Name,Data,News,Evaluation
Alphabet,02/12/2023,"Tesla, Amazon, and Alphabet Split Last Year. In 2023, These Are the ...",still open
Alphabet,02/12/2023,Is Alphabet (GOOG) Stock Recovering?,still open
Alphabet,02/12/2023,Alphabet's laid-off health tech employees on where their work heads ...,still open
Alphabet,02/12/2023,Why Is Alphabet Stock So Cheap?,still open
Alphabet,02/12/2023,"Amazon stock hit hardest after tech earnings bonanza, despite misses by Apple and Alphabet",still open
Alphabet,02/12/2023,"Alphabet makes cuts, Twitter bans third-party clients, and Netflix’s Reed Hastings steps down",still open
Alphabet,02/12/2023,Malaga Cove Capital LLC Increases Its Position in Alphabet Inc ...,still open
Alphabet,02/12/2023,Alphabet commences Canadian layoffs,still open
Alphabet,02/12/2023,Will Alphabet Stock Beat the Market in 2023?,still open
Alphabet,02/12/2023,"Why Amazon, Alphabet, and Atlassian Stocks All Traded Lower ...",still open
Alphabet,02/12/2023,"Amazon, Apple, Alphabet Headline Another Busy Earnings Week",still open
Alphabet,02/12/2023,"Stocks making the biggest moves premarket: Netflix, Alphabet, Nordstrom, PagerDuty and more",still open
Alphabet,02/12/2023,Accused killer of FDNY EMT Yadira Arroyo recited the alphabet after ...,still open
Alphabet,02/12/2023,Laid Off Googlers Got More Severance Than Workers At Alphabet's ...,still open
Alphabet,02/12/2023,"Spotify, Alphabet And Meta Lead Tech Stock Surge After Massive Layoff Announcements",still open
Alphabet,02/12/2023,"Stocks making the biggest moves midday: Sunrun, U.S. Bancorp, Alphabet, AT&T and more",still open
Alphabet,02/12/2023,World's Oldest Sentence Written In The First Alphabet Discovered,still open
Alphabet,02/12/2023,Alphabet Down 8.6% Despite Solid Earnings Growth,still open
Alphabet,02/12/2023,"Microsoft, Alphabet Cry Poor Right Before Making $32.8 Billion",still open
Alphabet,02/12/2023,Alphabet or Microsoft? Analysts predict which stock will come out on ...,still open
Alphabet,02/12/2023,Fujitsu re-org sparks alphabet soup splatter: GSBG splits into GTSBG and GBSBG,still open
Alphabet,02/12/2023,"Why Amazon, Alphabet, and Snowflake Stocks Fell Hard on ...",still open
Alphabet,02/12/2023,Why Amazon and Alphabet Are Still 2 of My Highest-Conviction ...,still open
Alphabet,02/12/2023,"Wall Street rallies to end higher on Alphabet, Netflix lift",still open
Alphabet,02/12/2023,Alphabet Job Cuts Eyed Despite Hiring Spree That Continued In 2022,still open
Alphabet,02/12/2023,Alphabet Earnings Preview: Buy GOOGL Stock While its Cheap?,still open
Alphabet,02/12/2023,Top Wall Street analysts like these stocks for maximum returns,still open
Alphabet,02/12/2023,Best Stock to Buy: Amazon Stock vs. Alphabet Stock,still open
Alphabet,02/12/2023,"ChatGPT goes pro, layoffs at Alphabet, and Dungeons & Dragons flirts with restrictive new licensing",still open
Alphabet,02/12/2023,Alphabet-owned AI firm DeepMind shutters office in Canada's ...,still open
Alphabet,02/12/2023,Google Calls In Larry Page and Sergey Brin to Tackle ChatGPT and A.I. Chatbots,still open
Alphabet,02/12/2023,Wedgewood Partners: “Alphabet (GOOG) is Capable of Generating Much Better Margins in the Future”,still open
Alphabet,02/12/2023,Drunken Hinckley driver doesn’t ‘do alphabet all of the time’: Broadview Heights Police Blotter,still open
Alphabet,02/12/2023,Elon Musk: Google’s Alphabet had ‘standing interest’ in buying Tesla,still open
Alphabet,02/12/2023,COINTELPRO is alive and well – Alphabet Boys Podcast,still open
Alphabet,02/12/2023,Alphabet Q4 earnings: has google's advertising revenue held up ...,still open
Alphabet,02/12/2023,Live news updates from January 20: Alphabet to cut 12000 jobs ...,still open
Alphabet,02/12/2023,"S&P 500, Dow score best day in 2 weeks, Nasdaq erases weekly loss as Netflix, Alphabet jump",still open
Alphabet,02/12/2023,Alphabet misses on earnings as YouTube shrinks; company will cut headcount growth by half in Q4,still open
Alphabet,02/12/2023,"Alphabet must cut headcount and trim costs, activist investor TCI says",still open
Alphabet,02/12/2023,Bilingual people who know a different alphabet have unique brains,still open
Alphabet,02/12/2023,This Ancient Inscription Is The Oldest Sentence in The World's First ...,still open
Alphabet,02/12/2023,Alpha. Bravo. Cyrillic.,still open
Alphabet,02/12/2023,"Alphabet Seeks To Identify 10,000 Poor-Performing Googlers As ...",still open
Alphabet,02/12/2023,Apple and Alphabet Implement Massive Share Buyback Programs,still open
Alphabet,02/12/2023,Alphabet misses on earnings and revenue for second quarter,still open
Alphabet,02/12/2023,An Intro to the Military Phonetic Alphabet,still open
Alphabet,02/12/2023,Why Alphabet Is Much More Than an Advertising Company,still open
Alphabet,02/12/2023,"Bill Gates Says ChatGPT As Big An Invention As The Internet - Microsoft (NASDAQ:MSFT), Alphabet (NASDAQ:G",still open
Alphabet,02/12/2023,Alphabet X graduates robotic agtech firm Mineral,still open
Alphabet,02/12/2023,Is This New AI Tool the End for Alphabet?,still open
Alphabet,02/12/2023,Alphabet's 'Other Bets' Come Under Pressure as Health Focus Grows,still open
Alphabet,02/12/2023,Alphabet Versus ChatGPT. Who Wins?,still open
Alphabet,02/12/2023,"Better Buy: Amazon, Microsoft, or Alphabet?",still open
Alphabet,02/12/2023,Google Stock: 4 Things That Smart Investors Should Know (NASDAQ:GOOG),still open
Alphabet,02/12/2023,Is It Time To Consider Buying Alphabet Inc. (NASDAQ:GOOGL)?,still open
Alphabet,02/12/2023,2 Reasons Why Alphabet Is a Screaming Buy Right Now,still open
Alphabet,02/12/2023,Alphabet stock dive on Bard snafu was overblown and don't dismiss Google AI,still open
Alphabet,02/12/2023,Alphabet shares dive after Google’s chatbot gives incorrect answer,still open
Alphabet,02/12/2023,Google Parent Alphabet Stock Falls For Second Day As Investors Weigh AI Competition,still open
Alphabet,02/12/2023,Why Alphabet Stock Is Falling Again Today,still open
Alphabet,02/12/2023,Buy the 'Bard Dip' in Alphabet Stock? Check the Chart First.,still open
Alphabet,02/12/2023,Alphabet shares fall 7% following Google's A.I. event,still open
Alphabet,02/12/2023,Why Alphabet Stock Is Selling Off: Is It Game Over for Google?,still open
Alphabet,02/12/2023,Alphabet's $100 Billion Stock Swoon Shows AI Stakes Are Rising,still open
Alphabet,02/12/2023,"Alphabet Inc Class A (GOOGL) Stock Has Fallen -9.02% This Week: Buy, Hold, or Sell?",still open
Alphabet,02/12/2023,Why Alphabet Stock Gained 12% in January,still open
Alphabet,02/12/2023,Why Alphabet Stock Dropped and Then Recovered Today,still open
Alphabet,02/12/2023,"Alphabet Inc Class C (GOOG) Stock Is Lower By -2.14% This Week: Buy, Hold, or Sell?",still open
Alphabet,02/12/2023,"Alphabet Inc. Cl A stock falls Friday, underperforms market",still open
Alphabet,02/12/2023,"Down 22%, Is Alphabet Stock a Buy in 2023?",still open
Alphabet,02/12/2023,"Dow closes nearly 250 points lower, Nasdaq sheds 1% as Alphabet shares slide: Live updates",still open
Alphabet,02/12/2023,Why Alphabet Stock Jumped Today,still open
Alphabet,02/12/2023,Why Alphabet Stock Pulled Back Today,still open
Alphabet,02/12/2023,Why Is Alphabet Stock So Cheap?,still open
Alphabet,02/12/2023,Will Alphabet Stock Beat the Market in 2023?,still open
Alphabet,02/12/2023,Is Alphabet (GOOG) Stock Recovering?,still open
Alphabet,02/12/2023,"Stocks making the biggest moves midday: CVS, Fortinet, Lumen Technologies, Alphabet & more",still open
Alphabet,02/12/2023,Better Big Tech Stock: Alphabet vs. Microsoft,still open
Alphabet,02/12/2023,Is Alphabet the Best FAANG Stock to Bet on This Decade?,still open
Alphabet,02/12/2023,Alphabet Stock Surged More Than 63% After Breaking Out In 2021 ...,still open
Alphabet,02/12/2023,Torray LLC Grows Stock Holdings in Alphabet Inc. (NASDAQ:GOOG),still open
Alphabet,02/12/2023,Alphabet Inc. (NASDAQ:GOOGL) Stock Holdings Raised by Hartford ...,still open
Alphabet,02/12/2023,Top Wall Street analysts like these stocks for maximum returns,still open
Alphabet,02/12/2023,"Stocks fall on Friday, but S&P 500 notches winning week as strong 2023 continues",still open
Alphabet,02/12/2023,"Stocks making the biggest moves midday: Netflix, Coinbase, Alphabet, SVB Financial & more",still open
Alphabet,02/12/2023,"Tesla, Amazon, and Alphabet Split Last Year. In 2023, These Are the ...",still open
Alphabet,02/12/2023,Alphabet Inc. Cl A stock underperforms Thursday when compared to ...,still open
Alphabet,02/12/2023,"The Best Stocks To Invest $5,000 in Right Now",still open
Alphabet,02/12/2023,Best Stock to Buy: Amazon Stock vs. Alphabet Stock,still open
Alphabet,02/12/2023,Big Tech Earnings Preview: Time to Buy Amazon or Alphabet Stock?,still open
Alphabet,02/12/2023,Better Buy: Tesla vs. Alphabet Stock,still open
Alphabet,02/12/2023,Northstar Group Inc. Boosts Stock Holdings in Alphabet Inc ...,still open
Alphabet,02/12/2023,"Amazon stock hit hardest after tech earnings bonanza, despite misses by Apple and Alphabet",still open
Alphabet,02/12/2023,Wedgewood Partners: “Alphabet (GOOG) is Capable of Generating Much Better Margins in the Future”,still open
Alphabet,02/12/2023,Alphabet Inc. Cl A stock outperforms competitors despite losses on the day,still open
Alphabet,02/12/2023,Alphabet Stock Rallies After Job Cuts. Here’s Where It Can Go Next.,still open
Alphabet,02/12/2023,"Alphabet Inc. Cl A stock rises Thursday, outperforms market",still open
Alphabet,02/12/2023,"US STOCKS-Wall Street rallies to end higher on Alphabet, Netflix lift",still open
Alphabet,02/12/2023,Alphabet or Microsoft? Analysts predict which stock will come out on ...,still open
Alphabet,02/12/2023,"If I Had $1,000 to Invest Between Alphabet (Google), Uber, and Meta ...",still open
Alphabet,02/12/2023,"Buy Boeing and Sell Alphabet Stock, Says Piper Sandler",still open
Alphabet,02/12/2023,Opinion: These Will Be the 3 Largest Stocks by 2030,still open
Alphabet,02/12/2023,Alphabet Inc. Cl A stock outperforms market on strong trading day,still open
Alphabet,02/12/2023,"Stocks making the biggest moves midday: Sunrun, U.S. Bancorp, Alphabet, AT&T and more",still open
Alphabet,02/12/2023,What to Know About Alphabet Stock for 2023,still open
Alphabet,02/12/2023,"Spotify, Alphabet And Meta Lead Tech Stock Surge After Massive Layoff Announcements",still open
Alphabet,02/12/2023,"Why Amazon, Alphabet, and Snowflake Stocks Fell Hard on ...",still open
Alphabet,02/12/2023,Google Stock: A Recipe For A Dynamite 2023 (NASDAQ:GOOGL),still open
Alphabet,02/12/2023,1 Growth Stock Down 32% to Buy Right Now,still open
Alphabet,02/12/2023,Why Amazon and Alphabet Are Still 2 of My Highest-Conviction ...,still open
Alphabet,02/12/2023,Here is What to Know Beyond Why Alphabet Inc. (GOOGL) is a ...,still open
Alphabet,02/12/2023,"Alphabet Inc. Cl A stock falls Tuesday, underperforms market",still open
Alphabet,02/12/2023,Top AI Stocks To Buy Now? 3 In Focus,still open
Alphabet,02/12/2023,Alphabet Job Cuts Eyed Despite Hiring Spree That Continued In 2022,still open
Alphabet,02/12/2023,Ann Mather Sells 340 Shares of Alphabet Inc. (NASDAQ:GOOGL ...,still open
Alphabet,02/12/2023,2 FAANG Stocks to Buy in 2023 and 1 to Avoid: Here's Why,still open
Alphabet,02/12/2023,2 Stock-Split Stocks the Smartest Investors Are Buying Hand Over ...,still open
Alphabet,02/12/2023,Alphabet Down 8.6% Despite Solid Earnings Growth,still open
Alphabet,02/12/2023,Chemung Canal Trust Co. Increases Stock Holdings in Alphabet Inc ...,still open
Alphabet,02/12/2023,10 Set-It-and-Forget-It Stocks to Buy According to Financial Media,still open
Alphabet,02/12/2023,Two “Strong Buy” Tech Stocks with Over 30% Upside,still open
Alphabet,02/12/2023,"Google Parent Alphabet to Cut 12,000 Jobs",still open
Alphabet,02/12/2023,"Microsoft, Alphabet Cry Poor Right Before Making $32.8 Billion",still open
Alphabet,02/12/2023,"S&P 500, Dow score best day in 2 weeks, Nasdaq erases weekly loss as Netflix, Alphabet jump",still open
Alphabet,02/12/2023,2 Growth Stocks Down More Than 30% to Buy Right Now,still open
Alphabet,02/12/2023,Top Wall Street analysts like these stocks amid easing inflation,still open
Alphabet,02/12/2023,Here's How Much You Would Have Made Owning Alphabet Stock In The Last 15 Years,still open
Alphabet,02/12/2023,Recent Layoffs Don't Change the Story for GOOG Stock,still open
Alphabet,02/12/2023,Google Stock: When Will Pichai Drop The Axe? (NASDAQ:GOOG),still open
Alphabet,02/12/2023,"Google asked Larry Page, Sergey Brin for help after ChatGPT 'code red'",still open
Alphabet,02/12/2023,Why Alphabet Stock Crashed Wednesday Morning,still open
Alphabet,02/12/2023,Why Alphabet Stock Is a Buy Despite YouTube's Revenue Drop,still open
Alphabet,02/12/2023,Alphabet Stock Is a Buy and It's All Thanks to Google Cloud,still open
Alphabet,02/12/2023,Why Alphabet Stock Was Sliding Today,still open
Alphabet,02/12/2023,Is Alphabet the Top Tech Stock to Buy In 2023?,still open
Alphabet,02/12/2023,10 Reasons to Buy Alphabet Stock Now,still open
Alphabet,02/12/2023,Alphabet Stock: Bull vs. Bear,still open
Alphabet,02/12/2023,"After Falling 39% in 2022, Is Alphabet Stock a Buy in 2023?",still open
Alphabet,02/12/2023,3 Reasons to Buy Alphabet Stock After Its Latest Price Drop,still open
Alphabet,02/12/2023,Will Alphabet Stock Bounce Back in 2023?,still open
Alphabet,02/12/2023,"Down 36% From Its High, Is Alphabet Stock a Screaming Buy Right ...",still open
Alphabet,02/12/2023,Is Alphabet Stock A Buy Now?,still open
Alphabet,02/12/2023,Why Alphabet Stock (NASDAQ:GOOGL) is Cheap Despite Slowing ...,still open
Alphabet,02/12/2023,"Down 41%, Alphabet Stock Is a Once-in-a-Decade Buying ...",still open
Alphabet,02/12/2023,Is Now the Right Time to Buy Alphabet Stock?,still open
Alphabet,02/12/2023,Alphabet Stock Can Double Your Money in 5 Years. Here's How.,still open
Alphabet,02/12/2023,Alphabet Stock Splits Next Week: Should Investors Buy Now?,still open
Alphabet,02/13/2023,"Amazon, Alphabet Antitrust Push Seen Unlocking Value in Shares",still open
Alphabet,02/13/2023,"Better Buy: Amazon, Microsoft, or Alphabet?",still open
Alphabet,02/13/2023,Alphabet Versus ChatGPT. Who Wins?,still open
Alphabet,02/13/2023,Alphabet vs. Microsoft: Who Will Win the AI Race?,still open
Alphabet,02/13/2023,"Google Bard factual snafu sees Alphabet Inc. losing US$100 billion in market value, employees mock CEO Pichai for ...",still open
Alphabet,02/13/2023,Why Alphabet Stock Is a No-Brainer Buy After This Week's Sell-off,still open
Alphabet,02/13/2023,Market Concerns Impacted Alphabet (GOOG)’s Performance in Q4,still open
Alphabet,02/13/2023,Here's how Microsoft and Alphabet compare in the A.I. war,still open
Alphabet,02/13/2023,Alphabet's $100 Billion Mistake Is Your Opportunity of a Lifetime,still open
Alphabet,02/13/2023,Google Parent Alphabet Drags Communications Stocks Lower,still open
Alphabet,02/13/2023,1 Thing the Smartest Investors Know About Alphabet,still open
Alphabet,02/13/2023,"Bill Gates Says ChatGPT As Big An Invention As The Internet - Microsoft (NASDAQ:MSFT), Alphabet (NASDAQ:G",still open
Alphabet,02/13/2023,"Amazon, Alphabet Antitrust Push Seen Unlocking Value in Shares",still open
Alphabet,02/13/2023,Apple vs. Alphabet vs. Meta: Which Tech Stock Is The Best Value?,still open
Alphabet,02/13/2023,Is Alphabet Inc Class A (GOOGL) a Loser in the Communication Services Sector?,still open
Alphabet,02/13/2023,Alphabet vs Microsoft: AI kicks off a new battle over search,still open
Alphabet,02/13/2023,1ST Source Bank Boosts Stake in Alphabet Inc. (NASDAQ:GOOGL),still open
Alphabet,02/13/2023,Fear of complacency costs Alphabet $150 billion,still open
Alphabet,02/13/2023,"Alphabet Stock Lost 10% In One Week, What's Next?",still open
Alphabet,02/13/2023,"Alphabet, Activision Blizzard, Oak Street Health And This Australian Company On CNBC’s ‘Final Trades’ - A",still open
Alphabet,02/13/2023,2 Reasons Why Alphabet Is a Screaming Buy Right Now,still open
Alphabet,02/13/2023,Alphabet misses on earnings and revenue as YouTube falls short,still open
Alphabet,02/13/2023,"Amazon, Alphabet Antitrust Push Seen Unlocking Value: Tech Watch",still open
Alphabet,02/13/2023,See Which Of The Latest 13F Filers Holds Alphabet,still open
Alphabet,02/13/2023,"Alphabet cuts 12000 jobs after pandemic hiring spree, refocuses on AI",still open
Alphabet,02/13/2023,"Google Parent Alphabet to Cut 12,000 Jobs",still open
Alphabet,02/13/2023,Better Buy: Meta Platforms vs. Alphabet,still open
Alphabet,02/13/2023,"Alphabet Inc. Cl A stock falls Friday, underperforms market",still open
Alphabet,02/13/2023,"Alphabet (GOOGL), Amazon (AMZN), Apple (AAPL) Earnings: What ...",still open
Alphabet,02/13/2023,Wall Street's top Thursday analyst calls include Tesla & Alphabet,still open
Alphabet,02/13/2023,"A $100 Investment In Bitcoin, Dogecoin, Alphabet, Apple, Microsoft, Amazon And Tesla 5 Years Ago Would Yi",still open
Alphabet,02/13/2023,Why Alphabet Stock Gained 12% in January,still open
Alphabet,02/13/2023,Alphabet’s Layoffs Aren’t Very Googley,still open
Alphabet,02/13/2023,Lower administrative court's decision on redemption of a class of ...,still open
Alphabet,02/13/2023,"Wall St falls after recent strong gains, Alphabet shares sink",still open
Alphabet,02/13/2023,'I want to use all 26 letters of the alphabet when I name my kids - it's so special',still open
Alphabet,02/13/2023,"Alphabet, Microsoft, and Meta look to prioritize AI amid layoffs",still open
Alphabet,02/13/2023,Eating My Way Through the Alphabet: Big Kahuna Hawaiian BBQ ...,still open
Alphabet,02/13/2023,What's A Prudent Way To Handle Long-Dated Google Call Options? - Alphabet (NASDAQ:GOOGL),still open
Alphabet,02/13/2023,Alphabet's Falling Ad Revenue Could Overshadow Cloud Growth,still open
Alphabet,02/13/2023,"Stocks making the biggest moves midday: CVS, Fortinet, Lumen Technologies, Alphabet & more",still open
Alphabet,02/13/2023,Google's Parent Alphabet to Spend $500M Cutting Office Space ...,still open
Alphabet,02/13/2023,Earnings playbook: Apple and Google-parent Alphabet lead the ...,still open
Alphabet,02/13/2023,Why Alphabet Stock Pulled Back Today,still open
Alphabet,02/13/2023,Why has Alphabet hit the panic button? Only Google can answer that question,still open
Alphabet,02/13/2023,"Meta, Alphabet Target Middle Managers With Tech Jobs Cuts",still open
Alphabet,02/13/2023,Apple (AAPL) and Alphabet (GOOGL) earnings: Tech fund manager ...,still open
Alphabet,02/13/2023,Better Buy: Disney vs. Alphabet,still open
Alphabet,02/13/2023,Alphabet commences Canadian layoffs,still open
Alphabet,02/13/2023,"Down 22%, Is Alphabet Stock a Buy in 2023?",still open
Alphabet,02/13/2023,1 Stock I Own and Will Buy More of No Matter What Happens With ...,still open
Alphabet,02/13/2023,Is Alphabet (GOOG) Stock Recovering?,still open
Alphabet,02/13/2023,Why Is Alphabet Stock So Cheap?,still open
Alphabet,02/13/2023,Alphabet has a data quality advantage in AI - share price decline ...,still open
Alphabet,02/13/2023,Alphabet's laid-off health tech employees on where their work heads ...,still open
Alphabet,02/13/2023,"Alphabet makes cuts, Twitter bans third-party clients, and Netflix’s Reed Hastings steps down",still open
Alphabet,02/13/2023,"Tesla, Amazon, and Alphabet Split Last Year. In 2023, These Are the ...",still open
Alphabet,02/13/2023,"Amazon stock hit hardest after tech earnings bonanza, despite misses by Apple and Alphabet",still open
Alphabet,02/13/2023,Google Parent Alphabet Posts Drop in Ad Revenue Amid Slowdown,still open
Alphabet,02/13/2023,"Amazon, Meta, Alphabet Face Proxy Proposals on Human Rights (1)",still open
Alphabet,02/13/2023,3 Things About Alphabet That Smart Investors Know,still open
Alphabet,02/13/2023,Nasdaq Bear Market: 3 Reasons to Buy Alphabet in 2023,still open
Alphabet,02/13/2023,Are More Layoffs Coming to Alphabet?,still open
Alphabet,02/13/2023,"Stocks making the biggest moves premarket: Netflix, Alphabet, Nordstrom, PagerDuty and more",still open
Alphabet,02/13/2023,"Stocks making the biggest moves midday: Sunrun, U.S. Bancorp, Alphabet, AT&T and more",still open
Alphabet,02/13/2023,"Why Amazon, Alphabet, and Atlassian Stocks All Traded Lower ...",still open
Alphabet,02/13/2023,"Amazon, Apple, Alphabet Headline Another Busy Earnings Week",still open
Alphabet,02/13/2023,"Spotify, Alphabet And Meta Lead Tech Stock Surge After Massive Layoff Announcements",still open
Alphabet,02/13/2023,World's Oldest Sentence Written In The First Alphabet Discovered,still open
Alphabet,02/13/2023,Alphabet Down 8.6% Despite Solid Earnings Growth,still open
Alphabet,02/13/2023,"Microsoft, Alphabet Cry Poor Right Before Making $32.8 Billion",still open
Alphabet,02/13/2023,"Alphabet remains 'fabric of the internet' and will do great long, says ...",still open
Alphabet,02/13/2023,Is Alphabet Stock a Buy Despite Earnings Miss? Chart Holds a Clue,still open
Alphabet,02/13/2023,"Apple, Alphabet, Amazon.com earnings: 3 things to watch",still open
Alphabet,02/13/2023,Alphabet or Microsoft? Analysts predict which stock will come out on ...,still open
Alphabet,02/13/2023,"Why Amazon, Alphabet, and Snowflake Stocks Fell Hard on ...",still open
Alphabet,02/13/2023,"Wall Street rallies to end higher on Alphabet, Netflix lift",still open
Alphabet,02/13/2023,Fujitsu re-org sparks alphabet soup splatter: GSBG splits into GTSBG and GBSBG,still open
Alphabet,02/13/2023,Alphabet Rockers Bring All The Joy To The City National Bank First ...,still open
Alphabet,02/13/2023,Alphabet Job Cuts Eyed Despite Hiring Spree That Continued In 2022,still open
Alphabet,02/13/2023,Top Wall Street analysts like these stocks for maximum returns,still open
Alphabet,02/13/2023,Big tech is crowing about A.I. as it lays off tens of thousands of workers,still open
Alphabet,02/13/2023,Accused killer of FDNY EMT Yadira Arroyo recited the alphabet after ...,still open
Alphabet,02/13/2023,Best Stock to Buy: Amazon Stock vs. Alphabet Stock,still open
Alphabet,02/13/2023,"Neftlix, Alphabet rise; Lilly, Concentrix fall",still open
Alphabet,02/13/2023,"ChatGPT goes pro, layoffs at Alphabet, and Dungeons & Dragons flirts with restrictive new licensing",still open
Alphabet,02/13/2023,Alphabet-owned AI firm DeepMind shutters office in Canada's ...,still open
Alphabet,02/13/2023,Google Calls In Larry Page and Sergey Brin to Tackle ChatGPT and A.I. Chatbots,still open
Alphabet,02/13/2023,Wedgewood Partners: “Alphabet (GOOG) is Capable of Generating Much Better Margins in the Future”,still open
Alphabet,02/13/2023,Morgan Stanley analyst says buy Alphabet and Amazon but warns ...,still open
Alphabet,02/13/2023,Elon Musk: Google’s Alphabet had ‘standing interest’ in buying Tesla,still open
Alphabet,02/13/2023,COINTELPRO is alive and well – Alphabet Boys Podcast,still open
Alphabet,02/13/2023,"Indonesia Asks Facebook, Google To Share Revenue With Media - Alphabet (NASDAQ:GOOG), Alphabet (NASDAQ:GO",still open
Alphabet,02/13/2023,Kenichi Kuromaru on finding unique expression in optical illusions ...,still open
Alphabet,02/13/2023,Live news updates from January 20: Alphabet to cut 12000 jobs ...,still open
Alphabet,02/13/2023,"S&P 500, Dow score best day in 2 weeks, Nasdaq erases weekly loss as Netflix, Alphabet jump",still open
Alphabet,02/13/2023,Top Wall Street analysts like these stocks amid easing inflation,still open
Alphabet,02/13/2023,Alphabet misses on earnings as YouTube shrinks; company will cut headcount growth by half in Q4,still open
Alphabet,02/13/2023,"Alphabet must cut headcount and trim costs, activist investor TCI says",still open
Alphabet,02/13/2023,"Better Buy: Amazon, Microsoft, or Alphabet?",still open
Alphabet,02/13/2023,Alphabet Versus ChatGPT. Who Wins?,still open
Alphabet,02/13/2023,Google Stock: 4 Things That Smart Investors Should Know (NASDAQ:GOOG),still open
Alphabet,02/13/2023,Why Alphabet Stock Is a No-Brainer Buy After This Week's Sell-off,still open
Alphabet,02/13/2023,Google: Don't Fear AI Future (NASDAQ:GOOG),still open
Alphabet,02/13/2023,Best AI Stock to Buy: Alphabet Stock or Microsoft Stock,still open
Alphabet,02/13/2023,Market Concerns Impacted Alphabet (GOOG)’s Performance in Q4,still open
Alphabet,02/13/2023,Apple vs. Alphabet vs. Meta: Which Tech Stock Is The Best Value?,still open
Alphabet,02/13/2023,"Amazon, Alphabet Antitrust Push Seen Unlocking Value in Shares",still open
Alphabet,02/13/2023,Has Google Already Lost The ChatGPT War? (NASDAQ:GOOG),still open
Alphabet,02/13/2023,Why Alphabet Stock Is Falling Again Today,still open
Alphabet,02/13/2023,Alphabet vs Microsoft: AI kicks off a new battle over search,still open
Alphabet,02/13/2023,Buy the 'Bard Dip' in Alphabet Stock? Check the Chart First.,still open
Alphabet,02/13/2023,Why Alphabet Stock Is Selling Off: Is It Game Over for Google?,still open
Alphabet,02/13/2023,Alphabet's $100 Billion Stock Swoon Shows AI Stakes Are Rising,still open
Alphabet,02/13/2023,"Alphabet Stock Lost 10% In One Week, What's Next?",still open
Alphabet,02/13/2023,Is Alphabet Inc Class A (GOOGL) a Loser in the Communication Services Sector?,still open
Alphabet,02/13/2023,2 Reasons Why Alphabet Is a Screaming Buy Right Now,still open
Alphabet,02/13/2023,Why Alphabet Stock Gained 12% in January,still open
Alphabet,02/13/2023,Why Alphabet Stock Dropped and Then Recovered Today,still open
Alphabet,02/13/2023,1ST Source Bank Boosts Stake in Alphabet Inc. (NASDAQ:GOOGL),still open
Alphabet,02/13/2023,"Amazon, Alphabet Antitrust Push Seen Unlocking Value in Shares",still open
Alphabet,02/13/2023,"Alphabet Inc Class C (GOOG) Stock Is Lower By -2.14% This Week: Buy, Hold, or Sell?",still open
