Name,Data,News,Evaluation
Alphabet,02/07/2023,"How Microsoft, Google are taking on ChatGPT, what it means for the stocks",still open
Alphabet,02/07/2023,3 Cheap Stocks to Buy Right Now,still open
Alphabet,02/07/2023,"Google suffered 'pullback' in ad spending over holidays, Alphabet stock falls after earnings",still open
Alphabet,02/07/2023,Why Alphabet Stock Was a Dog on Monday,still open
Alphabet,02/07/2023,Is Alphabet Inc Class C (GOOG) Stock Over or Undervalued?,still open
Alphabet,02/07/2023,Is Alphabet Stock a Buy Despite Earnings Miss? Chart Holds a Clue,still open
Alphabet,02/07/2023,Torray LLC Grows Stock Holdings in Alphabet Inc. (NASDAQ:GOOG),still open
Alphabet,02/07/2023,Why Alphabet Stock Dropped and Then Recovered Today,still open
Alphabet,02/07/2023,Alphabet Inc. (NASDAQ:GOOGL) Shares Acquired by Atwater Malick ...,still open
Alphabet,02/07/2023,Best Stock to Buy: Alphabet Stock vs. The Trade Desk Stock,still open
Alphabet,02/07/2023,Why Alphabet Stock Gained 12% in January,still open
Alphabet,02/07/2023,Alphabet Inc. Cl A stock underperforms Monday when compared to competitors,still open
Alphabet,02/07/2023,Why Alphabet Stock Pulled Back Today,still open
Alphabet,02/07/2023,Alphabet Inc. Cl A stock outperforms market on strong trading day,still open
Alphabet,02/07/2023,Why Alphabet Stock Jumped Today,still open
Alphabet,02/07/2023,Is Alphabet (GOOG) Stock Recovering?,still open
Alphabet,02/07/2023,"Stocks fall on Friday, but S&P 500 notches winning week as strong 2023 continues",still open
Alphabet,02/07/2023,Google Stock: Remains A Good Long-Term Investment Opportunity,still open
Alphabet,02/07/2023,Will Alphabet Stock Beat the Market in 2023?,still open
Alphabet,02/07/2023,Why Is Alphabet Stock So Cheap?,still open
Alphabet,02/07/2023,Investors Heavily Search Alphabet Inc. (GOOGL): Here is What You ...,still open
Alphabet,02/07/2023,"Why Alphabet Shares Are Rising - Alphabet (NASDAQ:GOOG), Alphabet (NASDAQ:GOOGL)",still open
Alphabet,02/07/2023,Alphabet Stock Surged More Than 63% After Breaking Out In 2021 ...,still open
Alphabet,02/07/2023,"After Falling 39% in 2022, Is Alphabet Stock a Buy in 2023?",still open
Alphabet,02/07/2023,Top Wall Street analysts like these stocks for maximum returns,still open
Alphabet,02/07/2023,Is Alphabet the Best FAANG Stock to Bet on This Decade?,still open
Alphabet,02/07/2023,"Amazon stock hit hardest after tech earnings bonanza, despite misses by Apple and Alphabet",still open
Alphabet,02/07/2023,Big Tech Earnings Preview: Time to Buy Amazon or Alphabet Stock?,still open
Alphabet,02/07/2023,Best Stock to Buy: Amazon Stock vs. Alphabet Stock,still open
Alphabet,02/07/2023,Better Buy: Tesla vs. Alphabet Stock,still open
Alphabet,02/07/2023,"Alphabet Inc. Cl A stock falls Thursday, underperforms market",still open
Alphabet,02/07/2023,"Alphabet Inc. Cl A stock rises Thursday, outperforms market",still open
Alphabet,02/07/2023,"Stocks making the biggest moves midday: Netflix, Coinbase, Alphabet, SVB Financial & more",still open
Alphabet,02/07/2023,Where's All That Bad Earnings News That Stock Investors Were ...,still open
Alphabet,02/07/2023,"5 stocks to watch on Thursday: Alphabet, Taiwan Semiconductor ...",still open
Alphabet,02/07/2023,"Buy Boeing and Sell Alphabet Stock, Says Piper Sandler",still open
Alphabet,02/07/2023,Alphabet Inc. Cl A stock underperforms Tuesday when compared to competitors,still open
Alphabet,02/07/2023,Google Stock: A Recipe For A Dynamite 2023 (NASDAQ:GOOGL),still open
Alphabet,02/07/2023,Alphabet Stock Rallies After Job Cuts. Here’s Where It Can Go Next.,still open
Alphabet,02/07/2023,"Stock Market Today: Netflix, Alphabet Lead Rally in Tech Stocks",still open
Alphabet,02/07/2023,Why Amazon and Alphabet Are Still 2 of My Highest-Conviction ...,still open
Alphabet,02/07/2023,"Big Tech earnings preview: Apple, Amazon and Alphabet",still open
Alphabet,02/07/2023,Northstar Group Inc. Boosts Stock Holdings in Alphabet Inc ...,still open
Alphabet,02/07/2023,Why Alphabet Rose Today,still open
Alphabet,02/07/2023,"Why Amazon, Alphabet, and Snowflake Stocks Fell Hard on ...",still open
Alphabet,02/07/2023,"Stocks making the biggest moves midday: Sunrun, U.S. Bancorp, Alphabet, AT&T and more",still open
Alphabet,02/07/2023,Fortem Financial Group LLC Boosts Holdings in Alphabet Inc ...,still open
Alphabet,02/07/2023,Is Trending Stock Alphabet Inc. (GOOG) a Buy Now?,still open
Alphabet,02/07/2023,"Spotify, Alphabet And Meta Lead Tech Stock Surge After Massive Layoff Announcements",still open
Alphabet,02/07/2023,"Alphabet Inc. Cl A stock rises Monday, outperforms market",still open
Alphabet,02/07/2023,"Alphabet Inc. Cl A stock falls Tuesday, underperforms market",still open
Alphabet,02/07/2023,How to Buy Alphabet (Google) Shares UK for Beginners [cur_year],still open
Alphabet,02/07/2023,Earnings Preview: Alphabet Inc. (GOOG) Q4 Earnings Expected to ...,still open
Alphabet,02/07/2023,2 FAANG Stocks to Buy in 2023 and 1 to Avoid: Here's Why,still open
Alphabet,02/07/2023,Top Wall Street analysts like these stocks amid easing inflation,still open
Alphabet,02/07/2023,"If You Like Amazon, Microsoft, and Alphabet, Consider Buying This ...",still open
Alphabet,02/07/2023,Ann Mather Sells 340 Shares of Alphabet Inc. (NASDAQ:GOOGL ...,still open
Alphabet,02/07/2023,Alphabet (GOOGL) to Boost YouTube TV With Redesigned Features,still open
Alphabet,02/07/2023,1 Growth Stock Down 32% to Buy Right Now,still open
Alphabet,02/07/2023,Alphabet Inc. (GOOGL) is Attracting Investor Attention: Here is What ...,still open
Alphabet,02/07/2023,Here is What to Know Beyond Why Alphabet Inc. (GOOGL) is a ...,still open
Alphabet,02/07/2023,Alphabet Job Cuts Eyed Despite Hiring Spree That Continued In 2022,still open
Alphabet,02/07/2023,"Meta, Alphabet Target Middle Managers With Tech Jobs Cuts",still open
Alphabet,02/07/2023,Recent Layoffs Don't Change the Story for GOOG Stock,still open
Alphabet,02/07/2023,What to Know About Alphabet Stock for 2023,still open
Alphabet,02/07/2023,"Alphabet (Google) Stock Surges, Showing More Strength Than ...",still open
Alphabet,02/07/2023,ChatGPT mania pumps up Chinese AI technology stocks,still open
Alphabet,02/07/2023,Why C3.ai Stock Popped Again Today,still open
Alphabet,02/07/2023,2 Top Growth Stocks I'm Buying Hand Over Fist These Days,still open
Alphabet,02/07/2023,2 Stock-Split Stocks to Buy Hand Over Fist in 2023 and 1 to Avoid ...,still open
Alphabet,02/07/2023,"The FAANMGs: Google Is A Buy, Netflix Is A Goodbye (GOOG)",still open
Alphabet,02/07/2023,Alphabet (GOOGL) Joins Pivot to Aid Adoption of Nest Devices,still open
Alphabet,02/07/2023,Here's How Much You Would Have Made Owning Alphabet Stock In The Last 15 Years,still open
Alphabet,02/07/2023,This House of Representative Just Sold Up To $3.00M In Alphabet Stock - Alphabet (NASDAQ:GOOGL),still open
Alphabet,02/07/2023,Alphabet's Google Cloud Platform revenue expectations lowered by ...,still open
Alphabet,02/07/2023,Bridgeworth LLC Acquires 6387 Shares of Alphabet Inc. (NASDAQ ...,still open
Alphabet,02/07/2023,"Alphabet Inc. Bottom Line Declines In Q4, misses estimates",still open
Alphabet,02/07/2023,MSFT Stock: How Big Artificial Intelligence Investment Could ...,still open
Alphabet,02/07/2023,3 Stocks I Will 'Never' Sell,still open
Alphabet,02/07/2023,Alphabet to cut staff of health sciences unit Verily by 15%,still open
Alphabet,02/07/2023,Why Alphabet Stock Crashed Wednesday Morning,still open
Alphabet,02/07/2023,Why Alphabet Stock Is a Buy Despite YouTube's Revenue Drop,still open
Alphabet,02/07/2023,Alphabet Stock Is a Buy and It's All Thanks to Google Cloud,still open
Alphabet,02/07/2023,Why Alphabet Stock Was Sliding Today,still open
Alphabet,02/07/2023,Is Alphabet the Top Tech Stock to Buy In 2023?,still open
Alphabet,02/07/2023,Alphabet Stock: Bull vs. Bear,still open
Alphabet,02/07/2023,10 Reasons to Buy Alphabet Stock Now,still open
Alphabet,02/07/2023,3 Reasons to Buy Alphabet Stock After Its Latest Price Drop,still open
Alphabet,02/07/2023,Will Alphabet Stock Bounce Back in 2023?,still open
Alphabet,02/07/2023,"Down 36% From Its High, Is Alphabet Stock a Screaming Buy Right ...",still open
Alphabet,02/08/2023,Alphabet shares slip 8% following Google's A.I. event,still open
Alphabet,02/08/2023,Alphabet Stock Loses $100 Billion After New AI Chatbot Gives Wrong Answer In Ad,still open
Alphabet,02/08/2023,Why Alphabet Stock Was Gaining Today,still open
Alphabet,02/08/2023,Alphabet will enlist ‘every Googler’ to test its ChatGPT competitor as search engines around the world go all-out on A.I.,still open
Alphabet,02/08/2023,"Google rolls out Bard, its answer to ChatGPT",still open
Alphabet,02/08/2023,ChatGPT rival Bard and Microsoft event swing Alphabet stock price,still open
Alphabet,02/08/2023,Google enlisting staff to test ChatGPT rival Bard: report,still open
Alphabet,02/08/2023,Alphabet and Microsoft Push New AI Features,still open
Alphabet,02/08/2023,"This Company Is Beating Google to Chat-Based Search, and It's Not Microsoft",still open
Alphabet,02/08/2023,Google's Parent Alphabet to Spend $500M Cutting Office Space This Quarter – Commercial Observer,still open
Alphabet,02/08/2023,"Meta, Alphabet Target Middle Managers With Tech Jobs Cuts",still open
Alphabet,02/08/2023,Better Buy: Meta Platforms vs. Alphabet,still open
Alphabet,02/08/2023,12 Symbols From Our Alphabet No Longer Used Today,still open
Alphabet,02/08/2023,Top AI Stock: Microsoft vs. Alphabet -- the Battle for the Best Search ...,still open
Alphabet,02/08/2023,Alphabet Falls Most in Three Months on Bard Accuracy Concerns,still open
Alphabet,02/08/2023,"Tesla, Amazon, and Alphabet Split Last Year. In 2023, These Are the ...",still open
Alphabet,02/08/2023,Alphabet Reports Slowest Growth in Years!,still open
Alphabet,02/08/2023,"Alphabet Inc Class C (GOOG) Stock Is Lower By -2.14% This Week: Buy, Hold, or Sell?",still open
Alphabet,02/08/2023,Tranquilli Financial Advisor LLC Has $414000 Stock Position in ...,still open
Alphabet,02/08/2023,"Alphabet Down Over 6%, on Pace for Largest Percent Decrease Since October 2022 -- Data Talk",still open
Alphabet,02/08/2023,Alphabet VC arm GV invests $28.1M in mental health startup Firsthand,still open
Alphabet,02/08/2023,"Meta, Alphabet target middle managers with tech jobs cuts",still open
Alphabet,02/08/2023,Is Alphabet (GOOG) an Attractive Investment for the Long-Term?,still open
Alphabet,02/08/2023,"Alphabet (GOOGL), Amazon (AMZN), Apple (AAPL) Earnings: What ...",still open
Alphabet,02/08/2023,Alphabet's Google to Use Artificial Intelligence to Summarize Web Information,still open
Alphabet,02/08/2023,"Alphabet, Capri Holdings, Paycom Software And Other Big Stocks Moving Lower On Wednesday - Bed Bath & Bey",still open
Alphabet,02/08/2023,Why Alphabet Stock Gained 12% in January,still open
Alphabet,02/08/2023,"Alphabet Google Is Better Prepared Than Rivals to Lead AI Race, BofA Says",still open
Alphabet,02/08/2023,Best Stock to Buy: Alphabet Stock vs. The Trade Desk Stock,still open
Alphabet,02/08/2023,Factual Error of Google’s AI Chatbot Bard Tanks Alphabet Stock Price,still open
Alphabet,02/08/2023,"Google Parent Alphabet to Cut 12,000 Jobs",still open
Alphabet,02/08/2023,Alphabet commences Canadian layoffs,still open
Alphabet,02/08/2023,"Alphabet cuts 12000 jobs after pandemic hiring spree, refocuses on AI",still open
Alphabet,02/08/2023,"Alphabet Inc. Cl A stock rises Tuesday, outperforms market",still open
Alphabet,02/08/2023,"Loop Capital Raises Alphabet's Price Target to $125 From $120, Maintains Buy Rating",still open
Alphabet,02/08/2023,Alphabet’s Layoffs Aren’t Very Googley,still open
Alphabet,02/08/2023,"Mixed fortunes as Meta, Shell and Alphabet post Q4 results",still open
Alphabet,02/08/2023,Drunken Hinckley driver doesn’t ‘do alphabet all of the time’: Broadview Heights Police Blotter,still open
Alphabet,02/08/2023,Investors Heavily Search Alphabet Inc. (GOOGL): Here is What You ...,still open
Alphabet,02/08/2023,Torray LLC Grows Stock Holdings in Alphabet Inc. (NASDAQ:GOOG),still open
Alphabet,02/08/2023,Toast Forms Partnership With Alphabet's Google to Launch New Food Ordering Channel,still open
Alphabet,02/08/2023,"Big Tech earnings preview: Apple, Amazon and Alphabet",still open
Alphabet,02/08/2023,Alphabet Inc. Cl A stock underperforms Monday when compared to competitors,still open
Alphabet,02/08/2023,Better Buy: Disney vs. Alphabet,still open
Alphabet,02/08/2023,Why has Alphabet hit the panic button? Only Google can answer that question,still open
Alphabet,02/08/2023,PM Modi Praises Artist For Creating Fun Kannada Alphabet Chart,still open
Alphabet,02/08/2023,"Amazon stock hit hardest after tech earnings bonanza, despite misses by Apple and Alphabet",still open
Alphabet,02/08/2023,Why Alphabet Stock Pulled Back Today,still open
Alphabet,02/08/2023,Atlantic Equities on Alphabet (GOOGL) Following Microsoft (MSFT ...,still open
Alphabet,02/08/2023,Alphabet's laid-off health tech employees on where their work heads ...,still open
Alphabet,02/08/2023,Is Alphabet (GOOG) Stock Recovering?,still open
Alphabet,02/08/2023,Top Wall Street analysts like these stocks for maximum returns,still open
Alphabet,02/08/2023,"Alphabet makes cuts, Twitter bans third-party clients, and Netflix’s Reed Hastings steps down",still open
Alphabet,02/08/2023,"Amazon, Meta, Alphabet Face Proxy Proposals on Human Rights (1)",still open
Alphabet,02/08/2023,Fujitsu re-org sparks alphabet soup splatter: GSBG splits into GTSBG and GBSBG,still open
Alphabet,02/08/2023,Are More Layoffs Coming to Alphabet?,still open
Alphabet,02/08/2023,Why Is Alphabet Stock So Cheap?,still open
Alphabet,02/08/2023,Nasdaq Bear Market: 3 Reasons to Buy Alphabet in 2023,still open
Alphabet,02/08/2023,"Why Amazon, Alphabet, and Atlassian Stocks All Traded Lower ...",still open
Alphabet,02/08/2023,Big Tech Earnings Preview: Time to Buy Amazon or Alphabet Stock?,still open
Alphabet,02/08/2023,World's Oldest Sentence Written In The First Alphabet Discovered,still open
Alphabet,02/08/2023,"Apple, Alphabet, Amazon.com earnings: 3 things to watch",still open
Alphabet,02/08/2023,3 Things About Alphabet That Smart Investors Know,still open
Alphabet,02/08/2023,"Viral Trick To Pinch Photos And Drop Them Between Apple Devices - Alphabet (NASDAQ:GOOG), Alphabet (NASDA",still open
Alphabet,02/08/2023,"Stocks making the biggest moves premarket: Netflix, Alphabet, Nordstrom, PagerDuty and more",still open
Alphabet,02/08/2023,"Stocks making the biggest moves midday: Sunrun, U.S. Bancorp, Alphabet, AT&T and more",still open
Alphabet,02/08/2023,Apple Is Far Better Positioned Than Amazon or Alphabet: Here's the ...,still open
Alphabet,02/08/2023,"After Falling 39% in 2022, Is Alphabet Stock a Buy in 2023?",still open
Alphabet,02/08/2023,"Meta, Amazon, Alphabet, Apple earnings: Big tech's bad year is over.",still open
Alphabet,02/08/2023,Is Alphabet the Best FAANG Stock to Bet on This Decade?,still open
Alphabet,02/08/2023,Why Amazon and Alphabet Are Still 2 of My Highest-Conviction ...,still open
Alphabet,02/08/2023,"Why Amazon, Alphabet, and Snowflake Stocks Fell Hard on ...",still open
Alphabet,02/08/2023,"Microsoft, Alphabet Cry Poor Right Before Making $32.8 Billion",still open
Alphabet,02/08/2023,"Spotify, Alphabet And Meta Lead Tech Stock Surge After Massive Layoff Announcements",still open
Alphabet,02/08/2023,Alphabet X graduates robotic agtech firm Mineral,still open
Alphabet,02/08/2023,"Wall Street rallies to end higher on Alphabet, Netflix lift",still open
Alphabet,02/08/2023,"Tesla, Amazon, Apple, Alphabet, Gaucho Group: Why These Five Stocks Are Drawing Investors' Attention Toda",still open
Alphabet,02/08/2023,"Alphabet's DeepMind Lays Off Some Staff, Closes Canadian Office",still open
Alphabet,02/08/2023,Best Stock to Buy: Amazon Stock vs. Alphabet Stock,still open
Alphabet,02/08/2023,Why Alphabet Rose Today,still open
Alphabet,02/08/2023,Alphabet Job Cuts Eyed Despite Hiring Spree That Continued In 2022,still open
Alphabet,02/08/2023,"ChatGPT goes pro, layoffs at Alphabet, and Dungeons & Dragons flirts with restrictive new licensing",still open
Alphabet,02/08/2023,"Neftlix, Alphabet rise; Lilly, Concentrix fall",still open
Alphabet,02/08/2023,"Apple, Alphabet and Amazon Drop on Earnings",still open
Alphabet,02/08/2023,"Big Tech Calls From Apple, Amazon, Alphabet Paint 'Different Picture' Than What Tech Bears Hoped For Says",still open
Alphabet,02/08/2023,"ChatGPT Effect? Google Intensifies AI Focus With Latest Investment - Alphabet (NASDAQ:GOOG), Alphabet (NA",still open
Alphabet,02/08/2023,Will CrowdStrike Be Worth More Than Alphabet by 2040?,still open
Alphabet,02/08/2023,Wedgewood Partners: “Alphabet (GOOG) is Capable of Generating Much Better Margins in the Future”,still open
Alphabet,02/08/2023,Alphabet (GOOGL) Boosts YouTube Music With Redesigned Library,still open
Alphabet,02/08/2023,Google parent Alphabet reportedly starts cutting jobs at healthcare unit,still open
Alphabet,02/08/2023,"Apple Stock Rebounds After Earnings Miss, Amazon and Alphabet Fall",still open
Alphabet,02/08/2023,"If You Invested $1,000 In Google Stock At IPO, Here's How Much You'd Have Now - Alphabet (NASDAQ:GOOG)",still open
Alphabet,02/08/2023,Saturday's Lucas Oil Chili Bowl Nationals Alphabet Soup Lineups,still open
Alphabet,02/08/2023,Alphabet's Google Cloud Platform revenue expectations lowered by ...,still open
Alphabet,02/08/2023,"Microsoft's Bing Vs. Google Bard: Analysts Pick Potential Winner - Microsoft (NASDAQ:MSFT), Alphabet (NAS",still open
Alphabet,02/08/2023,"S&P 500, Dow score best day in 2 weeks, Nasdaq erases weekly loss as Netflix, Alphabet jump",still open
Alphabet,02/08/2023,Ben’s Baseball Alphabet: Michelangelo,still open
Alphabet,02/08/2023,Alphabet Stock Loses $100 Billion After New AI Chatbot Gives Wrong Answer In Ad,still open
Alphabet,02/08/2023,Why Alphabet Stock Was Gaining Today,still open
Alphabet,02/08/2023,Alphabet shares slip 8% following Google's A.I. event,still open
Alphabet,02/08/2023,I Predicted Google's 2022 Stock Decline; Here's The Price I'll Start Buying In 2023 (GOOG),still open
Alphabet,02/08/2023,ChatGPT rival Bard and Microsoft event swing Alphabet stock price,still open
Alphabet,02/08/2023,"Tesla, Amazon, and Alphabet Split Last Year. In 2023, These Are the Top Stock-Split Candidates",still open
Alphabet,02/08/2023,Better Buy: Meta Platforms vs. Alphabet,still open
Alphabet,02/08/2023,Google: Going Nowhere Fast On Fundamentals (NASDAQ:GOOG),still open
Alphabet,02/08/2023,This Trillion-Dollar Growth Stock Just Beat Microsoft and Amazon in 1 Key Area,still open
Alphabet,02/08/2023,"BBBY, UBER, GOOGL Predictions: 3 Hot Stocks for Tomorrow",still open
Alphabet,02/08/2023,Alphabet Falls Most in Three Months on Bard Accuracy Concerns,still open
Alphabet,02/08/2023,"Alphabet Inc Class C (GOOG) Stock Is Lower By -2.14% This Week: Buy, Hold, or Sell?",still open
Alphabet,02/08/2023,Why Alphabet Stock Gained 12% in January,still open
Alphabet,02/08/2023,Why Alphabet Stock Dropped and Then Recovered Today,still open
Alphabet,02/08/2023,Is Alphabet Inc Class C (GOOG) Stock Over or Undervalued?,still open
Alphabet,02/08/2023,"Alphabet Inc. Cl A stock rises Tuesday, outperforms market",still open
Alphabet,02/08/2023,Top AI Stock: Microsoft vs. Alphabet -- the Battle for the Best Search ...,still open
Alphabet,02/08/2023,Tranquilli Financial Advisor LLC Has $414000 Stock Position in ...,still open
Alphabet,02/08/2023,Torray LLC Grows Stock Holdings in Alphabet Inc. (NASDAQ:GOOG),still open
Alphabet,02/08/2023,Best Stock to Buy: Alphabet Stock vs. The Trade Desk Stock,still open
Alphabet,02/08/2023,Why Alphabet Stock Pulled Back Today,still open
Alphabet,02/08/2023,Why Alphabet Stock Jumped Today,still open
Alphabet,02/08/2023,Is Alphabet (GOOG) Stock Recovering?,still open
Alphabet,02/08/2023,Alphabet Inc. Cl A stock underperforms Monday when compared to competitors,still open
Alphabet,02/08/2023,Factual Error of Google’s AI Chatbot Bard Tanks Alphabet Stock Price,still open
Alphabet,02/08/2023,Why Is Alphabet Stock So Cheap?,still open
Alphabet,02/08/2023,Will Alphabet Stock Beat the Market in 2023?,still open
Alphabet,02/08/2023,Better Big Tech Stock: Alphabet vs. Microsoft,still open
Alphabet,02/08/2023,"Stocks fall on Friday, but S&P 500 notches winning week as strong 2023 continues",still open
Alphabet,02/08/2023,"Why Alphabet Shares Are Rising - Alphabet (NASDAQ:GOOG), Alphabet (NASDAQ:GOOGL)",still open
Alphabet,02/08/2023,Alphabet Stock Surged More Than 63% After Breaking Out In 2021 ...,still open
Alphabet,02/08/2023,"After Falling 39% in 2022, Is Alphabet Stock a Buy in 2023?",still open
Alphabet,02/08/2023,Is Alphabet (GOOG) an Attractive Investment for the Long-Term?,still open
Alphabet,02/08/2023,Top Wall Street analysts like these stocks for maximum returns,still open
Alphabet,02/08/2023,Investors Heavily Search Alphabet Inc. (GOOGL): Here is What You ...,still open
Alphabet,02/08/2023,Is Alphabet the Best FAANG Stock to Bet on This Decade?,still open
Alphabet,02/08/2023,"Alphabet, Capri Holdings, Paycom Software And Other Big Stocks Moving Lower On Wednesday - Bed Bath & Bey",still open
Alphabet,02/08/2023,Big Tech Earnings Preview: Time to Buy Amazon or Alphabet Stock?,still open
Alphabet,02/08/2023,Better Buy: Tesla vs. Alphabet Stock,still open
Alphabet,02/08/2023,"Stocks making the biggest moves midday: Netflix, Coinbase, Alphabet, SVB Financial & more",still open
Alphabet,02/08/2023,Best Stock to Buy: Amazon Stock vs. Alphabet Stock,still open
Alphabet,02/08/2023,"Amazon stock hit hardest after tech earnings bonanza, despite misses by Apple and Alphabet",still open
Alphabet,02/08/2023,Wedgewood Partners: “Alphabet (GOOG) is Capable of Generating Much Better Margins in the Future”,still open
Alphabet,02/08/2023,"Alphabet Inc. Cl A stock falls Thursday, underperforms market",still open
Alphabet,02/08/2023,"If You Invested $1,000 In Google Stock At IPO, Here's How Much You'd Have Now - Alphabet (NASDAQ:GOOG)",still open
Alphabet,02/08/2023,"Alphabet Inc. Cl A stock rises Thursday, outperforms market",still open
Alphabet,02/08/2023,"5 stocks to watch on Thursday: Alphabet, Taiwan Semiconductor ...",still open
Alphabet,02/08/2023,Northstar Group Inc. Boosts Stock Holdings in Alphabet Inc ...,still open
Alphabet,02/08/2023,Alphabet Inc. Cl A stock underperforms Tuesday when compared to competitors,still open
Alphabet,02/08/2023,Alphabet Stock Rallies After Job Cuts. Here’s Where It Can Go Next.,still open
Alphabet,02/08/2023,"Buy Boeing and Sell Alphabet Stock, Says Piper Sandler",still open
Alphabet,02/08/2023,Why Amazon and Alphabet Are Still 2 of My Highest-Conviction ...,still open
Alphabet,02/08/2023,"Stock Market Today: Netflix, Alphabet Lead Rally in Tech Stocks",still open
Alphabet,02/08/2023,Why Alphabet Rose Today,still open
Alphabet,02/08/2023,"Alphabet Down Over 6%, on Pace for Largest Percent Decrease Since October 2022 -- Data Talk",still open
Alphabet,02/08/2023,"Stocks making the biggest moves midday: Sunrun, U.S. Bancorp, Alphabet, AT&T and more",still open
Alphabet,02/08/2023,"Why Amazon, Alphabet, and Snowflake Stocks Fell Hard on ...",still open
Alphabet,02/08/2023,Insider Selling: Alphabet Inc. (NASDAQ:GOOG) Director Sells 340 ...,still open
Alphabet,02/08/2023,Is Trending Stock Alphabet Inc. (GOOG) a Buy Now?,still open
Alphabet,02/08/2023,2 FAANG Stocks That Can Double Your Money by 2027,still open
Alphabet,02/08/2023,1 Growth Stock Down 32% to Buy Right Now,still open
Alphabet,02/08/2023,"Spotify, Alphabet And Meta Lead Tech Stock Surge After Massive Layoff Announcements",still open
Alphabet,02/08/2023,Google Stock: A Recipe For A Dynamite 2023 (NASDAQ:GOOGL),still open
Alphabet,02/08/2023,"Alphabet Inc. Cl A stock falls Tuesday, underperforms market",still open
Alphabet,02/08/2023,"Alphabet Inc. Cl A stock rises Friday, outperforms market",still open
Alphabet,02/08/2023,Earnings Preview: Alphabet Inc. (GOOG) Q4 Earnings Expected to ...,still open
Alphabet,02/08/2023,"Big Tech earnings preview: Apple, Amazon and Alphabet",still open
Alphabet,02/08/2023,2 FAANG Stocks to Buy in 2023 and 1 to Avoid: Here's Why,still open
Alphabet,02/08/2023,"If You Like Amazon, Microsoft, and Alphabet, Consider Buying This ...",still open
Alphabet,02/08/2023,How to Buy Alphabet (Google) Shares UK for Beginners [cur_year],still open
Alphabet,02/08/2023,Alphabet Job Cuts Eyed Despite Hiring Spree That Continued In 2022,still open
Alphabet,02/08/2023,Recent Layoffs Don't Change the Story for GOOG Stock,still open
Alphabet,02/08/2023,What to Know About Alphabet Stock for 2023,still open
Alphabet,02/08/2023,"Google Parent Alphabet to Cut 12,000 Jobs",still open
Alphabet,02/08/2023,Top Wall Street analysts like these stocks amid easing inflation,still open
Alphabet,02/08/2023,"The FAANMGs: Google Is A Buy, Netflix Is A Goodbye (GOOG)",still open
Alphabet,02/08/2023,2 Stock-Split Stocks to Buy Hand Over Fist in 2023 and 1 to Avoid ...,still open
Alphabet,02/08/2023,2 Growth Stocks Down More Than 30% to Buy Right Now,still open
Alphabet,02/08/2023,Alphabet Inc. (NASDAQ:GOOGL) Shares Purchased by Guinness ...,still open
Alphabet,02/08/2023,Alphabet (GOOGL) Joins Pivot to Aid Adoption of Nest Devices,still open
Alphabet,02/08/2023,This House of Representative Just Sold Up To $3.00M In Alphabet Stock - Alphabet (NASDAQ:GOOGL),still open
Alphabet,02/08/2023,Here's How Much You Would Have Made Owning Alphabet Stock In The Last 15 Years,still open
Alphabet,02/08/2023,Alphabet's Google Cloud Platform revenue expectations lowered by ...,still open
