Name,Data,News,Evaluation
Alphabet,02/10/2023,Fear of complacency costs Alphabet $150 billion,still open
Alphabet,02/10/2023,Why Alphabet Stock Is Falling Again Today,still open
Alphabet,02/10/2023,1 Thing the Smartest Investors Know About Alphabet,still open
Alphabet,02/10/2023,Alphabet Inc Class C (GOOG) Stock: What Does the Chart Say Friday?,still open
Alphabet,02/10/2023,Is Alphabet (GOOG) a Good Long-Term Investment Avenue?,still open
Alphabet,02/10/2023,"Wall St falls after recent strong gains, Alphabet shares sink",still open
Alphabet,02/10/2023,Wall Street's top Thursday analyst calls include Tesla & Alphabet,still open
Alphabet,02/10/2023,Google Parent Alphabet Drags Communications Stocks Lower,still open
Alphabet,02/10/2023,Accused killer of FDNY EMT recited alphabet after passersby ...,still open
Alphabet,02/10/2023,Better Buy: Meta Platforms vs. Alphabet,still open
Alphabet,02/10/2023,Alphabet misses on earnings and revenue as YouTube falls short,still open
Alphabet,02/10/2023,Deseret Mutual Benefit Administrators Raises Holdings in Alphabet ...,still open
Alphabet,02/10/2023,Apple hasn't announced massive layoff's like Alphabet and Amazon ...,still open
Alphabet,02/10/2023,Alphabet has a data quality advantage in AI - share price decline ...,still open
Alphabet,02/10/2023,Google's massive layoffs have renewed interest in the tiny Alphabet ...,still open
Alphabet,02/10/2023,Grammy Winners Alphabet Rockers To Perform at UC Berkeley On ...,still open
Alphabet,02/10/2023,"In Architects' Alphabet, 'a' is for acanthus leaves used in decoration ...",still open
Alphabet,02/10/2023,"Stocks making the biggest moves midday: CVS, Fortinet, Lumen Technologies, Alphabet & more",still open
Alphabet,02/10/2023,"Alphabet (GOOGL), Amazon (AMZN), Apple (AAPL) Earnings: What ...",still open
Alphabet,02/10/2023,Alphabet Inc. (NASDAQ:GOOG) Position Raised by Malaga Cove ...,still open
Alphabet,02/10/2023,"Google Parent Alphabet to Cut 12,000 Jobs",still open
Alphabet,02/10/2023,Why Alphabet Stock Gained 12% in January,still open
Alphabet,02/10/2023,"Layoffs cost companies billions—here’s how much Amazon, Alphabet, Microsoft, and 7 other companies spent per employee",still open
Alphabet,02/10/2023,"Alphabet cuts 12000 jobs after pandemic hiring spree, refocuses on AI",still open
Alphabet,02/10/2023,Alphabet’s Layoffs Aren’t Very Googley,still open
Alphabet,02/10/2023,"Alphabet, Microsoft, and Meta look to prioritize AI amid layoffs",still open
Alphabet,02/10/2023,"Tesla, Amazon, and Alphabet Split Last Year. In 2023, These Are the ...",still open
Alphabet,02/10/2023,Ex-Google engineer says Alphabet isn't taking AI seriously,still open
Alphabet,02/10/2023,"What to expect from Meta, Apple, Amazon, and Alphabet earnings",still open
Alphabet,02/10/2023,Alphabet commences Canadian layoffs,still open
Alphabet,02/10/2023,Earnings playbook: Apple and Google-parent Alphabet lead the ...,still open
Alphabet,02/10/2023,Better Buy: Disney vs. Alphabet,still open
Alphabet,02/10/2023,Apple (AAPL) and Alphabet (GOOGL) earnings: Tech fund manager ...,still open
Alphabet,02/10/2023,Why has Alphabet hit the panic button? Only Google can answer that question,still open
Alphabet,02/10/2023,Why Alphabet Stock Pulled Back Today,still open
Alphabet,02/10/2023,"Down 22%, Is Alphabet Stock a Buy in 2023?",still open
Alphabet,02/10/2023,"Amazon stock hit hardest after tech earnings bonanza, despite misses by Apple and Alphabet",still open
Alphabet,02/10/2023,Is Alphabet (GOOG) Stock Recovering?,still open
Alphabet,02/10/2023,WATCH: Young boy raps the alphabet and impresses mom,still open
Alphabet,02/10/2023,Alphabet or Microsoft? Analysts predict which stock will come out on ...,still open
Alphabet,02/10/2023,Why Is Alphabet Stock So Cheap?,still open
Alphabet,02/10/2023,"Alphabet makes cuts, Twitter bans third-party clients, and Netflix’s Reed Hastings steps down",still open
Alphabet,02/10/2023,"Amazon, Meta, Alphabet Face Proxy Proposals on Human Rights (1)",still open
Alphabet,02/10/2023,"Apple, Amazon and Alphabet earnings are coming. Here's what the stock options market is bracing for.",still open
Alphabet,02/10/2023,Are More Layoffs Coming to Alphabet?,still open
Alphabet,02/10/2023,Alphabet robotics division Intrinsic hit with layoffs,still open
Alphabet,02/10/2023,Nasdaq Bear Market: 3 Reasons to Buy Alphabet in 2023,still open
Alphabet,02/10/2023,Fujitsu re-org sparks alphabet soup splatter: GSBG splits into GTSBG and GBSBG,still open
Alphabet,02/10/2023,"Why Amazon, Alphabet, and Atlassian Stocks All Traded Lower ...",still open
Alphabet,02/10/2023,"Amazon, Apple, Alphabet Headline Another Busy Earnings Week",still open
Alphabet,02/10/2023,3 Things About Alphabet That Smart Investors Know,still open
Alphabet,02/10/2023,World's Oldest Sentence Written In The First Alphabet Discovered,still open
Alphabet,02/10/2023,"Stocks making the biggest moves premarket: Netflix, Alphabet, Nordstrom, PagerDuty and more",still open
Alphabet,02/10/2023,"Spotify, Alphabet And Meta Lead Tech Stock Surge After Massive Layoff Announcements",still open
Alphabet,02/10/2023,Alphabet X graduates robotic agtech firm Mineral,still open
Alphabet,02/10/2023,"Microsoft, Alphabet Cry Poor Right Before Making $32.8 Billion",still open
Alphabet,02/10/2023,Alphabet Down 8.6% Despite Solid Earnings Growth,still open
Alphabet,02/10/2023,Drunken Hinckley driver doesn’t ‘do alphabet all of the time’: Broadview Heights Police Blotter,still open
Alphabet,02/10/2023,"Why Amazon, Alphabet, and Snowflake Stocks Fell Hard on ...",still open
Alphabet,02/10/2023,Top Wall Street analysts like these stocks for maximum returns,still open
Alphabet,02/10/2023,"After Falling 39% in 2022, Is Alphabet Stock a Buy in 2023?",still open
Alphabet,02/10/2023,"Stocks making the biggest moves midday: Sunrun, U.S. Bancorp, Alphabet, AT&T and more",still open
Alphabet,02/10/2023,"Wall Street rallies to end higher on Alphabet, Netflix lift",still open
Alphabet,02/10/2023,Why Amazon and Alphabet Are Still 2 of My Highest-Conviction ...,still open
Alphabet,02/10/2023,Alphabet Job Cuts Eyed Despite Hiring Spree That Continued In 2022,still open
Alphabet,02/10/2023,Best Stock to Buy: Amazon Stock vs. Alphabet Stock,still open
Alphabet,02/10/2023,"Why Alphabet, Pinterest Shares Are Rising After Hours - Alphabet (NASDAQ:GOOG)",still open
Alphabet,02/10/2023,Big tech is crowing about A.I. as it lays off tens of thousands of workers,still open
Alphabet,02/10/2023,"Verily, Alphabet's health-focused company, is cutting jobs",still open
Alphabet,02/10/2023,"Neftlix, Alphabet rise; Lilly, Concentrix fall",still open
Alphabet,02/10/2023,Alphabet-owned AI firm DeepMind shutters office in Canada's ...,still open
Alphabet,02/10/2023,"ChatGPT goes pro, layoffs at Alphabet, and Dungeons & Dragons flirts with restrictive new licensing",still open
Alphabet,02/10/2023,Will CrowdStrike Be Worth More Than Alphabet by 2040?,still open
Alphabet,02/10/2023,Apple Is Far Better Positioned Than Amazon or Alphabet: Here's the ...,still open
Alphabet,02/10/2023,Google Calls In Larry Page and Sergey Brin to Tackle ChatGPT and A.I. Chatbots,still open
Alphabet,02/10/2023,"Big Tech Calls From Apple, Amazon, Alphabet Paint 'Different Picture' Than What Tech Bears Hoped For Says",still open
Alphabet,02/10/2023,Wedgewood Partners: “Alphabet (GOOG) is Capable of Generating Much Better Margins in the Future”,still open
Alphabet,02/10/2023,COINTELPRO is alive and well – Alphabet Boys Podcast,still open
Alphabet,02/10/2023,"Viral Trick To Pinch Photos And Drop Them Between Apple Devices - Alphabet (NASDAQ:GOOG), Alphabet (NASDA",still open
Alphabet,02/10/2023,"5 stocks to watch on Thursday: Alphabet, Taiwan Semiconductor ...",still open
Alphabet,02/10/2023,Alphabet Inc. Cl A stock outperforms competitors despite losses on the day,still open
Alphabet,02/10/2023,$1000 Invested In Alphabet 15 Years Ago Would Be Worth This Much Today - Alphabet (NASDAQ:GOOGL),still open
Alphabet,02/10/2023,"Apple Stock Rebounds After Earnings Miss, Amazon and Alphabet Fall",still open
Alphabet,02/10/2023,Alphabet's Google Cloud Platform revenue expectations lowered by ...,still open
Alphabet,02/10/2023,"What's Going On With Alphabet Shares Today - Alphabet (NASDAQ:GOOG), Alphabet (NASDAQ:GOOGL)",still open
Alphabet,02/10/2023,Live news updates from January 20: Alphabet to cut 12000 jobs ...,still open
Alphabet,02/10/2023,Why Alphabet Stock Is a No-Brainer Buy After This Week's Sell-off,still open
Alphabet,02/10/2023,Alphabet Falls Most in Three Months on Bard Accuracy Concerns,still open
Alphabet,02/10/2023,Alphabet Stock Plunge Erases $100 Billion After New AI Chatbot Gives Wrong Answer In Ad,still open
Alphabet,02/10/2023,A robot’s $100 billion error: Alphabet shares tank after its ChatGPT rival makes a mistake in its very first ad,still open
Alphabet,02/10/2023,Google Stock: 4 Things That Smart Investors Should Know (NASDAQ:GOOG),still open
Alphabet,02/10/2023,Best AI Stock to Buy: Alphabet Stock or Microsoft Stock,still open
Alphabet,02/10/2023,Alphabet Versus ChatGPT. Who Wins?,still open
Alphabet,02/10/2023,Is It Time To Consider Buying Alphabet Inc. (NASDAQ:GOOGL)?,still open
Alphabet,02/10/2023,I Predicted Google's 2022 Stock Decline; Here's The Price I'll Start Buying In 2023 (GOOG),still open
Alphabet,02/10/2023,Why Alphabet Stock Is Selling Off: Is It Game Over for Google?,still open
Alphabet,02/10/2023,Alphabet’s $100 Billion Stock Swoon Shows AI Stakes Are Rising,still open
Alphabet,02/10/2023,Alphabet's $100 Billion Stock Swoon Shows AI Stakes Are Rising,still open
Alphabet,02/10/2023,Why Alphabet Stock Is Falling Again Today,still open
Alphabet,02/10/2023,Alphabet shares fall 7% following Google's A.I. event,still open
Alphabet,02/10/2023,Buy the 'Bard Dip' in Alphabet Stock? Check the Chart First.,still open
Alphabet,02/10/2023,Alphabet Inc Class C (GOOG) Stock: What Does the Chart Say Friday?,still open
Alphabet,02/10/2023,2 Reasons Why Alphabet Is a Screaming Buy Right Now,still open
Alphabet,02/10/2023,"Alphabet Inc Class A (GOOGL) Stock Has Fallen -9.02% This Week: Buy, Hold, or Sell?",still open
Alphabet,02/10/2023,"Dow closes nearly 250 points lower, Nasdaq sheds 1% as Alphabet shares slide: Live updates",still open
Alphabet,02/10/2023,Why Alphabet Stock Gained 12% in January,still open
Alphabet,02/10/2023,Why Alphabet Stock Dropped and Then Recovered Today,still open
Alphabet,02/10/2023,"Down 22%, Is Alphabet Stock a Buy in 2023?",still open
Alphabet,02/10/2023,Alphabet Inc. Cl A stock underperforms Thursday when compared to competitors,still open
Alphabet,02/10/2023,Deseret Mutual Benefit Administrators Raises Holdings in Alphabet ...,still open
Alphabet,02/10/2023,Why Alphabet Stock Jumped Today,still open
Alphabet,02/10/2023,Why Alphabet Stock Pulled Back Today,still open
Alphabet,02/10/2023,Why Is Alphabet Stock So Cheap?,still open
Alphabet,02/10/2023,Is Alphabet (GOOG) Stock Recovering?,still open
Alphabet,02/10/2023,Alphabet Inc. Cl A stock underperforms Wednesday when compared to competitors,still open
Alphabet,02/10/2023,Will Alphabet Stock Beat the Market in 2023?,still open
Alphabet,02/10/2023,Torray LLC Grows Stock Holdings in Alphabet Inc. (NASDAQ:GOOG),still open
Alphabet,02/10/2023,"After Falling 39% in 2022, Is Alphabet Stock a Buy in 2023?",still open
Alphabet,02/10/2023,"Tesla, Amazon, and Alphabet Split Last Year. In 2023, These Are the ...",still open
Alphabet,02/10/2023,Better Big Tech Stock: Alphabet vs. Microsoft,still open
Alphabet,02/10/2023,Alphabet Inc. (NASDAQ:GOOGL) Stock Holdings Raised by Hartford ...,still open
Alphabet,02/10/2023,"Stocks fall on Friday, but S&P 500 notches winning week as strong 2023 continues",still open
Alphabet,02/10/2023,Alphabet Stock Surged More Than 63% After Breaking Out In 2021 ...,still open
Alphabet,02/10/2023,Top Wall Street analysts like these stocks for maximum returns,still open
Alphabet,02/10/2023,Alphabet or Microsoft? Analysts predict which stock will come out on ...,still open
Alphabet,02/10/2023,Is Alphabet the Best FAANG Stock to Bet on This Decade?,still open
Alphabet,02/10/2023,"Why Alphabet Shares Are Rising - Alphabet (NASDAQ:GOOG), Alphabet (NASDAQ:GOOGL)",still open
Alphabet,02/10/2023,"Stocks making the biggest moves midday: Netflix, Coinbase, Alphabet, SVB Financial & more",still open
Alphabet,02/10/2023,Best Stock to Buy: Amazon Stock vs. Alphabet Stock,still open
Alphabet,02/10/2023,Big Tech Earnings Preview: Time to Buy Amazon or Alphabet Stock?,still open
Alphabet,02/10/2023,"Amazon stock hit hardest after tech earnings bonanza, despite misses by Apple and Alphabet",still open
Alphabet,02/10/2023,Better Buy: Tesla vs. Alphabet Stock,still open
Alphabet,02/10/2023,Northstar Group Inc. Boosts Stock Holdings in Alphabet Inc ...,still open
Alphabet,02/10/2023,Alphabet Stock Rallies After Job Cuts. Here’s Where It Can Go Next.,still open
Alphabet,02/10/2023,Alphabet Inc. Cl A stock outperforms competitors despite losses on the day,still open
Alphabet,02/10/2023,Wedgewood Partners: “Alphabet (GOOG) is Capable of Generating Much Better Margins in the Future”,still open
Alphabet,02/10/2023,"Alphabet Inc. Cl A stock falls Thursday, underperforms market",still open
Alphabet,02/10/2023,Investors Heavily Search Alphabet Inc. (GOOGL): Here is What You ...,still open
Alphabet,02/10/2023,"Alphabet Inc. Cl A stock rises Thursday, outperforms market",still open
Alphabet,02/10/2023,"5 stocks to watch on Thursday: Alphabet, Taiwan Semiconductor ...",still open
Alphabet,02/10/2023,Alphabet has a data quality advantage in AI - share price decline ...,still open
Alphabet,02/10/2023,"US STOCKS-Wall Street rallies to end higher on Alphabet, Netflix lift",still open
Alphabet,02/10/2023,"Alphabet Inc. Cl A stock falls Friday, underperforms market",still open
Alphabet,02/10/2023,"Buy Boeing and Sell Alphabet Stock, Says Piper Sandler",still open
Alphabet,02/10/2023,"If I Had $1,000 to Invest Between Alphabet (Google), Uber, and Meta ...",still open
Alphabet,02/10/2023,"Stocks making the biggest moves midday: Sunrun, U.S. Bancorp, Alphabet, AT&T and more",still open
Alphabet,02/10/2023,What to Know About Alphabet Stock for 2023,still open
Alphabet,02/10/2023,"Spotify, Alphabet And Meta Lead Tech Stock Surge After Massive Layoff Announcements",still open
Alphabet,02/10/2023,Why Amazon and Alphabet Are Still 2 of My Highest-Conviction ...,still open
Alphabet,02/10/2023,"Why Amazon, Alphabet, and Snowflake Stocks Fell Hard on ...",still open
Alphabet,02/10/2023,1 Growth Stock Down 32% to Buy Right Now,still open
Alphabet,02/10/2023,"Alphabet Inc. Cl A stock falls Tuesday, underperforms market",still open
Alphabet,02/10/2023,"Alphabet Inc. Cl A stock rises Friday, outperforms market",still open
Alphabet,02/10/2023,"If You Like Amazon, Microsoft, and Alphabet, Consider Buying This ...",still open
Alphabet,02/10/2023,ChatGPT Mania: 3 Stocks to Buy Hand Over Fist,still open
Alphabet,02/10/2023,Alphabet Job Cuts Eyed Despite Hiring Spree That Continued In 2022,still open
Alphabet,02/10/2023,Ann Mather Sells 340 Shares of Alphabet Inc. (NASDAQ:GOOGL ...,still open
Alphabet,02/10/2023,Google Stock: A Recipe For A Dynamite 2023 (NASDAQ:GOOGL),still open
Alphabet,02/10/2023,2 FAANG Stocks to Buy in 2023 and 1 to Avoid: Here's Why,still open
Alphabet,02/10/2023,2 Stock-Split Stocks the Smartest Investors Are Buying Hand Over ...,still open
Alphabet,02/10/2023,Alphabet Down 8.6% Despite Solid Earnings Growth,still open
Alphabet,02/10/2023,Chemung Canal Trust Co. Increases Stock Holdings in Alphabet Inc ...,still open
Alphabet,02/10/2023,Wall Street's top Thursday analyst calls include Tesla & Alphabet,still open
Alphabet,02/10/2023,Two “Strong Buy” Tech Stocks with Over 30% Upside,still open
Alphabet,02/10/2023,"Google Parent Alphabet to Cut 12,000 Jobs",still open
Alphabet,02/10/2023,"Microsoft, Alphabet Cry Poor Right Before Making $32.8 Billion",still open
Alphabet,02/10/2023,Recent Layoffs Don't Change the Story for GOOG Stock,still open
Alphabet,02/10/2023,This House of Representative Just Sold Up To $3.00M In Alphabet Stock - Alphabet (NASDAQ:GOOGL),still open
Alphabet,02/10/2023,"What's Going On With Alphabet Shares Today - Alphabet (NASDAQ:GOOG), Alphabet (NASDAQ:GOOGL)",still open
Alphabet,02/10/2023,"S&P 500, Dow score best day in 2 weeks, Nasdaq erases weekly loss as Netflix, Alphabet jump",still open
Alphabet,02/10/2023,2 Growth Stocks Down More Than 30% to Buy Right Now,still open
Alphabet,02/10/2023,Top Wall Street analysts like these stocks amid easing inflation,still open
Alphabet,02/10/2023,Here's How Much You Would Have Made Owning Alphabet Stock In The Last 15 Years,still open
Alphabet,02/10/2023,Alphabet's Google Cloud Platform revenue expectations lowered by ...,still open
Alphabet,02/10/2023,Alphabet Inc. (NASDAQ:GOOG) Shares Purchased by Navis Wealth ...,still open
Alphabet,02/10/2023,Bard's Big Blunder: How Google lost $100bn overnight,still open
Alphabet,02/10/2023,Google Stock: When Will Pichai Drop The Axe? (NASDAQ:GOOG),still open
Alphabet,02/10/2023,Alphabet to cut staff of health sciences unit Verily by 15%,still open
Alphabet,02/10/2023,"Google asked Larry Page, Sergey Brin for help after ChatGPT 'code red'",still open
Alphabet,02/10/2023,"Verily, Alphabet's health-focused company, is cutting jobs",still open
Alphabet,02/10/2023,Why Alphabet Stock Crashed Wednesday Morning,still open
Alphabet,02/10/2023,Why Alphabet Stock Is a Buy Despite YouTube's Revenue Drop,still open
Alphabet,02/10/2023,Alphabet Stock Is a Buy and It's All Thanks to Google Cloud,still open
Alphabet,02/10/2023,Why Alphabet Stock Was Sliding Today,still open
Alphabet,02/10/2023,Is Alphabet the Top Tech Stock to Buy In 2023?,still open
Alphabet,02/11/2023,Here's how Microsoft and Alphabet compare in the A.I. war,still open
Alphabet,02/11/2023,Alphabet shares fall 7% following Google's A.I. event,still open
Alphabet,02/11/2023,Alphabet vs. Microsoft: Who Will Win the AI Race?,still open
Alphabet,02/11/2023,A robot’s $100 billion error: Alphabet shares tank after its ChatGPT rival makes a mistake in its very first ad,still open
Alphabet,02/11/2023,"Better Buy: Amazon, Microsoft, or Alphabet?",still open
Alphabet,02/11/2023,Google's massive layoffs have renewed interest in the tiny Alphabet Workers Union.,still open
Alphabet,02/11/2023,Is It Time To Consider Buying Alphabet Inc. (NASDAQ:GOOGL)?,still open
Alphabet,02/11/2023,"Meta, Alphabet target middle managers with tech jobs cuts",still open
Alphabet,02/11/2023,Fear of complacency costs Alphabet $150 billion,still open
Alphabet,02/11/2023,Why Alphabet Stock Is Selling Off: Is It Game Over for Google?,still open
Alphabet,02/11/2023,Google's Bard AI Bot Error Just Cost Alphabet $100 Billion | Time,still open
Alphabet,02/11/2023,Alphabet Versus ChatGPT. Who Wins?,still open
Alphabet,02/11/2023,Why Alphabet Stock Is a No-Brainer Buy After This Week's Sell-off,still open
Alphabet,02/11/2023,2 Reasons Why Alphabet Is a Screaming Buy Right Now,still open
Alphabet,02/11/2023,1 Thing the Smartest Investors Know About Alphabet,still open
Alphabet,02/11/2023,"Alphabet Inc Class A (GOOGL) Stock Has Fallen -9.02% This Week: Buy, Hold, or Sell?",still open
Alphabet,02/11/2023,Accused killer of FDNY EMT recited alphabet after passersby ...,still open
Alphabet,02/11/2023,"Wall St falls after recent strong gains, Alphabet shares sink",still open
Alphabet,02/11/2023,Alphabet misses on earnings and revenue as YouTube falls short,still open
Alphabet,02/11/2023,"Alphabet Inc. Cl A stock falls Friday, underperforms market",still open
Alphabet,02/11/2023,Google Parent Alphabet Drags Communications Stocks Lower,still open
Alphabet,02/11/2023,Eating My Way Through the Alphabet: Big Kahuna Hawaiian BBQ ...,still open
Alphabet,02/11/2023,Better Buy: Meta Platforms vs. Alphabet,still open
Alphabet,02/11/2023,Wall Street's top Thursday analyst calls include Tesla & Alphabet,still open
Alphabet,02/11/2023,"Alphabet (GOOGL), Amazon (AMZN), Apple (AAPL) Earnings: What ...",still open
Alphabet,02/11/2023,"Google Parent Alphabet to Cut 12,000 Jobs",still open
Alphabet,02/11/2023,"Alphabet cuts 12000 jobs after pandemic hiring spree, refocuses on AI",still open
Alphabet,02/11/2023,Why Alphabet Stock Gained 12% in January,still open
Alphabet,02/11/2023,Deseret Mutual Benefit Administrators Raises Holdings in Alphabet ...,still open
Alphabet,02/11/2023,"Stocks making the biggest moves midday: CVS, Fortinet, Lumen Technologies, Alphabet & more",still open
Alphabet,02/11/2023,Alphabet’s Layoffs Aren’t Very Googley,still open
Alphabet,02/11/2023,Grammy Winners Alphabet Rockers To Perform at UC Berkeley On ...,still open
Alphabet,02/11/2023,"Alphabet, Microsoft, and Meta look to prioritize AI amid layoffs",still open
Alphabet,02/11/2023,Alphabet has a data quality advantage in AI - share price decline ...,still open
Alphabet,02/11/2023,Apple hasn't announced massive layoff's like Alphabet and Amazon ...,still open
Alphabet,02/11/2023,Google's Parent Alphabet to Spend $500M Cutting Office Space ...,still open
Alphabet,02/11/2023,"Meta, Alphabet Target Middle Managers With Tech Jobs Cuts",still open
Alphabet,02/11/2023,"Analysts overlook Alphabet's disappointing quarter, cite confidence ...",still open
Alphabet,02/11/2023,"What to expect from Meta, Apple, Amazon, and Alphabet earnings",still open
Alphabet,02/11/2023,"Tesla, Amazon, and Alphabet Split Last Year. In 2023, These Are the ...",still open
Alphabet,02/11/2023,Earnings playbook: Apple and Google-parent Alphabet lead the ...,still open
Alphabet,02/11/2023,Why has Alphabet hit the panic button? Only Google can answer that question,still open
Alphabet,02/11/2023,Why Alphabet Stock Pulled Back Today,still open
Alphabet,02/11/2023,Better Buy: Disney vs. Alphabet,still open
Alphabet,02/11/2023,Armstrong Shaw Associates Inc. CT Has $5.13 Million Holdings in ...,still open
Alphabet,02/11/2023,"Down 22%, Is Alphabet Stock a Buy in 2023?",still open
Alphabet,02/11/2023,Alphabet commences Canadian layoffs,still open
Alphabet,02/11/2023,Is Alphabet (GOOG) Stock Recovering?,still open
Alphabet,02/11/2023,"Amazon stock hit hardest after tech earnings bonanza, despite misses by Apple and Alphabet",still open
Alphabet,02/11/2023,"Alphabet makes cuts, Twitter bans third-party clients, and Netflix’s Reed Hastings steps down",still open
Alphabet,02/11/2023,Why Is Alphabet Stock So Cheap?,still open
Alphabet,02/11/2023,Alphabet robotics subsidiary Intrinsic lays off 20% staff,still open
Alphabet,02/11/2023,"Amazon, Meta, Alphabet Face Proxy Proposals on Human Rights (1)",still open
Alphabet,02/11/2023,Are More Layoffs Coming to Alphabet?,still open
Alphabet,02/11/2023,"Alphabet, Capri Holdings, Paycom Software And Other Big Stocks Moving Lower On Wednesday - Bed Bath & Bey",still open
Alphabet,02/11/2023,Nasdaq Bear Market: 3 Reasons to Buy Alphabet in 2023,still open
Alphabet,02/11/2023,"Apple, Amazon and Alphabet earnings are coming. Here's what the stock options market is bracing for.",still open
Alphabet,02/11/2023,3 Things About Alphabet That Smart Investors Know,still open
Alphabet,02/11/2023,"Stocks making the biggest moves midday: Sunrun, U.S. Bancorp, Alphabet, AT&T and more",still open
Alphabet,02/11/2023,"Why Amazon, Alphabet, and Atlassian Stocks All Traded Lower ...",still open
Alphabet,02/11/2023,"Amazon, Apple, Alphabet Headline Another Busy Earnings Week",still open
Alphabet,02/11/2023,"Stocks making the biggest moves premarket: Netflix, Alphabet, Nordstrom, PagerDuty and more",still open
Alphabet,02/11/2023,"Alphabet remains 'fabric of the internet' and will do great long, says ...",still open
Alphabet,02/11/2023,"Spotify, Alphabet And Meta Lead Tech Stock Surge After Massive Layoff Announcements",still open
Alphabet,02/11/2023,Fujitsu re-org sparks alphabet soup splatter: GSBG splits into GTSBG and GBSBG,still open
Alphabet,02/11/2023,World's Oldest Sentence Written In The First Alphabet Discovered,still open
Alphabet,02/11/2023,Alphabet (GOOGL) to Post Q4 Earnings: What's in the Offing?,still open
Alphabet,02/11/2023,"Microsoft, Alphabet Cry Poor Right Before Making $32.8 Billion",still open
Alphabet,02/11/2023,Alphabet Down 8.6% Despite Solid Earnings Growth,still open
Alphabet,02/11/2023,Alphabet or Microsoft? Analysts predict which stock will come out on ...,still open
Alphabet,02/11/2023,"Why Amazon, Alphabet, and Snowflake Stocks Fell Hard on ...",still open
Alphabet,02/11/2023,Why Amazon and Alphabet Are Still 2 of My Highest-Conviction ...,still open
Alphabet,02/11/2023,"Wall Street rallies to end higher on Alphabet, Netflix lift",still open
Alphabet,02/11/2023,Alphabet Job Cuts Eyed Despite Hiring Spree That Continued In 2022,still open
Alphabet,02/11/2023,Top Wall Street analysts like these stocks for maximum returns,still open
Alphabet,02/11/2023,Big tech is crowing about A.I. as it lays off tens of thousands of workers,still open
Alphabet,02/11/2023,"Why Alphabet, Pinterest Shares Are Rising After Hours - Alphabet (NASDAQ:GOOG)",still open
Alphabet,02/11/2023,Best Stock to Buy: Amazon Stock vs. Alphabet Stock,still open
Alphabet,02/11/2023,"Neftlix, Alphabet rise; Lilly, Concentrix fall",still open
Alphabet,02/11/2023,"ChatGPT goes pro, layoffs at Alphabet, and Dungeons & Dragons flirts with restrictive new licensing",still open
Alphabet,02/11/2023,Drunken Hinckley driver doesn’t ‘do alphabet all of the time’: Broadview Heights Police Blotter,still open
Alphabet,02/11/2023,"Senator calls for Apple, Alphabet to boot TikTok from app stores",still open
