Name,Data,News,Evaluation
Anadarko Petroleum Corp,02/06/2023,How Occidental Petroleum Stock Could Be a Big Winner,still open
Anadarko Petroleum Corp,02/06/2023,How a CEO Rescued a Big Bet on Big Oil; 'There Were a Lot of ...,still open
Anadarko Petroleum Corp,02/06/2023,Anadarko shareholders go for the cash in $38 billion Occidental ...,still open
Anadarko Petroleum Corp,02/06/2023,Buffett's Berkshire edges closer to 20% Occidental stake,still open
Anadarko Petroleum Corp,02/06/2023,Berkshire Hathaway reveals $5 bln Occidental stake as Icahn exits,still open
Anadarko Petroleum Corp,02/06/2023,Evaluation Of Berkshire's Investment In Occidental Petroleum,still open
Anadarko Petroleum Corp,02/06/2023,Occidental Petroleum Stock Can Keep Rising: It Just Won A Huge Bet,still open
Anadarko Petroleum Corp,02/06/2023,Occidental Petroleum's Premium May Be Too Optimistic (NYSE:OXY),still open
Anadarko Petroleum Corp,02/06/2023,Is Occidental Petroleum Stock A Buy After Berkshire Hathaway ...,still open
Anadarko Petroleum Corp,02/06/2023,Occidental Petroleum Stock: We No Longer Recommend Buying OXY,still open
Anadarko Petroleum Corp,02/06/2023,Why Occidental Is Among The Best Performing Stocks In The S&P 500,still open
Anadarko Petroleum Corp,02/06/2023,Buffett's Berkshire helps bankroll Occidental's $38 billion bid for ...,still open
Anadarko Petroleum Corp,02/06/2023,Berkshire Hathaway approved to buy up to half of Occidental ...,still open
Anadarko Petroleum Corp,02/06/2023,"Vicki Hollub, CEO of Occidental Petroleum, shares why Warren Buffett likes the way she’s running the company",still open
Anadarko Petroleum Corp,02/06/2023,Occidental Petroleum: Does Buffett Want The Whole Enchilada ...,still open
Anadarko Petroleum Corp,02/06/2023,Devon Energy Appoints Michael Mears and Gennifer Kelly to Board of Directors,still open
Anadarko Petroleum Corp,02/06/2023,Anadarko approves $20 billion LNG export project in Mozambique,still open
Anadarko Petroleum Corp,02/06/2023,Our Ultimate Stock-Pickers' Top 10 High-Conviction Purchases,still open
Anadarko Petroleum Corp,02/06/2023,Where Will Occidental Petroleum Stock Be In 5 Years? (NYSE:OXY),still open
Anadarko Petroleum Corp,02/06/2023,Has Warren Buffett Just Bought a Meme Stock?,still open
Anadarko Petroleum Corp,02/06/2023,Anadarko stock: Chevron Corporation bid topped by Occidental Petroleum,still open
Anadarko Petroleum Corp,02/06/2023,T. Rowe Price Raises Concerns About News Corp’s Merger With Fox,still open
Anadarko Petroleum Corp,02/06/2023,Buffett Sitting on Oxy Warrants That Could Give Him 23.6 Percent Stake,still open
Anadarko Petroleum Corp,02/06/2023,Occidental Petroleum: I Am Getting Cautious (NYSE:OXY),still open
Anadarko Petroleum Corp,02/06/2023,Occidental Petroleum Is About To Prove Vicki Hollub Right (NYSE ...,still open
Anadarko Petroleum Corp,02/06/2023,"Anadarko to resume deal talks with Occidental, says bid could be 'superior' to Chevron's offer",still open
Anadarko Petroleum Corp,02/06/2023,Occidental Petroleum Stock Is Still Undervalued With Recent ...,still open
Anadarko Petroleum Corp,02/06/2023,"The Zacks Analyst Blog Highlights Occidental Petroleum, Hess, Marathon Petroleum, ExxonMobil and Schlumberger",still open
Anadarko Petroleum Corp,02/06/2023,Occidental Petroleum Stock Forecast | Is Occidental Petroleum a ...,still open
Anadarko Petroleum Corp,02/06/2023,Warren Buffett Commits $10 Billion To Occidental Acquisition Of Anadarko,still open
Anadarko Petroleum Corp,02/06/2023,Former Anadarko Employees Say Denver Office Was Beset By ...,still open
Anadarko Petroleum Corp,02/06/2023,"Propane Market Size [2022-2029] | Industry Trends, Growth, Share, Market Drivers, Restraints, Opportunities, SWOT Analysis, And Key Developments with Global Forecast",still open
Anadarko Petroleum Corp,02/06/2023,"Occidental is sued by shareholders, bondholders over Anadarko ...",still open
Anadarko Petroleum Corp,02/06/2023,Be More Excited About Occidental Petroleum Stock (NYSE:OXY),still open
Anadarko Petroleum Corp,02/06/2023,Anadarko Petroleum: DJ Basin Well Economics (NYSE:APC),still open
Anadarko Petroleum Corp,02/06/2023,Anadarko Agrees To Be Acquired By Occidental,still open
Anadarko Petroleum Corp,02/06/2023,Fitch Revises OXY's Outlook to Positive on Accelerated Debt ...,still open
Anadarko Petroleum Corp,02/06/2023,Halliburton shares fell for the wrong reason early Tuesday — here's ...,still open
Anadarko Petroleum Corp,02/06/2023,Unit Corp. Ends Bid to Liquidate Properties Following Gulf Coast Asset Sale,still open
Anadarko Petroleum Corp,02/06/2023,Occidental Petroleum Stock: Look Elsewhere In Oil And Gas (NYSE ...,still open
Anadarko Petroleum Corp,02/06/2023,"Occidental to pay dividend to Buffett's Berkshire in cash, not stock",still open
Anadarko Petroleum Corp,02/06/2023,Activist investor Carl Icahn exits Occidental Petroleum after nearly three years -WSJ,still open
Anadarko Petroleum Corp,02/06/2023,Occidental inks $8.8 billion deal to sell Anadarko's African oil and gas assets to Total,still open
Anadarko Petroleum Corp,02/06/2023,Could Chevron Now Acquire Occidental For Less Than It Could Have Bought Anadarko?,still open
Anadarko Petroleum Corp,02/06/2023,Anadarko Petroleum Mitigating Top Oil And Gas Risks (NYSE:APC),still open
Anadarko Petroleum Corp,02/06/2023,EPIC Midstream Expands Board with Appointment of Occidental’s Marcia Backus,still open
Anadarko Petroleum Corp,02/06/2023,How the Most Hyped U.S. Oil Merger in a Decade Went Bust,still open
Anadarko Petroleum Corp,02/06/2023,Is Occidental Petroleum Stock Worth The Risk?,still open
Anadarko Petroleum Corp,02/06/2023,Occidental agrees to sell two Ghana assets for $750 mln,still open
Anadarko Petroleum Corp,02/06/2023,Pay Attention To Occidental Petroleum Paying Back Debt (NYSE:OXY),still open
Anadarko Petroleum Corp,02/06/2023,Occidental to increase dividend payments after cutting debt - CEO,still open
Anadarko Petroleum Corp,02/06/2023,$33 billion deal in Big Oil: Chevron is buying Anadarko Petroleum,still open
Anadarko Petroleum Corp,02/06/2023,"Carl Icahn may be right about Occidental’s Anadarko deal, but for a different reason",still open
Anadarko Petroleum Corp,02/06/2023,Sell Anadarko Petroleum - Debt Load Is Much Worse Than Other Oil ...,still open
Anadarko Petroleum Corp,02/06/2023,Occidental Petroleum Stock: Keep Buying Everything You Want ...,still open
Anadarko Petroleum Corp,02/06/2023,"Once on the brink of bankruptcy, Oxy appears to have turned a corner",still open
Anadarko Petroleum Corp,02/06/2023,Anadarko Petroleum: An Opportune Acquisition From Freeport ...,still open
Anadarko Petroleum Corp,02/06/2023,Anadarko Stealthily Exiting The Cote D'Ivoire (NYSE:APC),still open
Anadarko Petroleum Corp,02/06/2023,Will These 3 Oil Stocks Keep Gushing Higher?,still open
Anadarko Petroleum Corp,02/06/2023,4 Top Oil & Gas Stocks To Watch As Russia-Ukraine Crisis Escalates,still open
Anadarko Petroleum Corp,02/06/2023,FACTBOX-Buffett ramps up oil bets with $4 bln Chevron stake,still open
Anadarko Petroleum Corp,02/06/2023,Occidental Petroleum: The Anadarko Experiment (NYSE:OXY),still open
Anadarko Petroleum Corp,02/06/2023,Occidental's Purchase Of Anadarko Isn't A Permian Oil Purchase ...,still open
Anadarko Petroleum Corp,02/06/2023,Occidental's stock price falls after Buffett sells stake - Houston ...,still open
Anadarko Petroleum Corp,02/06/2023,Weld County landowners claim Anadarko underpaid surface rights royalties for years,still open
Anadarko Petroleum Corp,02/06/2023,Asset manager BlackRock cuts stake in Occidental Petroleum,still open
Anadarko Petroleum Corp,02/06/2023,Occidental Petroleum: And The Winner Is Warren Buffett (NYSE:OXY),still open
Anadarko Petroleum Corp,02/06/2023,Anadarko Petroleum $100 Million CEO Ensnared in Oilfield-Fraud ...,still open
Anadarko Petroleum Corp,02/06/2023,Asset Divestitures To Provide An Uptick To Occidental Petroleum Stock,still open
Anadarko Petroleum Corp,02/06/2023,Why These 3 Oil Stocks Will Outperform,still open
Anadarko Petroleum Corp,02/06/2023,Occidental Petroleum's stock falls as UBS analyst turns bearish after record monthly gain,still open
Anadarko Petroleum Corp,02/06/2023,Anadarko Petroleum's Colombian Ambitions (NYSE:APC),still open
Anadarko Petroleum Corp,02/06/2023,Occidental to cut Western Midstream stake to reduce debt,still open
Anadarko Petroleum Corp,02/06/2023,Occidental Petroleum Stock: Betting On Stronger Oil Prices,still open
Anadarko Petroleum Corp,02/06/2023,Occidental Petroleum: A Tricky Financial Situation (NYSE:OXY),still open
Anadarko Petroleum Corp,02/06/2023,$55 billion purchase of Anadarko finalized after bidding war with ...,still open
Anadarko Petroleum Corp,02/06/2023,Occidental to sell some Permian basin assets for $508 mln,still open
Anadarko Petroleum Corp,02/06/2023,Berkshire Hathaway to take Occidental shares instead of cash ...,still open
Anadarko Petroleum Corp,02/06/2023,Occidental adopts poison pill to combat potential hostile takeover ...,still open
