Name,Data,News,Evaluation
AutoZone Inc,02/09/2023,O'Reilly Automotive Inc. stock outperforms market on strong trading day,still open
AutoZone Inc,02/09/2023,"AutoZone, Inc. (NYSE:AZO) Q1 2023 Earnings Call Transcript",still open
AutoZone Inc,02/09/2023,"AutoZone Inc. stock rises Tuesday, outperforms market",still open
AutoZone Inc,02/09/2023,Tractor Supply Co. stock underperforms Friday when compared to ...,still open
AutoZone Inc,02/09/2023,"AutoZone Inc. stock rises Friday, outperforms market",still open
AutoZone Inc,02/09/2023,"AutoZone, Inc. (AZO) Q1 2023 Earnings Call Transcript",still open
AutoZone Inc,02/09/2023,"AutoZone, Inc.'s (NYSE:AZO) CEO Looks Like They Deserve Their Pay Packet",still open
AutoZone Inc,02/09/2023,"AutoZone, Inc. (AZO) Q4 2022 Earnings Call Transcript",still open
AutoZone Inc,02/09/2023,AutoZone Inc. stock underperforms Wednesday when compared to competitors,still open
AutoZone Inc,02/09/2023,"AutoZone Inc. stock falls Monday, still outperforms market",still open
AutoZone Inc,02/09/2023,"AutoZone Inc. stock falls Thursday, underperforms market",still open
AutoZone Inc,02/09/2023,"AutoZone Inc. stock rises Monday, outperforms market",still open
AutoZone Inc,02/09/2023,"AutoZone Inc. stock rises Tuesday, still underperforms market",still open
AutoZone Inc,02/09/2023,AutoZone Inc. stock underperforms Friday when compared to competitors,still open
AutoZone Inc,02/09/2023,AutoZone Inc. stock outperforms market on strong trading day,still open
AutoZone Inc,02/09/2023,"AutoZone Inc. stock falls Friday, underperforms market",still open
AutoZone Inc,02/09/2023,AutoZone and peers fall amid concerns over DIY auto parts demand,still open
AutoZone Inc,02/09/2023,"Are Investors Undervaluing AutoZone, Inc. (NYSE:AZO) By 20%?",still open
AutoZone Inc,02/09/2023,Alation Named a Winner in the 2022 Technology Innovation Awards for Sixth Consecutive Year,still open
AutoZone Inc,02/09/2023,AutoZone Authorizes Additional Stock Repurchase,still open
AutoZone Inc,02/09/2023,"AutoZone Inc. stock rises Wednesday, still underperforms market",still open
AutoZone Inc,02/09/2023,"AutoZone Inc. stock rises Monday, still underperforms market",still open
AutoZone Inc,02/09/2023,"AutoZone Inc. stock rises Friday, still underperforms market",still open
AutoZone Inc,02/09/2023,AutoZone (AZO) Stock Moves -0.63%: What You Should Know,still open
AutoZone Inc,02/09/2023,"AutoZone, Inc. (AZO) CEO Bill Rhodes on Q3 2022 Results ...",still open
AutoZone Inc,02/09/2023,AutoZone Announces Change to Executive Committee,still open
AutoZone Inc,02/09/2023,"AutoZone to hold Stockholders' Meeting December 14, 2022",still open
AutoZone Inc,02/09/2023,"AutoZone to Release Fourth Quarter Earnings September 19, 2022",still open
AutoZone Inc,02/09/2023,AutoZone apparently considering superstore in North Highlands ...,still open
AutoZone Inc,02/09/2023,"Is Most-Watched Stock AutoZone, Inc. (AZO) Worth Betting on Now?",still open
AutoZone Inc,02/09/2023,"5 stocks to watch on Tuesday: AutoZone, Signet Jewelers and more",still open
AutoZone Inc,02/09/2023,AutoZone authorizes additional $2.5B share buyback,still open
AutoZone Inc,02/09/2023,AutoZone CEO sells $33.0M in common stock,still open
AutoZone Inc,02/09/2023,"At US$2,027, Is AutoZone, Inc. (NYSE:AZO) Worth Looking At Closely?",still open
AutoZone Inc,02/09/2023,"AutoZone Inc. stock falls Wednesday, underperforms market",still open
AutoZone Inc,02/09/2023,"AutoZone, Inc. (NYSE:AZO) Director George R. Mrkonic, Jr. Sells ...",still open
AutoZone Inc,02/09/2023,AutoZone Tesla Pair Trade Refresh: Time To Book Profits? (NYSE ...,still open
AutoZone Inc,02/09/2023,AutoZone: How A Stock Earns Buy-And-Hold Status In My Portfolio ...,still open
AutoZone Inc,02/09/2023,Investors in AutoZone (NYSE:AZO) have made a solid return of 269% over the past five years,still open
AutoZone Inc,02/09/2023,AutoZone Inc. stock outperforms competitors despite losses on the day,still open
AutoZone Inc,02/09/2023,"Transcript : AutoZone, Inc. Presents at 46th Annual Automotive ...",still open
AutoZone Inc,02/09/2023,AutoZone Stock: A Cigar Butt Story (NYSE:AZO),still open
AutoZone Inc,02/09/2023,A Quality Exec Comp Plan Lowers The Risk Of Investing In AutoZone,still open
AutoZone Inc,02/09/2023,Moody's rates AutoZone's proposed $500 million notes offering at ...,still open
AutoZone Inc,02/09/2023,AutoZone : 2022 Chairman Letter to Shareholders,still open
AutoZone Inc,02/09/2023,AutoZone Earnings: Near-Term Headwinds Keep Us On Sidelines ...,still open
AutoZone Inc,02/09/2023,Dunbar Pays $23M for LA Property - CPE,still open
AutoZone Inc,02/09/2023,AutoZone Recognizes Contributions of Top Vendor Partners,still open
AutoZone Inc,02/09/2023,AZO Earnings: Key quarterly highlights from AutoZone’s Q1 2023 ...,still open
AutoZone Inc,02/09/2023,"AutoZone, Inc. (AZO) CEO Bill Rhodes on Q2 2022 Results ...",still open
AutoZone Inc,02/09/2023,Zacks Investment Ideas feature highlights: AutoZone,still open
AutoZone Inc,02/09/2023,AutoZone to add store at Village Shoppes on Nazareth Pike in ...,still open
AutoZone Inc,02/09/2023,"Is AutoZone, Inc. (AZO) Stock a Smart Investment Friday?",still open
AutoZone Inc,02/09/2023,"AutoZone, Home Depot, Tractor Supply among top retail picks at ...",still open
AutoZone Inc,02/09/2023,AutoZone Full Year 2022 Earnings: Beats Expectations,still open
AutoZone Inc,02/09/2023,Here's How Much a $1000 Investment in AutoZone Made 10 Years Ago Would Be Worth Today,still open
AutoZone Inc,02/09/2023,AutoZone Appoints New Board Members,still open
AutoZone Inc,02/09/2023,"Brokerages have given AutoZone, Inc. (NYSE:AZO) an average ...",still open
AutoZone Inc,02/09/2023,"Grant E. Mcgee, VP of AutoZone, Inc. (NYSE:AZO), sells 500 shares.",still open
AutoZone Inc,02/09/2023,AutoZone and Pep Boys building-out space on San Jose Boulevard,still open
AutoZone Inc,02/09/2023,"AutoZone, Costco, Broadcom and Campbell Soup are part of Zacks Earnings Preview",still open
AutoZone Inc,02/09/2023,AutoZone is singled out by Bank of America as a potential Q3 ...,still open
AutoZone Inc,02/09/2023,Glenn Youngkin | Governor.Virginia.gov,still open
AutoZone Inc,02/09/2023,"Automotive Pair Trade: Sell Tesla, Buy AutoZone Stock (NYSE:TSLA)",still open
AutoZone Inc,02/09/2023,AutoZone Inc. stock outperforms competitors on strong trading day,still open
AutoZone Inc,02/09/2023,"AutoZone Inc. stock falls Tuesday, underperforms market",still open
AutoZone Inc,02/09/2023,AutoZone Inc. stock underperforms Thursday when compared to competitors,still open
AutoZone Inc,02/09/2023,Is AutoZone (AZO) a Great Buy?,still open
AutoZone Inc,02/09/2023,"AutoZone Inc. stock rises Wednesday, outperforms market",still open
AutoZone Inc,02/09/2023,"AutoZone Inc. stock falls Wednesday, still outperforms market",still open
AutoZone Inc,02/09/2023,"Advance Auto Parts Inc. stock falls Wednesday, underperforms market",still open
AutoZone Inc,02/09/2023,Braun Stacey Associates Inc. Has $17.25 Million Position in ...,still open
AutoZone Inc,02/09/2023,Have AutoZone Insiders Been Selling Stock?,still open
AutoZone Inc,02/09/2023,Tractor Supply Co. stock outperforms competitors despite losses on the day,still open
AutoZone Inc,02/09/2023,"AutoZone, Inc. (NYSE:AZO) Receives Consensus Recommendation ...",still open
AutoZone Inc,02/09/2023,Fitch Rates AutoZone's Proposed Unsecured Notes Offering 'BBB',still open
AutoZone Inc,02/09/2023,"Simon Quick Advisors LLC Takes Position in AutoZone, Inc. (NYSE ...",still open
AutoZone Inc,02/09/2023,BlackRock Increases Position in AutoZone (AZO),still open
AutoZone Inc,02/09/2023,Top 5 4th Quarter Trades of FIERA CAPITAL CORP,still open
AutoZone Inc,02/09/2023,"Advance Auto Parts Inc. stock falls Thursday, underperforms market",still open
AutoZone Inc,02/09/2023,Is Alphabet (GOOG) an Attractive Investment for the Long-Term?,still open
AutoZone Inc,02/09/2023,"AUTOZONE INC : Entry into a Material Definitive Agreement, Creation of a Direct Financial Obligation or an Obligation under an Off-Balance Sheet Arrangement of a Registrant, Financial Statements and Exhibits (form 8-K)",still open
AutoZone Inc,02/09/2023,"Advance Auto Parts Inc. stock rises Monday, still underperforms market",still open
AutoZone Inc,02/09/2023,"Freedom Day Solutions, LLC Buys 3, Sells 2 in 4th Quarter",still open
AutoZone Inc,02/09/2023,Advance Auto Parts Inc. stock outperforms market on strong trading day,still open
AutoZone Inc,02/09/2023,"Starbucks, NVIDIA And These 3 Stocks Insiders Are Selling - NetApp (NASDAQ:NTAP), AutoZone (NYSE:AZO)",still open
AutoZone Inc,02/09/2023,Advance Auto Parts Inc. stock outperforms competitors despite ...,still open
AutoZone Inc,02/09/2023,ALLDATA launches ALLDATA Labour Times,still open
AutoZone Inc,02/09/2023,"Mitsubishi UFJ Asset Management (UK) Ltd. Buys 2, Sells 3 in 4th ...",still open
AutoZone Inc,02/09/2023,15 Most Valuable Retail Companies In The World,still open
AutoZone Inc,02/09/2023,"AutoZone Inc. stock rises Tuesday, outperforms market",still open
AutoZone Inc,02/09/2023,"AutoZone Inc. stock rises Tuesday, still underperforms market",still open
AutoZone Inc,02/09/2023,"Thursday’s Top Analyst Upgrades and Downgrades: American Airlines, American Express, Best Buy, Dollar General, Goldman Sachs, Royal Caribbean, Walmart and More",still open
AutoZone Inc,02/09/2023,"AutoZone Inc. stock rises Friday, outperforms market",still open
AutoZone Inc,02/09/2023,AutoZone Inc. stock underperforms Tuesday when compared to competitors,still open
AutoZone Inc,02/09/2023,"AutoZone Inc. stock rises Wednesday, still underperforms market",still open
AutoZone Inc,02/09/2023,AutoZone stock accelerates on big earnings beat (NYSE:AZO),still open
AutoZone Inc,02/09/2023,"AutoZone Inc. stock falls Thursday, underperforms market",still open
AutoZone Inc,02/09/2023,"AutoZone Inc. stock rises Monday, outperforms market",still open
AutoZone Inc,02/09/2023,"AutoZone Inc. stock falls Thursday, still outperforms market",still open
AutoZone Inc,02/09/2023,"Is Most-Watched Stock AutoZone, Inc. (AZO) Worth Betting on Now?",still open
AutoZone Inc,02/09/2023,"AutoZone Inc. stock falls Monday, still outperforms market",still open
AutoZone Inc,02/09/2023,AutoZone similar companies: Who is their biggest competitor?,still open
AutoZone Inc,02/09/2023,AutoZone CEO sells $33.0M in common stock,still open
AutoZone Inc,02/09/2023,AutoZone Inc. stock underperforms Friday when compared to competitors,still open
AutoZone Inc,02/09/2023,"AutoZone Inc. stock falls Friday, underperforms market",still open
AutoZone Inc,02/09/2023,AutoZone and peers fall amid concerns over DIY auto parts demand,still open
AutoZone Inc,02/09/2023,AutoZone Inc. stock underperforms Wednesday when compared to competitors,still open
AutoZone Inc,02/09/2023,AutoZone Authorizes Additional Stock Repurchase,still open
AutoZone Inc,02/09/2023,JILL SOLTAU TO JOIN SOUTHWEST AIRLINES' BOARD OF DIRECTORS,still open
AutoZone Inc,02/09/2023,"AutoZone, Inc. (NYSE:AZO) Director George R. Mrkonic, Jr. Sells ...",still open
AutoZone Inc,02/09/2023,AutoZone Inc. stock outperforms competitors despite losses on the day,still open
AutoZone Inc,02/09/2023,"AutoZone Inc. stock rises Friday, still underperforms market",still open
AutoZone Inc,02/09/2023,"5 stocks to watch on Tuesday: AutoZone, Signet Jewelers and more",still open
AutoZone Inc,02/09/2023,Why AutoZone (AZO) is a Top Value Stock for the Long-Term,still open
AutoZone Inc,02/09/2023,AutoZone Stock Falls After Earnings Beat | Investor's Business Daily,still open
AutoZone Inc,02/09/2023,AutoZone: How A Stock Earns Buy-And-Hold Status In My Portfolio ...,still open
AutoZone Inc,02/09/2023,"Are Investors Undervaluing AutoZone, Inc. (NYSE:AZO) By 20%?",still open
AutoZone Inc,02/09/2023,AutoZone (AZO) Stock Moves -0.63%: What You Should Know,still open
AutoZone Inc,02/09/2023,"Is AutoZone, Inc. (AZO) Stock a Smart Investment Friday?",still open
AutoZone Inc,02/09/2023,AutoZone Stock: A Cigar Butt Story (NYSE:AZO),still open
AutoZone Inc,02/09/2023,AutoZone Tesla Pair Trade Refresh: Time To Book Profits? (NYSE ...,still open
AutoZone Inc,02/09/2023,Why AutoZone Stock Jumped 15% This Week,still open
AutoZone Inc,02/09/2023,"AutoZone, Inc. (AZO) Q1 2023 Earnings Call Transcript",still open
AutoZone Inc,02/09/2023,Is AutoZone Stock A Buy Or Sell As It Nears All-Time Highs?,still open
AutoZone Inc,02/09/2023,Investors in AutoZone (NYSE:AZO) have made a solid return of 269% over the past five years,still open
AutoZone Inc,02/09/2023,"Skip the Mechanic, but Should You Skip AutoZone Stock?",still open
AutoZone Inc,02/09/2023,AutoZone Earnings: Near-Term Headwinds Keep Us On Sidelines ...,still open
AutoZone Inc,02/09/2023,"AutoZone, Inc.'s (NYSE:AZO) CEO Looks Like They Deserve Their Pay Packet",still open
AutoZone Inc,02/09/2023,Zacks Investment Ideas feature highlights: AutoZone,still open
AutoZone Inc,02/09/2023,"Wedbush forecasts that AutoZone, Inc. will report FY2023 earnings ...",still open
AutoZone Inc,02/09/2023,AZO Stock: Auto Parts Leader AutoZone Rises Near Buy Point As ...,still open
AutoZone Inc,02/09/2023,A Quality Exec Comp Plan Lowers The Risk Of Investing In AutoZone,still open
AutoZone Inc,02/09/2023,"Automotive Pair Trade: Sell Tesla, Buy AutoZone Stock (NYSE:TSLA)",still open
AutoZone Inc,02/09/2023,Here's How Much a $1000 Investment in AutoZone Made 10 Years Ago Would Be Worth Today,still open
AutoZone Inc,02/09/2023,"Grant E. Mcgee, VP of AutoZone, Inc. (NYSE:AZO), sells 500 shares.",still open
AutoZone Inc,02/09/2023,"AutoZone, Inc. (AZO) CEO Bill Rhodes on Q3 2022 Results ...",still open
AutoZone Inc,02/09/2023,"At US$2,027, Is AutoZone, Inc. (NYSE:AZO) Worth Looking At Closely?",still open
AutoZone Inc,02/09/2023,"AutoZone, Costco, Broadcom and Campbell Soup are part of Zacks Earnings Preview",still open
AutoZone Inc,02/09/2023,"Beat the Market the Zacks Way: Tenaris, Lululemon, AutoZone in Focus",still open
AutoZone Inc,02/09/2023,"AutoZone, Inc. (NYSE:AZO) short interest falls by 5.2%.",still open
AutoZone Inc,02/09/2023,"Time to Get in the Zone, AutoZone Stock",still open
AutoZone Inc,02/09/2023,Why AutoZone (AZO) is a Top Value Stock for the Long-Term,still open
AutoZone Inc,02/09/2023,AutoZone Stock: Buy For Inflation And Recession Protection (NYSE ...,still open
AutoZone Inc,02/09/2023,AutoZone is singled out by Bank of America as a potential Q3 ...,still open
AutoZone Inc,02/09/2023,"AutoZone, Home Depot, Tractor Supply among top retail picks at ...",still open
AutoZone Inc,02/09/2023,AutoZone (AZO) Delights Investors With $2B Buyback Boost,still open
AutoZone Inc,02/09/2023,AutoZone : 2022 Chairman Letter to Shareholders,still open
AutoZone Inc,02/09/2023,"AutoZone, Toll Brothers And 3 Stocks To Watch Heading Into Tuesday - GitLab (NASDAQ:GTLB), AutoZone (NYSE",still open
AutoZone Inc,02/09/2023,Agree Realty Stock: Perfect Macro Setup For This High-Quality ...,still open
AutoZone Inc,02/09/2023,"AutoZone, Inc. (AZO) CEO Bill Rhodes on Q2 2022 Results ...",still open
AutoZone Inc,02/09/2023,AZO: 3 Consumer Stocks Investors Shouldn't Write Off in 2023,still open
AutoZone Inc,02/09/2023,AutoZone Full Year 2022 Earnings: Beats Expectations,still open
AutoZone Inc,02/09/2023,"Advance Auto Parts Inc. stock falls Friday, still outperforms market",still open
AutoZone Inc,02/09/2023,These 4 Companies Could Be the Next Stock-Split Stocks After ...,still open
AutoZone Inc,02/09/2023,"The Zacks Analyst Blog Highlights Advance Auto Parts, Best Buy, AutoZone, DICK'S Sporting Goods and Ulta Beauty",still open
AutoZone Inc,02/09/2023,"AutoZone, EOG Resources, Rivian Automotive And This Big-Box Retailer On CNBC's 'Final Trades' - Costco Wh",still open
AutoZone Inc,02/09/2023,"Man threatens to 'shoot up' Wawa in South Brunswick, NJ",still open
AutoZone Inc,02/09/2023,AZO: These 4 Auto Part Stocks Look Like Great Investments Now,still open
AutoZone Inc,02/09/2023,Popular grocery store chain opens new store in New Jersey,still open
AutoZone Inc,02/09/2023,"Stocks making the biggest moves midday: Textron, Charter, Estee Lauder, Signet and more",still open
AutoZone Inc,02/09/2023,AutoZone: Compounding Machine Continues Accelerating (NYSE ...,still open
AutoZone Inc,02/09/2023,"Stocks making the biggest moves in the premarket: Target, Kohl's, AutoZone and more",still open
AutoZone Inc,02/10/2023,AutoZone Inc. stock outperforms market on strong trading day,still open
AutoZone Inc,02/10/2023,Kovitz Investment Group Partners LLC Raises Stock Position in ...,still open
AutoZone Inc,02/10/2023,Is AutoZone (AZO) a Great Buy?,still open
AutoZone Inc,02/10/2023,Fitch Rates AutoZone's Proposed Unsecured Notes Offering 'BBB',still open
AutoZone Inc,02/10/2023,AutoZone Inc. stock underperforms Thursday when compared to competitors,still open
AutoZone Inc,02/10/2023,"AutoZone Inc. stock rises Wednesday, outperforms market",still open
AutoZone Inc,02/10/2023,"AutoZone Inc. stock falls Wednesday, still outperforms market",still open
AutoZone Inc,02/10/2023,Braun Stacey Associates Inc. Has $17.25 Million Position in ...,still open
AutoZone Inc,02/10/2023,Corner of Bethlehem's Five Points sold for $2.6M; AutoZone being ...,still open
AutoZone Inc,02/10/2023,BlackRock Increases Position in AutoZone (AZO),still open
AutoZone Inc,02/10/2023,"AUTOZONE INC : Entry into a Material Definitive Agreement, Creation of a Direct Financial Obligation or an Obligation under an Off-Balance Sheet Arrangement of a Registrant, Financial Statements and Exhibits (form 8-K)",still open
AutoZone Inc,02/10/2023,"Advance Auto Parts Inc. stock rises Thursday, outperforms market",still open
AutoZone Inc,02/10/2023,Have AutoZone Insiders Been Selling Stock?,still open
AutoZone Inc,02/10/2023,"AutoZone to Release Second Quarter Earnings February 28, 2023 - AutoZone (NYSE:AZO)",still open
AutoZone Inc,02/10/2023,"AutoZone, Inc. (NYSE:AZO) Receives Consensus Recommendation ...",still open
AutoZone Inc,02/10/2023,"Simon Quick Advisors LLC Takes Position in AutoZone, Inc. (NYSE ...",still open
AutoZone Inc,02/10/2023,Tractor Supply Co. stock outperforms market on strong trading day,still open
AutoZone Inc,02/10/2023,ALLDATA launches ALLDATA Labour Times,still open
AutoZone Inc,02/10/2023,AutoZone similar companies: Who is their biggest competitor?,still open
AutoZone Inc,02/10/2023,Is Alphabet (GOOG) an Attractive Investment for the Long-Term?,still open
AutoZone Inc,02/10/2023,15 Most Valuable Retail Companies In The World,still open
AutoZone Inc,02/10/2023,"Advance Auto Parts Inc. stock falls Thursday, underperforms market",still open
AutoZone Inc,02/10/2023,"Tweedy Browne Buys 1, Sells 4 in 4th Quarter",still open
AutoZone Inc,02/10/2023,"Notable Tuesday Option Activity: AZO, SBUX, ILMN",still open
AutoZone Inc,02/10/2023,Top 5 4th Quarter Trades of FIERA CAPITAL CORP,still open
AutoZone Inc,02/10/2023,Advance Auto Parts Inc. stock outperforms market on strong trading day,still open
AutoZone Inc,02/10/2023,"Freedom Day Solutions, LLC Buys 3, Sells 2 in 4th Quarter",still open
AutoZone Inc,02/10/2023,Morgan Stanley says AutoZone is 'Cruising Along' after meeting with ...,still open
AutoZone Inc,02/10/2023,JILL SOLTAU TO JOIN SOUTHWEST AIRLINES' BOARD OF ...,still open
AutoZone Inc,02/10/2023,"Starbucks, NVIDIA And These 3 Stocks Insiders Are Selling - NetApp (NASDAQ:NTAP), AutoZone (NYSE:AZO)",still open
AutoZone Inc,02/10/2023,"Mitsubishi UFJ Asset Management (UK) Ltd. Buys 2, Sells 3 in 4th ...",still open
AutoZone Inc,02/10/2023,"AutoZone, Inc. (NYSE:AZO) Q1 2023 Earnings Call Transcript",still open
AutoZone Inc,02/10/2023,"AutoZone Inc. stock rises Tuesday, outperforms market",still open
AutoZone Inc,02/10/2023,"AutoZone Inc. stock rises Friday, outperforms market",still open
AutoZone Inc,02/10/2023,"AutoZone, Inc. (AZO) Q1 2023 Earnings Call Transcript",still open
AutoZone Inc,02/10/2023,"AutoZone, Inc.'s (NYSE:AZO) CEO Looks Like They Deserve Their Pay Packet",still open
AutoZone Inc,02/10/2023,"AutoZone, Inc. (AZO) Q4 2022 Earnings Call Transcript",still open
AutoZone Inc,02/10/2023,AutoZone Inc. stock underperforms Wednesday when compared to competitors,still open
AutoZone Inc,02/10/2023,"AutoZone Inc. stock falls Monday, still outperforms market",still open
AutoZone Inc,02/10/2023,"AutoZone Inc. stock rises Monday, outperforms market",still open
AutoZone Inc,02/10/2023,"AutoZone Inc. stock rises Tuesday, still underperforms market",still open
AutoZone Inc,02/10/2023,AutoZone Inc. stock underperforms Friday when compared to ...,still open
AutoZone Inc,02/10/2023,"AutoZone Inc. stock falls Friday, underperforms market",still open
AutoZone Inc,02/10/2023,"AutoZone Inc. stock falls Tuesday, underperforms market",still open
AutoZone Inc,02/10/2023,"Are Investors Undervaluing AutoZone, Inc. (NYSE:AZO) By 20%?",still open
AutoZone Inc,02/10/2023,"AutoZone Inc. stock falls Thursday, underperforms market",still open
AutoZone Inc,02/10/2023,AutoZone Authorizes Additional Stock Repurchase,still open
AutoZone Inc,02/10/2023,AutoZone (AZO) Stock Moves -0.63%: What You Should Know,still open
AutoZone Inc,02/10/2023,"AutoZone Inc. stock rises Monday, still underperforms market",still open
AutoZone Inc,02/10/2023,SAWGRASS ASSET MANAGEMENT LLC,still open
AutoZone Inc,02/10/2023,"AutoZone Inc. stock rises Friday, still underperforms market",still open
AutoZone Inc,02/10/2023,"Thursday’s Top Analyst Upgrades and Downgrades: American Airlines, American Express, Best Buy, Dollar General, Goldman Sachs, Royal Caribbean, Walmart and More",still open
AutoZone Inc,02/10/2023,"AutoZone, Inc. (AZO) CEO Bill Rhodes on Q3 2022 Results ...",still open
AutoZone Inc,02/10/2023,AutoZone Announces Change to Executive Committee,still open
AutoZone Inc,02/10/2023,"AutoZone to Release Fourth Quarter Earnings September 19, 2022",still open
AutoZone Inc,02/10/2023,"AutoZone to hold Stockholders' Meeting December 14, 2022",still open
AutoZone Inc,02/10/2023,"Is Most-Watched Stock AutoZone, Inc. (AZO) Worth Betting on Now?",still open
AutoZone Inc,02/10/2023,AutoZone apparently considering superstore in North Highlands ...,still open
AutoZone Inc,02/10/2023,"AutoZone Inc. stock rises Thursday, outperforms market",still open
AutoZone Inc,02/10/2023,AutoZone CEO sells $33.0M in common stock,still open
AutoZone Inc,02/10/2023,"At US$2,027, Is AutoZone, Inc. (NYSE:AZO) Worth Looking At Closely?",still open
AutoZone Inc,02/10/2023,AutoZone Inc. stock outperforms competitors on strong trading day,still open
AutoZone Inc,02/10/2023,AutoZone authorizes additional $2.5B share buyback,still open
AutoZone Inc,02/10/2023,"AutoZone, Inc. (NYSE:AZO) Director George R. Mrkonic, Jr. Sells ...",still open
AutoZone Inc,02/10/2023,AutoZone Tesla Pair Trade Refresh: Time To Book Profits? (NYSE ...,still open
AutoZone Inc,02/10/2023,AutoZone: How A Stock Earns Buy-And-Hold Status In My Portfolio ...,still open
AutoZone Inc,02/10/2023,AutoZone Inc. stock outperforms competitors despite losses on the day,still open
AutoZone Inc,02/10/2023,Alation Named a Winner in the 2022 Technology Innovation Awards for Sixth Consecutive Year,still open
AutoZone Inc,02/10/2023,"Police Log: February 10, 2023",still open
AutoZone Inc,02/10/2023,"Transcript : AutoZone, Inc. Presents at 46th Annual Automotive ...",still open
AutoZone Inc,02/10/2023,AutoZone Stock: A Cigar Butt Story (NYSE:AZO),still open
AutoZone Inc,02/10/2023,A Quality Exec Comp Plan Lowers The Risk Of Investing In AutoZone,still open
AutoZone Inc,02/10/2023,Moody's rates AutoZone's proposed $500 million notes offering at ...,still open
AutoZone Inc,02/10/2023,AutoZone : 2022 Chairman Letter to Shareholders,still open
AutoZone Inc,02/10/2023,AutoZone Earnings: Near-Term Headwinds Keep Us On Sidelines ...,still open
AutoZone Inc,02/10/2023,AutoZone Recognizes Contributions of Top Vendor Partners,still open
AutoZone Inc,02/10/2023,"5 stocks to watch on Tuesday: AutoZone, Signet Jewelers and more",still open
AutoZone Inc,02/10/2023,Investors in AutoZone (NYSE:AZO) have made a solid return of 269% over the past five years,still open
AutoZone Inc,02/10/2023,AZO Earnings: Key quarterly highlights from AutoZone’s Q1 2023 ...,still open
AutoZone Inc,02/10/2023,"AutoZone, Inc. (AZO) CEO Bill Rhodes on Q2 2022 Results ...",still open
AutoZone Inc,02/10/2023,AutoZone to add store at Village Shoppes on Nazareth Pike in ...,still open
AutoZone Inc,02/10/2023,"Is AutoZone, Inc. (AZO) Stock a Smart Investment Friday?",still open
AutoZone Inc,02/10/2023,"AutoZone, Home Depot, Tractor Supply among top retail picks at ...",still open
AutoZone Inc,02/10/2023,"AutoZone reports strong quarter, commercial business continues to ...",still open
AutoZone Inc,02/10/2023,AutoZone Full Year 2022 Earnings: Beats Expectations,still open
AutoZone Inc,02/10/2023,Here's How Much a $1000 Investment in AutoZone Made 10 Years Ago Would Be Worth Today,still open
AutoZone Inc,02/10/2023,"Brokerages have given AutoZone, Inc. (NYSE:AZO) an average ...",still open
AutoZone Inc,02/10/2023,AutoZone Appoints New Board Members,still open
AutoZone Inc,02/10/2023,"Grant E. Mcgee, VP of AutoZone, Inc. (NYSE:AZO), sells 500 shares.",still open
AutoZone Inc,02/10/2023,AutoZone and Pep Boys building-out space on San Jose Boulevard,still open
AutoZone Inc,02/10/2023,AutoZone is singled out by Bank of America as a potential Q3 ...,still open
AutoZone Inc,02/10/2023,Glenn Youngkin | Governor.Virginia.gov,still open
AutoZone Inc,02/10/2023,"Automotive Pair Trade: Sell Tesla, Buy AutoZone Stock (NYSE:TSLA)",still open
