Name,Data,News,Evaluation
AutoZone Inc,02/06/2023,"Tractor Supply Co. stock rises Friday, still underperforms market",still open
AutoZone Inc,02/06/2023,"AutoZone Inc. stock rises Tuesday, outperforms market",still open
AutoZone Inc,02/06/2023,"AutoZone Inc. stock rises Tuesday, still underperforms market",still open
AutoZone Inc,02/06/2023,15 Most Valuable Retail Companies In The World,still open
AutoZone Inc,02/06/2023,AutoZone Inc. stock underperforms Tuesday when compared to competitors,still open
AutoZone Inc,02/06/2023,"AutoZone Inc. stock rises Friday, outperforms market",still open
AutoZone Inc,02/06/2023,AutoZone stock accelerates on big earnings beat (NYSE:AZO),still open
AutoZone Inc,02/06/2023,"AutoZone Inc. stock falls Thursday, underperforms market",still open
AutoZone Inc,02/06/2023,"AutoZone Inc. stock rises Monday, outperforms market",still open
AutoZone Inc,02/06/2023,"AutoZone Inc. stock falls Wednesday, still outperforms market",still open
AutoZone Inc,02/06/2023,"Is Most-Watched Stock AutoZone, Inc. (AZO) Worth Betting on Now?",still open
AutoZone Inc,02/06/2023,JILL SOLTAU TO JOIN SOUTHWEST AIRLINES' BOARD OF DIRECTORS,still open
AutoZone Inc,02/06/2023,AutoZone Inc. stock underperforms Thursday when compared to competitors,still open
AutoZone Inc,02/06/2023,"AutoZone Inc. stock falls Monday, still outperforms market",still open
AutoZone Inc,02/06/2023,AutoZone Inc. stock underperforms Friday when compared to competitors,still open
AutoZone Inc,02/06/2023,AutoZone and peers fall amid concerns over DIY auto parts demand,still open
AutoZone Inc,02/06/2023,"AutoZone Inc. stock rises Wednesday, still underperforms market",still open
AutoZone Inc,02/06/2023,"AutoZone Inc. stock rises Monday, still underperforms market",still open
AutoZone Inc,02/06/2023,AutoZone CEO sells $33.0M in common stock,still open
AutoZone Inc,02/06/2023,AutoZone Authorizes Additional Stock Repurchase,still open
AutoZone Inc,02/06/2023,AutoZone Inc. stock underperforms Wednesday when compared to competitors despite daily gains,still open
AutoZone Inc,02/06/2023,AutoZone Inc. stock outperforms competitors on strong trading day,still open
AutoZone Inc,02/06/2023,"AutoZone Inc. stock rises Friday, still underperforms market",still open
AutoZone Inc,02/06/2023,Why AutoZone (AZO) is a Top Value Stock for the Long-Term,still open
AutoZone Inc,02/06/2023,AutoZone Stock Falls After Earnings Beat | Investor's Business Daily,still open
AutoZone Inc,02/06/2023,"These Are the 50 Biggest Retailers in America, and Three Are ...",still open
AutoZone Inc,02/06/2023,AutoZone: How A Stock Earns Buy-And-Hold Status In My Portfolio ...,still open
AutoZone Inc,02/06/2023,"Are Investors Undervaluing AutoZone, Inc. (NYSE:AZO) By 20%?",still open
AutoZone Inc,02/06/2023,AutoZone (AZO) Stock Moves -0.63%: What You Should Know,still open
AutoZone Inc,02/06/2023,Here's Why AutoZone (AZO) is a Strong Value Stock,still open
AutoZone Inc,02/06/2023,"Is AutoZone, Inc. (AZO) Stock a Smart Investment Friday?",still open
AutoZone Inc,02/06/2023,AutoZone Stock: A Cigar Butt Story (NYSE:AZO),still open
AutoZone Inc,02/06/2023,"5 stocks to watch on Tuesday: AutoZone, Signet Jewelers and more",still open
AutoZone Inc,02/06/2023,AutoZone Tesla Pair Trade Refresh: Time To Book Profits? (NYSE ...,still open
AutoZone Inc,02/06/2023,"AutoZone to Release Fourth Quarter Earnings September 19, 2022",still open
AutoZone Inc,02/06/2023,Why AutoZone (AZO) is a Top Growth Stock for the Long-Term,still open
AutoZone Inc,02/06/2023,"AutoZone, Inc. (AZO) Q1 2023 Earnings Call Transcript",still open
AutoZone Inc,02/06/2023,Is AutoZone Stock A Buy Or Sell As It Nears All-Time Highs?,still open
AutoZone Inc,02/06/2023,"Short Interest in AutoZone, Inc. (NYSE:AZO) Increases By 9.8%",still open
AutoZone Inc,02/06/2023,Why AutoZone (AZO) is a Top Value Stock for the Long-Term,still open
AutoZone Inc,02/06/2023,"AutoZone, Inc.'s (NYSE:AZO) CEO Looks Like They Deserve Their Pay Packet",still open
AutoZone Inc,02/06/2023,AutoZone Earnings: Near-Term Headwinds Keep Us On Sidelines ...,still open
AutoZone Inc,02/06/2023,Investors in AutoZone (NYSE:AZO) have made a solid return of 269% over the past five years,still open
AutoZone Inc,02/06/2023,A Quality Exec Comp Plan Lowers The Risk Of Investing In AutoZone,still open
AutoZone Inc,02/06/2023,AutoZone is singled out by Bank of America as a potential Q3 ...,still open
AutoZone Inc,02/06/2023,"Automotive Pair Trade: Sell Tesla, Buy AutoZone Stock (NYSE:TSLA)",still open
AutoZone Inc,02/06/2023,"Grant E. Mcgee, VP of AutoZone, Inc. (NYSE:AZO), sells 500 shares.",still open
AutoZone Inc,02/06/2023,"AutoZone, Inc. (AZO) CEO Bill Rhodes on Q3 2022 Results ...",still open
AutoZone Inc,02/06/2023,Here's How Much a $1000 Investment in AutoZone Made 10 Years Ago Would Be Worth Today,still open
AutoZone Inc,02/06/2023,"At US$2,027, Is AutoZone, Inc. (NYSE:AZO) Worth Looking At Closely?",still open
AutoZone Inc,02/06/2023,AutoZone (AZO) Down 0.4% Since Last Earnings Report: Can It ...,still open
AutoZone Inc,02/06/2023,"AutoZone, Inc. (NYSE:AZO) short interest falls by 5.2%.",still open
AutoZone Inc,02/06/2023,"Beat the Market the Zacks Way: McDonald's, Deere, Autozone in ...",still open
AutoZone Inc,02/06/2023,"Time to Get in the Zone, AutoZone Stock",still open
AutoZone Inc,02/06/2023,"Beat the Market the Zacks Way: Tenaris, Lululemon, AutoZone in Focus",still open
AutoZone Inc,02/06/2023,Popular grocery store chain opens new store in New Jersey,still open
AutoZone Inc,02/06/2023,Why Is AutoZone (AZO) Up 8.2% Since Last Earnings Report?,still open
AutoZone Inc,02/06/2023,"AutoZone, Home Depot, Tractor Supply among top retail picks at ...",still open
AutoZone Inc,02/06/2023,O'Reilly & AutoZone Outperform The S&P: Is Either A Better Stock?,still open
AutoZone Inc,02/06/2023,AutoZone Full Year 2022 Earnings: Beats Expectations,still open
AutoZone Inc,02/06/2023,"AutoZone to hold Stockholders’ Meeting December 14, 2022",still open
AutoZone Inc,02/06/2023,"AutoZone Could Be A High-Inflation Winner, Here's How (NYSE:AZO)",still open
AutoZone Inc,02/06/2023,AutoZone : 2022 Chairman Letter to Shareholders,still open
AutoZone Inc,02/06/2023,Advance Auto Parts wins out over AutoZone in BofA's auto retail check,still open
AutoZone Inc,02/06/2023,"AutoZone, Inc. (AZO) CEO Bill Rhodes on Q2 2022 Results ...",still open
AutoZone Inc,02/06/2023,Is Autozone A Buy Before Earnings Are Released?,still open
AutoZone Inc,02/06/2023,"AutoZone, Toll Brothers And 3 Stocks To Watch Heading Into Tuesday",still open
AutoZone Inc,02/06/2023,Vice President Harris Coming to St. Cloud on Thursday,still open
AutoZone Inc,02/06/2023,"Advance Auto Parts Inc. stock falls Friday, still outperforms market",still open
AutoZone Inc,02/06/2023,"AutoZone, EOG Resources, Rivian Automotive And This Big-Box Retailer On CNBC's 'Final Trades' - Costco Wh",still open
AutoZone Inc,02/06/2023,"AutoZone Stock: Good Long Term Prospects, But Fairly Priced ...",still open
AutoZone Inc,02/06/2023,"The Zacks Analyst Blog Highlights Advance Auto Parts, Best Buy, AutoZone, DICK'S Sporting Goods and Ulta Beauty",still open
AutoZone Inc,02/06/2023,"Stocks making the biggest moves midday: Textron, Charter, Estee Lauder, Signet and more",still open
AutoZone Inc,02/06/2023,AutoZone: Compounding Machine Continues Accelerating (NYSE ...,still open
AutoZone Inc,02/06/2023,"Stocks making the biggest moves in the premarket: Target, Kohl's, AutoZone and more",still open
AutoZone Inc,02/06/2023,Is AutoZone (AZO) a Great Buy?,still open
AutoZone Inc,02/06/2023,"AutoZone Inc. stock falls Friday, underperforms market",still open
AutoZone Inc,02/06/2023,Braun Stacey Associates Inc. Has $17.25 Million Position in ...,still open
AutoZone Inc,02/06/2023,Fitch Rates AutoZone's Proposed Unsecured Notes Offering 'BBB',still open
AutoZone Inc,02/06/2023,AutoZone Inc. stock outperforms competitors despite losses on the day,still open
AutoZone Inc,02/06/2023,"AutoZone Inc. stock falls Tuesday, underperforms market",still open
AutoZone Inc,02/06/2023,"AutoZone Inc. stock falls Thursday, still outperforms market",still open
AutoZone Inc,02/06/2023,BlackRock Increases Position in AutoZone (AZO),still open
AutoZone Inc,02/06/2023,Corner of Bethlehem's Five Points sold for $2.6M; AutoZone being ...,still open
AutoZone Inc,02/06/2023,"AUTOZONE INC : Entry into a Material Definitive Agreement, Creation of a Direct Financial Obligation or an Obligation under an Off-Balance Sheet Arrangement of a Registrant, Financial Statements and Exhibits (form 8-K)",still open
AutoZone Inc,02/06/2023,"AutoZone, Inc. (NYSE:AZO) Receives Consensus Recommendation ...",still open
AutoZone Inc,02/06/2023,Have AutoZone Insiders Been Selling Stock?,still open
AutoZone Inc,02/06/2023,"AutoZone, Inc. (NYSE:AZO) is Fiera Capital Corp's 3rd Largest ...",still open
AutoZone Inc,02/06/2023,Ardevora Asset Management LLP Has $27.19 Million Stock Position ...,still open
AutoZone Inc,02/06/2023,ALLDATA launches ALLDATA Labour Times,still open
AutoZone Inc,02/06/2023,Advance Auto Parts Inc. stock underperforms Friday when compared to competitors,still open
AutoZone Inc,02/06/2023,AutoZone similar companies: Who is their biggest competitor?,still open
AutoZone Inc,02/06/2023,AutoZone: Uncertain Prospects In An EV Future (NYSE:AZO),still open
AutoZone Inc,02/06/2023,Guggenheim has raised its rating on AutoZone (NYSE:AZO).,still open
AutoZone Inc,02/06/2023,15 Most Valuable Retail Companies In The World,still open
AutoZone Inc,02/06/2023,"Advance Auto Parts Inc. stock falls Thursday, underperforms market",still open
AutoZone Inc,02/06/2023,Former JCPenney CEO Jill Soltau joins Southwest Airlines board ...,still open
AutoZone Inc,02/06/2023,Advance Auto Parts Inc. stock outperforms competitors despite losses on the day,still open
AutoZone Inc,02/06/2023,"Strongsville approves TIF agreements for AutoZone, Litehouse & two industrial firms",still open
AutoZone Inc,02/06/2023,Explore AutoZone Park home of the Memphis Redbirds,still open
AutoZone Inc,02/06/2023,"Tractor Supply Co. stock rises Wednesday, still underperforms market",still open
AutoZone Inc,02/06/2023,"Advance Auto Parts Inc. stock falls Monday, underperforms market",still open
AutoZone Inc,02/06/2023,"Starbucks, NVIDIA And These 3 Stocks Insiders Are Selling - NetApp (NASDAQ:NTAP), AutoZone (NYSE:AZO)",still open
AutoZone Inc,02/06/2023,Automotive Side Window Deflectors Market Development Size 2023 ...,still open
AutoZone Inc,02/06/2023,"AutoZone, Inc. (NYSE:AZO) Q1 2023 Earnings Call Transcript",still open
AutoZone Inc,02/06/2023,AZO: 3 Consumer Stocks Investors Shouldn't Write Off in 2023,still open
AutoZone Inc,02/06/2023,"AutoZone Inc. stock rises Tuesday, outperforms market",still open
AutoZone Inc,02/06/2023,U.S. stocks lower at close of trade; Dow Jones Industrial Average ...,still open
AutoZone Inc,02/06/2023,"AutoZone Inc. stock rises Friday, outperforms market",still open
AutoZone Inc,02/06/2023,"These Are the 50 Biggest Retailers in America, and Three Are ...",still open
AutoZone Inc,02/06/2023,"AutoZone, Inc. (AZO) Q1 2023 Earnings Call Transcript",still open
AutoZone Inc,02/06/2023,"AutoZone, Inc.'s (NYSE:AZO) CEO Looks Like They Deserve Their Pay Packet",still open
AutoZone Inc,02/06/2023,Tractor Supply Co. stock underperforms Wednesday when compared to competitors,still open
AutoZone Inc,02/06/2023,"AutoZone, Inc. (AZO) Q4 2022 Earnings Call Transcript",still open
AutoZone Inc,02/06/2023,AutoZone Announces Change to Executive Committee,still open
AutoZone Inc,02/06/2023,AutoZone Inc. stock underperforms Wednesday when compared to competitors,still open
AutoZone Inc,02/06/2023,"AutoZone Inc. stock falls Thursday, underperforms market",still open
AutoZone Inc,02/06/2023,"AutoZone Inc. stock falls Monday, still outperforms market",still open
AutoZone Inc,02/06/2023,"AutoZone Inc. stock rises Monday, outperforms market",still open
AutoZone Inc,02/06/2023,AutoZone (AZO) Gains As Market Dips: What You Should Know,still open
AutoZone Inc,02/06/2023,AutoZone Inc. stock underperforms Friday when compared to competitors,still open
AutoZone Inc,02/06/2023,AutoZone Inc. stock underperforms Thursday when compared to competitors,still open
AutoZone Inc,02/06/2023,"AutoZone Inc. stock falls Wednesday, still outperforms market",still open
AutoZone Inc,02/06/2023,AutoZone Inc. stock outperforms market on strong trading day,still open
AutoZone Inc,02/06/2023,"AutoZone to hold Stockholders’ Meeting December 14, 2022",still open
AutoZone Inc,02/06/2023,"Are Investors Undervaluing AutoZone, Inc. (NYSE:AZO) By 20%?",still open
AutoZone Inc,02/06/2023,AutoZone and peers fall amid concerns over DIY auto parts demand,still open
AutoZone Inc,02/06/2023,AutoZone Authorizes Additional Stock Repurchase,still open
AutoZone Inc,02/06/2023,"AutoZone Inc. stock rises Tuesday, still underperforms market",still open
AutoZone Inc,02/06/2023,"AutoZone Inc. stock rises Wednesday, still underperforms market",still open
AutoZone Inc,02/06/2023,AutoZone Inc. stock outperforms competitors on strong trading day,still open
AutoZone Inc,02/06/2023,AutoZone (AZO) Stock Moves -0.63%: What You Should Know,still open
AutoZone Inc,02/06/2023,"AutoZone, Inc. (AZO) CEO Bill Rhodes on Q3 2022 Results ...",still open
AutoZone Inc,02/06/2023,"AutoZone Inc. stock rises Friday, still underperforms market",still open
AutoZone Inc,02/06/2023,"AutoZone to Release Fourth Quarter Earnings September 19, 2022",still open
AutoZone Inc,02/06/2023,"Is Most-Watched Stock AutoZone, Inc. (AZO) Worth Betting on Now?",still open
AutoZone Inc,02/06/2023,AutoZone apparently considering superstore in North Highlands ...,still open
AutoZone Inc,02/06/2023,"At US$2,027, Is AutoZone, Inc. (NYSE:AZO) Worth Looking At Closely?",still open
AutoZone Inc,02/06/2023,AutoZone authorizes additional $2.5B share buyback,still open
AutoZone Inc,02/06/2023,AutoZone Tesla Pair Trade Refresh: Time To Book Profits? (NYSE ...,still open
AutoZone Inc,02/06/2023,Episode 193: Kevin Scanlon,still open
AutoZone Inc,02/06/2023,AutoZone: How A Stock Earns Buy-And-Hold Status In My Portfolio ...,still open
AutoZone Inc,02/06/2023,AutoZone CEO sells $33.0M in common stock,still open
AutoZone Inc,02/06/2023,"Transcript : AutoZone, Inc. Presents at 46th Annual Automotive ...",still open
AutoZone Inc,02/06/2023,Whataburger to Southside and Baymeadows,still open
AutoZone Inc,02/06/2023,AutoZone Stock: A Cigar Butt Story (NYSE:AZO),still open
AutoZone Inc,02/06/2023,A Quality Exec Comp Plan Lowers The Risk Of Investing In AutoZone,still open
AutoZone Inc,02/06/2023,Moody's rates AutoZone's proposed $500 million notes offering at ...,still open
AutoZone Inc,02/06/2023,AutoZone : 2022 Chairman Letter to Shareholders,still open
AutoZone Inc,02/06/2023,Here's What to Expect From AutoZone's (AZO) Q4 Earnings,still open
AutoZone Inc,02/06/2023,Single-Phase Electricity Meters Market Current Status and Future ...,still open
AutoZone Inc,02/06/2023,Popular grocery store chain opens new store in New Jersey,still open
AutoZone Inc,02/06/2023,AutoZone Earnings: Near-Term Headwinds Keep Us On Sidelines ...,still open
AutoZone Inc,02/06/2023,"5 stocks to watch on Tuesday: AutoZone, Signet Jewelers and more",still open
AutoZone Inc,02/06/2023,"Short Interest in AutoZone, Inc. (NYSE:AZO) Increases By 9.8%",still open
AutoZone Inc,02/06/2023,AutoZone Recognizes Contributions of Top Vendor Partners,still open
AutoZone Inc,02/06/2023,"AutoZone, Inc. (AZO) CEO Bill Rhodes on Q2 2022 Results ...",still open
AutoZone Inc,02/06/2023,Investors in AutoZone (NYSE:AZO) have made a solid return of 269% over the past five years,still open
AutoZone Inc,02/06/2023,AutoZone to add store at Village Shoppes on Nazareth Pike in ...,still open
AutoZone Inc,02/06/2023,"New Year, New Strategy? Actually, No; Here's Why, Plus 6 Quick ...",still open
AutoZone Inc,02/06/2023,"Is AutoZone, Inc. (AZO) Stock a Smart Investment Friday?",still open
AutoZone Inc,02/06/2023,"AutoZone, Home Depot, Tractor Supply among top retail picks at ...",still open
AutoZone Inc,02/06/2023,AutoZone is singled out by Bank of America as a potential Q3 ...,still open
AutoZone Inc,02/06/2023,2023 Schedule Drawn by Scarlett – Kansas Jayhawks,still open
AutoZone Inc,02/06/2023,Here's Why AutoZone (AZO) is a Great Momentum Stock to Buy,still open
AutoZone Inc,02/06/2023,AutoZone Appoints New Board Members,still open
AutoZone Inc,02/06/2023,"AutoZone reports strong quarter, commercial business continues to ...",still open
AutoZone Inc,02/06/2023,Here's Why AutoZone (AZO) is a Strong Value Stock,still open
AutoZone Inc,02/06/2023,Here's How Much a $1000 Investment in AutoZone Made 10 Years Ago Would Be Worth Today,still open
AutoZone Inc,02/06/2023,AutoZone Full Year 2022 Earnings: Beats Expectations,still open
AutoZone Inc,02/06/2023,Vice President Harris Coming to St. Cloud on Thursday,still open
AutoZone Inc,02/06/2023,AutoZone and Pep Boys building-out space on San Jose Boulevard,still open
AutoZone Inc,02/06/2023,"Grant E. Mcgee, VP of AutoZone, Inc. (NYSE:AZO), sells 500 shares.",still open
AutoZone Inc,02/06/2023,Is AutoZone (AZO) a Great Buy?,still open
AutoZone Inc,02/06/2023,"AutoZone Inc. stock falls Friday, underperforms market",still open
AutoZone Inc,02/06/2023,"AutoZone Inc. stock falls Tuesday, underperforms market",still open
AutoZone Inc,02/06/2023,Braun Stacey Associates Inc. Has $17.25 Million Position in ...,still open
AutoZone Inc,02/06/2023,AutoZone Inc. stock outperforms competitors despite losses on the day,still open
AutoZone Inc,02/06/2023,"AutoZone Inc. stock falls Thursday, still outperforms market",still open
AutoZone Inc,02/06/2023,Have AutoZone Insiders Been Selling Stock?,still open
AutoZone Inc,02/06/2023,BlackRock Increases Position in AutoZone (AZO),still open
AutoZone Inc,02/06/2023,Ardevora Asset Management LLP Has $27.19 Million Stock Position ...,still open
AutoZone Inc,02/06/2023,"AutoZone, Inc. (NYSE:AZO) is Fiera Capital Corp's 3rd Largest ...",still open
AutoZone Inc,02/06/2023,Fitch Rates AutoZone's Proposed Unsecured Notes Offering 'BBB',still open
AutoZone Inc,02/06/2023,"AutoZone, Inc. (NYSE:AZO) Receives Consensus Recommendation ...",still open
AutoZone Inc,02/06/2023,Advance Auto Parts Inc. stock underperforms Friday when compared to competitors,still open
AutoZone Inc,02/06/2023,Guggenheim has raised its rating on AutoZone (NYSE:AZO).,still open
AutoZone Inc,02/06/2023,"AUTOZONE INC : Entry into a Material Definitive Agreement, Creation of a Direct Financial Obligation or an Obligation under an Off-Balance Sheet Arrangement of a Registrant, Financial Statements and Exhibits (form 8-K)",still open
AutoZone Inc,02/06/2023,Advance Auto Parts Inc. stock outperforms competitors despite losses on the day,still open
AutoZone Inc,02/06/2023,"Tractor Supply Co. stock rises Thursday, still underperforms market",still open
AutoZone Inc,02/06/2023,"Starbucks, NVIDIA And These 3 Stocks Insiders Are Selling - NetApp (NASDAQ:NTAP), AutoZone (NYSE:AZO)",still open
AutoZone Inc,02/06/2023,"Advance Auto Parts Inc. stock falls Thursday, underperforms market",still open
AutoZone Inc,02/06/2023,"Advance Auto Parts Inc. stock falls Monday, underperforms market",still open
AutoZone Inc,02/06/2023,U.S. stocks lower at close of trade; Dow Jones Industrial Average ...,still open
AutoZone Inc,02/06/2023,AZO: 3 Consumer Stocks Investors Shouldn't Write Off in 2023,still open
AutoZone Inc,02/06/2023,Tractor Supply Co. stock underperforms Tuesday when compared to competitors,still open
AutoZone Inc,02/06/2023,"Tractor Supply Co. stock rises Friday, still underperforms market",still open
AutoZone Inc,02/06/2023,"AutoZone Inc. stock rises Tuesday, outperforms market",still open
AutoZone Inc,02/06/2023,"AutoZone Inc. stock rises Tuesday, still underperforms market",still open
AutoZone Inc,02/06/2023,15 Most Valuable Retail Companies In The World,still open
AutoZone Inc,02/06/2023,AutoZone Inc. stock underperforms Tuesday when compared to competitors,still open
AutoZone Inc,02/06/2023,"AutoZone Inc. stock rises Friday, outperforms market",still open
AutoZone Inc,02/06/2023,AutoZone stock accelerates on big earnings beat (NYSE:AZO),still open
AutoZone Inc,02/06/2023,"AutoZone Inc. stock falls Thursday, underperforms market",still open
AutoZone Inc,02/06/2023,"AutoZone Inc. stock rises Monday, outperforms market",still open
AutoZone Inc,02/06/2023,"AutoZone Inc. stock falls Wednesday, still outperforms market",still open
AutoZone Inc,02/06/2023,"Is Most-Watched Stock AutoZone, Inc. (AZO) Worth Betting on Now?",still open
AutoZone Inc,02/06/2023,JILL SOLTAU TO JOIN SOUTHWEST AIRLINES' BOARD OF DIRECTORS,still open
AutoZone Inc,02/06/2023,AutoZone Inc. stock underperforms Thursday when compared to competitors,still open
AutoZone Inc,02/06/2023,"AutoZone Inc. stock falls Monday, still outperforms market",still open
AutoZone Inc,02/06/2023,AutoZone Inc. stock underperforms Friday when compared to competitors,still open
AutoZone Inc,02/06/2023,AutoZone and peers fall amid concerns over DIY auto parts demand,still open
AutoZone Inc,02/06/2023,"AutoZone Inc. stock rises Wednesday, still underperforms market",still open
AutoZone Inc,02/06/2023,"AutoZone Inc. stock rises Monday, still underperforms market",still open
AutoZone Inc,02/06/2023,AutoZone CEO sells $33.0M in common stock,still open
AutoZone Inc,02/06/2023,AutoZone Authorizes Additional Stock Repurchase,still open
AutoZone Inc,02/06/2023,AutoZone Inc. stock underperforms Wednesday when compared to competitors despite daily gains,still open
AutoZone Inc,02/06/2023,AutoZone Inc. stock outperforms competitors on strong trading day,still open
AutoZone Inc,02/06/2023,"AutoZone Inc. stock rises Friday, still underperforms market",still open
AutoZone Inc,02/06/2023,Why AutoZone (AZO) is a Top Value Stock for the Long-Term,still open
AutoZone Inc,02/06/2023,AutoZone Stock Falls After Earnings Beat | Investor's Business Daily,still open
AutoZone Inc,02/06/2023,"These Are the 50 Biggest Retailers in America, and Three Are ...",still open
AutoZone Inc,02/06/2023,AutoZone: How A Stock Earns Buy-And-Hold Status In My Portfolio ...,still open
AutoZone Inc,02/06/2023,"Are Investors Undervaluing AutoZone, Inc. (NYSE:AZO) By 20%?",still open
AutoZone Inc,02/06/2023,AutoZone (AZO) Stock Moves -0.63%: What You Should Know,still open
AutoZone Inc,02/06/2023,Here's Why AutoZone (AZO) is a Strong Value Stock,still open
AutoZone Inc,02/06/2023,"Is AutoZone, Inc. (AZO) Stock a Smart Investment Friday?",still open
AutoZone Inc,02/06/2023,AutoZone Stock: A Cigar Butt Story (NYSE:AZO),still open
AutoZone Inc,02/06/2023,"5 stocks to watch on Tuesday: AutoZone, Signet Jewelers and more",still open
AutoZone Inc,02/06/2023,AutoZone Tesla Pair Trade Refresh: Time To Book Profits? (NYSE ...,still open
AutoZone Inc,02/06/2023,"AutoZone to Release Fourth Quarter Earnings September 19, 2022",still open
AutoZone Inc,02/06/2023,Why AutoZone (AZO) is a Top Growth Stock for the Long-Term,still open
AutoZone Inc,02/06/2023,"AutoZone, Inc. (AZO) Q1 2023 Earnings Call Transcript",still open
AutoZone Inc,02/06/2023,Is AutoZone Stock A Buy Or Sell As It Nears All-Time Highs?,still open
AutoZone Inc,02/06/2023,"Short Interest in AutoZone, Inc. (NYSE:AZO) Increases By 9.8%",still open
AutoZone Inc,02/06/2023,Why AutoZone (AZO) is a Top Value Stock for the Long-Term,still open
AutoZone Inc,02/06/2023,"AutoZone, Inc.'s (NYSE:AZO) CEO Looks Like They Deserve Their Pay Packet",still open
AutoZone Inc,02/06/2023,AutoZone Earnings: Near-Term Headwinds Keep Us On Sidelines ...,still open
AutoZone Inc,02/06/2023,Investors in AutoZone (NYSE:AZO) have made a solid return of 269% over the past five years,still open
AutoZone Inc,02/06/2023,A Quality Exec Comp Plan Lowers The Risk Of Investing In AutoZone,still open
AutoZone Inc,02/06/2023,AutoZone is singled out by Bank of America as a potential Q3 ...,still open
AutoZone Inc,02/06/2023,"Automotive Pair Trade: Sell Tesla, Buy AutoZone Stock (NYSE:TSLA)",still open
AutoZone Inc,02/06/2023,"Grant E. Mcgee, VP of AutoZone, Inc. (NYSE:AZO), sells 500 shares.",still open
AutoZone Inc,02/06/2023,"AutoZone, Inc. (AZO) CEO Bill Rhodes on Q3 2022 Results ...",still open
AutoZone Inc,02/06/2023,Here's How Much a $1000 Investment in AutoZone Made 10 Years Ago Would Be Worth Today,still open
AutoZone Inc,02/06/2023,"At US$2,027, Is AutoZone, Inc. (NYSE:AZO) Worth Looking At Closely?",still open
AutoZone Inc,02/06/2023,AutoZone (AZO) Down 0.4% Since Last Earnings Report: Can It ...,still open
AutoZone Inc,02/06/2023,"AutoZone, Inc. (NYSE:AZO) short interest falls by 5.2%.",still open
AutoZone Inc,02/06/2023,"Beat the Market the Zacks Way: McDonald's, Deere, Autozone in ...",still open
AutoZone Inc,02/06/2023,"Time to Get in the Zone, AutoZone Stock",still open
AutoZone Inc,02/06/2023,"Beat the Market the Zacks Way: Tenaris, Lululemon, AutoZone in Focus",still open
AutoZone Inc,02/06/2023,Popular grocery store chain opens new store in New Jersey,still open
AutoZone Inc,02/06/2023,Why Is AutoZone (AZO) Up 8.2% Since Last Earnings Report?,still open
AutoZone Inc,02/06/2023,"AutoZone, Home Depot, Tractor Supply among top retail picks at ...",still open
AutoZone Inc,02/06/2023,O'Reilly & AutoZone Outperform The S&P: Is Either A Better Stock?,still open
AutoZone Inc,02/06/2023,AutoZone Full Year 2022 Earnings: Beats Expectations,still open
AutoZone Inc,02/06/2023,"AutoZone to hold Stockholders’ Meeting December 14, 2022",still open
AutoZone Inc,02/06/2023,"AutoZone Could Be A High-Inflation Winner, Here's How (NYSE:AZO)",still open
