Name,Data,News,Evaluation
CBRE Group,02/08/2023,Key Factors to Impact Simon Property (SPG) in Q4 Earnings,still open
CBRE Group,02/08/2023,CRE deal volume could drop 15% in 2023; Realty Income to buy ...,still open
CBRE Group,02/08/2023,"Raymond James Maintains Strong Buy on CBRE Group, Lowers ...",still open
CBRE Group,02/08/2023,"CBRE Group Inc. Cl A stock rises Tuesday, outperforms market",still open
CBRE Group,02/08/2023,Hong Kong Tycoon's Seized Office Tower to Be Bought by PAG and ...,still open
CBRE Group,02/08/2023,CBRE Group Inc. Cl A stock outperforms market on strong trading day,still open
CBRE Group,02/08/2023,"CBRE Group Inc. Cl A stock rises Tuesday, still underperforms market",still open
CBRE Group,02/08/2023,"CBRE Group Inc. Cl A stock rises Friday, outperforms market",still open
CBRE Group,02/08/2023,"CBRE Group Inc. Cl A stock rises Monday, outperforms market",still open
CBRE Group,02/08/2023,"CBRE Group Inc. Cl A stock rises Wednesday, outperforms market",still open
CBRE Group,02/08/2023,Prospera Financial Services Inc. Purchases a New Position in Boyd ...,still open
CBRE Group,02/08/2023,M&A Into the Deep End — Mergers & Acquisitions,still open
CBRE Group,02/08/2023,Is a Beat in Store for Regency (REG) This Earnings Season?,still open
CBRE Group,02/08/2023,Macau gaming stocks gain traction on positive January GGR results,still open
CBRE Group,02/08/2023,The Search for Clarity: Multifamily and Commercial Real Estate ...,still open
CBRE Group,02/08/2023,"CBRE Group, Inc. (CBRE) Q3 2022 Earnings Call Transcript",still open
CBRE Group,02/08/2023,"US Real Estate Appraisal Market Report to 2028: Key Players Include CoreLogic, The Accurate Group, Clear Capital and ServiceLink",still open
CBRE Group,02/08/2023,"With EPS Growth And More, CBRE Group (NYSE:CBRE) Makes An Interesting Case",still open
CBRE Group,02/08/2023,The future remains bright for industrial property,still open
CBRE Group,02/08/2023,"Debt, Equity and Finance Rainmakers In CRE",still open
CBRE Group,02/08/2023,10 Undervalued Stocks to Buy According to Billionaire Paul Tudor Jones,still open
CBRE Group,02/08/2023,"CBRE Group, an S&P 500 company announces the findings of its latest retail report",still open
CBRE Group,02/08/2023,"CBRE Group Third Quarter 2022 Earnings: EPS Beats Expectations, Revenues Lag",still open
CBRE Group,02/08/2023,"These 3 Real Estate Stocks Focus on Growth, Not Dividends",still open
CBRE Group,02/08/2023,This Favorable Sign Appears On CBRE Group's Chart - CBRE Group (NYSE:CBRE),still open
CBRE Group,02/08/2023,3 Bill Nygren Stocks Fall Near 52-Week Lows,still open
CBRE Group,02/09/2023,Vanguard Group Updates Holdings in CBRE Group (CBRE),still open
CBRE Group,02/09/2023,"CBRE Group Inc. Cl A stock falls Wednesday, underperforms market",still open
CBRE Group,02/09/2023,CBRE Global Real Estate Income Fund : Investment Management Expands Client Solutions Team with New Infrastructure Appointments in EMEA and APAC,still open
CBRE Group,02/09/2023,Validea Daily Guru Fundamental Report for CBRE - 2/8/2023,still open
CBRE Group,02/09/2023,CBRE Hospitality Co-Head Mark Owens Joins Colliers,still open
CBRE Group,02/09/2023,Is CBRE Group (CBRE) an Attractively Valued Stock?,still open
CBRE Group,02/09/2023,Should You Invest in CBRE Group (CBRE)?,still open
CBRE Group,02/09/2023,Global Group President of CBRE To Depart World's Largest Brokerage,still open
CBRE Group,02/09/2023,Should Investors Retain CBRE Group (CBRE) Stock for Now?,still open
CBRE Group,02/09/2023,"CBRE reports slowing lending pace in Q4, but optimism for ...",still open
CBRE Group,02/09/2023,"CBRE Group Inc. Cl A stock rises Tuesday, outperforms market",still open
CBRE Group,02/09/2023,CBRE Named Fortune Magazine’s Most Admired Real Estate Company,still open
CBRE Group,02/09/2023,CBRE Earns Place in Bloomberg Gender-Equality Index for Fourth ...,still open
CBRE Group,02/09/2023,Colliers Recruits Longtime CBRE Capital Markets Broker in Greater ...,still open
CBRE Group,02/09/2023,Civic Leader Joins CBRE as Managing Director,still open
CBRE Group,02/09/2023,Malvern's BluePearl Pet Hospital One of CBRE Mid-Atlantic Net ...,still open
CBRE Group,02/09/2023,"CBRE Group snags Buy rating, Jones Lang LaSalle started at ...",still open
CBRE Group,02/09/2023,CBRE Arranges $62.4M Acquisition Loan for Blakely Apartments in ...,still open
CBRE Group,02/09/2023,"CBRE IM Appoints Danny Queenan as CEO, Hires APAC Logistics ...",still open
CBRE Group,02/09/2023,Columbus office of CBRE names new vice chairman – REJournals,still open
CBRE Group,02/09/2023,"CBRE Group, Inc. (NYSE:CBRE) Receives Average Rating of ...",still open
CBRE Group,02/09/2023,CBRE Group Inc. Cl A stock outperforms market despite losses on the day,still open
CBRE Group,02/09/2023,CBRE/Buffalo's overview offers mixed views on WNY's real estate ...,still open
CBRE Group,02/09/2023,CBRE Inc. leaving longtime U.S. Bank Center home for BMO Tower,still open
CBRE Group,02/09/2023,Fitch Affirms CBRE Loan Services Primary Servicer Rating,still open
CBRE Group,02/09/2023,CBRE Brokers $20.5M Sale of Azusa Industrial Property -,still open
CBRE Group,02/09/2023,20 Most Valuable Real Estate Companies in the World,still open
CBRE Group,02/09/2023,Morgan Stanley Cuts Stake in CBRE Clarion Global Real Estate ...,still open
CBRE Group,02/09/2023,Fox Run Management L.L.C. Acquires Shares of 5914 CBRE Group ...,still open
CBRE Group,02/09/2023,Validea Daily Guru Fundamental Report for CBRE - 1/26/2023,still open
CBRE Group,02/09/2023,Forum Mobility and CBRE Investment Management Announce $400 ...,still open
CBRE Group,02/09/2023,"CBRE Group Inc. Cl A stock rises Thursday, outperforms market",still open
CBRE Group,02/09/2023,"CBRE Group Inc. Cl A stock rises Friday, outperforms market",still open
CBRE Group,02/09/2023,"'Megawarehouse' demand hits record highs in 2022, reports CBRE",still open
CBRE Group,02/09/2023,Houston Office Expert Jason Presley Leaves CBRE For Goodwin ...,still open
CBRE Group,02/09/2023,Citigroup Starts CBRE Group at Buy With $100 Price Target,still open
CBRE Group,02/09/2023,Soloviev Group Taps CBRE to Lease 9 W. 57th St. as It Undergoes ...,still open
CBRE Group,02/09/2023,People moves: Tandean heads CBRE IM Asia indirect private real ...,still open
CBRE Group,02/09/2023,CBRE Arranges Sale of 65-Property Hotel Portfolio worth $514 Million,still open
CBRE Group,02/09/2023,Pzena Investment Management LLC Has $45.58 Million Stake in ...,still open
CBRE Group,02/09/2023,Offices sit empty as vacancy rates hit all-time high in Q4: CBRE,still open
CBRE Group,02/09/2023,Self-Storage Real Estate Acquisitions and Sales: February 2023,still open
CBRE Group,02/09/2023,CBRE brokers sale of Napa Valley resort,still open
CBRE Group,02/09/2023,CBRE Global Real Estate Income Fund : MEAG Expands the Munich Re U.S. Residential Portfolio,still open
CBRE Group,02/09/2023,"Raymond James Adjusts Price Target on CBRE to $101 From $105, Maintains Strong Buy Rating",still open
CBRE Group,02/09/2023,Electric Vehicle Infrastructure,still open
CBRE Group,02/09/2023,CBRE Global Real Estate Income Fund (NYSE: IGR) Declares ...,still open
CBRE Group,02/09/2023,Olympus Group Real Estate and CBRE lease 20400 s/f to Rhode ...,still open
CBRE Group,02/09/2023,Five Ways To Leverage Investment in Electric Vehicle Charging for ...,still open
CBRE Group,02/09/2023,"This Week's Comings & Goings | February 9, 2023 — LODGING",still open
CBRE Group,02/09/2023,CBRE Investment Management buys Berewick apartments for $63.7 ...,still open
CBRE Group,02/09/2023,Rockefeller Group Sells Recently Completed Industrial Near NJ ...,still open
CBRE Group,02/09/2023,CBRE Announces North American Winners for Its Supplier ...,still open
CBRE Group,02/09/2023,"CBRE IM, MG Real Estate close two logistics d...",still open
CBRE Group,02/09/2023,CBRE IM appoints APAC and EMEA heads of research,still open
CBRE Group,02/09/2023,ioXt Alliance Expands IoT Certification Program to Include Building ...,still open
CBRE Group,02/09/2023,CBRE Upgrades Boyd Gaming (BYD),still open
CBRE Group,02/09/2023,Meet the 2023 Power Leaders 250 – Part 4: Real Estate - South ...,still open
CBRE Group,02/09/2023,Commercial Real Estate Investors Not Shying Away From Retail Despite Companies Like Bed Bath & Beyond Closing Stores,still open
CBRE Group,02/09/2023,RK Capital Management LLC Has $11.75 Million Position in Golden ...,still open
CBRE Group,02/09/2023,Movers and Shakers: Morning Pointe Adds Clinical Services VP ...,still open
CBRE Group,02/09/2023,"Daniel Cateliu, joins the Industrial & Logistics Services team, at ...",still open
CBRE Group,02/09/2023,Demand for medical office buildings to continue in 2023 - Chicago ...,still open
CBRE Group,02/09/2023,2023 Space Awards for Raleigh-Durham: Top real estate deals and ...,still open
CBRE Group,02/09/2023,U.S. Hotels State of the Union January 2023 Edition,still open
CBRE Group,02/09/2023,"Raymond James Maintains Strong Buy on CBRE Group, Lowers ...",still open
CBRE Group,02/09/2023,What's in the Cards for Kimco (KIM) This Earnings Season?,still open
CBRE Group,02/09/2023,Property Management Services Market Reach A Valuation Of US ...,still open
CBRE Group,02/09/2023,CBRE arranges lease renewal for Hishi Plastics USA in Lincoln Park,still open
CBRE Group,02/09/2023,"Amid Fears Of A Recession, What’s Been Driving Demand For Multifamily Real Estate? - CBRE Group (NYSE:CBR",still open
CBRE Group,02/09/2023,Tech Influencers,still open
CBRE Group,02/09/2023,Orion Real Estate Partners acquires 144-unit active adult community ...,still open
CBRE Group,02/09/2023,"CBRE trades East Orange development site, Hue Soul, for $4.15M",still open
CBRE Group,02/09/2023,2 Ways the Market's Underestimating Amazon in 2023,still open
CBRE Group,02/09/2023,Do You Believe in the Long-Term Growth Opportunities of Jones Lang LaSalle Incorporated (JLL)?,still open
CBRE Group,02/09/2023,Northwestern Mutual plans to bring 2K employees back to ...,still open
CBRE Group,02/09/2023,Belmont Village to Open Senior Living Community in Bay Area,still open
CBRE Group,02/09/2023,Newmark Group: Cheap For Valid Reasons (NASDAQ:NMRK),still open
CBRE Group,02/09/2023,"Facility Management Market Size, Trends, Analysis, Share, Growth ...",still open
CBRE Group,02/09/2023,"Top Workplace/Interior Fitout Architecture, Engineering, and ...",still open
CBRE Group,02/09/2023,Phoenix named one of top three industrial markets to watch in US,still open
CBRE Group,02/09/2023,Oklahoma City has apartment building boom going on but for how ...,still open
CBRE Group,02/09/2023,Here are the top NYC i-sales of 2022,still open
CBRE Group,02/09/2023,He Turned Wall Street Offices Into Homes. Now He Vows To ...,still open
CBRE Group,02/09/2023,Is a Beat in Store for Federal Realty (FRT) in Q4 Earnings?,still open
CBRE Group,02/09/2023,"KBC Group NV Takes $542000 Position in Red Rock Resorts, Inc ...",still open
CBRE Group,02/09/2023,Empty Office Towers Show Remote-Work Pain Rippling Through ...,still open
CBRE Group,02/09/2023,CBRE IM to Develop Greater Tokyo Warehouse,still open
CBRE Group,02/09/2023,People moves: Franks and Lee join DigitalBridge's capital formation ...,still open
CBRE Group,02/09/2023,"L&L, BlackRock sign law firm to renewal, expansion at 600 Third Ave",still open
CBRE Group,02/09/2023,"Private Capital, Regional and Local Banks Step Up to Make Loans",still open
CBRE Group,02/09/2023,Financial Consultant Junto Capital Takes 25K in Midtown,still open
CBRE Group,02/09/2023,Grand Prairie Hotel and Carrollton warehouse add to recent commercial property sales,still open
CBRE Group,02/09/2023,"The Comeback King: For 40 Years, John Rogers Has Come Out Of ...",still open
CBRE Group,02/09/2023,'Echo chamber thinking': Real estate forum optimistic for Downtown rebound,still open
CBRE Group,02/09/2023,World's Largest Brokerage Begins Cutting Costs as Capital Markets ...,still open
CBRE Group,02/09/2023,Day 3 of MSPBJ's 40 Under 40 honorees include HealthPartners ...,still open
CBRE Group,02/09/2023,CBRE Group: Now Is A Great Time To Buy Shares (NYSE:CBRE),still open
CBRE Group,02/09/2023,Vanguard Group Updates Holdings in CBRE Group (CBRE),still open
CBRE Group,02/09/2023,"CBRE Group Inc. Cl A stock falls Wednesday, underperforms market",still open
CBRE Group,02/09/2023,Is CBRE Group (CBRE) an Attractively Valued Stock?,still open
CBRE Group,02/09/2023,Should Investors Retain CBRE Group (CBRE) Stock for Now?,still open
CBRE Group,02/09/2023,Validea Daily Guru Fundamental Report for CBRE - 2/8/2023,still open
CBRE Group,02/09/2023,"CBRE Group Inc. Cl A stock rises Tuesday, outperforms market",still open
CBRE Group,02/09/2023,Flputnam Investment Management Co. Reduces Stock Position in ...,still open
CBRE Group,02/09/2023,Should You Invest in CBRE Group (CBRE)?,still open
CBRE Group,02/09/2023,Fox Run Management L.L.C. Acquires Shares of 5914 CBRE Group ...,still open
CBRE Group,02/09/2023,"CBRE Group Inc. Cl A stock falls Tuesday, underperforms market",still open
CBRE Group,02/09/2023,"CBRE Group Inc. Cl A stock rises Thursday, outperforms market",still open
CBRE Group,02/09/2023,CBRE Global Real Estate Income Fund : Investment Management Expands Client Solutions Team with New Infrastructure Appointments in EMEA and APAC,still open
CBRE Group,02/09/2023,Virtu Financial LLC Invests $202000 in Boyd Gaming Co. (NYSE:BYD),still open
CBRE Group,02/09/2023,Morgan Stanley Cuts Stake in CBRE Clarion Global Real Estate ...,still open
CBRE Group,02/09/2023,RK Capital Management LLC Has $11.75 Million Position in Golden ...,still open
CBRE Group,02/09/2023,Pzena Investment Management LLC Has $45.58 Million Stake in ...,still open
CBRE Group,02/09/2023,Validea Daily Guru Fundamental Report for CBRE - 1/26/2023,still open
CBRE Group,02/09/2023,"KBC Group NV Takes $542000 Position in Red Rock Resorts, Inc ...",still open
CBRE Group,02/09/2023,RMR Group (RMR) Q1 Earnings Lag Estimates,still open
CBRE Group,02/09/2023,"CBRE Group snags Buy rating, Jones Lang LaSalle started at ...",still open
CBRE Group,02/09/2023,Newmark Group: Cheap For Valid Reasons (NASDAQ:NMRK),still open
CBRE Group,02/09/2023,Boyd Gaming (NYSE:BYD) Issues Earnings Results,still open
CBRE Group,02/09/2023,2 Ways the Market's Underestimating Amazon in 2023,still open
CBRE Group,02/09/2023,"Q1 2023 EPS Estimates for PENN Entertainment, Inc. (NASDAQ ...",still open
CBRE Group,02/09/2023,Las Vegas Sands (NYSE:LVS) Rating Increased to Hold at ...,still open
CBRE Group,02/09/2023,"The Comeback King: For 40 Years, John Rogers Has Come Out Of ...",still open
CBRE Group,02/09/2023,Tracking William Von Mueffling's Cantillon Capital Management ...,still open
CBRE Group,02/09/2023,CBRE Named Fortune Magazine's Most Admired Real Estate Company,still open
CBRE Group,02/09/2023,CBRE Earns Place in Bloomberg Gender-Equality Index for Fourth ...,still open
CBRE Group,02/09/2023,"Red Rock Resorts, Inc. (NASDAQ:RRR) Receives Average ...",still open
CBRE Group,02/09/2023,20 Most Valuable Real Estate Companies in the World,still open
CBRE Group,02/09/2023,Do You Believe in the Long-Term Growth Opportunities of Jones Lang LaSalle Incorporated (JLL)?,still open
CBRE Group,02/09/2023,CBRE Global Real Estate Income Fund (NYSE: IGR) Declares Monthly Distribution for January,still open
CBRE Group,02/09/2023,Citigroup Starts CBRE Group at Buy With $100 Price Target,still open
CBRE Group,02/09/2023,Commercial Real Estate Investors Not Shying Away From Retail Despite Companies Like Bed Bath & Beyond Closing Stores,still open
CBRE Group,02/09/2023,CBRE Arranges Sale of 65-Property Hotel Portfolio worth $514 Million; The properties are located in 27 states across the country,still open
CBRE Group,02/09/2023,CBRE Group: Now Is A Great Time To Buy Shares (NYSE:CBRE),still open
CBRE Group,02/09/2023,"Benzinga's Top Ratings Upgrades, Downgrades For January 27, 2023",still open
CBRE Group,02/09/2023,ProShare Advisors LLC Sells 32380 Shares of Las Vegas Sands ...,still open
CBRE Group,02/09/2023,Offices sit empty as vacancy rates hit all-time high in Q4: CBRE,still open
CBRE Group,02/09/2023,"Raymond James Adjusts Price Target on CBRE to $101 From $105, Maintains Strong Buy Rating",still open
CBRE Group,02/09/2023,Jefferies Financial Group Weighs in on Las Vegas Sands Corp.'s Q3 ...,still open
CBRE Group,02/09/2023,CBRE Global Real Estate Income Fund : MEAG Expands the Munich Re U.S. Residential Portfolio,still open
CBRE Group,02/09/2023,"Red Rock Resorts, Inc. (NASDAQ:RRR) Receives Average Rating of ...",still open
CBRE Group,02/09/2023,Saudi real estate sees marked improvement in all sectors in 2022,still open
CBRE Group,02/09/2023,CBRE Announces North American Winners for Its Supplier Innovation Challenge,still open
CBRE Group,02/09/2023,"MGM Resorts soars, Entain slumps with buyout off the table",still open
CBRE Group,02/09/2023,Teacher Retirement System of Texas Purchases 42924 Shares of ...,still open
CBRE Group,02/09/2023,New York Developer Turns Empty Wall Street Offices Into Luxury ...,still open
CBRE Group,02/09/2023,Boyd Gaming (BYD) to Release Quarterly Earnings on Thursday,still open
CBRE Group,02/09/2023,CBRE Group Stock: Cyclical & Structural Headwinds (NYSE:CBRE),still open
CBRE Group,02/09/2023,PENN Entertainment (NASDAQ:PENN) Given New $45.00 Price ...,still open
CBRE Group,02/09/2023,Empty Office Towers Show Remote-Work Pain Rippling Through ...,still open
CBRE Group,02/09/2023,"29247 Shares in Red Rock Resorts, Inc. (NASDAQ:RRR) Purchased ...",still open
CBRE Group,02/09/2023,Duality Advisers LP Invests $1.01 Million in Boyd Gaming Co ...,still open
CBRE Group,02/09/2023,Truist Financial downgrades Red Rock Resorts (NASDAQ:RRR) to ...,still open
CBRE Group,02/09/2023,JD Property and Harvest’s REIT lists on the Shanghai Stock Exchange,still open
CBRE Group,02/09/2023,"Brokerages have assigned a consensus rating of ""Moderate Buy"" to ...",still open
CBRE Group,02/09/2023,"Xenia Hotels & Resorts, Inc. (NYSE:XHR) Given Average ...",still open
CBRE Group,02/09/2023,"Golden Entertainment, Inc. (NASDAQ:GDEN) Given Consensus ...",still open
CBRE Group,02/09/2023,"Elon Musk May Be Late On His San Francisco Rent, But The City Has Bigger Issues With Its Office Space",still open
CBRE Group,02/09/2023,Boyd Gaming Co. (NYSE:BYD) Shares Sold by Aptus Capital ...,still open
CBRE Group,02/09/2023,CBRE Group: High-Quality Company At A Fair Price (NYSE:CBRE),still open
CBRE Group,02/09/2023,"CBRE Group, Inc.'s (NYSE:CBRE) Stock Is Going Strong: Is the Market Following Fundamentals?",still open
CBRE Group,02/09/2023,Is CBRE Group (CBRE) a Good Long-Term Investment?,still open
CBRE Group,02/09/2023,"CBRE Group (CBRE) Q3 Earnings & Revenues Lag, Stock Down",still open
CBRE Group,02/09/2023,Boyd Gaming (NYSE:BYD) Price Target Increased to $80.00 by ...,still open
CBRE Group,02/09/2023,Meet the 2023 Power Leaders 250 – Part 4: Real Estate - South ...,still open
CBRE Group,02/09/2023,MainStay CBRE Global Infrastructure Megatrends Fund (NYSE ...,still open
CBRE Group,02/09/2023,Is a Beat in Store for Federal Realty (FRT) in Q4 Earnings?,still open
CBRE Group,02/09/2023,"Metal, IT drag as Nifty ends 90 pts lower; Adani Ports gains 8% | Mint",still open
CBRE Group,02/09/2023,"Why CBRE Group, Inc. (NYSE:CBRE) Could Be Worth Watching",still open
CBRE Group,02/09/2023,Prospera Financial Services Inc. Purchases a New Position in Boyd ...,still open
CBRE Group,02/09/2023,CRE deal volume could drop 15% in 2023; Realty Income to buy ...,still open
CBRE Group,02/09/2023,"Raymond James Maintains Strong Buy on CBRE Group, Lowers ...",still open
CBRE Group,02/09/2023,Key Factors to Impact Simon Property (SPG) in Q4 Earnings,still open
CBRE Group,02/09/2023,Hong Kong Tycoon's Seized Office Tower to Be Bought by PAG and ...,still open
CBRE Group,02/09/2023,CBRE Group Inc. Cl A stock outperforms market on strong trading day,still open
CBRE Group,02/09/2023,"CBRE Group Inc. Cl A stock rises Tuesday, still underperforms market",still open
CBRE Group,02/09/2023,"CBRE Group Inc. Cl A stock rises Friday, outperforms market",still open
CBRE Group,02/09/2023,"CBRE Group Inc. Cl A stock rises Monday, outperforms market",still open
CBRE Group,02/09/2023,M&A Into the Deep End — Mergers & Acquisitions,still open
CBRE Group,02/09/2023,Nike lease fills new warehouse in southern Dallas County,still open
CBRE Group,02/09/2023,Dublin offices just 10% full on Mondays and Fridays - survey,still open
CBRE Group,02/09/2023,"CBRE Group Inc. Cl A stock rises Wednesday, outperforms market",still open
CBRE Group,02/09/2023,Is a Beat in Store for Regency (REG) This Earnings Season?,still open
CBRE Group,02/09/2023,"CBRE Group, Inc. (CBRE) Q3 2022 Earnings Call Transcript",still open
CBRE Group,02/09/2023,"US Real Estate Appraisal Market Report to 2028: Key Players Include CoreLogic, The Accurate Group, Clear Capital and ServiceLink",still open
CBRE Group,02/09/2023,Why Some Executives Wish E.S.G. ‘Just Goes Away’,still open
CBRE Group,02/09/2023,10 Undervalued Stocks to Buy According to Billionaire Paul Tudor Jones,still open
CBRE Group,02/09/2023,"CBRE Group, an S&P 500 company announces the findings of its latest retail report",still open
CBRE Group,02/09/2023,"Debt, Equity and Finance Rainmakers In CRE",still open
CBRE Group,02/09/2023,The Search for Clarity: Multifamily and Commercial Real Estate ...,still open
CBRE Group,02/09/2023,QuotedData’s Real Estate Monthly Roundup – February 2023,still open
CBRE Group,02/09/2023,"These 3 Real Estate Stocks Focus on Growth, Not Dividends",still open
CBRE Group,02/09/2023,3 Bill Nygren Stocks Fall Near 52-Week Lows,still open
CBRE Group,02/09/2023,This Favorable Sign Appears On CBRE Group's Chart - CBRE Group (NYSE:CBRE),still open
CBRE Group,02/09/2023,The future remains bright for industrial property,still open
CBRE Group,02/09/2023,CBRE to end most of its business in Russia (NYSE:CBRE),still open
CBRE Group,02/09/2023,Receiver lists Eyre Peninsula properties,still open
CBRE Group,02/09/2023,Vanguard Group Updates Holdings in CBRE Group (CBRE),still open
CBRE Group,02/09/2023,"CBRE Group Inc. Cl A stock falls Wednesday, underperforms market",still open
CBRE Group,02/09/2023,CBRE Global Real Estate Income Fund : Investment Management Expands Client Solutions Team with New Infrastructure Appointments in EMEA and APAC,still open
CBRE Group,02/09/2023,Validea Daily Guru Fundamental Report for CBRE - 2/8/2023,still open
CBRE Group,02/09/2023,CBRE Hospitality Co-Head Mark Owens Joins Colliers,still open
CBRE Group,02/09/2023,Is CBRE Group (CBRE) an Attractively Valued Stock?,still open
CBRE Group,02/09/2023,Should You Invest in CBRE Group (CBRE)?,still open
CBRE Group,02/09/2023,Global Group President of CBRE To Depart World's Largest Brokerage,still open
CBRE Group,02/09/2023,Should Investors Retain CBRE Group (CBRE) Stock for Now?,still open
CBRE Group,02/09/2023,"CBRE reports slowing lending pace in Q4, but optimism for ...",still open
CBRE Group,02/09/2023,"CBRE Group Inc. Cl A stock rises Tuesday, outperforms market",still open
CBRE Group,02/09/2023,CBRE Named Fortune Magazine’s Most Admired Real Estate Company,still open
CBRE Group,02/09/2023,CBRE Earns Place in Bloomberg Gender-Equality Index for Fourth ...,still open
CBRE Group,02/09/2023,Colliers Recruits Longtime CBRE Capital Markets Broker in Greater ...,still open
CBRE Group,02/09/2023,Civic Leader Joins CBRE as Managing Director,still open
CBRE Group,02/09/2023,Malvern's BluePearl Pet Hospital One of CBRE Mid-Atlantic Net ...,still open
CBRE Group,02/09/2023,"CBRE Group snags Buy rating, Jones Lang LaSalle started at ...",still open
CBRE Group,02/09/2023,CBRE Arranges $62.4M Acquisition Loan for Blakely Apartments in ...,still open
CBRE Group,02/09/2023,"CBRE IM Appoints Danny Queenan as CEO, Hires APAC Logistics ...",still open
CBRE Group,02/09/2023,Columbus office of CBRE names new vice chairman – REJournals,still open
CBRE Group,02/09/2023,"CBRE Group, Inc. (NYSE:CBRE) Receives Average Rating of ...",still open
CBRE Group,02/09/2023,CBRE Group Inc. Cl A stock outperforms market despite losses on the day,still open
CBRE Group,02/09/2023,CBRE/Buffalo's overview offers mixed views on WNY's real estate ...,still open
CBRE Group,02/09/2023,CBRE Inc. leaving longtime U.S. Bank Center home for BMO Tower,still open
CBRE Group,02/09/2023,Fitch Affirms CBRE Loan Services Primary Servicer Rating,still open
CBRE Group,02/09/2023,CBRE Brokers $20.5M Sale of Azusa Industrial Property -,still open
CBRE Group,02/09/2023,20 Most Valuable Real Estate Companies in the World,still open
CBRE Group,02/09/2023,Morgan Stanley Cuts Stake in CBRE Clarion Global Real Estate ...,still open
CBRE Group,02/09/2023,Fox Run Management L.L.C. Acquires Shares of 5914 CBRE Group ...,still open
CBRE Group,02/09/2023,Validea Daily Guru Fundamental Report for CBRE - 1/26/2023,still open
CBRE Group,02/09/2023,Forum Mobility and CBRE Investment Management Announce $400 ...,still open
CBRE Group,02/09/2023,"CBRE Group Inc. Cl A stock rises Thursday, outperforms market",still open
CBRE Group,02/09/2023,"CBRE Group Inc. Cl A stock rises Friday, outperforms market",still open
CBRE Group,02/09/2023,"'Megawarehouse' demand hits record highs in 2022, reports CBRE",still open
CBRE Group,02/09/2023,Houston Office Expert Jason Presley Leaves CBRE For Goodwin ...,still open
CBRE Group,02/09/2023,Citigroup Starts CBRE Group at Buy With $100 Price Target,still open
CBRE Group,02/09/2023,Soloviev Group Taps CBRE to Lease 9 W. 57th St. as It Undergoes ...,still open
