Name,Data,News,Evaluation
CBRE Group,02/06/2023,"CBRE Group, an S&P 500 company announces the findings of its latest retail report",still open
CBRE Group,02/06/2023,"These 3 Real Estate Stocks Focus on Growth, Not Dividends",still open
CBRE Group,02/06/2023,"CBRE Group Third Quarter 2022 Earnings: EPS Beats Expectations, Revenues Lag",still open
CBRE Group,02/06/2023,Receiver lists Eyre Peninsula properties,still open
CBRE Group,02/06/2023,3 Bill Nygren Stocks Fall Near 52-Week Lows,still open
CBRE Group,02/06/2023,CBRE to end most of its business in Russia (NYSE:CBRE),still open
CBRE Group,02/06/2023,IN BRIEF: Target Healthcare REIT says asset values hurt by rate hikes,still open
CBRE Group,02/06/2023,Altus Power surges as bullish Evercore ISI touts ties to CBRE ...,still open
CBRE Group,02/06/2023,"CBRE Pushes New Business Lines, Predicts Fourth-Quarter ...",still open
CBRE Group,02/06/2023,Jones Lang LaSalle (JLL) Stock Down on Q3 Earnings Miss,still open
CBRE Group,02/07/2023,"CBRE Group Inc. Cl A stock falls Monday, underperforms market",still open
CBRE Group,02/07/2023,Is CBRE Group (CBRE) an Attractively Valued Stock?,still open
CBRE Group,02/07/2023,Columbus office of CBRE names new vice chairman – REJournals,still open
CBRE Group,02/07/2023,Validea Daily Guru Fundamental Report for CBRE - 2/3/2023,still open
CBRE Group,02/07/2023,Global Group President of CBRE To Depart World's Largest Brokerage,still open
CBRE Group,02/07/2023,Should You Invest in CBRE Group (CBRE)?,still open
CBRE Group,02/07/2023,Colliers Recruits Longtime CBRE Capital Markets Broker in Greater ...,still open
CBRE Group,02/07/2023,CBRE Arranges $62.4M Acquisition Loan for Blakely Apartments in ...,still open
CBRE Group,02/07/2023,Should Investors Retain CBRE Group (CBRE) Stock for Now?,still open
CBRE Group,02/07/2023,CBRE Named Fortune Magazine’s Most Admired Real Estate Company,still open
CBRE Group,02/07/2023,"CBRE Group snags Buy rating, Jones Lang LaSalle started at ...",still open
CBRE Group,02/07/2023,CBRE Earns Place in Bloomberg Gender-Equality Index for Fourth ...,still open
CBRE Group,02/07/2023,Malvern's BluePearl Pet Hospital One of CBRE Mid-Atlantic Net ...,still open
CBRE Group,02/07/2023,CBRE Investment Management's CEO departs,still open
CBRE Group,02/07/2023,"Virtu Financial LLC Acquires New Shares in CBRE Group, Inc ...",still open
CBRE Group,02/07/2023,Fox Run Management L.L.C. Acquires Shares of 5914 CBRE Group ...,still open
CBRE Group,02/07/2023,Fitch Affirms CBRE Loan Services Primary Servicer Rating,still open
CBRE Group,02/07/2023,Industry Veteran Robert Blount Leaves JLL to Return to CBRE,still open
CBRE Group,02/07/2023,CBRE Group Inc. Cl A stock outperforms market despite losses on ...,still open
CBRE Group,02/07/2023,What's in the Cards for Kimco (KIM) This Earnings Season?,still open
CBRE Group,02/07/2023,CBRE looks to unload Michigan Avenue office tower,still open
CBRE Group,02/07/2023,Validea Daily Guru Fundamental Report for CBRE - 1/26/2023,still open
CBRE Group,02/07/2023,CBRE Global Real Estate Income Fund : Investment Management Fund Signs Agreement to Acquire Gateway Fiber,still open
CBRE Group,02/07/2023,CBRE Investment Management appoints Asia head for indirect ...,still open
CBRE Group,02/07/2023,This Favorable Sign Appears On CBRE Group's Chart,still open
CBRE Group,02/07/2023,"CBRE Group Inc. Cl A stock rises Friday, outperforms market",still open
CBRE Group,02/07/2023,"CBRE Group Inc. Cl A stock rises Thursday, outperforms market",still open
CBRE Group,02/07/2023,CBRE to move Milwaukee office to BMO Tower,still open
CBRE Group,02/07/2023,CBRE Leads U.S. Investment Sales Activity in 2022 for 17th Consecutive Year,still open
CBRE Group,02/07/2023,Citigroup Starts CBRE Group at Buy With $100 Price Target,still open
CBRE Group,02/07/2023,Soloviev Group Taps CBRE to Lease 9 W. 57th St. as It Undergoes ...,still open
CBRE Group,02/07/2023,Pzena Investment Management LLC Has $45.58 Million Stake in ...,still open
CBRE Group,02/07/2023,Company news: CBRE Syracuse hires Lawrence Papaleo,still open
CBRE Group,02/07/2023,Forum Mobility and CBRE Investment Management Announce $400 ...,still open
CBRE Group,02/07/2023,CBRE Arranges Sale of 65-Property Hotel Portfolio worth $514 Million,still open
CBRE Group,02/07/2023,Offices sit empty as vacancy rates hit all-time high in Q4: CBRE,still open
CBRE Group,02/07/2023,CBRE Survey: DFW is Nation's No. 1 Target for CRE Investment in ...,still open
CBRE Group,02/07/2023,Orion Real Estate Expands Utah Portfolio - Multifamily Real Estate ...,still open
CBRE Group,02/07/2023,CBRE Global Real Estate Income Fund : MEAG Expands the Munich Re U.S. Residential Portfolio,still open
CBRE Group,02/07/2023,CBRE Investment Management buys Berewick apartments for $63.7 ...,still open
CBRE Group,02/07/2023,Raymond James Maintains Strong Buy Rating for CBRE Group ...,still open
CBRE Group,02/07/2023,Brookfield Buys Inland Empire Logistics Center for $330M,still open
CBRE Group,02/07/2023,CBRE Upgrades Boyd Gaming (BYD),still open
CBRE Group,02/07/2023,Commercial Real Estate Lending Slows in Q4 2022,still open
CBRE Group,02/07/2023,"Raymond James Adjusts Price Target on CBRE to $101 From $105, Maintains Strong Buy Rating",still open
CBRE Group,02/07/2023,Olympus Group Real Estate and CBRE lease 20400 s/f to Rhode ...,still open
CBRE Group,02/07/2023,Offices sit empty across Triangle as sublease vacancy rates hit record highs,still open
CBRE Group,02/07/2023,CBRE Announces North American Winners for Its Supplier ...,still open
CBRE Group,02/07/2023,Is a Beat in Store for Regency (REG) This Earnings Season?,still open
CBRE Group,02/07/2023,CBRE brokers sale of Napa Valley resort,still open
CBRE Group,02/07/2023,CBRE Global Real Estate Income Fund (NYSE: IGR) Declares Monthly Distribution for January,still open
CBRE Group,02/07/2023,CBRE IM appoints APAC and EMEA heads of research,still open
CBRE Group,02/07/2023,Northwestern Mutual plans to bring 2K employees back to ...,still open
CBRE Group,02/07/2023,2023 Space Awards for Raleigh-Durham: Top real estate deals and ...,still open
CBRE Group,02/07/2023,"KBC Group NV Takes $542000 Position in Red Rock Resorts, Inc ...",still open
CBRE Group,02/07/2023,Meet the 2023 Power Leaders 250 – Part 4: Real Estate - South ...,still open
CBRE Group,02/07/2023,Newmark Group: Cheap For Valid Reasons (NASDAQ:NMRK),still open
CBRE Group,02/07/2023,Citigroup Initiates Coverage On CBRE Group with Buy Rating ...,still open
CBRE Group,02/07/2023,Oklahoma City has apartment building boom going on but for how ...,still open
CBRE Group,02/07/2023,CBRE Arranges $46.5M Sale of Larchmont Village Apartments,still open
CBRE Group,02/07/2023,"Private Capital, Regional and Local Banks Step Up to Make CRE Loans",still open
CBRE Group,02/07/2023,He Turned Wall Street Offices Into Homes. Now He Vows To ...,still open
CBRE Group,02/07/2023,U.S. Hotels State of the Union January 2023 Edition,still open
CBRE Group,02/07/2023,Financial Consultant Junto Capital Takes 25K in Midtown,still open
CBRE Group,02/07/2023,CBRE Hires Chan as China Capital Markets Head,still open
CBRE Group,02/07/2023,CBRE forecasts enhanced RevPAR growth in 2023 despite ...,still open
CBRE Group,02/07/2023,CBRE secures $42.7M in financing for 2 Phoenix-Mesa Gateway ...,still open
CBRE Group,02/07/2023,Gantry's Tim Storey talks commercial lending trends and what he's watching in 2023,still open
CBRE Group,02/07/2023,"NYC Deals of the Day: Feb. 7, 2023",still open
CBRE Group,02/07/2023,"Top Workplace/Interior Fitout Architecture, Engineering, and ...",still open
CBRE Group,02/07/2023,"Raymond James Maintains Strong Buy on CBRE Group, Lowers ...",still open
CBRE Group,02/07/2023,CBRE arranges lease renewal for Hishi Plastics USA in Lincoln Park,still open
CBRE Group,02/07/2023,Phoenix named one of top three industrial markets to watch in US,still open
CBRE Group,02/07/2023,"CBRE trades East Orange development site, Hue Soul, for $4.15M",still open
CBRE Group,02/07/2023,"Amid Fears Of A Recession, What’s Been Driving Demand For Multifamily Real Estate? - CBRE Group (NYSE:CBR",still open
CBRE Group,02/07/2023,CBRE arranges sale of 586-unit Stonebridge of Arlington Heights in ...,still open
CBRE Group,02/07/2023,"Leasing of industrial, logistics space highest in NCR in 2022 across top 8 cities: CBRE",still open
CBRE Group,02/07/2023,European CRE Acquires 247-Unit Class A Multifamily in Durham,still open
CBRE Group,02/07/2023,Grand Prairie Hotel and Carrollton warehouse add to recent commercial property sales,still open
CBRE Group,02/07/2023,Is a Beat in Store for Federal Realty (FRT) in Q4 Earnings?,still open
CBRE Group,02/07/2023,"Tuesday, February 7, 2023 | Daily Bulletin",still open
CBRE Group,02/07/2023,Tech Influencers,still open
CBRE Group,02/07/2023,Fashion designer Tanya Taylor launching first brick-and-mortar boutique,still open
CBRE Group,02/07/2023,Las Vegas Sands (NYSE:LVS) Rating Increased to Hold at ...,still open
CBRE Group,02/07/2023,"This Week's LA Deal Sheet (February 2, 2023)",still open
CBRE Group,02/07/2023,Boyd Gaming (NYSE:BYD) Issues Earnings Results,still open
CBRE Group,02/07/2023,"The Comeback King: For 40 Years, John Rogers Has Come Out Of ...",still open
CBRE Group,02/07/2023,Downtown Conversions Turn Aging Office Towers into New ...,still open
CBRE Group,02/07/2023,CP Group Announces 17786 SF in New Leasing at Two Town ...,still open
CBRE Group,02/07/2023,Polsinelli Law Firm Expands at 600 Third Avenue in Murray Hill,still open
CBRE Group,02/07/2023,World's Largest Brokerage Begins Cutting Costs as Capital Markets ...,still open
CBRE Group,02/07/2023,"Red Rock Resorts, Inc. (NASDAQ:RRR) Receives Average ...",still open
CBRE Group,02/07/2023,Day 3 of MSPBJ's 40 Under 40 honorees include HealthPartners ...,still open
CBRE Group,02/07/2023,A Check-In on the Hotel Sector’s ESG Initiatives,still open
CBRE Group,02/07/2023,M&A Into the Deep End — Mergers & Acquisitions,still open
CBRE Group,02/07/2023,CBRE Group: Now Is A Great Time To Buy Shares (NYSE:CBRE),still open
CBRE Group,02/07/2023,South Pier at Tempe Town Lake breaks ground - Phoenix Business ...,still open
CBRE Group,02/07/2023,Top 5 4th Quarter Trades of EVERENCE CAPITAL MANAGEMENT ...,still open
CBRE Group,02/07/2023,How CBRE Group Inc. is reexamining its own office space,still open
CBRE Group,02/07/2023,"Sonoma, Marin business leads from commercial real estate ...",still open
CBRE Group,02/07/2023,"CBRE Group Inc. Cl A stock falls Monday, underperforms market",still open
CBRE Group,02/07/2023,Is CBRE Group (CBRE) an Attractively Valued Stock?,still open
CBRE Group,02/07/2023,Should Investors Retain CBRE Group (CBRE) Stock for Now?,still open
CBRE Group,02/07/2023,Fox Run Management L.L.C. Acquires Shares of 5914 CBRE Group ...,still open
CBRE Group,02/07/2023,Validea Daily Guru Fundamental Report for CBRE - 2/3/2023,still open
CBRE Group,02/07/2023,"Virtu Financial LLC Acquires New Shares in CBRE Group, Inc ...",still open
CBRE Group,02/07/2023,Should You Invest in CBRE Group (CBRE)?,still open
CBRE Group,02/07/2023,"CBRE Group Inc. Cl A stock falls Tuesday, underperforms market",still open
CBRE Group,02/07/2023,"KBC Group NV Takes $542000 Position in Red Rock Resorts, Inc ...",still open
CBRE Group,02/07/2023,"CBRE Group Inc. Cl A stock rises Thursday, outperforms market",still open
CBRE Group,02/07/2023,"CBRE Group Inc. Cl A stock rises Friday, outperforms market",still open
CBRE Group,02/07/2023,Pzena Investment Management LLC Has $45.58 Million Stake in ...,still open
CBRE Group,02/07/2023,Newmark Group: Cheap For Valid Reasons (NASDAQ:NMRK),still open
CBRE Group,02/07/2023,Validea Daily Guru Fundamental Report for CBRE - 1/26/2023,still open
CBRE Group,02/07/2023,Tracking William Von Mueffling's Cantillon Capital Management ...,still open
CBRE Group,02/07/2023,Jefferies Financial Group Weighs in on Boyd Gaming Co.'s Q2 2023 ...,still open
CBRE Group,02/07/2023,Boyd Gaming (NYSE:BYD) Issues Earnings Results,still open
CBRE Group,02/07/2023,"Q1 2023 EPS Estimates for PENN Entertainment, Inc. (NASDAQ ...",still open
CBRE Group,02/07/2023,Las Vegas Sands (NYSE:LVS) Rating Increased to Hold at ...,still open
CBRE Group,02/07/2023,RMR Group (RMR) Q1 Earnings Lag Estimates,still open
CBRE Group,02/07/2023,"CBRE Group snags Buy rating, Jones Lang LaSalle started at ...",still open
CBRE Group,02/07/2023,Prudential Financial Inc. Has $2.74 Million Stake in Golden ...,still open
CBRE Group,02/07/2023,"The Comeback King: For 40 Years, John Rogers Has Come Out Of ...",still open
CBRE Group,02/07/2023,CBRE Named Fortune Magazine's Most Admired Real Estate Company,still open
CBRE Group,02/07/2023,CBRE Earns Place in Bloomberg Gender-Equality Index for Fourth ...,still open
CBRE Group,02/07/2023,This Favorable Sign Appears On CBRE Group's Chart,still open
CBRE Group,02/07/2023,CBRE Global Real Estate Income Fund : Investment Management Names Head of Asia Investments for Indirect Private Real Estate Strategies,still open
CBRE Group,02/07/2023,Do You Believe in the Long-Term Growth Opportunities of Jones Lang LaSalle Incorporated (JLL)?,still open
CBRE Group,02/07/2023,"Red Rock Resorts, Inc. (NASDAQ:RRR) Receives Average ...",still open
CBRE Group,02/07/2023,Citigroup Starts CBRE Group at Buy With $100 Price Target,still open
CBRE Group,02/07/2023,CBRE Global Real Estate Income Fund (NYSE: IGR) Declares Monthly Distribution for January,still open
CBRE Group,02/07/2023,Top 5 4th Quarter Trades of EVERENCE CAPITAL MANAGEMENT ...,still open
CBRE Group,02/07/2023,Commercial Real Estate Investors Not Shying Away From Retail ...,still open
CBRE Group,02/07/2023,"Benzinga's Top Ratings Upgrades, Downgrades For January 27, 2023",still open
CBRE Group,02/07/2023,CBRE Group: Now Is A Great Time To Buy Shares (NYSE:CBRE),still open
CBRE Group,02/07/2023,Offices sit empty as vacancy rates hit all-time high in Q4: CBRE,still open
CBRE Group,02/07/2023,What's in the Cards for Kimco (KIM) This Earnings Season?,still open
CBRE Group,02/07/2023,Jefferies Financial Group Weighs in on Las Vegas Sands Corp.'s Q3 ...,still open
CBRE Group,02/07/2023,CBRE Global Real Estate Income Fund : MEAG Expands the Munich Re U.S. Residential Portfolio,still open
CBRE Group,02/07/2023,Raymond James Maintains Strong Buy Rating for CBRE Group ...,still open
CBRE Group,02/07/2023,New York Developer Turns Empty Wall Street Offices Into Luxury ...,still open
CBRE Group,02/07/2023,"Raymond James Adjusts Price Target on CBRE to $101 From $105, Maintains Strong Buy Rating",still open
CBRE Group,02/07/2023,"Red Rock Resorts, Inc. (NASDAQ:RRR) Receives Average Rating of ...",still open
CBRE Group,02/07/2023,"29247 Shares in Red Rock Resorts, Inc. (NASDAQ:RRR) Purchased ...",still open
CBRE Group,02/07/2023,CBRE Announces North American Winners for Its Supplier Innovation Challenge,still open
CBRE Group,02/07/2023,Teacher Retirement System of Texas Purchases 42924 Shares of ...,still open
CBRE Group,02/07/2023,CBRE Arranges Sale of 65-Property Hotel Portfolio worth $514 Million; The properties are located in 27 states across the country,still open
CBRE Group,02/07/2023,Amazon and CBRE invest in electric trucking startup Forum Mobility,still open
CBRE Group,02/07/2023,Boyd Gaming (BYD) to Release Quarterly Earnings on Thursday,still open
CBRE Group,02/07/2023,"Xenia Hotels & Resorts, Inc. (NYSE:XHR) Given Average ...",still open
CBRE Group,02/07/2023,Jennison Associates LLC Acquires 263794 Shares of PENN ...,still open
CBRE Group,02/07/2023,PENN Entertainment (NASDAQ:PENN) Given New $45.00 Price ...,still open
CBRE Group,02/07/2023,CBRE Group Stock: Cyclical & Structural Headwinds (NYSE:CBRE),still open
CBRE Group,02/07/2023,Duality Advisers LP Invests $1.01 Million in Boyd Gaming Co ...,still open
CBRE Group,02/07/2023,"Elon Musk May Be Late On His San Francisco Rent, But The City Has Bigger Issues With Its Office Space",still open
CBRE Group,02/07/2023,Truist Financial downgrades Red Rock Resorts (NASDAQ:RRR) to ...,still open
CBRE Group,02/07/2023,"Metal, IT drag as Nifty ends 90 pts lower; Adani Ports gains 8% | Mint",still open
CBRE Group,02/07/2023,"Golden Entertainment, Inc. (NASDAQ:GDEN) Given Consensus ...",still open
CBRE Group,02/07/2023,Boyd Gaming Co. (NYSE:BYD) Shares Sold by Aptus Capital ...,still open
CBRE Group,02/07/2023,"CBRE Group, Inc.'s (NYSE:CBRE) Stock Is Going Strong: Is the Market Following Fundamentals?",still open
CBRE Group,02/07/2023,CBRE Group: High-Quality Company At A Fair Price (NYSE:CBRE),still open
CBRE Group,02/07/2023,Red Robin Gourmet Burgers Considering Sale-Leaseback Deal,still open
CBRE Group,02/07/2023,Glenmede Trust Co. NA Sells 113265 Shares of Piedmont Office ...,still open
CBRE Group,02/07/2023,Jefferies Financial Group has downgraded Golden Entertainment ...,still open
CBRE Group,02/07/2023,Is CBRE Group (CBRE) a Good Long-Term Investment?,still open
CBRE Group,02/07/2023,"CBRE Group (CBRE) Q3 Earnings & Revenues Lag, Stock Down",still open
CBRE Group,02/07/2023,Is a Beat in Store for Federal Realty (FRT) in Q4 Earnings?,still open
CBRE Group,02/07/2023,Meet the 2023 Power Leaders 250 – Part 4: Real Estate - South ...,still open
CBRE Group,02/07/2023,Empty Office Towers Show Remote-Work Pain Rippling Through ...,still open
CBRE Group,02/07/2023,Citigroup Initiates Coverage On CBRE Group with Buy Rating ...,still open
CBRE Group,02/07/2023,MainStay CBRE Global Infrastructure Megatrends Fund (NYSE ...,still open
CBRE Group,02/07/2023,Key Factors to Impact Simon Property (SPG) in Q4 Earnings,still open
CBRE Group,02/07/2023,"Monday’s Top Analyst Upgrades and Downgrades: Activision, Apple, Chewy, Etsy, General Mills, Las Vegas Sands, Steel Dynamics, Take-Two, Tesla, 3M and More",still open
CBRE Group,02/07/2023,"Why CBRE Group, Inc. (NYSE:CBRE) Could Be Worth Watching",still open
CBRE Group,02/07/2023,CRE deal volume could drop 15% in 2023; Realty Income to buy ...,still open
CBRE Group,02/07/2023,Hong Kong Tycoon's Seized Office Tower to Be Bought by PAG and ...,still open
CBRE Group,02/07/2023,"CBRE Group Inc. Cl A stock rises Tuesday, outperforms market",still open
CBRE Group,02/07/2023,Is a Beat in Store for Regency (REG) This Earnings Season?,still open
CBRE Group,02/07/2023,CBRE Group Inc. Cl A stock outperforms market on strong trading day,still open
CBRE Group,02/07/2023,"CBRE Group Inc. Cl A stock rises Tuesday, still underperforms market",still open
CBRE Group,02/07/2023,"CBRE Group Inc. Cl A stock rises Monday, outperforms market",still open
CBRE Group,02/07/2023,Prospera Financial Services Inc. Purchases a New Position in Boyd ...,still open
CBRE Group,02/07/2023,"CBRE Group Inc. Cl A stock rises Wednesday, outperforms market",still open
CBRE Group,02/07/2023,M&A Into the Deep End — Mergers & Acquisitions,still open
CBRE Group,02/07/2023,What's in the Offing for CBRE Group (CBRE) in Q3 Earnings?,still open
CBRE Group,02/07/2023,Macau gaming stocks gain traction on positive January GGR results,still open
CBRE Group,02/07/2023,Elon Musk Warns Of More Pain As Commercial Real Estate Prices ...,still open
CBRE Group,02/07/2023,"Possible bearish signals as CBRE Group, Inc. (NYSE:CBRE) insiders disposed of US$2.0m worth of stock",still open
CBRE Group,02/07/2023,"US Real Estate Appraisal Market Report to 2028: Key Players Include CoreLogic, The Accurate Group, Clear Capital and ServiceLink",still open
CBRE Group,02/07/2023,"CBRE Group, Inc. (CBRE) Q3 2022 Earnings Call Transcript",still open
CBRE Group,02/07/2023,"With EPS Growth And More, CBRE Group (NYSE:CBRE) Makes An Interesting Case",still open
CBRE Group,02/07/2023,10 Undervalued Stocks to Buy According to Billionaire Paul Tudor Jones,still open
CBRE Group,02/07/2023,"CBRE Group, an S&P 500 company announces the findings of its latest retail report",still open
CBRE Group,02/07/2023,"These 3 Real Estate Stocks Focus on Growth, Not Dividends",still open
CBRE Group,02/07/2023,Buying cheap might not be the REIT move,still open
CBRE Group,02/07/2023,"CBRE Group Third Quarter 2022 Earnings: EPS Beats Expectations, Revenues Lag",still open
CBRE Group,02/07/2023,Receiver lists Eyre Peninsula properties,still open
CBRE Group,02/07/2023,3 Bill Nygren Stocks Fall Near 52-Week Lows,still open
CBRE Group,02/07/2023,CBRE to end most of its business in Russia (NYSE:CBRE),still open
CBRE Group,02/07/2023,Altus Power surges as bullish Evercore ISI touts ties to CBRE ...,still open
CBRE Group,02/07/2023,"CBRE Group Inc. Cl A stock falls Monday, underperforms market",still open
CBRE Group,02/07/2023,Is CBRE Group (CBRE) an Attractively Valued Stock?,still open
CBRE Group,02/07/2023,Columbus office of CBRE names new vice chairman – REJournals,still open
CBRE Group,02/07/2023,Validea Daily Guru Fundamental Report for CBRE - 2/3/2023,still open
CBRE Group,02/07/2023,Global Group President of CBRE To Depart World's Largest Brokerage,still open
CBRE Group,02/07/2023,Should You Invest in CBRE Group (CBRE)?,still open
CBRE Group,02/07/2023,Colliers Recruits Longtime CBRE Capital Markets Broker in Greater ...,still open
CBRE Group,02/07/2023,CBRE Arranges $62.4M Acquisition Loan for Blakely Apartments in ...,still open
CBRE Group,02/07/2023,Should Investors Retain CBRE Group (CBRE) Stock for Now?,still open
CBRE Group,02/07/2023,CBRE Named Fortune Magazine’s Most Admired Real Estate Company,still open
CBRE Group,02/07/2023,"CBRE Group snags Buy rating, Jones Lang LaSalle started at ...",still open
CBRE Group,02/07/2023,CBRE Earns Place in Bloomberg Gender-Equality Index for Fourth ...,still open
CBRE Group,02/07/2023,Malvern's BluePearl Pet Hospital One of CBRE Mid-Atlantic Net ...,still open
CBRE Group,02/07/2023,CBRE Investment Management's CEO departs,still open
CBRE Group,02/07/2023,"Virtu Financial LLC Acquires New Shares in CBRE Group, Inc ...",still open
CBRE Group,02/07/2023,Fox Run Management L.L.C. Acquires Shares of 5914 CBRE Group ...,still open
CBRE Group,02/07/2023,Fitch Affirms CBRE Loan Services Primary Servicer Rating,still open
CBRE Group,02/07/2023,Industry Veteran Robert Blount Leaves JLL to Return to CBRE,still open
CBRE Group,02/07/2023,CBRE Group Inc. Cl A stock outperforms market despite losses on ...,still open
CBRE Group,02/07/2023,What's in the Cards for Kimco (KIM) This Earnings Season?,still open
CBRE Group,02/07/2023,CBRE looks to unload Michigan Avenue office tower,still open
CBRE Group,02/07/2023,Validea Daily Guru Fundamental Report for CBRE - 1/26/2023,still open
CBRE Group,02/07/2023,CBRE Global Real Estate Income Fund : Investment Management Fund Signs Agreement to Acquire Gateway Fiber,still open
CBRE Group,02/07/2023,CBRE Investment Management appoints Asia head for indirect ...,still open
CBRE Group,02/07/2023,This Favorable Sign Appears On CBRE Group's Chart,still open
CBRE Group,02/07/2023,"CBRE Group Inc. Cl A stock rises Friday, outperforms market",still open
CBRE Group,02/07/2023,"CBRE Group Inc. Cl A stock rises Thursday, outperforms market",still open
CBRE Group,02/07/2023,CBRE to move Milwaukee office to BMO Tower,still open
CBRE Group,02/07/2023,CBRE Leads U.S. Investment Sales Activity in 2022 for 17th Consecutive Year,still open
CBRE Group,02/07/2023,Citigroup Starts CBRE Group at Buy With $100 Price Target,still open
CBRE Group,02/07/2023,Soloviev Group Taps CBRE to Lease 9 W. 57th St. as It Undergoes ...,still open
CBRE Group,02/07/2023,Pzena Investment Management LLC Has $45.58 Million Stake in ...,still open
CBRE Group,02/07/2023,Company news: CBRE Syracuse hires Lawrence Papaleo,still open
CBRE Group,02/07/2023,Forum Mobility and CBRE Investment Management Announce $400 ...,still open
CBRE Group,02/07/2023,CBRE Arranges Sale of 65-Property Hotel Portfolio worth $514 Million,still open
CBRE Group,02/07/2023,Offices sit empty as vacancy rates hit all-time high in Q4: CBRE,still open
CBRE Group,02/07/2023,CBRE Survey: DFW is Nation's No. 1 Target for CRE Investment in ...,still open
CBRE Group,02/07/2023,Orion Real Estate Expands Utah Portfolio - Multifamily Real Estate ...,still open
CBRE Group,02/07/2023,CBRE Global Real Estate Income Fund : MEAG Expands the Munich Re U.S. Residential Portfolio,still open
CBRE Group,02/07/2023,CBRE Investment Management buys Berewick apartments for $63.7 ...,still open
CBRE Group,02/07/2023,Raymond James Maintains Strong Buy Rating for CBRE Group ...,still open
CBRE Group,02/07/2023,Brookfield Buys Inland Empire Logistics Center for $330M,still open
CBRE Group,02/07/2023,CBRE Upgrades Boyd Gaming (BYD),still open
CBRE Group,02/07/2023,Commercial Real Estate Lending Slows in Q4 2022,still open
CBRE Group,02/07/2023,"Raymond James Adjusts Price Target on CBRE to $101 From $105, Maintains Strong Buy Rating",still open
CBRE Group,02/07/2023,Olympus Group Real Estate and CBRE lease 20400 s/f to Rhode ...,still open
CBRE Group,02/07/2023,Offices sit empty across Triangle as sublease vacancy rates hit record highs,still open
CBRE Group,02/07/2023,CBRE Announces North American Winners for Its Supplier ...,still open
CBRE Group,02/07/2023,Is a Beat in Store for Regency (REG) This Earnings Season?,still open
CBRE Group,02/07/2023,CBRE brokers sale of Napa Valley resort,still open
CBRE Group,02/07/2023,CBRE Global Real Estate Income Fund (NYSE: IGR) Declares Monthly Distribution for January,still open
CBRE Group,02/07/2023,CBRE IM appoints APAC and EMEA heads of research,still open
CBRE Group,02/07/2023,Northwestern Mutual plans to bring 2K employees back to ...,still open
CBRE Group,02/07/2023,2023 Space Awards for Raleigh-Durham: Top real estate deals and ...,still open
