Name,Data,News,Evaluation
CBRE Group,02/11/2023,Columbus office of CBRE names new vice chairman – REJournals,still open
CBRE Group,02/11/2023,Fox Run Management L.L.C. Acquires Shares of 5914 CBRE Group ...,still open
CBRE Group,02/11/2023,Fitch Affirms CBRE Loan Services Primary Servicer Rating,still open
CBRE Group,02/11/2023,"CBRE Group Inc. Cl A stock rises Thursday, outperforms market",still open
CBRE Group,02/11/2023,Forum Mobility and CBRE Investment Management Announce $400 ...,still open
CBRE Group,02/11/2023,Altus Power Introduces Community Solar Partnership Program to ...,still open
CBRE Group,02/11/2023,CBRE Leads U.S. Investment Sales Activity in 2022 for 17th Consecutive Year,still open
CBRE Group,02/11/2023,"CBRE Group Inc. Cl A stock rises Friday, outperforms market",still open
CBRE Group,02/11/2023,Soloviev Group Taps CBRE to Lease 9 W. 57th St. as It Undergoes ...,still open
CBRE Group,02/11/2023,CBRE Global Real Estate Income Fund (NYSE: IGR) Declares Monthly Distribution for February - CBRE Clarion,still open
CBRE Group,02/11/2023,Five Ways To Leverage Investment in Electric Vehicle,still open
CBRE Group,02/11/2023,CBRE Arranges Sale of 65-Property Hotel Portfolio worth $514 Million,still open
CBRE Group,02/11/2023,Pzena Investment Management LLC Has $45.58 Million Stake in ...,still open
CBRE Group,02/11/2023,CBRE/Buffalo's overview offers mixed views on WNY's real estate ...,still open
CBRE Group,02/11/2023,"Keefe, Bruyette & Woods Downgrades CBRE Group to Market Perform From Outperform With $88 Price Target",still open
CBRE Group,02/11/2023,"Raymond James Adjusts Price Target on CBRE to $101 From $105, Maintains Strong Buy Rating",still open
CBRE Group,02/11/2023,"'Megawarehouse' demand hits record highs in 2022, reports CBRE",still open
CBRE Group,02/11/2023,CREC Awards for 2022,still open
CBRE Group,02/11/2023,CBRE Global Real Estate Income Fund : MEAG Expands the Munich Re U.S. Residential Portfolio,still open
CBRE Group,02/11/2023,"Cresa Expands Industrial Group, Lee & Associates Promotes ...",still open
CBRE Group,02/11/2023,Can’t get enough Dave & Buster’s? You can now try the Roblox version,still open
CBRE Group,02/11/2023,Olympus Group Real Estate and CBRE lease 20400 s/f to Rhode ...,still open
CBRE Group,02/11/2023,CBRE Arranges $62.4 Million Loan for Phased Acquisition of ...,still open
CBRE Group,02/11/2023,CBRE Announces North American Winners for Its Supplier ...,still open
CBRE Group,02/11/2023,20 Most Valuable Real Estate Companies in the World,still open
CBRE Group,02/11/2023,Commercial real estate deals from across the Oklahoma City metro ...,still open
CBRE Group,02/11/2023,CBRE Investment Management buys Berewick apartments for $63.7 ...,still open
CBRE Group,02/11/2023,Here are the top NYC i-sales of 2022,still open
CBRE Group,02/11/2023,Newmark and CBRE complete 30665 s/f lease for ASMPT AEi at ...,still open
CBRE Group,02/11/2023,US hotel revenues fully recover in 2022; Brookfield to sell Fla. hotel ...,still open
CBRE Group,02/11/2023,Commercial Real Estate Investors Not Shying Away From Retail Despite Companies Like Bed Bath & Beyond Closing Stores,still open
CBRE Group,02/11/2023,"Delray Beach Golf Course will be getting makeover, housing on land",still open
CBRE Group,02/11/2023,EQUITY COMMONWEALTH Management's Discussion and Analysis of Financial Condition and Results of Operations. (form 10-K),still open
CBRE Group,02/11/2023,CBRE Upgrades Boyd Gaming (BYD),still open
CBRE Group,02/11/2023,2023 Space Awards for Raleigh-Durham: Top real estate deals and ...,still open
CBRE Group,02/11/2023,Meet the 2023 Power Leaders 250 – Part 4: Real Estate - South ...,still open
CBRE Group,02/11/2023,U.S. Hotels State of the Union January 2023 Edition,still open
CBRE Group,02/11/2023,"Raymond James Maintains Strong Buy on CBRE Group, Lowers ...",still open
CBRE Group,02/11/2023,"The US Real Estate Appraisal Market Size, Key Players and Value to be Worth US $11.41 billion in 2028",still open
CBRE Group,02/11/2023,Top 5 4th Quarter Trades of CBRE INVESTMENT MANAGEMENT ...,still open
CBRE Group,02/11/2023,CBRE arranges lease renewal for Hishi Plastics USA in Lincoln Park,still open
CBRE Group,02/11/2023,Self-Storage Real Estate Acquisitions and Sales: February 2023,still open
CBRE Group,02/11/2023,Commercial real estate deal activity to shrink in 2023 as recession ...,still open
CBRE Group,02/11/2023,"CBRE trades East Orange development site, Hue Soul, for $4.15M",still open
CBRE Group,02/11/2023,Brookfield Buys Inland Empire Logistics Center for $330M,still open
CBRE Group,02/11/2023,Offices sit empty across Triangle as sublease vacancy rates hit record highs,still open
CBRE Group,02/11/2023,CBRE Hires Chan as China Capital Markets Head,still open
CBRE Group,02/11/2023,"Private Capital, Regional and Local Banks Step Up to Make Loans",still open
CBRE Group,02/11/2023,Esprit Leases 38K SF Office in Hudson Square,still open
CBRE Group,02/11/2023,What's in the Cards for Kimco (KIM) This Earnings Season?,still open
CBRE Group,02/11/2023,Orion Real Estate Partners acquires 144-unit active adult community ...,still open
CBRE Group,02/11/2023,MGM Resorts International (MGM) Q4 2022 Earnings Call Transcript,still open
CBRE Group,02/11/2023,Northwestern Mutual plans to bring 2K employees back to ...,still open
CBRE Group,02/11/2023,Empty Office Towers Show Remote-Work Pain Rippling Through ...,still open
CBRE Group,02/11/2023,"Red Rock Resorts, Inc. (NASDAQ:RRR) Receives Average ...",still open
CBRE Group,02/11/2023,Virtu Financial LLC Invests $202000 in Boyd Gaming Co. (NYSE:BYD),still open
CBRE Group,02/11/2023,Newmark Group: Cheap For Valid Reasons (NASDAQ:NMRK),still open
CBRE Group,02/11/2023,Oklahoma City has apartment building boom going on but for how ...,still open
CBRE Group,02/11/2023,2 Ways the Market's Underestimating Amazon in 2023,still open
CBRE Group,02/11/2023,New York Developer Turns Empty Wall Street Offices Into Luxury ...,still open
CBRE Group,02/11/2023,"KBC Group NV Takes $542000 Position in Red Rock Resorts, Inc ...",still open
CBRE Group,02/11/2023,"The Comeback King: For 40 Years, John Rogers Has Come Out Of ...",still open
CBRE Group,02/11/2023,World's Largest Brokerage Begins Cutting Costs as Capital Markets ...,still open
CBRE Group,02/11/2023,CBRE Group: Now Is A Great Time To Buy Shares (NYSE:CBRE),still open
CBRE Group,02/11/2023,Should Investors Retain CBRE Group (CBRE) Stock for Now?,still open
CBRE Group,02/11/2023,US open: Stocks lower as volatile week draws to a close | Financial ...,still open
CBRE Group,02/11/2023,"Facility Management Market Demand and Supply Analysis, Industry ...",still open
CBRE Group,02/11/2023,"Golden Entertainment, Inc. is owned by the New York State ...",still open
CBRE Group,02/11/2023,Post-Covid Manhattan office market rebound gaining momentum,still open
CBRE Group,02/11/2023,How CBRE Group Inc. is reexamining its own office space,still open
CBRE Group,02/11/2023,Is CBRE Group (CBRE) a Good Long-Term Investment?,still open
CBRE Group,02/11/2023,European real estate market faces wrecking ball amid falling ...,still open
CBRE Group,02/11/2023,AIF Institute Announces the Launch of its Center for Private Capital Investing and the Addition of Former Oklahoma Deputy State Treasurer Andrew Messer as its Executive Director,still open
CBRE Group,02/11/2023,A Check-In on the Hotel Sector’s ESG Initiatives,still open
CBRE Group,02/11/2023,"CBRE Group Inc. Cl A stock falls Friday, underperforms market",still open
CBRE Group,02/11/2023,Highlights from the Ratings and Financial Report for CBRE Group ...,still open
CBRE Group,02/11/2023,Boiling and ready to burst as CBRE Group Inc. (CBRE) last month ...,still open
CBRE Group,02/11/2023,Mitsubishi UFJ Trust & Banking Corp Boosts Stake in CBRE Group ...,still open
CBRE Group,02/11/2023,Vanguard Group Updates Holdings in CBRE Group (CBRE),still open
CBRE Group,02/11/2023,"Real Estate Stocks Moving Thursday: CIGI, NMRK, BEKE, CBRE, VINO, FLJ, ASPS, ARI",still open
CBRE Group,02/11/2023,Flputnam Investment Management Co. Reduces Stock Position in ...,still open
CBRE Group,02/11/2023,Validea Daily Guru Fundamental Report for CBRE - 2/3/2023,still open
CBRE Group,02/11/2023,Should You Invest in CBRE Group (CBRE)?,still open
CBRE Group,02/11/2023,Fox Run Management L.L.C. Acquires Shares of 5914 CBRE Group ...,still open
CBRE Group,02/11/2023,"CBRE Group Inc. Cl A stock falls Tuesday, underperforms market",still open
CBRE Group,02/11/2023,"CBRE Group Inc. Cl A stock rises Thursday, outperforms market",still open
CBRE Group,02/11/2023,"CBRE Group Inc. Cl A stock rises Friday, outperforms market",still open
CBRE Group,02/11/2023,"CBRE Group, Inc. (NYSE:CBRE) Stock Holdings Increased by ...",still open
CBRE Group,02/11/2023,CBRE Retains Top Spot in U.S. Investment Sales Activity in 2022,still open
CBRE Group,02/11/2023,Pzena Investment Management LLC Has $45.58 Million Stake in ...,still open
CBRE Group,02/11/2023,CBRE Global Real Estate Income Fund : Investment Management Expands Client Solutions Team with New Infrastructure Appointments in EMEA and APAC,still open
CBRE Group,02/11/2023,Virtu Financial LLC Invests $202000 in Boyd Gaming Co. (NYSE:BYD),still open
CBRE Group,02/11/2023,"CBRE Group snags Buy rating, Jones Lang LaSalle started at ...",still open
CBRE Group,02/11/2023,RMR Group (RMR) Q1 Earnings Lag Estimates,still open
CBRE Group,02/11/2023,"KBC Group NV Takes $542000 Position in Red Rock Resorts, Inc ...",still open
CBRE Group,02/11/2023,RK Capital Management LLC Has $11.75 Million Position in Golden ...,still open
CBRE Group,02/11/2023,"Red Rock Resorts, Inc. (NASDAQ:RRR) Receives Average ...",still open
CBRE Group,02/11/2023,Jefferies Financial Group Weighs in on Boyd Gaming Co.'s Q2 2023 ...,still open
CBRE Group,02/11/2023,Newmark Group: Cheap For Valid Reasons (NASDAQ:NMRK),still open
CBRE Group,02/11/2023,Boyd Gaming (NYSE:BYD) Issues Earnings Results,still open
CBRE Group,02/11/2023,"The Comeback King: For 40 Years, John Rogers Has Come Out Of ...",still open
CBRE Group,02/11/2023,Commercial real estate deal activity to shrink in 2023 as recession ...,still open
CBRE Group,02/11/2023,"Q1 2023 EPS Estimates for PENN Entertainment, Inc. (NASDAQ ...",still open
CBRE Group,02/11/2023,Las Vegas Sands (NYSE:LVS) Rating Increased to Hold at ...,still open
CBRE Group,02/11/2023,CBRE Named Fortune Magazine's Most Admired Real Estate Company,still open
CBRE Group,02/11/2023,16 Most Valuable Hotel Companies In The World,still open
CBRE Group,02/11/2023,2 Ways the Market's Underestimating Amazon in 2023,still open
CBRE Group,02/11/2023,EQUITY COMMONWEALTH Management's Discussion and Analysis of Financial Condition and Results of Operations. (form 10-K),still open
CBRE Group,02/11/2023,CBRE Global Real Estate Income Fund (NYSE: IGR) Declares Monthly Distribution for February - CBRE Clarion,still open
CBRE Group,02/11/2023,Analysts have reduced their earnings per share estimates for PENN ...,still open
CBRE Group,02/11/2023,"Golden Entertainment, Inc. is owned by Prudential Financial Inc. for ...",still open
CBRE Group,02/11/2023,Commercial Real Estate Investors Not Shying Away From Retail Despite Companies Like Bed Bath & Beyond Closing Stores,still open
CBRE Group,02/11/2023,"Keefe, Bruyette & Woods Downgrades CBRE Group to Market Perform From Outperform With $88 Price Target",still open
CBRE Group,02/11/2023,Should Investors Retain CBRE Group (CBRE) Stock for Now?,still open
CBRE Group,02/11/2023,CBRE Group: Now Is A Great Time To Buy Shares (NYSE:CBRE),still open
CBRE Group,02/11/2023,CBRE Arranges Sale of 65-Property Hotel Portfolio worth $514 Million; The properties are located in 27 states across the country,still open
CBRE Group,02/11/2023,"Benzinga's Top Ratings Upgrades, Downgrades For January 27, 2023",still open
CBRE Group,02/11/2023,"Raymond James Adjusts Price Target on CBRE to $101 From $105, Maintains Strong Buy Rating",still open
CBRE Group,02/11/2023,ProShare Advisors LLC Sells 32380 Shares of Las Vegas Sands ...,still open
CBRE Group,02/11/2023,Jones Lang LaSalle: Taking A More Cautious View (NYSE:JLL),still open
CBRE Group,02/11/2023,CBRE Global Real Estate Income Fund : MEAG Expands the Munich Re U.S. Residential Portfolio,still open
CBRE Group,02/11/2023,Jefferies Financial Group Weighs in on Las Vegas Sands Corp.'s Q3 ...,still open
CBRE Group,02/11/2023,Red Rock Resorts (RRR) Scheduled to Post Quarterly Earnings on ...,still open
CBRE Group,02/11/2023,CBRE Announces North American Winners for Its Supplier Innovation Challenge,still open
CBRE Group,02/11/2023,CBRE Group Stock: Cyclical & Structural Headwinds (NYSE:CBRE),still open
CBRE Group,02/11/2023,Teacher Retirement System of Texas Purchases 42924 Shares of ...,still open
CBRE Group,02/11/2023,Empty Office Towers Show Remote-Work Pain Rippling Through ...,still open
CBRE Group,02/11/2023,Boyd Gaming (BYD) to Release Quarterly Earnings on Thursday,still open
CBRE Group,02/11/2023,PENN Entertainment (NASDAQ:PENN) Given New $45.00 Price ...,still open
CBRE Group,02/11/2023,CBRE Group: High-Quality Company At A Fair Price (NYSE:CBRE),still open
CBRE Group,02/11/2023,"29247 Shares in Red Rock Resorts, Inc. (NASDAQ:RRR) Purchased ...",still open
CBRE Group,02/11/2023,"Brokerages have assigned a consensus rating of ""Moderate Buy"" to ...",still open
CBRE Group,02/11/2023,Boyd Gaming Co. (NYSE:BYD) Shares Sold by Aptus Capital ...,still open
CBRE Group,02/11/2023,"CBRE Group (CBRE) Q3 Earnings & Revenues Lag, Stock Down",still open
CBRE Group,02/11/2023,New York Developer Turns Empty Wall Street Offices Into Luxury ...,still open
CBRE Group,02/11/2023,Is CBRE Group (CBRE) a Good Long-Term Investment?,still open
CBRE Group,02/11/2023,"CBRE Group, Inc.'s (NYSE:CBRE) Stock Is Going Strong: Is the Market Following Fundamentals?",still open
CBRE Group,02/11/2023,Saudi real estate sees marked improvement in all sectors in 2022,still open
CBRE Group,02/11/2023,MainStay CBRE Global Infrastructure Megatrends Fund (NYSE ...,still open
CBRE Group,02/11/2023,MGM Resorts International (MGM) Q4 2022 Earnings Call Transcript,still open
CBRE Group,02/11/2023,"Why CBRE Group, Inc. (NYSE:CBRE) Could Be Worth Watching",still open
CBRE Group,02/11/2023,Is a Beat in Store for Federal Realty (FRT) in Q4 Earnings?,still open
CBRE Group,02/11/2023,Prospera Financial Services Inc. Purchases a New Position in Boyd ...,still open
CBRE Group,02/11/2023,"CBRE Group Inc. Cl A stock falls Monday, underperforms market",still open
CBRE Group,02/11/2023,CRE deal volume could drop 15% in 2023; Realty Income to buy ...,still open
CBRE Group,02/11/2023,"CBRE Group Inc. Cl A stock rises Tuesday, outperforms market",still open
CBRE Group,02/11/2023,"Raymond James Maintains Strong Buy on CBRE Group, Lowers ...",still open
CBRE Group,02/11/2023,What's in the Cards for Kimco (KIM) This Earnings Season?,still open
CBRE Group,02/11/2023,CBRE Group Inc. Cl A stock outperforms market on strong trading day,still open
CBRE Group,02/11/2023,"CBRE Group Inc. Cl A stock rises Tuesday, still underperforms market",still open
CBRE Group,02/11/2023,"Metal, IT drag as Nifty ends 90 pts lower; Adani Ports gains 8% | Mint",still open
CBRE Group,02/11/2023,M&A Into the Deep End — Mergers & Acquisitions,still open
CBRE Group,02/11/2023,What's in the Offing for CBRE Group (CBRE) in Q3 Earnings?,still open
CBRE Group,02/11/2023,"CBRE Group Inc. Cl A stock rises Wednesday, outperforms market",still open
CBRE Group,02/11/2023,"MGM Resorts soars, Entain slumps with buyout off the table",still open
CBRE Group,02/11/2023,Access Intelligence wins contracts around the world,still open
CBRE Group,02/11/2023,Downtown Conversions Turn Aging Office Towers into New ...,still open
CBRE Group,02/11/2023,"CBRE Group, Inc. (CBRE) Q3 2022 Earnings Call Transcript",still open
CBRE Group,02/11/2023,Why Some Executives Wish E.S.G. ‘Just Goes Away’,still open
CBRE Group,02/11/2023,"US Real Estate Appraisal Market Report to 2028: Key Players Include CoreLogic, The Accurate Group, Clear Capital and ServiceLink",still open
CBRE Group,02/11/2023,CBRE Group Inc. Cl A stock underperforms Wednesday when compared to competitors,still open
CBRE Group,02/11/2023,"Transcript : Rexford Industrial Realty, Inc., Q4 2022 Earnings Call, Feb 09, 2023",still open
CBRE Group,02/11/2023,Is a Beat in Store for Regency (REG) This Earnings Season?,still open
CBRE Group,02/11/2023,Economic trends that will continue to shape the real estate industry in 2023 | Mint,still open
CBRE Group,02/11/2023,"CBRE Group, an S&P 500 company announces the findings of its latest retail report",still open
CBRE Group,02/11/2023,10 Undervalued Stocks to Buy According to Billionaire Paul Tudor ...,still open
CBRE Group,02/11/2023,Dublin offices just 10% full on Mondays and Fridays - survey,still open
CBRE Group,02/11/2023,"These 3 Real Estate Stocks Focus on Growth, Not Dividends",still open
CBRE Group,02/11/2023,The Search for Clarity: Multifamily and Commercial Real Estate ...,still open
CBRE Group,02/11/2023,3 Bill Nygren Stocks Fall Near 52-Week Lows,still open
CBRE Group,02/11/2023,This Favorable Sign Appears On CBRE Group's Chart - CBRE Group (NYSE:CBRE),still open
CBRE Group,02/11/2023,CBRE to end most of its business in Russia (NYSE:CBRE),still open
CBRE Group,02/11/2023,Altus Power surges as bullish Evercore ISI touts ties to CBRE ...,still open
CBRE Group,02/11/2023,"Where to Invest $5,000 for the Next 5 Years",still open
CBRE Group,02/12/2023,CBRE Completes Two Leases at Central Park Business Center in ...,still open
CBRE Group,02/12/2023,Vanguard Group Updates Holdings in CBRE Group (CBRE),still open
CBRE Group,02/12/2023,"CBRE Group Inc. Cl A stock falls Friday, underperforms market",still open
CBRE Group,02/12/2023,Mitsubishi UFJ Trust & Banking Corp Boosts Stake in CBRE Group ...,still open
CBRE Group,02/12/2023,"Amalgamated Bank Has $5.90 Million Holdings in CBRE Group, Inc ...",still open
CBRE Group,02/12/2023,Industry Veteran Returns to CBRE as Vice Chair of DFW Advisory ...,still open
CBRE Group,02/12/2023,We Think CBRE Group (NYSE:CBRE) Can Stay On Top Of Its Debt,still open
CBRE Group,02/12/2023,Validea Daily Guru Fundamental Report for CBRE - 2/3/2023,still open
CBRE Group,02/12/2023,Global Group President of CBRE To Depart World's Largest Brokerage,still open
CBRE Group,02/12/2023,Should You Be Adding CBRE Group (NYSE:CBRE) To Your Watchlist Today?,still open
CBRE Group,02/12/2023,CBRE Earns Place in Bloomberg Gender-Equality Index for Fourth ...,still open
CBRE Group,02/12/2023,CBRE Hospitality Co-Head Mark Owens Joins Colliers,still open
CBRE Group,02/12/2023,CBRE Named Fortune Magazine's Most Admired Real Estate ...,still open
CBRE Group,02/12/2023,"CBRE Group snags Buy rating, Jones Lang LaSalle started at ...",still open
CBRE Group,02/12/2023,"Real Estate Stocks Moving Thursday: CIGI, NMRK, BEKE, CBRE, VINO, FLJ, ASPS, ARI",still open
CBRE Group,02/12/2023,Floridian Town Center in Orlando has Alabama partnerships ...,still open
CBRE Group,02/12/2023,CBRE Global Real Estate Income Fund : Investment Management Expands Client Solutions Team with New Infrastructure Appointments in EMEA and APAC,still open
CBRE Group,02/12/2023,"CBRE Group Inc. Cl A stock rises Tuesday, outperforms market",still open
CBRE Group,02/12/2023,Malvern's BluePearl Pet Hospital One of CBRE Mid-Atlantic Net ...,still open
CBRE Group,02/12/2023,"CBRE Group, Inc. (NYSE:CBRE) Shares Purchased by DekaBank ...",still open
CBRE Group,02/12/2023,CBRE Retains Top Spot in U.S. Investment Sales Activity in 2022,still open
CBRE Group,02/12/2023,"CBRE Group, Inc. (NYSE:CBRE) Receives Average Rating of ...",still open
CBRE Group,02/12/2023,CBRE Group Inc. Cl A stock outperforms market despite losses on the day,still open
CBRE Group,02/12/2023,CBRE Inc. leaving longtime U.S. Bank Center home for BMO Tower,still open
CBRE Group,02/12/2023,Colliers Recruits Longtime CBRE Capital Markets Broker in Greater ...,still open
CBRE Group,02/12/2023,This Favorable Sign Appears On CBRE Group's Chart - CBRE Group (NYSE:CBRE),still open
CBRE Group,02/12/2023,Forum Mobility and CBRE Investment Management Announce $400 ...,still open
CBRE Group,02/12/2023,Fox Run Management L.L.C. Acquires Shares of 5914 CBRE Group ...,still open
CBRE Group,02/12/2023,Five Ways To Leverage Investment in Electric Vehicle,still open
CBRE Group,02/12/2023,Fitch Affirms CBRE Loan Services Primary Servicer Rating,still open
CBRE Group,02/12/2023,CBRE Arranges Sale of 65-Property Hotel Portfolio worth $514 Million,still open
CBRE Group,02/12/2023,Columbus office of CBRE names new vice chairman – REJournals,still open
CBRE Group,02/12/2023,"CBRE Group Inc. Cl A stock falls Wednesday, underperforms market",still open
CBRE Group,02/12/2023,Soloviev Group Taps CBRE to Lease 9 W. 57th St. as It Undergoes ...,still open
CBRE Group,02/12/2023,Altus Power Introduces Community Solar Partnership Program to ...,still open
CBRE Group,02/12/2023,Pzena Investment Management LLC Has $45.58 Million Stake in ...,still open
CBRE Group,02/12/2023,People moves: Tandean heads CBRE IM Asia indirect private real ...,still open
CBRE Group,02/12/2023,"Raymond James Adjusts Price Target on CBRE to $101 From $105, Maintains Strong Buy Rating",still open
CBRE Group,02/12/2023,"Keefe, Bruyette & Woods Downgrades CBRE Group to Market Perform From Outperform With $88 Price Target",still open
CBRE Group,02/12/2023,CBRE Survey: DFW is Nation's No. 1 Target for CRE Investment in ...,still open
CBRE Group,02/12/2023,Houston Office Expert Jason Presley Leaves CBRE For Goodwin ...,still open
CBRE Group,02/12/2023,CBRE/Buffalo's overview offers mixed views on WNY's real estate ...,still open
CBRE Group,02/12/2023,CBRE Global Real Estate Income Fund : MEAG Expands the Munich Re U.S. Residential Portfolio,still open
CBRE Group,02/12/2023,CBRE: Commercial Real Estate Lending Slowed in Q4 2022,still open
CBRE Group,02/12/2023,"'Megawarehouse' demand hits record highs in 2022, reports CBRE",still open
CBRE Group,02/12/2023,CBRE Announces North American Winners for Its Supplier ...,still open
CBRE Group,02/12/2023,IBE Trade Scores Wall Street Office Tenant,still open
CBRE Group,02/12/2023,CBRE Investment Management buys Berewick apartments for $63.7 ...,still open
CBRE Group,02/12/2023,Commercial Real Estate Investors Not Shying Away From Retail Despite Companies Like Bed Bath & Beyond Closing Stores,still open
CBRE Group,02/12/2023,20 Most Valuable Real Estate Companies in the World,still open
CBRE Group,02/12/2023,"Golden Entertainment, Inc. (NASDAQ:GDEN) Stock Position ...",still open
CBRE Group,02/12/2023,Here are the top NYC i-sales of 2022,still open
CBRE Group,02/12/2023,Commercial real estate deals from across the Oklahoma City metro ...,still open
CBRE Group,02/12/2023,"Raymond James Maintains Strong Buy on CBRE Group, Lowers ...",still open
CBRE Group,02/12/2023,Can’t get enough Dave & Buster’s? You can now try the Roblox version,still open
CBRE Group,02/12/2023,US hotel revenues fully recover in 2022; Brookfield to sell Fla. hotel ...,still open
CBRE Group,02/12/2023,CBRE arranges lease renewal for Hishi Plastics USA in Lincoln Park,still open
CBRE Group,02/12/2023,Commercial real estate deal activity to shrink in 2023 as recession ...,still open
CBRE Group,02/12/2023,"CBRE trades East Orange development site, Hue Soul, for $4.15M",still open
CBRE Group,02/12/2023,EQUITY COMMONWEALTH Management's Discussion and Analysis of Financial Condition and Results of Operations. (form 10-K),still open
CBRE Group,02/12/2023,"Delray Beach Golf Course will be getting makeover, housing on land",still open
CBRE Group,02/12/2023,"Weekly roundup of people news, Feb 10 | Moves",still open
CBRE Group,02/12/2023,"NYC Deals of the Day: Feb. 10, 2023",still open
CBRE Group,02/12/2023,CBRE Hires Chan as China Capital Markets Head,still open
CBRE Group,02/12/2023,Self-Storage Real Estate Acquisitions and Sales: February 2023,still open
CBRE Group,02/12/2023,Offices sit empty across Triangle as sublease vacancy rates hit record highs,still open
CBRE Group,02/12/2023,Empty Office Towers Show Remote-Work Pain Rippling Through ...,still open
CBRE Group,02/12/2023,Brookfield Properties sells Diplomat Beach Resort for $835M,still open
CBRE Group,02/12/2023,"Private Capital, Regional and Local Banks Step Up to Make Loans",still open
CBRE Group,02/12/2023,What's in the Cards for Kimco (KIM) This Earnings Season?,still open
CBRE Group,02/12/2023,Top 5 4th Quarter Trades of CBRE INVESTMENT MANAGEMENT ...,still open
CBRE Group,02/12/2023,"Cubist Systematic Strategies LLC sells 17,422 Independence Realty ...",still open
CBRE Group,02/12/2023,"Nine Must Reads for CRE Investors on Jan. 27, 2022",still open
CBRE Group,02/12/2023,Northwestern Mutual plans to bring 2K employees back to ...,still open
CBRE Group,02/12/2023,Office makeover at former Raleigh HQ signs first tenant – a preppy apparel brand,still open
CBRE Group,02/12/2023,Rockefeller Group sells Burlington County distribution center for $83M,still open
CBRE Group,02/12/2023,2 Ways the Market's Underestimating Amazon in 2023,still open
CBRE Group,02/12/2023,Esprit Leases 38K SF Office in Hudson Square,still open
CBRE Group,02/12/2023,ioXt Alliance Expands IoT Certification Program to Include Building ...,still open
CBRE Group,02/12/2023,World's Largest Brokerage Begins Cutting Costs as Capital Markets ...,still open
CBRE Group,02/12/2023,Virtu Financial LLC Invests $202000 in Boyd Gaming Co. (NYSE:BYD),still open
CBRE Group,02/12/2023,"KBC Group NV Takes $542000 Position in Red Rock Resorts, Inc ...",still open
