Name,Data,News,Evaluation
Celgene Corp.,02/05/2023,"Celgene, sold for $74 billion, leaves a legacy of chutzpah in science ...",still open
Celgene Corp.,02/05/2023,Celgene aims to quell growth worries with $7B Impact deal,still open
Celgene Corp.,02/05/2023,Celgene Corporation Announces Appointment of Dr. Alise Reicin to ...,still open
Celgene Corp.,02/05/2023,'Major blunder': Ex-staffers blast Bristol Myers Squibb's handling of ...,still open
Celgene Corp.,02/05/2023,Celgene Corporation: How to Effectively Buy Into CELG Stock,still open
Celgene Corp.,02/05/2023,Osteogenesis Imperfecta Treatment Market Size Is Estimated To ...,still open
Celgene Corp.,02/05/2023,Celgene calls it quits on expensive Crohn's drug,still open
Celgene Corp.,02/05/2023,There's No Joy In Biotech. Mighty Celgene Just Struck Out,still open
Celgene Corp.,02/05/2023,Kyn Therapeutics Enters into Global Strategic Collaboration with ...,still open
Celgene Corp.,02/05/2023,Skyhawk Therapeutics Announces Strategic Collaboration with ...,still open
Celgene Corp.,02/05/2023,Acute Myeloid Leukemia Pipeline Experiences Momentum ...,still open
Celgene Corp.,02/05/2023,Celgene and Acceleron Announce Luspatercept Achieved Primary ...,still open
Celgene Corp.,02/05/2023,Celgene to pay Mylan $62 million to resolve cancer drug antitrust case,still open
Celgene Corp.,02/05/2023,"Celgene, Bristol-Myers set $2.2 billion termination fee for their mega ...",still open
Celgene Corp.,02/05/2023,Celgene to pay $280 million to settle off-label marketing case,still open
Celgene Corp.,02/05/2023,Nearly One Year Post-Celgene: BMS CMO On Pipeline Progress ...,still open
Celgene Corp.,02/05/2023,"Celgene Completes Acquisition of Juno Therapeutics, Inc ...",still open
Celgene Corp.,02/05/2023,"Nimbus, Bristol-Myers Drop Psoriasis Drug Dispute",still open
Celgene Corp.,02/05/2023,Why Celgene's Beaten Down Stock Can Rise 28%,still open
Celgene Corp.,02/05/2023,Sun Pharma settles patent litigation with Celgene Corporation for cancer drug Revlimid,still open
Celgene Corp.,02/05/2023,Celgene-backed CRISPR company emerges with $68M Series A,still open
Celgene Corp.,02/05/2023,Celgene notches positive Otezla data in scalp psoriasis as it guns ...,still open
Celgene Corp.,02/05/2023,It had to happen: Ex-Celgene shareholders sue Bristol Myers ...,still open
Celgene Corp.,02/05/2023,Myelodysplastic Syndrome (MDS) Treatment Market is estimated to ...,still open
Celgene Corp.,02/05/2023,Facebook Legal Vets Jump to Shopify Amid Meta Leadership ...,still open
Celgene Corp.,02/05/2023,Dragonfly Therapeutics Announces Strategic Collaboration with ...,still open
Celgene Corp.,02/05/2023,"Celgene to Acquire Delinia, Inc.",still open
Celgene Corp.,02/05/2023,Celgene repeatedly raised Revlimid's price to hit aggressive sales ...,still open
Celgene Corp.,02/05/2023,Celgene to buy Abraxis BioScience for $2.9 billion,still open
Celgene Corp.,02/05/2023,Celgene's drug for anemia in beta thalassemia priced at $3441/ 25 ...,still open
Celgene Corp.,02/05/2023,Idhifa approval furthers Celgene's diversification goals,still open
Celgene Corp.,02/05/2023,"With 1.7% CAGR, Novel Drug Delivery Systems Market (New Report) Size is expected to reach USD 27380 Million by",still open
Celgene Corp.,02/05/2023,ACCC delivers bitter pill on patent settlement,still open
Celgene Corp.,02/05/2023,Acceleron Pharma Announces Global Collaboration with Celgene ...,still open
Celgene Corp.,02/05/2023,Regenacy Pharmaceuticals to be Launched by Acetylon ...,still open
Celgene Corp.,02/05/2023,UPDATE 2-Celgene to invest $1 bln in Juno to partner in cancer ...,still open
Celgene Corp.,02/05/2023,Drug Buyers 'Astounded' As Celgene Axes $55M Antitrust Deal,still open
Celgene Corp.,02/05/2023,BRIEF-Celgene says CEO's 2016 compensation was $16.5 mln,still open
Celgene Corp.,02/05/2023,IMIDomics SL and Celgene Corporation Enter into Strategic ...,still open
Celgene Corp.,02/05/2023,BMS/Celgene deal will create haematology powerhouse BMS ...,still open
Celgene Corp.,02/05/2023,Celgene Pays Exscientia $25 Million up Front for 3-Year AI ...,still open
Celgene Corp.,02/05/2023,How Bad Is Celgene's FDA Foul-Up? Two Decades Of Biotech History Say It Can't Be Good,still open
Celgene Corp.,02/05/2023,Jounce Therapeutics Announces Major Strategic Collaboration with ...,still open
Celgene Corp.,02/05/2023,Grant & Eisenhofer settles fee fight with Celgene whistleblower,still open
Celgene Corp.,02/05/2023,"Stock Watch: J.P. Morgan Conference, Big Splash News And Stock ...",still open
Celgene Corp.,02/05/2023,"Kessler Topaz Meltzer & Check, LLP Announces Pendency of Class ...",still open
Celgene Corp.,02/05/2023,Celgene Corporation: How to Effectively Buy Into CELG Stock,still open
Celgene Corp.,02/05/2023,"Geron says blood cancer drug succeeds in late-stage study, shares ...",still open
Celgene Corp.,02/05/2023,Bristol-Myers Must Face Celgene Deal Suit In NJ State Court,still open
Celgene Corp.,02/05/2023,Bristol-Myers Squibb's $74 billion acquisition of Celgene would combine two troubled companies,still open
Celgene Corp.,02/05/2023,"Bristol-Myers Squibb Completes Acquisition of Celgene, Creating a ...",still open
Celgene Corp.,02/05/2023,Why Celgene's Beaten Down Stock Can Rise 28%,still open
Celgene Corp.,02/05/2023,Celgene Stock History: The Biotech's Path to Gigantic Gains,still open
Celgene Corp.,02/05/2023,15 Most Creative Companies In The World,still open
Celgene Corp.,02/05/2023,How Celgene's Big Acquisition Could Fire Up Its Stock,still open
Celgene Corp.,02/05/2023,Bristol Myers to Buy Turning Point Therapeutics in $4.1 Billion Oncology Deal,still open
Celgene Corp.,02/05/2023,"BioMarin Appoints Former CEO of Celgene Corporation, Mark Alles ...",still open
Celgene Corp.,02/05/2023,Is Celgene A Growth Or A Value Stock? (NASDAQ:CELG),still open
Celgene Corp.,02/05/2023,Sun Pharma settles patent litigation with Celgene Corporation for cancer drug Revlimid,still open
Celgene Corp.,02/05/2023,Celgene to buy Juno for $9 billion to boost cancer pipeline,still open
Celgene Corp.,02/05/2023,Starboard joins opposition to Bristol-Myers' $74 billion Celgene deal,still open
Celgene Corp.,02/05/2023,Global T-Cell Lymphoma Market Size to grow USD 3390.6 Million by 2030 | CAGR of 8.50%,still open
Celgene Corp.,02/05/2023,Celgene Reports Third Quarter 2019 Operating and Financial Results,still open
Celgene Corp.,02/05/2023,Facebook Legal Vets Jump to Shopify Amid Meta Leadership ...,still open
Celgene Corp.,02/05/2023,Starboard abandons campaign to scuttle Bristol-Myers-Celgene deal,still open
Celgene Corp.,02/05/2023,7 Life Science Stocks to Buy Today,still open
Celgene Corp.,02/05/2023,Juno Therapeutics: What The Celgene Potential Acquisition ...,still open
Celgene Corp.,02/05/2023,"Celgene's 2% Share Decline May Be Due To Disappointing 2020 Guidance, Analyst Says",still open
Celgene Corp.,02/05/2023,Celgene's Stock Is Fairly Valued Even In Worst-Case Revlimid ...,still open
Celgene Corp.,02/05/2023,Vividion Therapeutics Announces Strategic Research Collaboration ...,still open
Celgene Corp.,02/05/2023,There's No Joy In Biotech. Mighty Celgene Just Struck Out,still open
Celgene Corp.,02/05/2023,"Former Celgene, Portola Lawyers Land New Big Pharma Roles",still open
Celgene Corp.,02/05/2023,Amgen stock pops after company agrees to buy Celgene’s blockbuster anti-inflammatory drug Otezla,still open
Celgene Corp.,02/05/2023,Celgene (CELG) Updates on R&D Deep Dive (Multiple Myeloma ...,still open
Celgene Corp.,02/05/2023,"Celgene Completes Acquisition of Juno Therapeutics, Inc ...",still open
Celgene Corp.,02/05/2023,Bristol-Myers/Celgene: Win-Win Merger (NASDAQ:CELG),still open
Celgene Corp.,02/05/2023,Celgene and Acceleron Announce Luspatercept Achieved Primary ...,still open
Celgene Corp.,02/05/2023,Celgene to Pay $280 Million to Settle Fraud Suit Over Cancer Drugs,still open
Celgene Corp.,02/05/2023,Celgene Corporation 2017 Q3 - Results - Earnings Call Slides ...,still open
Celgene Corp.,02/05/2023,"Behcet's Syndrome Market Generated Opportunities, Future Scope ...",still open
Celgene Corp.,02/05/2023,"Why Celgene Corporation (CELG), Centurylink Inc (CTL) and ...",still open
Celgene Corp.,02/05/2023,Celgene And Biogen Earnings Could Make Or Break The Biotech ...,still open
Celgene Corp.,02/05/2023,"Biotech Stock Roundup: Celgene in Immuno-Oncology Deal, Zafgen Drops Lead Drug",still open
Celgene Corp.,02/05/2023,Juno Therapeutics Reports Third Quarter 2017 Financial Results,still open
Celgene Corp.,02/05/2023,Skyhawk Therapeutics Announces Strategic Collaboration with ...,still open
Celgene Corp.,02/05/2023,UPDATE 2-Celgene to invest $1 bln in Juno to partner in cancer ...,still open
Celgene Corp.,02/05/2023,These Juno investors will cash out big in Celgene's $9 billion ...,still open
Celgene Corp.,02/05/2023,Sun Pharma’s Revlimid drug patent settlement does not enthuse Street | Mint,still open
Celgene Corp.,02/05/2023,Celgene Corporation: Fast Growing Drugs About to Become ...,still open
Celgene Corp.,02/05/2023,"Stock Market News for January 20, 2016",still open
Celgene Corp.,02/05/2023,Celularity: Celgene Spin-Off Developing Allogeneic Therapies ...,still open
Celgene Corp.,02/05/2023,Celularity and GX Acquisition Corp. Announce Merger Agreement to ...,still open
Celgene Corp.,02/05/2023,Why It's Time That Markets Assign More Value To Celgene's Drug ...,still open
Celgene Corp.,02/05/2023,Nearly One Year Post-Celgene: BMS CMO On Pipeline Progress ...,still open
Celgene Corp.,02/05/2023,Wachtell Dealmaker Edward Lee Jumps to Kirkland in New York (1),still open
Celgene Corp.,02/05/2023,Bristol-Myers: Fattening Up The Pipeline With Celgene (NYSE:BMY),still open
Celgene Corp.,02/05/2023,Cipla Gains Nearly 5% On Settlement of US Patent Litigation,still open
Celgene Corp.,02/05/2023,Celgene Reports Fourth Quarter and Full-Year 2016 Operating and ...,still open
Celgene Corp.,02/05/2023,These 17 stocks may be tasty for bottom-feeding investors,still open
Celgene Corp.,02/05/2023,Dragonfly Therapeutics Announces Strategic Collaboration with ...,still open
Celgene Corp.,02/05/2023,Antengene Corporation Appoints Former Celgene ANZ General ...,still open
Celgene Corp.,02/05/2023,First Week of CELG November 20th Options Trading,still open
Celgene Corp.,02/05/2023,Should You Own Celgene In 2017? Part 1 (NASDAQ:CELG),still open
Celgene Corp.,02/05/2023,Celgene: Will Tremfya Punish Otezla Too? (NASDAQ:CELG),still open
Celgene Corp.,02/05/2023,Can-Fite Biopharma: A Possible Threat To Celgene? (NASDAQ ...,still open
Celgene Corp.,02/05/2023,AbbVie + Allergan: Where Are The Synergies?,still open
Celgene Corp.,02/05/2023,The Stumbling Blocks Of Celgene-Dependent Acceleron And Why ...,still open
Celgene Corp.,02/05/2023,What It's Like Inside America’s Best Employer,still open
Celgene Corp.,02/05/2023,"Stock Market News for November 11, 2014 - Market News",still open
Celgene Corp.,02/05/2023,Celgene takes a punt on M&A | Business,still open
Celgene Corp.,02/05/2023,News,still open
Celgene Corp.,02/05/2023,Should You Own Celgene In 2017? Part 4 (NASDAQ:CELG),still open
Celgene Corp.,02/05/2023,10 Most-Loved Stocks in Hedge Funds: Goldman's VIP List,still open
Celgene Corp.,02/05/2023,Should You Own Celgene In 2017? Part 2 (NASDAQ:CELG),still open
Celgene Corp.,02/05/2023,Acceleron And Celgene Deliver Strong Results In The Phase 3 ...,still open
Celgene Corp.,02/05/2023,Cadila Health settles patents case with US firm over anti-cancer drug Revlimid | Mint,still open
Celgene Corp.,02/05/2023,Should You Own Celgene In 2017? Part 6 (NASDAQ:CELG),still open
Celgene Corp.,02/05/2023,US STOCKS Wall St at record levels after Trump signs fiscal aid bill,still open
Celgene Corp.,02/05/2023,Celgene research leader Dr. Rupert Vessey joins Juno board ...,still open
Celgene Corp.,02/05/2023,Celgene slips as FDA refuses to review critical multiple sclerosis ...,still open
Celgene Corp.,02/05/2023,Lycera Announces Celgene Has Exercised its Option to License ...,still open
Celgene Corp.,02/05/2023,An Investing Overview of the Multiple Sclerosis Market,still open
Celgene Corp.,02/05/2023,Should You Own Celgene In 2017? Part 7 (NASDAQ:CELG),still open
Celgene Corp.,02/05/2023,"From Nightmare Drug to Celgene Blockbuster, Thalidomide Is Back",still open
Celgene Corp.,02/05/2023,My 2 Cents On The Ozanimod Saga (NASDAQ:CELG),still open
Celgene Corp.,02/05/2023,Lilly makes $8 billion bet on drugs for rare cancers with Loxo Oncology buy,still open
Celgene Corp.,02/05/2023,"Pharmion CEO will stay in Colo., start another biotech - Denver ...",still open
Celgene Corp.,02/05/2023,"What Are Drag-Along Rights? Meaning, Benefits, and Example",still open
Celgene Corp.,02/05/2023,Amgen Completes Acquisition Of Otezla® (apremilast),still open
Celgene Corp.,02/05/2023,US STOCKS S&P 500 set for worst day in a month on fresh virus fears,still open
Celgene Corp.,02/05/2023,UK's NICE says cost of Celgene's Abraxane is not justified by its ...,still open
Celgene Corp.,02/05/2023,"VentiRx Pharmaceuticals Announces Exclusive, Strategic ...",still open
Celgene Corp.,02/05/2023,A Look At What Some of Big Pharma's Top Lawyers Earned in 2019,still open
Celgene Corp.,02/05/2023,3 Biotech Stocks to Buy Right Now,still open
Celgene Corp.,02/05/2023,Celgene appoints Marie-France Tschudin and Stefano Portolano to ...,still open
Celgene Corp.,02/05/2023,ANALYSIS: U.S. M&A Mega Year in Review,still open
Celgene Corp.,02/05/2023,Billionaire Ray Dalio's Bridgewater Bets Big on ETFs: 13F Filing,still open
Celgene Corp.,02/05/2023,5 Attractive Biotechnology Stocks For Healthy Long-Term Returns,still open
Celgene Corp.,02/05/2023,US STOCKS Wall Street edges higher on recovery outlook,still open
Celgene Corp.,02/05/2023,Celgene and IBM Watson Health Forge Collaboration Designed to ...,still open
Celgene Corp.,02/05/2023,"BMY Stock Forecast, Price & News (Bristol-Myers Squibb)",still open
