Name,Data,News,Evaluation
Chevron Corp.,02/13/2023,Business lobby rips Biden's stock buyback tax plan,still open
Chevron Corp.,02/13/2023,Valero Energy Corp. stock outperforms market despite losses on the day,still open
Chevron Corp.,02/13/2023,"Hess Corp. stock rises Monday, still underperforms market",still open
Chevron Corp.,02/13/2023,Hess Corp. stock outperforms market despite losses on the day,still open
Chevron Corp.,02/13/2023,COHEN LAWRENCE B Goes on Buying Spree in 4th Quarter,still open
Chevron Corp.,02/13/2023,President Biden calls out stock buybacks in State of the Union address,still open
Chevron Corp.,02/13/2023,Ask the Rational Investor: Chevron's $75 billion buyback,still open
Chevron Corp.,02/13/2023,Chevron Explores Algerian Gas Plans Amid Russian Sanctions - WSJ,still open
Chevron Corp.,02/13/2023,15 Most Undervalued Value Stocks To Buy According To Hedge Funds,still open
Chevron Corp.,02/13/2023,CVX Named Top 25 SAFE Dividend Stock Increasing Payments For ...,still open
Chevron Corp.,02/13/2023,12 Cheap Monthly Dividend Stocks To Buy,still open
Chevron Corp.,02/13/2023,11 Undervalued Dividend Aristocrats To Buy Now,still open
Chevron Corp.,02/13/2023,"Chevron Corp. stock falls Wednesday, underperforms market",still open
Chevron Corp.,02/13/2023,Big Oil Faces Headwinds After Record $199 Billion Profit Haul,still open
Chevron Corp.,02/13/2023,"Chevron Corp. stock falls Tuesday, underperforms market",still open
Chevron Corp.,02/13/2023,"Exxon Reaps $59 Billion Profit, Holds Steady on Buybacks",still open
Chevron Corp.,02/13/2023,Chevron Corporation (CVX) is Attracting Investor Attention: Here is ...,still open
Chevron Corp.,02/13/2023,"Chevron Corp. stock rises Monday, still underperforms market",still open
Chevron Corp.,02/13/2023,Chevron Corporation (NYSE:CVX) insiders sold US$1.4m worth of stock suggesting impending weakness.,still open
Chevron Corp.,02/13/2023,Chevron Corp. stock outperforms competitors despite losses on the day,still open
Chevron Corp.,02/13/2023,"Chevron Corp. stock rises Thursday, outperforms market",still open
Chevron Corp.,02/13/2023,"North American Morning Briefing : Payrolls Shocker, China Spat to Weigh on Stocks",still open
Chevron Corp.,02/13/2023,Is Chevron Corporation (CVX) Stock at the Top of the Oil & Gas Integrated Industry?,still open
Chevron Corp.,02/13/2023,"Chevron: Stock Is Overbought, Time To Take Partial Profits (NYSE ...",still open
Chevron Corp.,02/13/2023,Why Chevron Stock Was Climbing Today,still open
Chevron Corp.,02/13/2023,Is Chevron Stock a Buy?,still open
Chevron Corp.,02/13/2023,Is Chevron Stock A Buy?,still open
Chevron Corp.,02/13/2023,"Exxon Is Not Letting Dividend Investors Down, Despite the Lack of a ...",still open
Chevron Corp.,02/13/2023,Why Chevron and Other Oil Stocks Popped Today,still open
Chevron Corp.,02/13/2023,Is Chevron Corporation (CVX) Stock Near the Top of the Oil & Gas Integrated Industry?,still open
Chevron Corp.,02/13/2023,"CNBC Halftime Report Final Trades: Kinder Morgan, Chevron Corp ...",still open
Chevron Corp.,02/13/2023,"3 Reasons to Buy Chevron, and 1 Reason to Sell",still open
Chevron Corp.,02/13/2023,"Big Oil Delivers Big Earnings, Big Share Buybacks and Big Dividend Hikes",still open
Chevron Corp.,02/13/2023,"Chevron Stock: Is It A Buy Right Now? Here's What Earnings, Charts ...",still open
Chevron Corp.,02/13/2023,"Fair Or Not, Big Oil Has To Deal With Public Opinion",still open
Chevron Corp.,02/13/2023,Stocks Mixed On Weakness In Tech As Bond Yields Climb,still open
Chevron Corp.,02/13/2023,Better Buy: ExxonMobil or Chevron?,still open
Chevron Corp.,02/13/2023,Should You Buy Chevron Corporation (CVX) in Oil & Gas Integrated Industry?,still open
Chevron Corp.,02/13/2023,Chevron Completes Acquisition of (REG),still open
Chevron Corp.,02/13/2023,Chevron Announces Third Quarter 2022 Results — Chevron,still open
Chevron Corp.,02/13/2023,Is Chevron Corporation (CVX) Stock Over or Undervalued?,still open
Chevron Corp.,02/13/2023,ExxonMobil Versus Chevron: A Case for Owning Both,still open
Chevron Corp.,02/13/2023,Chevron Stock: Buying Undervalued High-Yield With A Bull Case ...,still open
Chevron Corp.,02/13/2023,Better Buy: Chevron vs. ExxonMobil Stock,still open
Chevron Corp.,02/13/2023,"Top Stock Reports for Chevron, Eli Lilly & Charles Schwab",still open
Chevron Corp.,02/13/2023,Stocks Settle Mixed On Strength In Energy Stocks And Weakness In ...,still open
Chevron Corp.,02/13/2023,Chevron and Baseload Capital create joint venture,still open
Chevron Corp.,02/13/2023,"Why Exxon, Chevron, and Devon Energy Plunged Today",still open
Chevron Corp.,02/13/2023,Cash key for Chevron and Exxon Mobil as Truist raises stock price targets,still open
Chevron Corp.,02/13/2023,Chevron Plans to Significantly Boost Spending in 2023. Should ...,still open
Chevron Corp.,02/13/2023,CVX Stock: Chevron Flashes Profit-Taking Signs After Soaring With ...,still open
Chevron Corp.,02/13/2023,"Since 2016, Warren Buffett Has Bought $9 Billion More of This Stock ...",still open
Chevron Corp.,02/13/2023,Exxon Mobil Vs. Chevron: One's Way Better (NYSE:CVX),still open
Chevron Corp.,02/13/2023,15 Biggest Natural Gas Pipeline Companies in the World,still open
Chevron Corp.,02/13/2023,Chevron Earnings: A Fundamental Look At Q1 2022 (NYSE:CVX),still open
Chevron Corp.,02/13/2023,"Exxon, Chevron Will Spend More on Stock Returns Than Production",still open
Chevron Corp.,02/13/2023,"Stocks making the biggest moves midday: Apple, Chevron, Bilibili, Hibbett & more",still open
Chevron Corp.,02/13/2023,10 Most Overvalued Companies According to the Media,still open
Chevron Corp.,02/13/2023,"Chevron says it 'can do it all', after record profit and buyback lift",still open
Chevron Corp.,02/13/2023,Chevron Invests in Carbon Capture and Removal Technology ...,still open
Chevron Corp.,02/13/2023,"Why Chevron, Devon Energy, and Cheniere Fell Today",still open
Chevron Corp.,02/13/2023,Chevron Stock: Did Warren Buffett Issue A Long-Term Buy Signal ...,still open
Chevron Corp.,02/13/2023,Chevron Corporation (NYSE:CVX) has seen a significant decrease ...,still open
Chevron Corp.,02/13/2023,"1 Stock to Buy, 1 Stock to Dump This Week: Chevron, Target",still open
Chevron Corp.,02/13/2023,Chevron Announces Second Quarter 2022 Results — Chevron,still open
Chevron Corp.,02/13/2023,Chevron agrees to sell Myanmar assets and will exit country,still open
Chevron Corp.,02/13/2023,Chevron Weighs Extending CEO Mike Wirth Past Mandatory Retirement Age - WSJ,still open
Chevron Corp.,02/13/2023,SFBT Digest: Property owners sue in S.F.; Chevron may let CEO stay longer - San Francisco Business Times,still open
Chevron Corp.,02/13/2023,Chevron weighs extending CEO Mike Wirth past mandatory retirement age,still open
Chevron Corp.,02/13/2023,Chevron (NYSE:CVX) Has Announced That It Will Be Increasing Its Dividend To $1.51,still open
Chevron Corp.,02/13/2023,Chevron (CVX) Sells Yadana's 41.1% Gas Stake to MTI in Myanmar,still open
Chevron Corp.,02/13/2023,Here's What We Like About Chevron's (NYSE:CVX) Upcoming Dividend,still open
Chevron Corp.,02/13/2023,Chevron agrees to sell Myanmar assets and will exit country By Reuters,still open
Chevron Corp.,02/13/2023,Chevron pledges $75 bln for share buybacks as cash grows,still open
Chevron Corp.,02/13/2023,Chevron annual profit hits record but Q4 miss hits shares,still open
Chevron Corp.,02/13/2023,Exxon and Chevron share $100bn in profit after surge in oil prices,still open
Chevron Corp.,02/13/2023,Chevron considers extending current CEO's retirement age - WSJ,still open
Chevron Corp.,02/13/2023,Algeria Hopes Energy Deal With Chevron Is Concluded This Year,still open
Chevron Corp.,02/13/2023,"Chevron Corp. stock rises Friday, outperforms market",still open
Chevron Corp.,02/13/2023,Chevron CEO Says European Natural Gas Outlook 'Less Dire ...,still open
Chevron Corp.,02/13/2023,"Chevron Corp. stock rises Tuesday, outperforms market",still open
Chevron Corp.,02/13/2023,"Chevron Corp. stock falls Monday, underperforms market",still open
Chevron Corp.,02/13/2023,"Chevron Corp. stock falls Friday, underperforms market",still open
Chevron Corp.,02/13/2023,Basin drives Chevron’s progress,still open
Chevron Corp.,02/13/2023,"Exxon, Chevron, ConocoPhillips plan Permian Basin production ...",still open
Chevron Corp.,02/13/2023,Permian Carries Chevron to Record 4Q U.S. Production,still open
Chevron Corp.,02/13/2023,Validea's Top Ten Energy Stocks Based On Joel Greenblatt - 2/12 ...,still open
Chevron Corp.,02/13/2023,Ask the Rational Investor: Chevron's $75 billion buyback,still open
Chevron Corp.,02/13/2023,Chevron Says Venezuela Production Up Nearly 80%,still open
Chevron Corp.,02/13/2023,Udine Wealth Management Inc. Buys Shares of 2093 Chevron Co ...,still open
Chevron Corp.,02/13/2023,Validea's Top Ten Energy Stocks Based On Kenneth Fisher - 2/12 ...,still open
Chevron Corp.,02/13/2023,Senate poised to revive probe of Big Oil climate claims,still open
Chevron Corp.,02/13/2023,Chevron Expands Venezuelan Crude Sales To Other Oil Refiners,still open
Chevron Corp.,02/13/2023,"Chevron, Microsoft back new energy tech accelerator at the Ion",still open
Chevron Corp.,02/13/2023,"Hydraulic Fluid Market Size, Share, Industry Overview, Demand ...",still open
Chevron Corp.,02/13/2023,"Tesla, Chevron rise; Wolfspeed, Southwest fall",still open
Chevron Corp.,02/13/2023,"Marathon Oil Corp. stock rises Friday, outperforms market",still open
Chevron Corp.,02/13/2023,Chevron's refinery unloading first Venezuelan crude cargo,still open
Chevron Corp.,02/13/2023,"Europe Oil Firms Shell, BP Shift Back to Fossil Fuels Despite ...",still open
Chevron Corp.,02/13/2023,Valero Energy Corp. stock outperforms market on strong trading day,still open
Chevron Corp.,02/13/2023,Occidental Petroleum Corp. stock outperforms market on strong trading day,still open
Chevron Corp.,02/13/2023,"Hess Corp. stock rises Friday, outperforms market",still open
Chevron Corp.,02/13/2023,"Buybacks Race to a Record $132 Billion Start, Defying Naysayers",still open
Chevron Corp.,02/13/2023,"Consumer sentiment, inflation data, Chevron earnings: 3 things to watch",still open
Chevron Corp.,02/13/2023,"CNBC Halftime Report Final Trades: Kinder Morgan, Chevron Corp ...",still open
Chevron Corp.,02/13/2023,"Delaware Chancery Court Judge on Leave After Accident, Surgery",still open
Chevron Corp.,02/13/2023,Chevron and Baseload Capital create joint venture,still open
Chevron Corp.,02/13/2023,"Factbox: U.S. stock buybacks so far in 2023: big money, fewer ...",still open
Chevron Corp.,02/13/2023,"Lubricants Market: In-Depth Analysis, Emerging Trends, Top Key ...",still open
Chevron Corp.,02/13/2023,Chevron: Get Ready For A Big Dividend Hike Ahead Of Q4 Results ...,still open
Chevron Corp.,02/13/2023,"CNBC Halftime Report Final Trades: Citigroup, Live Nation ...",still open
Chevron Corp.,02/13/2023,"Jet Fuel Market Insights by Industry Demand, New Opportunities ...",still open
Chevron Corp.,02/13/2023,"In State of the Union, Biden will propose quadrupling the tax on ...",still open
Chevron Corp.,02/13/2023,Business lobby rips Biden's stock buyback tax plan,still open
Chevron Corp.,02/13/2023,Chevron Completes Acquisition of (REG),still open
Chevron Corp.,02/13/2023,Chevron Announces Third Quarter 2022 Results — Chevron,still open
Chevron Corp.,02/13/2023,Finely Tuned First Mover: Tim Duncan’s Rise to Leader of the Pack,still open
Chevron Corp.,02/13/2023,Exxon (XOM) $59 Billion Profit Clouded by Investor Buyback ...,still open
Chevron Corp.,02/13/2023,"‘We Are Going to Need Oil…At Least Another Decade,’ Biden Says",still open
Chevron Corp.,02/13/2023,The SEC's proposed rule on climate-related disclosures: Potential ...,still open
Chevron Corp.,02/13/2023,Oil Industry’s windfall fails to excite Wall Street | Mint,still open
Chevron Corp.,02/13/2023,Hydrogen and Ammonia Project along the Gulf Coast,still open
Chevron Corp.,02/13/2023,Dividend Capture Strategy: 10 High-Yield Stocks to Buy in February,still open
Chevron Corp.,02/13/2023,Chevron New Energies — Chevron,still open
Chevron Corp.,02/13/2023,Chevron Announces Agreement to Acquire Renewable Energy ...,still open
Chevron Corp.,02/13/2023,COHEN LAWRENCE B Goes on Buying Spree in 4th Quarter,still open
Chevron Corp.,02/13/2023,Chevron Announces Second Quarter 2022 Results — Chevron,still open
Chevron Corp.,02/13/2023,Chevron Executing Plans to Deliver Higher Returns and Lower ...,still open
Chevron Corp.,02/13/2023,Analysis | How Maduro Beat Guaidó and the US in Venezuela's ...,still open
Chevron Corp.,02/13/2023,"Chevron says it 'can do it all', after record profit and buyback lift",still open
Chevron Corp.,02/13/2023,3 Houston innovators to know this week,still open
Chevron Corp.,02/13/2023,US open: Stocks higher as investors await CPI reading | Financial ...,still open
Chevron Corp.,02/13/2023,Chevron sending two oil tankers to Venezuela under U.S. approval,still open
Chevron Corp.,02/13/2023,Chevron to Send First Venezuelan Crude Shipment to US by Late ...,still open
Chevron Corp.,02/13/2023,Leadership Change to Enhance Execution — Chevron,still open
Chevron Corp.,02/13/2023,"Chevron Corp. v. San Mateo County, California",still open
Chevron Corp.,02/13/2023,Chevron Lifts 2023 Capital Spending to Top of Range Amid Biden ...,still open
Chevron Corp.,02/13/2023,EXCLUSIVE Chevron offering minority stakes in three Alaskan oilfields,still open
Chevron Corp.,02/13/2023,A Letter to President Biden from Chevron CEO Mike Wirth — Chevron,still open
Chevron Corp.,02/13/2023,"Chevron applies for Venezuela license renewal, proposes wider ...",still open
Chevron Corp.,02/13/2023,Chevron sees LNG growth opportunity in Europe on strong demand ...,still open
Chevron Corp.,02/13/2023,"Chevron, Exxon and Total keen to invest in India, says minister",still open
Chevron Corp.,02/13/2023,Carbon Capture and Storage Project — Chevron,still open
Chevron Corp.,02/13/2023,"Venezuelan officials, Chevron execs hold closed-door meetings",still open
Chevron Corp.,02/13/2023,Chevron Corp. (CVX) Q3 2022 Earnings Call Transcript,still open
Chevron Corp.,02/13/2023,Chevron Corporation (CVX) is Attracting Investor Attention: Here is ...,still open
Chevron Corp.,02/13/2023,Hydrogen Value Chain: Making a Viable Alternative,still open
Chevron Corp.,02/13/2023,Chevron restarts production at Wheatstone gas plant,still open
Chevron Corp.,02/13/2023,"Chevron sells global headquarters, pares back in California amid Texas expansion",still open
Chevron Corp.,02/13/2023,"Chevron Corp. stock rises Thursday, outperforms market",still open
Chevron Corp.,02/13/2023,Chevron plans sale of Bakersfield office space amid local consolidation,still open
Chevron Corp.,02/13/2023,Chevron Targets European LNG Market as Gas Demand Surges,still open
Chevron Corp.,02/13/2023,"Chevron to sell San Ramon headquarters, move employees to ...",still open
Chevron Corp.,02/13/2023,"Chevron Corp. stock rises Monday, still underperforms market",still open
Chevron Corp.,02/13/2023,U.S. prepared to authorize Chevron to boost Venezuela's oil output,still open
Chevron Corp.,02/13/2023,"Chevron, Japan's MOL to study CO2 transportation from Singapore ...",still open
Chevron Corp.,02/13/2023,"Chevron CEO urges Biden to stop criticizing Big Oil, take new ...",still open
Chevron Corp.,02/13/2023,"Chevron's profit nearly quadruples, vows more natural gas investment",still open
Chevron Corp.,02/13/2023,How Chevron Plans to Juggle Oil and Gas Growth with New Energies,still open
Chevron Corp.,02/13/2023,High fuel prices could erode public support for energy transition ...,still open
Chevron Corp.,02/13/2023,Chevron to send 500000-barrel cargo of Venezuelan oil to its ...,still open
Chevron Corp.,02/13/2023,Chevron Corp. stock outperforms competitors despite losses on the day,still open
Chevron Corp.,02/13/2023,"Chevron, Schlumberger withdraw request for California carbon ...",still open
Chevron Corp.,02/13/2023,Is Chevron Stock A Buy?,still open
Chevron Corp.,02/13/2023,"BP, Chevron cut offshore oil production ahead of Hurricane Ian ...",still open
Chevron Corp.,02/13/2023,"Chevron Corp. stock falls Wednesday, underperforms market",still open
Chevron Corp.,02/13/2023,"Chevron Corp. stock rises Friday, outperforms market",still open
Chevron Corp.,02/13/2023,"Chevron Corp. stock rises Tuesday, outperforms market",still open
Chevron Corp.,02/13/2023,Benjamin F. Edwards & Company Inc. sells its stake in Chevron ...,still open
Chevron Corp.,02/13/2023,Chevron to Buy Back $75 Billion in Stock After Record Profit,still open
Chevron Corp.,02/13/2023,"Chevron Corp. stock falls Monday, underperforms market",still open
Chevron Corp.,02/13/2023,Chevron Stock: What A Big Dividend Disappointment (NYSE:CVX),still open
Chevron Corp.,02/13/2023,"Chevron Corp. stock falls Friday, underperforms market",still open
Chevron Corp.,02/13/2023,"Marathon Oil Corp. stock rises Friday, outperforms market",still open
Chevron Corp.,02/13/2023,Valero Energy Corp. stock outperforms market on strong trading day,still open
Chevron Corp.,02/13/2023,Udine Wealth Management Inc. Buys Shares of 2093 Chevron Co ...,still open
Chevron Corp.,02/13/2023,"Hess Corp. stock rises Friday, outperforms market",still open
Chevron Corp.,02/13/2023,Validea's Top Ten Energy Stocks Based On Joel Greenblatt - 2/12 ...,still open
Chevron Corp.,02/13/2023,Occidental Petroleum Corp. stock outperforms market on strong trading day,still open
Chevron Corp.,02/13/2023,Validea's Top Ten Energy Stocks Based On Kenneth Fisher - 2/12 ...,still open
Chevron Corp.,02/13/2023,Chevron considers extending current CEO's retirement age - WSJ,still open
Chevron Corp.,02/13/2023,Why Oil and Natural Gas Stocks Surged Today,still open
Chevron Corp.,02/13/2023,"Energy Stocks on the Move Thursday: BORR, MUR, CVE, CVX, NR, CEIX, ENSV, RES",still open
Chevron Corp.,02/13/2023,Chevron: Get Ready For A Big Dividend Hike Ahead Of Q4 Results ...,still open
Chevron Corp.,02/13/2023,META & CVX Buybacks: Who Benefits Most?,still open
Chevron Corp.,02/13/2023,Stock market today: Dow and Nasdaq notch gains on tech-led rally,still open
Chevron Corp.,02/13/2023,"Buybacks Race to a Record $132 Billion Start, Defying Naysayers",still open
Chevron Corp.,02/13/2023,Hess Corp. stock underperforms Thursday when compared to competitors,still open
Chevron Corp.,02/13/2023,"Marathon Oil Corp. stock falls Wednesday, underperforms market",still open
Chevron Corp.,02/13/2023,CVX Crosses Above Average Analyst Target,still open
Chevron Corp.,02/13/2023,Occidental Petroleum Corp. stock underperforms Thursday when compared to competitors,still open
Chevron Corp.,02/13/2023,"Marathon Oil Corp. stock rises Wednesday, outperforms market",still open
Chevron Corp.,02/13/2023,Valero Energy Corp. stock underperforms Wednesday when compared to competitors,still open
Chevron Corp.,02/13/2023,Dividend Capture Strategy: 10 High-Yield Stocks to Buy in February,still open
Chevron Corp.,02/13/2023,"Occidental Petroleum Corp. stock falls Monday, underperforms market",still open
Chevron Corp.,02/13/2023,"BUZZ-U.S. STOCKS ON THE MOVE-Fat Brands, Spotify, Uber Tech",still open
Chevron Corp.,02/13/2023,"Marathon Petroleum Corp. stock falls Wednesday, still outperforms market",still open
Chevron Corp.,02/13/2023,"Occidental Petroleum Corp. stock falls Wednesday, still outperforms market",still open
Chevron Corp.,02/13/2023,"Valero Energy Corp. stock rises Monday, still underperforms market",still open
Chevron Corp.,02/13/2023,Chevron agrees to sell Myanmar assets and will exit country,still open
Chevron Corp.,02/13/2023,Marathon Oil Corp. stock underperforms Friday when compared to competitors,still open
Chevron Corp.,02/13/2023,Business lobby rips Biden's stock buyback tax plan,still open
Chevron Corp.,02/13/2023,Valero Energy Corp. stock outperforms market despite losses on the day,still open
Chevron Corp.,02/13/2023,"Hess Corp. stock rises Monday, still underperforms market",still open
Chevron Corp.,02/13/2023,Hess Corp. stock outperforms market despite losses on the day,still open
Chevron Corp.,02/13/2023,COHEN LAWRENCE B Goes on Buying Spree in 4th Quarter,still open
Chevron Corp.,02/13/2023,President Biden calls out stock buybacks in State of the Union address,still open
Chevron Corp.,02/13/2023,Ask the Rational Investor: Chevron's $75 billion buyback,still open
Chevron Corp.,02/13/2023,Chevron Explores Algerian Gas Plans Amid Russian Sanctions - WSJ,still open
Chevron Corp.,02/13/2023,15 Most Undervalued Value Stocks To Buy According To Hedge Funds,still open
Chevron Corp.,02/13/2023,CVX Named Top 25 SAFE Dividend Stock Increasing Payments For ...,still open
Chevron Corp.,02/13/2023,12 Cheap Monthly Dividend Stocks To Buy,still open
Chevron Corp.,02/13/2023,11 Undervalued Dividend Aristocrats To Buy Now,still open
Chevron Corp.,02/13/2023,"Chevron Corp. stock falls Wednesday, underperforms market",still open
Chevron Corp.,02/13/2023,Big Oil Faces Headwinds After Record $199 Billion Profit Haul,still open
Chevron Corp.,02/13/2023,"Chevron Corp. stock falls Tuesday, underperforms market",still open
Chevron Corp.,02/13/2023,"Exxon Reaps $59 Billion Profit, Holds Steady on Buybacks",still open
Chevron Corp.,02/13/2023,Chevron Corporation (CVX) is Attracting Investor Attention: Here is ...,still open
Chevron Corp.,02/13/2023,"Chevron Corp. stock rises Monday, still underperforms market",still open
Chevron Corp.,02/13/2023,Chevron Corporation (NYSE:CVX) insiders sold US$1.4m worth of stock suggesting impending weakness.,still open
Chevron Corp.,02/13/2023,Chevron Corp. stock outperforms competitors despite losses on the day,still open
Chevron Corp.,02/13/2023,"Chevron Corp. stock rises Thursday, outperforms market",still open
Chevron Corp.,02/13/2023,"North American Morning Briefing : Payrolls Shocker, China Spat to Weigh on Stocks",still open
Chevron Corp.,02/13/2023,Is Chevron Corporation (CVX) Stock at the Top of the Oil & Gas Integrated Industry?,still open
Chevron Corp.,02/13/2023,"Chevron: Stock Is Overbought, Time To Take Partial Profits (NYSE ...",still open
Chevron Corp.,02/13/2023,Why Chevron Stock Was Climbing Today,still open
Chevron Corp.,02/13/2023,Is Chevron Stock a Buy?,still open
Chevron Corp.,02/13/2023,Is Chevron Stock A Buy?,still open
Chevron Corp.,02/13/2023,"Exxon Is Not Letting Dividend Investors Down, Despite the Lack of a ...",still open
Chevron Corp.,02/13/2023,Why Chevron and Other Oil Stocks Popped Today,still open
Chevron Corp.,02/13/2023,Is Chevron Corporation (CVX) Stock Near the Top of the Oil & Gas Integrated Industry?,still open
Chevron Corp.,02/13/2023,"CNBC Halftime Report Final Trades: Kinder Morgan, Chevron Corp ...",still open
Chevron Corp.,02/13/2023,"3 Reasons to Buy Chevron, and 1 Reason to Sell",still open
Chevron Corp.,02/13/2023,"Big Oil Delivers Big Earnings, Big Share Buybacks and Big Dividend Hikes",still open
Chevron Corp.,02/13/2023,"Chevron Stock: Is It A Buy Right Now? Here's What Earnings, Charts ...",still open
Chevron Corp.,02/13/2023,"Fair Or Not, Big Oil Has To Deal With Public Opinion",still open
Chevron Corp.,02/13/2023,Stocks Mixed On Weakness In Tech As Bond Yields Climb,still open
Chevron Corp.,02/13/2023,Better Buy: ExxonMobil or Chevron?,still open
Chevron Corp.,02/13/2023,Should You Buy Chevron Corporation (CVX) in Oil & Gas Integrated Industry?,still open
Chevron Corp.,02/13/2023,Chevron Completes Acquisition of (REG),still open
Chevron Corp.,02/13/2023,Chevron Announces Third Quarter 2022 Results — Chevron,still open
Chevron Corp.,02/13/2023,Is Chevron Corporation (CVX) Stock Over or Undervalued?,still open
Chevron Corp.,02/13/2023,ExxonMobil Versus Chevron: A Case for Owning Both,still open
Chevron Corp.,02/13/2023,Chevron Stock: Buying Undervalued High-Yield With A Bull Case ...,still open
Chevron Corp.,02/13/2023,Better Buy: Chevron vs. ExxonMobil Stock,still open
Chevron Corp.,02/13/2023,"Top Stock Reports for Chevron, Eli Lilly & Charles Schwab",still open
Chevron Corp.,02/13/2023,Stocks Settle Mixed On Strength In Energy Stocks And Weakness In ...,still open
Chevron Corp.,02/13/2023,Chevron and Baseload Capital create joint venture,still open
Chevron Corp.,02/13/2023,"Why Exxon, Chevron, and Devon Energy Plunged Today",still open
Chevron Corp.,02/13/2023,Cash key for Chevron and Exxon Mobil as Truist raises stock price targets,still open
Chevron Corp.,02/13/2023,Chevron Plans to Significantly Boost Spending in 2023. Should ...,still open
Chevron Corp.,02/13/2023,CVX Stock: Chevron Flashes Profit-Taking Signs After Soaring With ...,still open
Chevron Corp.,02/13/2023,"Since 2016, Warren Buffett Has Bought $9 Billion More of This Stock ...",still open
Chevron Corp.,02/13/2023,Exxon Mobil Vs. Chevron: One's Way Better (NYSE:CVX),still open
Chevron Corp.,02/13/2023,15 Biggest Natural Gas Pipeline Companies in the World,still open
Chevron Corp.,02/13/2023,Chevron Earnings: A Fundamental Look At Q1 2022 (NYSE:CVX),still open
Chevron Corp.,02/13/2023,"Exxon, Chevron Will Spend More on Stock Returns Than Production",still open
Chevron Corp.,02/13/2023,"Stocks making the biggest moves midday: Apple, Chevron, Bilibili, Hibbett & more",still open
Chevron Corp.,02/13/2023,10 Most Overvalued Companies According to the Media,still open
Chevron Corp.,02/13/2023,"Chevron says it 'can do it all', after record profit and buyback lift",still open
Chevron Corp.,02/13/2023,Chevron Invests in Carbon Capture and Removal Technology ...,still open
Chevron Corp.,02/13/2023,"Why Chevron, Devon Energy, and Cheniere Fell Today",still open
