Name,Data,News,Evaluation
CIGNA Corp.,02/05/2023,Cigna expects revenue gains from launches of Humira biosimilars,still open
CIGNA Corp.,02/05/2023,Cigna Profits Top $1 Billion With 1M New Health Plan Members Forecast For 2023,still open
CIGNA Corp.,02/05/2023,"Cigna Corp. tops earnings, but misses revenue expectations By ...",still open
CIGNA Corp.,02/05/2023,"Cigna Corp. stock falls Friday, underperforms market",still open
CIGNA Corp.,02/05/2023,"Cigna Sues Former Executive Bricker, CVS Over Departure to Rival",still open
CIGNA Corp.,02/05/2023,"Cigna Corp. Q4 Profit Increases, beats estimates",still open
CIGNA Corp.,02/05/2023,"Cigna (NYSE:CI) Releases Earnings Results, Beats Expectations By ...",still open
CIGNA Corp.,02/05/2023,Cigna: Q4 Earnings Snapshot,still open
CIGNA Corp.,02/05/2023,"CIGNA CORP : Results of Operations and Financial Condition, Financial Statements and Exhibits (form 8-K)",still open
CIGNA Corp.,02/05/2023,"NOCD Raises $34M in Round Led by Cigna Ventures, 7wireVentures",still open
CIGNA Corp.,02/05/2023,Cigna Corp. stock underperforms Friday when compared to competitors,still open
CIGNA Corp.,02/05/2023,"Zacks.com featured highlights Stride, Herc Holdings, ONEOK and ...",still open
CIGNA Corp.,02/05/2023,Should Cigna Corp (CI) Stock Be in Your Portfolio?,still open
CIGNA Corp.,02/05/2023,Cigna drops Fry's pharmacies from in-network insurance coverage,still open
CIGNA Corp.,02/05/2023,Should You Buy Cigna Corp (CI) in Health Care Plans Industry?,still open
CIGNA Corp.,02/05/2023,"Cigna, Phoenix Children's reach tentative agreement; contract discussions continue",still open
CIGNA Corp.,02/05/2023,Where Does Cigna Corp (CI) Stock Fall in the Health Care Plans Field?,still open
CIGNA Corp.,02/05/2023,"Cigna Corp. stock rises Tuesday, still underperforms market",still open
CIGNA Corp.,02/05/2023,Altrius Capital Management Inc Sells 8022 Shares of Cigna Co ...,still open
CIGNA Corp.,02/05/2023,"Jobs report, Sanofi earnings, Cigna results: 3 things to watch",still open
CIGNA Corp.,02/05/2023,Health-insurance stocks drop after Medicare Advantage proposes ...,still open
CIGNA Corp.,02/05/2023,March 24th Options Now Available For Cigna (CI),still open
CIGNA Corp.,02/05/2023,Glenmede Trust Co. NA Has $45.70 Million Holdings in Cigna Co ...,still open
CIGNA Corp.,02/05/2023,Plan to build 585 multi-family housing units in Franklin Lakes to be ...,still open
CIGNA Corp.,02/05/2023,"Alphabet, Apple And 3 Stocks To Watch Heading Into Friday - Apple (NASDAQ:AAPL), Cigna (NYSE:CI)",still open
CIGNA Corp.,02/05/2023,Sector Update : Healthcare Stocks Stage Thursday Retreat,still open
CIGNA Corp.,02/05/2023,"Noteworthy Friday Option Activity: CI, ADTN, ON",still open
CIGNA Corp.,02/05/2023,"AbbVie's Humira gets a U.S. rival, but costs could stay high",still open
CIGNA Corp.,02/05/2023,"AFLAC Inc. stock rises Tuesday, still underperforms market",still open
CIGNA Corp.,02/05/2023,United States Files Civil Fraud Lawsuit Against Cigna For Artificially ...,still open
CIGNA Corp.,02/05/2023,"Cigna Reports Strong Third Quarter 2022 Results, Raises 2022 ...",still open
CIGNA Corp.,02/05/2023,"Cigna Reports Strong Second Quarter 2022 Results, Raises 2022 ...",still open
CIGNA Corp.,02/05/2023,Markets Today: Stocks Plunge on Weak Tech Earnings and U.S. ...,still open
CIGNA Corp.,02/05/2023,Cigna Announces $3.5 Billion Accelerated Stock Repurchase ...,still open
CIGNA Corp.,02/05/2023,"Cigna Declares Quarterly Dividend - Oct 26, 2022",still open
CIGNA Corp.,02/05/2023,Top 5 4th Quarter Trades of MEYER HANDELMAN CO,still open
CIGNA Corp.,02/05/2023,Cigna Spotlights Healthy Growth at Investor Day 2022,still open
CIGNA Corp.,02/05/2023,Cigna Will Expand Obamacare Plans To Three New States,still open
CIGNA Corp.,02/05/2023,Penny Stocks & What To Watch in the Stock Market This Week 1/30-2/3,still open
CIGNA Corp.,02/05/2023,Is Cigna Corp (CI) Stock Near the Top of the Health Care Plans Industry?,still open
CIGNA Corp.,02/05/2023,Is Cigna Corp (CI) the Top Pick in the Health Care Plans Industry?,still open
CIGNA Corp.,02/05/2023,Barclays PLC Reduces Its Holdings in Fortis Inc. (NYSE:FTS),still open
CIGNA Corp.,02/05/2023,"Cigna Corp. stock rises Thursday, outperforms market",still open
CIGNA Corp.,02/05/2023,Cigna’s $2.5 Billion Stake In VillageMD’s Summit Venture To Grow Evernorth Provider Portfolio,still open
CIGNA Corp.,02/05/2023,"Cigna Reports Fourth Quarter and Full Year 2021 Results, Expects ...",still open
CIGNA Corp.,02/05/2023,"Calif. suit accuses drugmakers, PBMs of insulin overcharging",still open
CIGNA Corp.,02/05/2023,Cigna Corp. stock outperforms competitors despite losses on the day,still open
CIGNA Corp.,02/05/2023,Is Cigna Corporation (CI) a Safe Investment During Macroeconomic Uncertainty?,still open
CIGNA Corp.,02/05/2023,Chuck Close's estate sues Cigna for not paying his medical benefits,still open
CIGNA Corp.,02/05/2023,Cigna Q3 Earnings: Where I Went Wrong (NYSE:CI),still open
CIGNA Corp.,02/05/2023,Cigna CEO Sees 'Tremendous' Growth Opportunities in Middle East,still open
CIGNA Corp.,02/05/2023,"Cigna Corp. stock rises Wednesday, still underperforms market",still open
CIGNA Corp.,02/05/2023,AMA Joins in Lawsuit Accusing Cigna of Underpaying Physicians,still open
CIGNA Corp.,02/05/2023,"Patients, doctors sue to hold Cigna accountable for underpayments",still open
CIGNA Corp.,02/05/2023,Is Cigna Corp (CI) Stock Trading Below Fair Value?,still open
CIGNA Corp.,02/05/2023,CIGNA CORP : Regulation FD Disclosure (form 8-K),still open
CIGNA Corp.,02/05/2023,What Cigna's Evernorth Plans Mean for Behavioral Health,still open
CIGNA Corp.,02/05/2023,Special Obamacare enrollments for Medicaid enrollees losing ...,still open
CIGNA Corp.,02/05/2023,"Cigna Corp. stock falls Thursday, still outperforms market",still open
CIGNA Corp.,02/05/2023,Evernorth Performance And Life Insurance Sale Boost Cigna Profits,still open
CIGNA Corp.,02/05/2023,Cigna Corp. stock outperforms market on strong trading day,still open
CIGNA Corp.,02/05/2023,Health insurer Cigna boosts forecast as COVID costs recede,still open
CIGNA Corp.,02/05/2023,Form 8-K Cigna Corp For: Dec 30,still open
CIGNA Corp.,02/05/2023,"Valley hospital, national health insurance provider in major contract dispute",still open
CIGNA Corp.,02/05/2023,Chubb Completes Acquisition of Cigna's Personal Accident ...,still open
CIGNA Corp.,02/05/2023,Cigna Corporation's Third Quarter 2022 Earnings Release Details,still open
CIGNA Corp.,02/05/2023,Cigna CEO David Cordani says employers are finally recognizing worker mental health as a productivity and engagement issue,still open
CIGNA Corp.,02/05/2023,"Allegiance, a Cigna Company, selects eGain for knowledge ...",still open
CIGNA Corp.,02/05/2023,Kroger wants to end deal with Cigna Express Scripts; drug pricing ...,still open
CIGNA Corp.,02/05/2023,Cigna Retirees Lose Round in Long-Running Pension Benefits Suit,still open
CIGNA Corp.,02/05/2023,Cigna survey finds evolving expat landscape that presents ...,still open
CIGNA Corp.,02/05/2023,Oscar and Cigna bringing their joint health insurance product for small businesses to Philadelphia,still open
CIGNA Corp.,02/05/2023,Is Cigna Corp (CI) a Winner in the Health Care Plans Industry?,still open
CIGNA Corp.,02/05/2023,CT companies to pay for employees' travel for abortions,still open
CIGNA Corp.,02/05/2023,"Centene to cut costs with new pharmacy benefits manager, shares ...",still open
CIGNA Corp.,02/05/2023,Cigna Wins Billing Dispute Over Substance Abuse Treatment Center,still open
CIGNA Corp.,02/05/2023,"Evernorth, Bicycle Health Deal Gives Cigna Members Access to ...",still open
CIGNA Corp.,02/05/2023,Cigna Announces Significant Increase to Share Repurchase ...,still open
CIGNA Corp.,02/05/2023,Cigna's David Cordani Addresses the Teen Mental Health Crisis at ...,still open
CIGNA Corp.,02/05/2023,"Top Analyst Reports for UnitedHealth, Blackstone & Cigna",still open
CIGNA Corp.,02/05/2023,Inside Cigna Subsidiary Evernorth's Plans to Leverage Data to ...,still open
CIGNA Corp.,02/05/2023,Chutes & Ladders—Verily names chief marketing officer; Cigna's ...,still open
CIGNA Corp.,02/05/2023,Cigna Latest Health Insurer To Increase Venture Spending On Startups And Digital Tech,still open
CIGNA Corp.,02/05/2023,"UnitedHealth, Cigna stocks fall after Raymond James downgrades, citing tripledemic and policy concerns",still open
CIGNA Corp.,02/05/2023,Cigna Gets Nod for Settlement Expanding Liposuction Coverage,still open
CIGNA Corp.,02/05/2023,"Stocks making the biggest moves premarket: Eli Lilly, Cigna, Restaurant Brands and more",still open
CIGNA Corp.,02/05/2023,MAPS: Fortune 500 companies in CT in 2012 and 2022,still open
CIGNA Corp.,02/05/2023,Cigna's Evernorth unit partners with rival Kaiser Permanente,still open
CIGNA Corp.,02/05/2023,This Health Insurance Company Is A Better Pick Over UnitedHealth Stock,still open
CIGNA Corp.,02/05/2023,Hamilton County OKs purchase of 19 acres at former Cigna facility ...,still open
CIGNA Corp.,02/05/2023,DOJ joins Cigna Medicare Advantage fraud case,still open
CIGNA Corp.,02/05/2023,Centene Is Said to Have Drawn Takeover Interest From Cigna,still open
CIGNA Corp.,02/05/2023,Cigna expects to affirm 2022 profit guidance in 'the next several weeks',still open
CIGNA Corp.,02/05/2023,Chancery Tosses $1.85B Anthem-Cigna Merger Bust Fee Suit,still open
CIGNA Corp.,02/05/2023,Cigna Adds Iora Primary Care to Medicare Advantage Network in ...,still open
CIGNA Corp.,02/05/2023,Cigna Gets $6 Million Covid Testing Reimbursement Suit Trimmed,still open
CIGNA Corp.,02/05/2023,Cigna Reports $1 Billion Profit On Strong Evernorth Pharmacy Performance,still open
CIGNA Corp.,02/05/2023,AMA joins class action lawsuit against Cigna's insurance billing ...,still open
CIGNA Corp.,02/05/2023,"Cigna Corp. stock falls Friday, underperforms market",still open
CIGNA Corp.,02/05/2023,"Cigna stock bounces after profit tops expectations, while revenue comes up shy",still open
CIGNA Corp.,02/05/2023,Cigna beats quarterly profit expectations as COVID medical costs fall,still open
CIGNA Corp.,02/05/2023,"Cigna Corp. tops earnings, but misses revenue expectations By ...",still open
CIGNA Corp.,02/05/2023,Cigna Corp (CI) Is the Top Stock in the Health Care Plans Industry?,still open
CIGNA Corp.,02/05/2023,Cigna Corp. stock outperforms market on strong trading day,still open
CIGNA Corp.,02/05/2023,Should Cigna Corp (CI) Stock Be in Your Portfolio?,still open
CIGNA Corp.,02/05/2023,"Cigna Corp. stock falls Thursday, underperforms market",still open
CIGNA Corp.,02/05/2023,"Cigna Corp. stock rises Tuesday, still underperforms market",still open
CIGNA Corp.,02/05/2023,Should You Buy Cigna Corp (CI) in Health Care Plans Industry?,still open
CIGNA Corp.,02/05/2023,"Zacks.com featured highlights Stride, Herc Holdings, ONEOK and ...",still open
CIGNA Corp.,02/05/2023,Health-insurance stocks drop after Medicare Advantage proposes ...,still open
CIGNA Corp.,02/05/2023,Altrius Capital Management Inc Sells 8022 Shares of Cigna Co ...,still open
CIGNA Corp.,02/05/2023,"CIGNA CORP : Results of Operations and Financial Condition, Financial Statements and Exhibits (form 8-K)",still open
CIGNA Corp.,02/05/2023,"Alphabet, Apple And 3 Stocks To Watch Heading Into Friday - Apple (NASDAQ:AAPL), Cigna (NYSE:CI)",still open
CIGNA Corp.,02/05/2023,"Jobs report, Sanofi earnings, Cigna results: 3 things to watch",still open
CIGNA Corp.,02/05/2023,March 24th Options Now Available For Cigna (CI),still open
CIGNA Corp.,02/05/2023,AFLAC Inc. stock underperforms Thursday when compared to competitors,still open
CIGNA Corp.,02/05/2023,Cigna Co. (NYSE:CI) Shares Acquired by Fox Run Management L.L.C.,still open
CIGNA Corp.,02/05/2023,Sector Update : Healthcare Stocks Stage Thursday Retreat,still open
CIGNA Corp.,02/05/2023,Penny Stocks & What To Watch in the Stock Market This Week 1/30-2/3,still open
CIGNA Corp.,02/05/2023,Glenmede Trust Co. NA Has $45.70 Million Holdings in Cigna Co ...,still open
CIGNA Corp.,02/05/2023,Markets Today: Stocks Plunge on Weak Tech Earnings and U.S. ...,still open
CIGNA Corp.,02/05/2023,"AFLAC Inc. stock rises Tuesday, outperforms market",still open
CIGNA Corp.,02/05/2023,Cigna Corp. stock underperforms Friday when compared to competitors,still open
CIGNA Corp.,02/05/2023,Is Cigna Corp (CI) Stock Near the Top of the Health Care Plans Industry?,still open
CIGNA Corp.,02/05/2023,Barclays PLC Reduces Its Holdings in Fortis Inc. (NYSE:FTS),still open
CIGNA Corp.,02/05/2023,Cigna Corp. stock outperforms competitors on strong trading day,still open
CIGNA Corp.,02/05/2023,"CI Stock Forecast, Price & News (Cigna)",still open
CIGNA Corp.,02/05/2023,Cigna Corp. stock outperforms competitors despite losses on the day,still open
CIGNA Corp.,02/05/2023,Cigna Announces $3.5 Billion Accelerated Stock Repurchase ...,still open
CIGNA Corp.,02/05/2023,Is Cigna Corporation (CI) a Safe Investment During Macroeconomic Uncertainty?,still open
CIGNA Corp.,02/05/2023,"Cigna Corp. stock rises Thursday, outperforms market",still open
CIGNA Corp.,02/05/2023,Manitou Investment Management Ltd. Grows Stock Position in ...,still open
CIGNA Corp.,02/05/2023,Top 5 4th Quarter Trades of MEYER HANDELMAN CO,still open
CIGNA Corp.,02/05/2023,"Cigna Corp. stock rises Wednesday, still underperforms market",still open
CIGNA Corp.,02/05/2023,"Cigna Corp. stock falls Thursday, still outperforms market",still open
CIGNA Corp.,02/05/2023,"AbbVie's Humira gets a U.S. rival, but costs could stay high By Reuters",still open
CIGNA Corp.,02/05/2023,Is Cigna Corp (CI) a Winner in the Health Care Plans Industry?,still open
CIGNA Corp.,02/05/2023,"Top Analyst Reports for UnitedHealth, Blackstone & Cigna",still open
CIGNA Corp.,02/05/2023,"Cigna Declares Quarterly Dividend - Oct 26, 2022",still open
CIGNA Corp.,02/05/2023,"Cigna Reports Strong Third Quarter 2022 Results, Raises 2022 ...",still open
CIGNA Corp.,02/05/2023,"Cigna Reports Strong Second Quarter 2022 Results, Raises 2022 ...",still open
CIGNA Corp.,02/05/2023,CIGNA CORP : Regulation FD Disclosure (form 8-K),still open
CIGNA Corp.,02/05/2023,Cigna Corporation's Third Quarter 2022 Earnings Release Details,still open
CIGNA Corp.,02/05/2023,"Centene to cut costs with new pharmacy benefits manager, shares ...",still open
CIGNA Corp.,02/05/2023,"Stocks making the biggest moves premarket: Eli Lilly, Cigna, Restaurant Brands and more",still open
CIGNA Corp.,02/05/2023,Special Obamacare enrollments for Medicaid enrollees losing ...,still open
CIGNA Corp.,02/05/2023,"UnitedHealth, Cigna stocks fall after Raymond James downgrades, citing tripledemic and policy concerns",still open
CIGNA Corp.,02/05/2023,Cigna’s $2.5 Billion Stake In VillageMD’s Summit Venture To Grow Evernorth Provider Portfolio,still open
CIGNA Corp.,02/05/2023,CI: 2 Medical Stocks to Buy Now Without Hesitation,still open
CIGNA Corp.,02/05/2023,CI: 3 Stocks Worth Buying Before Year-End,still open
CIGNA Corp.,02/05/2023,CI: These 2 Stocks Will Be Winners Over the Long Term,still open
CIGNA Corp.,02/05/2023,CI: 3 Reliable Stocks to Fall Back on When Times Are Tough,still open
CIGNA Corp.,02/05/2023,Why Cigna Stock Could Rise Quickly,still open
CIGNA Corp.,02/05/2023,"Cigna Reports Fourth Quarter and Full Year 2021 Results, Expects ...",still open
CIGNA Corp.,02/05/2023,Pot Stock Drops 1.8% Wednesday: Should You Buy Hexo Corp (HEXO)?,still open
CIGNA Corp.,02/05/2023,Multiplan Corp (MPLN) Stock Decreases -9.76% This Week; Should You Buy?,still open
CIGNA Corp.,02/05/2023,4 Stocks From the Finance Sector Crushing the S&P 500 in 2022,still open
CIGNA Corp.,02/05/2023,Where Does McKesson Corp (MCK) Stock Fall in the Medical Distribution Field?,still open
CIGNA Corp.,02/05/2023,CVS Health Corp. stock underperforms Monday when compared to competitors despite daily gains,still open
CIGNA Corp.,02/05/2023,Cigna Rules Out Large-Scale M&A to Focus on Share Repurchases,still open
CIGNA Corp.,02/05/2023,This Health Insurance Company Is A Better Pick Over UnitedHealth Stock,still open
CIGNA Corp.,02/05/2023,Cigna CEO Sees 'Tremendous' Growth Opportunities in Middle East,still open
CIGNA Corp.,02/05/2023,Is Flora Growth Corp (FLGC) Stock About to Get Hot Friday?,still open
CIGNA Corp.,02/05/2023,Analyst Rating: Will Clover Health Investments Corp (CLOV) Stock Lead the Market?,still open
CIGNA Corp.,02/05/2023,Top 10 Health Insurance Stocks to Buy,still open
CIGNA Corp.,02/05/2023,"CVS Health Corp. stock rises Monday, still underperforms market",still open
CIGNA Corp.,02/05/2023,Elevance (ELV) Stock Plunges After First Earnings Since Dropping ...,still open
CIGNA Corp.,02/05/2023,CVS Health Corp. stock outperforms competitors despite losses on the day,still open
CIGNA Corp.,02/05/2023,"CVS Health Corp. stock falls Thursday, underperforms market",still open
CIGNA Corp.,02/05/2023,U.S. Sues Cigna Corp for Overcharging Medicare Advantage Program,still open
CIGNA Corp.,02/05/2023,Is 180 Life Sciences Corp (ATNF) Stock About to Get Hot Wednesday?,still open
CIGNA Corp.,02/05/2023,"CVS Health Corp. stock falls Thursday, still outperforms market",still open
CIGNA Corp.,02/05/2023,Does Absci Corp (ABSI) Have What it Takes to be in Your Portfolio Tuesday?,still open
CIGNA Corp.,02/05/2023,Is McKesson Corp (MCK) a Winner in the Medical Distribution Industry?,still open
CIGNA Corp.,02/05/2023,CVS Health Corp. stock outperforms competitors on strong trading day,still open
CIGNA Corp.,02/05/2023,Cigna expects to affirm 2022 profit guidance in ‘the next several weeks’,still open
CIGNA Corp.,02/05/2023,How Will the Market React to Adaptive Biotechnologies Corp (ADPT) Stock Getting a Bearish Rating,still open
CIGNA Corp.,02/05/2023,"CVS Health Corp. stock falls Wednesday, underperforms market",still open
CIGNA Corp.,02/05/2023,Is Baudax Bio Inc (BXRX) Stock Worth a Buy Tuesday?,still open
CIGNA Corp.,02/05/2023,Analyst Rating: Will Cano Health Inc (CANO) Stock Beat the Market?,still open
CIGNA Corp.,02/05/2023,"Is Spectrum Pharmaceuticals, Inc. (SPPI) Stock a Smart Investment Friday?",still open
CIGNA Corp.,02/05/2023,Chubb Completes Acquisition of Cigna's Personal Accident ...,still open
CIGNA Corp.,02/05/2023,SNDL Inc (SNDL) Up 1.60% in Premarket Trading,still open
CIGNA Corp.,02/05/2023,Sorrento Therapeutics Inc (SRNE) Stock Falls -23.30% This Week: Is It a Good Pick?,still open
CIGNA Corp.,02/05/2023,Analyst Rating: Will Cronos Group Inc (CRON) Stock Lead the Market?,still open
CIGNA Corp.,02/05/2023,Venus Concept Inc (VERO) Stock Gains 26.67% This Week: Is It a ...,still open
CIGNA Corp.,02/05/2023,Form 8-K Cigna Corp For: Dec 30,still open
CIGNA Corp.,02/05/2023,Is Heron Therapeutics Inc (HRTX) Stock a Good Value?,still open
CIGNA Corp.,02/05/2023,Is Eargo Inc (EAR) Stock a Smart Investment Wednesday?,still open
CIGNA Corp.,02/05/2023,Asensus Surgical Inc (ASXC) Stock Falls -12.82% This Week; Should You Buy?,still open
CIGNA Corp.,02/05/2023,Is Allarity Therapeutics Inc (ALLR) Stock Worth a Buy Thursday?,still open
CIGNA Corp.,02/05/2023,Should You Sell Corbus Pharmaceuticals Holdings Inc (CRBP) Stock Friday?,still open
CIGNA Corp.,02/05/2023,"CVS Health Corp. stock rises Monday, outperforms market",still open
CIGNA Corp.,02/05/2023,CI: 3 Red-Hot Healthcare Stocks Ignoring the Market's Downtrend,still open
CIGNA Corp.,02/05/2023,Cigna Is a Future Dividend Growth Superstar,still open
CIGNA Corp.,02/05/2023,Cigna expects revenue gains from launches of Humira biosimilars,still open
CIGNA Corp.,02/05/2023,Cigna Profits Top $1 Billion With 1M New Health Plan Members Forecast For 2023,still open
CIGNA Corp.,02/05/2023,"Cigna Corp. tops earnings, but misses revenue expectations By ...",still open
CIGNA Corp.,02/05/2023,"Cigna Corp. stock falls Friday, underperforms market",still open
CIGNA Corp.,02/05/2023,"Cigna Sues Former Executive Bricker, CVS Over Departure to Rival",still open
CIGNA Corp.,02/05/2023,"Cigna Corp. Q4 Profit Increases, beats estimates",still open
CIGNA Corp.,02/05/2023,"Cigna (NYSE:CI) Releases Earnings Results, Beats Expectations By ...",still open
CIGNA Corp.,02/05/2023,Cigna: Q4 Earnings Snapshot,still open
CIGNA Corp.,02/05/2023,"CIGNA CORP : Results of Operations and Financial Condition, Financial Statements and Exhibits (form 8-K)",still open
CIGNA Corp.,02/05/2023,"NOCD Raises $34M in Round Led by Cigna Ventures, 7wireVentures",still open
CIGNA Corp.,02/05/2023,Cigna Corp. stock underperforms Friday when compared to competitors,still open
CIGNA Corp.,02/05/2023,"Zacks.com featured highlights Stride, Herc Holdings, ONEOK and ...",still open
CIGNA Corp.,02/05/2023,Should Cigna Corp (CI) Stock Be in Your Portfolio?,still open
CIGNA Corp.,02/05/2023,Cigna drops Fry's pharmacies from in-network insurance coverage,still open
CIGNA Corp.,02/05/2023,Should You Buy Cigna Corp (CI) in Health Care Plans Industry?,still open
CIGNA Corp.,02/05/2023,"Cigna, Phoenix Children's reach tentative agreement; contract discussions continue",still open
CIGNA Corp.,02/05/2023,Where Does Cigna Corp (CI) Stock Fall in the Health Care Plans Field?,still open
CIGNA Corp.,02/05/2023,"Cigna Corp. stock rises Tuesday, still underperforms market",still open
CIGNA Corp.,02/05/2023,Altrius Capital Management Inc Sells 8022 Shares of Cigna Co ...,still open
CIGNA Corp.,02/05/2023,"Jobs report, Sanofi earnings, Cigna results: 3 things to watch",still open
CIGNA Corp.,02/05/2023,Health-insurance stocks drop after Medicare Advantage proposes ...,still open
CIGNA Corp.,02/05/2023,March 24th Options Now Available For Cigna (CI),still open
CIGNA Corp.,02/05/2023,Glenmede Trust Co. NA Has $45.70 Million Holdings in Cigna Co ...,still open
CIGNA Corp.,02/05/2023,Plan to build 585 multi-family housing units in Franklin Lakes to be ...,still open
CIGNA Corp.,02/05/2023,"Alphabet, Apple And 3 Stocks To Watch Heading Into Friday - Apple (NASDAQ:AAPL), Cigna (NYSE:CI)",still open
CIGNA Corp.,02/05/2023,Sector Update : Healthcare Stocks Stage Thursday Retreat,still open
CIGNA Corp.,02/05/2023,"Noteworthy Friday Option Activity: CI, ADTN, ON",still open
CIGNA Corp.,02/05/2023,"AbbVie's Humira gets a U.S. rival, but costs could stay high",still open
CIGNA Corp.,02/05/2023,"AFLAC Inc. stock rises Tuesday, still underperforms market",still open
CIGNA Corp.,02/05/2023,United States Files Civil Fraud Lawsuit Against Cigna For Artificially ...,still open
CIGNA Corp.,02/05/2023,"Cigna Reports Strong Third Quarter 2022 Results, Raises 2022 ...",still open
CIGNA Corp.,02/05/2023,"Cigna Reports Strong Second Quarter 2022 Results, Raises 2022 ...",still open
CIGNA Corp.,02/05/2023,Markets Today: Stocks Plunge on Weak Tech Earnings and U.S. ...,still open
CIGNA Corp.,02/05/2023,Cigna Announces $3.5 Billion Accelerated Stock Repurchase ...,still open
CIGNA Corp.,02/05/2023,"Cigna Declares Quarterly Dividend - Oct 26, 2022",still open
CIGNA Corp.,02/05/2023,Top 5 4th Quarter Trades of MEYER HANDELMAN CO,still open
CIGNA Corp.,02/05/2023,Cigna Spotlights Healthy Growth at Investor Day 2022,still open
CIGNA Corp.,02/05/2023,Cigna Will Expand Obamacare Plans To Three New States,still open
CIGNA Corp.,02/05/2023,Penny Stocks & What To Watch in the Stock Market This Week 1/30-2/3,still open
CIGNA Corp.,02/05/2023,Is Cigna Corp (CI) Stock Near the Top of the Health Care Plans Industry?,still open
CIGNA Corp.,02/05/2023,Is Cigna Corp (CI) the Top Pick in the Health Care Plans Industry?,still open
CIGNA Corp.,02/05/2023,Barclays PLC Reduces Its Holdings in Fortis Inc. (NYSE:FTS),still open
CIGNA Corp.,02/05/2023,"Cigna Corp. stock rises Thursday, outperforms market",still open
CIGNA Corp.,02/05/2023,Cigna’s $2.5 Billion Stake In VillageMD’s Summit Venture To Grow Evernorth Provider Portfolio,still open
CIGNA Corp.,02/05/2023,"Cigna Reports Fourth Quarter and Full Year 2021 Results, Expects ...",still open
CIGNA Corp.,02/05/2023,"Calif. suit accuses drugmakers, PBMs of insulin overcharging",still open
CIGNA Corp.,02/05/2023,Cigna Corp. stock outperforms competitors despite losses on the day,still open
CIGNA Corp.,02/05/2023,Is Cigna Corporation (CI) a Safe Investment During Macroeconomic Uncertainty?,still open
CIGNA Corp.,02/05/2023,Chuck Close's estate sues Cigna for not paying his medical benefits,still open
CIGNA Corp.,02/05/2023,Cigna Q3 Earnings: Where I Went Wrong (NYSE:CI),still open
CIGNA Corp.,02/05/2023,Cigna CEO Sees 'Tremendous' Growth Opportunities in Middle East,still open
CIGNA Corp.,02/05/2023,"Cigna Corp. stock rises Wednesday, still underperforms market",still open
CIGNA Corp.,02/05/2023,AMA Joins in Lawsuit Accusing Cigna of Underpaying Physicians,still open
CIGNA Corp.,02/05/2023,"Patients, doctors sue to hold Cigna accountable for underpayments",still open
CIGNA Corp.,02/05/2023,Is Cigna Corp (CI) Stock Trading Below Fair Value?,still open
CIGNA Corp.,02/05/2023,CIGNA CORP : Regulation FD Disclosure (form 8-K),still open
CIGNA Corp.,02/05/2023,What Cigna's Evernorth Plans Mean for Behavioral Health,still open
CIGNA Corp.,02/05/2023,Special Obamacare enrollments for Medicaid enrollees losing ...,still open
CIGNA Corp.,02/05/2023,"Cigna Corp. stock falls Thursday, still outperforms market",still open
CIGNA Corp.,02/05/2023,Evernorth Performance And Life Insurance Sale Boost Cigna Profits,still open
CIGNA Corp.,02/05/2023,Cigna Corp. stock outperforms market on strong trading day,still open
CIGNA Corp.,02/05/2023,Health insurer Cigna boosts forecast as COVID costs recede,still open
CIGNA Corp.,02/05/2023,Form 8-K Cigna Corp For: Dec 30,still open
CIGNA Corp.,02/05/2023,"Valley hospital, national health insurance provider in major contract dispute",still open
