Name,Data,News,Evaluation
CIGNA Corp.,02/12/2023,4 Stocks From the Finance Sector Crushing the S&P 500 in 2022,still open
CIGNA Corp.,02/12/2023,"Cigna Reports Fourth Quarter and Full Year 2021 Results, Expects ...",still open
CIGNA Corp.,02/12/2023,Is Quidelortho Corp (QDEL) Stock a Smart Investment Wednesday?,still open
CIGNA Corp.,02/12/2023,Cigna Rules Out Large-Scale M&A to Focus on Share Repurchases,still open
CIGNA Corp.,02/12/2023,CVS Health Corp. stock underperforms Monday when compared to competitors despite daily gains,still open
CIGNA Corp.,02/12/2023,Cigna CEO Sees 'Tremendous' Growth Opportunities in Middle East,still open
CIGNA Corp.,02/12/2023,Is Flora Growth Corp (FLGC) Stock About to Get Hot Friday?,still open
CIGNA Corp.,02/12/2023,This Health Insurance Company Is A Better Pick Over UnitedHealth Stock,still open
CIGNA Corp.,02/12/2023,"Market Rallies, But Defensive Stocks On Defense; Cigna, Flex ...",still open
CIGNA Corp.,02/12/2023,"Market Awaits Jobs Report; United Therapeutics, Trane ...",still open
CIGNA Corp.,02/12/2023,Analyst Rating: Will Clover Health Investments Corp (CLOV) Stock Lead the Market?,still open
CIGNA Corp.,02/12/2023,What is the Market's View on IM Cannabis Corp (IMCC) Stock's Price and Volume Trends Wednesday?,still open
CIGNA Corp.,02/12/2023,Top 10 Health Insurance Stocks to Buy,still open
CIGNA Corp.,02/12/2023,Elevance (ELV) Stock Plunges After First Earnings Since Dropping ...,still open
CIGNA Corp.,02/12/2023,"CVS Health Corp. stock falls Thursday, underperforms market",still open
CIGNA Corp.,02/12/2023,CVS Health Corp. stock outperforms competitors despite losses on the day,still open
CIGNA Corp.,02/12/2023,"CVS Health Corp. stock rises Monday, still underperforms market",still open
CIGNA Corp.,02/12/2023,15 Companies That Are Buying Back Their Stock,still open
CIGNA Corp.,02/12/2023,Is 180 Life Sciences Corp (ATNF) Stock About to Get Hot Wednesday?,still open
CIGNA Corp.,02/12/2023,Cigna expects to affirm 2022 profit guidance in ‘the next several weeks’,still open
CIGNA Corp.,02/12/2023,Does Absci Corp (ABSI) Have What it Takes to be in Your Portfolio Tuesday?,still open
CIGNA Corp.,02/12/2023,Is McKesson Corp (MCK) a Winner in the Medical Distribution Industry?,still open
CIGNA Corp.,02/12/2023,CVS Health Corp. stock outperforms competitors on strong trading day,still open
CIGNA Corp.,02/12/2023,U.S. Sues Cigna Corp for Overcharging Medicare Advantage Program,still open
CIGNA Corp.,02/12/2023,"CVS Health Corp. stock falls Thursday, still outperforms market",still open
CIGNA Corp.,02/12/2023,How Will the Market React to Adaptive Biotechnologies Corp (ADPT) Stock Getting a Bearish Rating,still open
CIGNA Corp.,02/12/2023,Where Does McKesson Corp (MCK) Stock Fall in the Medical Distribution Field?,still open
CIGNA Corp.,02/12/2023,Trulieve Cannabis Corp (TCNNF) Rises 1.09% Thursday: Are Investors Bullish or Bearish On This Pot Stock?,still open
CIGNA Corp.,02/12/2023,"Cigna Corp (CI) Stock Price, Trades & News",still open
CIGNA Corp.,02/12/2023,"CVS Health Corp. stock falls Wednesday, underperforms market",still open
CIGNA Corp.,02/12/2023,Is Baudax Bio Inc (BXRX) Stock Worth a Buy Tuesday?,still open
CIGNA Corp.,02/12/2023,Analyst Rating: Will Cano Health Inc (CANO) Stock Beat the Market?,still open
CIGNA Corp.,02/12/2023,Jushi Holdings Inc (JUSHF) Stock Loses -34.21% This Week; Should You Buy?,still open
CIGNA Corp.,02/12/2023,"Is Spectrum Pharmaceuticals, Inc. (SPPI) Stock a Smart Investment Friday?",still open
CIGNA Corp.,02/12/2023,"Cigna Corporation (CI) Stock Price Today, Quote & News",still open
CIGNA Corp.,02/12/2023,ZimVie Inc (ZIMV) Stock: Do Analysts Think You Should Hold?,still open
CIGNA Corp.,02/12/2023,Sorrento Therapeutics Inc (SRNE) Stock Falls -23.30% This Week: Is It a Good Pick?,still open
CIGNA Corp.,02/12/2023,SNDL Inc (SNDL) Up 1.60% in Premarket Trading,still open
CIGNA Corp.,02/12/2023,Asensus Surgical Inc (ASXC) Stock Falls -12.82% This Week; Should You Buy?,still open
CIGNA Corp.,02/12/2023,Analyst Rating: Will Cronos Group Inc (CRON) Stock Lead the Market?,still open
CIGNA Corp.,02/12/2023,Chubb Completes Acquisition of Cigna's Personal Accident ...,still open
CIGNA Corp.,02/12/2023,"CVS Health Corp. stock rises Monday, outperforms market",still open
CIGNA Corp.,02/13/2023,"As Cigna Adds More Services, Insurer Adjusts Brands To Reflect Benefits And ‘Evernorth Health Services’",still open
CIGNA Corp.,02/13/2023,Cigna Evolves Brands to Reflect Growing Portfolio,still open
CIGNA Corp.,02/13/2023,Cigna reorganizes brand portfolio under new holding company ...,still open
CIGNA Corp.,02/13/2023,"Cigna Corp. stock rises Thursday, outperforms market",still open
CIGNA Corp.,02/13/2023,Cigna Reports Strong Fourth Quarter and Full Year 2022 Results ...,still open
CIGNA Corp.,02/13/2023,Cigna Ranked No. 1 in Healthcare for Protecting Customer Privacy,still open
CIGNA Corp.,02/13/2023,See Which Of The Latest 13F Filers Holds Cigna,still open
CIGNA Corp.,02/13/2023,Is This the Best Time To Initiate a Position in Cigna Corporation (CI)?,still open
CIGNA Corp.,02/13/2023,Employers Achieve Lower Costs and Improve Health Engagement ...,still open
CIGNA Corp.,02/13/2023,Where Does Cigna Corp (CI) Stock Fall in the Health Care Plans Field?,still open
CIGNA Corp.,02/13/2023,Which payer raked in the most cash last year? The answer likely ...,still open
CIGNA Corp.,02/13/2023,"Cigna Corp. stock falls Thursday, underperforms market",still open
CIGNA Corp.,02/13/2023,Cigna Corporation Is At A Great Entry Price (NYSE:CI),still open
CIGNA Corp.,02/13/2023,Cigna drops Fry's pharmacies from in-network insurance coverage,still open
CIGNA Corp.,02/13/2023,"Cigna Sues CVS, New Pharmacy Executive Over Noncompete (2)",still open
CIGNA Corp.,02/13/2023,Cigna Corp. stock underperforms Friday when compared to competitors,still open
CIGNA Corp.,02/13/2023,"Cigna Corp. stock falls Friday, underperforms market",still open
CIGNA Corp.,02/13/2023,Cigna in the headlines: 8 recent developments,still open
CIGNA Corp.,02/13/2023,BlackRock Updates Holdings in Cigna (CI),still open
CIGNA Corp.,02/13/2023,"Cigna Corp. Q4 Profit Increases, beats estimates",still open
CIGNA Corp.,02/13/2023,Should Cigna Corp (CI) Stock Be in Your Portfolio?,still open
CIGNA Corp.,02/13/2023,Cigna Corp (CI) Is the Top Stock in the Health Care Plans Industry?,still open
CIGNA Corp.,02/13/2023,"CIGNA GROUP : Amendments to Articles of Inc. or Bylaws; Change in Fiscal Year, Financial Statements and Exhibits (form 8-K)",still open
CIGNA Corp.,02/13/2023,"Cigna restricts coverage of new ALS drug, deepening fears about ...",still open
CIGNA Corp.,02/13/2023,Highland Capital Management LLC Has $16.06 Million Holdings in ...,still open
CIGNA Corp.,02/13/2023,3 Trends All HR Professionals Should Watch in 2023,still open
CIGNA Corp.,02/13/2023,"Cigna Worldwide insurance company receives branch license in Saudi Arabia, plans growth in the Kingdom",still open
CIGNA Corp.,02/13/2023,"Zacks.com featured highlights Stride, Herc Holdings, ONEOK and ...",still open
CIGNA Corp.,02/13/2023,Cigna Wins VHIS Medical Insurance and High-end Medical Insurance awards at the 10Life 5-Star Insurance Award 2022,still open
CIGNA Corp.,02/13/2023,"Jobs report, Sanofi earnings, Cigna results: 3 things to watch",still open
CIGNA Corp.,02/13/2023,Here's Why You Should Retain Walgreens Boots (WBA) For Now,still open
CIGNA Corp.,02/13/2023,Too soon to tell how Medicare Advantage changes will affect ...,still open
CIGNA Corp.,02/13/2023,The Cigna Group is committed to creating a better future built on the ...,still open
CIGNA Corp.,02/13/2023,"Insurance giant Cigna reverses position, will now pay claim",still open
CIGNA Corp.,02/13/2023,"False Claims Act settlements exceeded $2.2 billion in 2022, DOJ says",still open
CIGNA Corp.,02/13/2023,Centene warns of hit to fast-growing Medicare Advantage business ...,still open
CIGNA Corp.,02/13/2023,Factbox-Which CVS rivals also own primary care services,still open
CIGNA Corp.,02/13/2023,CI: 4 Stocks You Can Rely on in Any Market Conditions,still open
CIGNA Corp.,02/13/2023,Mitsubishi UFJ Trust & Banking Corp Buys 2213 Shares of Check ...,still open
CIGNA Corp.,02/13/2023,AFLAC Inc. stock underperforms Friday when compared to competitors despite daily gains,still open
CIGNA Corp.,02/13/2023,Cigna Corporation Announces Appearance at the 41st Annual J.P. ...,still open
CIGNA Corp.,02/13/2023,20 Biggest Global Insurance Companies by Market Cap,still open
CIGNA Corp.,02/13/2023,United States Files Civil Fraud Lawsuit Against Cigna For Artificially ...,still open
CIGNA Corp.,02/13/2023,Cigna Named Corporate Sustainability Leader by Dow Jones for ...,still open
CIGNA Corp.,02/13/2023,Cigna Stock Looks Set to Climb Higher,still open
CIGNA Corp.,02/13/2023,"Dr. David Brailer, M.D., Ph.D. Joins Cigna as Executive Vice ...",still open
CIGNA Corp.,02/13/2023,"SVB Securities Adjusts Price Target on Cigna to $309 From $335, Maintains Market Perform Rating",still open
CIGNA Corp.,02/13/2023,Cigna Earned the #1 Ranking for Corporate Citizenship in the ...,still open
CIGNA Corp.,02/13/2023,Cigna Corporation Announces Appearance at the Credit Suisse 31st ...,still open
CIGNA Corp.,02/13/2023,Cigna Transforms Care Experience for Patients With Complex ...,still open
CIGNA Corp.,02/13/2023,"Cigna Reports Strong Third Quarter 2022 Results, Raises 2022 ...",still open
CIGNA Corp.,02/13/2023,Press Releases | Cigna Newsroom,still open
CIGNA Corp.,02/13/2023,14 Predictions on What the Future of Healthcare Will Look Like,still open
CIGNA Corp.,02/13/2023,"Chris Davis Buys 3, Sells 2 in 4th Quarter",still open
CIGNA Corp.,02/13/2023,"Cigna Completes Transaction with Chubb - Jul 1, 2022",still open
CIGNA Corp.,02/13/2023,"Cigna Grows ACA Marketplace Presence, Giving More Customers ...",still open
CIGNA Corp.,02/13/2023,"Prudential Financial (PRU) Q4 Earnings Miss, Decrease Y/Y",still open
CIGNA Corp.,02/13/2023,Press Releases | Cigna Newsroom,still open
CIGNA Corp.,02/13/2023,"Cigna Expands Its Medicare Advantage Plans for 2023, Giving ...",still open
CIGNA Corp.,02/13/2023,Infusion Pharmacy Management Market Seeking Excellent Growth ...,still open
CIGNA Corp.,02/13/2023,Cigna Champions Vitality as a Next Generation Health Measure,still open
CIGNA Corp.,02/13/2023,Elevance Health: Attractive On Its Expansion Catalysts (NYSE:ELV),still open
CIGNA Corp.,02/13/2023,"Cigna Reports Strong Second Quarter 2022 Results, Raises 2022 ...",still open
CIGNA Corp.,02/13/2023,"Cigna Brings Comprehensive, Cost-Effective Marketplace Plans to ...",still open
CIGNA Corp.,02/13/2023,Cigna + Oscar Expands Footprint to Bring Small Businesses in ...,still open
CIGNA Corp.,02/13/2023,Press Releases | Cigna Newsroom,still open
CIGNA Corp.,02/13/2023,"Aigen Investment Management LP makes a $486,000 investment in ...",still open
CIGNA Corp.,02/13/2023,10 Hot Insurance Stocks To Buy Now,still open
CIGNA Corp.,02/13/2023,Cigna Announces $3.5 Billion Accelerated Stock Repurchase ...,still open
CIGNA Corp.,02/13/2023,"Cigna Declares Quarterly Dividend - Oct 26, 2022",still open
CIGNA Corp.,02/13/2023,4 Digital Trends that Will Shape Health Care in 2023,still open
CIGNA Corp.,02/13/2023,Cigna Honored by Business Group on Health as Best Employer for ...,still open
CIGNA Corp.,02/13/2023,Express Scripts Announces Strategic Partnership with Centene to ...,still open
CIGNA Corp.,02/13/2023,Press Releases | Cigna Newsroom,still open
CIGNA Corp.,02/13/2023,Best Online OCD Therapy of 2023,still open
CIGNA Corp.,02/13/2023,Cigna Spotlights Healthy Growth at Investor Day 2022,still open
CIGNA Corp.,02/13/2023,Vitality Drives Health and Well-being for Veterans,still open
CIGNA Corp.,02/13/2023,Evernorth's Birthday Wish: Better Health for All,still open
CIGNA Corp.,02/13/2023,"As Temperatures Rise, Cigna Offers Medicare Advantage ...",still open
CIGNA Corp.,02/13/2023,"Cigna Reports Strong First Quarter 2022 Results, Raises 2022 Outlook",still open
CIGNA Corp.,02/13/2023,"Amid NV's health provider shortage, insurance companies denying ...",still open
CIGNA Corp.,02/13/2023,Is Cigna Corp (CI) the Top Pick in the Health Care Plans Industry?,still open
CIGNA Corp.,02/13/2023,Is Cigna Corp (CI) Stock Near the Top of the Health Care Plans Industry?,still open
CIGNA Corp.,02/13/2023,Video: Cigna CEO David Cordani Says Now is the Time To ...,still open
CIGNA Corp.,02/13/2023,How to Get Health Insurance If You're Self-Employed or Unemployed,still open
CIGNA Corp.,02/13/2023,"Healthy Growth, Powered by Our Purpose: A Letter from Cigna ...",still open
CIGNA Corp.,02/13/2023,Addressing Employee Burnout by Building a Culture of Health,still open
CIGNA Corp.,02/13/2023,CMI & Zain KSA partner to provide all-round carrier services,still open
CIGNA Corp.,02/13/2023,"Humana, ChenMed trumpet 5-year network partnership",still open
CIGNA Corp.,02/13/2023,Cigna (CI) Hits 52-Week High: What's Driving the Stock?,still open
CIGNA Corp.,02/13/2023,Health Equity for the LGBTQ+ Community Starts With Providers,still open
CIGNA Corp.,02/13/2023,Cigna Gives Forward: Employee Stories of Giving and Volunteerism,still open
CIGNA Corp.,02/13/2023,Cigna Corp. stock outperforms competitors despite losses on the day,still open
CIGNA Corp.,02/13/2023,"How Cigna is Advancing Diversity, Equity, and Inclusion for ...",still open
CIGNA Corp.,02/13/2023,Cigna's David Cordani Addresses the Teen Mental Health Crisis at ...,still open
CIGNA Corp.,02/13/2023,[EXCLUSIVE] [INTERVIEW] cignature talks long-awaited comeback ...,still open
CIGNA Corp.,02/13/2023,Cigna Launches Provider Consult Service to Drive Better Outcomes ...,still open
CIGNA Corp.,02/13/2023,How Businesses Can Turn their Employee Health Plan into a ...,still open
CIGNA Corp.,02/13/2023,Is Cigna Corporation (CI) a Safe Investment During Macroeconomic Uncertainty?,still open
CIGNA Corp.,02/13/2023,Cigna Corp. stock outperforms market on strong trading day,still open
CIGNA Corp.,02/13/2023,Cigna Corp. stock underperforms Thursday when compared to competitors despite daily gains,still open
CIGNA Corp.,02/13/2023,Where Does Cigna Corp (CI) Stock Fall in the Health Care Plans Field?,still open
CIGNA Corp.,02/13/2023,"Cigna Corp. stock falls Thursday, underperforms market",still open
CIGNA Corp.,02/13/2023,Should Cigna Corp (CI) Stock Be in Your Portfolio?,still open
CIGNA Corp.,02/13/2023,Cigna Corp. stock underperforms Friday when compared to competitors,still open
CIGNA Corp.,02/13/2023,Cigna Corp (CI) Is the Top Stock in the Health Care Plans Industry?,still open
CIGNA Corp.,02/13/2023,See Which Of The Latest 13F Filers Holds Cigna,still open
CIGNA Corp.,02/13/2023,"Cigna stock bounces after profit tops expectations, while revenue comes up shy",still open
CIGNA Corp.,02/13/2023,Should You Buy Cigna Corp (CI) in Health Care Plans Industry?,still open
CIGNA Corp.,02/13/2023,BlackRock Updates Holdings in Cigna (CI),still open
CIGNA Corp.,02/13/2023,Highland Capital Management LLC Has $16.06 Million Holdings in ...,still open
CIGNA Corp.,02/13/2023,Mitsubishi UFJ Trust & Banking Corp Buys 2213 Shares of Check ...,still open
CIGNA Corp.,02/13/2023,"Zacks.com featured highlights Stride, Herc Holdings, ONEOK and Cigna",still open
CIGNA Corp.,02/13/2023,AFLAC Inc. stock underperforms Friday when compared to competitors despite daily gains,still open
CIGNA Corp.,02/13/2023,Altrius Capital Management Inc Sells 8022 Shares of Cigna Co ...,still open
CIGNA Corp.,02/13/2023,Cigna Co. (NYSE:CI) Shares Acquired by Fox Run Management L.L.C.,still open
CIGNA Corp.,02/13/2023,Validea's Top Ten Healthcare Stocks Based On Martin Zweig - 1/15 ...,still open
CIGNA Corp.,02/13/2023,"Jobs report, Sanofi earnings, Cigna results: 3 things to watch",still open
CIGNA Corp.,02/13/2023,Glenmede Trust Co. NA Has $45.70 Million Holdings in Cigna Co ...,still open
CIGNA Corp.,02/13/2023,Is Cigna Corp (CI) the Top Pick in the Health Care Plans Industry?,still open
CIGNA Corp.,02/13/2023,Centene warns of hit to fast-growing Medicare Advantage business next year,still open
CIGNA Corp.,02/13/2023,Is Cigna Corp (CI) Stock Near the Top of the Health Care Plans Industry?,still open
CIGNA Corp.,02/13/2023,"Chris Davis Buys 3, Sells 2 in 4th Quarter",still open
CIGNA Corp.,02/13/2023,Is Cigna Corp (CI) Stock Trading Below Fair Value?,still open
CIGNA Corp.,02/13/2023,"CI Stock Forecast, Price & News (Cigna)",still open
CIGNA Corp.,02/13/2023,CVS digs into primary care with $9.5 billion Oak Street Health deal ...,still open
CIGNA Corp.,02/13/2023,Cigna Corp. stock outperforms competitors despite losses on the day,still open
CIGNA Corp.,02/13/2023,Jupiter Asset Management Ltd. Grows Position in Franco-Nevada ...,still open
CIGNA Corp.,02/13/2023,Cigna Announces $3.5 Billion Accelerated Stock Repurchase ...,still open
CIGNA Corp.,02/13/2023,Is Cigna Corporation (CI) a Safe Investment During Macroeconomic Uncertainty?,still open
CIGNA Corp.,02/13/2023,"Cigna Corp. stock rises Tuesday, still underperforms market",still open
CIGNA Corp.,02/13/2023,"Cigna Corp. stock rises Monday, outperforms market",still open
CIGNA Corp.,02/13/2023,8907 Shares in Pembina Pipeline Co. (NYSE:PBA) Purchased by ...,still open
CIGNA Corp.,02/13/2023,Here's How Much a $1000 Investment in Cigna Made 10 Years Ago Would Be Worth Today,still open
CIGNA Corp.,02/13/2023,Is Cigna Corp (CI) The Right Choice in Health Care Plans?,still open
CIGNA Corp.,02/13/2023,"Cigna Corp. stock rises Friday, still underperforms market",still open
CIGNA Corp.,02/13/2023,Cigna Corp. stock underperforms Wednesday when compared to competitors,still open
CIGNA Corp.,02/13/2023,Is Cigna Corp (CI) a Winner in the Health Care Plans Industry?,still open
CIGNA Corp.,02/13/2023,Cigna Corp. Shares Approach 52-Week High - Market Mover,still open
CIGNA Corp.,02/13/2023,"Cigna Declares Quarterly Dividend - Oct 26, 2022",still open
CIGNA Corp.,02/13/2023,"Cigna Reports Strong Third Quarter 2022 Results, Raises 2022 ...",still open
CIGNA Corp.,02/13/2023,"AbbVie's Humira gets a U.S. rival, but costs could stay high",still open
CIGNA Corp.,02/13/2023,"Top Analyst Reports for UnitedHealth, Blackstone & Cigna",still open
CIGNA Corp.,02/13/2023,"Cigna Reports Strong Second Quarter 2022 Results, Raises 2022 ...",still open
CIGNA Corp.,02/13/2023,CIGNA CORP : Regulation FD Disclosure (form 8-K),still open
CIGNA Corp.,02/13/2023,CIGNA CORP MANAGEMENT'S DISCUSSION AND ANALYSIS OF FINANCIAL CONDITION AND RESULTS OF OPERATIONS (form 10-Q),still open
CIGNA Corp.,02/13/2023,CI: 3 Stocks Worth Buying Before Year-End,still open
CIGNA Corp.,02/13/2023,"Centene to cut costs with new pharmacy benefits manager, shares ...",still open
CIGNA Corp.,02/13/2023,"Stocks making the biggest moves premarket: Eli Lilly, Cigna, Restaurant Brands and more",still open
CIGNA Corp.,02/13/2023,"UnitedHealth, Cigna stocks fall after Raymond James downgrades, citing tripledemic and policy concerns",still open
CIGNA Corp.,02/13/2023,Cigna’s $2.5 Billion Stake In VillageMD’s Summit Venture To Grow Evernorth Provider Portfolio,still open
CIGNA Corp.,02/13/2023,CI: 2 Medical Stocks to Buy Now Without Hesitation,still open
CIGNA Corp.,02/13/2023,CI: These 2 Stocks Will Be Winners Over the Long Term,still open
CIGNA Corp.,02/13/2023,CI: 3 Reliable Stocks to Fall Back on When Times Are Tough,still open
CIGNA Corp.,02/13/2023,Pot Stock Drops 1.8% Wednesday: Should You Buy Hexo Corp (HEXO)?,still open
CIGNA Corp.,02/13/2023,4 Stocks From the Finance Sector Crushing the S&P 500 in 2022,still open
CIGNA Corp.,02/13/2023,Is Quidelortho Corp (QDEL) Stock a Smart Investment Wednesday?,still open
CIGNA Corp.,02/13/2023,"Cigna Reports Fourth Quarter and Full Year 2021 Results, Expects ...",still open
CIGNA Corp.,02/13/2023,Why Cigna Stock Could Rise Quickly,still open
CIGNA Corp.,02/13/2023,Cigna Rules Out Large-Scale M&A to Focus on Share Repurchases,still open
CIGNA Corp.,02/13/2023,CVS Health Corp. stock underperforms Monday when compared to competitors despite daily gains,still open
CIGNA Corp.,02/13/2023,Cigna CEO Sees 'Tremendous' Growth Opportunities in Middle East,still open
CIGNA Corp.,02/13/2023,"CVS Health Corp. stock rises Friday, outperforms market",still open
CIGNA Corp.,02/13/2023,Is Flora Growth Corp (FLGC) Stock About to Get Hot Friday?,still open
CIGNA Corp.,02/13/2023,"Market Awaits Jobs Report; United Therapeutics, Trane ...",still open
CIGNA Corp.,02/13/2023,This Health Insurance Company Is A Better Pick Over UnitedHealth Stock,still open
CIGNA Corp.,02/13/2023,"Market Rallies, But Defensive Stocks On Defense; Cigna, Flex ...",still open
CIGNA Corp.,02/13/2023,Analyst Rating: Will Clover Health Investments Corp (CLOV) Stock Lead the Market?,still open
CIGNA Corp.,02/13/2023,What is the Market's View on IM Cannabis Corp (IMCC) Stock's Price and Volume Trends Wednesday?,still open
CIGNA Corp.,02/13/2023,Elevance (ELV) Stock Plunges After First Earnings Since Dropping ...,still open
CIGNA Corp.,02/13/2023,Top 10 Health Insurance Stocks to Buy,still open
CIGNA Corp.,02/13/2023,"CVS Health Corp. stock falls Thursday, underperforms market",still open
CIGNA Corp.,02/13/2023,CVS Health Corp. stock outperforms competitors despite losses on the day,still open
CIGNA Corp.,02/13/2023,"CVS Health Corp. stock rises Monday, still underperforms market",still open
CIGNA Corp.,02/13/2023,Is 180 Life Sciences Corp (ATNF) Stock About to Get Hot Wednesday?,still open
CIGNA Corp.,02/13/2023,Cigna expects to affirm 2022 profit guidance in ‘the next several weeks’,still open
CIGNA Corp.,02/13/2023,"Humana, Cigna see gains in Medicare Advantage Star Rating for ...",still open
CIGNA Corp.,02/13/2023,Does Absci Corp (ABSI) Have What it Takes to be in Your Portfolio Tuesday?,still open
CIGNA Corp.,02/13/2023,Is McKesson Corp (MCK) a Winner in the Medical Distribution Industry?,still open
CIGNA Corp.,02/13/2023,CVS Health Corp. stock outperforms competitors on strong trading day,still open
CIGNA Corp.,02/13/2023,Should Diagnostics & Research Stock Invitae Corp (NVTA) Be in Your Portfolio Friday?,still open
CIGNA Corp.,02/13/2023,U.S. Sues Cigna Corp for Overcharging Medicare Advantage Program,still open
CIGNA Corp.,02/13/2023,"CVS Health Corp. stock falls Thursday, still outperforms market",still open
CIGNA Corp.,02/13/2023,How Will the Market React to Adaptive Biotechnologies Corp (ADPT) Stock Getting a Bearish Rating,still open
CIGNA Corp.,02/13/2023,Where Does McKesson Corp (MCK) Stock Fall in the Medical Distribution Field?,still open
CIGNA Corp.,02/13/2023,Trulieve Cannabis Corp (TCNNF) Rises 1.09% Thursday: Are Investors Bullish or Bearish On This Pot Stock?,still open
CIGNA Corp.,02/13/2023,"Cigna Corp (CI) Stock Price, Trades & News",still open
CIGNA Corp.,02/13/2023,"CVS Health Corp. stock falls Wednesday, underperforms market",still open
CIGNA Corp.,02/13/2023,Is Baudax Bio Inc (BXRX) Stock Worth a Buy Tuesday?,still open
CIGNA Corp.,02/13/2023,Analyst Rating: Will Cano Health Inc (CANO) Stock Beat the Market?,still open
CIGNA Corp.,02/13/2023,Jushi Holdings Inc (JUSHF) Stock Loses -34.21% This Week; Should You Buy?,still open
CIGNA Corp.,02/13/2023,"Is Spectrum Pharmaceuticals, Inc. (SPPI) Stock a Smart Investment Friday?",still open
CIGNA Corp.,02/13/2023,"Cigna Corporation (CI) Stock Price Today, Quote & News",still open
CIGNA Corp.,02/13/2023,ZimVie Inc (ZIMV) Stock: Do Analysts Think You Should Hold?,still open
CIGNA Corp.,02/13/2023,SNDL Inc (SNDL) Up 1.60% in Premarket Trading,still open
CIGNA Corp.,02/13/2023,Asensus Surgical Inc (ASXC) Stock Falls -12.82% This Week; Should You Buy?,still open
CIGNA Corp.,02/13/2023,Analyst Rating: Will Cronos Group Inc (CRON) Stock Lead the Market?,still open
CIGNA Corp.,02/13/2023,Chubb Completes Acquisition of Cigna's Personal Accident ...,still open
CIGNA Corp.,02/13/2023,"As Cigna Adds More Services, Insurer Adjusts Brands To Reflect Benefits And ‘Evernorth Health Services’",still open
CIGNA Corp.,02/13/2023,Cigna Evolves Brands to Reflect Growing Portfolio,still open
CIGNA Corp.,02/13/2023,Cigna reorganizes brand portfolio under new holding company ...,still open
CIGNA Corp.,02/13/2023,"Cigna Corp. stock rises Thursday, outperforms market",still open
CIGNA Corp.,02/13/2023,Cigna Reports Strong Fourth Quarter and Full Year 2022 Results ...,still open
CIGNA Corp.,02/13/2023,Cigna Ranked No. 1 in Healthcare for Protecting Customer Privacy,still open
CIGNA Corp.,02/13/2023,See Which Of The Latest 13F Filers Holds Cigna,still open
CIGNA Corp.,02/13/2023,Is This the Best Time To Initiate a Position in Cigna Corporation (CI)?,still open
CIGNA Corp.,02/13/2023,Employers Achieve Lower Costs and Improve Health Engagement ...,still open
CIGNA Corp.,02/13/2023,Where Does Cigna Corp (CI) Stock Fall in the Health Care Plans Field?,still open
CIGNA Corp.,02/13/2023,Which payer raked in the most cash last year? The answer likely ...,still open
CIGNA Corp.,02/13/2023,"Cigna Corp. stock falls Thursday, underperforms market",still open
CIGNA Corp.,02/13/2023,Cigna Corporation Is At A Great Entry Price (NYSE:CI),still open
CIGNA Corp.,02/13/2023,Cigna drops Fry's pharmacies from in-network insurance coverage,still open
CIGNA Corp.,02/13/2023,"Cigna Sues CVS, New Pharmacy Executive Over Noncompete (2)",still open
CIGNA Corp.,02/13/2023,Cigna Corp. stock underperforms Friday when compared to competitors,still open
CIGNA Corp.,02/13/2023,"Cigna Corp. stock falls Friday, underperforms market",still open
CIGNA Corp.,02/13/2023,Cigna in the headlines: 8 recent developments,still open
CIGNA Corp.,02/13/2023,BlackRock Updates Holdings in Cigna (CI),still open
