Name,Data,News,Evaluation
CIGNA Corp.,02/10/2023,"Zacks.com featured highlights Stride, Herc Holdings, ONEOK and ...",still open
CIGNA Corp.,02/10/2023,"AFLAC Inc. stock falls Thursday, underperforms market",still open
CIGNA Corp.,02/10/2023,Altrius Capital Management Inc Sells 8022 Shares of Cigna Co ...,still open
CIGNA Corp.,02/10/2023,"CIGNA CORP : Results of Operations and Financial Condition, Financial Statements and Exhibits (form 8-K)",still open
CIGNA Corp.,02/10/2023,Jupiter Asset Management Ltd. Grows Position in Franco-Nevada ...,still open
CIGNA Corp.,02/10/2023,"Alphabet, Apple And 3 Stocks To Watch Heading Into Friday - Apple (NASDAQ:AAPL), Cigna (NYSE:CI)",still open
CIGNA Corp.,02/10/2023,Cigna Co. (NYSE:CI) Shares Acquired by Fox Run Management L.L.C.,still open
CIGNA Corp.,02/10/2023,Top 5 4th Quarter Trades of GR,still open
CIGNA Corp.,02/10/2023,Validea's Top Ten Healthcare Stocks Based On Martin Zweig - 1/15 ...,still open
CIGNA Corp.,02/10/2023,CVS digs into primary care with $9.5 billion Oak Street Health deal ...,still open
CIGNA Corp.,02/10/2023,Glenmede Trust Co. NA Has $45.70 Million Holdings in Cigna Co ...,still open
CIGNA Corp.,02/10/2023,Is Cigna Corp (CI) Stock Near the Top of the Health Care Plans Industry?,still open
CIGNA Corp.,02/10/2023,Is Cigna Corp (CI) the Top Pick in the Health Care Plans Industry?,still open
CIGNA Corp.,02/10/2023,Cigna Corp. stock outperforms competitors on strong trading day,still open
CIGNA Corp.,02/10/2023,"CI Stock Forecast, Price & News (Cigna)",still open
CIGNA Corp.,02/10/2023,Centene warns of hit to fast-growing Medicare Advantage business ...,still open
CIGNA Corp.,02/10/2023,Cigna Announces $3.5 Billion Accelerated Stock Repurchase ...,still open
CIGNA Corp.,02/10/2023,Cigna Corp. stock outperforms competitors despite losses on the day,still open
CIGNA Corp.,02/10/2023,"Cigna Corp. stock falls Thursday, still outperforms market",still open
CIGNA Corp.,02/10/2023,Is Cigna Corporation (CI) a Safe Investment During Macroeconomic Uncertainty?,still open
CIGNA Corp.,02/10/2023,"Cigna Corp. stock rises Wednesday, still underperforms market",still open
CIGNA Corp.,02/10/2023,Risks To Shareholder Returns Are Elevated At These Prices For Cigna Corporation (NYSE:CI),still open
CIGNA Corp.,02/10/2023,"Cigna Corp. stock rises Tuesday, still underperforms market",still open
CIGNA Corp.,02/10/2023,"Cigna Corp. stock rises Tuesday, outperforms market",still open
CIGNA Corp.,02/10/2023,Implied IWY Analyst Target Price: $150,still open
CIGNA Corp.,02/10/2023,Cigna Corp. Shares Approach 52-Week High - Market Mover,still open
CIGNA Corp.,02/10/2023,Is Cigna Corp (CI) a Winner in the Health Care Plans Industry?,still open
CIGNA Corp.,02/10/2023,"Cigna Declares Quarterly Dividend - Oct 26, 2022",still open
CIGNA Corp.,02/10/2023,"Cigna Reports Strong Third Quarter 2022 Results, Raises 2022 ...",still open
CIGNA Corp.,02/10/2023,"Top Analyst Reports for UnitedHealth, Blackstone & Cigna",still open
CIGNA Corp.,02/10/2023,CVS buying primary care provider Oak Street Health for $10.6 billion,still open
CIGNA Corp.,02/10/2023,"Cigna Reports Strong Second Quarter 2022 Results, Raises 2022 ...",still open
CIGNA Corp.,02/10/2023,CIGNA CORP : Regulation FD Disclosure (form 8-K),still open
CIGNA Corp.,02/10/2023,Cigna Corporation's Third Quarter 2022 Earnings Release Details,still open
CIGNA Corp.,02/10/2023,"Stocks making the biggest moves premarket: Eli Lilly, Cigna, Restaurant Brands and more",still open
CIGNA Corp.,02/10/2023,"Centene to cut costs with new pharmacy benefits manager, shares ...",still open
CIGNA Corp.,02/10/2023,CI: 3 Stocks Worth Buying Before Year-End,still open
CIGNA Corp.,02/10/2023,"UnitedHealth, Cigna stocks fall after Raymond James downgrades, citing tripledemic and policy concerns",still open
CIGNA Corp.,02/10/2023,Cigna’s $2.5 Billion Stake In VillageMD’s Summit Venture To Grow Evernorth Provider Portfolio,still open
CIGNA Corp.,02/10/2023,CI: These 2 Stocks Will Be Winners Over the Long Term,still open
CIGNA Corp.,02/10/2023,CI: 2 Medical Stocks to Buy Now Without Hesitation,still open
CIGNA Corp.,02/10/2023,CI: 3 Reliable Stocks to Fall Back on When Times Are Tough,still open
CIGNA Corp.,02/10/2023,4 Stocks From the Finance Sector Crushing the S&P 500 in 2022,still open
CIGNA Corp.,02/10/2023,"The Zacks Analyst Blog Highlights Apple, Alibaba, Bristol-Myers Squibb, Tesla and Cigna",still open
CIGNA Corp.,02/10/2023,Pot Stock Drops 1.8% Wednesday: Should You Buy Hexo Corp (HEXO)?,still open
CIGNA Corp.,02/10/2023,Why Cigna Stock Could Rise Quickly,still open
CIGNA Corp.,02/10/2023,"Cigna Reports Fourth Quarter and Full Year 2021 Results, Expects ...",still open
CIGNA Corp.,02/10/2023,Is Quidelortho Corp (QDEL) Stock a Smart Investment Wednesday?,still open
CIGNA Corp.,02/10/2023,Cigna Rules Out Large-Scale M&A to Focus on Share Repurchases,still open
CIGNA Corp.,02/10/2023,This Health Insurance Company Is A Better Pick Over UnitedHealth ...,still open
CIGNA Corp.,02/10/2023,Is Flora Growth Corp (FLGC) Stock About to Get Hot Friday?,still open
CIGNA Corp.,02/10/2023,Cigna CEO Sees 'Tremendous' Growth Opportunities in Middle East,still open
CIGNA Corp.,02/10/2023,"Market Rallies, But Defensive Stocks On Defense; Cigna, Flex ...",still open
CIGNA Corp.,02/10/2023,Elevance (ELV) Stock Plunges After First Earnings Since Dropping ...,still open
CIGNA Corp.,02/10/2023,Analyst Rating: Will Clover Health Investments Corp (CLOV) Stock Lead the Market?,still open
CIGNA Corp.,02/10/2023,"Market Awaits Jobs Report; United Therapeutics, Trane ...",still open
CIGNA Corp.,02/10/2023,Top 10 Health Insurance Stocks to Buy,still open
CIGNA Corp.,02/10/2023,CVS Health Corp. stock outperforms competitors despite losses on the day,still open
CIGNA Corp.,02/10/2023,15 Companies That Are Buying Back Their Stock,still open
CIGNA Corp.,02/10/2023,"CVS Health Corp. stock rises Monday, still underperforms market",still open
CIGNA Corp.,02/10/2023,Cigna expects to affirm 2022 profit guidance in ‘the next several weeks’,still open
CIGNA Corp.,02/10/2023,U.S. Sues Cigna Corp for Overcharging Medicare Advantage Program,still open
CIGNA Corp.,02/10/2023,Is 180 Life Sciences Corp (ATNF) Stock About to Get Hot Wednesday?,still open
CIGNA Corp.,02/10/2023,"CVS Health Corp. stock falls Thursday, underperforms market",still open
CIGNA Corp.,02/10/2023,Does Absci Corp (ABSI) Have What it Takes to be in Your Portfolio Tuesday?,still open
CIGNA Corp.,02/10/2023,Is McKesson Corp (MCK) a Winner in the Medical Distribution Industry?,still open
CIGNA Corp.,02/10/2023,"CVS Health Corp. stock falls Thursday, still outperforms market",still open
CIGNA Corp.,02/10/2023,How Will the Market React to Adaptive Biotechnologies Corp (ADPT) Stock Getting a Bearish Rating,still open
CIGNA Corp.,02/10/2023,Where Does McKesson Corp (MCK) Stock Fall in the Medical Distribution Field?,still open
CIGNA Corp.,02/10/2023,"Cigna Corp (CI) Stock Price, Trades & News",still open
CIGNA Corp.,02/10/2023,Is Baudax Bio Inc (BXRX) Stock Worth a Buy Tuesday?,still open
CIGNA Corp.,02/10/2023,Analyst Rating: Will Cano Health Inc (CANO) Stock Beat the Market?,still open
CIGNA Corp.,02/10/2023,Jushi Holdings Inc (JUSHF) Stock Loses -34.21% This Week; Should You Buy?,still open
CIGNA Corp.,02/10/2023,"Is Spectrum Pharmaceuticals, Inc. (SPPI) Stock a Smart Investment Friday?",still open
CIGNA Corp.,02/10/2023,"CVS Health Corp. stock falls Wednesday, underperforms market",still open
CIGNA Corp.,02/10/2023,Cigna Corp (CI) Is the Top Stock in the Health Care Plans Industry?,still open
CIGNA Corp.,02/10/2023,"Cigna Corporation (CI) Stock Price Today, Quote & News",still open
CIGNA Corp.,02/10/2023,Chubb Completes Acquisition of Cigna's Personal Accident ...,still open
CIGNA Corp.,02/10/2023,ZimVie Inc (ZIMV) Stock: Do Analysts Think You Should Hold?,still open
CIGNA Corp.,02/10/2023,Sorrento Therapeutics Inc (SRNE) Stock Falls -23.30% This Week: Is It a Good Pick?,still open
CIGNA Corp.,02/10/2023,SNDL Inc (SNDL) Up 1.60% in Premarket Trading,still open
CIGNA Corp.,02/10/2023,Asensus Surgical Inc (ASXC) Stock Falls -12.82% This Week; Should You Buy?,still open
CIGNA Corp.,02/10/2023,Analyst Rating: Will Cronos Group Inc (CRON) Stock Lead the Market?,still open
CIGNA Corp.,02/10/2023,Is Eargo Inc (EAR) Stock a Smart Investment Wednesday?,still open
CIGNA Corp.,02/10/2023,Form 8-K Cigna Corp For: Dec 30,still open
CIGNA Corp.,02/10/2023,"Cigna Corp. stock rises Thursday, outperforms market",still open
CIGNA Corp.,02/10/2023,Cigna Reports Strong Fourth Quarter and Full Year 2022 Results ...,still open
CIGNA Corp.,02/10/2023,Cigna expects revenue gains from launches of Humira biosimilars,still open
CIGNA Corp.,02/10/2023,Cigna Corporation (NYSE:CI) Q4 2022 Earnings Call Transcript,still open
CIGNA Corp.,02/10/2023,Cigna Corp. stock outperforms market on strong trading day,still open
CIGNA Corp.,02/10/2023,Cigna Ranked No. 1 in Healthcare for Protecting Customer Privacy,still open
CIGNA Corp.,02/10/2023,Fmr Increases Position in Cigna (CI),still open
CIGNA Corp.,02/10/2023,Highland Capital Management LLC Has $16.06 Million Holdings in ...,still open
CIGNA Corp.,02/10/2023,Cigna Earned the #1 Ranking for Corporate Citizenship in the ...,still open
CIGNA Corp.,02/10/2023,"Cigna Sues Former Executive Bricker, CVS Over Departure to Rival",still open
CIGNA Corp.,02/10/2023,Employers Achieve Lower Costs and Improve Health Engagement ...,still open
CIGNA Corp.,02/10/2023,BlackRock Updates Holdings in Cigna (CI),still open
CIGNA Corp.,02/10/2023,Cigna Corporation Is At A Great Entry Price (NYSE:CI),still open
CIGNA Corp.,02/10/2023,Cigna drops Fry's pharmacies from in-network insurance coverage,still open
CIGNA Corp.,02/10/2023,"Cigna restricts coverage of new ALS drug, deepening fears about ...",still open
CIGNA Corp.,02/10/2023,"Cigna Corp. Q4 Profit Increases, beats estimates",still open
CIGNA Corp.,02/10/2023,Cigna Corp. stock underperforms Friday when compared to competitors,still open
CIGNA Corp.,02/10/2023,Should Cigna Corp (CI) Stock Be in Your Portfolio?,still open
CIGNA Corp.,02/10/2023,"Cigna Corp. stock falls Friday, underperforms market",still open
CIGNA Corp.,02/10/2023,Cigna Corp. stock outperforms competitors on strong trading day,still open
CIGNA Corp.,02/10/2023,"NOCD Raises $34M in Round Led by Cigna Ventures, 7wireVentures",still open
CIGNA Corp.,02/10/2023,"Cigna Worldwide Insurance Company Receives Branch License in Saudi Arabia, Plans Growth in the Kingdom",still open
CIGNA Corp.,02/10/2023,"CIGNA CORP : Results of Operations and Financial Condition, Financial Statements and Exhibits (form 8-K)",still open
CIGNA Corp.,02/10/2023,3 Trends All HR Professionals Should Watch in 2023,still open
CIGNA Corp.,02/10/2023,"The Best Shape of Her Life: Stronger, More Fit, and 220 Pounds ...",still open
CIGNA Corp.,02/10/2023,Cigna in the headlines: 8 recent developments,still open
CIGNA Corp.,02/10/2023,"Zacks.com featured highlights Stride, Herc Holdings, ONEOK and ...",still open
CIGNA Corp.,02/10/2023,CI: 4 Stocks You Can Rely on in Any Market Conditions,still open
CIGNA Corp.,02/10/2023,Health-insurance stocks drop after Medicare Advantage proposes ...,still open
CIGNA Corp.,02/10/2023,John Perry: Deeply disappointed by proposed state shift in retiree insurance,still open
CIGNA Corp.,02/10/2023,Factbox-Which CVS rivals also own primary care services,still open
CIGNA Corp.,02/10/2023,Altrius Capital Management Inc Sells 8022 Shares of Cigna Co ...,still open
CIGNA Corp.,02/10/2023,Centene warns of hit to fast-growing Medicare Advantage business ...,still open
CIGNA Corp.,02/10/2023,"Insurance giant Cigna reverses position, will now pay claim",still open
CIGNA Corp.,02/10/2023,Cigna Wins VHIS Medical Insurance and High-end Medical Insurance awards at the 10Life 5-Star Insurance Award 2022,still open
CIGNA Corp.,02/10/2023,Too soon to tell how Medicare Advantage changes will affect ...,still open
CIGNA Corp.,02/10/2023,"False Claims Act settlements exceeded $2.2 billion in 2022, DOJ says",still open
CIGNA Corp.,02/10/2023,St. Luke's Health returns to Cigna network - Houston Business Journal,still open
CIGNA Corp.,02/10/2023,Time to Buy Cigna or Regeneron Stock Before Earnings?,still open
CIGNA Corp.,02/10/2023,Investing In Cigna Five Years Ago Fetches Shareholders A 68% Gain,still open
CIGNA Corp.,02/10/2023,Cigna Co. (NYSE:CI) Shares Acquired by Fox Run Management L.L.C.,still open
CIGNA Corp.,02/10/2023,Glenmede Trust Co. NA Has $45.70 Million Holdings in Cigna Co ...,still open
CIGNA Corp.,02/10/2023,Top Stories: Lawmakers introduce bills seeking to halt VA HER ...,still open
CIGNA Corp.,02/10/2023,Cigna Corporation's Fourth Quarter 2022 Earnings Release Details - Cigna (NYSE:CI),still open
CIGNA Corp.,02/10/2023,"AFLAC Inc. stock falls Thursday, underperforms market",still open
CIGNA Corp.,02/10/2023,Top 5 4th Quarter Trades of GR,still open
CIGNA Corp.,02/10/2023,"Radian Group (RDN) Q4 Earnings Top Estimates, Decrease Y/Y",still open
CIGNA Corp.,02/10/2023,What 7 payers said about Medicaid redeterminations,still open
CIGNA Corp.,02/10/2023,March 24th Options Now Available For Cigna (CI),still open
CIGNA Corp.,02/10/2023,"Raymond James Lowers Price Target on Cigna to $350 From $370, Maintains Outperform Rating",still open
CIGNA Corp.,02/10/2023,"SVB Securities Adjusts Price Target on Cigna to $309 From $335, Maintains Market Perform Rating",still open
CIGNA Corp.,02/10/2023,Cigna Corporation Announces Appearance at the 41st Annual J.P. ...,still open
CIGNA Corp.,02/10/2023,"Deutsche Bank Adjusts Cigna's Price Target to $348 From $359, Maintains Hold Rating",still open
CIGNA Corp.,02/10/2023,Elevance Health: Attractive On Its Expansion Catalysts (NYSE:ELV),still open
CIGNA Corp.,02/10/2023,Cigna-owned Express Scripts taps new president,still open
CIGNA Corp.,02/10/2023,"Prudential Financial (PRU) Q4 Earnings Miss, Decrease Y/Y",still open
CIGNA Corp.,02/10/2023,Cigna Named Corporate Sustainability Leader by Dow Jones for ...,still open
CIGNA Corp.,02/10/2023,United States Files Civil Fraud Lawsuit Against Cigna For Artificially ...,still open
CIGNA Corp.,02/10/2023,Child Health Insurance Market to See Huge Growth : Cigna ...,still open
CIGNA Corp.,02/10/2023,"Alphabet, Apple And 3 Stocks To Watch Heading Into Friday - Apple (NASDAQ:AAPL), Cigna (NYSE:CI)",still open
CIGNA Corp.,02/10/2023,"Assurant (AIZ) Q4 Earnings & Revenues Beat, Premiums Rise Y/Y",still open
CIGNA Corp.,02/10/2023,Molina Healthcare (MOH) Q4 Earnings Beat on Solid Medicaid Unit,still open
CIGNA Corp.,02/10/2023,"Dr. David Brailer, M.D., Ph.D. Joins Cigna as Executive Vice ...",still open
CIGNA Corp.,02/10/2023,Infusion Pharmacy Management Market Seeking Excellent Growth ...,still open
CIGNA Corp.,02/10/2023,Motco Sells 413 Shares of Cigna Co. (NYSE:CI),still open
CIGNA Corp.,02/10/2023,Express Scripts headquarters in north St. Louis County sells for $36 ...,still open
CIGNA Corp.,02/10/2023,iShares Global Healthcare ETF Experiences Big Outflow,still open
CIGNA Corp.,02/10/2023,Oscar posts $226M loss in Q4,still open
CIGNA Corp.,02/10/2023,"Cigna Reports Strong Third Quarter 2022 Results, Raises 2022 ...",still open
CIGNA Corp.,02/10/2023,Cigna Corporation Announces Appearance at the Credit Suisse 31st ...,still open
CIGNA Corp.,02/10/2023,Cigna Transforms Care Experience for Patients With Complex ...,still open
CIGNA Corp.,02/10/2023,Press Releases | Cigna Newsroom,still open
CIGNA Corp.,02/10/2023,14 Predictions on What the Future of Healthcare Will Look Like,still open
CIGNA Corp.,02/10/2023,[EXCLUSIVE] [INTERVIEW] cignature talks long-awaited comeback ...,still open
CIGNA Corp.,02/10/2023,"Cigna Completes Transaction with Chubb - Jul 1, 2022",still open
CIGNA Corp.,02/10/2023,"Cigna Grows ACA Marketplace Presence, Giving More Customers ...",still open
CIGNA Corp.,02/10/2023,California lawsuit accuses drugmakers of insulin overcharging,still open
CIGNA Corp.,02/10/2023,10 Hot Insurance Stocks To Buy Now,still open
CIGNA Corp.,02/10/2023,Press Releases | Cigna Newsroom,still open
CIGNA Corp.,02/10/2023,"Cigna Reports Strong Second Quarter 2022 Results, Raises 2022 ...",still open
CIGNA Corp.,02/10/2023,Cigna Champions Vitality as a Next Generation Health Measure,still open
CIGNA Corp.,02/10/2023,"Cigna Brings Comprehensive, Cost-Effective Marketplace Plans to ...",still open
CIGNA Corp.,02/10/2023,"Cigna Expands Its Medicare Advantage Plans for 2023, Giving ...",still open
CIGNA Corp.,02/10/2023,Cigna + Oscar Expands Footprint to Bring Small Businesses in ...,still open
CIGNA Corp.,02/10/2023,Press Releases | Cigna Newsroom,still open
CIGNA Corp.,02/10/2023,Cigna Announces $3.5 Billion Accelerated Stock Repurchase ...,still open
CIGNA Corp.,02/10/2023,Implied IWY Analyst Target Price: $150,still open
CIGNA Corp.,02/10/2023,"Cigna Declares Quarterly Dividend - Oct 26, 2022",still open
CIGNA Corp.,02/10/2023,Cigna Honored by Business Group on Health as Best Employer for ...,still open
CIGNA Corp.,02/10/2023,4 Digital Trends that Will Shape Health Care in 2023,still open
CIGNA Corp.,02/10/2023,Express Scripts Announces Strategic Partnership with Centene to ...,still open
CIGNA Corp.,02/10/2023,Press Releases | Cigna Newsroom,still open
CIGNA Corp.,02/10/2023,Cigna Spotlights Healthy Growth at Investor Day 2022,still open
CIGNA Corp.,02/10/2023,Vitality Drives Health and Well-being for Veterans,still open
CIGNA Corp.,02/10/2023,Evernorth's Birthday Wish: Better Health for All,still open
CIGNA Corp.,02/10/2023,"Cigna Reports Strong First Quarter 2022 Results, Raises 2022 Outlook",still open
CIGNA Corp.,02/10/2023,Is Cigna Corp (CI) the Top Pick in the Health Care Plans Industry?,still open
CIGNA Corp.,02/10/2023,Video: Cigna CEO David Cordani Says Now is the Time To ...,still open
CIGNA Corp.,02/10/2023,"As Temperatures Rise, Cigna Offers Medicare Advantage ...",still open
CIGNA Corp.,02/10/2023,SAS showcases latest in analytics and AI at LEAP 2023,still open
CIGNA Corp.,02/10/2023,"Cigna Corp. stock rises Thursday, outperforms market",still open
CIGNA Corp.,02/10/2023,Where Does Cigna Corp (CI) Stock Fall in the Health Care Plans Field?,still open
CIGNA Corp.,02/10/2023,Fmr Increases Position in Cigna (CI),still open
CIGNA Corp.,02/10/2023,Cigna (NYSE:CI) Updates FY23 Earnings Guidance,still open
CIGNA Corp.,02/10/2023,Cigna Corp. stock underperforms Thursday when compared to competitors despite daily gains,still open
CIGNA Corp.,02/10/2023,"Cigna Corp. stock falls Thursday, underperforms market",still open
CIGNA Corp.,02/10/2023,Highland Capital Management LLC Has $16.06 Million Holdings in ...,still open
CIGNA Corp.,02/10/2023,Cigna Corp. stock outperforms market on strong trading day,still open
CIGNA Corp.,02/10/2023,Should Cigna Corp (CI) Stock Be in Your Portfolio?,still open
CIGNA Corp.,02/10/2023,"Cigna stock bounces after profit tops expectations, while revenue comes up shy",still open
CIGNA Corp.,02/10/2023,Cigna Corp. stock underperforms Friday when compared to competitors,still open
CIGNA Corp.,02/10/2023,Should You Buy Cigna Corp (CI) in Health Care Plans Industry?,still open
CIGNA Corp.,02/10/2023,BlackRock Updates Holdings in Cigna (CI),still open
CIGNA Corp.,02/10/2023,Health-insurance stocks drop after Medicare Advantage proposes ...,still open
CIGNA Corp.,02/10/2023,"Zacks.com featured highlights Stride, Herc Holdings, ONEOK and ...",still open
CIGNA Corp.,02/10/2023,"AFLAC Inc. stock falls Thursday, underperforms market",still open
CIGNA Corp.,02/10/2023,Altrius Capital Management Inc Sells 8022 Shares of Cigna Co ...,still open
CIGNA Corp.,02/10/2023,"CIGNA CORP : Results of Operations and Financial Condition, Financial Statements and Exhibits (form 8-K)",still open
CIGNA Corp.,02/10/2023,Jupiter Asset Management Ltd. Grows Position in Franco-Nevada ...,still open
CIGNA Corp.,02/10/2023,"Alphabet, Apple And 3 Stocks To Watch Heading Into Friday - Apple (NASDAQ:AAPL), Cigna (NYSE:CI)",still open
CIGNA Corp.,02/10/2023,Cigna Co. (NYSE:CI) Shares Acquired by Fox Run Management L.L.C.,still open
CIGNA Corp.,02/10/2023,Top 5 4th Quarter Trades of GR,still open
CIGNA Corp.,02/10/2023,Validea's Top Ten Healthcare Stocks Based On Martin Zweig - 1/15 ...,still open
CIGNA Corp.,02/10/2023,CVS digs into primary care with $9.5 billion Oak Street Health deal ...,still open
CIGNA Corp.,02/10/2023,Glenmede Trust Co. NA Has $45.70 Million Holdings in Cigna Co ...,still open
CIGNA Corp.,02/10/2023,Is Cigna Corp (CI) Stock Near the Top of the Health Care Plans Industry?,still open
CIGNA Corp.,02/10/2023,Is Cigna Corp (CI) the Top Pick in the Health Care Plans Industry?,still open
CIGNA Corp.,02/10/2023,Cigna Corp. stock outperforms competitors on strong trading day,still open
CIGNA Corp.,02/10/2023,"CI Stock Forecast, Price & News (Cigna)",still open
CIGNA Corp.,02/10/2023,Centene warns of hit to fast-growing Medicare Advantage business ...,still open
CIGNA Corp.,02/10/2023,Cigna Announces $3.5 Billion Accelerated Stock Repurchase ...,still open
CIGNA Corp.,02/10/2023,Cigna Corp. stock outperforms competitors despite losses on the day,still open
CIGNA Corp.,02/10/2023,"Cigna Corp. stock falls Thursday, still outperforms market",still open
CIGNA Corp.,02/10/2023,Is Cigna Corporation (CI) a Safe Investment During Macroeconomic Uncertainty?,still open
CIGNA Corp.,02/10/2023,"Cigna Corp. stock rises Wednesday, still underperforms market",still open
CIGNA Corp.,02/10/2023,Risks To Shareholder Returns Are Elevated At These Prices For Cigna Corporation (NYSE:CI),still open
CIGNA Corp.,02/10/2023,"Cigna Corp. stock rises Tuesday, still underperforms market",still open
CIGNA Corp.,02/10/2023,"Cigna Corp. stock rises Tuesday, outperforms market",still open
CIGNA Corp.,02/10/2023,Implied IWY Analyst Target Price: $150,still open
CIGNA Corp.,02/10/2023,Cigna Corp. Shares Approach 52-Week High - Market Mover,still open
CIGNA Corp.,02/10/2023,Is Cigna Corp (CI) a Winner in the Health Care Plans Industry?,still open
CIGNA Corp.,02/10/2023,"Cigna Declares Quarterly Dividend - Oct 26, 2022",still open
CIGNA Corp.,02/10/2023,"Cigna Reports Strong Third Quarter 2022 Results, Raises 2022 ...",still open
CIGNA Corp.,02/10/2023,"Top Analyst Reports for UnitedHealth, Blackstone & Cigna",still open
CIGNA Corp.,02/10/2023,CVS buying primary care provider Oak Street Health for $10.6 billion,still open
CIGNA Corp.,02/10/2023,"Cigna Reports Strong Second Quarter 2022 Results, Raises 2022 ...",still open
CIGNA Corp.,02/10/2023,CIGNA CORP : Regulation FD Disclosure (form 8-K),still open
CIGNA Corp.,02/10/2023,Cigna Corporation's Third Quarter 2022 Earnings Release Details,still open
CIGNA Corp.,02/10/2023,"Stocks making the biggest moves premarket: Eli Lilly, Cigna, Restaurant Brands and more",still open
CIGNA Corp.,02/10/2023,"Centene to cut costs with new pharmacy benefits manager, shares ...",still open
CIGNA Corp.,02/10/2023,CI: 3 Stocks Worth Buying Before Year-End,still open
CIGNA Corp.,02/10/2023,"UnitedHealth, Cigna stocks fall after Raymond James downgrades, citing tripledemic and policy concerns",still open
CIGNA Corp.,02/10/2023,Cigna’s $2.5 Billion Stake In VillageMD’s Summit Venture To Grow Evernorth Provider Portfolio,still open
CIGNA Corp.,02/10/2023,CI: These 2 Stocks Will Be Winners Over the Long Term,still open
CIGNA Corp.,02/10/2023,CI: 2 Medical Stocks to Buy Now Without Hesitation,still open
CIGNA Corp.,02/10/2023,CI: 3 Reliable Stocks to Fall Back on When Times Are Tough,still open
CIGNA Corp.,02/10/2023,4 Stocks From the Finance Sector Crushing the S&P 500 in 2022,still open
CIGNA Corp.,02/10/2023,"The Zacks Analyst Blog Highlights Apple, Alibaba, Bristol-Myers Squibb, Tesla and Cigna",still open
CIGNA Corp.,02/10/2023,Pot Stock Drops 1.8% Wednesday: Should You Buy Hexo Corp (HEXO)?,still open
CIGNA Corp.,02/10/2023,Why Cigna Stock Could Rise Quickly,still open
CIGNA Corp.,02/10/2023,"Cigna Reports Fourth Quarter and Full Year 2021 Results, Expects ...",still open
CIGNA Corp.,02/10/2023,Is Quidelortho Corp (QDEL) Stock a Smart Investment Wednesday?,still open
CIGNA Corp.,02/10/2023,Cigna Rules Out Large-Scale M&A to Focus on Share Repurchases,still open
CIGNA Corp.,02/10/2023,This Health Insurance Company Is A Better Pick Over UnitedHealth ...,still open
CIGNA Corp.,02/10/2023,Is Flora Growth Corp (FLGC) Stock About to Get Hot Friday?,still open
CIGNA Corp.,02/10/2023,Cigna CEO Sees 'Tremendous' Growth Opportunities in Middle East,still open
CIGNA Corp.,02/10/2023,"Market Rallies, But Defensive Stocks On Defense; Cigna, Flex ...",still open
CIGNA Corp.,02/10/2023,Elevance (ELV) Stock Plunges After First Earnings Since Dropping ...,still open
CIGNA Corp.,02/10/2023,Analyst Rating: Will Clover Health Investments Corp (CLOV) Stock Lead the Market?,still open
CIGNA Corp.,02/10/2023,"Market Awaits Jobs Report; United Therapeutics, Trane ...",still open
CIGNA Corp.,02/10/2023,Top 10 Health Insurance Stocks to Buy,still open
CIGNA Corp.,02/10/2023,CVS Health Corp. stock outperforms competitors despite losses on the day,still open
CIGNA Corp.,02/10/2023,15 Companies That Are Buying Back Their Stock,still open
CIGNA Corp.,02/10/2023,"CVS Health Corp. stock rises Monday, still underperforms market",still open
CIGNA Corp.,02/10/2023,Cigna expects to affirm 2022 profit guidance in ‘the next several weeks’,still open
CIGNA Corp.,02/10/2023,U.S. Sues Cigna Corp for Overcharging Medicare Advantage Program,still open
CIGNA Corp.,02/10/2023,Is 180 Life Sciences Corp (ATNF) Stock About to Get Hot Wednesday?,still open
