Name,Data,News,Evaluation
Discovery Communications,02/13/2023,Aptorum Group Regains Compliance with Nasdaq Minimum Bid ...,still open
Discovery Communications,02/13/2023,3 Reasons to Avoid Warner Bros. Discovery Stock in 2023,still open
Discovery Communications,02/13/2023,Will the WarnerMedia Acquisition Boost Discovery Stock?,still open
Discovery Communications,02/13/2023,Is Discovery Communications Stock a Buy?,still open
Discovery Communications,02/13/2023,Is Warner Bros. Discovery Stock A Buy During The Dip? (NASDAQ ...,still open
Discovery Communications,02/13/2023,"Warner Bros. Discovery Stock: Looking Better, But Not Good Enough ...",still open
Discovery Communications,02/13/2023,"Down 45% From Its High, Is Warner Bros. Discovery A Buy?",still open
Discovery Communications,02/13/2023,"Ellis Martin Report : Latin Metals Inc. Rock Sampling Returns 1.3% Copper at Tillo Copper Project, Peru",still open
Discovery Communications,02/13/2023,"WarnerMedia, Discovery complete merger, become Warner Bros. Discovery",still open
Discovery Communications,02/13/2023,Warner Bros,still open
Discovery Communications,02/13/2023,Why Discovery Stock Tumbled 12% This Week,still open
Discovery Communications,02/13/2023,David Zaslav's top priority at Warner Bros. Discovery: Get the cash flowing again,still open
Discovery Communications,02/13/2023,WBD - Warner Bros.Discovery Inc Ordinary Shares - Class A Stock ...,still open
Discovery Communications,02/13/2023,Warner Bros. Discovery Unveils Communications Team Leadership,still open
Discovery Communications,02/13/2023,Better Buy: Warner Bros. Discovery vs. Paramount Global,still open
Discovery Communications,02/13/2023,"Warner Bros. Discovery, Inc. (WBD) Presents at Citi's 2023 ...",still open
Discovery Communications,02/13/2023,"WARNER BROS. DISCOVERY CHIEF FINANCIAL OFFICER GUNNAR WIEDENFELS TO PRESENT AT THE CITI 2023 COMMUNICATIONS, MEDIA & ENTERTAINMENT CONFERENCE",still open
Discovery Communications,02/13/2023,Why Warner Bros. Discovery Investors Should Tread Lightly,still open
Discovery Communications,02/13/2023,Warner Bros. Discovery jettisons more key executives as company shake-up continues,still open
Discovery Communications,02/13/2023,Will AT&T or Verizon Cut Their Dividends In 2023?,still open
Discovery Communications,02/13/2023,AT&T After Its Discovery Deal: Is the Stock a Good Investment?,still open
Discovery Communications,02/13/2023,Should You Invest in Warner Bros. Discovery Stock?,still open
Discovery Communications,02/13/2023,"If You Invested $10,000 in AT&T in 1984, This Is How Much You ...",still open
Discovery Communications,02/13/2023,"Warner Bros.Discovery Inc (WBD) Stock Price, Trades & News",still open
Discovery Communications,02/13/2023,"Stocks making the biggest moves premarket: Apple, CarMax, Bed Bath & Beyond and more",still open
Discovery Communications,02/13/2023,"Stocks making the biggest moves after hours: Block, PayPal, Carvana, Twilio and more",still open
Discovery Communications,02/13/2023,"Stocks making the biggest moves midday: Lyft, Carvana, Warner Bros. Discovery, DraftKings",still open
Discovery Communications,02/13/2023,Discovery will sell its Knoxville headquarters after Warner Bros ...,still open
Discovery Communications,02/13/2023,Why Discovery Stock Is Soaring Today,still open
Discovery Communications,02/13/2023,DISCA Stock price: Discovery Communications suffers as part of rumoured Archegos liquidation,still open
Discovery Communications,02/13/2023,Layoffs Begin at CNN Amid Warner Bros. Discovery Cost-Cutting Plan,still open
Discovery Communications,02/13/2023,Warner Bros. Discovery Unveils Executive Team for Nordics,still open
Discovery Communications,02/13/2023,3 (Related) Reasons Merging HBO Max and Discovery+ Is a Mistake,still open
Discovery Communications,02/13/2023,Discovery Joins the Streaming Wars With Its Own '+' Service,still open
Discovery Communications,02/13/2023,11 Best Streaming Stocks To Buy Now,still open
Discovery Communications,02/13/2023,Discovery CEO David Zaslav’s 2021 Pay Package Soars to $246M Ahead of WarnerMedia Merger,still open
Discovery Communications,02/13/2023,"2022 was tough for media stocks like Netflix and Disney, and 2023 doesn't look good, either",still open
Discovery Communications,02/13/2023,Warner Bros. Discovery Leadership Team Draws Ire Over Diversity,still open
Discovery Communications,02/13/2023,Discovery Closes In on Acquisition of WarnerMedia,still open
Discovery Communications,02/13/2023,Why This 1 Stock Is a Better Bet Than Discovery Ahead of Its Merger,still open
Discovery Communications,02/13/2023,Is AT&T Stock a Buy Now?,still open
Discovery Communications,02/13/2023,3 Tech Growth Stocks With More Potential Than Any Cryptocurrency,still open
Discovery Communications,02/13/2023,Discovery: My Favorite Media Stock For The Next Five Years ...,still open
Discovery Communications,02/13/2023,Better Buy: AT&T vs. Verizon Stock,still open
Discovery Communications,02/13/2023,‘It’s a sign of me buying.’ Inside the indictment of Archegos owner Bill Hwang,still open
Discovery Communications,02/13/2023,"3 Reasons to Buy AT&T, and 1 Reason to Sell",still open
Discovery Communications,02/13/2023,Which Is a Better Buy: Warner Bros. Discovery or Netflix?,still open
Discovery Communications,02/13/2023,Better Dividend Stock: AT&T vs. IBM,still open
Discovery Communications,02/13/2023,Sell These 3 Stocks and Kick These Overpaid CEOs Out of Your ...,still open
Discovery Communications,02/13/2023,AT&T Announces Details for Completion of WM Spin-Off,still open
Discovery Communications,02/13/2023,4 stocks of streaming-related companies drop 5% or more as investors lose confidence that the Fed might ease up,still open
Discovery Communications,02/13/2023,The Dish: Warner Bros. Discovery Braces For New Round Of Layoffs This Week,still open
Discovery Communications,02/13/2023,Warner Bros. Discovery Logs Big Q2 Loss on Content and Merger Costs,still open
Discovery Communications,02/13/2023,"Stocks making the biggest moves in the premarket: Zoom, Palo Alto Networks, Macy's and more",still open
Discovery Communications,02/13/2023,Warner Bros. Discovery Confuses Fans With 'Batgirl' And Other Cancellations,still open
Discovery Communications,02/13/2023,"CuriosityStream: A Speculative, but Promising Streaming Penny Stock",still open
Discovery Communications,02/13/2023,"AT&T to spin off WarnerMedia in $43 billion Discovery media merger, cuts dividend",still open
Discovery Communications,02/13/2023,"Stocks rise ahead of U.S. midterm elections, Dow closes more than 400 points higher",still open
Discovery Communications,02/13/2023,3 Reasons to Avoid AT&T Stock in 2023,still open
Discovery Communications,02/13/2023,David Zaslav Says Warner Bros. Discovery Is “Not For Sale” In Town Hall With Staff,still open
Discovery Communications,02/13/2023,Why AT&T Rose 18.8% in October,still open
Discovery Communications,02/13/2023,Warner Bros. Discovery planning major restructuring months after merger,still open
Discovery Communications,02/13/2023,Pomerantz Law Firm Announces the Filing of a Class Action Against ...,still open
Discovery Communications,02/13/2023,"Warner Bros. Discovery Stock Jumps Over 5% on Picks From Bank of America, Goldman Sachs",still open
Discovery Communications,02/13/2023,"Warner Bros. Discovery, Inc. (WBD) Q3 2022 Earnings Call Transcript",still open
Discovery Communications,02/13/2023,The Spinoff Breathes New Life Into AT&T And Warner Bros. (NYSE:T),still open
Discovery Communications,02/13/2023,AT&T To Spin-Merge WarnerMedia With Discovery,still open
Discovery Communications,02/13/2023,"Warner Bros. Discovery Taps Asif Sadiq as Chief Global Diversity, Equity and Inclusion Officer",still open
Discovery Communications,02/13/2023,Better Telecom Dividend Stock Post-Spinoff: AT&T or Verizon?,still open
Discovery Communications,02/13/2023,AT&T announces $43 billion deal to merge WarnerMedia with Discovery,still open
Discovery Communications,02/13/2023,3 High-Yield Dividend Stocks That Could Jump 15% to 24 ...,still open
Discovery Communications,02/13/2023,Michael Burry is Betting Everything on These 6 Stocks,still open
Discovery Communications,02/13/2023,3 Advantages for Discovery Communications in Streaming Video,still open
Discovery Communications,02/13/2023,Warner Bros. Discovery GAAP EPS of -$0.95 misses by $0.45 ...,still open
Discovery Communications,02/13/2023,"Stocks making the biggest moves in the premarket: Nio, Veru ...",still open
Discovery Communications,02/13/2023,Stock market today: Dow shrugs off rising yields to close higher,still open
Discovery Communications,02/13/2023,Warner Bros. Discovery Restructures DEI Team With an International Geographic Focus (Exclusive),still open
Discovery Communications,02/14/2023,On-Demand Male Contraceptive Shows Promise in Preclinical Study,still open
Discovery Communications,02/14/2023,Male Birth Control Drug Sees ‘Game-Changer’ Trial In Mice—Here’s What You Need To Know,still open
Discovery Communications,02/14/2023,Male contraceptive shows promise in preclinical study,still open
Discovery Communications,02/14/2023,"Olympic Media Rights Awarded to Warner Bros. Discovery, EBU",still open
Discovery Communications,02/14/2023,Inside Warner Bros. Discovery’s Secret Joint Bid With the European Broadcasting Union For Media Rights to the Olympics,still open
Discovery Communications,02/14/2023,"EBU, Warner Bros Discovery awarded media rights in Europe to 2032",still open
Discovery Communications,02/14/2023,BioMed X Launches New T Cell Immunology Discovery Platform,still open
Discovery Communications,02/14/2023,Judge denies LIV Golf request to expand discovery to Augusta ...,still open
Discovery Communications,02/14/2023,Cedara Accelerates Expansion with Appointment of Eric Shih as ...,still open
Discovery Communications,02/14/2023,Newfoundland Discovery Engages IR Contractor,still open
Discovery Communications,02/14/2023,How To Scale Your PPC & Advertising Way Beyond Google Ads ...,still open
Discovery Communications,02/14/2023,Falling asteroid sparks brilliant fireball over Europe just hours after ...,still open
Discovery Communications,02/14/2023,"Delix Therapeutics Partners With Cellectricon, Expressive ...",still open
Discovery Communications,02/14/2023,Congress weighing TikTok ban following Chinese spy balloon ...,still open
Discovery Communications,02/14/2023,Lithium discovery,still open
Discovery Communications,02/14/2023,Celebrate Women in Discovery Science,still open
Discovery Communications,02/14/2023,Genomics discovery of giant fungal viruses from subsurface oceanic ...,still open
Discovery Communications,02/14/2023,Discovery Education Announces New Appointments to Senior ...,still open
Discovery Communications,02/14/2023,LEGO Store Opening In DC Area Crowns First Master Lego Builder,still open
Discovery Communications,02/14/2023,Deadline for Submitting to Bumpers College Discovery Journal Is ...,still open
Discovery Communications,02/14/2023,V. Craig Jordan to give inaugural lecture on cancer drug discovery ...,still open
Discovery Communications,02/14/2023,"PGA Tour alleges Phil Mickelson, others have failed to produce core responsive documents in LIV Golf antitrust suit; tour seeks discovery extension",still open
Discovery Communications,02/14/2023,Is communication between spouses' privilege? - The General ...,still open
Discovery Communications,02/14/2023,FinThrive Named 2023 Best in KLAS for Insurance Discovery Solution,still open
Discovery Communications,02/14/2023,Heart disease kills 1 in 3 women annually but not all women ...,still open
Discovery Communications,02/14/2023,Showtime’s Erin Calhoun Named Head Of Communications For Paramount Streaming; Susan Lundgren To Exit,still open
Discovery Communications,02/14/2023,"Sensei Biotherapeutics to Present New Preclinical Data for SNS-101, a Conditionally Active VISTA-blocking Antibody, at the Keystone Symposia on Next Generation Antibody Therapeutics",still open
Discovery Communications,02/14/2023,Which Food Retailers Stand Out for Their Customer Service?,still open
Discovery Communications,02/14/2023,Artificial Intelligence Aids Discovery of Super Tight-Binding Antibodies,still open
Discovery Communications,02/14/2023,Evotec and Related Sciences Expand Integrated Drug Discovery ...,still open
Discovery Communications,02/14/2023,16-Year-Old Suspended After Discovery Of Loaded Gun,still open
Discovery Communications,02/14/2023,"Rilvegostomig, AstraZeneca's Bi-specific Antibody Derived from ...",still open
Discovery Communications,02/14/2023,Ohio University professor Jennifer Hines and her research group ...,still open
Discovery Communications,02/14/2023,KalVista Pharmaceuticals Provides Progress Updates on ...,still open
Discovery Communications,02/14/2023,'Natural killer' immune cells can modify tissue inflammation: study,still open
Discovery Communications,02/14/2023,Orbit Discovery and Endevica Bio Enter Multi-target Collaboration to Advance Development of Cachexia Therapeutics,still open
Discovery Communications,02/14/2023,Judge sanctions Facebook and BigLaw firm $925K for 'delay ...,still open
Discovery Communications,02/14/2023,"Chinese Balloon Had Tools to Collect Electronic Communications, U.S. Says",still open
Discovery Communications,02/14/2023,Somnus Scientific enhances their competitive intelligence with Epistemic AI,still open
Discovery Communications,02/14/2023,"Metagenomi Appoints Sarah Noonberg, M.D., Ph.D. as Chief ...",still open
Discovery Communications,02/14/2023,Researchers develop concept for rational design of important nitrogen compounds,still open
Discovery Communications,02/14/2023,Discovery will sell its Knoxville headquarters after Warner Bros ...,still open
Discovery Communications,02/14/2023,Here's What Will Happen to AT&T and Discovery Communications ...,still open
Discovery Communications,02/14/2023,Warner & Rubio Question Meta on Internal Documents Revealing ...,still open
Discovery Communications,02/14/2023,"Telomeres, mitochondria, and inflammation oh my! Three hallmarks ...",still open
Discovery Communications,02/14/2023,Microsoft Adds More Viva Engage Features as Yammer Retirement Picks Up Pace,still open
Discovery Communications,02/14/2023,Discovery Communications and Liberty Global to acquire All3Media,still open
Discovery Communications,02/14/2023,Warner Bros Discovery Sets Communications Exec Ranks ...,still open
Discovery Communications,02/14/2023,Warner Bros. Discovery Renews Contracts of Top Executives Gunnar Wiedenfels and Bruce Campbell,still open
Discovery Communications,02/14/2023,"Discovery, Inc. Announces Future Leadership Team for Warner Bros ...",still open
Discovery Communications,02/14/2023,Warner Bros. Discovery Won’t Overspend On Content As Last Discovery Quarter Tops 24M Streaming Subscribers,still open
Discovery Communications,02/14/2023,"Karen Grinthal, Veteran Ad Exec, to Exit Warner Bros. Discovery",still open
Discovery Communications,02/14/2023,Fitch Affirms Discovery Comm's 'BBB-' IDR; Assigns 'BBB-' IDRs to ...,still open
Discovery Communications,02/14/2023,"Warner Bros. Discovery, Inc. (WBD) Presents at Citi's 2023 ...",still open
Discovery Communications,02/14/2023,The Franklin Drive-In Theater in Kentucky is Closing,still open
Discovery Communications,02/14/2023,NanoString to Release Fourth Quarter and Fiscal Year 2022 ...,still open
Discovery Communications,02/14/2023,Several Warner Bros. Discovery TV Execs Are Out Amid Restructuring,still open
Discovery Communications,02/14/2023,Get Discovery+ for just $0.99 per month for 3 months with this Cyber ...,still open
Discovery Communications,02/14/2023,Warner Bros. Discovery Sets Out Germany Management Team; Discovery Deutschland Exec Alberto Horta To Exit,still open
Discovery Communications,02/14/2023,Warner Bros,still open
Discovery Communications,02/14/2023,Warner Bros. Discovery Logs Big Q2 Loss on Content and Merger Costs,still open
Discovery Communications,02/14/2023,Mike Rowe gets filthy on ‘Dirty Jobs’ to reconnect Americans,still open
Discovery Communications,02/14/2023,"Warner Bros Discovery's David Zaslav has charmed the Hollywood elite — now he'll have to show he can manage them, too",still open
Discovery Communications,02/14/2023,HBO Max Lawsuit Is Another Unforced Error for Warner Bros ...,still open
Discovery Communications,02/14/2023,Alianza Minerals Receives Approval for Repriced Warrants and Announces Warrant Exercise Incentive Program,still open
Discovery Communications,02/14/2023,David Zaslav's top priority at Warner Bros. Discovery: Get the cash flowing again,still open
Discovery Communications,02/14/2023,3 Reasons to Avoid Warner Bros. Discovery Stock in 2023,still open
Discovery Communications,02/14/2023,Warner Bros. Discovery Earnings: Focusing on Profits Over Users Is ...,still open
Discovery Communications,02/14/2023,Discovery Closes In on Acquisition of WarnerMedia,still open
Discovery Communications,02/14/2023,Class Action Alleges HGTV.com Visitors' Info Is Shared With ...,still open
Discovery Communications,02/14/2023,Warner Bros. Discovery Names Nathaniel Brown Chief Corporate Communications Officer,still open
Discovery Communications,02/14/2023,"Following HBO Max Removing Shows Like Westworld, Warner Bros ...",still open
Discovery Communications,02/14/2023,Luis Silberwasser Leaves TelevisaUnivision To Lead Warner Bros. Discovery Sports,still open
Discovery Communications,02/14/2023,Discovery CEO David Zaslav’s 2021 Pay Package Soars to $246M Ahead of WarnerMedia Merger,still open
Discovery Communications,02/14/2023,Discovery loses £12m on GB News,still open
Discovery Communications,02/14/2023,How Warner Bros. Discovery is scaling email personalization,still open
Discovery Communications,02/14/2023,The ‘How To’ Guide on UC Discovery & Migration,still open
Discovery Communications,02/14/2023,"Amazon, WarnerMedia and Discovery Join Russian Boycott",still open
Discovery Communications,02/14/2023,3 Advantages for Discovery Communications in Streaming Video,still open
Discovery Communications,02/14/2023,Johanna Fuentes Departs As Head of Global Communications Studios & Networks Group At Warner Bros. Discovery,still open
Discovery Communications,02/14/2023,Warner Bros. Discovery Confuses Fans With 'Batgirl' And Other Cancellations,still open
Discovery Communications,02/14/2023,Mythbusters streaming guide: How to watch Mythbusters online in ...,still open
Discovery Communications,02/14/2023,Discovery Communications leaving Silver Spring for New York City ...,still open
Discovery Communications,02/14/2023,Warner Bros. Discovery Leadership Team Draws Ire Over Diversity,still open
Discovery Communications,02/14/2023,Why do woodpeckers peck? New discovery about bird brains sheds ...,still open
Discovery Communications,02/14/2023,"Larry Laque, Kristin Brown, Jessica Driscoll, Doug Seybert Among Slew of TV Execs Ousted at Warner Bros. Discovery (EXCLUSIVE)",still open
Discovery Communications,02/14/2023,Scoop: CNN+ looks doomed,still open
Discovery Communications,02/14/2023,AT&T To Spin-Merge WarnerMedia With Discovery,still open
Discovery Communications,02/14/2023,New Winston & Strawn E-Discovery Partner: Approaches to ...,still open
Discovery Communications,02/14/2023,"DISCOVERY COMMUNICATIONS PRIVACY POLICY – Discovery, Inc.",still open
Discovery Communications,02/14/2023,HBO Max & Discovery + To Give Netflix And Hulu Stiff Competition,still open
Discovery Communications,02/14/2023,"Warner Bros. Discovery Sets CEE, Baltics, Middle East, Med And ...",still open
Discovery Communications,02/14/2023,UVA Discovery Could Improve Drug Development,still open
Discovery Communications,02/14/2023,Discovery Communications India's FY21 revenue up 10.32% to Rs 928.8 crore,still open
Discovery Communications,02/14/2023,Is Discovery Communications Stock a Buy?,still open
Discovery Communications,02/14/2023,"Warner Bros Discovery Restructures Diversity, Equity And Inclusion Group, Sets New Exec Roster",still open
Discovery Communications,02/14/2023,Discovery of small molecule agonists of the Relaxin Family Peptide ...,still open
Discovery Communications,02/14/2023,Warner Bros. Discovery Cuts Four Top OWN Execs (EXCLUSIVE),still open
Discovery Communications,02/14/2023,Why Warner Bros Discovery Is the S&P's Hottest Stock,still open
Discovery Communications,02/14/2023,"Monday Sector Leaders: Services, Technology & Communications",still open
Discovery Communications,02/14/2023,Should You Still Buy the S&P 500's Best-Performing January Stocks?,still open
Discovery Communications,02/14/2023,Warner Bros. Discovery: Business Model Flaws Date Way Back To ...,still open
Discovery Communications,02/14/2023,Inside Warner Bros. Discovery’s Secret Joint Bid With the European Broadcasting Union For Media Rights to the Olympics,still open
Discovery Communications,02/14/2023,What will TV be like in three years? Insiders predict future,still open
Discovery Communications,02/14/2023,20 Power Players Helping David Zaslav Transform Warner Bros ...,still open
Discovery Communications,02/14/2023,Evotec and Related Sciences expand integrated drug discovery and development partnership,still open
Discovery Communications,02/14/2023,KalVista Pharmaceuticals Provides Progress Updates on Sebetralstat Development,still open
Discovery Communications,02/14/2023,"Top Research Reports for Chevron, Novo Nordisk & Amgen",still open
Discovery Communications,02/14/2023,Better Buy: AT&T vs. Verizon,still open
Discovery Communications,02/14/2023,"Rilvegostomig, AstraZeneca's Bi-specific Antibody Derived from Compugen's COM902, Expected to Progress into Phase 3",still open
Discovery Communications,02/14/2023,"Compugen to Release Fourth Quarter and Full Year 2022 Results on Monday, February 27, 2023",still open
Discovery Communications,02/14/2023,Disc Medicine Announces $62.5 Million Financing led by Bain Capital Life Sciences to Advance Portfolio of Novel Hematology Programs,still open
Discovery Communications,02/14/2023,Discovery surrounding newly appointed Chula Vista councilmember stirs contention in South Bay,still open
Discovery Communications,02/14/2023,Here's What Will Happen to AT&T and Discovery Communications ...,still open
Discovery Communications,02/14/2023,Stock Market,still open
Discovery Communications,02/14/2023,Aptorum Group Announces 1-for-10 Reverse Stock Split,still open
Discovery Communications,02/14/2023,Surge Copper Confirms Large New Zinc-Silver-Gold-Lead ...,still open
Discovery Communications,02/14/2023,Aligos Therapeutics to Present Program Updates at the 32nd Conference of the Asian Pacific Association for the Study of the Liver,still open
Discovery Communications,02/14/2023,Brett Favre files another motion to dismiss Mississippi lawsuit ...,still open
Discovery Communications,02/14/2023,"ALX Resources Corp. Stakes Crystal Lithium Project, Northern Saskatchewan, Canada",still open
Discovery Communications,02/14/2023,3 Reasons to Avoid Warner Bros. Discovery Stock in 2023,still open
Discovery Communications,02/14/2023,Aptorum Group Regains Compliance with Nasdaq Minimum Bid ...,still open
Discovery Communications,02/14/2023,Will the WarnerMedia Acquisition Boost Discovery Stock?,still open
Discovery Communications,02/14/2023,Is Discovery Communications Stock a Buy?,still open
Discovery Communications,02/14/2023,Is Warner Bros. Discovery Stock A Buy During The Dip? (NASDAQ ...,still open
Discovery Communications,02/14/2023,"Warner Bros. Discovery Stock: Looking Better, But Not Good Enough ...",still open
Discovery Communications,02/14/2023,"Down 45% From Its High, Is Warner Bros. Discovery A Buy?",still open
Discovery Communications,02/14/2023,Why Discovery Stock Tumbled 12% This Week,still open
Discovery Communications,02/14/2023,Warner Bros,still open
Discovery Communications,02/14/2023,Reunion Neuroscience Provides Business Update and Reports ...,still open
Discovery Communications,02/14/2023,"WarnerMedia, Discovery complete merger, become Warner Bros. Discovery",still open
Discovery Communications,02/14/2023,David Zaslav's top priority at Warner Bros. Discovery: Get the cash flowing again,still open
Discovery Communications,02/14/2023,Warner Bros. Discovery Unveils Communications Team Leadership,still open
Discovery Communications,02/14/2023,Better Buy: Warner Bros. Discovery vs. Paramount Global,still open
Discovery Communications,02/14/2023,WBD - Warner Bros.Discovery Inc Ordinary Shares - Class A Stock ...,still open
Discovery Communications,02/14/2023,"WARNER BROS. DISCOVERY CHIEF FINANCIAL OFFICER GUNNAR WIEDENFELS TO PRESENT AT THE CITI 2023 COMMUNICATIONS, MEDIA & ENTERTAINMENT CONFERENCE",still open
Discovery Communications,02/14/2023,"Warner Bros. Discovery, Inc. (WBD) Presents at Citi's 2023 ...",still open
Discovery Communications,02/14/2023,Faraday Copper Announces Closing of C$40 Million Bought Deal ...,still open
Discovery Communications,02/14/2023,Why Warner Bros. Discovery Investors Should Tread Lightly,still open
Discovery Communications,02/14/2023,Johnson & Johnson to Participate in the Barclays Global HealthCare Conference,still open
Discovery Communications,02/14/2023,Warner Bros. Discovery jettisons more key executives as company shake-up continues,still open
Discovery Communications,02/14/2023,Will AT&T or Verizon Cut Their Dividends In 2023?,still open
Discovery Communications,02/14/2023,AT&T After Its Discovery Deal: Is the Stock a Good Investment?,still open
Discovery Communications,02/14/2023,Should You Invest in Warner Bros. Discovery Stock?,still open
Discovery Communications,02/14/2023,"If You Invested $10,000 in AT&T in 1984, This Is How Much You ...",still open
