Name,Data,News,Evaluation
Discovery Communications,02/07/2023,Warner Bros. Discovery Confuses Fans With 'Batgirl' And Other Cancellations,still open
Discovery Communications,02/07/2023,"AT&T to spin off WarnerMedia in $43 billion Discovery media merger, cuts dividend",still open
Discovery Communications,02/07/2023,"CuriosityStream: A Speculative, but Promising Streaming Penny Stock",still open
Discovery Communications,02/07/2023,"Stocks rise ahead of U.S. midterm elections, Dow closes more than 400 points higher",still open
Discovery Communications,02/07/2023,Discovery Joins the Streaming Wars With Its Own '+' Service,still open
Discovery Communications,02/07/2023,3 High-Yield Dividend Stocks That Could Jump 15% to 24 ...,still open
Discovery Communications,02/07/2023,Why AT&T Rose 18.8% in October,still open
Discovery Communications,02/07/2023,Pomerantz Law Firm Announces the Filing of a Class Action Against ...,still open
Discovery Communications,02/07/2023,The Spinoff Breathes New Life Into AT&T And Warner Bros. (NYSE:T),still open
Discovery Communications,02/07/2023,"Amazon, WarnerMedia and Discovery Join Russian Boycott",still open
Discovery Communications,02/07/2023,3 Cathie Wood Stocks That Could Deliver Bigger Gains Than the ...,still open
Discovery Communications,02/07/2023,AT&T To Spin-Merge WarnerMedia With Discovery,still open
Discovery Communications,02/07/2023,"WBD Stock Forecast, Price & News (Warner Bros. Discovery)",still open
Discovery Communications,02/07/2023,"Warner Bros. Discovery, Inc. (WBD) Q3 2022 Earnings Call Transcript",still open
Discovery Communications,02/07/2023,Better Telecom Dividend Stock Post-Spinoff: AT&T or Verizon?,still open
Discovery Communications,02/07/2023,AT&T And Discovery: The Sum Of The Parts,still open
Discovery Communications,02/07/2023,Michael Burry is Betting Everything on These 6 Stocks,still open
Discovery Communications,02/08/2023,FinThrive Named 2023 Best in KLAS for Insurance Discovery Solution,still open
Discovery Communications,02/08/2023,Deadline for Submitting to Bumpers College Discovery Journal Is ...,still open
Discovery Communications,02/08/2023,Ivey attempting to suppress communications between her office ...,still open
Discovery Communications,02/08/2023,V. Craig Jordan to give inaugural lecture on cancer drug discovery ...,still open
Discovery Communications,02/08/2023,Ethics group sues the National Archives over classified documents discovery,still open
Discovery Communications,02/08/2023,"PGA Tour alleges Phil Mickelson, others have failed to produce core responsive documents in LIV Golf antitrust suit; tour seeks discovery extension",still open
Discovery Communications,02/08/2023,Warner Bros. Discovery to still offer Discovery+ as standalone ...,still open
Discovery Communications,02/08/2023,Discovery surrounding newly appointed Chula Vista councilmember stirs contention in South Bay,still open
Discovery Communications,02/08/2023,Judge denies LIV Golf request to expand discovery to Augusta ...,still open
Discovery Communications,02/08/2023,3 Reasons to Avoid Warner Bros. Discovery Stock in 2023,still open
Discovery Communications,02/08/2023,"EBU, Warner Bros Discovery awarded media rights in Europe to 2032",still open
Discovery Communications,02/08/2023,Inside the Academy’s Quest to Help Filmmakers Preserve Digital Titles,still open
Discovery Communications,02/08/2023,Meghan Markle Faces Race Against Time in Samantha Markle Lawsuit,still open
Discovery Communications,02/08/2023,Genomics discovery of giant fungal viruses from subsurface oceanic ...,still open
Discovery Communications,02/08/2023,From Comcast to Netflix: Tracking streaming video and pay TV ...,still open
Discovery Communications,02/08/2023,"Superman, Batman and Swamp Thing to anchor DC's revamped ...",still open
Discovery Communications,02/08/2023,A major archaeological discovery was made on the Miami River. Was it kept ‘under wraps’?,still open
Discovery Communications,02/08/2023,Slone Partners Places Gayarthri Swaminath as SVP of Discovery and Edward Moler as VP of Data Science at Juvena,still open
Discovery Communications,02/08/2023,Pfizer ordered to disclose FBI communications in trade secrets case,still open
Discovery Communications,02/08/2023,Showtime’s Erin Calhoun Named Head Of Communications For Paramount Streaming; Susan Lundgren To Exit,still open
Discovery Communications,02/08/2023,"Telomeres, mitochondria, and inflammation oh my! Three hallmarks ...",still open
Discovery Communications,02/08/2023,AI-Based Strategy Boosts High-Affinity Antibody Drug Discovery,still open
Discovery Communications,02/08/2023,Jon and Kate Gosselin's daughter Mady takes a stand against online trolls: 'You are not entitled to anything',still open
Discovery Communications,02/08/2023,Law Firm M&A Deals Should Consolidate Their Tech Solutions Early,still open
Discovery Communications,02/08/2023,Intel 471 Announces Powerful and Scalable Attack Surface ...,still open
Discovery Communications,02/08/2023,"Behind Friday's $161M IPO: A star scientist, GPCR drug discovery ...",still open
Discovery Communications,02/08/2023,"Rustrela virus, a relative of rubella, identified as cause of dangerous feline disease",still open
Discovery Communications,02/08/2023,"Resonac Selects Enthought’s Materials Informatics Acceleration Program to Expand Machine Learning Pipeline, Cultivate Broader Culture Change",still open
Discovery Communications,02/08/2023,"US Prosecutors Want to Delay CFTC, SEC Fraud Cases Against ...",still open
Discovery Communications,02/08/2023,Surge Copper Confirms Large New Zinc-Silver-Gold-Lead ...,still open
Discovery Communications,02/08/2023,Armin Afsahi appointed vice president for alumni relations and ...,still open
Discovery Communications,02/08/2023,Bullet found in Moore High School classroom leads to discovery of gun,still open
Discovery Communications,02/08/2023,Researchers Discover a Previously Unknown Cellular Component ...,still open
Discovery Communications,02/08/2023,Should You Still Buy the S&P 500's Best-Performing January Stocks?,still open
Discovery Communications,02/08/2023,First chance to come together and share your bicentenary ideas ...,still open
Discovery Communications,02/08/2023,"Outlook on the Smart Machines in Enterprise, Industrial Automation, and IIoT Global Market to 2028: Improvements in the Smart Workplace, Smart Data Discovery and Cognitive Automation Drive Growth",still open
Discovery Communications,02/08/2023,Game-changing $10-million gift positions Sinai Health at the ...,still open
Discovery Communications,02/08/2023,The Franklin Drive-In Theater in Kentucky is Closing,still open
Discovery Communications,02/08/2023,Grand Jury in Clean Water Act Probe Gets Video of Feds' Search,still open
Discovery Communications,02/08/2023,Discovery will sell its Knoxville headquarters after Warner Bros ...,still open
Discovery Communications,02/08/2023,"Codebreakers Have Deciphered The Lost Letters of Mary, Queen of ...",still open
Discovery Communications,02/08/2023,Here's What Will Happen to AT&T and Discovery Communications ...,still open
Discovery Communications,02/08/2023,Penn State Applied Research Laboratory awarded $734M Naval ...,still open
Discovery Communications,02/08/2023,"Republicans, aided by Musk, accuse Big Tech of colluding with ...",still open
Discovery Communications,02/08/2023,The United States Supreme Court Decides Not To Rule On Case ...,still open
Discovery Communications,02/08/2023,"Hospitality, Gaming & Leisure Brochure - Hotels & Hospitality ...",still open
Discovery Communications,02/08/2023,UMass Chan Medical School licenses data processing and analysis ...,still open
Discovery Communications,02/08/2023,Arvind Raman selected as the next dean of Purdue's College of ...,still open
Discovery Communications,02/08/2023,JCDecaux appoints Elina Valtia as the new CEO in Finland,still open
Discovery Communications,02/08/2023,Discovery Communications and Liberty Global to acquire All3Media,still open
Discovery Communications,02/08/2023,"Warner Bros Discovery Sets Communications Exec Ranks, Announces Exit Of Eight Veteran Staffers",still open
Discovery Communications,02/08/2023,You can get 3 months of Discovery+ at $0.99 a month for Cyber ...,still open
Discovery Communications,02/08/2023,Warner Bros. Discovery Renews Contracts of Top Executives Gunnar Wiedenfels and Bruce Campbell,still open
Discovery Communications,02/08/2023,"Rubio, Warner Question Meta on User Data Access in China, Russia ...",still open
Discovery Communications,02/08/2023,"Discovery, Inc. Announces Future Leadership Team for Warner Bros ...",still open
Discovery Communications,02/08/2023,Comparison of fecal and blood metabolome reveals inconsistent ...,still open
Discovery Communications,02/08/2023,Warner Bros. Discovery Won’t Overspend On Content As Last Discovery Quarter Tops 24M Streaming Subscribers,still open
Discovery Communications,02/08/2023,"Karen Grinthal, Veteran Ad Exec, to Exit Warner Bros. Discovery",still open
Discovery Communications,02/08/2023,KalVista Pharmaceuticals Presents Data at Western Society of ...,still open
Discovery Communications,02/08/2023,Fitch Affirms Discovery Comm's 'BBB-' IDR; Assigns 'BBB-' IDRs to ...,still open
Discovery Communications,02/08/2023,NCC-CSIRT issues advisories to protect Nigerians against threat ...,still open
Discovery Communications,02/08/2023,"Warner Bros. Discovery, Inc. (WBD) Presents at Citi's 2023 ...",still open
Discovery Communications,02/08/2023,Several Warner Bros. Discovery TV Execs Are Out Amid Restructuring,still open
Discovery Communications,02/08/2023,George 'The Penguin' Mitchell's encrypted phone service hacked by ...,still open
Discovery Communications,02/08/2023,HBO Max Lawsuit Is Another Unforced Error for Warner Bros ...,still open
Discovery Communications,02/08/2023,Warner Bros. Discovery Sets Out Germany Management Team; Discovery Deutschland Exec Alberto Horta To Exit,still open
Discovery Communications,02/08/2023,Warner Bros. Discovery Logs Big Q2 Loss on Content and Merger Costs,still open
Discovery Communications,02/08/2023,Warner Bros. Discovery Names Nathaniel Brown Chief Corporate Communications Officer,still open
Discovery Communications,02/08/2023,"Warner Bros Discovery's David Zaslav has charmed the Hollywood elite — now he'll have to show he can manage them, too",still open
Discovery Communications,02/08/2023,Mike Rowe gets filthy on ‘Dirty Jobs’ to reconnect Americans,still open
Discovery Communications,02/08/2023,Warner Bros,still open
Discovery Communications,02/08/2023,Warner Bros. Discovery Earnings: Focusing on Profits Over Users Is ...,still open
Discovery Communications,02/08/2023,David Zaslav's top priority at Warner Bros. Discovery: Get the cash flowing again,still open
Discovery Communications,02/08/2023,Class Action Alleges HGTV.com Visitors' Info Is Shared With ...,still open
Discovery Communications,02/08/2023,Discovery Closes In on Acquisition of WarnerMedia,still open
Discovery Communications,02/08/2023,Luis Silberwasser Leaves TelevisaUnivision To Lead Warner Bros. Discovery Sports,still open
Discovery Communications,02/08/2023,"Following HBO Max Removing Shows Like Westworld, Warner Bros ...",still open
Discovery Communications,02/08/2023,Discovery CEO David Zaslav’s 2021 Pay Package Soars to $246M Ahead of WarnerMedia Merger,still open
Discovery Communications,02/08/2023,Discovery loses £12m on GB News,still open
Discovery Communications,02/08/2023,How Warner Bros. Discovery is scaling email personalization,still open
Discovery Communications,02/08/2023,The ‘How To’ Guide on UC Discovery & Migration,still open
Discovery Communications,02/08/2023,"Amazon, WarnerMedia and Discovery Join Russian Boycott",still open
Discovery Communications,02/08/2023,Warner Bros. Discovery Confuses Fans With 'Batgirl' And Other Cancellations,still open
Discovery Communications,02/08/2023,3 Advantages for Discovery Communications in Streaming Video,still open
Discovery Communications,02/08/2023,Scoop: CNN+ looks doomed,still open
Discovery Communications,02/08/2023,New Winston & Strawn E-Discovery Partner: Approaches to ...,still open
Discovery Communications,02/08/2023,Discovery Communications India's FY21 revenue up 10.32% to Rs 928.8 crore,still open
Discovery Communications,02/08/2023,Discovery moving HQ to Scripps in Knoxville,still open
Discovery Communications,02/08/2023,Why do woodpeckers peck? New discovery about bird brains sheds ...,still open
Discovery Communications,02/08/2023,HBO Max & Discovery + To Give Netflix And Hulu Stiff Competition,still open
Discovery Communications,02/08/2023,Discovery of small molecule agonists of the Relaxin Family Peptide ...,still open
Discovery Communications,02/08/2023,Warner Bros. Discovery Leadership Team Draws Ire Over Diversity,still open
Discovery Communications,02/08/2023,AT&T To Spin-Merge WarnerMedia With Discovery,still open
Discovery Communications,02/08/2023,"DISCOVERY COMMUNICATIONS PRIVACY POLICY – Discovery, Inc.",still open
Discovery Communications,02/08/2023,Barksdale Warrants Exercised and Options Issued,still open
Discovery Communications,02/08/2023,UVA Discovery Could Improve Drug Development,still open
Discovery Communications,02/08/2023,"Larry Laque, Kristin Brown, Jessica Driscoll, Doug Seybert Among Slew of TV Execs Ousted at Warner Bros. Discovery (EXCLUSIVE)",still open
Discovery Communications,02/08/2023,3 Reasons to Avoid Warner Bros. Discovery Stock in 2023,still open
Discovery Communications,02/08/2023,Why Warner Bros Discovery Is the S&P's Hottest Stock,still open
Discovery Communications,02/08/2023,Warner Bros. Discovery Is Sett,still open
Discovery Communications,02/08/2023,From worst to first: 2022's stock losers are leading the market this year,still open
Discovery Communications,02/08/2023,Should You Still Buy the S&P 500's Best-Performing January Stocks?,still open
Discovery Communications,02/08/2023,Discovery surrounding newly appointed Chula Vista councilmember stirs contention in South Bay,still open
Discovery Communications,02/08/2023,Best Income Stocks to Buy for February 8th,still open
Discovery Communications,02/08/2023,From Comcast to Netflix: Tracking streaming video and pay TV ...,still open
Discovery Communications,02/08/2023,Better Buy: AT&T vs. Verizon,still open
Discovery Communications,02/08/2023,Inside Warner Bros. Discovery’s Secret Joint Bid With the European Broadcasting Union For Media Rights to the Olympics,still open
Discovery Communications,02/08/2023,20 Power Players Helping David Zaslav Transform Warner Bros ...,still open
Discovery Communications,02/08/2023,Chart Of The Day: Donnelly Financial Solutions,still open
Discovery Communications,02/08/2023,"Cosmos Health: Shareholder-Friendly News Abounds, Stock ...",still open
Discovery Communications,02/08/2023,Surge Copper Confirms Large New Zinc-Silver-Gold-Lead ...,still open
Discovery Communications,02/08/2023,Stock market today: Dow shrugs off rising yields to close higher,still open
Discovery Communications,02/08/2023,AIM movers: URU Metals discovers higher grade and Sosandar ...,still open
Discovery Communications,02/08/2023,Elevation Oncology to Present at the SVB Securities Global Biopharma Conference,still open
Discovery Communications,02/08/2023,CENTOGENE Regains Compliance With Nasdaq Listing Requirements,still open
Discovery Communications,02/08/2023,Here's What Will Happen to AT&T and Discovery Communications ...,still open
Discovery Communications,02/08/2023,Evaxion and Pantherna announce promising preclinical mRNA vaccine data,still open
Discovery Communications,02/08/2023,"KalVista Pharmaceuticals Presents Data at Western Society of Allergy, Asthma & Immunology (WSAAI) 60th Annual Scientific Session",still open
Discovery Communications,02/08/2023,How HBO’s creatives survived corporate chaos,still open
Discovery Communications,02/08/2023,07.02.2023 / 07 : 30 CET/CEST The issuer is solely responsible for the content of this announcement - Form 6-K,still open
Discovery Communications,02/08/2023,Theseus Pharmaceuticals to Participate in the SVB Securities Global Biopharma Conference,still open
Discovery Communications,02/08/2023,"Rogers Communications (RCI) Q4 Earnings Beat, Revenues Miss",still open
Discovery Communications,02/08/2023,Chinook Therapeutics to Present at SVB Securities Global Biopharma Conference,still open
Discovery Communications,02/08/2023,Government Contracts Trading Strategy,still open
Discovery Communications,02/08/2023,Mining Stock News - Sun Summit (TSXV: SMN) to Commence ...,still open
Discovery Communications,02/08/2023,These 2 dividend-stock ETFs are more like growth funds in disguise ...,still open
Discovery Communications,02/08/2023,"FTI Consulting, Inc. - Consensus Indicates Potential 17.0% Upside",still open
Discovery Communications,02/08/2023,Atreca and Xencor to Develop T Cell Engaging Bispecific Antibody Directed Against Novel Solid Tumor Target,still open
Discovery Communications,02/08/2023,"Warner Bros. Discovery Stock: Looking Better, But Not Good Enough ...",still open
Discovery Communications,02/08/2023,"PRESSWIRE 2022/2023 : Rockridge Announces Planning Underway for Upcoming Drill Program at its High-Grade Raney Gold Project Southwest of Timmins, Ontario",still open
Discovery Communications,02/08/2023,Is Warner Bros. Discovery Stock A Buy During The Dip? (NASDAQ ...,still open
Discovery Communications,02/08/2023,Is Discovery Communications Stock a Buy?,still open
Discovery Communications,02/08/2023,Barksdale Warrants Exercised and Options Issued,still open
Discovery Communications,02/08/2023,"Down 45% From Its High, Is Warner Bros. Discovery A Buy?",still open
Discovery Communications,02/08/2023,UCB : FINTEPLA▼ (fenfluramine) oral solution approved in the EU for adjunctive treatment of seizures associated with Lennox-Gastaut syndrome (LGS),still open
Discovery Communications,02/08/2023,Why Discovery Stock Tumbled 12% This Week,still open
Discovery Communications,02/08/2023,Danaher Announces New Environmental and Applied Solutions Company to Be Named Veralto,still open
Discovery Communications,02/08/2023,Warner Bros,still open
Discovery Communications,02/08/2023,"Warner Bros. Discovery, Inc. (WBD) Presents at Citi's 2023 ...",still open
Discovery Communications,02/08/2023,WBD - Warner Bros.Discovery Inc Ordinary Shares - Class A Stock ...,still open
Discovery Communications,02/08/2023,Better Buy: Warner Bros. Discovery vs. Paramount Global,still open
Discovery Communications,02/08/2023,"WARNER BROS. DISCOVERY CHIEF FINANCIAL OFFICER GUNNAR WIEDENFELS TO PRESENT AT THE CITI 2023 COMMUNICATIONS, MEDIA & ENTERTAINMENT CONFERENCE",still open
Discovery Communications,02/08/2023,David Zaslav's top priority at Warner Bros. Discovery: Get the cash flowing again,still open
Discovery Communications,02/08/2023,Warner Bros. Lifts Discovery Write-Down to $5.3B,still open
Discovery Communications,02/08/2023,"WarnerMedia, Discovery complete merger, become Warner Bros. Discovery",still open
Discovery Communications,02/08/2023,Warner Bros. Discovery Unveils Communications Team Leadership,still open
Discovery Communications,02/08/2023,Why Warner Bros. Discovery Investors Should Tread Lightly,still open
Discovery Communications,02/08/2023,Warner Bros. Discovery jettisons more key executives as company shake-up continues,still open
Discovery Communications,02/08/2023,The Target Report: The Box is Back—January 2023 M&A Activity,still open
Discovery Communications,02/08/2023,AT&T After Its Discovery Deal: Is the Stock a Good Investment?,still open
Discovery Communications,02/08/2023,Will AT&T or Verizon Cut Their Dividends In 2023?,still open
Discovery Communications,02/08/2023,Should You Invest in Warner Bros. Discovery Stock?,still open
Discovery Communications,02/08/2023,"If You Invested $10,000 in AT&T in 1984, This Is How Much You ...",still open
Discovery Communications,02/08/2023,"Stocks making the biggest moves premarket: Apple, CarMax, Bed Bath & Beyond and more",still open
Discovery Communications,02/08/2023,"Stocks making the biggest moves after hours: Block, PayPal, Carvana, Twilio and more",still open
Discovery Communications,02/08/2023,"Stocks making the biggest moves midday: Lyft, Carvana, Warner ...",still open
Discovery Communications,02/08/2023,Discovery will sell its Knoxville headquarters after Warner Bros ...,still open
Discovery Communications,02/08/2023,3 (Related) Reasons Merging HBO Max and Discovery+ Is a Mistake,still open
Discovery Communications,02/08/2023,Comcast potentially eyeing Warner Bros. Discovery buy - report,still open
Discovery Communications,02/08/2023,"2022 was tough for media stocks like Netflix and Disney, and 2023 doesn't look good, either",still open
Discovery Communications,02/08/2023,11 Best Streaming Stocks To Buy Now,still open
Discovery Communications,02/08/2023,Discovery CEO David Zaslav’s 2021 Pay Package Soars to $246M Ahead of WarnerMedia Merger,still open
Discovery Communications,02/08/2023,Warner Bros. Discovery Earnings: Focusing on Profits Over Users Is ...,still open
Discovery Communications,02/08/2023,Warner Bros. Discovery Nordics Executive Team Unveiled,still open
Discovery Communications,02/08/2023,Why This 1 Stock Is a Better Bet Than Discovery Ahead of Its Merger,still open
Discovery Communications,02/08/2023,Is AT&T Stock a Buy Now?,still open
Discovery Communications,02/08/2023,Discovery Closes In on Acquisition of WarnerMedia,still open
Discovery Communications,02/08/2023,3 Tech Growth Stocks With More Potential Than Any Cryptocurrency,still open
Discovery Communications,02/08/2023,"3 Reasons to Buy AT&T, and 1 Reason to Sell",still open
Discovery Communications,02/08/2023,‘It’s a sign of me buying.’ Inside the indictment of Archegos owner Bill Hwang,still open
Discovery Communications,02/08/2023,Discovery: My Favorite Media Stock For The Next Five Years ...,still open
Discovery Communications,02/08/2023,Yanked HBO Max Series Like ‘Westworld’ to Land at Third Party Ad-Based Streamers As Warner Bros. Discovery Plans to Launch Its Own,still open
Discovery Communications,02/08/2023,Sell These 3 Stocks and Kick These Overpaid CEOs Out of Your ...,still open
Discovery Communications,02/08/2023,Better Buy: AT&T vs. Verizon Stock,still open
Discovery Communications,02/08/2023,Better Dividend Stock: AT&T vs. IBM,still open
Discovery Communications,02/08/2023,AT&T Announces Details for Completion of WM Spin-Off,still open
Discovery Communications,02/08/2023,Warner Bros. Discovery Leadership Team Draws Ire Over Diversity,still open
Discovery Communications,02/08/2023,4 stocks of streaming-related companies drop 5% or more as investors lose confidence that the Fed might ease up,still open
Discovery Communications,02/08/2023,The Dish: Warner Bros. Discovery Braces For New Round Of Layoffs This Week,still open
Discovery Communications,02/08/2023,Warner Bros. Discovery Logs Big Q2 Loss on Content and Merger Costs,still open
Discovery Communications,02/08/2023,"Warner Bros. Discovery nears 95M streaming subs, bumps up ...",still open
Discovery Communications,02/08/2023,Warner Bros. Discovery Confuses Fans With 'Batgirl' And Other Cancellations,still open
Discovery Communications,02/08/2023,"AT&T to spin off WarnerMedia in $43 billion Discovery media merger, cuts dividend",still open
Discovery Communications,02/08/2023,"CuriosityStream: A Speculative, but Promising Streaming Penny Stock",still open
Discovery Communications,02/08/2023,AT&T To Spin-Merge WarnerMedia With Discovery,still open
Discovery Communications,02/08/2023,Discovery Joins the Streaming Wars With Its Own '+' Service,still open
Discovery Communications,02/08/2023,"Stocks rise ahead of U.S. midterm elections, Dow closes more than 400 points higher",still open
Discovery Communications,02/08/2023,3 High-Yield Dividend Stocks That Could Jump 15% to 24 ...,still open
Discovery Communications,02/08/2023,Michael Burry is Betting Everything on These 6 Stocks,still open
Discovery Communications,02/08/2023,Pomerantz Law Firm Announces the Filing of a Class Action Against ...,still open
Discovery Communications,02/08/2023,Why AT&T Rose 18.8% in October,still open
Discovery Communications,02/08/2023,FinThrive Named 2023 Best in KLAS for Insurance Discovery Solution,still open
Discovery Communications,02/08/2023,Deadline for Submitting to Bumpers College Discovery Journal Is ...,still open
Discovery Communications,02/08/2023,Ivey attempting to suppress communications between her office ...,still open
Discovery Communications,02/08/2023,V. Craig Jordan to give inaugural lecture on cancer drug discovery ...,still open
Discovery Communications,02/08/2023,Ethics group sues the National Archives over classified documents discovery,still open
Discovery Communications,02/08/2023,"PGA Tour alleges Phil Mickelson, others have failed to produce core responsive documents in LIV Golf antitrust suit; tour seeks discovery extension",still open
Discovery Communications,02/08/2023,Warner Bros. Discovery to still offer Discovery+ as standalone ...,still open
Discovery Communications,02/08/2023,Discovery surrounding newly appointed Chula Vista councilmember stirs contention in South Bay,still open
Discovery Communications,02/08/2023,Judge denies LIV Golf request to expand discovery to Augusta ...,still open
Discovery Communications,02/08/2023,3 Reasons to Avoid Warner Bros. Discovery Stock in 2023,still open
Discovery Communications,02/08/2023,"EBU, Warner Bros Discovery awarded media rights in Europe to 2032",still open
Discovery Communications,02/08/2023,Inside the Academy’s Quest to Help Filmmakers Preserve Digital Titles,still open
