Name,Data,News,Evaluation
Discovery Communications,02/10/2023,"Stocks making the biggest moves after hours: Block, PayPal, Carvana, Twilio and more",still open
Discovery Communications,02/10/2023,"Stocks making the biggest moves midday: Lyft, Carvana, Warner Bros. Discovery, DraftKings",still open
Discovery Communications,02/10/2023,Discovery will sell its Knoxville headquarters after Warner Bros ...,still open
Discovery Communications,02/10/2023,DISCA Stock Price: Discovery Communications suffers as part of rumoured Archegos liquidation,still open
Discovery Communications,02/10/2023,3 (Related) Reasons Merging HBO Max and Discovery+ Is a Mistake,still open
Discovery Communications,02/10/2023,Warner Bros. Discovery Unveils Executive Team for Nordics,still open
Discovery Communications,02/10/2023,11 Best Streaming Stocks To Buy Now,still open
Discovery Communications,02/10/2023,Discovery CEO David Zaslav’s 2021 Pay Package Soars to $246M Ahead of WarnerMedia Merger,still open
Discovery Communications,02/10/2023,Barksdale Warrants Exercised and Options Issued,still open
Discovery Communications,02/10/2023,"2022 was tough for media stocks like Netflix and Disney, and 2023 doesn't look good, either",still open
Discovery Communications,02/10/2023,Is AT&T Stock a Buy Now?,still open
Discovery Communications,02/10/2023,Warner Bros. Discovery Leadership Team Draws Ire Over Diversity,still open
Discovery Communications,02/10/2023,Discovery Closes In on Acquisition of WarnerMedia,still open
Discovery Communications,02/10/2023,Why This 1 Stock Is a Better Bet Than Discovery Ahead of Its Merger,still open
Discovery Communications,02/10/2023,"3 Reasons to Buy AT&T, and 1 Reason to Sell",still open
Discovery Communications,02/10/2023,3 Tech Growth Stocks With More Potential Than Any Cryptocurrency,still open
Discovery Communications,02/10/2023,‘It’s a sign of me buying.’ Inside the indictment of Archegos owner Bill Hwang,still open
Discovery Communications,02/10/2023,Discovery: My Favorite Media Stock For The Next Five Years ...,still open
Discovery Communications,02/10/2023,Better Buy: AT&T vs. Verizon Stock,still open
Discovery Communications,02/10/2023,AT&T Announces Details for Completion of WM Spin-Off,still open
Discovery Communications,02/10/2023,Better Dividend Stock: AT&T vs. IBM,still open
Discovery Communications,02/10/2023,4 stocks of streaming-related companies drop 5% or more as investors lose confidence that the Fed might ease up,still open
Discovery Communications,02/10/2023,Warner Bros. Discovery planning major restructuring months after merger,still open
Discovery Communications,02/10/2023,The Dish: Warner Bros. Discovery Braces For New Round Of Layoffs This Week,still open
Discovery Communications,02/10/2023,Warner Bros. Discovery Logs Big Q2 Loss on Content and Merger Costs,still open
Discovery Communications,02/10/2023,"Warner Bros. Discovery nears 95M streaming subs, bumps up ...",still open
Discovery Communications,02/10/2023,"Warner Bros. Discovery Stock Jumps Over 5% on Picks From Bank of America, Goldman Sachs",still open
Discovery Communications,02/10/2023,"Stocks making the biggest moves in the premarket: Zoom, Palo Alto Networks, Macy's and more",still open
Discovery Communications,02/10/2023,Warner Bros. Discovery Confuses Fans With 'Batgirl' And Other Cancellations,still open
Discovery Communications,02/10/2023,AT&T To Spin-Merge WarnerMedia With Discovery,still open
Discovery Communications,02/10/2023,"Better Buy: AT&T (T), TMobile (TMUS), or Verizon (VZ) Stock",still open
Discovery Communications,02/10/2023,"CuriosityStream: A Speculative, but Promising Streaming Penny Stock",still open
Discovery Communications,02/10/2023,Discovery Joins the Streaming Wars With Its Own '+' Service,still open
Discovery Communications,02/10/2023,"AT&T to spin off WarnerMedia in $43 billion Discovery media merger, cuts dividend",still open
Discovery Communications,02/10/2023,"Stocks rise ahead of U.S. midterm elections, Dow closes more than 400 points higher",still open
Discovery Communications,02/10/2023,Why AT&T Rose 18.8% in October,still open
Discovery Communications,02/10/2023,Pomerantz Law Firm Announces the Filing of a Class Action Against ...,still open
Discovery Communications,02/10/2023,3 High-Yield Dividend Stocks That Could Jump 15% to 24 ...,still open
Discovery Communications,02/10/2023,"WBD Stock Forecast, Price & News (Warner Bros. Discovery)",still open
Discovery Communications,02/10/2023,Michael Burry is Betting Everything on These 6 Stocks,still open
Discovery Communications,02/10/2023,The Spinoff Breathes New Life Into AT&T And Warner Bros. (NYSE:T),still open
Discovery Communications,02/10/2023,"Warner Bros. Discovery, Inc. (WBD) Q3 2022 Earnings Call Transcript",still open
Discovery Communications,02/10/2023,Better Telecom Dividend Stock Post-Spinoff: AT&T or Verizon?,still open
Discovery Communications,02/10/2023,"Stocks making the biggest moves in the premarket: Nio, Veru ...",still open
Discovery Communications,02/10/2023,AT&T announces $43 billion deal to merge WarnerMedia with Discovery,still open
Discovery Communications,02/10/2023,3 Advantages for Discovery Communications in Streaming Video,still open
Discovery Communications,02/11/2023,Giada De Laurentiis leaves Food Network after 21 years for 'exciting' new gig,still open
Discovery Communications,02/11/2023,Celebrate Women in Discovery Science | UC San Francisco,still open
Discovery Communications,02/11/2023,"PGA Tour seeks to extend document discovery, delay antitrust trial ...",still open
Discovery Communications,02/11/2023,Ethics group sues the National Archives over classified documents discovery,still open
Discovery Communications,02/11/2023,Deadline for Submitting to Bumpers College Discovery Journal Is ...,still open
Discovery Communications,02/11/2023,FinThrive Named 2023 Best in KLAS for Insurance Discovery Solution,still open
Discovery Communications,02/11/2023,"CNN suspects Michael Flynn’s family deleted communications, demands ‘forensic search’ of phones",still open
Discovery Communications,02/11/2023,Warner Bros. Discovery to still offer Discovery+ as standalone ...,still open
Discovery Communications,02/11/2023,"With Real-time Segments for Bloomreach Discovery, Merchandisers ...",still open
Discovery Communications,02/11/2023,Evotec and Related Sciences expand integrated drug discovery and development partnership,still open
Discovery Communications,02/11/2023,UC San Diego Experts Develop AI To Assist Discovery of Super Tight-Binding Antibodies,still open
Discovery Communications,02/11/2023,Genomics discovery of giant fungal viruses from subsurface oceanic ...,still open
Discovery Communications,02/11/2023,What Was the Chinese Spy Balloon Trying to Collect?,still open
Discovery Communications,02/11/2023,From Comcast to Netflix: Tracking streaming video and pay TV ...,still open
Discovery Communications,02/11/2023,Discovery surrounding newly appointed Chula Vista councilmember stirs contention in South Bay,still open
Discovery Communications,02/11/2023,Wreck of 150-year-old unlucky ship found off Lake Superior's Shipwreck Coast,still open
Discovery Communications,02/11/2023,Crinetics Pharmaceuticals to Participate in the SVB Securities Global Biopharma Conference,still open
Discovery Communications,02/11/2023,What India’s discovery of first ever lithium deposits means for country,still open
Discovery Communications,02/11/2023,A major archaeological discovery was made on the Miami River ...,still open
Discovery Communications,02/11/2023,Meghan Markle Faces Race Against Time in Samantha Markle Lawsuit,still open
Discovery Communications,02/11/2023,Jon and Kate Gosselin's daughter Mady takes a stand against online trolls: 'You are not entitled to anything',still open
Discovery Communications,02/11/2023,Judge denies LIV Golf request to expand discovery to Augusta ...,still open
Discovery Communications,02/11/2023,Pfizer ordered to disclose FBI communications in trade secrets case,still open
Discovery Communications,02/11/2023,Aptorum Group Ltd. (APM) Regains Nasdaq Compliance,still open
Discovery Communications,02/11/2023,New Method for Targeted Design of Molecules With AI,still open
Discovery Communications,02/11/2023,NZ Minister speaks on possibility of Chinese surveillance tech in ...,still open
Discovery Communications,02/11/2023,'Natural killer' immune cells can modify tissue inflammation: study,still open
Discovery Communications,02/11/2023,"Telomeres, mitochondria, and inflammation oh my! Three hallmarks ...",still open
Discovery Communications,02/11/2023,"Trump team turns over laptop, additional classified documents months after infamous Mar-a-Lago raid",still open
Discovery Communications,02/11/2023,Warner & Rubio Question Meta on Internal Documents Revealing ...,still open
Discovery Communications,02/11/2023,Discovery will sell its Knoxville headquarters after Warner Bros ...,still open
Discovery Communications,02/11/2023,Armin Afsahi appointed vice president for alumni relations and ...,still open
Discovery Communications,02/11/2023,Does TikTok 'Wiretap' Users? Mounting Privacy Suits Press Claim,still open
Discovery Communications,02/11/2023,Here's What Will Happen to AT&T and Discovery Communications ...,still open
Discovery Communications,02/11/2023,"BioNJ Elects Board Chair, Officers and Trustees",still open
Discovery Communications,02/11/2023,"Hunter Biden, the border, DOJ bias: House Republicans’ many, many investigations, explained",still open
Discovery Communications,02/11/2023,NCC advises Samsung phone users to update Galaxy Store apps,still open
Discovery Communications,02/11/2023,Discovery Communications and Liberty Global to acquire All3Media,still open
Discovery Communications,02/11/2023,UMass Chan Medical School licenses data processing and analysis ...,still open
Discovery Communications,02/11/2023,Warner Bros. Discovery Renews Contracts of Top Executives Gunnar Wiedenfels and Bruce Campbell,still open
Discovery Communications,02/11/2023,The Franklin Drive-In Theater in Kentucky is Closing,still open
Discovery Communications,02/11/2023,"Warner Bros Discovery Sets Communications Exec Ranks, Announces Exit Of Eight Veteran Staffers",still open
Discovery Communications,02/11/2023,"Discovery, Inc. Announces Future Leadership Team for Warner Bros ...",still open
Discovery Communications,02/11/2023,Warner Bros. Discovery Won’t Overspend On Content As Last Discovery Quarter Tops 24M Streaming Subscribers,still open
Discovery Communications,02/11/2023,Comparison of fecal and blood metabolome reveals inconsistent ...,still open
Discovery Communications,02/11/2023,"Karen Grinthal, Veteran Ad Exec, to Exit Warner Bros. Discovery",still open
Discovery Communications,02/11/2023,First chance to come together and share your bicentenary ideas ...,still open
Discovery Communications,02/11/2023,Fitch Affirms Discovery Comm's 'BBB-' IDR; Assigns 'BBB-' IDRs to ...,still open
Discovery Communications,02/11/2023,Penn State Applied Research Laboratory awarded $734M Naval ...,still open
Discovery Communications,02/11/2023,"Codebreakers Have Deciphered The Lost Letters of Mary, Queen of ...",still open
Discovery Communications,02/11/2023,"Warner Bros. Discovery, Inc. (WBD) Presents at Citi's 2023 ...",still open
Discovery Communications,02/11/2023,Get Discovery+ for just $0.99 per month for 3 months with this Cyber ...,still open
Discovery Communications,02/11/2023,Crinetics Pharmaceuticals Announces Inducement Grants Under ...,still open
Discovery Communications,02/11/2023,Warner Bros,still open
Discovery Communications,02/11/2023,Warner Bros. Discovery Sets Out Germany Management Team; Discovery Deutschland Exec Alberto Horta To Exit,still open
Discovery Communications,02/11/2023,Warner Bros. Discovery Names Nathaniel Brown Chief Corporate Communications Officer,still open
Discovery Communications,02/11/2023,HBO Max Lawsuit Is Another Unforced Error for Warner Bros ...,still open
Discovery Communications,02/11/2023,"Warner Bros Discovery's David Zaslav has charmed the Hollywood elite — now he'll have to show he can manage them, too",still open
Discovery Communications,02/11/2023,Mike Rowe gets filthy on ‘Dirty Jobs’ to reconnect Americans,still open
Discovery Communications,02/11/2023,David Zaslav's top priority at Warner Bros. Discovery: Get the cash flowing again,still open
Discovery Communications,02/11/2023,The New York Times Warns That Freedom of Speech Is a Threat,still open
Discovery Communications,02/11/2023,Class Action Alleges HGTV.com Visitors' Info Is Shared With ...,still open
Discovery Communications,02/11/2023,Discovery Closes In on Acquisition of WarnerMedia,still open
Discovery Communications,02/11/2023,Warner Bros. Discovery Earnings: Focusing on Profits Over Users Is ...,still open
Discovery Communications,02/11/2023,Luis Silberwasser Leaves TelevisaUnivision To Lead Warner Bros. Discovery Sports,still open
Discovery Communications,02/11/2023,"Following HBO Max Removing Shows Like Westworld, Warner Bros ...",still open
Discovery Communications,02/11/2023,Discovery CEO David Zaslav’s 2021 Pay Package Soars to $246M Ahead of WarnerMedia Merger,still open
Discovery Communications,02/11/2023,KalVista Pharmaceuticals (KALV) Reports Publication of ...,still open
Discovery Communications,02/11/2023,The ‘How To’ Guide on UC Discovery & Migration,still open
Discovery Communications,02/11/2023,Why Does Michael Burry Like Discovery Communications?,still open
Discovery Communications,02/11/2023,"Amazon, WarnerMedia and Discovery Join Russian Boycott",still open
Discovery Communications,02/11/2023,Will the WarnerMedia Acquisition Boost Discovery Stock?,still open
Discovery Communications,02/11/2023,3 Advantages for Discovery Communications in Streaming Video,still open
Discovery Communications,02/11/2023,Warner Bros. Discovery Leadership Team Draws Ire Over Diversity,still open
Discovery Communications,02/11/2023,Discovery moving HQ to Scripps in Knoxville,still open
Discovery Communications,02/11/2023,"DISCOVERY COMMUNICATIONS PRIVACY POLICY – Discovery, Inc.",still open
Discovery Communications,02/11/2023,Discovery of small molecule agonists of the Relaxin Family Peptide ...,still open
Discovery Communications,02/11/2023,AT&T To Spin-Merge WarnerMedia With Discovery,still open
Discovery Communications,02/11/2023,Discovery Communications India's FY21 revenue up 10.32% to Rs 928.8 crore,still open
Discovery Communications,02/11/2023,UVA Discovery Could Improve Drug Development,still open
Discovery Communications,02/11/2023,Is Discovery Communications Stock a Buy?,still open
Discovery Communications,02/11/2023,"Warner Bros Discovery Restructures Diversity, Equity And Inclusion ...",still open
Discovery Communications,02/11/2023,Top Stocks to Buy in 11 Different Sectors,still open
Discovery Communications,02/11/2023,Johanna Fuentes Departs As Head of Global Communications Studios & Networks Group At Warner Bros. Discovery,still open
Discovery Communications,02/11/2023,Discovery Communications To Buy Scripps For $14.6 Billion,still open
Discovery Communications,02/11/2023,"From a “small-town girl” to the MD of Warner Bros. Discovery, meet ...",still open
Discovery Communications,02/11/2023,"DISCOVERY, INC. REPORTS FOURTH-QUARTER AND FULL ...",still open
Discovery Communications,02/11/2023,E-discovery trends in 2022,still open
Discovery Communications,02/11/2023,Warner Bros Discovery CEO David Zaslav to meet skittish CNN anchors after merger,still open
Discovery Communications,02/11/2023,Is Warner Bros. Discovery Stock A Buy During The Dip? (NASDAQ ...,still open
Discovery Communications,02/11/2023,Technology Consulting In Australia - Fin Tech - Australia,still open
Discovery Communications,02/11/2023,Who is David Zaslav? The Discovery CEO is about to lead a new ...,still open
Discovery Communications,02/11/2023,Discovery Announces Pricing of $30.0 Billion Senior Notes Offering ...,still open
Discovery Communications,02/11/2023,Discovery Communications closes its $14.6B acquisition of Scripps ...,still open
Discovery Communications,02/11/2023,AT&T announces $43 billion deal to merge WarnerMedia with Discovery,still open
Discovery Communications,02/11/2023,Discovery Communications to sell education business to Francisco ...,still open
Discovery Communications,02/11/2023,Why Discovery Stock Tumbled 12% This Week,still open
Discovery Communications,02/11/2023,Why Warner Bros Discovery Is the S&P's Hottest Stock,still open
Discovery Communications,02/11/2023,Should You Still Buy the S&P 500's Best-Performing January Stocks?,still open
Discovery Communications,02/11/2023,What will TV look like in three years? These industry insiders share their predictions,still open
Discovery Communications,02/11/2023,Warner Bros. Discovery: Business Model Flaws Date Way Back To ...,still open
Discovery Communications,02/11/2023,Evotec and Related Sciences expand integrated drug discovery and development partnership,still open
Discovery Communications,02/11/2023,Inside Warner Bros. Discovery’s Secret Joint Bid With the European Broadcasting Union For Media Rights to the Olympics,still open
Discovery Communications,02/11/2023,20 Power Players Helping David Zaslav Transform Warner Bros ...,still open
Discovery Communications,02/11/2023,From Comcast to Netflix: Tracking streaming video and pay TV ...,still open
Discovery Communications,02/11/2023,Best Growth Stocks to Buy for February 10th,still open
Discovery Communications,02/11/2023,Better Buy: AT&T vs. Verizon,still open
Discovery Communications,02/11/2023,Crinetics Pharmaceuticals Announces Inducement Grants Under ...,still open
Discovery Communications,02/11/2023,Discovery surrounding newly appointed Chula Vista councilmember stirs contention in South Bay,still open
Discovery Communications,02/11/2023,"Cosmos Health: Shareholder-Friendly News Abounds, Stock ...",still open
Discovery Communications,02/11/2023,Aptorum Group Regains Compliance with Nasdaq Minimum Bid Price and Receives Nasdaq Notification of Minimum Market Value of Publicly Held Shares Deficiency,still open
Discovery Communications,02/11/2023,Here's What Will Happen to AT&T and Discovery Communications ...,still open
Discovery Communications,02/11/2023,Prometheus Biosciences to Present at the SVB Securities Global Biopharma Conference,still open
Discovery Communications,02/11/2023,These 2 dividend-stock ETFs are more like growth funds in disguise ...,still open
Discovery Communications,02/11/2023,KalVista Pharmaceuticals Announces Publication of Sebetralstat Phase 2 Data in The Lancet,still open
Discovery Communications,02/11/2023,3 Reasons to Avoid Warner Bros. Discovery Stock in 2023,still open
Discovery Communications,02/11/2023,Evotec SE : Laetitia Rouxel to succeed Enno Spillner as Chief Financial Officer,still open
Discovery Communications,02/11/2023,Doximity rolls out beta version of ChatGPT tool for docs aiming to ...,still open
Discovery Communications,02/11/2023,Golden Arrow Applies to Extend Warrants,still open
Discovery Communications,02/11/2023,Form 8-K Maxpro Capital Acquisiti For: Feb 09,still open
Discovery Communications,02/11/2023,Crinetics Pharmaceuticals Announces Inducement Grants Under ...,still open
Discovery Communications,02/11/2023,Will the WarnerMedia Acquisition Boost Discovery Stock?,still open
Discovery Communications,02/11/2023,Wachtell: How big & powerful is the US law firm Adani Group has hired to fight Hindenburg,still open
Discovery Communications,02/11/2023,Is Discovery Communications Stock a Buy?,still open
Discovery Communications,02/11/2023,Is Warner Bros. Discovery Stock A Buy During The Dip? (NASDAQ ...,still open
Discovery Communications,02/11/2023,"Warner Bros. Discovery Stock: Looking Better, But Not Good Enough ...",still open
Discovery Communications,02/11/2023,"Down 45% From Its High, Is Warner Bros. Discovery A Buy?",still open
Discovery Communications,02/11/2023,"WarnerMedia, Discovery complete merger, become Warner Bros. Discovery",still open
Discovery Communications,02/11/2023,Why Discovery Stock Tumbled 12% This Week,still open
Discovery Communications,02/11/2023,Warner Bros,still open
Discovery Communications,02/11/2023,David Zaslav's top priority at Warner Bros. Discovery: Get the cash flowing again,still open
Discovery Communications,02/11/2023,Better Buy: Warner Bros. Discovery vs. Paramount Global,still open
Discovery Communications,02/11/2023,WBD - Warner Bros.Discovery Inc Ordinary Shares - Class A Stock ...,still open
Discovery Communications,02/11/2023,Warner Bros. Discovery Unveils Communications Team Leadership,still open
Discovery Communications,02/11/2023,Why Warner Bros. Discovery Investors Should Tread Lightly,still open
Discovery Communications,02/11/2023,"Warner Bros. Discovery, Inc. (WBD) Presents at Citi's 2023 ...",still open
Discovery Communications,02/11/2023,Warner Bros. Discovery jettisons more key executives as company shake-up continues,still open
Discovery Communications,02/11/2023,Will AT&T or Verizon Cut Their Dividends In 2023?,still open
Discovery Communications,02/11/2023,AT&T After Its Discovery Deal: Is the Stock a Good Investment?,still open
Discovery Communications,02/11/2023,Should You Invest in Warner Bros. Discovery Stock?,still open
Discovery Communications,02/11/2023,"Warner Bros.Discovery Inc (WBD) Stock Price, Trades & News",still open
Discovery Communications,02/11/2023,"If You Invested $10,000 in AT&T in 1984, This Is How Much You ...",still open
Discovery Communications,02/11/2023,"Stocks making the biggest moves premarket: Apple, CarMax, Bed Bath & Beyond and more",still open
Discovery Communications,02/11/2023,"Stocks making the biggest moves after hours: Block, PayPal, Carvana, Twilio and more",still open
Discovery Communications,02/11/2023,"Stocks making the biggest moves midday: Lyft, Carvana, Warner Bros. Discovery, DraftKings",still open
Discovery Communications,02/11/2023,Discovery will sell its Knoxville headquarters after Warner Bros ...,still open
Discovery Communications,02/11/2023,Layoffs Begin at CNN Amid Warner Bros. Discovery Cost-Cutting Plan,still open
Discovery Communications,02/11/2023,3 (Related) Reasons Merging HBO Max and Discovery+ Is a Mistake,still open
Discovery Communications,02/11/2023,DISCA Stock Price: Discovery Communications suffers as part of rumoured Archegos liquidation,still open
Discovery Communications,02/11/2023,Compugen to Present at the SVB Securities Global Biopharma Conference - Compugen (NASDAQ:CGEN),still open
Discovery Communications,02/11/2023,Is AT&T Stock a Buy Following Warner Bros. Discovery Spinoff? J.P. Morgan Weighs In,still open
Discovery Communications,02/11/2023,Warner Bros. Discovery Unveils Executive Team for Nordics,still open
Discovery Communications,02/11/2023,Discovery Joins the Streaming Wars With Its Own '+' Service,still open
Discovery Communications,02/11/2023,Discovery CEO David Zaslav’s 2021 Pay Package Soars to $246M Ahead of WarnerMedia Merger,still open
Discovery Communications,02/11/2023,11 Best Streaming Stocks To Buy Now,still open
Discovery Communications,02/11/2023,"2022 was tough for media stocks like Netflix and Disney, and 2023 doesn't look good, either",still open
Discovery Communications,02/11/2023,Warner Bros. Discovery Leadership Team Draws Ire Over Diversity,still open
Discovery Communications,02/11/2023,Is AT&T Stock a Buy Now?,still open
Discovery Communications,02/11/2023,Discovery Closes In on Acquisition of WarnerMedia,still open
Discovery Communications,02/11/2023,Why This 1 Stock Is a Better Bet Than Discovery Ahead of Its Merger,still open
Discovery Communications,02/11/2023,3 Tech Growth Stocks With More Potential Than Any Cryptocurrency,still open
Discovery Communications,02/11/2023,Discovery: My Favorite Media Stock For The Next Five Years ...,still open
Discovery Communications,02/11/2023,Better Buy: AT&T vs. Verizon Stock,still open
Discovery Communications,02/11/2023,‘It’s a sign of me buying.’ Inside the indictment of Archegos owner Bill Hwang,still open
Discovery Communications,02/11/2023,Better Dividend Stock: AT&T vs. IBM,still open
Discovery Communications,02/11/2023,"3 Reasons to Buy AT&T, and 1 Reason to Sell",still open
Discovery Communications,02/11/2023,AT&T Announces Details for Completion of WM Spin-Off,still open
Discovery Communications,02/11/2023,4 stocks of streaming-related companies drop 5% or more as investors lose confidence that the Fed might ease up,still open
Discovery Communications,02/11/2023,Warner Bros. Discovery planning major restructuring months after merger,still open
Discovery Communications,02/11/2023,The Dish: Warner Bros. Discovery Braces For New Round Of Layoffs This Week,still open
Discovery Communications,02/11/2023,Warner Bros. Discovery Logs Big Q2 Loss on Content and Merger Costs,still open
Discovery Communications,02/11/2023,"Stocks making the biggest moves in the premarket: Zoom, Palo Alto Networks, Macy's and more",still open
Discovery Communications,02/11/2023,Warner Bros. Discovery Confuses Fans With 'Batgirl' And Other Cancellations,still open
Discovery Communications,02/11/2023,"WBD Stock Forecast, Price & News (Warner Bros. Discovery)",still open
Discovery Communications,02/11/2023,"CuriosityStream: A Speculative, but Promising Streaming Penny Stock",still open
Discovery Communications,02/11/2023,"AT&T to spin off WarnerMedia in $43 billion Discovery media merger, cuts dividend",still open
Discovery Communications,02/11/2023,"Better Buy: AT&T (T), TMobile (TMUS), or Verizon (VZ) Stock",still open
