Name,Data,News,Evaluation
Exxon Mobil Corp.,02/05/2023,"Exxon, Chevron, ConocoPhillips plan Permian Basin production growth in 2023 - Houston Business Journal",still open
Exxon Mobil Corp.,02/05/2023,Exxon Mobil (NYSE:XOM) Is Paying Out A Larger Dividend Than Last Year,still open
Exxon Mobil Corp.,02/05/2023,Exxon Mobil Can Continue And Should Accelerate (NYSE:XOM),still open
Exxon Mobil Corp.,02/05/2023,Exclusive: Exxon prepares to start up $2 bln Texas oil refinery expansion,still open
Exxon Mobil Corp.,02/05/2023,Study: Exxon Mobil accurately predicted warming since 1970s,still open
Exxon Mobil Corp.,02/05/2023,ExxonMobil posts record $56bn profit,still open
Exxon Mobil Corp.,02/05/2023,White House blasts Exxon over historical $56 bln annual profit,still open
Exxon Mobil Corp.,02/05/2023,Exxon smashes Western oil majors' earnings record with $56 billion profit for 2022,still open
Exxon Mobil Corp.,02/05/2023,Exxon smashes Western oil majors' profits with $56 billion in 2022,still open
Exxon Mobil Corp.,02/05/2023,Exxon Mobil Stock Is Running Out Of Gas (NYSE:XOM),still open
Exxon Mobil Corp.,02/05/2023,ExxonMobil announces full-year 2022 results,still open
Exxon Mobil Corp.,02/05/2023,Exxon Mobil Corp. Reported Earnings. Did it Beat Estimates?,still open
Exxon Mobil Corp.,02/05/2023,Is Exxon Mobil Corp (XOM) Stock Worth a Buy Friday?,still open
Exxon Mobil Corp.,02/05/2023,"Exxon Mobil Corp. stock rises Friday, outperforms market",still open
Exxon Mobil Corp.,02/05/2023,"Exxon Mobil Corp. stock falls Thursday, underperforms market",still open
Exxon Mobil Corp.,02/05/2023,ExxonMobil moves forward with largest renewable diesel facility in ...,still open
Exxon Mobil Corp.,02/05/2023,"Exxon Mobil Corp. stock rises Thursday, outperforms market",still open
Exxon Mobil Corp.,02/05/2023,Exxon Mobil sets large-scale hydrogen plant start-up for 2027,still open
Exxon Mobil Corp.,02/05/2023,Exxon Mobil Corp (XOM) to Release Quarter 4 Numbers,still open
Exxon Mobil Corp.,02/05/2023,Assessing ExxonMobil's global warming projections,still open
Exxon Mobil Corp.,02/05/2023,"Exxon Mobil Corp. Q4 Profit Increases, beats estimates",still open
Exxon Mobil Corp.,02/05/2023,Is Exxon Mobil Corp (XOM) Stock at the Top of the Oil & Gas Integrated Industry?,still open
Exxon Mobil Corp.,02/05/2023,"Exxon Mobil to Sell Thai Refinery, Retail Unit to Bangchak Corp",still open
Exxon Mobil Corp.,02/05/2023,Should You Sell Exxon Mobil Corp (XOM) Stock Thursday?,still open
Exxon Mobil Corp.,02/05/2023,"Exxon Mobil Corp. stock falls Friday, underperforms market",still open
Exxon Mobil Corp.,02/05/2023,Camden Capital LLC Trims Stock Holdings in Exxon Mobil Co ...,still open
Exxon Mobil Corp.,02/05/2023,Do Analysts Agree Friday on Exxon Mobil Corp (XOM) Stock's Target Price?,still open
Exxon Mobil Corp.,02/05/2023,"Exxon set to order 5th Guyana oil vessel, sizing up more blocks",still open
Exxon Mobil Corp.,02/05/2023,"Exxon Mobil Corp. stock falls Tuesday, still outperforms market",still open
Exxon Mobil Corp.,02/05/2023,Oil Industry's Windfall Fails to Excite Wall Street,still open
Exxon Mobil Corp.,02/05/2023,"Exxon Mobil Corp. stock rises Friday, still underperforms market",still open
Exxon Mobil Corp.,02/05/2023,An In-Depth Look At Exxon Mobil's Revenue And Its Determining ...,still open
Exxon Mobil Corp.,02/05/2023,Professor Says Flawed 'Exxon Knew' Study Designed To Make ...,still open
Exxon Mobil Corp.,02/05/2023,"Exxon Mobil, Pfizer, McDonald's earnings: 3 things to watch",still open
Exxon Mobil Corp.,02/05/2023,"The Zacks Analyst Blog Highlights Exxon Mobil, Fomento Economico Mexicano, Prologis, Marsh & McLennan and Becton Dickinson",still open
Exxon Mobil Corp.,02/05/2023,Russia's Sakhalin-1 near full oil output after Exxon exit -source,still open
Exxon Mobil Corp.,02/05/2023,"Nippon Steel, Mitsubishi, Exxon to look at CCS value chains in Asia ...",still open
Exxon Mobil Corp.,02/05/2023,Exxon Mobil Corporation (XOM) Is a Trending Stock: Facts to Know ...,still open
Exxon Mobil Corp.,02/05/2023,U.S. oil & gas rig count falls by the most in a week since June 2020 ...,still open
Exxon Mobil Corp.,02/05/2023,Exxon Mobil: The Train To Elephant Land Is Leaving The Station ...,still open
Exxon Mobil Corp.,02/05/2023,June 2025 Options Now Available For Exxon Mobil (XOM),still open
Exxon Mobil Corp.,02/05/2023,"The Zacks Analyst Blog Highlights Exxon Mobil, Viper Energy ...",still open
Exxon Mobil Corp.,02/05/2023,Remembering longtime Corporation member James R. Houghton,still open
Exxon Mobil Corp.,02/05/2023,U.S. refiners throttle back Q1 output after record 2022 runs,still open
Exxon Mobil Corp.,02/05/2023,"Exxon Stock, a Dividend Aristocrat, Hikes Payout for 40 Straight Years",still open
Exxon Mobil Corp.,02/05/2023,"BP, Chubu Elec to study CCS project at Nagoya in broad tie-up in Asia",still open
Exxon Mobil Corp.,02/05/2023,ConocoPhillips joins Big Oil's parade of bumper profits but shares fall,still open
Exxon Mobil Corp.,02/05/2023,ExxonMobil and their partners should be the ones to finance the gas ...,still open
Exxon Mobil Corp.,02/05/2023,"Hess Corp. stock falls Friday, still outperforms market",still open
Exxon Mobil Corp.,02/05/2023,EXXON MOBIL CORP Change in Directors or Principal Officers (form 8-K/A),still open
Exxon Mobil Corp.,02/05/2023,Shell Posts Record 2022 Profit Fueled By Soaring Energy Prices,still open
Exxon Mobil Corp.,02/05/2023,Marathon Oil Corp. stock underperforms Friday when compared to competitors,still open
Exxon Mobil Corp.,02/05/2023,Why Canadian Oil & Gas Will Remain Hot In 2023,still open
Exxon Mobil Corp.,02/05/2023,"Chevron, Exxon and Total keen to invest in India, says minister",still open
Exxon Mobil Corp.,02/05/2023,Guyana: 1.3 billion barrels in ExxonMobil offshore oil field,still open
Exxon Mobil Corp.,02/05/2023,WRAPUP 2-U.S. execs sound a note of caution even as earnings outstrip estimates,still open
Exxon Mobil Corp.,02/05/2023,Hybrid Organic Acid Antifreeze Market is Booming Worldwide ...,still open
Exxon Mobil Corp.,02/05/2023,Carbon capture and storage market size to increase by USD 104.5 million tons: Market research insights highlight a hike in investments and advances in technology as a key driver - Technavio,still open
Exxon Mobil Corp.,02/05/2023,"Operations at Exxon's Baytown, Texas refinery normal after storms",still open
Exxon Mobil Corp.,02/05/2023,12 Cheap Energy Stocks To Buy,still open
Exxon Mobil Corp.,02/05/2023,Wall St gains over 1% after encouraging inflation data with Fed next,still open
Exxon Mobil Corp.,02/05/2023,Big Oil Faces Headwinds After Record $199 Billion Profit Haul,still open
Exxon Mobil Corp.,02/05/2023,"Wax Market Analysis 2023 Future Outlook, Key Applications, Trends ...",still open
Exxon Mobil Corp.,02/05/2023,"Prudent Investors Network Inc. owns $827,000 shares of Exxon ...",still open
Exxon Mobil Corp.,02/05/2023,"Scotiabank Adjusts Price Target on Exxon Mobil to $140 From $135, Maintains Sector Outperform Rating",still open
Exxon Mobil Corp.,02/05/2023,"Biolubricants Market Trends Analysis and Precise Outlook by 2030 | Exxon Mobil Corporation, Royal Dutch Shell",still open
Exxon Mobil Corp.,02/05/2023,MORNING BID-Fed games,still open
Exxon Mobil Corp.,02/05/2023,High Purity Gaseous Helium Market 2023 key developmental ...,still open
Exxon Mobil Corp.,02/05/2023,High Efficiency Catalyst Market is expected to reach a value of 2027 ...,still open
Exxon Mobil Corp.,02/05/2023,Wire and Cable Insulation Market Biggest Innovation with Top Key ...,still open
Exxon Mobil Corp.,02/05/2023,Exxon stock vs Chevron stock: Goldman Sachs analyst picks a side,still open
Exxon Mobil Corp.,02/05/2023,HFC Blowing Agent Market To Grow Extensively At Unstoppable ...,still open
Exxon Mobil Corp.,02/05/2023,15 Best Dividend Leaders to Buy According to Hedge Funds,still open
Exxon Mobil Corp.,02/05/2023,XOM: 3 High-Quality Stocks to Pick up in 2023,still open
Exxon Mobil Corp.,02/05/2023,"Wells Fargo Adjusts Price Target on Exxon Mobil to $125 From $122, Maintains Overweight Rating",still open
Exxon Mobil Corp.,02/05/2023,"Jet Fuel Market Share, In-depth Analysis Report and Forecast 2032 ...",still open
Exxon Mobil Corp.,02/05/2023,These 2 dividend-stock ETFs are more like growth funds in disguise ...,still open
Exxon Mobil Corp.,02/05/2023,"Indian, European oil firms evaluating bids for Guyana blocks",still open
Exxon Mobil Corp.,02/05/2023,Exxon Mobil : Fourth Quarter 2022 Earnings - webcast presentation materials,still open
Exxon Mobil Corp.,02/05/2023,Vinyl Acetate Market Is Thriving Worldwide-Calanese Corporation ...,still open
Exxon Mobil Corp.,02/05/2023,"Top 5 4th Quarter Trades of PARAGON FINANCIAL PARTNERS, INC.",still open
Exxon Mobil Corp.,02/05/2023,ExxonMobil announces third-quarter 2022 results,still open
Exxon Mobil Corp.,02/05/2023,ExxonMobil announces second-quarter 2022 results,still open
Exxon Mobil Corp.,02/05/2023,ExxonMobil elects Larry Kellner and John Harris to Board of Directors,still open
Exxon Mobil Corp.,02/05/2023,QatarEnergy and ExxonMobil to independently market Golden Pass ...,still open
Exxon Mobil Corp.,02/05/2023,News,still open
Exxon Mobil Corp.,02/05/2023,Exxon shares surge to record high on strong earnings outlook,still open
Exxon Mobil Corp.,02/05/2023,ExxonMobil starts operations at large-scale advanced recycling facility,still open
Exxon Mobil Corp.,02/05/2023,"Stock Market News: Nasdaq's best January in 22 years, PayPal ...",still open
Exxon Mobil Corp.,02/05/2023,ExxonMobil statement regarding President Biden Letter to Oil Industry,still open
Exxon Mobil Corp.,02/05/2023,partners make new discovery on Angola Block 15,still open
Exxon Mobil Corp.,02/05/2023,ExxonMobil announces corporate plan — Company expects to ...,still open
Exxon Mobil Corp.,02/05/2023,ExxonMobil announces two new Guyana discoveries,still open
Exxon Mobil Corp.,02/05/2023,Exxon faces $2 billion loss on sale of troubled California oil properties,still open
Exxon Mobil Corp.,02/05/2023,Governance | Sustainability,still open
Exxon Mobil Corp.,02/05/2023,Exxon sues EU in move to block new windfall tax on oil companies,still open
Exxon Mobil Corp.,02/05/2023,ExxonMobil announces first-quarter 2022 results,still open
Exxon Mobil Corp.,02/05/2023,"ExxonMobil Appoints Jim Chapman, Vice President, Tax and ...",still open
Exxon Mobil Corp.,02/05/2023,Exxon selling Montana oil refinery to Par Pacific in $310 million deal,still open
Exxon Mobil Corp.,02/05/2023,Is Exxon Mobil Corp (XOM) Stock Worth a Buy Friday?,still open
Exxon Mobil Corp.,02/05/2023,"Exxon Mobil Corp. stock rises Friday, outperforms market",still open
Exxon Mobil Corp.,02/05/2023,"Exxon Mobil Corp. stock falls Thursday, underperforms market",still open
Exxon Mobil Corp.,02/05/2023,Do Analysts Agree Tuesday on Exxon Mobil Corp (XOM) Stock's Target Price?,still open
Exxon Mobil Corp.,02/05/2023,"Exxon Mobil Corp. stock rises Tuesday, outperforms market",still open
Exxon Mobil Corp.,02/05/2023,"Exxon Mobil Corp. stock falls Monday, underperforms market",still open
Exxon Mobil Corp.,02/05/2023,"Exxon Mobil Corp. stock falls Tuesday, still outperforms market",still open
Exxon Mobil Corp.,02/05/2023,"Exxon Mobil Corp. stock rises Thursday, outperforms market",still open
Exxon Mobil Corp.,02/05/2023,Exxon Mobil stock slides 3% premarket after fourth-quarter revenue lags consensus,still open
Exxon Mobil Corp.,02/05/2023,Should You Sell Exxon Mobil Corp (XOM) Stock Thursday?,still open
Exxon Mobil Corp.,02/05/2023,"Exxon Mobil Corp. stock rises Friday, still underperforms market",still open
Exxon Mobil Corp.,02/05/2023,Exxon Mobil Corp (XOM) to Release Quarter 4 Numbers,still open
Exxon Mobil Corp.,02/05/2023,Camden Capital LLC Trims Stock Holdings in Exxon Mobil Co ...,still open
Exxon Mobil Corp.,02/05/2023,5 Energy Stocks Gurus Are Drilling Into,still open
Exxon Mobil Corp.,02/05/2023,"Top Stock Reports for Exxon Mobil, Fomento Economico Mexicano & Prologis",still open
Exxon Mobil Corp.,02/05/2023,"Exxon Mobil to Sell Thai Refinery, Retail Unit to Bangchak Corp",still open
Exxon Mobil Corp.,02/05/2023,Marathon Oil Corp. stock underperforms Friday when compared to competitors,still open
Exxon Mobil Corp.,02/05/2023,"Hess Corp. stock falls Friday, still outperforms market",still open
Exxon Mobil Corp.,02/05/2023,"Exxon Stock, a Dividend Aristocrat, Hikes Payout for 40 Straight Years",still open
Exxon Mobil Corp.,02/05/2023,"Exxon set to order 5th Guyana oil vessel, sizing up more blocks",still open
Exxon Mobil Corp.,02/05/2023,US STOCKS-Wall St gains over 1% after encouraging inflation data ...,still open
Exxon Mobil Corp.,02/05/2023,Exclusive: Exxon prepares to start up $2 bln Texas oil refinery ...,still open
Exxon Mobil Corp.,02/05/2023,June 2025 Options Now Available For Exxon Mobil (XOM),still open
Exxon Mobil Corp.,02/05/2023,"Exxon Mobil, Pfizer, McDonald's earnings: 3 things to watch",still open
Exxon Mobil Corp.,02/05/2023,Why Canadian Oil & Gas Will Remain Hot In 2023,still open
Exxon Mobil Corp.,02/05/2023,Eastman Chemical Co. stock outperforms market on strong trading day,still open
Exxon Mobil Corp.,02/05/2023,Exxon Mobil Co. (NYSE:XOM) Sees Large Decline in Short Interest,still open
Exxon Mobil Corp.,02/05/2023,"The Zacks Analyst Blog Highlights Exxon Mobil, Viper Energy ...",still open
Exxon Mobil Corp.,02/05/2023,"Marathon Oil Corp. stock rises Thursday, outperforms market",still open
Exxon Mobil Corp.,02/05/2023,St. Louis Trust Co Has $1.32 Million Stock Position in Exxon Mobil ...,still open
Exxon Mobil Corp.,02/05/2023,Exxon stock vs Chevron stock: Goldman Sachs analyst picks a side,still open
Exxon Mobil Corp.,02/05/2023,"Exxon Scientists Predicted Global Warming, Even as Company Cast Doubts, Study Finds",still open
Exxon Mobil Corp.,02/05/2023,Exxon Mobil sets large-scale hydrogen plant start-up for 2027,still open
Exxon Mobil Corp.,02/05/2023,Bob Simpson-led TXO Energy Partners IPO Exceeding Expectations,still open
Exxon Mobil Corp.,02/05/2023,"Chevron, Exxon and Total keen to invest in India, says minister",still open
Exxon Mobil Corp.,02/05/2023,These 2 dividend-stock ETFs are more like growth funds in disguise ...,still open
Exxon Mobil Corp.,02/05/2023,"Stock Market News: Nasdaq's best January in 22 years, PayPal ...",still open
Exxon Mobil Corp.,02/05/2023,EXXON MOBIL CORP Change in Directors or Principal Officers (form 8-K/A),still open
Exxon Mobil Corp.,02/05/2023,"Exxon Mobil Corp. stock falls Wednesday, underperforms market",still open
Exxon Mobil Corp.,02/05/2023,U.S. refiners throttle back Q1 output after record 2022 runs,still open
Exxon Mobil Corp.,02/05/2023,MORNING BID-Fed games,still open
Exxon Mobil Corp.,02/05/2023,Exxon shares surge to record high on strong earnings outlook,still open
Exxon Mobil Corp.,02/05/2023,Analysis | The Real Winners of the Coming Capex Tsunami,still open
Exxon Mobil Corp.,02/05/2023,U.S. oil & gas rig count falls by the most in a week since June 2020 - Baker Hughes,still open
Exxon Mobil Corp.,02/05/2023,"Top 5 4th Quarter Trades of Ipswich Investment Management Co., Inc.",still open
Exxon Mobil Corp.,02/05/2023,Why ExxonMobil Stock Popped on Monday,still open
Exxon Mobil Corp.,02/05/2023,Is Exxon Mobil Corp (XOM) Stock a Good Value Thursday?,still open
Exxon Mobil Corp.,02/05/2023,"BP PLC ADR falls Thursday, underperforms market",still open
Exxon Mobil Corp.,02/05/2023,Is Exxon Mobil Corp (XOM) Stock at the Top of the Oil & Gas Integrated Industry?,still open
Exxon Mobil Corp.,02/05/2023,"Exxon Mobil Corp. stock rises Wednesday, outperforms market",still open
Exxon Mobil Corp.,02/05/2023,Exxon Mobil Corp. stock outperforms market on strong trading day,still open
Exxon Mobil Corp.,02/05/2023,Why ExxonMobil Stock Is Rising Today,still open
Exxon Mobil Corp.,02/05/2023,Exxon Mobil (NYSE:XOM) Stock Price Hits New Record High,still open
Exxon Mobil Corp.,02/05/2023,Why ExxonMobil Stock Jumped 27% in October,still open
Exxon Mobil Corp.,02/05/2023,Exxon Mobil Corp. stock outperforms competitors despite losses on the day,still open
Exxon Mobil Corp.,02/05/2023,Exxon Mobil Stock Is Running Out Of Gas (NYSE:XOM),still open
Exxon Mobil Corp.,02/05/2023,"Exxon plans to raise spending in 2023, boost share buybacks",still open
Exxon Mobil Corp.,02/05/2023,Is ExxonMobil a Buy?,still open
Exxon Mobil Corp.,02/05/2023,Exxon Mobil Corp. stock underperforms Wednesday when compared to competitors despite daily gains,still open
Exxon Mobil Corp.,02/05/2023,ExxonMobil Posts Record Profits. Time to Buy the Dividend Aristocrat?,still open
Exxon Mobil Corp.,02/05/2023,Better Oil Stock: Exxon vs Chevron,still open
Exxon Mobil Corp.,02/05/2023,"With a $30 Billion Cash War Chest, Could ExxonMobil Be Planning ...",still open
Exxon Mobil Corp.,02/05/2023,"Exxon Mobil Corp. stock rises Monday, still underperforms market",still open
Exxon Mobil Corp.,02/05/2023,"Why ExxonMobil, Occidental Petroleum, and Phillips 66 Stocks Just ...",still open
Exxon Mobil Corp.,02/05/2023,ExxonMobil announces third-quarter 2022 results,still open
Exxon Mobil Corp.,02/05/2023,Exxon Profit (NYSE:XOM) Soars to All-Time High as Energy Markets ...,still open
Exxon Mobil Corp.,02/05/2023,Why ExxonMobil Stock Is Slumping Today,still open
Exxon Mobil Corp.,02/05/2023,Will Exxon Mobil Corp (XOM) Beat the Rest of the Stocks in the Energy Sector?,still open
Exxon Mobil Corp.,02/05/2023,"Exxon, Chevron to spend billions more on oil projects next year",still open
Exxon Mobil Corp.,02/05/2023,Exxon Mobil Stock: A Must Have For Dividend Income Investors ...,still open
Exxon Mobil Corp.,02/05/2023,"The Zacks Analyst Blog Highlights Exxon Mobil, Meta Platforms, Eaton Keysight Technologies and ANSYS",still open
Exxon Mobil Corp.,02/05/2023,"Why Oil Stocks ExxonMobil, Phillips 66, and Marathon Oil Were ...",still open
Exxon Mobil Corp.,02/05/2023,Exxon faces $2 billion loss on sale of troubled California oil properties,still open
Exxon Mobil Corp.,02/05/2023,Where Will ExxonMobil Be in 10 Years?,still open
Exxon Mobil Corp.,02/05/2023,Exxon Mobil Stock: Game Over (NYSE:XOM),still open
Exxon Mobil Corp.,02/05/2023,Exxon sues EU in move to block new windfall tax on oil companies,still open
Exxon Mobil Corp.,02/05/2023,XOM Stock Price Prediction: Know about this Deliberate Selling ...,still open
Exxon Mobil Corp.,02/05/2023,"The Zacks Analyst Blog Highlights Exxon Mobil, Merck & Co, Chevron, American Electric Power and The Southern",still open
Exxon Mobil Corp.,02/05/2023,Exxon signals strong Q3 earnings on natural gas pricing,still open
Exxon Mobil Corp.,02/05/2023,"Top Stock Reports for Berkshire Hathaway, Exxon Mobil & Walmart",still open
Exxon Mobil Corp.,02/05/2023,"Exxon Mobil makes a big comeback, surpassing Tesla in market value",still open
Exxon Mobil Corp.,02/05/2023,Better Buy: ExxonMobil or Chevron?,still open
Exxon Mobil Corp.,02/05/2023,"Exxon (XOM), Chevron (CVX) Ramp Up Stock Buybacks as Energy ...",still open
Exxon Mobil Corp.,02/05/2023,"Exxon Mobil, Chevron, ConocoPhillips Slapped With Shareholder Resolutions Over Secretive Tax Practices",still open
Exxon Mobil Corp.,02/05/2023,"Big Tech Loses Sway as S&P 500 Becomes More Exxon, Less ...",still open
Exxon Mobil Corp.,02/05/2023,"Exxon completes sale of Chad, Cameroon operations for $407 million",still open
Exxon Mobil Corp.,02/05/2023,"The Zacks Analyst Blog Highlights Tesla, Exxon Mobil, Marriott ...",still open
Exxon Mobil Corp.,02/05/2023,Is Exxon Stock a Buy?,still open
Exxon Mobil Corp.,02/05/2023,Exxon Mobil Corp. (XOM) Q3 2022 Earnings Call Transcript,still open
Exxon Mobil Corp.,02/05/2023,This Oil King Has a Brighter Future Than You Might Think,still open
Exxon Mobil Corp.,02/05/2023,Exxon CEO Loves What Manchin Did for Big Oil in $370 Billion Deal,still open
Exxon Mobil Corp.,02/05/2023,"Exxon Rebuts Biden's Attack on Profits, Citing Dividend Payout",still open
Exxon Mobil Corp.,02/05/2023,Exxon signals strong Q4 profit to drive annual record,still open
Exxon Mobil Corp.,02/05/2023,Better Buy: ExxonMobil or TotalEnergies?,still open
Exxon Mobil Corp.,02/05/2023,Better Oil Stock: ExxonMobil or Enbridge?,still open
Exxon Mobil Corp.,02/05/2023,The climate investor who bet right on ExxonMobil on how to stay ahead of the market for the next decade,still open
Exxon Mobil Corp.,02/05/2023,Exxon Mobil Stock: How War Affects Exxon and Oil Price (NYSE:XOM),still open
Exxon Mobil Corp.,02/05/2023,Exxon Mobil Stock Is One Of The Worst To Own In August,still open
Exxon Mobil Corp.,02/05/2023,Chevron vs. Exxon Mobil: Which Oil Titan Should Investors Focus On?,still open
Exxon Mobil Corp.,02/05/2023,Better Dividend Stock: ExxonMobil vs. Chevron,still open
Exxon Mobil Corp.,02/05/2023,"Exxon, Chevron, ConocoPhillips plan Permian Basin production growth in 2023 - Houston Business Journal",still open
Exxon Mobil Corp.,02/05/2023,Exxon Mobil (NYSE:XOM) Is Paying Out A Larger Dividend Than Last Year,still open
Exxon Mobil Corp.,02/05/2023,Exxon Mobil Can Continue And Should Accelerate (NYSE:XOM),still open
Exxon Mobil Corp.,02/05/2023,Exclusive: Exxon prepares to start up $2 bln Texas oil refinery expansion,still open
Exxon Mobil Corp.,02/05/2023,Study: Exxon Mobil accurately predicted warming since 1970s,still open
Exxon Mobil Corp.,02/05/2023,ExxonMobil posts record $56bn profit,still open
Exxon Mobil Corp.,02/05/2023,White House blasts Exxon over historical $56 bln annual profit,still open
Exxon Mobil Corp.,02/05/2023,Exxon smashes Western oil majors' earnings record with $56 billion profit for 2022,still open
Exxon Mobil Corp.,02/05/2023,Exxon smashes Western oil majors' profits with $56 billion in 2022,still open
Exxon Mobil Corp.,02/05/2023,Exxon Mobil Stock Is Running Out Of Gas (NYSE:XOM),still open
Exxon Mobil Corp.,02/05/2023,ExxonMobil announces full-year 2022 results,still open
Exxon Mobil Corp.,02/05/2023,Exxon Mobil Corp. Reported Earnings. Did it Beat Estimates?,still open
Exxon Mobil Corp.,02/05/2023,Is Exxon Mobil Corp (XOM) Stock Worth a Buy Friday?,still open
Exxon Mobil Corp.,02/05/2023,"Exxon Mobil Corp. stock rises Friday, outperforms market",still open
Exxon Mobil Corp.,02/05/2023,"Exxon Mobil Corp. stock falls Thursday, underperforms market",still open
Exxon Mobil Corp.,02/05/2023,ExxonMobil moves forward with largest renewable diesel facility in ...,still open
Exxon Mobil Corp.,02/05/2023,"Exxon Mobil Corp. stock rises Thursday, outperforms market",still open
Exxon Mobil Corp.,02/05/2023,Exxon Mobil sets large-scale hydrogen plant start-up for 2027,still open
Exxon Mobil Corp.,02/05/2023,Exxon Mobil Corp (XOM) to Release Quarter 4 Numbers,still open
Exxon Mobil Corp.,02/05/2023,Assessing ExxonMobil's global warming projections,still open
Exxon Mobil Corp.,02/05/2023,"Exxon Mobil Corp. Q4 Profit Increases, beats estimates",still open
Exxon Mobil Corp.,02/05/2023,Is Exxon Mobil Corp (XOM) Stock at the Top of the Oil & Gas Integrated Industry?,still open
Exxon Mobil Corp.,02/05/2023,"Exxon Mobil to Sell Thai Refinery, Retail Unit to Bangchak Corp",still open
Exxon Mobil Corp.,02/05/2023,Should You Sell Exxon Mobil Corp (XOM) Stock Thursday?,still open
Exxon Mobil Corp.,02/05/2023,"Exxon Mobil Corp. stock falls Friday, underperforms market",still open
Exxon Mobil Corp.,02/05/2023,Camden Capital LLC Trims Stock Holdings in Exxon Mobil Co ...,still open
Exxon Mobil Corp.,02/05/2023,Do Analysts Agree Friday on Exxon Mobil Corp (XOM) Stock's Target Price?,still open
Exxon Mobil Corp.,02/05/2023,"Exxon set to order 5th Guyana oil vessel, sizing up more blocks",still open
Exxon Mobil Corp.,02/05/2023,"Exxon Mobil Corp. stock falls Tuesday, still outperforms market",still open
Exxon Mobil Corp.,02/05/2023,Oil Industry's Windfall Fails to Excite Wall Street,still open
Exxon Mobil Corp.,02/05/2023,"Exxon Mobil Corp. stock rises Friday, still underperforms market",still open
Exxon Mobil Corp.,02/05/2023,An In-Depth Look At Exxon Mobil's Revenue And Its Determining ...,still open
Exxon Mobil Corp.,02/05/2023,Professor Says Flawed 'Exxon Knew' Study Designed To Make ...,still open
Exxon Mobil Corp.,02/05/2023,"Exxon Mobil, Pfizer, McDonald's earnings: 3 things to watch",still open
Exxon Mobil Corp.,02/05/2023,"The Zacks Analyst Blog Highlights Exxon Mobil, Fomento Economico Mexicano, Prologis, Marsh & McLennan and Becton Dickinson",still open
Exxon Mobil Corp.,02/05/2023,Russia's Sakhalin-1 near full oil output after Exxon exit -source,still open
Exxon Mobil Corp.,02/05/2023,"Nippon Steel, Mitsubishi, Exxon to look at CCS value chains in Asia ...",still open
Exxon Mobil Corp.,02/05/2023,Exxon Mobil Corporation (XOM) Is a Trending Stock: Facts to Know ...,still open
Exxon Mobil Corp.,02/05/2023,U.S. oil & gas rig count falls by the most in a week since June 2020 ...,still open
Exxon Mobil Corp.,02/05/2023,Exxon Mobil: The Train To Elephant Land Is Leaving The Station ...,still open
Exxon Mobil Corp.,02/05/2023,June 2025 Options Now Available For Exxon Mobil (XOM),still open
Exxon Mobil Corp.,02/05/2023,"The Zacks Analyst Blog Highlights Exxon Mobil, Viper Energy ...",still open
Exxon Mobil Corp.,02/05/2023,Remembering longtime Corporation member James R. Houghton,still open
Exxon Mobil Corp.,02/05/2023,U.S. refiners throttle back Q1 output after record 2022 runs,still open
Exxon Mobil Corp.,02/05/2023,"Exxon Stock, a Dividend Aristocrat, Hikes Payout for 40 Straight Years",still open
Exxon Mobil Corp.,02/05/2023,"BP, Chubu Elec to study CCS project at Nagoya in broad tie-up in Asia",still open
Exxon Mobil Corp.,02/05/2023,ConocoPhillips joins Big Oil's parade of bumper profits but shares fall,still open
