Name,Data,News,Evaluation
Exxon Mobil Corp.,02/11/2023,India's ONGC to invest $3.5 bln to boost output from western ...,still open
Exxon Mobil Corp.,02/11/2023,"Biden Targets Meta, Exxon, Others For Enriching Wall Street Using A Special Tactic - Meta Platforms (NASD",still open
Exxon Mobil Corp.,02/11/2023,"Jet Fuel Market Insights by Industry Demand, New Opportunities ...",still open
Exxon Mobil Corp.,02/11/2023,"New Ways and Means GOP members bring energy, agricultural focus",still open
Exxon Mobil Corp.,02/11/2023,FY2023 EPS Estimates for Exxon Mobil Co. (NYSE:XOM) Cut by ...,still open
Exxon Mobil Corp.,02/11/2023,Hess Corporation: Bring On That Cash Flow (NYSE:HES),still open
Exxon Mobil Corp.,02/11/2023,Supply chains suffer huge disruptions from Turkey earthquake due ...,still open
Exxon Mobil Corp.,02/11/2023,These 3 Companies Generate Serious Cash,still open
Exxon Mobil Corp.,02/11/2023,"Chevron, Exxon and Total keen to invest in India, says minister",still open
Exxon Mobil Corp.,02/11/2023,Shell’s Clean Energy Transition Battles Record Oil Profits,still open
Exxon Mobil Corp.,02/11/2023,'It's outrageous': Biden blasts Big Oil's record profits amid the 'energy crisis' — proposes quadrupling the tax on buybacks. Here's how much the 3 giant US-based producers made in 2022,still open
Exxon Mobil Corp.,02/11/2023,Hybrid Organic Acid Antifreeze Market is Booming Worldwide ...,still open
Exxon Mobil Corp.,02/11/2023,Shell Posts Record 2022 Profit Fueled By Soaring Energy Prices,still open
Exxon Mobil Corp.,02/11/2023,"Petroleum Resins Market to Observe Prominent Development of USD 4.8 Billion by 2029, Size, Share, Trends,",still open
Exxon Mobil Corp.,02/11/2023,Exxon Mobil Stock Likely To Trade Lower Post Q4,still open
Exxon Mobil Corp.,02/11/2023,Sector Update : Energy Stocks Mixed in Midday Trading,still open
Exxon Mobil Corp.,02/11/2023,"Earnings roundup: Profits soar for NuStar, other oil and gas companies",still open
Exxon Mobil Corp.,02/11/2023,Energy Stocks Rise Following Reports on Russia Cutting Oil Production in March,still open
Exxon Mobil Corp.,02/11/2023,COHEN LAWRENCE B Goes on Buying Spree in 4th Quarter,still open
Exxon Mobil Corp.,02/11/2023,U.S. residential heating oil prices decline from record-highs in ...,still open
Exxon Mobil Corp.,02/11/2023,"Prudent Investors Network Inc. owns $827,000 shares of Exxon ...",still open
Exxon Mobil Corp.,02/11/2023,"Biolubricants Market Trends Analysis and Precise Outlook by 2030 | Exxon Mobil Corporation, Royal Dutch Shell",still open
Exxon Mobil Corp.,02/11/2023,Can Billion Dollar Buybacks Boost Stock Prices,still open
Exxon Mobil Corp.,02/11/2023,Exxon Mobil prepares to start up Beaumont refinery's new crude ...,still open
Exxon Mobil Corp.,02/11/2023,"Wireless access point market 2023-2027: A descriptive analysis of five forces model, market dynamics, and segmentation - Technavio",still open
Exxon Mobil Corp.,02/11/2023,Fifth Circuit Rules in Rahman v. Exxon Mobil,still open
Exxon Mobil Corp.,02/11/2023,News,still open
Exxon Mobil Corp.,02/11/2023,ExxonMobil announces corporate plan — Company expects to ...,still open
Exxon Mobil Corp.,02/11/2023,Public funding for political campaigns will keep government working ...,still open
Exxon Mobil Corp.,02/11/2023,Exxon Mobil counsel David Woodcock's move to Gibson Dunn is ...,still open
Exxon Mobil Corp.,02/11/2023,"Indian, European oil firms evaluating bids for Guyana blocks",still open
Exxon Mobil Corp.,02/11/2023,Column: Fantasy league matchmaking between oil majors and ...,still open
Exxon Mobil Corp.,02/11/2023,ExxonMobil announces third-quarter 2022 results,still open
Exxon Mobil Corp.,02/11/2023,"Why this money manager is betting on Mexico, energy and shorter ...",still open
Exxon Mobil Corp.,02/11/2023,partners make new discovery on Angola Block 15,still open
Exxon Mobil Corp.,02/11/2023,"Agricultural Films Market Is Expected To Reach around USD 16.37 Billion by 2030, Grow at a CAGR Of 6.3% during Forecast Period 2023 To 2030 | Data By Contrive Datum Insights Pvt Ltd.",still open
Exxon Mobil Corp.,02/11/2023,ExxonMobil announces two new Guyana discoveries,still open
Exxon Mobil Corp.,02/11/2023,ExxonMobil starts operations at large-scale advanced recycling facility,still open
Exxon Mobil Corp.,02/11/2023,"Exxon Mobil Corp. stock rises Friday, outperforms market",still open
Exxon Mobil Corp.,02/11/2023,Is Exxon Mobil Corp (XOM) Stock Worth a Buy Friday?,still open
Exxon Mobil Corp.,02/11/2023,Why ExxonMobil Stock Topped the Market on Thursday,still open
Exxon Mobil Corp.,02/11/2023,Do Analysts Agree Tuesday on Exxon Mobil Corp (XOM) Stock's Target Price?,still open
Exxon Mobil Corp.,02/11/2023,"Exxon Mobil Corp. stock falls Tuesday, still outperforms market",still open
Exxon Mobil Corp.,02/11/2023,"Exxon Mobil Corp. stock falls Thursday, underperforms market",still open
Exxon Mobil Corp.,02/11/2023,"Exxon Mobil Corp. stock falls Wednesday, underperforms market",still open
Exxon Mobil Corp.,02/11/2023,"Marathon Oil Corp. stock rises Friday, outperforms market",still open
Exxon Mobil Corp.,02/11/2023,Should You Sell Exxon Mobil Corp (XOM) Stock Thursday?,still open
Exxon Mobil Corp.,02/11/2023,Valero Energy Corp. stock outperforms market on strong trading day,still open
Exxon Mobil Corp.,02/11/2023,Exxon smashes Western oil majors' profits with $56 billion in 2022,still open
Exxon Mobil Corp.,02/11/2023,"Hess Corp. stock rises Friday, outperforms market",still open
Exxon Mobil Corp.,02/11/2023,"Exxon Mobil Corp. stock rises Thursday, outperforms market",still open
Exxon Mobil Corp.,02/11/2023,Do Analysts Agree Friday on Exxon Mobil Corp (XOM) Stock's Target Price?,still open
Exxon Mobil Corp.,02/11/2023,"Exxon Mobil Corp. stock falls Friday, underperforms market",still open
Exxon Mobil Corp.,02/11/2023,"Zacks Market Edge Highlights: Pfizer, Exxon Mobil, Citigroup ...",still open
Exxon Mobil Corp.,02/11/2023,"Top Stock Reports for Exxon Mobil, Fomento Economico Mexicano & Prologis",still open
Exxon Mobil Corp.,02/11/2023,Eastman Chemical Co. stock underperforms Friday when compared to competitors,still open
Exxon Mobil Corp.,02/11/2023,Camden Capital LLC Trims Stock Holdings in Exxon Mobil Co ...,still open
Exxon Mobil Corp.,02/11/2023,Udine Wealth Management Inc. Takes $1.38 Million Position in ...,still open
Exxon Mobil Corp.,02/11/2023,How to Build a Lottery Winning Stock Portfolio,still open
Exxon Mobil Corp.,02/11/2023,"Exxon Stock, a Dividend Aristocrat, Hikes Payout for 40 Straight Years",still open
Exxon Mobil Corp.,02/11/2023,See Which Of The Latest 13F Filers Holds Exxon Mobil,still open
Exxon Mobil Corp.,02/11/2023,5 Energy Stocks Gurus Are Drilling Into,still open
Exxon Mobil Corp.,02/11/2023,"Exxon set to order 5th Guyana oil vessel, sizing up more blocks",still open
Exxon Mobil Corp.,02/11/2023,XOM Named Top 25 SAFE Dividend Stock Increasing Payments For ...,still open
Exxon Mobil Corp.,02/11/2023,Valero Energy Corp. stock underperforms Friday when compared to competitors,still open
Exxon Mobil Corp.,02/11/2023,UPDATE 1-Mexico Pacific to sell LNG from Sonora export plant to Exxon Mobil,still open
Exxon Mobil Corp.,02/11/2023,Study: Exxon Mobil accurately predicted warming since 1970s,still open
Exxon Mobil Corp.,02/11/2023,June 2025 Options Now Available For Exxon Mobil (XOM),still open
Exxon Mobil Corp.,02/11/2023,"Marathon Petroleum Corp. stock falls Tuesday, underperforms market",still open
Exxon Mobil Corp.,02/11/2023,"Marathon Oil Corp. stock rises Monday, still underperforms market",still open
Exxon Mobil Corp.,02/11/2023,Exclusive: Exxon prepares to start up $2 bln Texas oil refinery ...,still open
Exxon Mobil Corp.,02/11/2023,Hess Corp. stock underperforms Tuesday when compared to competitors,still open
Exxon Mobil Corp.,02/11/2023,"BUZZ-U.S. STOCKS ON THE MOVE-Fat Brands, Spotify, Uber Tech",still open
Exxon Mobil Corp.,02/11/2023,Exxon Mobil Co. (NYSE:XOM) Sees Large Decline in Short Interest,still open
Exxon Mobil Corp.,02/11/2023,Validea Motley Fool Strategy Daily Upgrade Report - 2/7/2023,still open
Exxon Mobil Corp.,02/11/2023,"Valero Energy Corp. stock rises Monday, still underperforms market",still open
Exxon Mobil Corp.,02/11/2023,"Hess Corp. stock rises Thursday, outperforms market",still open
Exxon Mobil Corp.,02/11/2023,St. Louis Trust Co Has $1.32 Million Stock Position in Exxon Mobil ...,still open
Exxon Mobil Corp.,02/11/2023,"Marathon Oil Corp. stock rises Thursday, outperforms market",still open
Exxon Mobil Corp.,02/11/2023,"Biden Targets Meta, Exxon, Others For Enriching Wall Street Using A Special Tactic - Meta Platforms (NASD",still open
Exxon Mobil Corp.,02/11/2023,"The Zacks Analyst Blog Highlights Exxon Mobil, Viper Energy ...",still open
Exxon Mobil Corp.,02/11/2023,BP PLC ADR underperforms Friday when compared to competitors despite daily gains,still open
Exxon Mobil Corp.,02/11/2023,Hess Corp. stock outperforms market despite losses on the day,still open
Exxon Mobil Corp.,02/11/2023,Marathon Oil Corp. stock underperforms Friday when compared to competitors,still open
Exxon Mobil Corp.,02/11/2023,Occidental’s CEO Says Stock Buybacks Take Priority Over Oil Growth,still open
Exxon Mobil Corp.,02/11/2023,Amazon Is a Value Stock in Topsy-Turvy New World of Investing,still open
Exxon Mobil Corp.,02/11/2023,"Chevron, Exxon and Total keen to invest in India, says minister",still open
Exxon Mobil Corp.,02/11/2023,"Exxon Mobil to sell Thailand refinery, retail fuel unit to local company ...",still open
Exxon Mobil Corp.,02/11/2023,Top 5 4th Quarter Trades of PIONEER TRUST BANK NA/OR,still open
Exxon Mobil Corp.,02/11/2023,NYSE Investigates Technical Issue That Caused Wild Market Open,still open
Exxon Mobil Corp.,02/11/2023,"Big Oil Delivers Big Earnings, Big Share Buybacks and Big Dividend Hikes",still open
Exxon Mobil Corp.,02/11/2023,Japex lifts FY22/23 profit forecast on higher natural gas prices,still open
Exxon Mobil Corp.,02/11/2023,Where Will Exxon Mobil Corp (XOM) Stock Go Next After It Is Down 1.29% in a Week?,still open
Exxon Mobil Corp.,02/11/2023,India's ONGC to invest $3.5 bln to boost output from western offshore assets,still open
Exxon Mobil Corp.,02/11/2023,Why ExxonMobil Stock Popped on Monday,still open
Exxon Mobil Corp.,02/11/2023,"Wednesday’s Top Analyst Upgrades and Downgrades: BP, Exxon Mobil, Kroger, Microsoft, RingCentral, Wayfair, Wendy’s and More",still open
Exxon Mobil Corp.,02/11/2023,Is Exxon Mobil Corp (XOM) Stock a Good Value Thursday?,still open
Exxon Mobil Corp.,02/11/2023,Is Exxon Mobil Corp (XOM) Stock at the Top of the Oil & Gas Integrated Industry?,still open
Exxon Mobil Corp.,02/11/2023,"Mitsubishi eyes carbon capture project with Exxon, Nippon Steel",still open
Exxon Mobil Corp.,02/11/2023,"Exxon Mobil Corp. stock rises Wednesday, outperforms market",still open
Exxon Mobil Corp.,02/11/2023,Activist investor ValueAct takes stake in Spotify,still open
Exxon Mobil Corp.,02/11/2023,Exxon Mobil Corp. stock outperforms market on strong trading day,still open
Exxon Mobil Corp.,02/11/2023,Why ExxonMobil Stock Is Rising Today,still open
Exxon Mobil Corp.,02/11/2023,Form N-CSR CENTRAL SECURITIES CORP For: Dec 31,still open
Exxon Mobil Corp.,02/11/2023,Exxon Mobil (NYSE:XOM) Stock Price Hits New Record High,still open
Exxon Mobil Corp.,02/11/2023,"Earnings roundup: Profits soar for NuStar, other oil and gas companies",still open
Exxon Mobil Corp.,02/11/2023,"Exxon Mobil Corp. stock rises Tuesday, outperforms market",still open
Exxon Mobil Corp.,02/11/2023,"Exxon plans to raise spending in 2023, boost share buybacks",still open
Exxon Mobil Corp.,02/11/2023,"Wireless access point market 2023-2027: A descriptive analysis of five forces model, market dynamics, and segmentation - Technavio",still open
Exxon Mobil Corp.,02/11/2023,New ETFs Target Congress’ Investments Based on Party,still open
Exxon Mobil Corp.,02/11/2023,Stocks Settle Mixed On Strength In Energy Stocks And Weakness In ...,still open
Exxon Mobil Corp.,02/11/2023,"Exxon Mobil, Pfizer, McDonald's earnings: 3 things to watch",still open
Exxon Mobil Corp.,02/11/2023,"Exxon Mobil Corp. stock falls Monday, underperforms market",still open
Exxon Mobil Corp.,02/11/2023,Exxon (XOM) Stock Hits Record High as Energy Sector Outperforms ...,still open
Exxon Mobil Corp.,02/11/2023,"The Zacks Analyst Blog Highlights Exxon Mobil, Coca-Cola, Thermo Fisher Scientific, The Progressive, and Dominion Energy",still open
Exxon Mobil Corp.,02/11/2023,Why ExxonMobil Stock Jumped 27% in October,still open
Exxon Mobil Corp.,02/11/2023,"North American Morning Briefing : Payrolls Shocker, China Spat to Weigh on Stocks",still open
Exxon Mobil Corp.,02/11/2023,"The Zacks Analyst Blog Highlights Exxon Mobil, T-Mobile US, Intuitive Surgical, Texas Instruments and Infosys",still open
Exxon Mobil Corp.,02/11/2023,Exxon Mobil Stock: Nowhere To Go But Down (NYSE:XOM),still open
Exxon Mobil Corp.,02/11/2023,"Exxon Mobil Corp. stock rises Monday, still underperforms market",still open
Exxon Mobil Corp.,02/11/2023,Exxon Profit (NYSE:XOM) Soars to All-Time High as Energy Markets ...,still open
Exxon Mobil Corp.,02/11/2023,Is ExxonMobil a Buy?,still open
Exxon Mobil Corp.,02/11/2023,"Why ExxonMobil, Occidental Petroleum, and Phillips 66 Stocks Just ...",still open
Exxon Mobil Corp.,02/11/2023,ExxonMobil announces third-quarter 2022 results,still open
Exxon Mobil Corp.,02/11/2023,The Global Fallout Of The Fed's Decision,still open
Exxon Mobil Corp.,02/11/2023,Exxon Mobil Stock: A Must Have For Dividend Income Investors ...,still open
Exxon Mobil Corp.,02/11/2023,Exxon Mobil Stock Is Running Out Of Gas (NYSE:XOM),still open
Exxon Mobil Corp.,02/11/2023,"Exxon, Chevron to spend billions more on oil projects next year",still open
Exxon Mobil Corp.,02/11/2023,"The Zacks Analyst Blog Highlights Exxon Mobil, Meta Platforms, Eaton Keysight Technologies and ANSYS",still open
Exxon Mobil Corp.,02/11/2023,Better Oil Stock: Exxon vs Chevron,still open
Exxon Mobil Corp.,02/11/2023,"Why Oil Stocks ExxonMobil, Phillips 66, and Marathon Oil Were ...",still open
Exxon Mobil Corp.,02/11/2023,XOM Stock Price Prediction: Know about this Deliberate Selling ...,still open
Exxon Mobil Corp.,02/11/2023,Exxon Mobil Stock: Game Over (NYSE:XOM),still open
Exxon Mobil Corp.,02/11/2023,Exxon Mobil Corp. (XOM) Q3 2022 Earnings Call Transcript,still open
Exxon Mobil Corp.,02/11/2023,"Why ExxonMobil, Occidental Petroleum, and Devon Energy Stocks ...",still open
Exxon Mobil Corp.,02/11/2023,"The Zacks Analyst Blog Highlights Exxon Mobil, Merck & Co, Chevron, American Electric Power and The Southern",still open
Exxon Mobil Corp.,02/11/2023,Exxon signals strong Q3 earnings on natural gas pricing,still open
Exxon Mobil Corp.,02/11/2023,Exxon Walking Away From Algae Biofuel Projects in Climate Retreat (NYSE:XOM),still open
Exxon Mobil Corp.,02/11/2023,Exxon to merge some business units as part of cost-cutting plan,still open
Exxon Mobil Corp.,02/11/2023,ExxonMobil boosts energy trading ambitions to compete against peers,still open
Exxon Mobil Corp.,02/11/2023,Exxon Plans Trading Division to Compete With the Likes of Glencore (NYSE:XOM),still open
Exxon Mobil Corp.,02/11/2023,"Zacks Market Edge Highlights: Pfizer, Exxon Mobil, Citigroup, Enterprise Products Partners and Intel",still open
Exxon Mobil Corp.,02/11/2023,Exxon's Trading Ambitions Mean Culture Shift to More Risk-Taking,still open
Exxon Mobil Corp.,02/11/2023,Here's What We Like About Exxon Mobil's (NYSE:XOM) Upcoming Dividend,still open
Exxon Mobil Corp.,02/11/2023,Exxon smashes Western oil majors' profits with $56 billion in 2022,still open
Exxon Mobil Corp.,02/11/2023,Study: Exxon Mobil accurately predicted warming since 1970s,still open
Exxon Mobil Corp.,02/11/2023,Exclusive: Exxon prepares to start up $2 bln Texas oil refinery expansion,still open
Exxon Mobil Corp.,02/11/2023,Exxon signals strong Q4 profit to drive annual record,still open
Exxon Mobil Corp.,02/11/2023,"Exxon set to order 5th Guyana oil vessel, sizing up more blocks",still open
Exxon Mobil Corp.,02/11/2023,"Exxon Mobil Corp. stock rises Friday, outperforms market",still open
Exxon Mobil Corp.,02/11/2023,Should You Buy Exxon Mobil Corp (XOM) Stock Friday Morning?,still open
Exxon Mobil Corp.,02/11/2023,Exxon Mobil Co. (NYSE:XOM) Receives Consensus ...,still open
Exxon Mobil Corp.,02/11/2023,ExxonMobil announces full-year 2022 results,still open
Exxon Mobil Corp.,02/11/2023,Exxon Mobil Corporation (NYSE:XOM) Q4 2022 Earnings Call Transcript,still open
Exxon Mobil Corp.,02/11/2023,Mexico Pacific to sell LNG from Sonora export plant to Exxon Mobil,still open
Exxon Mobil Corp.,02/11/2023,Is Exxon Mobil Corp (XOM) Stock Worth a Buy Friday?,still open
Exxon Mobil Corp.,02/11/2023,"Exxon Mobil Corp. stock falls Wednesday, underperforms market",still open
Exxon Mobil Corp.,02/11/2023,"Exxon Mobil Corp. stock falls Thursday, underperforms market",still open
Exxon Mobil Corp.,02/11/2023,"Zacks Market Edge Highlights: Pfizer, Exxon Mobil, Citigroup ...",still open
Exxon Mobil Corp.,02/11/2023,"Exxon Mobil Corp. stock rises Thursday, outperforms market",still open
Exxon Mobil Corp.,02/11/2023,Do Analysts Agree Tuesday on Exxon Mobil Corp (XOM) Stock's Target Price?,still open
Exxon Mobil Corp.,02/11/2023,Assessing ExxonMobil's global warming projections,still open
Exxon Mobil Corp.,02/11/2023,Exxon Mobil sets large-scale hydrogen plant start-up for 2027,still open
Exxon Mobil Corp.,02/11/2023,Should You Sell Exxon Mobil Corp (XOM) Stock Thursday?,still open
Exxon Mobil Corp.,02/11/2023,"Exxon Mobil Corp. stock falls Friday, underperforms market",still open
Exxon Mobil Corp.,02/11/2023,Exxon Mobil Corporation 2022 Q4 - Results - Earnings Call ...,still open
Exxon Mobil Corp.,02/11/2023,Do Analysts Agree Friday on Exxon Mobil Corp (XOM) Stock's Target Price?,still open
Exxon Mobil Corp.,02/11/2023,"Exxon Mobil Corp. stock falls Tuesday, still outperforms market",still open
Exxon Mobil Corp.,02/11/2023,"Exxon Mobil Corp. Q4 Profit Increases, beats estimates",still open
Exxon Mobil Corp.,02/11/2023,"Exxon just made record profits, also knew even more about climate change than we realized",still open
Exxon Mobil Corp.,02/11/2023,Exxon Retreats From Major Climate Effort to Make Biofuels From Algae,still open
Exxon Mobil Corp.,02/11/2023,Valero Energy Corp. stock outperforms market on strong trading day,still open
Exxon Mobil Corp.,02/11/2023,"Marathon Oil Corp. stock rises Friday, outperforms market",still open
Exxon Mobil Corp.,02/11/2023,"Hess Corp. stock rises Friday, outperforms market",still open
Exxon Mobil Corp.,02/11/2023,Udine Wealth Management Inc. Takes $1.38 Million Position in ...,still open
Exxon Mobil Corp.,02/11/2023,Vanguard Group Increases Position in Exxon Mobil (XOM),still open
Exxon Mobil Corp.,02/11/2023,"The Zacks Analyst Blog Highlights Exxon Mobil, Fomento Economico Mexicano, Prologis, Marsh & McLennan and Becton Dickinson",still open
Exxon Mobil Corp.,02/11/2023,"Exclusive: Exxon halts routine gas flaring in the Permian, wants ...",still open
Exxon Mobil Corp.,02/11/2023,APA strikes oil off Suriname coast,still open
Exxon Mobil Corp.,02/11/2023,"Europe Oil Firms Shell, BP Shift Back to Fossil Fuels Despite ...",still open
Exxon Mobil Corp.,02/11/2023,"Nippon Steel, Mitsubishi, Exxon to look at CCS value chains in Asia ...",still open
Exxon Mobil Corp.,02/11/2023,How to Build a Lottery Winning Stock Portfolio,still open
Exxon Mobil Corp.,02/11/2023,Is a Beat in Store for ExxonMobil (XOM) in Q4 Earnings?,still open
Exxon Mobil Corp.,02/11/2023,BP PLC ADR underperforms Friday when compared to competitors despite daily gains,still open
Exxon Mobil Corp.,02/11/2023,"Why Exxon Mobil, Phillips 66 And Shell Are All Seeing Blue Skies Tuesday - Phillips 66 (NYSE:PSX), Exxon",still open
Exxon Mobil Corp.,02/11/2023,"Indian energy company ONGC Videsh eyes oil, gas 'hot spots' in ...",still open
Exxon Mobil Corp.,02/11/2023,Exxon Mobil Corporation (NYSE:XOM) Vice President Darrin L ...,still open
Exxon Mobil Corp.,02/11/2023,"Exxon Mobil to sell Thailand refinery, retail fuel unit to local company ...",still open
Exxon Mobil Corp.,02/11/2023,Eastman Chemical Co. stock underperforms Friday when compared to competitors,still open
Exxon Mobil Corp.,02/11/2023,"Oil companies' 2022 profits: How much did Exxon, BP and more ...",still open
Exxon Mobil Corp.,02/11/2023,Japex lifts FY22/23 profit forecast on higher natural gas prices,still open
Exxon Mobil Corp.,02/11/2023,"The Zacks Analyst Blog Highlights Exxon Mobil, Viper Energy ...",still open
Exxon Mobil Corp.,02/11/2023,"Exxon Stock, a Dividend Aristocrat, Hikes Payout for 40 Straight Years",still open
Exxon Mobil Corp.,02/11/2023,"Cheap clean hydrogen? Not so fast, energy giants say.",still open
Exxon Mobil Corp.,02/11/2023,The Oil Giants' Bet On The Super Cycle: Exxon Mobil And BP (NYSE ...,still open
Exxon Mobil Corp.,02/11/2023,"Esters Market Is Booming Worldwide 2023-2030 | BASF SE, Exxon ...",still open
Exxon Mobil Corp.,02/11/2023,"Operations normal at Exxon Beaumont, Texas complex after storms ...",still open
Exxon Mobil Corp.,02/11/2023,US Sanctions on Russia Make Ivan Tavrin Become Moscow’s ...,still open
Exxon Mobil Corp.,02/11/2023,India's ONGC to invest $3.5 bln to boost output from western ...,still open
Exxon Mobil Corp.,02/11/2023,"Biden Targets Meta, Exxon, Others For Enriching Wall Street Using A Special Tactic - Meta Platforms (NASD",still open
Exxon Mobil Corp.,02/11/2023,"Jet Fuel Market Insights by Industry Demand, New Opportunities ...",still open
Exxon Mobil Corp.,02/11/2023,"New Ways and Means GOP members bring energy, agricultural focus",still open
Exxon Mobil Corp.,02/11/2023,FY2023 EPS Estimates for Exxon Mobil Co. (NYSE:XOM) Cut by ...,still open
Exxon Mobil Corp.,02/11/2023,Hess Corporation: Bring On That Cash Flow (NYSE:HES),still open
Exxon Mobil Corp.,02/11/2023,Supply chains suffer huge disruptions from Turkey earthquake due ...,still open
Exxon Mobil Corp.,02/11/2023,These 3 Companies Generate Serious Cash,still open
Exxon Mobil Corp.,02/11/2023,"Chevron, Exxon and Total keen to invest in India, says minister",still open
Exxon Mobil Corp.,02/11/2023,Shell’s Clean Energy Transition Battles Record Oil Profits,still open
Exxon Mobil Corp.,02/11/2023,'It's outrageous': Biden blasts Big Oil's record profits amid the 'energy crisis' — proposes quadrupling the tax on buybacks. Here's how much the 3 giant US-based producers made in 2022,still open
Exxon Mobil Corp.,02/11/2023,Hybrid Organic Acid Antifreeze Market is Booming Worldwide ...,still open
Exxon Mobil Corp.,02/11/2023,Shell Posts Record 2022 Profit Fueled By Soaring Energy Prices,still open
Exxon Mobil Corp.,02/11/2023,"Petroleum Resins Market to Observe Prominent Development of USD 4.8 Billion by 2029, Size, Share, Trends,",still open
Exxon Mobil Corp.,02/11/2023,Exxon Mobil Stock Likely To Trade Lower Post Q4,still open
Exxon Mobil Corp.,02/11/2023,Sector Update : Energy Stocks Mixed in Midday Trading,still open
Exxon Mobil Corp.,02/11/2023,"Earnings roundup: Profits soar for NuStar, other oil and gas companies",still open
Exxon Mobil Corp.,02/11/2023,Energy Stocks Rise Following Reports on Russia Cutting Oil Production in March,still open
Exxon Mobil Corp.,02/11/2023,COHEN LAWRENCE B Goes on Buying Spree in 4th Quarter,still open
Exxon Mobil Corp.,02/11/2023,U.S. residential heating oil prices decline from record-highs in ...,still open
Exxon Mobil Corp.,02/11/2023,"Prudent Investors Network Inc. owns $827,000 shares of Exxon ...",still open
Exxon Mobil Corp.,02/11/2023,"Biolubricants Market Trends Analysis and Precise Outlook by 2030 | Exxon Mobil Corporation, Royal Dutch Shell",still open
Exxon Mobil Corp.,02/11/2023,Can Billion Dollar Buybacks Boost Stock Prices,still open
Exxon Mobil Corp.,02/11/2023,Exxon Mobil prepares to start up Beaumont refinery's new crude ...,still open
Exxon Mobil Corp.,02/11/2023,"Wireless access point market 2023-2027: A descriptive analysis of five forces model, market dynamics, and segmentation - Technavio",still open
Exxon Mobil Corp.,02/11/2023,Fifth Circuit Rules in Rahman v. Exxon Mobil,still open
Exxon Mobil Corp.,02/11/2023,News,still open
Exxon Mobil Corp.,02/11/2023,ExxonMobil announces corporate plan — Company expects to ...,still open
Exxon Mobil Corp.,02/11/2023,Public funding for political campaigns will keep government working ...,still open
Exxon Mobil Corp.,02/11/2023,Exxon Mobil counsel David Woodcock's move to Gibson Dunn is ...,still open
Exxon Mobil Corp.,02/11/2023,"Indian, European oil firms evaluating bids for Guyana blocks",still open
Exxon Mobil Corp.,02/11/2023,Column: Fantasy league matchmaking between oil majors and ...,still open
Exxon Mobil Corp.,02/11/2023,ExxonMobil announces third-quarter 2022 results,still open
Exxon Mobil Corp.,02/11/2023,"Why this money manager is betting on Mexico, energy and shorter ...",still open
Exxon Mobil Corp.,02/11/2023,partners make new discovery on Angola Block 15,still open
Exxon Mobil Corp.,02/11/2023,"Agricultural Films Market Is Expected To Reach around USD 16.37 Billion by 2030, Grow at a CAGR Of 6.3% during Forecast Period 2023 To 2030 | Data By Contrive Datum Insights Pvt Ltd.",still open
Exxon Mobil Corp.,02/11/2023,ExxonMobil announces two new Guyana discoveries,still open
Exxon Mobil Corp.,02/11/2023,ExxonMobil starts operations at large-scale advanced recycling facility,still open
Exxon Mobil Corp.,02/11/2023,"Exxon Mobil Corp. stock rises Friday, outperforms market",still open
Exxon Mobil Corp.,02/11/2023,Is Exxon Mobil Corp (XOM) Stock Worth a Buy Friday?,still open
