Name,Data,News,Evaluation
Exxon Mobil Corp.,02/08/2023,"TotalEnergies (TTE) Q4 Earnings Beat Estimates, Sales Rise Y/Y",still open
Exxon Mobil Corp.,02/08/2023,"Nippon Steel, Mitsubishi, Exxon to look at CCS value chains in Asia ...",still open
Exxon Mobil Corp.,02/08/2023,"The Zacks Analyst Blog Highlights Exxon Mobil, Fomento Economico Mexicano, Prologis, Marsh & McLennan and Becton Dickinson",still open
Exxon Mobil Corp.,02/08/2023,Biden's Nod to Enduring Oil Demand Sets Stage for COP28,still open
Exxon Mobil Corp.,02/08/2023,"Hess Corp. stock rises Tuesday, outperforms market",still open
Exxon Mobil Corp.,02/08/2023,Exxon Mobil Corporation (XOM) Is a Trending Stock: Facts to Know ...,still open
Exxon Mobil Corp.,02/08/2023,An In-Depth Look At Exxon Mobil's Revenue And Its Determining ...,still open
Exxon Mobil Corp.,02/08/2023,Marathon Oil Corp. stock outperforms market on strong trading day,still open
Exxon Mobil Corp.,02/08/2023,Is Schwab Fundamental U.S. Large Company Index ETF (FNDX) a ...,still open
Exxon Mobil Corp.,02/08/2023,Valero Energy Corp. stock outperforms competitors on strong trading day,still open
Exxon Mobil Corp.,02/08/2023,10 Companies Likely to be Dividend Kings in the Future,still open
Exxon Mobil Corp.,02/08/2023,"Biden Targets Meta, Exxon, Others For Enriching Wall Street Using A Special Tactic - Meta Platforms (NASD",still open
Exxon Mobil Corp.,02/08/2023,Increased Call for Higher Taxation Rises as Energy Giants Rake in Billions in Profit,still open
Exxon Mobil Corp.,02/08/2023,High-Profile Exxon Mobil Attorney Departs Despite Company's ...,still open
Exxon Mobil Corp.,02/08/2023,India's Petronet seeks more LNG under long-term Qatar deal,still open
Exxon Mobil Corp.,02/08/2023,Validea Motley Fool Strategy Daily Upgrade Report - 2/7/2023,still open
Exxon Mobil Corp.,02/08/2023,"Exxon Stock, a Dividend Aristocrat, Hikes Payout for 40 Straight Years",still open
Exxon Mobil Corp.,02/08/2023,"The Zacks Analyst Blog Highlights Exxon Mobil, Viper Energy ...",still open
Exxon Mobil Corp.,02/08/2023,"Exxon, Chevron, ConocoPhillips plan Permian Basin production ...",still open
Exxon Mobil Corp.,02/08/2023,Exxon Mobil doublespeak reveals climate change challenge for Big ...,still open
Exxon Mobil Corp.,02/08/2023,Can Billion Dollar Buybacks Boost Stock Prices,still open
Exxon Mobil Corp.,02/08/2023,BP PLC ADR outperforms market on strong trading day,still open
Exxon Mobil Corp.,02/08/2023,Shell’s Clean Energy Transition Battles Record Oil Profits,still open
Exxon Mobil Corp.,02/08/2023,"BP Posts Record 2022 Earnings, Biggest Profit In 114-Year History",still open
Exxon Mobil Corp.,02/08/2023,U.S. refiners throttle back Q1 output after record 2022 runs,still open
Exxon Mobil Corp.,02/08/2023,Exxon Mobil prepares to start up Beaumont refinery's new crude ...,still open
Exxon Mobil Corp.,02/08/2023,Polypropylene Nonwoven Fabric Market Foreseen to Draw a ...,still open
Exxon Mobil Corp.,02/08/2023,Dividend Capture Strategy: 10 High-Yield Stocks to Buy in February,still open
Exxon Mobil Corp.,02/08/2023,Occidental's CEO says stock buybacks take priority over oil growth,still open
Exxon Mobil Corp.,02/08/2023,"Chevron, Exxon and Total keen to invest in India, says minister",still open
Exxon Mobil Corp.,02/08/2023,Remembering longtime Corporation member James R. Houghton,still open
Exxon Mobil Corp.,02/08/2023,ConocoPhillips joins Big Oil's parade of bumper profits but shares fall,still open
Exxon Mobil Corp.,02/08/2023,Guyana: 1.3 billion barrels in ExxonMobil offshore oil field,still open
Exxon Mobil Corp.,02/08/2023,"Earnings roundup: Profits soar for NuStar, other oil and gas companies",still open
Exxon Mobil Corp.,02/08/2023,Mining Chemicals Market 2023 Huge Demand & Future Scope ...,still open
Exxon Mobil Corp.,02/08/2023,Shell Posts Record 2022 Profit Fueled By Soaring Energy Prices,still open
Exxon Mobil Corp.,02/08/2023,Petroleum Resins Market Research Report by Power Rating ...,still open
Exxon Mobil Corp.,02/08/2023,Hybrid Organic Acid Antifreeze Market is Booming Worldwide ...,still open
Exxon Mobil Corp.,02/08/2023,The Global Fallout Of The Fed's Decision,still open
Exxon Mobil Corp.,02/08/2023,"The Global Carbon Capture and Storage Market Market is forecast to grow by 104.5 mn t during 2022-2027, accelerating at a CAGR of 22.91% during the forecast period",still open
Exxon Mobil Corp.,02/08/2023,"Operations at Exxon's Baytown, Texas refinery normal after storms",still open
Exxon Mobil Corp.,02/08/2023,Exxon Mobil Stock: Nowhere To Go But Down (NYSE:XOM),still open
Exxon Mobil Corp.,02/08/2023,Big Oil Faces Headwinds After Record $199 Billion Profit Haul,still open
Exxon Mobil Corp.,02/08/2023,4 Dividend Aristocrat Buys For February,still open
Exxon Mobil Corp.,02/08/2023,12 Cheap Energy Stocks To Buy,still open
Exxon Mobil Corp.,02/08/2023,Guyana expects proposal from India for long-term crude purchases,still open
Exxon Mobil Corp.,02/08/2023,Crude Benzene Market Size 2023 Industry Recent Developments ...,still open
Exxon Mobil Corp.,02/08/2023,"Performance Elastomer Market Growth, Next Big Business Opportunities 2031 | Mitsui Chemical, Wacker Chemie,",still open
Exxon Mobil Corp.,02/08/2023,"DOLIVER ADVISORS, LP Buys 2, S",still open
Exxon Mobil Corp.,02/08/2023,Industrial Oil Market to Display Impressive Growth of 3.6% with ...,still open
Exxon Mobil Corp.,02/08/2023,"Prudent Investors Network Inc. owns $827,000 shares of Exxon ...",still open
Exxon Mobil Corp.,02/08/2023,Global Asphalt Markets Report 2022-2027 - Developing Countries ...,still open
Exxon Mobil Corp.,02/08/2023,"Biolubricants Market Trends Analysis and Precise Outlook by 2030 | Exxon Mobil Corporation, Royal Dutch Shell",still open
Exxon Mobil Corp.,02/08/2023,Industrial Plastic Market will grow to USD 135.6 billion by 2030 : GreyViews,still open
Exxon Mobil Corp.,02/08/2023,The Real Winners of the Coming Capex Tsunami,still open
Exxon Mobil Corp.,02/08/2023,Physical Blowing Agents Market Current Status and Future ...,still open
Exxon Mobil Corp.,02/08/2023,"Wax Market Size 2023 and Forecast by 2029, Top Companies are ...",still open
Exxon Mobil Corp.,02/08/2023,"Automotive Lubricants Market Is Expected To Reach around USD 76.61 Billion by 2030, Grow at a CAGR Of 1.6% during Forecast Period 2023 To 2030 | Data By Contrive Datum Insights Pvt Ltd.",still open
Exxon Mobil Corp.,02/08/2023,15 Most Valuable Russian Companies In The World,still open
Exxon Mobil Corp.,02/08/2023,"Scotiabank Adjusts Price Target on Exxon Mobil to $140 From $135, Maintains Sector Outperform Rating",still open
Exxon Mobil Corp.,02/08/2023,"Jet Fuel Market Share, In-depth Analysis Report and Forecast 2032 ...",still open
Exxon Mobil Corp.,02/08/2023,Olefinic Thermoplastic Elastomer Market Size 2023 Industry Recent ...,still open
Exxon Mobil Corp.,02/08/2023,ExxonMobil announces third-quarter 2022 results,still open
Exxon Mobil Corp.,02/08/2023,XOM: 3 High-Quality Stocks to Pick up in 2023,still open
Exxon Mobil Corp.,02/08/2023,ExxonMobil announces second-quarter 2022 results,still open
Exxon Mobil Corp.,02/08/2023,ExxonMobil elects Larry Kellner and John Harris to Board of Directors,still open
Exxon Mobil Corp.,02/08/2023,News,still open
Exxon Mobil Corp.,02/08/2023,ExxonMobil announces corporate plan — Company expects to ...,still open
Exxon Mobil Corp.,02/08/2023,"Exxon Mobil Corp. stock rises Tuesday, outperforms market",still open
Exxon Mobil Corp.,02/08/2023,Is Exxon Mobil Corp (XOM) Stock Worth a Buy Friday?,still open
Exxon Mobil Corp.,02/08/2023,Exxon Mobil Co. (NYSE:XOM) Receives Consensus ...,still open
Exxon Mobil Corp.,02/08/2023,Exxon Mobil (NYSE:XOM) PT Raised to $110.00,still open
Exxon Mobil Corp.,02/08/2023,Do Analysts Agree Tuesday on Exxon Mobil Corp (XOM) Stock's Target Price?,still open
Exxon Mobil Corp.,02/08/2023,"Exxon Mobil Corp. stock falls Thursday, underperforms market",still open
Exxon Mobil Corp.,02/08/2023,"Exxon Mobil Corp. stock falls Tuesday, still outperforms market",still open
Exxon Mobil Corp.,02/08/2023,Should You Buy Exxon Mobil Corp (XOM) Stock After it Has Gained 3.70% in a Week?,still open
Exxon Mobil Corp.,02/08/2023,Should You Sell Exxon Mobil Corp (XOM) Stock Thursday?,still open
Exxon Mobil Corp.,02/08/2023,Exxon smashes Western oil majors' profits with $56 billion in 2022,still open
Exxon Mobil Corp.,02/08/2023,"Exxon Mobil Corp. stock rises Thursday, outperforms market",still open
Exxon Mobil Corp.,02/08/2023,"Exxon Mobil Corp. stock falls Friday, underperforms market",still open
Exxon Mobil Corp.,02/08/2023,"Hess Corp. stock rises Tuesday, outperforms market",still open
Exxon Mobil Corp.,02/08/2023,Marathon Oil Corp. stock outperforms market on strong trading day,still open
Exxon Mobil Corp.,02/08/2023,Exxon Mobil Co. (NYSE:XOM) VP Darrin L. Talley Sells 2500 Shares,still open
Exxon Mobil Corp.,02/08/2023,Valero Energy Corp. stock outperforms competitors on strong trading day,still open
Exxon Mobil Corp.,02/08/2023,Exxon Mobil Stock: Nowhere To Go But Down (NYSE:XOM),still open
Exxon Mobil Corp.,02/08/2023,ExxonMobil Likely to Report Surge in Q4 Earnings,still open
Exxon Mobil Corp.,02/08/2023,"Top Stock Reports for Exxon Mobil, Fomento Economico Mexicano & Prologis",still open
Exxon Mobil Corp.,02/08/2023,"Exxon Mobil to Sell Thai Refinery, Retail Unit to Bangchak Corp",still open
Exxon Mobil Corp.,02/08/2023,"Exxon Stock, a Dividend Aristocrat, Hikes Payout for 40 Straight Years",still open
Exxon Mobil Corp.,02/08/2023,"Exxon set to order 5th Guyana oil vessel, sizing up more blocks",still open
Exxon Mobil Corp.,02/08/2023,5 Energy Stocks Gurus Are Drilling Into,still open
Exxon Mobil Corp.,02/08/2023,"Eastman Chemical Co. stock rises Tuesday, still underperforms market",still open
Exxon Mobil Corp.,02/08/2023,"BUZZ-U.S. STOCKS ON THE MOVE-Fat Brands, Spotify, Uber Tech",still open
Exxon Mobil Corp.,02/08/2023,Validea Motley Fool Strategy Daily Upgrade Report - 2/7/2023,still open
Exxon Mobil Corp.,02/08/2023,"Biden Targets Meta, Exxon, Others For Enriching Wall Street Using A Special Tactic - Meta Platforms (NASD",still open
Exxon Mobil Corp.,02/08/2023,Study: Exxon Mobil accurately predicted warming since 1970s,still open
Exxon Mobil Corp.,02/08/2023,Exclusive: Exxon prepares to start up $2 bln Texas oil refinery ...,still open
Exxon Mobil Corp.,02/08/2023,US STOCKS-Wall St gains over 1% after encouraging inflation data with Fed next,still open
Exxon Mobil Corp.,02/08/2023,June 2025 Options Now Available For Exxon Mobil (XOM),still open
Exxon Mobil Corp.,02/08/2023,Valero Energy Corp. stock underperforms Wednesday when ...,still open
Exxon Mobil Corp.,02/08/2023,Occidental's CEO says stock buybacks take priority over oil growth,still open
Exxon Mobil Corp.,02/08/2023,Exxon Mobil Co. (NYSE:XOM) Sees Large Decline in Short Interest,still open
Exxon Mobil Corp.,02/08/2023,"Valero Energy Corp. stock rises Monday, still underperforms market",still open
Exxon Mobil Corp.,02/08/2023,"Marathon Oil Corp. stock rises Thursday, outperforms market",still open
Exxon Mobil Corp.,02/08/2023,"The Zacks Analyst Blog Highlights Exxon Mobil, Viper Energy ...",still open
Exxon Mobil Corp.,02/08/2023,St. Louis Trust Co Has $1.32 Million Stock Position in Exxon Mobil ...,still open
Exxon Mobil Corp.,02/08/2023,Is Schwab Fundamental U.S. Large Company Index ETF (FNDX) a ...,still open
Exxon Mobil Corp.,02/08/2023,Exxon stock vs Chevron stock: Goldman Sachs analyst picks a side,still open
Exxon Mobil Corp.,02/08/2023,"DOLIVER ADVISORS, LP Buys 2, S",still open
Exxon Mobil Corp.,02/08/2023,Dividend Capture Strategy: 10 High-Yield Stocks to Buy in February,still open
Exxon Mobil Corp.,02/08/2023,"Chevron, Exxon and Total keen to invest in India, says minister",still open
Exxon Mobil Corp.,02/08/2023,India's ONGC to invest $3.5 bln to boost output from western offshore assets,still open
Exxon Mobil Corp.,02/08/2023,BP posts record annual profit of $28B By Investing.com,still open
Exxon Mobil Corp.,02/08/2023,Exxon Mobil prepares to start up Beaumont refinery's new crude ...,still open
Exxon Mobil Corp.,02/08/2023,BP PLC ADR outperforms market on strong trading day,still open
Exxon Mobil Corp.,02/08/2023,"Exxon Mobil Corp. stock rises Friday, outperforms market",still open
Exxon Mobil Corp.,02/08/2023,These 2 dividend-stock ETFs are more like growth funds in disguise ...,still open
Exxon Mobil Corp.,02/08/2023,"Exxon Mobil Corp. stock falls Wednesday, underperforms market",still open
Exxon Mobil Corp.,02/08/2023,"Earnings roundup: Profits soar for NuStar, other oil and gas companies",still open
Exxon Mobil Corp.,02/08/2023,Where Will Exxon Mobil Corp (XOM) Stock Go Next After It Is Down 1.29% in a Week?,still open
Exxon Mobil Corp.,02/08/2023,Why ExxonMobil Stock Popped on Monday,still open
Exxon Mobil Corp.,02/08/2023,"Stock Market News: Nasdaq's best January in 22 years, PayPal ...",still open
Exxon Mobil Corp.,02/08/2023,U.S. refiners throttle back Q1 output after record 2022 runs,still open
Exxon Mobil Corp.,02/08/2023,Why ExxonMobil Stock Jumped 27% in October,still open
Exxon Mobil Corp.,02/08/2023,Is Exxon Mobil Corp (XOM) Stock a Good Value Thursday?,still open
Exxon Mobil Corp.,02/08/2023,Exxon (XOM) Stock Hits Record High as Energy Sector Outperforms ...,still open
Exxon Mobil Corp.,02/08/2023,Is Exxon Mobil Corp (XOM) Stock at the Top of the Oil & Gas Integrated Industry?,still open
Exxon Mobil Corp.,02/08/2023,"Exxon Mobil Corp. stock rises Wednesday, outperforms market",still open
Exxon Mobil Corp.,02/08/2023,Exxon Mobil Corp. stock outperforms market on strong trading day,still open
Exxon Mobil Corp.,02/08/2023,"North American Morning Briefing : Payrolls Shocker, China Spat to Weigh on Stocks",still open
Exxon Mobil Corp.,02/08/2023,The Global Fallout Of The Fed's Decision,still open
Exxon Mobil Corp.,02/08/2023,Why ExxonMobil Stock Is Rising Today,still open
Exxon Mobil Corp.,02/08/2023,Exxon Mobil (NYSE:XOM) Stock Price Hits New Record High,still open
Exxon Mobil Corp.,02/08/2023,Exxon Mobil Corp. stock outperforms competitors despite losses on the day,still open
Exxon Mobil Corp.,02/08/2023,"Exxon plans to raise spending in 2023, boost share buybacks",still open
Exxon Mobil Corp.,02/08/2023,ExxonMobil Posts Record Profits. Time to Buy the Dividend Aristocrat?,still open
Exxon Mobil Corp.,02/08/2023,Is ExxonMobil a Buy?,still open
Exxon Mobil Corp.,02/08/2023,"With a $30 Billion Cash War Chest, Could ExxonMobil Be Planning ...",still open
Exxon Mobil Corp.,02/08/2023,Better Oil Stock: Exxon vs Chevron,still open
Exxon Mobil Corp.,02/08/2023,"Why ExxonMobil, Occidental Petroleum, and Phillips 66 Stocks Just ...",still open
Exxon Mobil Corp.,02/08/2023,"Exxon Mobil Corp. stock rises Monday, still underperforms market",still open
Exxon Mobil Corp.,02/08/2023,Exxon Profit (NYSE:XOM) Soars to All-Time High as Energy Markets ...,still open
Exxon Mobil Corp.,02/08/2023,ExxonMobil announces third-quarter 2022 results,still open
Exxon Mobil Corp.,02/08/2023,"Exxon, Chevron to spend billions more on oil projects next year",still open
Exxon Mobil Corp.,02/08/2023,Exxon Mobil Stock: A Must Have For Dividend Income Investors ...,still open
Exxon Mobil Corp.,02/08/2023,The Real Winners of the Coming Capex Tsunami,still open
Exxon Mobil Corp.,02/08/2023,Why ExxonMobil Stock Is Slumping Today,still open
Exxon Mobil Corp.,02/08/2023,"The Zacks Analyst Blog Highlights Exxon Mobil, Meta Platforms, Eaton Keysight Technologies and ANSYS",still open
Exxon Mobil Corp.,02/08/2023,Exxon faces $2 billion loss on sale of troubled California oil properties,still open
Exxon Mobil Corp.,02/08/2023,"Why Oil Stocks ExxonMobil, Phillips 66, and Marathon Oil Were ...",still open
Exxon Mobil Corp.,02/08/2023,Exxon Mobil Stock: Game Over (NYSE:XOM),still open
Exxon Mobil Corp.,02/08/2023,Where Will ExxonMobil Be in 10 Years?,still open
Exxon Mobil Corp.,02/08/2023,Exxon Mobil Corp. (XOM) Q3 2022 Earnings Call Transcript,still open
Exxon Mobil Corp.,02/08/2023,"The Zacks Analyst Blog Highlights Exxon Mobil, Merck & Co, Chevron, American Electric Power and The Southern",still open
Exxon Mobil Corp.,02/08/2023,Exxon signals strong Q3 earnings on natural gas pricing,still open
Exxon Mobil Corp.,02/08/2023,XOM Stock Price Prediction: Know about this Deliberate Selling ...,still open
Exxon Mobil Corp.,02/08/2023,"Top Stock Reports for Berkshire Hathaway, Exxon Mobil & Walmart",still open
Exxon Mobil Corp.,02/08/2023,Better Buy: ExxonMobil or Chevron?,still open
Exxon Mobil Corp.,02/08/2023,"Exxon Mobil makes a big comeback, surpassing Tesla in market value",still open
Exxon Mobil Corp.,02/08/2023,Exxon sues EU in move to block new windfall tax on oil companies,still open
Exxon Mobil Corp.,02/08/2023,"Exxon (XOM), Chevron (CVX) Ramp Up Stock Buybacks as Energy ...",still open
Exxon Mobil Corp.,02/08/2023,"Exxon completes sale of Chad, Cameroon operations for $407 million",still open
Exxon Mobil Corp.,02/08/2023,"Exxon Mobil, Chevron, ConocoPhillips Slapped With Shareholder Resolutions Over Secretive Tax Practices",still open
Exxon Mobil Corp.,02/08/2023,Is Exxon Stock a Buy?,still open
Exxon Mobil Corp.,02/08/2023,Exxon shares surge to record high on strong earnings outlook,still open
Exxon Mobil Corp.,02/08/2023,"STOCK MARKET NEWS: Biden on State of the Union, Fed's Powell ...",still open
Exxon Mobil Corp.,02/08/2023,This Oil King Has a Brighter Future Than You Might Think,still open
Exxon Mobil Corp.,02/08/2023,"Exxon Rebuts Biden's Attack on Profits, Citing Dividend Payout",still open
Exxon Mobil Corp.,02/08/2023,Exxon Mobil Corporation (XOM) is Attracting Investor Attention: Here is What You Should Know,still open
Exxon Mobil Corp.,02/08/2023,UPDATE 1-Mexico Pacific to sell LNG from Sonora export plant to Exxon Mobil,still open
Exxon Mobil Corp.,02/08/2023,Exxon Mobil: An Exceptional Year Does Not Guarantee Future Success (NYSE:XOM),still open
Exxon Mobil Corp.,02/08/2023,Exclusive: Exxon prepares to start up $2 bln Texas oil refinery expansion,still open
Exxon Mobil Corp.,02/08/2023,Study: Exxon Mobil accurately predicted warming since 1970s,still open
Exxon Mobil Corp.,02/08/2023,White House blasts Exxon over historical $56 bln annual profit,still open
Exxon Mobil Corp.,02/08/2023,"Exxon set to order 5th Guyana oil vessel, sizing up more blocks",still open
Exxon Mobil Corp.,02/08/2023,Exxon smashes Western oil majors' earnings record with $56 billion profit for 2022,still open
Exxon Mobil Corp.,02/08/2023,Exxon smashes Western oil majors' profits with $56 billion in 2022,still open
Exxon Mobil Corp.,02/08/2023,Exxon signals strong Q4 profit to drive annual record,still open
Exxon Mobil Corp.,02/08/2023,"Exxon Mobil Corp. stock rises Tuesday, outperforms market",still open
Exxon Mobil Corp.,02/08/2023,Mexico Pacific to sell LNG from Sonora export plant to Exxon Mobil,still open
Exxon Mobil Corp.,02/08/2023,ExxonMobil announces full-year 2022 results,still open
Exxon Mobil Corp.,02/08/2023,Is Exxon Mobil Corp (XOM) Stock Worth a Buy Friday?,still open
Exxon Mobil Corp.,02/08/2023,"Exxon Mobil Corp. stock falls Thursday, underperforms market",still open
Exxon Mobil Corp.,02/08/2023,"Exxon Mobil Corp. stock rises Thursday, outperforms market",still open
Exxon Mobil Corp.,02/08/2023,Exxon Mobil sets large-scale hydrogen plant start-up for 2027,still open
Exxon Mobil Corp.,02/08/2023,Do Analysts Agree Tuesday on Exxon Mobil Corp (XOM) Stock's Target Price?,still open
Exxon Mobil Corp.,02/08/2023,Exxon Mobil Corporation 2022 Q4 - Results - Earnings Call ...,still open
Exxon Mobil Corp.,02/08/2023,ExxonMobil to sell interest in Esso Thailand,still open
Exxon Mobil Corp.,02/08/2023,Should You Sell Exxon Mobil Corp (XOM) Stock Thursday?,still open
Exxon Mobil Corp.,02/08/2023,"Esters Market Is Booming Worldwide 2023-2030 | BASF SE, Exxon ...",still open
Exxon Mobil Corp.,02/08/2023,Assessing ExxonMobil's global warming projections,still open
Exxon Mobil Corp.,02/08/2023,"Exxon Mobil Corp. Q4 Profit Increases, beats estimates",still open
Exxon Mobil Corp.,02/08/2023,"Exxon Mobil Corp. stock falls Friday, underperforms market",still open
Exxon Mobil Corp.,02/08/2023,"Indian energy company ONGC Videsh eyes oil, gas 'hot spots' in ...",still open
Exxon Mobil Corp.,02/08/2023,Do Analysts Agree Friday on Exxon Mobil Corp (XOM) Stock's Target Price?,still open
Exxon Mobil Corp.,02/08/2023,Exxon Mobil Corporation (NYSE:XOM) Vice President Darrin L ...,still open
Exxon Mobil Corp.,02/08/2023,"Exxon Mobil Corp. stock falls Tuesday, still outperforms market",still open
Exxon Mobil Corp.,02/08/2023,Here's What We Like About Exxon Mobil's (NYSE:XOM) Upcoming Dividend,still open
Exxon Mobil Corp.,02/08/2023,"TotalEnergies (TTE) Q4 Earnings Beat Estimates, Sales Rise Y/Y",still open
Exxon Mobil Corp.,02/08/2023,"Nippon Steel, Mitsubishi, Exxon to look at CCS value chains in Asia ...",still open
Exxon Mobil Corp.,02/08/2023,"The Zacks Analyst Blog Highlights Exxon Mobil, Fomento Economico Mexicano, Prologis, Marsh & McLennan and Becton Dickinson",still open
Exxon Mobil Corp.,02/08/2023,Biden's Nod to Enduring Oil Demand Sets Stage for COP28,still open
Exxon Mobil Corp.,02/08/2023,"Hess Corp. stock rises Tuesday, outperforms market",still open
Exxon Mobil Corp.,02/08/2023,Exxon Mobil Corporation (XOM) Is a Trending Stock: Facts to Know ...,still open
Exxon Mobil Corp.,02/08/2023,An In-Depth Look At Exxon Mobil's Revenue And Its Determining ...,still open
Exxon Mobil Corp.,02/08/2023,Marathon Oil Corp. stock outperforms market on strong trading day,still open
Exxon Mobil Corp.,02/08/2023,Is Schwab Fundamental U.S. Large Company Index ETF (FNDX) a ...,still open
Exxon Mobil Corp.,02/08/2023,Valero Energy Corp. stock outperforms competitors on strong trading day,still open
Exxon Mobil Corp.,02/08/2023,10 Companies Likely to be Dividend Kings in the Future,still open
Exxon Mobil Corp.,02/08/2023,"Biden Targets Meta, Exxon, Others For Enriching Wall Street Using A Special Tactic - Meta Platforms (NASD",still open
Exxon Mobil Corp.,02/08/2023,Increased Call for Higher Taxation Rises as Energy Giants Rake in Billions in Profit,still open
Exxon Mobil Corp.,02/08/2023,High-Profile Exxon Mobil Attorney Departs Despite Company's ...,still open
Exxon Mobil Corp.,02/08/2023,India's Petronet seeks more LNG under long-term Qatar deal,still open
Exxon Mobil Corp.,02/08/2023,Validea Motley Fool Strategy Daily Upgrade Report - 2/7/2023,still open
Exxon Mobil Corp.,02/08/2023,"Exxon Stock, a Dividend Aristocrat, Hikes Payout for 40 Straight Years",still open
Exxon Mobil Corp.,02/08/2023,"The Zacks Analyst Blog Highlights Exxon Mobil, Viper Energy ...",still open
Exxon Mobil Corp.,02/08/2023,"Exxon, Chevron, ConocoPhillips plan Permian Basin production ...",still open
Exxon Mobil Corp.,02/08/2023,Exxon Mobil doublespeak reveals climate change challenge for Big ...,still open
Exxon Mobil Corp.,02/08/2023,Can Billion Dollar Buybacks Boost Stock Prices,still open
Exxon Mobil Corp.,02/08/2023,BP PLC ADR outperforms market on strong trading day,still open
Exxon Mobil Corp.,02/08/2023,Shell’s Clean Energy Transition Battles Record Oil Profits,still open
Exxon Mobil Corp.,02/08/2023,"BP Posts Record 2022 Earnings, Biggest Profit In 114-Year History",still open
Exxon Mobil Corp.,02/08/2023,U.S. refiners throttle back Q1 output after record 2022 runs,still open
Exxon Mobil Corp.,02/08/2023,Exxon Mobil prepares to start up Beaumont refinery's new crude ...,still open
Exxon Mobil Corp.,02/08/2023,Polypropylene Nonwoven Fabric Market Foreseen to Draw a ...,still open
Exxon Mobil Corp.,02/08/2023,Dividend Capture Strategy: 10 High-Yield Stocks to Buy in February,still open
Exxon Mobil Corp.,02/08/2023,Occidental's CEO says stock buybacks take priority over oil growth,still open
Exxon Mobil Corp.,02/08/2023,"Chevron, Exxon and Total keen to invest in India, says minister",still open
Exxon Mobil Corp.,02/08/2023,Remembering longtime Corporation member James R. Houghton,still open
Exxon Mobil Corp.,02/08/2023,ConocoPhillips joins Big Oil's parade of bumper profits but shares fall,still open
Exxon Mobil Corp.,02/08/2023,Guyana: 1.3 billion barrels in ExxonMobil offshore oil field,still open
Exxon Mobil Corp.,02/08/2023,"Earnings roundup: Profits soar for NuStar, other oil and gas companies",still open
Exxon Mobil Corp.,02/08/2023,Mining Chemicals Market 2023 Huge Demand & Future Scope ...,still open
Exxon Mobil Corp.,02/08/2023,Shell Posts Record 2022 Profit Fueled By Soaring Energy Prices,still open
Exxon Mobil Corp.,02/08/2023,Petroleum Resins Market Research Report by Power Rating ...,still open
Exxon Mobil Corp.,02/08/2023,Hybrid Organic Acid Antifreeze Market is Booming Worldwide ...,still open
Exxon Mobil Corp.,02/08/2023,The Global Fallout Of The Fed's Decision,still open
Exxon Mobil Corp.,02/08/2023,"The Global Carbon Capture and Storage Market Market is forecast to grow by 104.5 mn t during 2022-2027, accelerating at a CAGR of 22.91% during the forecast period",still open
Exxon Mobil Corp.,02/08/2023,"Operations at Exxon's Baytown, Texas refinery normal after storms",still open
Exxon Mobil Corp.,02/08/2023,Exxon Mobil Stock: Nowhere To Go But Down (NYSE:XOM),still open
Exxon Mobil Corp.,02/08/2023,Big Oil Faces Headwinds After Record $199 Billion Profit Haul,still open
Exxon Mobil Corp.,02/08/2023,4 Dividend Aristocrat Buys For February,still open
Exxon Mobil Corp.,02/08/2023,12 Cheap Energy Stocks To Buy,still open
Exxon Mobil Corp.,02/08/2023,Guyana expects proposal from India for long-term crude purchases,still open
Exxon Mobil Corp.,02/08/2023,Crude Benzene Market Size 2023 Industry Recent Developments ...,still open
