Name,Data,News,Evaluation
Exxon Mobil Corp.,02/13/2023,An In-Depth Look At Exxon Mobil's Revenue And Its Determining ...,still open
Exxon Mobil Corp.,02/13/2023,APA strikes oil off Suriname coast,still open
Exxon Mobil Corp.,02/13/2023,"Indian energy company ONGC Videsh eyes oil, gas 'hot spots' in ...",still open
Exxon Mobil Corp.,02/13/2023,Gebrüder Weiss announces a new location in Albania,still open
Exxon Mobil Corp.,02/13/2023,"Aircraft Lubricant Market Potential Growth 2023 -2030, Industry Analysis, Size, Share | Molykote, Shell Inc,",still open
Exxon Mobil Corp.,02/13/2023,"Marathon Oil Corp. stock rises Friday, outperforms market",still open
Exxon Mobil Corp.,02/13/2023,Valero Energy Corp. stock outperforms market on strong trading day,still open
Exxon Mobil Corp.,02/13/2023,"Hess Corp. stock rises Friday, outperforms market",still open
Exxon Mobil Corp.,02/13/2023,Exxon Mobil Corporation (NYSE:XOM) Vice President Darrin L ...,still open
Exxon Mobil Corp.,02/13/2023,How to Build a Lottery Winning Stock Portfolio,still open
Exxon Mobil Corp.,02/13/2023,"13 Feb, 2023 China to dominate polyethylene capacity additions in ...",still open
Exxon Mobil Corp.,02/13/2023,"Oil companies' 2022 profits: How much did Exxon, BP and more ...",still open
Exxon Mobil Corp.,02/13/2023,Exxon Mobil Stock Likely To Trade Lower Post Q4,still open
Exxon Mobil Corp.,02/13/2023,"Operations normal at Exxon Beaumont, Texas complex after storms ...",still open
Exxon Mobil Corp.,02/13/2023,12 Most Profitable Oil Stocks in the World,still open
Exxon Mobil Corp.,02/13/2023,The Oil Giants' Bet On The Super Cycle: Exxon Mobil And BP (NYSE ...,still open
Exxon Mobil Corp.,02/13/2023,Base Oil Market 2022-2030 Worldwide Major Growth by Key Players ...,still open
Exxon Mobil Corp.,02/13/2023,FY2023 EPS Estimates for Exxon Mobil Co. (NYSE:XOM) Cut by ...,still open
Exxon Mobil Corp.,02/13/2023,"Process Oil Market Size, Share, Revenue, Trends And Drivers For 2023-2032",still open
Exxon Mobil Corp.,02/13/2023,25 Most Expensive Countries in Europe,still open
Exxon Mobil Corp.,02/13/2023,Japex lifts FY22/23 profit forecast on higher natural gas prices,still open
Exxon Mobil Corp.,02/13/2023,"Cheap clean hydrogen? Not so fast, energy giants say.",still open
Exxon Mobil Corp.,02/13/2023,"Biden Targets Meta, Exxon, Others For Enriching Wall Street Using A Special Tactic - Meta Platforms (NASD",still open
Exxon Mobil Corp.,02/13/2023,Blow Molding Resins Market to Reach US$25.1 billion by 2027 - IndustryARC,still open
Exxon Mobil Corp.,02/13/2023,Europe’s Oil Giants Slow Green Goals and Act More Like Exxon,still open
Exxon Mobil Corp.,02/13/2023,Exclusive Research Report on Benzene Toluene Xylene Market ...,still open
Exxon Mobil Corp.,02/13/2023,US Sanctions on Russia Make Ivan Tavrin Become Moscow’s ...,still open
Exxon Mobil Corp.,02/13/2023,Chevron weighs extending CEO Mike Wirth past mandatory retirement age,still open
Exxon Mobil Corp.,02/13/2023,10 Companies Likely to be Dividend Kings in the Future,still open
Exxon Mobil Corp.,02/13/2023,Hybrid Organic Acid Antifreeze Market is Booming Worldwide ...,still open
Exxon Mobil Corp.,02/13/2023,Hess Corporation: Bring On That Cash Flow (NYSE:HES),still open
Exxon Mobil Corp.,02/13/2023,Metal Working Lubricants Industry is Expected to Reach $8 Billion ...,still open
Exxon Mobil Corp.,02/13/2023,"Jet Fuel Market Insights by Industry Demand, New Opportunities ...",still open
Exxon Mobil Corp.,02/13/2023,Is Schwab Fundamental U.S. Large Company Index ETF (FNDX) a ...,still open
Exxon Mobil Corp.,02/13/2023,"Best Stocks To buy Now: February 11, 2023",still open
Exxon Mobil Corp.,02/13/2023,Supply chains suffer huge disruptions from Turkey earthquake due ...,still open
Exxon Mobil Corp.,02/13/2023,"Prudent Investors Network Inc. owns $827,000 shares of Exxon ...",still open
Exxon Mobil Corp.,02/13/2023,"Biolubricants Market Trends Analysis and Precise Outlook by 2030 | Exxon Mobil Corporation, Royal Dutch Shell",still open
Exxon Mobil Corp.,02/13/2023,12 Cheap Energy Stocks To Buy,still open
Exxon Mobil Corp.,02/13/2023,Letters: We should make electric cars even cleaner by embracing ...,still open
Exxon Mobil Corp.,02/13/2023,US open: Stocks higher as investors await CPI reading | Financial ...,still open
Exxon Mobil Corp.,02/13/2023,Exxon Mobil prepares to start up Beaumont refinery's new crude ...,still open
Exxon Mobil Corp.,02/13/2023,News,still open
Exxon Mobil Corp.,02/13/2023,Fifth Circuit Rules in Rahman v. Exxon Mobil,still open
Exxon Mobil Corp.,02/13/2023,ExxonMobil announces corporate plan — Company expects to ...,still open
Exxon Mobil Corp.,02/13/2023,Public funding for political campaigns will keep government working ...,still open
Exxon Mobil Corp.,02/13/2023,"Indian, European oil firms evaluating bids for Guyana blocks",still open
Exxon Mobil Corp.,02/13/2023,"Offshore Decommissioning Market Future Development 2023 -2030 Industry Growth, Size, Share |Allseas Group, AF",still open
Exxon Mobil Corp.,02/13/2023,"Agriculture Films Market Market Size 2022 Demand, Global Trend ...",still open
Exxon Mobil Corp.,02/13/2023,ExxonMobil announces third-quarter 2022 results,still open
Exxon Mobil Corp.,02/13/2023,"Minneapolis Portfolio Management Group, LLC Buys 2, Sells 3 in ...",still open
Exxon Mobil Corp.,02/13/2023,Petroleum Resins Market Research Report by Power Rating ...,still open
Exxon Mobil Corp.,02/13/2023,partners make new discovery on Angola Block 15,still open
Exxon Mobil Corp.,02/13/2023,ExxonMobil announces two new Guyana discoveries,still open
Exxon Mobil Corp.,02/13/2023,Energy Stocks Rise Following Reports on Russia Cutting Oil Production in March,still open
Exxon Mobil Corp.,02/13/2023,ExxonMobil starts operations at large-scale advanced recycling facility,still open
Exxon Mobil Corp.,02/13/2023,ExxonMobil announces second-quarter 2022 results,still open
Exxon Mobil Corp.,02/13/2023,'It's outrageous': Biden blasts Big Oil's record profits amid the 'energy crisis' — proposes quadrupling the tax on buybacks. Here's how much the 3 giant US-based producers made in 2022,still open
Exxon Mobil Corp.,02/13/2023,QatarEnergy and ExxonMobil to independently market Golden Pass ...,still open
Exxon Mobil Corp.,02/13/2023,ExxonMobil statement regarding President Biden Letter to Oil Industry,still open
Exxon Mobil Corp.,02/13/2023,11 Most Undervalued Blue Chip Stocks To Buy According To Hedge Funds,still open
Exxon Mobil Corp.,02/13/2023,Should You Buy Exxon Mobil Corp (XOM) Stock Friday Morning?,still open
Exxon Mobil Corp.,02/13/2023,"Exxon Mobil Corp. stock rises Friday, outperforms market",still open
Exxon Mobil Corp.,02/13/2023,Exxon Mobil Co. (NYSE:XOM) Receives Consensus ...,still open
Exxon Mobil Corp.,02/13/2023,Do Analysts Agree Tuesday on Exxon Mobil Corp (XOM) Stock's Target Price?,still open
Exxon Mobil Corp.,02/13/2023,Is Exxon Mobil Corp (XOM) Stock Worth a Buy Friday?,still open
Exxon Mobil Corp.,02/13/2023,"Exxon Mobil Corp. stock falls Tuesday, still outperforms market",still open
Exxon Mobil Corp.,02/13/2023,"Exxon Mobil Corp. stock falls Wednesday, underperforms market",still open
Exxon Mobil Corp.,02/13/2023,Should You Sell Exxon Mobil Corp (XOM) Stock Thursday?,still open
Exxon Mobil Corp.,02/13/2023,Why ExxonMobil Stock Topped the Market on Thursday,still open
Exxon Mobil Corp.,02/13/2023,Exxon smashes Western oil majors' profits with $56 billion in 2022,still open
Exxon Mobil Corp.,02/13/2023,Udine Wealth Management Inc. invests $1.38 million in Exxon Mobil ...,still open
Exxon Mobil Corp.,02/13/2023,"Exxon Mobil Corp. stock falls Monday, underperforms market",still open
Exxon Mobil Corp.,02/13/2023,"Exxon Is Not Letting Dividend Investors Down, Despite the Lack of a ...",still open
Exxon Mobil Corp.,02/13/2023,"Marathon Oil Corp. stock rises Friday, outperforms market",still open
Exxon Mobil Corp.,02/13/2023,Valero Energy Corp. stock outperforms market on strong trading day,still open
Exxon Mobil Corp.,02/13/2023,"Hess Corp. stock rises Friday, outperforms market",still open
Exxon Mobil Corp.,02/13/2023,Exxon Mobil Stock Likely To Trade Lower Post Q4,still open
Exxon Mobil Corp.,02/13/2023,"Top Stock Reports for Exxon Mobil, Fomento Economico Mexicano & Prologis",still open
Exxon Mobil Corp.,02/13/2023,Validea's Top Ten Energy Stocks Based On Kenneth Fisher - 2/12 ...,still open
Exxon Mobil Corp.,02/13/2023,Validea's Top Ten Energy Stocks Based On Motley Fool - 2/12/2023,still open
Exxon Mobil Corp.,02/13/2023,"Zacks Market Edge Highlights: Pfizer, Exxon Mobil, Citigroup ...",still open
Exxon Mobil Corp.,02/13/2023,Camden Capital LLC Trims Stock Holdings in Exxon Mobil Co ...,still open
Exxon Mobil Corp.,02/13/2023,Exxon Reports FCCU-Related Issue at Baytown Oil Refinery in Texas,still open
Exxon Mobil Corp.,02/13/2023,Hot to Build a Lottery Winning Stock Portfolio,still open
Exxon Mobil Corp.,02/13/2023,"Exxon set to order 5th Guyana oil vessel, sizing up more blocks",still open
Exxon Mobil Corp.,02/13/2023,June 2025 Options Now Available For Exxon Mobil (XOM),still open
Exxon Mobil Corp.,02/13/2023,US STOCKS-Wall St gains over 1% after encouraging inflation data with Fed next,still open
Exxon Mobil Corp.,02/13/2023,FY2023 EPS Estimates for Exxon Mobil Co. (NYSE:XOM) Cut by ...,still open
Exxon Mobil Corp.,02/13/2023,"BUZZ-U.S. STOCKS ON THE MOVE-Fat Brands, Spotify, Uber Tech",still open
Exxon Mobil Corp.,02/13/2023,"Big Oil hits $221 billion profit record, Biden says 'it's outrageous'",still open
Exxon Mobil Corp.,02/13/2023,"Exxon Scientists Predicted Global Warming, Even as Company Cast Doubts, Study Finds",still open
Exxon Mobil Corp.,02/13/2023,Validea Motley Fool Strategy Daily Upgrade Report - 2/7/2023,still open
Exxon Mobil Corp.,02/13/2023,Hess Corp. stock outperforms market on strong trading day,still open
Exxon Mobil Corp.,02/13/2023,"Biden Targets Meta, Exxon, Others For Enriching Wall Street Using A Special Tactic - Meta Platforms (NASD",still open
Exxon Mobil Corp.,02/13/2023,Occidental’s CEO Says Stock Buybacks Take Priority Over Oil Growth,still open
Exxon Mobil Corp.,02/13/2023,Amazon Is a Value Stock in Topsy-Turvy New World of Investing,still open
Exxon Mobil Corp.,02/13/2023,Big Oil Faces Headwinds After Record $199 Billion Profit Haul,still open
Exxon Mobil Corp.,02/13/2023,‘Scared the Hell Out of Me’: NYSE’s Wild Start Rattles Traders,still open
Exxon Mobil Corp.,02/13/2023,"Exxon Mobil Corp. stock rises Tuesday, outperforms market",still open
Exxon Mobil Corp.,02/13/2023,BP PLC ADR underperforms Friday when compared to competitors despite daily gains,still open
Exxon Mobil Corp.,02/13/2023,"Exxon Mobil Corp. stock rises Monday, outperforms market",still open
Exxon Mobil Corp.,02/13/2023,"Wednesday’s Top Analyst Upgrades and Downgrades: BP, Exxon Mobil, Kroger, Microsoft, RingCentral, Wayfair, Wendy’s and More",still open
Exxon Mobil Corp.,02/13/2023,Where Will Exxon Mobil Corp (XOM) Stock Go Next After It Is Down 1.29% in a Week?,still open
Exxon Mobil Corp.,02/13/2023,Top 5 4th Quarter Trades of PIONEER TRUST BANK NA/OR,still open
Exxon Mobil Corp.,02/13/2023,Is WisdomTree U.S. LargeCap Dividend ETF (DLN) a Strong ETF ...,still open
Exxon Mobil Corp.,02/13/2023,Why ExxonMobil Stock Popped on Monday,still open
Exxon Mobil Corp.,02/13/2023,Chevron Falls After Posting Disappointing Quarterly Result,still open
Exxon Mobil Corp.,02/13/2023,Is Exxon Mobil Corp (XOM) Stock a Good Value Thursday?,still open
Exxon Mobil Corp.,02/13/2023,"Exxon Mobil Corp. stock falls Friday, underperforms market",still open
Exxon Mobil Corp.,02/13/2023,"Stock Market News: Nasdaq's best January in 22 years, PayPal ...",still open
Exxon Mobil Corp.,02/13/2023,Is Exxon Mobil Corp (XOM) Stock at the Top of the Oil & Gas Integrated Industry?,still open
Exxon Mobil Corp.,02/13/2023,Exxon Mobil Corp. stock outperforms market on strong trading day,still open
Exxon Mobil Corp.,02/13/2023,Why ExxonMobil Stock Is Rising Today,still open
Exxon Mobil Corp.,02/13/2023,Exxon Mobil (NYSE:XOM) Stock Price Hits New Record High,still open
Exxon Mobil Corp.,02/13/2023,"Exxon plans to raise spending in 2023, boost share buybacks",still open
Exxon Mobil Corp.,02/13/2023,Is Exxon Mobil Corp (XOM) a Bad Choice in Oil & Gas Integrated Thursday?,still open
Exxon Mobil Corp.,02/13/2023,Exxon (XOM) Stock Hits Record High as Energy Sector Outperforms ...,still open
Exxon Mobil Corp.,02/13/2023,Chevron weighs extending CEO Mike Wirth past mandatory retirement age,still open
Exxon Mobil Corp.,02/13/2023,"The Zacks Analyst Blog Highlights Exxon Mobil, Coca-Cola, Thermo Fisher Scientific, The Progressive, and Dominion Energy",still open
Exxon Mobil Corp.,02/13/2023,Why ExxonMobil Stock Jumped 27% in October,still open
Exxon Mobil Corp.,02/13/2023,"The Zacks Analyst Blog Highlights Exxon Mobil, T-Mobile US, Intuitive Surgical, Texas Instruments and Infosys",still open
Exxon Mobil Corp.,02/13/2023,"Exxon Mobil Corp. stock rises Tuesday, still underperforms market",still open
Exxon Mobil Corp.,02/13/2023,Exxon Mobil Stock: Nowhere To Go But Down (NYSE:XOM),still open
Exxon Mobil Corp.,02/13/2023,Exxon Profit (NYSE:XOM) Soars to All-Time High as Energy Markets ...,still open
Exxon Mobil Corp.,02/13/2023,"Exxon Mobil Corp. stock rises Monday, still underperforms market",still open
Exxon Mobil Corp.,02/13/2023,Is ExxonMobil a Buy?,still open
Exxon Mobil Corp.,02/13/2023,"Why ExxonMobil, Occidental Petroleum, and Phillips 66 Stocks Just ...",still open
Exxon Mobil Corp.,02/13/2023,"Fair Or Not, Big Oil Has To Deal With Public Opinion",still open
Exxon Mobil Corp.,02/13/2023,"Top Stock Reports for Berkshire Hathaway, Exxon Mobil & Walmart",still open
Exxon Mobil Corp.,02/13/2023,ExxonMobil announces third-quarter 2022 results,still open
Exxon Mobil Corp.,02/13/2023,"North American Morning Briefing : Payrolls Shocker, China Spat to Weigh on Stocks",still open
Exxon Mobil Corp.,02/13/2023,U.S. oil & gas rig count falls by the most in a week since June 2020 - Baker Hughes,still open
Exxon Mobil Corp.,02/13/2023,Activist investor ValueAct takes stake in Spotify,still open
Exxon Mobil Corp.,02/13/2023,"Exxon, Chevron to spend billions more on oil projects next year",still open
Exxon Mobil Corp.,02/13/2023,Exxon Mobil Stock: A Must Have For Dividend Income Investors ...,still open
Exxon Mobil Corp.,02/13/2023,Markets Today: Stock Indexes Slide as Bond Yields Climb on ...,still open
Exxon Mobil Corp.,02/13/2023,Better Oil Stock: Exxon vs Chevron,still open
Exxon Mobil Corp.,02/13/2023,"Why Oil Stocks ExxonMobil, Phillips 66, and Marathon Oil Were ...",still open
Exxon Mobil Corp.,02/13/2023,XOM Stock Price Prediction: Know about this Deliberate Selling ...,still open
Exxon Mobil Corp.,02/13/2023,Exxon Mobil Stock: Game Over (NYSE:XOM),still open
Exxon Mobil Corp.,02/13/2023,Exxon Mobil Corp. (XOM) Q3 2022 Earnings Call Transcript,still open
Exxon Mobil Corp.,02/13/2023,"Top Stock Reports for Exxon Mobil, Meta Platforms & Eaton",still open
Exxon Mobil Corp.,02/13/2023,Exxon signals strong Q3 earnings on natural gas pricing,still open
Exxon Mobil Corp.,02/13/2023,"The Zacks Analyst Blog Highlights Exxon Mobil, Merck & Co, Chevron, American Electric Power and The Southern",still open
Exxon Mobil Corp.,02/13/2023,The Global Fallout Of The Fed's Decision,still open
Exxon Mobil Corp.,02/13/2023,"Exxon Stock, a Dividend Aristocrat, Hikes Payout for 40 Straight Years",still open
Exxon Mobil Corp.,02/13/2023,Better Buy: ExxonMobil or Chevron?,still open
Exxon Mobil Corp.,02/13/2023,Exxon faces $2 billion loss on sale of troubled California oil properties,still open
Exxon Mobil Corp.,02/13/2023,"Exxon Mobil to Sell Thai Refinery, Retail Unit to Bangchak Corp",still open
Exxon Mobil Corp.,02/13/2023,Exxon sues EU in move to block new windfall tax on oil companies,still open
Exxon Mobil Corp.,02/13/2023,"Exxon completes sale of Chad, Cameroon operations for $407 million",still open
Exxon Mobil Corp.,02/13/2023,"Exxon Mobil makes a big comeback, surpassing Tesla in market value",still open
Exxon Mobil Corp.,02/13/2023,Stocks Settle Mixed On Strength In Energy Stocks And Weakness In ...,still open
Exxon Mobil Corp.,02/13/2023,"Big Tech Loses Sway as S&P 500 Becomes More Exxon, Less ...",still open
Exxon Mobil Corp.,02/13/2023,"Exxon Rebuts Biden's Attack on Profits, Citing Dividend Payout",still open
Exxon Mobil Corp.,02/13/2023,"Exxon (XOM), Chevron (CVX) Ramp Up Stock Buybacks as Energy ...",still open
Exxon Mobil Corp.,02/13/2023,Is Exxon Stock a Buy?,still open
Exxon Mobil Corp.,02/13/2023,Better Dividend Stock: ExxonMobil vs. Chevron,still open
Exxon Mobil Corp.,02/15/2023,Exxon Gives Up on Much-Hyped Algae Biofuels,still open
Exxon Mobil Corp.,02/15/2023,Time To Buy XOM Stock Amid Exxon Moves?,still open
Exxon Mobil Corp.,02/15/2023,Guyana to complete new oil contract model by Q2 as auction looms,still open
Exxon Mobil Corp.,02/15/2023,Exxon Mobil Stock: Outperformance Not Likely To Last (NYSE:XOM),still open
Exxon Mobil Corp.,02/15/2023,Exxon to merge some business units as part of cost-cutting plan,still open
Exxon Mobil Corp.,02/15/2023,ExxonMobil posts record $56bn profit,still open
Exxon Mobil Corp.,02/15/2023,Exclusive: Exxon prepares to start up $2 bln Texas oil refinery expansion,still open
Exxon Mobil Corp.,02/15/2023,White House blasts Exxon over historical $56 bln annual profit,still open
Exxon Mobil Corp.,02/15/2023,ExxonMobil boosts energy trading ambitions to compete against peers,still open
Exxon Mobil Corp.,02/15/2023,Assessing ExxonMobil's global warming projections,still open
Exxon Mobil Corp.,02/15/2023,Should You Buy Exxon Mobil Corp (XOM) Stock on Tuesday?,still open
Exxon Mobil Corp.,02/15/2023,"Exxon Mobil Corp. stock falls Tuesday, underperforms market",still open
Exxon Mobil Corp.,02/15/2023,Exxon Mobil Corporation (NYSE:XOM) insiders sold US$3.0m worth of stock suggesting impending weakness.,still open
Exxon Mobil Corp.,02/15/2023,ExxonMobil announces full-year 2022 results,still open
Exxon Mobil Corp.,02/15/2023,Exxon Mobil Corp. Reported Earnings. Did it Beat Estimates?,still open
Exxon Mobil Corp.,02/15/2023,Exxon Mobil Is the Biggest Gainer in the Management Top 250,still open
Exxon Mobil Corp.,02/15/2023,Mexico Pacific to sell LNG from Sonora export plant to Exxon Mobil,still open
Exxon Mobil Corp.,02/15/2023,Exxon Mobil Corporation (XOM) is Attracting Investor Attention: Here is What You Should Know,still open
Exxon Mobil Corp.,02/15/2023,Is Exxon Mobil Corp (XOM) Stock Worth a Buy Friday?,still open
Exxon Mobil Corp.,02/15/2023,"Exxon Mobil Corp. stock falls Wednesday, underperforms market",still open
Exxon Mobil Corp.,02/15/2023,"Exxon Is Not Letting Dividend Investors Down, Despite the Lack of a ...",still open
Exxon Mobil Corp.,02/15/2023,Exclusive: Pilot Company trims energy trading unit following Buffett ...,still open
Exxon Mobil Corp.,02/15/2023,Exxon Walking Away From Algae Biofuel Projects in Climate Retreat ...,still open
Exxon Mobil Corp.,02/15/2023,Hess Corp. stock outperforms market on strong trading day,still open
Exxon Mobil Corp.,02/15/2023,Should You Sell Exxon Mobil Corp (XOM) Stock Thursday?,still open
Exxon Mobil Corp.,02/15/2023,Is Exxon Mobil Corp (XOM) Stock at the Top of the Oil & Gas Integrated Industry?,still open
Exxon Mobil Corp.,02/15/2023,"Exxon Mobil Corp. stock falls Monday, underperforms market",still open
Exxon Mobil Corp.,02/15/2023,Exxon Mobil sets large-scale hydrogen plant start-up for 2027,still open
Exxon Mobil Corp.,02/15/2023,"Valero Energy Corp. stock falls Tuesday, underperforms market",still open
Exxon Mobil Corp.,02/15/2023,Marathon Petroleum Corp. stock outperforms competitors on strong trading day,still open
Exxon Mobil Corp.,02/15/2023,"Exxon set to order 5th Guyana oil vessel, sizing up more blocks",still open
Exxon Mobil Corp.,02/15/2023,"Exxon Mobil Corp. stock falls Tuesday, still outperforms market",still open
Exxon Mobil Corp.,02/15/2023,Udine Wealth Management Inc. invests $1.38 million in Exxon Mobil ...,still open
Exxon Mobil Corp.,02/15/2023,"Exxon Mobil Corp. Q4 Profit Increases, beats estimates",still open
Exxon Mobil Corp.,02/15/2023,BP PLC ADR outperforms competitors on strong trading day,still open
Exxon Mobil Corp.,02/15/2023,"The Zacks Analyst Blog Highlights Exxon Mobil, Fomento Economico Mexicano, Prologis, Marsh & McLennan and Becton Dickinson",still open
Exxon Mobil Corp.,02/15/2023,"Eastman Chemical Co. stock falls Tuesday, underperforms market",still open
Exxon Mobil Corp.,02/15/2023,"Exclusive: Exxon halts routine gas flaring in the Permian, wants ...",still open
Exxon Mobil Corp.,02/15/2023,"Zacks Market Edge Highlights: Pfizer, Exxon Mobil, Citigroup ...",still open
Exxon Mobil Corp.,02/15/2023,MicroSectors™ Launches Energy Long & Short Exchange Traded ...,still open
Exxon Mobil Corp.,02/15/2023,An In-Depth Look At Exxon Mobil's Revenue And Its Determining ...,still open
Exxon Mobil Corp.,02/15/2023,Global Medical Polymer Market Size To Grow USD 37.39 Billion By 2030 | CAGR of 8.2%,still open
Exxon Mobil Corp.,02/15/2023,"Exxon Mobil, Pfizer, McDonald's earnings: 3 things to watch",still open
Exxon Mobil Corp.,02/15/2023,"Indian energy company ONGC Videsh eyes oil, gas 'hot spots' in ...",still open
Exxon Mobil Corp.,02/15/2023,Exxon's scientists accurately predicted global warming projections ...,still open
Exxon Mobil Corp.,02/15/2023,Verra Appoints Judith Simon As A New President,still open
Exxon Mobil Corp.,02/15/2023,"Automotive engine oil market to grow at a CAGR of 3.7%: Highlights on COVID-19 analysis, recovery, and latest trends - Technavio",still open
Exxon Mobil Corp.,02/15/2023,"NuMat Technologies Announces Appointment of Dr. Jeffrey M. Dysard, as Executive Vice President and Chief Technology Officer",still open
Exxon Mobil Corp.,02/15/2023,Oil Majors Flush With Cash Have Changed Their Spending Priorities,still open
Exxon Mobil Corp.,02/15/2023,Exxon tells U.S. labor board refinery lockout did not target union,still open
Exxon Mobil Corp.,02/15/2023,Senate poised to revive probe of Big Oil climate claims,still open
Exxon Mobil Corp.,02/15/2023,"RWWM, Inc. Buys 2, Sells 3 in 4th Quarter",still open
Exxon Mobil Corp.,02/15/2023,Russian oil production unexpectedly rebounded in 2022 despite ...,still open
Exxon Mobil Corp.,02/15/2023,Validea's Top Ten Energy Stocks Based On Kenneth Fisher - 2/12 ...,still open
Exxon Mobil Corp.,02/15/2023,PARUS FINANCE (UK) Ltd Goes on,still open
Exxon Mobil Corp.,02/15/2023,Exxon Mobil Stock Likely To Trade Lower Post Q4,still open
Exxon Mobil Corp.,02/15/2023,Exxon Mobil Corporation (NYSE:XOM) Vice President Darrin L ...,still open
Exxon Mobil Corp.,02/15/2023,"Operations normal at Exxon Beaumont, Texas complex after storms ...",still open
Exxon Mobil Corp.,02/15/2023,Exxon weighs widening Guyana exploration effort - report (NYSE ...,still open
Exxon Mobil Corp.,02/15/2023,How to Build a Lottery Winning Stock Portfolio,still open
Exxon Mobil Corp.,02/15/2023,The Oil Giants' Bet On The Super Cycle: Exxon Mobil And BP (NYSE ...,still open
Exxon Mobil Corp.,02/15/2023,"Plastic additives market size to grow by USD 19.86 bn, Modifier to ...",still open
Exxon Mobil Corp.,02/15/2023,"Biden Targets Meta, Exxon, Others For Enriching Wall Street Using A Special Tactic - Meta Platforms (NASD",still open
Exxon Mobil Corp.,02/15/2023,"After Record Year for Big Oil, Senator Markey Joins Senator ...",still open
Exxon Mobil Corp.,02/15/2023,Hybrid Organic Acid Antifreeze Market is Booming Worldwide ...,still open
Exxon Mobil Corp.,02/15/2023,12 Most Profitable Oil Stocks in the World,still open
Exxon Mobil Corp.,02/15/2023,ExxonMobil (XOM) Set to Begin Beaumont Oil Refinery Expansion,still open
Exxon Mobil Corp.,02/15/2023,10 Companies Likely to be Dividend Kings in the Future,still open
Exxon Mobil Corp.,02/15/2023,Hess Corporation: Bring On That Cash Flow (NYSE:HES),still open
Exxon Mobil Corp.,02/15/2023,"Prudent Investors Network Inc. owns $827,000 shares of Exxon ...",still open
Exxon Mobil Corp.,02/15/2023,"Biolubricants Market Trends Analysis and Precise Outlook by 2030 | Exxon Mobil Corporation, Royal Dutch Shell",still open
Exxon Mobil Corp.,02/15/2023,Base Oil Market 2022-2030 Worldwide Major Growth by Key Players ...,still open
Exxon Mobil Corp.,02/15/2023,12 Cheap Energy Stocks To Buy,still open
Exxon Mobil Corp.,02/15/2023,"Jet Fuel Market Insights by Industry Demand, New Opportunities ...",still open
Exxon Mobil Corp.,02/15/2023,"Daily Brief United States: Berkshire Hathaway Inc Cl B, Lululemon ...",still open
Exxon Mobil Corp.,02/15/2023,25 Most Expensive Countries in Europe,still open
Exxon Mobil Corp.,02/15/2023,Metal Processing Lubricant Market is Expected to Reach US$ 43.33 ...,still open
Exxon Mobil Corp.,02/15/2023,"Best Stocks To buy Now: February 11, 2023",still open
Exxon Mobil Corp.,02/15/2023,News,still open
Exxon Mobil Corp.,02/15/2023,Electric Vehicle Fluids and Lubricants Market Size [2023-2029 ...,still open
Exxon Mobil Corp.,02/15/2023,ExxonMobil announces corporate plan — Company expects to ...,still open
Exxon Mobil Corp.,02/15/2023,Top 5 4th Quarter Trades of AMALGAMATED BANK,still open
Exxon Mobil Corp.,02/15/2023,Public funding for political campaigns will keep government working ...,still open
Exxon Mobil Corp.,02/15/2023,"Indian, European oil firms evaluating bids for Guyana blocks",still open
Exxon Mobil Corp.,02/15/2023,Hydrogenated Mineral Turpentine Market Is Thriving Worldwide ...,still open
Exxon Mobil Corp.,02/15/2023,ExxonMobil announces third-quarter 2022 results,still open
