Name,Data,News,Evaluation
Microsoft,02/12/2023,History Says the Nasdaq Could Soar in 2023 -- 5 Stocks You'll Wish ...,still open
Microsoft,02/12/2023,"Video Game Stocks Hit Reset Button, Face Iffy 2023",still open
Microsoft,02/12/2023,"Trump lost out on MILLIONS after sharing Apple and Microsoft stocks too early, documents show",still open
Microsoft,02/12/2023,Why Baidu Shares Are Trading Higher Premarket Today,still open
Microsoft,02/12/2023,Why Microsoft Stock Dropped Today,still open
Microsoft,02/12/2023,Why Microsoft Stock Slumped 5% Today,still open
Microsoft,02/12/2023,"Microsoft Stock: Buy, Sell, or Hold in 2023?",still open
Microsoft,02/12/2023,Is Microsoft Stock Price Ready For Takeoff (Technical Analysis ...,still open
Microsoft,02/12/2023,Why Microsoft Stock Was Down on Monday,still open
Microsoft,02/12/2023,Can Microsoft Win the Race to Dominate Artificial Intelligence?,still open
Microsoft,02/12/2023,Why Microsoft Stock Was Climbing Today,still open
Microsoft,02/12/2023,Is Microsoft Stock a Buy Right Now?,still open
Microsoft,02/12/2023,Stock Market Sell-Off: Is Microsoft Stock a Buy?,still open
Microsoft,02/12/2023,The AI Land Grab Has Started,still open
Microsoft,02/12/2023,I'm Microsoft's former VP of HR. Here are the 3 types of employees most at risk during layoffs — and the 2 that are safest.,still open
Microsoft,02/12/2023,Why Microsoft Stock Popped on Wednesday,still open
Microsoft,02/12/2023,This Hasn't Happened to Microsoft's Stock Since 2012,still open
Microsoft,02/12/2023,"Down 30%, Is Microsoft Stock a Buy Now?",still open
Microsoft,02/12/2023,"Why Microsoft Stock Popped, Then Dropped, on Wednesday",still open
Microsoft,02/12/2023,Why Microsoft Stock Lagged the Market Today,still open
Microsoft,02/12/2023,Why Microsoft Is Down 29% This Year,still open
Microsoft,02/12/2023,Could Microsoft Stock Help You Retire A Millionaire?,still open
Microsoft,02/12/2023,Is Microsoft Stock a Buy?,still open
Microsoft,02/12/2023,Why Microsoft Stock Jumped Today,still open
Microsoft,02/12/2023,Buzzy A.I. tools like Microsoft-backed ChatGPT replaced crypto as the hot tech topic of Davos,still open
Microsoft,02/12/2023,"Down 25%, Is Microsoft Stock a Buy?",still open
Microsoft,02/13/2023,"I wanted to try the new Bing with ChatGPT. Then, Microsoft went all Microsoft",still open
Microsoft,02/13/2023,The Week in Business: Microsoft’s Big Bet on A.I.,still open
Microsoft,02/13/2023,"Microsoft to demo its new ChatGPT-like AI in Word, PowerPoint, and Outlook soon",still open
Microsoft,02/13/2023,Microsoft is issuing an update to permanently kill Internet Explorer 11 tomorrow,still open
Microsoft,02/13/2023,Microsoft and Activision Bizarrely Demand PlayStation Leadership’s Performance Reviews,still open
Microsoft,02/13/2023,Microsoft announces another round of layoffs impacting Washington workers,still open
Microsoft,02/13/2023,Microsoft switches Edge’s PDF reader to pay-to-play Adobe Acrobat,still open
Microsoft,02/13/2023,"Microsoft and ChatGPT Won't Be Google Killers. Here's the 1 Company That Could Be, Though.",still open
Microsoft,02/13/2023,ANSYS (ANSS) to Develop New Offering Via Microsoft Azure,still open
Microsoft,02/13/2023,Microsoft Reportedly Shutting Down Industrial Metaverse Focused Group – Metaverse Bitcoin News,still open
Microsoft,02/13/2023,Microsoft cuts another 600 Seattle-area jobs as downsizing continues,still open
Microsoft,02/13/2023,Microsoft co-founder Bill Gates: ChatGPT 'will change our world',still open
Microsoft,02/13/2023,Microsoft's Big Game,still open
Microsoft,02/13/2023,"Sony Calls Microsoft's FTC Subpoena Demands ""Obvious ...",still open
Microsoft,02/13/2023,Kotick will reportedly remain as Activision CEO if Microsoft deal falls ...,still open
Microsoft,02/13/2023,Microsoft's End Goal Is Much Bigger Than Just Search,still open
Microsoft,02/13/2023,Microsoft To Activate On-Premises UUP for Windows 11 Cumulative ...,still open
Microsoft,02/13/2023,"Microsoft, McDonald's share gains lead Dow's 86-point jump",still open
Microsoft,02/13/2023,Join us at Microsoft Secure to innovate and grow,still open
Microsoft,02/13/2023,Disinformation Inc: Microsoft removes conservative sites from ...,still open
Microsoft,02/13/2023,"Tallan joins EY US, expanding cloud solution capabilities powered ...",still open
Microsoft,02/13/2023,Microsoft is secretly cooking up a major Windows 11 update – here's ...,still open
Microsoft,02/13/2023,Is Windows 11 Spyware? Microsoft Defends Sending User Data to ...,still open
Microsoft,02/13/2023,"Are Amazon, Google, And Microsoft Too Powerful In Cloud Banking?",still open
Microsoft,02/13/2023,Microsoft Admits Xbox Game Pass 'Cannibalizes' Game Sales,still open
Microsoft,02/13/2023,Adobe Acrobat will soon power Microsoft Edge's PDF reader,still open
Microsoft,02/13/2023,ANSYS (ANSS) to Develop New Offering Via Microsoft Azure,still open
Microsoft,02/13/2023,"As Microsoft And Google Battle Over AI, Some Partners Are Already ...",still open
Microsoft,02/13/2023,How Microsoft's new use of generative AI could make it cool again,still open
Microsoft,02/13/2023,How to Connect Analogue Devices to Microsoft Teams,still open
Microsoft,02/13/2023,Hacker Reveals Microsoft’s New AI-Powered Bing Chat Search Secrets,still open
Microsoft,02/13/2023,Do Traders Think Microsoft Corp (MSFT) Can Keep Climbing Monday?,still open
Microsoft,02/13/2023,Microsoft Surface Pro 9 review,still open
Microsoft,02/13/2023,Microsoft Teams Premium: Cut costs and add AI-powered productivity,still open
Microsoft,02/13/2023,Google and Microsoft's AI search war will add to carbon emissions,still open
Microsoft,02/13/2023,Microsoft WinGet package manager failing from expired SSL certificate,still open
Microsoft,02/13/2023,Reimagine personalized learning with new category of tools from ...,still open
Microsoft,02/13/2023,Microsoft Corporation (MSFT) Is a Trending Stock: Facts to Know ...,still open
Microsoft,02/13/2023,"Amazon, Microsoft, Google Pressured by Chinese Cloud Rivals in ...",still open
Microsoft,02/13/2023,Microsoft is adding native RGB lighting controls to Windows 11,still open
Microsoft,02/13/2023,How Bruce Jackson Went from the “NYC Projects” to Microsoft ...,still open
Microsoft,02/13/2023,Amazon Vs. Microsoft Vs. Google: Cloud Earnings Faceoff,still open
Microsoft,02/13/2023,"Dow's 333-point climb highlighted by gains for Microsoft, Nike shares",still open
Microsoft,02/13/2023,Microsoft Edge: manage Sent Pages in the History,still open
Microsoft,02/13/2023,Microsoft Cloud strength drives second quarter results - Stories,still open
Microsoft,02/13/2023,Westbourne Investment Advisors Inc. Has $11.94 Million Stock ...,still open
Microsoft,02/13/2023,"Why passkeys from Apple, Google, Microsoft may soon replace your passwords",still open
Microsoft,02/13/2023,Microsoft Outlook Android app gets updated with new feature,still open
Microsoft,02/13/2023,Microsoft and OpenAI extend partnership - The Official Microsoft Blog,still open
Microsoft,02/13/2023,Windows 11: Microsoft Stops Auto-Enabling Possibly Disruptive ...,still open
Microsoft,02/13/2023,Massive Microsoft Outlook outage brings email to a halt,still open
Microsoft,02/13/2023,Google will split its AR division in half to battle Microsoft and Oculus,still open
Microsoft,02/13/2023,Microsoft boosts Viva Sales with new GPT seller experience ...,still open
Microsoft,02/13/2023,How To Set up a Retention Policy for Microsoft Teams Meetings,still open
Microsoft,02/13/2023,"Microsoft to Lay Off 10,000 Workers as It Looks to Trim Costs",still open
Microsoft,02/13/2023,Engineers Deserve Better Than Microsoft Excel for Design Controls,still open
Microsoft,02/13/2023,Widow of slain Microsoft exec Jared Bridegan faces accused killer for first time in court,still open
Microsoft,02/13/2023,Impact X-Venture Studio: Accelerating underrepresented startups,still open
Microsoft,02/13/2023,Meeting the AI moment: advancing the future through responsible AI ...,still open
Microsoft,02/13/2023,Bing is Microsoft's chance to win the search battle if Bing doesn't ...,still open
Microsoft,02/13/2023,Govenda Integrates with Microsoft 365 to Further Enhance Board ...,still open
Microsoft,02/13/2023,General availability of Azure OpenAI Service expands access to ...,still open
Microsoft,02/13/2023,Microsoft's stalled plans already impacting Grove Park's housing market,still open
Microsoft,02/13/2023,Subject: Focusing on our short- and long-term opportunity - The ...,still open
Microsoft,02/13/2023,"Who are Microsoft's rivals in the latest AI war? Aside from Google, it's ...",still open
Microsoft,02/13/2023,Microsoft Mesh: Creating connections at the World Economic Forum ...,still open
Microsoft,02/13/2023,Google Follows Microsoft in Unveiling AI Search Features,still open
Microsoft,02/13/2023,"The Hypocrisy Of Layoffs At Google, Microsoft, And PayPal",still open
Microsoft,02/13/2023,What Microsoft’s Recent Layoffs Mean For The Company And Investors,still open
Microsoft,02/13/2023,How to Use the Ruler in Microsoft Word,still open
Microsoft,02/13/2023,Microsoft 365 trial offer blocks access to Windows 10 desktops,still open
Microsoft,02/13/2023,Microsoft and Qcells announce strategic alliance to curb carbon ...,still open
Microsoft,02/13/2023,"IIT Kharagpur alumni who worked as researcher at Microsoft gets laid off, says confidence is hit",still open
Microsoft,02/13/2023,Microsoft Security’s chief strategy officer joining Apiiro as new CPO,still open
Microsoft,02/13/2023,Microsoft cloud outage hits users around the world,still open
Microsoft,02/13/2023,iCloud or Microsoft 365,still open
Microsoft,02/13/2023,What's New in Microsoft Teams | January 2023 - Microsoft ...,still open
Microsoft,02/13/2023,"Cloud leaders Amazon, Google and Microsoft show the once-booming market is cooling down",still open
Microsoft,02/13/2023,Endeavour Solutions Inc. merges with Purely CRM to jointly serve Microsoft Dynamics 365 customers coast-t,still open
Microsoft,02/13/2023,Microsoft Has Stopped Selling Windows 10 – Get Genuine Windows 10 For Just $7.35 At Keysoff!,still open
Microsoft,02/13/2023,Why Microsoft Stock Climbed Today,still open
Microsoft,02/13/2023,"After Microsoft Bing, ChatGPT coming to Opera browser's sidebar | Mint",still open
Microsoft,02/13/2023,"Young guns ditch Morgan Stanley, Microsoft, Canva and Atlassian",still open
Microsoft,02/13/2023,Microsoft Azure Load Testing is now generally available,still open
Microsoft,02/13/2023,Resolved: Microsoft Team is experiencing access issue for some ...,still open
Microsoft,02/13/2023,Microsoft Rejoins Apple in $2 Trillion Club as Rally Accelerates,still open
Microsoft,02/13/2023,"Microsoft Hit With Teams, Microsoft 365 Outage Issues",still open
Microsoft,02/13/2023,"Microsoft's reportedly showing a ""System requirements not met ...",still open
Microsoft,02/13/2023,Microsoft Slowdown? Partners Investing Despite ‘More Cost ...,still open
Microsoft,02/13/2023,Microsoft will stop selling Windows 10 licenses in a few days,still open
Microsoft,02/13/2023,Four Ways Leaders Can Empower People for How Work Gets Done,still open
Microsoft,02/13/2023,Microsoft is checking everyone's bags for unsupported Office installs,still open
Microsoft,02/13/2023,Attackers abuse Microsoft’s 'verified publisher' status to steal data,still open
Microsoft,02/13/2023,"OpenAI, Microsoft want court to toss lawsuit accusing them of ...",still open
Microsoft,02/13/2023,Microsoft Studio 343 Industries Undergoing Reorganization of Halo ...,still open
Microsoft,02/13/2023,"Remember Bing? With ChatGPT's Help, Microsoft Is Coming for ...",still open
Microsoft,02/13/2023,Microsoft set to face EU antitrust probe over video calls,still open
Microsoft,02/13/2023,Surface Pro 9 review: Microsoft’s best tablet – if you pick the right one,still open
Microsoft,02/13/2023,"Google, Microsoft, Amazon and other tech companies have laid off more than 70,000 employees in the last year",still open
Microsoft,02/13/2023,Sony's gaming chief met EU's Vestager on Microsoft's Activision deal ...,still open
Microsoft,02/13/2023,Microsoft stock up ahead of January CPI report on Wall Street comments,still open
Microsoft,02/13/2023,Buying the Dips in Microsoft Stock as AI Plans Come to Life,still open
Microsoft,02/13/2023,"Microsoft and ChatGPT Won't Be Google Killers. Here's the 1 Company That Could Be, Though.",still open
Microsoft,02/13/2023,"Microsoft, McDonald's share gains lead Dow's 86-point jump",still open
Microsoft,02/13/2023,Microsoft Corporation (MSFT) Is a Trending Stock: Facts to Know Before Betting on It,still open
Microsoft,02/13/2023,Best AI Stock to Buy: Alphabet Stock or Microsoft Stock,still open
Microsoft,02/13/2023,Microsoft AI search updates can help boost stock 16%: Jefferies,still open
Microsoft,02/13/2023,"Microsoft Stock Slides As UBS Cuts Rating, Flags Azure, Office 365 Weakness",still open
Microsoft,02/13/2023,Why Microsoft Stock Climbed Today,still open
Microsoft,02/13/2023,Why Microsoft Stock Popped Today,still open
Microsoft,02/13/2023,Microsoft Stock Upgraded On AI News Amid Fears Of AI Stock Bubble,still open
Microsoft,02/13/2023,Is It Time to Buy Microsoft Stock?,still open
Microsoft,02/13/2023,Is Microsoft Stock a Buy Now?,still open
Microsoft,02/13/2023,Microsoft stock up ahead of January CPI report on Wall Street comments,still open
Microsoft,02/13/2023,MSFT Stock Spotlight: 3 Reasons to Believe Microsoft Will Win the AI ...,still open
Microsoft,02/13/2023,Why Microsoft Stock Rallied Today,still open
Microsoft,02/13/2023,Alphabet vs Microsoft: AI kicks off a new battle over search,still open
Microsoft,02/13/2023,Top AI Stocks To Buy Now? 3 In Focus,still open
Microsoft,02/13/2023,Westbourne Investment Advisors Inc. Has $11.94 Million Stock ...,still open
Microsoft,02/13/2023,Why Microsoft Stock Crept Higher on Monday,still open
Microsoft,02/13/2023,Why Microsoft Stock Popped on Friday,still open
Microsoft,02/13/2023,2 Reasons to Buy Microsoft Stock In 2023,still open
Microsoft,02/13/2023,Here's How Much You Would Have Made Owning Microsoft Stock In The Last 15 Years - Microsoft (NASDAQ:MSFT),still open
Microsoft,02/13/2023,Microsoft Stock: Racing To Dominate AI (NASDAQ:MSFT),still open
Microsoft,02/13/2023,Alphabet or Microsoft? Analysts predict which stock will come out on ...,still open
Microsoft,02/13/2023,Microsoft Stock: Software Giant Discloses Layoffs,still open
Microsoft,02/13/2023,Like OpenAI/ChatGPT's Potential? Check Out Microsoft Stock ...,still open
Microsoft,02/13/2023,Best Growth Stock To Buy: Sofi Stock vs. Microsoft Stock,still open
Microsoft,02/13/2023,Microsoft market cap tops $2 trillion on Bing's ChatGPT-style revamp,still open
Microsoft,02/13/2023,A.I. hype lifts MSFT shares at the expense of GOOGL,still open
Microsoft,02/13/2023,"Why Apple, Microsoft, and Warner Bros. Discovery Stocks are No ...",still open
Microsoft,02/13/2023,History Suggests the Nasdaq Could Soar in 2023: 3 Trillion-Dollar ...,still open
Microsoft,02/13/2023,This Trillion-Dollar Growth Stock Just Beat Microsoft and Amazon in ...,still open
Microsoft,02/13/2023,"Stocks making the biggest moves midday: Microsoft, Moderna, Mobileye, Chegg and more",still open
Microsoft,02/13/2023,Microsoft stock en route to worst daily drop in weeks,still open
Microsoft,02/13/2023,"Dow's 333-point climb highlighted by gains for Microsoft, Nike shares",still open
Microsoft,02/13/2023,Why Apple stock is still a buy 'at current levels' despite AI mania: Analyst,still open
Microsoft,02/13/2023,Dow Jones Futures Rise With CPI Report On Deck; Caterpillar ...,still open
Microsoft,02/13/2023,Nasdaq closes slightly lower for a second day as earnings season rolls on,still open
Microsoft,02/13/2023,Nasdaq Bear Market: 1 Phenomenal Growth Stock to Buy Like ...,still open
Microsoft,02/13/2023,Microsoft's Future Growth Prospects (NASDAQ:MSFT),still open
Microsoft,02/13/2023,Stock market news live updates: Stocks finish mixed as investors evaluate deluge of earnings,still open
Microsoft,02/13/2023,"Trading Microsoft and Activision Blizzard Amid AI, Earnings, Buyout Effort",still open
Microsoft,02/13/2023,"If You Invested $1,000 In Microsoft Stock When Bill Gates Left As CEO, Here's How Much You'd Have Now - M",still open
Microsoft,02/13/2023,Microsoft Kicks Off Tech Earnings Set to Slump Most Since 2016,still open
Microsoft,02/13/2023,Jim Cramer's top 10 things to watch in the market Wednesday ...,still open
Microsoft,02/13/2023,8 Top Tech Stocks To Buy Now - How To Take Advantage Of The Market Dip,still open
Microsoft,02/13/2023,"Dow Jones Futures Fall, AI Arms Race Intensifies; Fortinet, Enphase ...",still open
Microsoft,02/13/2023,2 Growth Stocks Down More Than 30% to Buy Right Now,still open
Microsoft,02/13/2023,Warren Buffett's Secret Portfolio Owns 3 Brand-Name AI Stocks,still open
Microsoft,02/13/2023,"Stocks to Watch: Microsoft, Uber, Chipotle, Prudential, Disney, Bed ...",still open
Microsoft,02/13/2023,Ripple CTO Explains Difference Between Ethereum (ETH) and Microsoft (MSFT) Stock,still open
Microsoft,02/13/2023,Aaron Wealth Advisors LLC owns $52.90 million of Microsoft stock ...,still open
Microsoft,02/13/2023,Microsoft’s (NASDAQ:MSFT) Activision Deal to Hit Another Roadblock,still open
Microsoft,02/13/2023,Microsoft Stock Jumps Ahead of AI Media Event With ChatGPT ...,still open
Microsoft,02/13/2023,Dow Jones Futures Rise; 10 Big Earnings On Tap For Market Rally ...,still open
Microsoft,02/13/2023,A Bull Market Is Coming: 2 Top Growth Stocks to Buy in 2023 and ...,still open
Microsoft,02/13/2023,Microsoft shares workaround for unresponsive Windows Start Menu,still open
Microsoft,02/13/2023,Microsoft shares jump on cloud growth,still open
Microsoft,02/13/2023,Will Datadog Be Worth More Than Microsoft by 2030?,still open
Microsoft,02/13/2023,Somerset Trust Co sells 419 Microsoft shares (NASDAQ:MSFT),still open
Microsoft,02/13/2023,CRWD Stock Initiated At Outperform Amid Microsoft Cybersecurity ...,still open
Microsoft,02/13/2023,"Earnings playbook: What investors can expect out of Tesla, Microsoft ...",still open
Microsoft,02/13/2023,Microsoft Shares State Legislative Priorities for 2023 | News ...,still open
Microsoft,02/13/2023,"Here are the layoff severance packages Google, Microsoft, Amazon and other tech giants have promised",still open
Microsoft,02/13/2023,'Black Swan' Author Says Argument That Bill Gates Could've Been A Trillionaire Had He Held On To His Micr,still open
Microsoft,02/13/2023,"S&P 500 posts worst day in more than a month, Dow closes 600 points lower",still open
Microsoft,02/13/2023,History Says the Nasdaq Could Soar in 2023 -- 5 Stocks You'll Wish ...,still open
Microsoft,02/13/2023,"Trump lost out on MILLIONS after sharing Apple and Microsoft stocks too early, documents show",still open
Microsoft,02/13/2023,"Video Game Stocks Hit Reset Button, Face Iffy 2023",still open
Microsoft,02/13/2023,Microsoft shares rally as it shrugs off tech turmoil,still open
Microsoft,02/13/2023,Why Microsoft Stock Slumped 5% Today,still open
Microsoft,02/13/2023,Why Microsoft Stock Dropped Today,still open
Microsoft,02/13/2023,"Microsoft Stock: Buy, Sell, or Hold in 2023?",still open
Microsoft,02/13/2023,Why Microsoft Stock Was Down on Monday,still open
Microsoft,02/13/2023,Is Microsoft Stock Price Ready For Takeoff (Technical Analysis ...,still open
Microsoft,02/13/2023,Why Microsoft Stock Popped on Wednesday,still open
Microsoft,02/13/2023,Why Microsoft Stock Was Climbing Today,still open
Microsoft,02/13/2023,Is Microsoft Stock a Buy Right Now?,still open
Microsoft,02/13/2023,Stock Market Sell-Off: Is Microsoft Stock a Buy?,still open
Microsoft,02/13/2023,Why Microsoft Stock Topped the Market Today,still open
Microsoft,02/13/2023,This Hasn't Happened to Microsoft's Stock Since 2012,still open
Microsoft,02/13/2023,"Down 30%, Is Microsoft Stock a Buy Now?",still open
Microsoft,02/13/2023,Why Microsoft Is Down 29% This Year,still open
Microsoft,02/13/2023,"Why Microsoft Stock Popped, Then Dropped, on Wednesday",still open
Microsoft,02/13/2023,Why Microsoft Stock Lagged the Market Today,still open
Microsoft,02/13/2023,Could Microsoft Stock Help You Retire A Millionaire?,still open
Microsoft,02/13/2023,Is Microsoft Stock a Buy?,still open
Microsoft,02/13/2023,Why Microsoft Stock Jumped Today,still open
Microsoft,02/13/2023,"Down 25%, Is Microsoft Stock a Buy?",still open
Microsoft,02/13/2023,Here’s When to Buy Microsoft Stock (Again),still open
Microsoft,02/13/2023,Microsoft Stock: A 'Buy On Weakness' Juggernaut (NASDAQ:MSFT),still open
Microsoft,02/13/2023,"I wanted to try the new Bing with ChatGPT. Then, Microsoft went all Microsoft",still open
Microsoft,02/13/2023,The Week in Business: Microsoft’s Big Bet on A.I.,still open
Microsoft,02/13/2023,"Microsoft to demo its new ChatGPT-like AI in Word, PowerPoint, and Outlook soon",still open
Microsoft,02/13/2023,Microsoft is issuing an update to permanently kill Internet Explorer 11 tomorrow,still open
Microsoft,02/13/2023,Microsoft and Activision Bizarrely Demand PlayStation Leadership’s Performance Reviews,still open
Microsoft,02/13/2023,Microsoft announces another round of layoffs impacting Washington workers,still open
Microsoft,02/13/2023,Microsoft switches Edge’s PDF reader to pay-to-play Adobe Acrobat,still open
Microsoft,02/13/2023,"Microsoft and ChatGPT Won't Be Google Killers. Here's the 1 Company That Could Be, Though.",still open
Microsoft,02/13/2023,ANSYS (ANSS) to Develop New Offering Via Microsoft Azure,still open
Microsoft,02/13/2023,Microsoft Reportedly Shutting Down Industrial Metaverse Focused Group – Metaverse Bitcoin News,still open
Microsoft,02/13/2023,Microsoft cuts another 600 Seattle-area jobs as downsizing continues,still open
Microsoft,02/13/2023,Microsoft co-founder Bill Gates: ChatGPT 'will change our world',still open
Microsoft,02/13/2023,Microsoft's Big Game,still open
Microsoft,02/13/2023,"Sony Calls Microsoft's FTC Subpoena Demands ""Obvious ...",still open
Microsoft,02/13/2023,Kotick will reportedly remain as Activision CEO if Microsoft deal falls ...,still open
Microsoft,02/13/2023,Microsoft's End Goal Is Much Bigger Than Just Search,still open
Microsoft,02/13/2023,Microsoft To Activate On-Premises UUP for Windows 11 Cumulative ...,still open
Microsoft,02/13/2023,"Microsoft, McDonald's share gains lead Dow's 86-point jump",still open
Microsoft,02/13/2023,Join us at Microsoft Secure to innovate and grow,still open
Microsoft,02/13/2023,Disinformation Inc: Microsoft removes conservative sites from ...,still open
Microsoft,02/13/2023,"Tallan joins EY US, expanding cloud solution capabilities powered ...",still open
Microsoft,02/13/2023,Microsoft is secretly cooking up a major Windows 11 update – here's ...,still open
Microsoft,02/13/2023,Is Windows 11 Spyware? Microsoft Defends Sending User Data to ...,still open
Microsoft,02/13/2023,"Are Amazon, Google, And Microsoft Too Powerful In Cloud Banking?",still open
Microsoft,02/13/2023,Microsoft Admits Xbox Game Pass 'Cannibalizes' Game Sales,still open
Microsoft,02/13/2023,Adobe Acrobat will soon power Microsoft Edge's PDF reader,still open
Microsoft,02/13/2023,ANSYS (ANSS) to Develop New Offering Via Microsoft Azure,still open
Microsoft,02/13/2023,"As Microsoft And Google Battle Over AI, Some Partners Are Already ...",still open
Microsoft,02/13/2023,How Microsoft's new use of generative AI could make it cool again,still open
Microsoft,02/13/2023,How to Connect Analogue Devices to Microsoft Teams,still open
Microsoft,02/13/2023,Hacker Reveals Microsoft’s New AI-Powered Bing Chat Search Secrets,still open
Microsoft,02/13/2023,Do Traders Think Microsoft Corp (MSFT) Can Keep Climbing Monday?,still open
Microsoft,02/13/2023,Microsoft Surface Pro 9 review,still open
Microsoft,02/13/2023,Microsoft Teams Premium: Cut costs and add AI-powered productivity,still open
Microsoft,02/13/2023,Google and Microsoft's AI search war will add to carbon emissions,still open
Microsoft,02/13/2023,Microsoft WinGet package manager failing from expired SSL certificate,still open
Microsoft,02/13/2023,Reimagine personalized learning with new category of tools from ...,still open
Microsoft,02/13/2023,Microsoft Corporation (MSFT) Is a Trending Stock: Facts to Know ...,still open
Microsoft,02/13/2023,"Amazon, Microsoft, Google Pressured by Chinese Cloud Rivals in ...",still open
Microsoft,02/13/2023,Microsoft is adding native RGB lighting controls to Windows 11,still open
Microsoft,02/13/2023,How Bruce Jackson Went from the “NYC Projects” to Microsoft ...,still open
Microsoft,02/13/2023,Amazon Vs. Microsoft Vs. Google: Cloud Earnings Faceoff,still open
Microsoft,02/13/2023,"Dow's 333-point climb highlighted by gains for Microsoft, Nike shares",still open
Microsoft,02/13/2023,Microsoft Edge: manage Sent Pages in the History,still open
Microsoft,02/13/2023,Microsoft Cloud strength drives second quarter results - Stories,still open
Microsoft,02/13/2023,Westbourne Investment Advisors Inc. Has $11.94 Million Stock ...,still open
Microsoft,02/13/2023,"Why passkeys from Apple, Google, Microsoft may soon replace your passwords",still open
Microsoft,02/13/2023,Microsoft Outlook Android app gets updated with new feature,still open
Microsoft,02/13/2023,Microsoft and OpenAI extend partnership - The Official Microsoft Blog,still open
Microsoft,02/13/2023,Windows 11: Microsoft Stops Auto-Enabling Possibly Disruptive ...,still open
Microsoft,02/13/2023,Massive Microsoft Outlook outage brings email to a halt,still open
Microsoft,02/13/2023,Google will split its AR division in half to battle Microsoft and Oculus,still open
