Name,Data,News,Evaluation
Microsoft,02/10/2023,Best AI Stock to Buy: Alphabet Stock or Microsoft Stock,still open
Microsoft,02/10/2023,A.I. hype lifts MSFT shares at the expense of GOOGL,still open
Microsoft,02/10/2023,Google Bard AI vs. Microsoft ChatGPT-Which is the Better AI Stock to Buy?,still open
Microsoft,02/10/2023,Is It Time to Buy Microsoft Stock?,still open
Microsoft,02/10/2023,Microsoft Stock: 3 Things That Smart Investors Should Know ...,still open
Microsoft,02/10/2023,Microsoft vs. Google: Who Will Win the AI Battle?,still open
Microsoft,02/10/2023,Microsoft Stock: Racing To Dominate AI (NASDAQ:MSFT),still open
Microsoft,02/10/2023,Why Microsoft Stock Popped Today,still open
Microsoft,02/10/2023,Microsoft Stock: Racing To Dominate AI (NASDAQ:MSFT),still open
Microsoft,02/10/2023,Here's How Much You Would Have Made Owning Microsoft Stock In The Last 15 Years - Microsoft (NASDAQ:MSFT),still open
Microsoft,02/10/2023,Why Microsoft Stock Climbed Today,still open
Microsoft,02/10/2023,Bard AI Vs. Microsoft’s ChatGPT – Is Google’s Stock A Sell?,still open
Microsoft,02/10/2023,Is Microsoft Stock a Buy Now?,still open
Microsoft,02/10/2023,Why Microsoft Stock Rallied Today,still open
Microsoft,02/10/2023,Why Microsoft Stock Popped on Friday,still open
Microsoft,02/10/2023,Howard Wealth Management LLC Has $820000 Stock Holdings in ...,still open
Microsoft,02/10/2023,Where Will Microsoft Stock Be in 3 Years?,still open
Microsoft,02/10/2023,"Why Apple, Microsoft, and Warner Bros. Discovery Stocks are No ...",still open
Microsoft,02/10/2023,Why Microsoft Stock Crept Higher on Monday,still open
Microsoft,02/10/2023,Microsoft market cap tops $2 trillion on Bing's ChatGPT-style revamp,still open
Microsoft,02/10/2023,This Hasn't Happened to Microsoft's Stock Since 2012,still open
Microsoft,02/10/2023,Buying the Dips in Microsoft Stock as AI Plans Come to Life,still open
Microsoft,02/10/2023,This Trillion-Dollar Growth Stock Just Beat Microsoft and Amazon in ...,still open
Microsoft,02/10/2023,Microsoft Stock: Software Giant Discloses Layoffs | Investor's ...,still open
Microsoft,02/10/2023,"Microsoft Stock Remains a Core Name to Own in 2023, Says Wedbush",still open
Microsoft,02/10/2023,Like OpenAI/ChatGPT's Potential? Check Out Microsoft Stock ...,still open
Microsoft,02/10/2023,Alphabet or Microsoft? Analysts predict which stock will come out on ...,still open
Microsoft,02/10/2023,Microsoft (NASDAQ:MSFT) Could Be A Buy For Its Upcoming Dividend,still open
Microsoft,02/10/2023,Best Growth Stock To Buy: Sofi Stock vs. Microsoft Stock,still open
Microsoft,02/10/2023,Microsoft stock en route to worst daily drop in weeks,still open
Microsoft,02/10/2023,Better Buy: Amazon Stock vs. Microsoft Stock,still open
Microsoft,02/10/2023,Futures Fall As Shakeout Deepens; Tesla Doubles From Bear Low,still open
Microsoft,02/10/2023,Better Bear Market Buy: Meta Platforms vs. Microsoft,still open
Microsoft,02/10/2023,3 Must-Know Conversational AI Stocks,still open
Microsoft,02/10/2023,"Stocks to Watch: Microsoft, Uber, Chipotle, Prudential, Disney, Bed ...",still open
Microsoft,02/10/2023,Dow Jones Falls On Hot Inflation Survey Data; Lyft Crashes 35% On ...,still open
Microsoft,02/10/2023,"Trading Microsoft and Activision Blizzard Amid AI, Earnings, Buyout Effort",still open
Microsoft,02/10/2023,Activision Blizzard Stock: Strong Results And Microsoft Drama ...,still open
Microsoft,02/10/2023,Microsoft Stock on Pace for a Fifth Straight Daily Advance,still open
Microsoft,02/10/2023,"Dow Jones Futures Fall, AI Arms Race Intensifies; Fortinet, Enphase ...",still open
Microsoft,02/10/2023,Nasdaq closes slightly lower for a second day as earnings season rolls on,still open
Microsoft,02/10/2023,"Stocks making the biggest moves midday: Microsoft, Moderna, Mobileye, Chegg and more",still open
Microsoft,02/10/2023,Nasdaq Bear Market: 1 Phenomenal Growth Stock to Buy Like ...,still open
Microsoft,02/10/2023,Microsoft's Future Growth Prospects (NASDAQ:MSFT),still open
Microsoft,02/10/2023,Stock market news live updates: Stocks finish mixed as investors evaluate deluge of earnings,still open
Microsoft,02/10/2023,A Bull Market Is Coming: 2 Top Growth Stocks to Buy in 2023 and ...,still open
Microsoft,02/10/2023,"If You Like Amazon, Microsoft, and Alphabet, Consider Buying This ...",still open
Microsoft,02/10/2023,"If You Invested $1,000 In Microsoft Stock When Bill Gates Left As CEO, Here's How Much You'd Have Now - M",still open
Microsoft,02/10/2023,Microsoft Corp. stock outperforms competitors on strong trading day,still open
Microsoft,02/10/2023,Microsoft Kicks Off Tech Earnings Set to Slump Most Since 2016,still open
Microsoft,02/10/2023,"Dow climbs 250 points on gains in shares of Microsoft, Boeing",still open
Microsoft,02/10/2023,Jim Cramer's top 10 things to watch in the market Wednesday ...,still open
Microsoft,02/10/2023,8 Top Tech Stocks To Buy Now - How To Take Advantage Of The Market Dip,still open
Microsoft,02/10/2023,Microsoft Stock Jumps Ahead of AI Media Event With ChatGPT ...,still open
Microsoft,02/10/2023,2 Growth Stocks Down More Than 30% to Buy Right Now,still open
Microsoft,02/10/2023,"Microsoft Reportedly Cuts Jobs at HoloLens, Xbox, Surface Units",still open
Microsoft,02/10/2023,Microsoft’s (NASDAQ:MSFT) Activision Deal to Hit Another Roadblock,still open
Microsoft,02/10/2023,Dow Jones Futures Rise; 10 Big Earnings On Tap For Market Rally ...,still open
Microsoft,02/10/2023,"Microsoft shares 6 areas of focus for financial services industry, ET ...",still open
Microsoft,02/10/2023,Microsoft shares workaround for unresponsive Windows Start Menu,still open
Microsoft,02/10/2023,"Video Game Stocks Hit Reset Button, Face Iffy 2023",still open
Microsoft,02/10/2023,Will Datadog Be Worth More Than Microsoft by 2030?,still open
Microsoft,02/10/2023,Somerset Trust Co sells 419 Microsoft shares (NASDAQ:MSFT),still open
Microsoft,02/10/2023,Microsoft will need 'a crowbar to pry away' Google's advertising ...,still open
Microsoft,02/10/2023,"Earnings playbook: What investors can expect out of Tesla, Microsoft ...",still open
Microsoft,02/10/2023,"Here are the layoff severance packages Google, Microsoft, Amazon and other tech giants have promised",still open
Microsoft,02/10/2023,Wednesday's top tech news: Google showcases its own AI search ...,still open
Microsoft,02/10/2023,"S&P 500 posts worst day in more than a month, Dow closes 600 points lower",still open
Microsoft,02/10/2023,History Says the Nasdaq Could Soar in 2023 -- 5 Stocks You'll Wish ...,still open
Microsoft,02/10/2023,Where Will Nintendo Stock Be in 1 Year?,still open
Microsoft,02/10/2023,'Black Swan' Author Says Argument That Bill Gates Could've Been A Trillionaire Had He Held On To His Micr,still open
Microsoft,02/10/2023,Microsoft looked at buying Figma but declined to put in an offer as Adobe deal was nearing,still open
Microsoft,02/10/2023,"Trump lost out on MILLIONS after sharing Apple and Microsoft stocks too early, documents show",still open
Microsoft,02/10/2023,Why Baidu Shares Are Trading Higher Premarket Today,still open
Microsoft,02/10/2023,Why Microsoft Stock Dropped Today,still open
Microsoft,02/10/2023,Why Microsoft Stock Slumped 5% Today,still open
Microsoft,02/10/2023,"Microsoft Stock: Buy, Sell, or Hold in 2023?",still open
Microsoft,02/10/2023,Why Microsoft Stock Was Down on Monday,still open
Microsoft,02/10/2023,Is Microsoft Stock Price Ready For Takeoff (Technical Analysis ...,still open
Microsoft,02/10/2023,Why Microsoft Stock Was Climbing Today,still open
Microsoft,02/10/2023,Is Microsoft Stock a Buy Right Now?,still open
Microsoft,02/10/2023,Nasdaq's 2023 'Junk Rally' Flies in the Face of Risky Backdrop,still open
Microsoft,02/10/2023,Stock Market Sell-Off: Is Microsoft Stock a Buy?,still open
Microsoft,02/10/2023,"Spotify, Google, Microsoft, and more: 2023 tech layoffs are already piling up",still open
Microsoft,02/10/2023,Why Microsoft Stock Popped on Wednesday,still open
Microsoft,02/10/2023,"Down 30%, Is Microsoft Stock a Buy Now?",still open
Microsoft,02/10/2023,Why Microsoft Stock Lagged the Market Today,still open
Microsoft,02/10/2023,"Why Microsoft Stock Popped, Then Dropped, on Wednesday",still open
Microsoft,02/10/2023,Could Microsoft Stock Help You Retire A Millionaire?,still open
Microsoft,02/10/2023,"Microsoft to demo its new ChatGPT-like AI in Word, PowerPoint, and Outlook soon",still open
Microsoft,02/10/2023,Microsoft CEO Satya Nadella explains how Bing with AI is better than Google,still open
Microsoft,02/10/2023,A disastrous chatbot release in 2016 could help explain why Microsoft is trouncing Google in A.I. today,still open
Microsoft,02/10/2023,Microsoft co-founder Bill Gates: ChatGPT 'will change our world',still open
Microsoft,02/10/2023,Microsoft co-founder Bill Gates: ChatGPT 'will change our world',still open
Microsoft,02/10/2023,"Exclusive: Bill Gates On Advising OpenAI, Microsoft And Why AI Is 'The Hottest Topic Of 2023'",still open
Microsoft,02/10/2023,Microsoft announces another round of layoffs impacting Washington workers,still open
Microsoft,02/10/2023,Microsoft announces another round of layoffs in Washington,still open
Microsoft,02/10/2023,"Microsoft, GitLab and others latest to make job cuts",still open
Microsoft,02/10/2023,Microsoft to retire its Support Diagnostic Tool (MSDT) in 2025,still open
Microsoft,02/10/2023,Microsoft might have plans to get rid of all those RGB lighting apps on your PC,still open
Microsoft,02/10/2023,Microsoft Kills Its Industrial Metaverse Team After 4 Months,still open
Microsoft,02/10/2023,Microsoft Disbands Industrial Metaverse Project: Report,still open
Microsoft,02/10/2023,Microsoft Culls Metaverse Team It Created 4 Months Ago,still open
Microsoft,02/10/2023,"A.I. search could reap Microsoft $10 billion a year, analyst estimates",still open
Microsoft,02/10/2023,Amazon Vs. Microsoft Vs. Google: Cloud Earnings Faceoff,still open
Microsoft,02/10/2023,"MARTA: Bankhead expansion on track, despite halt on nearby Microsoft campus - Atlanta Business Chronicle",still open
Microsoft,02/10/2023,Join us at Microsoft Secure to innovate and grow,still open
Microsoft,02/10/2023,How Microsoft's new use of generative AI could make it cool again,still open
Microsoft,02/10/2023,Microsoft Teams Premium: Cut costs and add AI-powered productivity,still open
Microsoft,02/10/2023,Microsoft rolls out ChatGPT-powered Teams Premium,still open
Microsoft,02/10/2023,Microsoft Disbands Industrial Metaverse Project: Report,still open
Microsoft,02/10/2023,"Microsoft Has Plans to Shove Its Bing AI Into Word, PowerPoint, and ...",still open
Microsoft,02/10/2023,This Microsoft Office for Mac package turns your Mac into a cross ...,still open
Microsoft,02/10/2023,Reimagine personalized learning with new category of tools from ...,still open
Microsoft,02/10/2023,"Microsoft’s Activision Blizzard acquisition will harm UK gamers, says watchdog",still open
Microsoft,02/10/2023,The gathering AI storm between Microsoft and Google,still open
Microsoft,02/10/2023,Microsoft to Add New IT Policy to Enable Features on Windows 11,still open
Microsoft,02/10/2023,Microsoft Star Insight Enterprises Has $1.5B In M&A ‘Fuel’,still open
Microsoft,02/10/2023,"3 trends will shape the future of work, according to Microsoft's CEO",still open
Microsoft,02/10/2023,"Microsoft Announces New Generative AI Search Using ChatGPT; Bada BING, Bada Boom—The AI Race Is On",still open
Microsoft,02/10/2023,Microsoft Releases Edge 110 and Drops Support for Windows 7 and ...,still open
Microsoft,02/10/2023,Microsoft says Intel driver bug crashes apps on Windows PCs,still open
Microsoft,02/10/2023,Microsoft CEO Satya Nadella says he hopes Google is ready to compete when it comes to AI search: ‘I want people to know that we made them dance’,still open
Microsoft,02/10/2023,"Microsoft's new AI Bing taught my son ethnic slurs, and I'm horrified",still open
Microsoft,02/10/2023,Automate your attack response with Azure DDoS Protection solution ...,still open
Microsoft,02/10/2023,Outlook down: Microsoft experiences widespread outage,still open
Microsoft,02/10/2023,Microsoft Cloud strength drives second quarter results - Stories,still open
Microsoft,02/10/2023,Activision Blizzard Stock: Strong Results And Microsoft Drama ...,still open
Microsoft,02/10/2023,Microsoft Stock: Upside Potential But Shares May Be Choppy In The ...,still open
Microsoft,02/10/2023,Microsoft Already Developing Windows 11 Moment 4,still open
Microsoft,02/10/2023,Microsoft and OpenAI extend partnership - The Official Microsoft Blog,still open
Microsoft,02/10/2023,Microsoft boosts Viva Sales with new GPT seller experience ...,still open
Microsoft,02/10/2023,Microsoft-Activision Deal: Game's On! (NASDAQ:ATVI),still open
Microsoft,02/10/2023,"Xbox Game Pass ""Cannibalizes"" Game Sales Admits Microsoft in ...",still open
Microsoft,02/10/2023,Microsoft Teams Free data won’t transfer over to Microsoft Teams (free),still open
Microsoft,02/10/2023,"Tech Layoffs: Microsoft-owned GitHub to shed 10% employees, will close all offices",still open
Microsoft,02/10/2023,Meeting the AI moment: advancing the future through responsible AI ...,still open
Microsoft,02/10/2023,Microsoft Rejoins Apple in $2 Trillion Club as Rally Accelerates,still open
Microsoft,02/10/2023,"Microsoft to Lay Off 10,000 Workers as It Looks to Trim Costs",still open
Microsoft,02/10/2023,Microsoft 365 trial offer blocks access to Windows 10 desktops,still open
Microsoft,02/10/2023,Microsoft Edge is getting Adobe's freemium PDF viewer,still open
Microsoft,02/10/2023,General availability of Azure OpenAI Service expands access to ...,still open
Microsoft,02/10/2023,Microsoft's Adaptive Accessories are a tradeoff,still open
Microsoft,02/10/2023,Subject: Focusing on our short- and long-term opportunity - The ...,still open
Microsoft,02/10/2023,Microsoft Mesh: Creating connections at the World Economic Forum ...,still open
Microsoft,02/10/2023,What Microsoft’s Recent Layoffs Mean For The Company And Investors,still open
Microsoft,02/10/2023,"Cloud leaders Amazon, Google and Microsoft show the once-booming market is cooling down",still open
Microsoft,02/10/2023,Jim Cramer Thinks Microsoft's Latest Announcement Is a Major Problem for Google,still open
Microsoft,02/10/2023,"Chevron, Microsoft back Houston-based clean energy program for ...",still open
Microsoft,02/10/2023,Microsoft and Qcells announce strategic alliance to curb carbon ...,still open
Microsoft,02/10/2023,"Google announces new AI search features, as race with Microsoft heats up",still open
Microsoft,02/10/2023,Microsoft Bets Big on the Creator of ChatGPT in Race to Dominate A.I.,still open
Microsoft,02/10/2023,"All you need to know about ChatGPT, the A.I. chatbot that's got the world talking and tech giants clashing",still open
Microsoft,02/10/2023,Microsoft says services have recovered after widespread outage,still open
Microsoft,02/10/2023,What's New in Microsoft Teams | January 2023 - Microsoft ...,still open
Microsoft,02/10/2023,Dow Jones Falters; Microsoft Has Growing AI Waitlist,still open
Microsoft,02/10/2023,Microsoft Azure Load Testing is now generally available,still open
Microsoft,02/10/2023,"Stocks making the biggest moves premarket: Uber, Chipotle, Microsoft, Lumen and more",still open
Microsoft,02/10/2023,Microsoft halts work on 90-acre Westside Atlanta campus,still open
Microsoft,02/10/2023,Microsoft to cut 120 jobs in Ireland,still open
Microsoft,02/10/2023,Microsoft Authenticator drops support for Apple Watch,still open
Microsoft,02/10/2023,Resolved: Microsoft Team is experiencing access issue for some ...,still open
Microsoft,02/10/2023,Meet your goals in 2023 with Microsoft Viva Goals,still open
Microsoft,02/10/2023,"Microsoft Hit With Teams, Microsoft 365 Outage Issues",still open
Microsoft,02/10/2023,Four Ways Leaders Can Empower People for How Work Gets Done,still open
Microsoft,02/10/2023,"Alibaba Jumps ChatGPT Bandwagon After Microsoft, Google And Baidu",still open
Microsoft,02/10/2023,Microsoft will stop selling Windows 10 licenses in a few days,still open
Microsoft,02/10/2023,"Amid Layoffs, Microsoft Is Moving to Unlimited Time Off",still open
Microsoft,02/10/2023,Tech Mahindra and Microsoft join hands to bring cloud-powered 5G ...,still open
Microsoft,02/10/2023,Attackers abuse Microsoft’s 'verified publisher' status to steal data,still open
Microsoft,02/10/2023,"Monetary Policy, 1 Minute S&P Chart, Trading Lockheed, Microsoft ...",still open
Microsoft,02/10/2023,Microsoft is checking everyone's bags for unsupported Office installs,still open
Microsoft,02/10/2023,Microsoft Studio 343 Industries Undergoing Reorganization of Halo ...,still open
Microsoft,02/10/2023,"Remember Bing? With ChatGPT's Help, Microsoft Is Coming for Google Search",still open
Microsoft,02/10/2023,"OpenAI, Microsoft want court to toss lawsuit accusing them of ...",still open
Microsoft,02/10/2023,"Facebook, Microsoft pulling out of more Seattle-area offices",still open
Microsoft,02/10/2023,Microsoft employees are getting unlimited time off,still open
Microsoft,02/10/2023,Biomedical Research Platform Terra Now Available on Microsoft Azure,still open
Microsoft,02/10/2023,Iran responsible for Charlie Hebdo attacks - Microsoft On the Issues,still open
Microsoft,02/10/2023,Microsoft set to face EU antitrust probe over video calls,still open
Microsoft,02/10/2023,"Microsoft Stopped Selling Windows 10, But You Can Find It Elsewhere",still open
Microsoft,02/10/2023,Sony's gaming chief met EU's Vestager on Microsoft's Activision deal ...,still open
Microsoft,02/10/2023,"Microsoft Patch Tuesday, January 2023 Edition – Krebs on Security",still open
Microsoft,02/10/2023,Surface Pro 9 review: Microsoft’s best tablet – if you pick the right one,still open
Microsoft,02/10/2023,Microsoft faces EU antitrust warning over Activision deal - sources,still open
Microsoft,02/10/2023,"Google, Microsoft, Amazon and other tech companies have laid off more than 70,000 employees in the last year",still open
Microsoft,02/10/2023,Microsoft Combat Goggles Falter as Congress Says No to Buying ...,still open
Microsoft,02/10/2023,"Microsoft, Boeing share gains lead Dow's 136-point climb",still open
Microsoft,02/10/2023,Laid-off Microsoft engineer on H1-B worries about where she'll live,still open
Microsoft,02/10/2023,Microsoft giving workers unlimited time off,still open
Microsoft,02/10/2023,"Months after NSA disclosed Microsoft cert bug, datacenters remain unpatched",still open
Microsoft,02/10/2023,"Google, Nvidia Express Concerns to FTC About Microsoft's ...",still open
Microsoft,02/10/2023,Microsoft Rewards: How To Claim 2000 Bonus Points On Xbox In ...,still open
Microsoft,02/10/2023,Microsoft looked at buying Figma but declined to put in an offer as Adobe deal was nearing,still open
Microsoft,02/10/2023,Microsoft fixed a problem that made Start menu and taskbar ...,still open
Microsoft,02/10/2023,AI Wars: Will Microsoft Eat Google's Lunch? (NASDAQ:GOOG),still open
Microsoft,02/10/2023,Buying the Dips in Microsoft Stock as AI Plans Come to Life,still open
Microsoft,02/10/2023,Microsoft Stock Leaps As Tech Giant Unveils Plans To Revamp Bing With AI,still open
Microsoft,02/10/2023,"C3.ai Stock: The True Beneficiary Of ChatGPT, Not Microsoft",still open
Microsoft,02/10/2023,Microsoft Stock: Ready for the Big Tech AI Battle,still open
Microsoft,02/10/2023,Microsoft Stock: Upside Potential But Shares May Be Choppy In The Near Term (MSFT),still open
Microsoft,02/10/2023,Microsoft vs. Google: Who Will Win the AI Battle?,still open
Microsoft,02/10/2023,Best AI Stock to Buy: Alphabet Stock or Microsoft Stock,still open
Microsoft,02/10/2023,A.I. hype lifts MSFT shares at the expense of GOOGL,still open
Microsoft,02/10/2023,Google Bard AI vs. Microsoft ChatGPT-Which is the Better AI Stock to Buy?,still open
Microsoft,02/10/2023,Is It Time to Buy Microsoft Stock?,still open
Microsoft,02/10/2023,Microsoft Stock: 3 Things That Smart Investors Should Know ...,still open
Microsoft,02/10/2023,Microsoft vs. Google: Who Will Win the AI Battle?,still open
Microsoft,02/10/2023,Microsoft Stock: Racing To Dominate AI (NASDAQ:MSFT),still open
Microsoft,02/10/2023,Why Microsoft Stock Popped Today,still open
Microsoft,02/10/2023,Microsoft Stock: Racing To Dominate AI (NASDAQ:MSFT),still open
Microsoft,02/10/2023,Here's How Much You Would Have Made Owning Microsoft Stock In The Last 15 Years - Microsoft (NASDAQ:MSFT),still open
Microsoft,02/10/2023,Why Microsoft Stock Climbed Today,still open
Microsoft,02/10/2023,Bard AI Vs. Microsoft’s ChatGPT – Is Google’s Stock A Sell?,still open
Microsoft,02/10/2023,Is Microsoft Stock a Buy Now?,still open
Microsoft,02/10/2023,Why Microsoft Stock Rallied Today,still open
Microsoft,02/10/2023,Why Microsoft Stock Popped on Friday,still open
Microsoft,02/10/2023,Howard Wealth Management LLC Has $820000 Stock Holdings in ...,still open
Microsoft,02/10/2023,Where Will Microsoft Stock Be in 3 Years?,still open
Microsoft,02/10/2023,"Why Apple, Microsoft, and Warner Bros. Discovery Stocks are No ...",still open
Microsoft,02/10/2023,Why Microsoft Stock Crept Higher on Monday,still open
Microsoft,02/10/2023,Microsoft market cap tops $2 trillion on Bing's ChatGPT-style revamp,still open
Microsoft,02/10/2023,This Hasn't Happened to Microsoft's Stock Since 2012,still open
Microsoft,02/10/2023,Buying the Dips in Microsoft Stock as AI Plans Come to Life,still open
Microsoft,02/10/2023,This Trillion-Dollar Growth Stock Just Beat Microsoft and Amazon in ...,still open
Microsoft,02/10/2023,Microsoft Stock: Software Giant Discloses Layoffs | Investor's ...,still open
Microsoft,02/10/2023,"Microsoft Stock Remains a Core Name to Own in 2023, Says Wedbush",still open
Microsoft,02/10/2023,Like OpenAI/ChatGPT's Potential? Check Out Microsoft Stock ...,still open
Microsoft,02/10/2023,Alphabet or Microsoft? Analysts predict which stock will come out on ...,still open
Microsoft,02/10/2023,Microsoft (NASDAQ:MSFT) Could Be A Buy For Its Upcoming Dividend,still open
Microsoft,02/10/2023,Best Growth Stock To Buy: Sofi Stock vs. Microsoft Stock,still open
Microsoft,02/10/2023,Microsoft stock en route to worst daily drop in weeks,still open
Microsoft,02/10/2023,Better Buy: Amazon Stock vs. Microsoft Stock,still open
Microsoft,02/10/2023,Futures Fall As Shakeout Deepens; Tesla Doubles From Bear Low,still open
Microsoft,02/10/2023,Better Bear Market Buy: Meta Platforms vs. Microsoft,still open
Microsoft,02/10/2023,3 Must-Know Conversational AI Stocks,still open
Microsoft,02/10/2023,"Stocks to Watch: Microsoft, Uber, Chipotle, Prudential, Disney, Bed ...",still open
Microsoft,02/10/2023,Dow Jones Falls On Hot Inflation Survey Data; Lyft Crashes 35% On ...,still open
Microsoft,02/10/2023,"Trading Microsoft and Activision Blizzard Amid AI, Earnings, Buyout Effort",still open
Microsoft,02/10/2023,Activision Blizzard Stock: Strong Results And Microsoft Drama ...,still open
Microsoft,02/10/2023,Microsoft Stock on Pace for a Fifth Straight Daily Advance,still open
Microsoft,02/10/2023,"Dow Jones Futures Fall, AI Arms Race Intensifies; Fortinet, Enphase ...",still open
Microsoft,02/10/2023,Nasdaq closes slightly lower for a second day as earnings season rolls on,still open
Microsoft,02/10/2023,"Stocks making the biggest moves midday: Microsoft, Moderna, Mobileye, Chegg and more",still open
Microsoft,02/10/2023,Nasdaq Bear Market: 1 Phenomenal Growth Stock to Buy Like ...,still open
Microsoft,02/10/2023,Microsoft's Future Growth Prospects (NASDAQ:MSFT),still open
Microsoft,02/10/2023,Stock market news live updates: Stocks finish mixed as investors evaluate deluge of earnings,still open
Microsoft,02/10/2023,A Bull Market Is Coming: 2 Top Growth Stocks to Buy in 2023 and ...,still open
Microsoft,02/10/2023,"If You Like Amazon, Microsoft, and Alphabet, Consider Buying This ...",still open
Microsoft,02/10/2023,"If You Invested $1,000 In Microsoft Stock When Bill Gates Left As CEO, Here's How Much You'd Have Now - M",still open
Microsoft,02/10/2023,Microsoft Corp. stock outperforms competitors on strong trading day,still open
Microsoft,02/10/2023,Microsoft Kicks Off Tech Earnings Set to Slump Most Since 2016,still open
Microsoft,02/10/2023,"Dow climbs 250 points on gains in shares of Microsoft, Boeing",still open
Microsoft,02/10/2023,Jim Cramer's top 10 things to watch in the market Wednesday ...,still open
Microsoft,02/10/2023,8 Top Tech Stocks To Buy Now - How To Take Advantage Of The Market Dip,still open
Microsoft,02/10/2023,Microsoft Stock Jumps Ahead of AI Media Event With ChatGPT ...,still open
Microsoft,02/10/2023,2 Growth Stocks Down More Than 30% to Buy Right Now,still open
Microsoft,02/10/2023,"Microsoft Reportedly Cuts Jobs at HoloLens, Xbox, Surface Units",still open
Microsoft,02/10/2023,Microsoft’s (NASDAQ:MSFT) Activision Deal to Hit Another Roadblock,still open
Microsoft,02/10/2023,Dow Jones Futures Rise; 10 Big Earnings On Tap For Market Rally ...,still open
Microsoft,02/10/2023,"Microsoft shares 6 areas of focus for financial services industry, ET ...",still open
Microsoft,02/10/2023,Microsoft shares workaround for unresponsive Windows Start Menu,still open
Microsoft,02/10/2023,"Video Game Stocks Hit Reset Button, Face Iffy 2023",still open
Microsoft,02/10/2023,Will Datadog Be Worth More Than Microsoft by 2030?,still open
Microsoft,02/10/2023,Somerset Trust Co sells 419 Microsoft shares (NASDAQ:MSFT),still open
Microsoft,02/10/2023,Microsoft will need 'a crowbar to pry away' Google's advertising ...,still open
Microsoft,02/10/2023,"Earnings playbook: What investors can expect out of Tesla, Microsoft ...",still open
