Name,Data,News,Evaluation
Microsoft,02/07/2023,Microsoft and Qcells announce strategic alliance to curb carbon ...,still open
Microsoft,02/07/2023,Microsoft Bets Big on the Creator of ChatGPT in Race to Dominate A.I.,still open
Microsoft,02/07/2023,"AudioCodes Clocks 7% Revenue Growth In Q4 Backed By Microsoft, Zoom",still open
Microsoft,02/07/2023,Microsoft DirectStorage continues surprising as Windows 11's gaming gets explored further,still open
Microsoft,02/07/2023,"Xbox 360 'May 2023' Closure Message Was An Error, Says Microsoft",still open
Microsoft,02/07/2023,2023 Release Wave 1: Experts preview even more Microsoft ...,still open
Microsoft,02/07/2023,How to save messages in Microsoft Teams and why you would want ...,still open
Microsoft,02/07/2023,Hackers weaponize Microsoft Visual Studio add-ins to push malware,still open
Microsoft,02/07/2023,Attackers abuse Microsoft’s 'verified publisher' status to steal data,still open
Microsoft,02/07/2023,Laid-off Microsoft engineer on H1-B worries about where she'll live,still open
Microsoft,02/07/2023,Four Ways Leaders Can Empower People for How Work Gets Done,still open
Microsoft,02/07/2023,Microsoft Releases January 2023 Security Updates | CISA,still open
Microsoft,02/07/2023,Resolved: Microsoft Team is experiencing access issue for some ...,still open
Microsoft,02/07/2023,2 Cybersecurity Stocks to Buy in 2023 Besides Microsoft,still open
Microsoft,02/07/2023,Meet your goals in 2023 with Microsoft Viva Goals,still open
Microsoft,02/07/2023,"Microsoft Hit With Teams, Microsoft 365 Outage Issues",still open
Microsoft,02/07/2023,Microsoft Studio 343 Industries Undergoing Reorganization of Halo ...,still open
Microsoft,02/07/2023,Microsoft will stop selling Windows 10 licenses in a few days,still open
Microsoft,02/07/2023,Microsoft Is Aggressively Investing In Healthcare AI,still open
Microsoft,02/07/2023,"Microsoft 365 Basic launches with 100 GB of storage, Outlook and more for $1.99 per month",still open
Microsoft,02/07/2023,Tech Mahindra and Microsoft join hands to bring cloud-powered 5G ...,still open
Microsoft,02/07/2023,Microsoft Warns Employees Not to Share Sensitive Data With ...,still open
Microsoft,02/07/2023,"Google, Microsoft, Amazon and other tech companies have laid off more than 70,000 employees in the last year",still open
Microsoft,02/07/2023,"Microsoft, GitHub, and OpenAI ask court to throw out AI copyright ...",still open
Microsoft,02/07/2023,Microsoft ends Windows 7 security updates,still open
Microsoft,02/07/2023,Microsoft set to face EU antitrust probe over video calls,still open
Microsoft,02/07/2023,Microsoft Edge 'Phoenix' is an internal reimagining of the Edge web ...,still open
Microsoft,02/07/2023,"Facebook, Microsoft pulling out of more Seattle-area offices",still open
Microsoft,02/07/2023,Sony's gaming chief met EU's Vestager on Microsoft's Activision deal ...,still open
Microsoft,02/07/2023,"Microsoft acquires Fungible, a maker of data processing units, to bolster Azure",still open
Microsoft,02/07/2023,Microsoft faces EU antitrust warning over Activision deal - sources,still open
Microsoft,02/07/2023,Microsoft Combat Goggles Falter as Congress Says No to Buying ...,still open
Microsoft,02/07/2023,"Microsoft, Home Depot share losses contribute to Dow's nearly 250 ...",still open
Microsoft,02/07/2023,Surface Pro 9 review: Microsoft's best tablet – if you pick the right one,still open
Microsoft,02/07/2023,Microsoft giving workers unlimited time off,still open
Microsoft,02/07/2023,Microsoft looked at buying Figma but declined to put in an offer as Adobe deal was nearing,still open
Microsoft,02/07/2023,"Microsoft Patch Tuesday, January 2023 Edition – Krebs on Security",still open
Microsoft,02/07/2023,"Microsoft scraps plans for dual-screen Surface Duo 3, pivots to new ...",still open
Microsoft,02/07/2023,"Guggenheim downgrades Microsoft, says vulnerabilities may be ...",still open
Microsoft,02/07/2023,"Microsoft, Alphabet Cry Poor Right Before Making $32.8 Billion",still open
Microsoft,02/07/2023,Microsoft has subpoenaed PlayStation for its defence against FTC ...,still open
Microsoft,02/07/2023,Microsoft ends Windows 7 extended security updates on Tuesday,still open
Microsoft,02/07/2023,Microsoft and ArcelorMittal back MIT spinout trying to green the $1.6 trillion steel industry,still open
Microsoft,02/07/2023,"Google, Nvidia Express Concerns to FTC About Microsoft's ...",still open
Microsoft,02/07/2023,Microsoft Stock: Ready for the Big Tech AI Battle,still open
Microsoft,02/07/2023,Microsoft to discuss OpenAI's ChatGPT at big event: Live updates,still open
Microsoft,02/07/2023,"Stocks mixed at open, Microsoft gains",still open
Microsoft,02/07/2023,Microsoft Stock Leaps Ahead of AI Media Event With ChatGPT Plans In Focus,still open
Microsoft,02/07/2023,"How Microsoft, Google are taking on ChatGPT, what it means for the stocks",still open
Microsoft,02/07/2023,Why Microsoft Stock Climbed Today,still open
Microsoft,02/07/2023,"Microsoft (MSFT) Stock: Undervalued, Outstanding Cloud Growth",still open
Microsoft,02/07/2023,Microsoft Stock: Here's When to Buy the Dip,still open
Microsoft,02/07/2023,"Microsoft is laying off 10,000 employees",still open
Microsoft,02/07/2023,"Microsoft Stock Slides As UBS Cuts Rating, Flags Azure, Office 365 Weakness",still open
Microsoft,02/07/2023,Want to Invest in ChatGPT? Then Buy Microsoft Stock,still open
Microsoft,02/07/2023,Want to Invest in ChatGPT? Then Buy Microsoft Stock,still open
Microsoft,02/07/2023,Microsoft Stock Options Still Popular After Tech Earnings,still open
Microsoft,02/07/2023,Is Microsoft Stock a Buy Now?,still open
Microsoft,02/07/2023,Microsoft Stock: Big Problems Ahead (NASDAQ:MSFT),still open
Microsoft,02/07/2023,Microsoft Stock: Ready for the Big Tech AI Battle,still open
Microsoft,02/07/2023,Why Microsoft Stock Rallied Today,still open
Microsoft,02/07/2023,Why Microsoft Stock Crept Higher on Monday,still open
Microsoft,02/07/2023,Why Microsoft Stock Popped on Friday,still open
Microsoft,02/07/2023,Fluent Financial LLC Has $2.24 Million Stock Position in Microsoft ...,still open
Microsoft,02/07/2023,Where Will Microsoft Stock Be in 3 Years?,still open
Microsoft,02/07/2023,Why Microsoft Stock Topped the Market Today,still open
Microsoft,02/07/2023,This Hasn't Happened to Microsoft's Stock Since 2012,still open
Microsoft,02/07/2023,C3.ai Stock (NYSE:AI): Ride it Up While AI is Hot,still open
Microsoft,02/07/2023,"This Company Is Beating Google to Chat-Based Search, and It's Not ...",still open
Microsoft,02/07/2023,"Microsoft Corp. stock falls Monday, still outperforms market",still open
Microsoft,02/07/2023,Microsoft Stock: Software Giant Discloses Layoffs,still open
Microsoft,02/07/2023,"Microsoft Stock Remains a Core Name to Own in 2023, Says Wedbush",still open
Microsoft,02/07/2023,"Microsoft, Tesla stock moves hint at positive signs for the market ...",still open
Microsoft,02/07/2023,Like OpenAI/ChatGPT's Potential? Check Out Microsoft Stock ...,still open
Microsoft,02/07/2023,Best Growth Stock To Buy: Sofi Stock vs. Microsoft Stock,still open
Microsoft,02/07/2023,Dow Jones Falls; Market Awaits Powell Test For Next Run; Apple ...,still open
Microsoft,02/07/2023,Better Buy: Amazon Stock vs. Microsoft Stock,still open
Microsoft,02/07/2023,Microsoft stock en route to worst daily drop in weeks,still open
Microsoft,02/07/2023,2 Top Stocks to Buy in February,still open
Microsoft,02/07/2023,2 Cybersecurity Stocks to Buy in 2023 Besides Microsoft,still open
Microsoft,02/07/2023,"Microsoft shares are 'just north' of expensive after earnings, Tim ...",still open
Microsoft,02/07/2023,Better Bear Market Buy: Meta Platforms vs. Microsoft,still open
Microsoft,02/07/2023,Apple vs. Microsoft: Which Tech Stock To Own In 2023?,still open
Microsoft,02/07/2023,Microsoft Stock on Pace for a Fifth Straight Daily Advance,still open
Microsoft,02/07/2023,Nasdaq Bear Market: 1 Phenomenal Growth Stock to Buy Like ...,still open
Microsoft,02/07/2023,"Dow Jones Futures Fall On Weak Microsoft Guidance, Boeing Loss ...",still open
Microsoft,02/07/2023,Activision Stock Jumps As 'Call of Duty' Drives Impressive Q4 Sales; Microsoft Takeover In Focus,still open
Microsoft,02/07/2023,Dow Jones Dips As Nasdaq Flies; Meta Stock Rockets After Mark ...,still open
Microsoft,02/07/2023,Dow Jones Futures Fall: Stock Market Rally Signals It's No Bear Run ...,still open
Microsoft,02/07/2023,Microsoft's Future Growth Prospects (NASDAQ:MSFT),still open
Microsoft,02/07/2023,"First round of earnings for Meta, Amazon, Tesla and Microsoft stocks",still open
Microsoft,02/07/2023,"If You Like Amazon, Microsoft, and Alphabet, Consider Buying This ...",still open
Microsoft,02/07/2023,Google to Defend Its Business From Microsoft and ChatGPT With ...,still open
Microsoft,02/07/2023,Microsoft Corp. stock outperforms competitors on strong trading day,still open
Microsoft,02/07/2023,Baidu Surges After Prepping ChatGPT-Style 'Ernie' Bot for March,still open
Microsoft,02/07/2023,"Guggenheim downgrades Microsoft, says vulnerabilities may be ...",still open
Microsoft,02/07/2023,"If You Invested $1,000 In Microsoft Stock When Bill Gates Left As CEO, Here's How Much You'd Have Now",still open
Microsoft,02/07/2023,"This Chicken Wing Stock Has A Better 5-Year Return Than Disney, Ford, Microsoft, Alibaba, Amazon, Bitcoin",still open
Microsoft,02/07/2023,"Dow jumps 162 points on gains in Dow, Microsoft stocks",still open
Microsoft,02/07/2023,8 Top Tech Stocks To Buy Now - How To Take Advantage Of The Market Dip,still open
Microsoft,02/07/2023,2 Growth Stocks Down More Than 30% to Buy Right Now,still open
Microsoft,02/07/2023,Why Cloudflare Looms Among Emerging AI Stocks Amid OpenAI ...,still open
Microsoft,02/07/2023,Microsoft shares workaround for unresponsive Windows Start Menu,still open
Microsoft,02/07/2023,Will Datadog Be Worth More Than Microsoft by 2030?,still open
Microsoft,02/07/2023,3 Stocks That Are Great Long-Term Picks,still open
Microsoft,02/07/2023,Here's How Much You Would Have Made Owning Microsoft Stock In The Last 5 Years,still open
Microsoft,02/07/2023,"Latest Windows 11 build shares desktop real estate with, er, Spotify",still open
Microsoft,02/07/2023,"Microsoft, Boeing share gains lead Dow's 82-point climb",still open
Microsoft,02/07/2023,Jim Cramer Sold The Stock He 'Swore' He Would Never Sell: Why The 'Ultimate Buy-And-Hold Stock' Had To Go,still open
Microsoft,02/07/2023,Microsoft and Activision Blizzard: ATVI stock price still below MSFT ...,still open
Microsoft,02/07/2023,Dow Jones Futures Rise On Bank Of Japan Surprise; Tesla ...,still open
Microsoft,02/07/2023,Microsoft Shares State Legislative Priorities for 2023 | News ...,still open
Microsoft,02/07/2023,Somerset Trust Co sells 419 Microsoft shares (NASDAQ:MSFT),still open
Microsoft,02/07/2023,Microsoft looked at buying Figma but declined to put in an offer as Adobe deal was nearing,still open
Microsoft,02/07/2023,"Jim Cramer's top 10 things Tuesday: Microsoft AI bet, defensive ...",still open
Microsoft,02/07/2023,5 Stocks That Can Benefit From Popular AI Like ChatGPT,still open
Microsoft,02/07/2023,Top Stocks to Buy: Cloud Computing Breakdown,still open
Microsoft,02/07/2023,Microsoft Is Coming After Alphabet's Money Printing Business,still open
Microsoft,02/07/2023,Microsoft Stock Slides As Weakened Cloud Outlook Reverses ...,still open
Microsoft,02/07/2023,Ireland shares new guide to keep Microsoft 365 services secure,still open
Microsoft,02/07/2023,'Black Swan' Author Says Argument That Bill Gates Could've Been A Trillionaire Had He Held On To His Micr,still open
Microsoft,02/07/2023,History Says the Nasdaq Could Soar in 2023 -- 5 Stocks You'll Wish ...,still open
Microsoft,02/07/2023,"Trump lost out on MILLIONS after sharing Apple and Microsoft stocks too early, documents show",still open
Microsoft,02/07/2023,Microsoft Stock Leaps After Topping Earnings Forecast On Cloud ...,still open
Microsoft,02/07/2023,"Facebook, Microsoft pulling out of more Seattle-area offices",still open
Microsoft,02/07/2023,My 2023 Stock Recommendations: How They're Performing and ...,still open
Microsoft,02/07/2023,Three big questions facing tech stocks this earnings season,still open
Microsoft,02/07/2023,This Stock Just Became One of the Most Profitable Companies on ...,still open
Microsoft,02/07/2023,Microsoft faces EU antitrust warning over Activision deal - sources,still open
Microsoft,02/07/2023,Meta’s 54% Stock Comeback Is Still on Shaky Ground,still open
Microsoft,02/07/2023,Why Alphabet Stock Was a Dog on Monday,still open
Microsoft,02/07/2023,Microsoft shares rally as it shrugs off tech turmoil,still open
Microsoft,02/07/2023,Microsoft Just Acquired a Chip Design Start-Up. Here's What ...,still open
Microsoft,02/07/2023,Why Microsoft Stock Dropped Today,still open
Microsoft,02/07/2023,Why Microsoft Stock Slumped 5% Today,still open
Microsoft,02/07/2023,"Microsoft Stock: Buy, Sell, or Hold in 2023?",still open
Microsoft,02/07/2023,Is Microsoft Stock Price Ready For Takeoff (Technical Analysis ...,still open
Microsoft,02/07/2023,Why Microsoft Stock Was Down on Monday,still open
Microsoft,02/07/2023,Why Microsoft Stock Popped on Wednesday,still open
Microsoft,02/07/2023,Why Microsoft Stock Was Climbing Today,still open
Microsoft,02/07/2023,Why Microsoft Stock Lagged the Market Today,still open
Microsoft,02/07/2023,Is Microsoft Stock a Buy Right Now?,still open
Microsoft,02/08/2023,"Microsoft launches the new Bing, with ChatGPT built in",still open
Microsoft,02/08/2023,"Microsoft CEO Satya Nadella on challenging Google with the help of AI technology: ""It's a new race""",still open
Microsoft,02/08/2023,"Google announces new AI search features, as race with Microsoft heats up",still open
Microsoft,02/08/2023,Activision stock slips after UK regulator raises concerns on Microsoft deal,still open
Microsoft,02/08/2023,UK regulators come down hard against Microsoft’s Activision acquisition,still open
Microsoft,02/08/2023,Britain takes aim at Microsoft's $69 billion 'Call of Duty' deal,still open
Microsoft,02/08/2023,Microsoft will wipe free Teams business users' data if they don't upgrade to a paid tier,still open
Microsoft,02/08/2023,Microsoft is about to retire Teams Free (classic). Here's what you need to know,still open
Microsoft,02/08/2023,The caveat about the new Microsoft Teams (free) version,still open
Microsoft,02/08/2023,Outlook down: Microsoft experiences widespread outage,still open
Microsoft,02/08/2023,Microsoft Outlook and Teams suffer another global outage,still open
Microsoft,02/08/2023,Microsoft investigates Outlook outage,still open
Microsoft,02/08/2023,"Microsoft will need 'a crowbar to pry away' Google's advertising dominance, even with its A.I. investments",still open
Microsoft,02/08/2023,"After Microsoft's 'Slap In The Face,' Westside Atlanta Leaders Grapple With What Comes Next",still open
Microsoft,02/08/2023,Microsoft Authenticator drops support for Apple Watch,still open
Microsoft,02/08/2023,Microsoft's cloud business stands to gain from the AI craze,still open
Microsoft,02/08/2023,"Microsoft to cut 10,000 jobs as spending slows",still open
Microsoft,02/08/2023,Microsoft announces new A.I.-powered Bing homepage that you can chat with,still open
Microsoft,02/08/2023,Microsoft likely to reveal ChatGPT-related service at event on Tuesday,still open
Microsoft,02/08/2023,I tried Microsoft's new AI-powered Bing. Here's what it's like,still open
Microsoft,02/08/2023,"UK regulator says Microsoft’s proposed $68.7B Activision merger could create ‘higher prices, fewer choices’",still open
Microsoft,02/08/2023,"Google Announces Bard, Its Rival To Microsoft-Backed ChatGPT",still open
Microsoft,02/08/2023,Why Microsoft Is the Safest Big Tech Stock,still open
Microsoft,02/08/2023,Microsoft Outlook outage resolved,still open
Microsoft,02/08/2023,"Wednesday's top tech news: after Microsoft's AI blowout, it's ...",still open
Microsoft,02/08/2023,Adobe and Microsoft Bring Industry-Leading Acrobat PDF Experience to 1.4 Billion Windows Users Through Microsoft Edge,still open
Microsoft,02/08/2023,Microsoft Teams Premium: Cut costs and add AI-powered productivity,still open
Microsoft,02/08/2023,This free version of Microsoft Teams is disappearing forever soon,still open
Microsoft,02/08/2023,"All you need to know about ChatGPT, the A.I. chatbot that's got the world talking and tech giants clashing",still open
Microsoft,02/08/2023,"US STOCKS-Futures edge lower, Microsoft rises on AI push",still open
Microsoft,02/08/2023,Microsoft Authenticator Discontinues Apple Watch App,still open
Microsoft,02/08/2023,"Amazon, Microsoft Cloud Computing Businesses Lose Steam",still open
Microsoft,02/08/2023,Microsoft's Adaptive Accessories are a tradeoff,still open
Microsoft,02/08/2023,"Why Apple, Microsoft, and Warner Bros. Discovery Stocks are No ...",still open
Microsoft,02/08/2023,"Stocks making the biggest moves premarket: Uber, Chipotle, Microsoft, Lumen and more",still open
Microsoft,02/08/2023,Microsoft Cloud strength drives second quarter results - Stories,still open
Microsoft,02/08/2023,Microsoft boosts Viva Sales with new GPT seller experience ...,still open
Microsoft,02/08/2023,Microsoft 365 trial offer blocks access to Windows 10 desktops,still open
Microsoft,02/08/2023,Meeting the AI moment: advancing the future through responsible AI ...,still open
Microsoft,02/08/2023,Microsoft and OpenAI extend partnership - The Official Microsoft Blog,still open
Microsoft,02/08/2023,"Stocks to Watch: Microsoft, Uber, Chipotle, Prudential, Disney, Bed ...",still open
Microsoft,02/08/2023,"Even as cloud infrastructure market growth slows, Microsoft continues to gain on Amazon",still open
Microsoft,02/08/2023,"Microsoft to Lay Off 10,000 Workers as It Looks to Trim Costs",still open
Microsoft,02/08/2023,How to disable rounded corners in Microsoft Edge?,still open
Microsoft,02/08/2023,"Monetary Policy, 1 Minute S&P Chart, Trading Lockheed, Microsoft ...",still open
Microsoft,02/08/2023,"insightsoftware Acquires Power ON, Integrating Operational ...",still open
Microsoft,02/08/2023,"Analysis: From Meta to Microsoft, AI's big moment is here",still open
Microsoft,02/08/2023,General availability of Azure OpenAI Service expands access to ...,still open
Microsoft,02/08/2023,What Microsoft’s Recent Layoffs Mean For The Company And Investors,still open
Microsoft,02/08/2023,Subject: Focusing on our short- and long-term opportunity - The ...,still open
Microsoft,02/08/2023,Microsoft Mesh: Creating connections at the World Economic Forum ...,still open
Microsoft,02/08/2023,"Dow climbs 250 points on gains in shares of Microsoft, Boeing",still open
Microsoft,02/08/2023,Why Microsoft Stock Climbed Today,still open
Microsoft,02/08/2023,What's New in Microsoft Teams | January 2023 - Microsoft ...,still open
Microsoft,02/08/2023,Microsoft users hit with global cloud outage that impacted products like Teams and Outlook,still open
Microsoft,02/08/2023,Microsoft swears it's not coming for your data with scan for old Office versions,still open
Microsoft,02/08/2023,Microsoft halts work on 90-acre Westside Atlanta campus,still open
Microsoft,02/08/2023,Microsoft and Qcells announce strategic alliance to curb carbon ...,still open
Microsoft,02/08/2023,Microsoft and Israeli startup Classiq collaborate to bring advanced ...,still open
Microsoft,02/08/2023,Is It Too Late To Consider Buying Microsoft Corporation (NASDAQ:MSFT)?,still open
Microsoft,02/08/2023,Microsoft Azure Load Testing is now generally available,still open
Microsoft,02/08/2023,Microsoft Bets Big on the Creator of ChatGPT in Race to Dominate A.I.,still open
Microsoft,02/08/2023,FTSE 100 index hits record high; CMA deals blow to Microsoft’s Activision deal – business live,still open
Microsoft,02/08/2023,Laid-off Microsoft engineer on H1-B worries about where she'll live,still open
Microsoft,02/08/2023,Meet your goals in 2023 with Microsoft Viva Goals,still open
Microsoft,02/08/2023,Resolved: Microsoft Team is experiencing access issue for some ...,still open
Microsoft,02/08/2023,Microsoft Releases January 2023 Security Updates | CISA,still open
Microsoft,02/08/2023,Four Ways Leaders Can Empower People for How Work Gets Done,still open
Microsoft,02/08/2023,Microsoft Slowdown? Partners Investing Despite ‘More Cost ...,still open
Microsoft,02/08/2023,Attackers abuse Microsoft’s 'verified publisher' status to steal data,still open
Microsoft,02/08/2023,Biomedical Research Platform Terra Now Available on Microsoft Azure,still open
Microsoft,02/08/2023,"Iran behind hack of French magazine Charlie Hebdo, Microsoft says",still open
Microsoft,02/08/2023,"Microsoft Hit With Teams, Microsoft 365 Outage Issues",still open
Microsoft,02/08/2023,Microsoft will stop selling Windows 10 licenses in a few days,still open
Microsoft,02/08/2023,2 Cybersecurity Stocks to Buy in 2023 Besides Microsoft,still open
Microsoft,02/08/2023,"Remember Bing? With ChatGPT's Help, Microsoft Is Coming for ...",still open
Microsoft,02/08/2023,Tech Mahindra and Microsoft join hands to bring cloud-powered 5G ...,still open
Microsoft,02/08/2023,"Microsoft 365 Basic launches with 100 GB of storage, Outlook and more for $1.99 per month",still open
Microsoft,02/08/2023,Microsoft Studio 343 Industries Undergoing Reorganization of Halo ...,still open
Microsoft,02/08/2023,Microsoft is checking everyone's bags for unsupported Office installs,still open
Microsoft,02/08/2023,Microsoft ends Windows 7 security updates,still open
Microsoft,02/08/2023,Microsoft set to face EU antitrust probe over video calls,still open
Microsoft,02/08/2023,"Microsoft Patch Tuesday, January 2023 Edition – Krebs on Security",still open
Microsoft,02/08/2023,"Facebook, Microsoft pulling out of more Seattle-area offices",still open
Microsoft,02/08/2023,"Microsoft, GitHub, and OpenAI ask court to throw out AI copyright ...",still open
Microsoft,02/08/2023,Sony's gaming chief met EU's Vestager on Microsoft's Activision deal ...,still open
Microsoft,02/08/2023,Microsoft faces EU antitrust warning over Activision deal - sources,still open
Microsoft,02/08/2023,Microsoft Combat Goggles Falter as Congress Says No to Buying ...,still open
Microsoft,02/08/2023,"Google, Microsoft, Amazon and other tech companies have laid off more than 70,000 employees in the last year",still open
Microsoft,02/08/2023,Surface Pro 9 review: Microsoft’s best tablet – if you pick the right one,still open
Microsoft,02/08/2023,Microsoft looked at buying Figma but declined to put in an offer as Adobe deal was nearing,still open
Microsoft,02/08/2023,Microsoft giving workers unlimited time off,still open
Microsoft,02/08/2023,"Microsoft scraps plans for dual-screen Surface Duo 3, pivots to new ...",still open
Microsoft,02/08/2023,Microsoft ends Windows 7 extended security updates on Tuesday,still open
Microsoft,02/08/2023,"Google, Nvidia Express Concerns to FTC About Microsoft's ...",still open
Microsoft,02/08/2023,"Microsoft, Home Depot share losses contribute to Dow's nearly 250 ...",still open
Microsoft,02/08/2023,Microsoft has subpoenaed PlayStation for its defence against FTC ...,still open
Microsoft,02/08/2023,Exclusive: This is Microsoft's new modern File Explorer overhaul for ...,still open
Microsoft,02/08/2023,Microsoft and ArcelorMittal back MIT spinout trying to green the $1.6 trillion steel industry,still open
Microsoft,02/08/2023,"Meta, Amazon, Microsoft, Alphabet exits will cost up to $4.7 billion",still open
Microsoft,02/08/2023,Buggy Microsoft Defender ASR rule deletes Windows app shortcuts,still open
Microsoft,02/08/2023,"Microsoft Plans to Build OpenAI, ChatGPT Features Into All Products",still open
Microsoft,02/08/2023,Tested: Microsoft's DirectStorage tech signals the sunset of SATA ...,still open
Microsoft,02/08/2023,Microsoft Stock Extends Gains As AI-Powered Bing Challenges Google Search Dominance,still open
Microsoft,02/08/2023,AI Stocks: Microsoft Stock Rises On Artificial Intelligence Plans,still open
Microsoft,02/08/2023,Want to Invest in ChatGPT? Then Buy Microsoft Stock,still open
Microsoft,02/08/2023,Why Microsoft Stock Popped Today,still open
Microsoft,02/08/2023,Microsoft Stock Leaps As Tech Giant Unveils Plans To Revamp Bing With AI,still open
Microsoft,02/08/2023,Microsoft Stock: Ready for the Big Tech AI Battle,still open
Microsoft,02/08/2023,Microsoft Stock: 3 Things That Smart Investors Should Know (NASDAQ:MSFT),still open
Microsoft,02/08/2023,Why Microsoft Stock Is Climbing Higher Today,still open
Microsoft,02/08/2023,Is It Time to Buy Microsoft Stock?,still open
Microsoft,02/08/2023,Microsoft Stock Extends Gains As AI-Powered Bing Challenges ...,still open
Microsoft,02/08/2023,Why Microsoft Stock Climbed Today,still open
Microsoft,02/08/2023,Is Microsoft Stock a Buy Now?,still open
Microsoft,02/08/2023,"Dow Jones Futures Fall After Market Rallies On Powell, AI Arms ...",still open
Microsoft,02/08/2023,Why Microsoft Stock Rallied Today,still open
Microsoft,02/08/2023,"Why Apple, Microsoft, and Warner Bros. Discovery Stocks are No ...",still open
Microsoft,02/08/2023,"Stocks making the biggest moves premarket: Uber, Chipotle, Microsoft, Lumen and more",still open
Microsoft,02/08/2023,Google Bard AI vs. Microsoft ChatGPT-Which is the Better AI Stock to ...,still open
Microsoft,02/08/2023,Why Microsoft Stock Crept Higher on Monday,still open
Microsoft,02/08/2023,Why Microsoft Stock Popped on Friday,still open
Microsoft,02/08/2023,Microsoft Co. (NASDAQ:MSFT) Shares Sold by Atria Investments LLC,still open
Microsoft,02/08/2023,Where Will Microsoft Stock Be in 3 Years?,still open
