Name,Data,News,Evaluation
NetApp,02/05/2023,NetApp CEO Kurian: ‘Sizable Opportunity’ Exists In Cloud ...,still open
NetApp,02/05/2023,How the NetApp/VMware Partnership Benefits Businesses in the ...,still open
NetApp,02/05/2023,Cloud Infrastructure Components Market Size & Analysis By 2022 ...,still open
NetApp,02/05/2023,"NetApp, Inc. (NASDAQ:NTAP) Q2 2023 Earnings Call Transcript",still open
NetApp,02/05/2023,Jodi Wadhwa Joins NetApp as Senior Director of Global Cloud ...,still open
NetApp,02/05/2023,"Domino Data Lab Teams With Nvidia, NetApp To Enable MLOps ...",still open
NetApp,02/05/2023,NetApp (NTAP) Down 14% Since Last Earnings Report: Can It Rebound?,still open
NetApp,02/05/2023,Database Management Software Market 2022 Segments Analysis ...,still open
NetApp,02/05/2023,Is NetApp Stock a Buy Now?,still open
NetApp,02/05/2023,Why NetApp (NTAP) is a Top Value Stock for the Long-Term,still open
NetApp,02/05/2023,NetApp bucks trend for all-flash array revenues – Blocks and Files,still open
NetApp,02/05/2023,TAG Heuer Porsche Formula E Team Partnering With NetApp,still open
NetApp,02/05/2023,Nasuni vs NetApp: Low-speed architecture collision – Blocks and Files,still open
NetApp,02/05/2023,NetApp public cloud chief Anthony Lye on asking app devs to ...,still open
NetApp,02/05/2023,"Disk Storage System Market Size, Development Data, Growth ...",still open
NetApp,02/05/2023,"Partners Notch HPE GreenLake Record, NetApp Warns of Headwinds",still open
NetApp,02/05/2023,NetApp adds Porsche race team to client list – Blocks and Files,still open
NetApp,02/05/2023,"NetApp crams ransomware, single subscription features and more ...",still open
NetApp,02/05/2023,"NetApp Aims to Make the Hybrid Cloud Less Complex, More Secure",still open
NetApp,02/05/2023,NetApp Cloud Volumes ONTAP: A GigaOm Benchmark Field Test,still open
NetApp,02/05/2023,NetApp Closes Acquisition of Instaclustr,still open
NetApp,02/05/2023,VMware Cloud on AWS Integrates with Amazon FSx for NetApp ...,still open
NetApp,02/05/2023,NetApp Teams with NVIDIA to Accelerate HPC and AI with Turnkey ...,still open
NetApp,02/05/2023,NetApp: Cloud Portfolio Review,still open
NetApp,02/05/2023,"NetApp, Inc. (NASDAQ:NTAP) Shares Acquired by Creative Planning",still open
NetApp,02/05/2023,"Hemenway Trust Co LLC Sells 12000 Shares of NetApp, Inc ...",still open
NetApp,02/05/2023,NetApp Inc. stock outperforms competitors despite losses on the day,still open
NetApp,02/05/2023,"With EPS Growth And More, NetApp (NASDAQ:NTAP) Makes An Interesting Case",still open
NetApp,02/05/2023,Why NetApp (NTAP) is a Top Momentum Stock for the Long-Term,still open
NetApp,02/05/2023,NetApp Inc. stock underperforms Thursday when compared to competitors,still open
NetApp,02/05/2023,Returns At NetApp (NASDAQ:NTAP) Are On The Way Up,still open
NetApp,02/05/2023,"NetApp Inc. stock rises Tuesday, outperforms market",still open
NetApp,02/05/2023,"NetApp, Inc. (NASDAQ:NTAP) Receives Average Recommendation ...",still open
NetApp,02/05/2023,NetApp Inc. stock outperforms competitors on strong trading day,still open
NetApp,02/05/2023,"Mn Services Vermogensbeheer B.V. Cuts Stake in NetApp, Inc ...",still open
NetApp,02/05/2023,"Starbucks, NVIDIA And These 3 Stocks Insiders Are Selling - NetApp (NASDAQ:NTAP), AutoZone (NYSE:AZO)",still open
NetApp,02/05/2023,"NetApp, a specialist in cloud data management, says it will lay off 8%, or around 960 people, citing economic climate",still open
NetApp,02/05/2023,20 Stocks That Are Aggressively Buying Back Shares According To Goldman Sachs,still open
NetApp,02/05/2023,NetApp (NTAP) Shares Cross 3% Yield Mark,still open
NetApp,02/05/2023,11 Tech Stocks With Low PE Ratio,still open
NetApp,02/05/2023,Interesting NTAP Put And Call Options For September 15th,still open
NetApp,02/05/2023,Mn Services Vermogensbeheer B.V. Reduces Its Holdings in ...,still open
NetApp,02/05/2023,The Oregon Public Employees Retirement Fund reduces its stake in ...,still open
NetApp,02/05/2023,Hussman Strategic Advisors Inc. invested $2.88 million in NetApp ...,still open
NetApp,02/05/2023,"PayPal, NetApp Lay Off 3,000 Employees In Latest Silicon Valley Tech Cuts",still open
NetApp,02/05/2023,"Seagate Technology Holdings PLC stock falls Friday, underperforms market",still open
NetApp,02/05/2023,NetApp : Building a solid data foundation for life sciences,still open
NetApp,02/05/2023,"NETAPP, INC. : Costs Associated with Exit or Disposal Activities, Regulation FD Disclosure, Financial Statements and Exhibits (form 8-K)",still open
NetApp,02/05/2023,NetApp : Sustainable on the automotive data highway,still open
NetApp,02/05/2023,"Look for More Upside in These 2 Stocks, Even Against a ...",still open
NetApp,02/05/2023,Is NetApp Stock a Buy Now?,still open
NetApp,02/05/2023,NetApp: Value Stock Or Value Trap? (NASDAQ:NTAP),still open
NetApp,02/05/2023,"Stock Market News: Nasdaq's best January in 22 years, PayPal ...",still open
NetApp,02/05/2023,"Despite A Rise In Sales, Here’s Why NetApp Stock Has Underperformed The S&P",still open
NetApp,02/05/2023,"What Is NetApp, Inc.'s (NASDAQ:NTAP) Share Price Doing?",still open
NetApp,02/05/2023,NetApp : Provision and manage Elastigroup with the new AWS Quickstart Guide,still open
NetApp,02/05/2023,NetApp stock falls more than 10% after fiscal 2023 guidance disappoints,still open
NetApp,02/05/2023,"Is NetApp Stock A Buy After Earnings? No, Earnings Didn't Move ...",still open
NetApp,02/05/2023,"At US$66.56, Is NetApp, Inc. (NASDAQ:NTAP) Worth Looking At Closely?",still open
NetApp,02/05/2023,NetApp Insiders Lose Out As Stock Sinks To US$60.32,still open
NetApp,02/05/2023,"NTAP Stock Forecast, Price & News (NetApp)",still open
NetApp,02/05/2023,"NetApp, which has big RTP campus, is cutting 8% of workforce; PayPal cutting 2,000 jobs",still open
NetApp,02/05/2023,NetApp (NTAP) Down 14% Since Last Earnings Report: Can It Rebound?,still open
NetApp,02/05/2023,NetApp shares nudge upward even as Morgan Stanley cuts rating,still open
NetApp,02/05/2023,Should Value Investors Consider NetApp (NTAP) Stock Now?,still open
NetApp,02/05/2023,"NetApp Inc. stock falls Monday, underperforms market",still open
NetApp,02/05/2023,Why NetApp (NTAP) is a Top Value Stock for the Long-Term,still open
NetApp,02/05/2023,"6 stocks to watch on Wednesday: NetApp, HP Enterprise, Fisker and ...",still open
NetApp,02/05/2023,Top 5 4th Quarter Trades of MILLER HOWARD INVESTMENTS INC ...,still open
NetApp,02/05/2023,NetApp (NTAP) Stock Could Hit $110: Analyst,still open
NetApp,02/05/2023,NetApp (NASDAQ:NTAP) Is Paying Out A Dividend Of $0.50,still open
NetApp,02/05/2023,NetApp Applauded by Frost & Sullivan for Addressing Complex and Constantly Evolving Healthcare and Life Sciences Challenges With Its Cloud Services,still open
NetApp,02/05/2023,NetApp Inc. stock outperforms market on strong trading day,still open
NetApp,02/05/2023,NetApp CFO buys shares worth $360K,still open
NetApp,02/05/2023,NetApp (NTAP) Stock: $105 Target And Outperform Rating,still open
NetApp,02/05/2023,"Stocks to Watch: Horizon Therapeutics, Workday, NetApp, Crowdstrike, Wayfair",still open
NetApp,02/05/2023,NetApp Inc. stock underperforms Tuesday when compared to competitors,still open
NetApp,02/05/2023,"﻿Video Surveillance Storage Market Statistical Forecast, Trade ...",still open
NetApp,02/05/2023,NetApp Inc. stock underperforms Monday when compared to competitors,still open
NetApp,02/05/2023,"Beware a valuation squeeze in tech stocks, strategist warns",still open
NetApp,02/05/2023,"Piezo Positioners Market Size, Development Data, Growth Analysis ...",still open
NetApp,02/05/2023,"Stocks making the biggest moves after hours: Workday, CrowdStrike, Horizon Therapeutics and more",still open
NetApp,02/05/2023,HPE and NetApp deliver mixed financial results,still open
NetApp,02/05/2023,"Robinhood, NetApp And These 2 Other Stocks Insiders Are Selling",still open
NetApp,02/05/2023,NetApp shares rise on earnings beat and strong outlook,still open
NetApp,02/05/2023,"Zacks Industry Outlook Highlights NetApp, Pure Storage and Super ...",still open
NetApp,02/05/2023,"JP Morgan upgrades Ciena, downgrades NetApp, Lumentum on ...",still open
NetApp,02/05/2023,Cloud Storage Gateways Market Booming Worldwide With Leading ...,still open
NetApp,02/05/2023,"CrowdStrike, NetApp, SentinelOne among premarket losers' pack",still open
NetApp,02/05/2023,"NetApp, CrowdStrike And Some Other Big Stocks Moving Lower In Today’s Pre-Market Session - Aspen Aerogels",still open
NetApp,02/05/2023,"Northland Capital Management Reacts to NetApp, Inc.'s Q4 2023 ...",still open
NetApp,02/05/2023,Okta and Miro cut staff amid biggest tech layoffs in two decades,still open
NetApp,02/05/2023,NetApp and Pure Storage deliver solid results on a strong day for ...,still open
NetApp,02/05/2023,These 4 Measures Indicate That NetApp (NASDAQ:NTAP) Is Using Debt Reasonably Well,still open
NetApp,02/05/2023,"After Its Recent Underperformance, How Likely Is A Turnaround In NetApp Stock?",still open
NetApp,02/05/2023,Database Management Software Market 2022 Segments Analysis ...,still open
NetApp,02/05/2023,NetApp (NTAP) Earnings Expected to Grow: What to Know Ahead of ...,still open
NetApp,02/05/2023,Cloud Infrastructure Components Market Size & Analysis By 2022 ...,still open
NetApp,02/05/2023,NetApp bucks trend for all-flash array revenues – Blocks and Files,still open
NetApp,02/05/2023,S&P 500 ends 3-day losing streak. Dow jumps 700 points after Powell signals smaller rate hikes,still open
NetApp,02/05/2023,Dark Clouds Are Gathering For Cloud Stocks,still open
NetApp,02/05/2023,NetApp and VMware Strengthen Global Partnership to Help ...,still open
NetApp,02/05/2023,"NetApp delivers solid earnings, but mixed guidance sends stock ...",still open
NetApp,02/05/2023,NetApp Slides After BofA Downgrade,still open
NetApp,02/05/2023,Cloud Network Infrastructure Industry is Expected to Reach $8 ...,still open
NetApp,02/05/2023,Announcing NetApp BlueXP: The Unified Data Experience for the ...,still open
NetApp,02/05/2023,"Stocks making the biggest moves after hours: Snowflake, Nvidia, Salesforce and more",still open
NetApp,02/05/2023,"NetApp earnings beat, Revenue misses in Q2",still open
NetApp,02/05/2023,NetApp acquires Instaclustr to deliver open source databases as a service,still open
NetApp,02/05/2023,NetApp Inc. (NTAP) is lower by 1.75% Monday In Premarket Trading,still open
NetApp,02/05/2023,"Despite 10% Rise In The Past Week, NetApp Stock Still Looks Like A Buy",still open
NetApp,02/05/2023,Top 10 Losers Today,still open
NetApp,02/05/2023,NetApp Historically Favors Upside Trade in Wake of Earnings-Driven After-Hours Moves,still open
NetApp,02/05/2023,"Disk Storage System Market Size, Development Data, Growth ...",still open
NetApp,02/05/2023,15 Stocks That Members of Congress Own,still open
NetApp,02/05/2023,NetApp's (NASDAQ:NTAP) 12% CAGR outpaced the company's ...,still open
NetApp,02/05/2023,"NetApp’s cloud-based Spot PC: Right solution, right direction, wrong company",still open
NetApp,02/05/2023,"NetApp appoints Ritesh Doshi as director commercial for India, SAARC",still open
NetApp,02/05/2023,5 Best Small and Mid-Cap Dividend Stocks to Buy Now,still open
NetApp,02/05/2023,"NetApp Opens New International Headquarters in Cork, Ireland to ...",still open
NetApp,02/05/2023,Should You Buy NetApp Inc. (NTAP) Stock Monday?,still open
NetApp,02/05/2023,Top Wall Street analysts say these are the best stocks to beat the volatile market,still open
