Name,Data,News,Evaluation
Vulcan Materials,02/10/2023,Global Nano-enabled Batteries Strategic Business Report 2023 ...,still open
Vulcan Materials,02/10/2023,Vulcan Materials acquires California producer,still open
Vulcan Materials,02/10/2023,"Solid Construction Activity Aid Vulcan (VMC), Inflation High",still open
Vulcan Materials,02/10/2023,Moody's assigns a P-2 rating to Vulcan's New CP program and Baa2 ...,still open
Vulcan Materials,02/10/2023,VULCAN REPORTS FOURTH QUARTER AND FULL YEAR 2021 ...,still open
Vulcan Materials,02/10/2023,COBA Students Win at 'The Yard',still open
Vulcan Materials,02/10/2023,Vulcan Materials Company is 'ideal for an inflationary environment',still open
Vulcan Materials,02/10/2023,"In Belize, a proposed limestone mine threatens conservation legacy ...",still open
Vulcan Materials,02/10/2023,Vulcan Materials Unfazed By Scrutiny Over Rock Quarry,still open
Vulcan Materials,02/10/2023,VMC: Does Vulcan Materials Deserve a Place in Your Portfolio?,still open
Vulcan Materials,02/10/2023,Vulcan Materials Company (Holdi - Consensus Indicates Potential ...,still open
Vulcan Materials,02/10/2023,Mexico seeks to settle $1.1 bln Vulcan suit over limestone mine ...,still open
Vulcan Materials,02/10/2023,Umicore to source nickel from Terrafame,still open
Vulcan Materials,02/10/2023,"FACT SHEET: Biden-Harris Administration Rallies States, Cities ...",still open
Vulcan Materials,02/10/2023,Vulcan's Scholar Athlete of the Week,still open
Vulcan Materials,02/10/2023,Vulcan Materials Stock: No Fundamental Basis For The High Price,still open
Vulcan Materials,02/10/2023,First Horizon Advisors Inc. Has $807000 Stock Holdings in Vulcan ...,still open
Vulcan Materials,02/10/2023,"Vulcan Materials Co. stock falls Thursday, still outperforms market",still open
Vulcan Materials,02/10/2023,Vulcan Materials (VMC) Reports Next Week: Wall Street Expects ...,still open
Vulcan Materials,02/10/2023,Cullen Frost Bankers Inc. Has $195000 Position in Vulcan Materials ...,still open
Vulcan Materials,02/10/2023,AE Wealth Management LLC Sells 41164 Shares of Vulcan ...,still open
Vulcan Materials,02/10/2023,Research Analysts Set Expectations for Vulcan Materials' Q4 2023 ...,still open
Vulcan Materials,02/10/2023,BlackRock Increases Position in Vulcan Materials (VMC),still open
Vulcan Materials,02/10/2023,"Vulcan Materials Co. stock rises Monday, still underperforms market",still open
Vulcan Materials,02/10/2023,"Vulcan Materials Co. stock falls Thursday, underperforms market",still open
Vulcan Materials,02/10/2023,"Vulcan Materials Co. stock rises Wednesday, outperforms market",still open
Vulcan Materials,02/10/2023,Martin Marietta (MLM) to Report Q4 Earnings: What's in Store?,still open
Vulcan Materials,02/10/2023,Great West Life Assurance Co. Can Cuts Stock Position in Vulcan ...,still open
Vulcan Materials,02/10/2023,Does TransDigm Group Incorporated (TDG) Have Strong Growth Ahead?,still open
Vulcan Materials,02/10/2023,We're Adding to This Holding as Construction Spending Is on the Rise,still open
Vulcan Materials,02/10/2023,Our Stocks Could Get a Biden Bump - Action Alerts PLUS,still open
Vulcan Materials,02/10/2023,We're Trimming One Stock as We Add to Another,still open
Vulcan Materials,02/10/2023,2 Concrete & Aggregates Stocks to Watch Amid Industry Headwinds,still open
Vulcan Materials,02/10/2023,"NICHOLAS COMPANY, INC. Buys 1, Sells 4 in 4th Quarter",still open
Vulcan Materials,02/10/2023,S&P 500 sinks as investors debate the Fed’s next move,still open
Vulcan Materials,02/10/2023,"RBC Upgrades Vulcan Materials to Outperform From Sector Perform, Boosts PT to $191 From $170, Expects 'Ramping Infrastructure Tailwinds'",still open
Vulcan Materials,02/10/2023,"S&P 500 Stocks: With A $1 Trillion Government Tailwind, Can These ...",still open
Vulcan Materials,02/10/2023,5 Best Infrastructure Stocks to Buy,still open
Vulcan Materials,02/10/2023,What Makes Vulcan Materials Company (VMC) an Attractive Stock?,still open
Vulcan Materials,02/10/2023,"Cheers! Spirits like gin, vodka, overtake beer's U.S. market share",still open
Vulcan Materials,02/10/2023,Vulcan Materials Stock Is A Solid Pick In Building Materials,still open
Vulcan Materials,02/10/2023,"Raymond James Maintains Outperform on Vulcan Materials, Raises ...",still open
Vulcan Materials,02/10/2023,One Vulcan Materials Company (NYSE:VMC) insider reduced their stake by 30% in the previous year,still open
Vulcan Materials,02/10/2023,Does Vulcan Materials Company (VMC) have Pricing Power?,still open
Vulcan Materials,02/10/2023,Vulcan Materials: Solid Growth Prospects (NYSE:VMC),still open
Vulcan Materials,02/10/2023,Should You Buy Vulcan Materials Company (NYSE:VMC) For Its Upcoming Dividend?,still open
Vulcan Materials,02/10/2023,"Vulcan Materials Third Quarter 2022 Earnings: Revenues Beat Expectations, EPS Lags",still open
Vulcan Materials,02/10/2023,"Heirloom, CarbonCure Technologies and Central Concrete Achieve ...",still open
Vulcan Materials,02/10/2023,"JPMorgan upgrades this materials stock, says it can weather ...",still open
Vulcan Materials,02/10/2023,Vulcan Materials (VMC) Tops Q3 Earnings and Revenue Estimates,still open
Vulcan Materials,02/10/2023,"Vulcan Materials Co. stock rises Tuesday, outperforms market",still open
Vulcan Materials,02/10/2023,Vulcan Materials Company (VMC) Q3 2022 Earnings Call Transcript,still open
Vulcan Materials,02/10/2023,Vulcan Materials: Performance Looks Mixed Going Forward (NYSE ...,still open
Vulcan Materials,02/10/2023,Vulcan Materials (NYSE:VMC) Seems To Use Debt Quite Sensibly,still open
Vulcan Materials,02/10/2023,VMC: Does Vulcan Materials Deserve a Place in Your Portfolio?,still open
Vulcan Materials,02/10/2023,Vulcan Materials Company is 'ideal for an inflationary environment',still open
Vulcan Materials,02/10/2023,4 Concrete & Aggregates Stocks to Watch Amid Industry Headwinds,still open
Vulcan Materials,02/10/2023,VULCAN REPORTS SECOND QUARTER 2022 RESULTS,still open
Vulcan Materials,02/10/2023,11 Best Cement and Construction Materials Stocks To Buy Now,still open
Vulcan Materials,02/10/2023,Vulcan Materials warns Mexican government could revoke ...,still open
Vulcan Materials,02/10/2023,Vulcan Materials' Mexican mining unit ordered shut by authorities ...,still open
Vulcan Materials,02/10/2023,7 Stocks to Buy as Infrastructure Spending Starts to Boom,still open
Vulcan Materials,02/10/2023,2 Stocks You'll Want to Own in 2023,still open
Vulcan Materials,02/10/2023,VULCAN MATERIALS TO OUTLINE NEW GROWTH AND ...,still open
Vulcan Materials,02/10/2023,Summit Materials: Good Growth Prospects At A Discount Valuation ...,still open
Vulcan Materials,02/10/2023,VULCAN MATERIALS COMPANY ELECTS NEW DIRECTOR,still open
Vulcan Materials,02/10/2023,Eagle Materials (EXP) Q2 Earnings and Revenues Top Estimates,still open
Vulcan Materials,02/10/2023,10 Best Infrastructure Stocks To Buy Now,still open
Vulcan Materials,02/10/2023,"Infrastructure Deal: Martin Marietta, Vulcan Materials Lead 5 Stocks ...",still open
Vulcan Materials,02/10/2023,10 Best Home Builder Stocks To Buy Now,still open
Vulcan Materials,02/10/2023,Solid Construction Activity Aids Vulcan (VMC) Amid Inflation,still open
Vulcan Materials,02/10/2023,Warning! Keep These 7 Dividend Stocks Out of Your Retirement ...,still open
Vulcan Materials,02/10/2023,Vulcan Materials Declined To Its 200-Day Simple Moving Average On Weak Earnings,still open
Vulcan Materials,02/10/2023,Eagle Materials Stock: Good Value For Long-Term Investors (NYSE ...,still open
Vulcan Materials,02/10/2023,Is Vulcan Materials Company (VMC) A Good Stock To Buy?,still open
Vulcan Materials,02/10/2023,U.S. Concrete stock surges after Vulcan Materials buyout deal valued at $1.29 billion,still open
Vulcan Materials,02/10/2023,"Martin Marietta Materials Inc. stock rises Monday, still underperforms market",still open
Vulcan Materials,02/10/2023,"We're Booting This Stock Back to the Bullpen, Adding to Two More",still open
Vulcan Materials,02/10/2023,Soros Fund Management takes new positions in Sierra Wireless ...,still open
Vulcan Materials,02/10/2023,"Martin Marietta Materials Inc. stock rises Tuesday, outperforms market",still open
Vulcan Materials,02/10/2023,Phoenix aggregate drivers end strike against Vulcan Materials,still open
Vulcan Materials,02/10/2023,"VMC Stock Forecast, Price & News (Vulcan Materials)",still open
Vulcan Materials,02/10/2023,"Vulcan Materials Stock (NYSE:VMC), Quotes and News Summary",still open
Vulcan Materials,02/10/2023,Vulcan Materials Company (Holding Company) (VMC) Stock Price ...,still open
Vulcan Materials,02/10/2023,Martin Marietta Materials Inc. stock underperforms Wednesday when compared to competitors,still open
Vulcan Materials,02/10/2023,Vulcan Completes Acquisition Of U.S. Concrete,still open
Vulcan Materials,02/10/2023,What's going on with the Vulcan share price today?,still open
Vulcan Materials,02/10/2023,ARIZONA VULCAN MATERIALS TEAMSTERS VOTE TO ...,still open
Vulcan Materials,02/10/2023,VULCAN REPORTS FIRST QUARTER 2022 RESULTS,still open
Vulcan Materials,02/10/2023,VULCAN PROVIDES UPDATE ON MEXICO OPERATIONS,still open
Vulcan Materials,02/10/2023,Vulcan Materials Co.: Set To Benefit From Economic Stimulus And ...,still open
Vulcan Materials,02/10/2023,Is Eagle Materials Stock A Suitable Foundation On Which To Build ...,still open
Vulcan Materials,02/10/2023,CRH: Vulcan Materials vs. CRH: Which Infrastructure Stock is a ...,still open
Vulcan Materials,02/10/2023,Is Vulcan Materials Company (VMC) the Top Pick in the Building Materials Industry?,still open
Vulcan Materials,02/10/2023,Moody's assigns a P-2 rating to Vulcan's New CP program and Baa2 ...,still open
Vulcan Materials,02/10/2023,"This Insider Has Just Sold Shares In Martin Marietta Materials, Inc. (NYSE:MLM)",still open
Vulcan Materials,02/10/2023,"Vulcan, Caterpillar stocks surge as infrastructure bill's passage gives big boost to materials makers",still open
Vulcan Materials,02/10/2023,Martin Marietta (MLM) to Sell Ready Mixed Concrete Operations,still open
Vulcan Materials,02/10/2023,Vulcan Materials consummates U.S. Concrete deal – Concrete ...,still open
Vulcan Materials,02/10/2023,VULCAN REPORTS FOURTH QUARTER AND FULL YEAR 2021 ...,still open
Vulcan Materials,02/10/2023,"Summit Materials Third Quarter 2022 Earnings: Revenues Beat Expectations, EPS Lags",still open
Vulcan Materials,02/10/2023,13 Best Infrastructure Stocks for America's Big Building Spend,still open
Vulcan Materials,02/10/2023,Vulcan Materials Company (NYSE:VMC) Is Going Strong But Fundamentals Appear To Be Mixed : Is There A Clear Direction For The Stock?,still open
Vulcan Materials,02/10/2023,"Owens Corning Leads 5 Construction and Materials Stocks, as Vulcan Materials Lags",still open
Vulcan Materials,02/10/2023,Mining Companies Benefit From the Widespread Utilizations of ...,still open
Vulcan Materials,02/10/2023,"5 infrastructure stocks to buy now that Biden's bill has been passed, according to Jefferies",still open
Vulcan Materials,02/10/2023,Vulcan Materials (NYSE: VMC): The Construction Company That's ...,still open
Vulcan Materials,02/10/2023,"Global Ready-Mix Concrete Market Report to 2030 - Players Include Holcim, SIKA, UltraTech Cement, Vicat and Vulcan Materials",still open
Vulcan Materials,02/10/2023,"Construction, Concrete and Asphalt Prices Keep Going Up: Stocks ...",still open
Vulcan Materials,02/10/2023,3 Potential Winning Stocks from Biden's Infrastructure Plan,still open
Vulcan Materials,02/10/2023,Transportation Secretary Elaine Chao Sells Stock in Highway Supply Company,still open
Vulcan Materials,02/11/2023,Seaport Global Initiates Coverage of Vulcan Materials (VMC) with ...,still open
Vulcan Materials,02/11/2023,"Vulcan Materials Co. stock falls Friday, underperforms market",still open
Vulcan Materials,02/11/2023,Is Vulcan Materials (NYSE:VMC) A Risky Investment?,still open
Vulcan Materials,02/11/2023,Vulcan Materials raises quarterly dividend by 7.5% to $0.43/share ...,still open
Vulcan Materials,02/11/2023,Vulcan Materials Stock: No Fundamental Basis For The High Price,still open
Vulcan Materials,02/11/2023,First Horizon Advisors Inc. Has $807000 Stock Holdings in Vulcan ...,still open
Vulcan Materials,02/11/2023,Vulcan Materials (VMC) Reports Next Week: Wall Street Expects ...,still open
Vulcan Materials,02/11/2023,BlackRock Increases Position in Vulcan Materials (VMC),still open
Vulcan Materials,02/11/2023,"Vulcan Materials Co. stock rises Thursday, outperforms market",still open
Vulcan Materials,02/11/2023,"Vulcan Materials Co. stock rises Monday, still underperforms market",still open
Vulcan Materials,02/11/2023,"Vulcan Materials Co. stock falls Thursday, underperforms market",still open
Vulcan Materials,02/11/2023,Is Vulcan Materials Company (VMC) a Good Buy in the Building Materials Industry?,still open
Vulcan Materials,02/11/2023,"‘Catastrophic failure’ caused quarry blast felt throughout Franklin, fire marshal says",still open
Vulcan Materials,02/11/2023,Martin Marietta (MLM) to Report Q4 Earnings: What's in Store?,still open
Vulcan Materials,02/11/2023,Analyst Expectations for Vulcan Materials's Future - Vulcan Materials (NYSE:VMC),still open
Vulcan Materials,02/11/2023,Concrete traps CO2 soaked from air in climate-friendly test,still open
Vulcan Materials,02/11/2023,Governor Cooper Announces Appointments and Nominations to ...,still open
Vulcan Materials,02/11/2023,Research Analysts Set Expectations for Vulcan Materials' Q4 2023 ...,still open
Vulcan Materials,02/11/2023,We're Adding to This Holding as Construction Spending Is on the Rise,still open
Vulcan Materials,02/11/2023,Great West Life Assurance Co. Can Cuts Stock Position in Vulcan ...,still open
Vulcan Materials,02/11/2023,S&P 500 sinks as investors debate the Fed’s next move,still open
Vulcan Materials,02/11/2023,Black Tie Affair Hosts Hatcher Family Honors,still open
Vulcan Materials,02/11/2023,Our Stocks Could Get a Biden Bump - Action Alerts PLUS,still open
Vulcan Materials,02/11/2023,VULCAN ANNOUNCES FOURTH QUARTER AND FULL YEAR ...,still open
Vulcan Materials,02/11/2023,Is Applied Materials (AMAT) a Worthy Long-Term Stock?,still open
Vulcan Materials,02/11/2023,2 Concrete & Aggregates Stocks to Watch Amid Industry Headwinds,still open
Vulcan Materials,02/11/2023,Freeport-McMoRan Announces Appointment of Kathleen L. Quirk to its Board of Directors,still open
Vulcan Materials,02/11/2023,Lightweight Construction Material Market Predictable To Exceed ...,still open
Vulcan Materials,02/11/2023,"Cheers! Spirits like gin, vodka, overtake beer's U.S. market share",still open
Vulcan Materials,02/11/2023,"Atlantic Equities Downgrades Vulcan Materials to Neutral, Raises ...",still open
Vulcan Materials,02/11/2023,Wachtell: How big & powerful is the US law firm Adani Group has hired to fight Hindenburg,still open
Vulcan Materials,02/11/2023,Driver patience urged as Leighton Avenue resurfacing begins this ...,still open
Vulcan Materials,02/11/2023,Eagle Materials (EXP) Matches Q3 Earnings Estimates,still open
Vulcan Materials,02/11/2023,We're Trimming One Stock as We Add to Another,still open
Vulcan Materials,02/11/2023,"Stellantis, Vulcan Energy to develop renewable energy assets in ...",still open
Vulcan Materials,02/11/2023,VMC Dividend Announcement $0.4300/Share 2/10/2023,still open
Vulcan Materials,02/11/2023,Oil Prices are Up as Russia Announces Plans to Reduce Oil Production,still open
Vulcan Materials,02/11/2023,"NICHOLAS COMPANY, INC. Buys 1, Sells 4 in 4th Quarter",still open
Vulcan Materials,02/11/2023,"Remembering Ann Korologos, a Renaissance woman",still open
Vulcan Materials,02/11/2023,Drifting Toward Disaster: Breaking the Brazos,still open
Vulcan Materials,02/11/2023,"Stock Market Week: Gold, Lithium, Steel, And Deere, Medpace ...",still open
Vulcan Materials,02/11/2023,"Kelly Thompson Obituary (1949 - 2023) - Homewood, AL - The ...",still open
Vulcan Materials,02/11/2023,Roadway Activity Report for parts of East and Middle Tennessee ...,still open
Vulcan Materials,02/11/2023,5 Best Infrastructure Stocks to Buy,still open
Vulcan Materials,02/11/2023,"S&P 500 Stocks: With A $1 Trillion Government Tailwind, Can These ...",still open
Vulcan Materials,02/11/2023,Expanding the hive,still open
Vulcan Materials,02/11/2023,Global Cement Market to Reach 14.2 Billion Tons by 2030,still open
Vulcan Materials,02/11/2023,Vulcan Materials: Solid Growth Prospects (NYSE:VMC),still open
Vulcan Materials,02/11/2023,VULCAN REPORTS THIRD QUARTER 2022 RESULTS,still open
Vulcan Materials,02/11/2023,Which Lithium Juniors Have Supply Deals With EV Makers?,still open
Vulcan Materials,02/11/2023,Worker dies following incident at Vulcan quarry,still open
Vulcan Materials,02/11/2023,VULCAN MATERIALS TO OUTLINE NEW GROWTH AND ...,still open
Vulcan Materials,02/11/2023,Oil Prices Rise on Supply Shortages After Earthquake in Turkey Causes Major Export Terminal Shutdown,still open
Vulcan Materials,02/11/2023,Vulcan Materials: Performance Looks Mixed Going Forward (NYSE ...,still open
Vulcan Materials,02/11/2023,One Vulcan Materials Company (NYSE:VMC) insider reduced their stake by 30% in the previous year,still open
Vulcan Materials,02/11/2023,Arizona Vulcan Materials Teamsters Vote to Authorize Strike,still open
Vulcan Materials,02/11/2023,Phoenix aggregate drivers end strike against Vulcan Materials,still open
Vulcan Materials,02/11/2023,Vulcan Materials Company (VMC) Q3 2022 Earnings Call Transcript,still open
Vulcan Materials,02/11/2023,Is Vulcan Materials Company (VMC) an Attractive Investment?,still open
Vulcan Materials,02/11/2023,US fighter jet shoots down suspected Chinese spy balloon,still open
Vulcan Materials,02/11/2023,VULCAN REPORTS SECOND QUARTER 2022 RESULTS,still open
Vulcan Materials,02/11/2023,VULCAN MATERIALS COMPANY ELECTS NEW DIRECTOR,still open
Vulcan Materials,02/11/2023,Hill Country residents opposed to Vulcan Quarry request rehearing,still open
Vulcan Materials,02/11/2023,Here’s Why Amazon.com (AMZN) Detracted in Q4,still open
Vulcan Materials,02/11/2023,Does Vulcan Materials Company (VMC) have Pricing Power?,still open
Vulcan Materials,02/11/2023,Surge in Severe Strep Cases in Kids Was Really a Return to Normal ...,still open
Vulcan Materials,02/11/2023,Fitch Rates Vulcan Materials' S-T IDR and Commercial Paper Rating ...,still open
Vulcan Materials,02/11/2023,PR News | Vulcan Materials Alum Signs with Summit Strategy - Wed ...,still open
Vulcan Materials,02/11/2023,"Vulcan Materials Co. talks mergers, acquisitions and federal funding ...",still open
Vulcan Materials,02/11/2023,Update on Vulcan's Mexico Operations,still open
Vulcan Materials,02/11/2023,Fitch Affirms Vulcan Materials' IDR at 'BBB'; Outlook Stable,still open
Vulcan Materials,02/11/2023,Vulcan Quarry opponents in Comal County request rehearing on air ...,still open
Vulcan Materials,02/11/2023,VULCAN PROVIDES UPDATE ON MEXICO OPERATIONS,still open
Vulcan Materials,02/11/2023,Vulcan Materials (NYSE:VMC) Seems To Use Debt Quite Sensibly,still open
Vulcan Materials,02/11/2023,Court ruling restores air permit for Vulcan's proposed quarry in ...,still open
Vulcan Materials,02/11/2023,Vulcan Materials' Mexican mining unit ordered shut by authorities ...,still open
Vulcan Materials,02/11/2023,Vulcan Materials Stock Is A Solid Pick In Building Materials,still open
Vulcan Materials,02/11/2023,"Building Material Market 2023 by Top Key Players, Types, Applications and Future Forecast to 2030",still open
Vulcan Materials,02/11/2023,"Vulcan Materials Co. stock rises Tuesday, outperforms market",still open
Vulcan Materials,02/11/2023,Forecast: Europe Could End Reliance On Chinese Li-ion Battery Cells By 2027,still open
Vulcan Materials,02/11/2023,Area near Vulcan Materials in Rabun Gap evacuated after truck with ...,still open
Vulcan Materials,02/11/2023,Vulcan Materials Co. creeping into Belize?,still open
Vulcan Materials,02/11/2023,VULCAN REPORTS FIRST QUARTER 2022 RESULTS,still open
Vulcan Materials,02/11/2023,Mexico prepared to sue U.S. firm Vulcan over environmental issues ...,still open
Vulcan Materials,02/11/2023,Should You Buy Vulcan Materials Company (NYSE:VMC) For Its Upcoming Dividend?,still open
Vulcan Materials,02/11/2023,Vulcan Materials acquires California producer,still open
Vulcan Materials,02/11/2023,Moody's assigns a P-2 rating to Vulcan's New CP program and Baa2 ...,still open
Vulcan Materials,02/11/2023,VULCAN REPORTS FOURTH QUARTER AND FULL YEAR 2021 ...,still open
Vulcan Materials,02/11/2023,COBA Students Win at 'The Yard',still open
Vulcan Materials,02/11/2023,Vulcan Materials Company is 'ideal for an inflationary environment',still open
Vulcan Materials,02/11/2023,"In Belize, a proposed limestone mine threatens conservation legacy ...",still open
Vulcan Materials,02/11/2023,Vulcan Materials Unfazed By Scrutiny Over Rock Quarry,still open
Vulcan Materials,02/11/2023,VMC: Does Vulcan Materials Deserve a Place in Your Portfolio?,still open
Vulcan Materials,02/11/2023,"High Temperature Sensors Market Size, Development Data, Growth ...",still open
Vulcan Materials,02/11/2023,Vulcan Materials Company (Holdi - Consensus Indicates Potential ...,still open
Vulcan Materials,02/11/2023,Global Nano-enabled Batteries Strategic Business Report 2023 ...,still open
Vulcan Materials,02/11/2023,Cape Ann news in brief | Community | gloucestertimes.com,still open
Vulcan Materials,02/11/2023,"FACT SHEET: Biden-Harris Administration Rallies States, Cities ...",still open
Vulcan Materials,02/11/2023,Vulcan Materials Stock: No Fundamental Basis For The High Price,still open
Vulcan Materials,02/11/2023,"Vulcan Materials Co. stock falls Friday, underperforms market",still open
Vulcan Materials,02/11/2023,First Horizon Advisors Inc. Has $807000 Stock Holdings in Vulcan ...,still open
Vulcan Materials,02/11/2023,VULCAN INCREASES QUARTERLY DIVIDEND ON COMMON ...,still open
Vulcan Materials,02/11/2023,Vulcan Materials (VMC) Reports Next Week: Wall Street Expects ...,still open
Vulcan Materials,02/11/2023,AE Wealth Management LLC Sells 41164 Shares of Vulcan ...,still open
Vulcan Materials,02/11/2023,"Vulcan Materials Co. stock rises Thursday, outperforms market",still open
Vulcan Materials,02/11/2023,Research Analysts Set Expectations for Vulcan Materials' Q4 2023 ...,still open
Vulcan Materials,02/11/2023,BlackRock Increases Position in Vulcan Materials (VMC),still open
Vulcan Materials,02/11/2023,"Vulcan Materials Co. stock rises Monday, still underperforms market",still open
Vulcan Materials,02/11/2023,"Vulcan Materials Co. stock falls Thursday, underperforms market",still open
Vulcan Materials,02/11/2023,Great West Life Assurance Co. Can Cuts Stock Position in Vulcan ...,still open
Vulcan Materials,02/11/2023,We're Adding to This Holding as Construction Spending Is on the Rise,still open
Vulcan Materials,02/11/2023,Martin Marietta (MLM) to Report Q4 Earnings: What's in Store?,still open
Vulcan Materials,02/11/2023,We're Trimming One Stock as We Add to Another,still open
Vulcan Materials,02/11/2023,2 Concrete & Aggregates Stocks to Watch Amid Industry Headwinds,still open
Vulcan Materials,02/11/2023,Our Stocks Could Get a Biden Bump - Action Alerts PLUS,still open
Vulcan Materials,02/11/2023,"Stock Market Week: Gold, Lithium, Steel, And Deere, Medpace ...",still open
Vulcan Materials,02/11/2023,Analyst Expectations for Vulcan Materials's Future - Vulcan Materials (NYSE:VMC),still open
Vulcan Materials,02/11/2023,"NICHOLAS COMPANY, INC. Buys 1, Sells 4 in 4th Quarter",still open
Vulcan Materials,02/11/2023,S&P 500 sinks as investors debate the Fed’s next move,still open
Vulcan Materials,02/11/2023,"S&P 500 Stocks: With A $1 Trillion Government Tailwind, Can These ...",still open
Vulcan Materials,02/11/2023,Here’s Why Amazon.com (AMZN) Detracted in Q4,still open
Vulcan Materials,02/11/2023,5 Best Infrastructure Stocks to Buy,still open
Vulcan Materials,02/11/2023,Oil Prices are Up as Russia Announces Plans to Reduce Oil Production,still open
Vulcan Materials,02/11/2023,What Makes Vulcan Materials Company (VMC) an Attractive Stock?,still open
Vulcan Materials,02/11/2023,Wachtell: How big & powerful is the US law firm Adani Group has hired to fight Hindenburg,still open
Vulcan Materials,02/11/2023,Vulcan Materials Stock Is A Solid Pick In Building Materials,still open
Vulcan Materials,02/11/2023,VMC Dividend Announcement $0.4300/Share 2/10/2023,still open
Vulcan Materials,02/11/2023,"Atlantic Equities Downgrades Vulcan Materials to Neutral, Raises ...",still open
Vulcan Materials,02/11/2023,One Vulcan Materials Company (NYSE:VMC) insider reduced their stake by 30% in the previous year,still open
Vulcan Materials,02/11/2023,Freeport-McMoRan Announces Appointment of Kathleen L. Quirk to its Board of Directors,still open
Vulcan Materials,02/11/2023,"Cheers! Spirits like gin, vodka, overtake beer's U.S. market share",still open
Vulcan Materials,02/11/2023,Does Vulcan Materials Company (VMC) have Pricing Power?,still open
Vulcan Materials,02/11/2023,"Heirloom, CarbonCure Technologies and Central Concrete Achieve ...",still open
Vulcan Materials,02/11/2023,Vulcan Materials: Solid Growth Prospects (NYSE:VMC),still open
Vulcan Materials,02/11/2023,Oil Prices Rise on Supply Shortages After Earthquake in Turkey Causes Major Export Terminal Shutdown,still open
Vulcan Materials,02/11/2023,Should You Buy Vulcan Materials Company (NYSE:VMC) For Its Upcoming Dividend?,still open
Vulcan Materials,02/11/2023,"Vulcan Materials Third Quarter 2022 Earnings: Revenues Beat Expectations, EPS Lags",still open
Vulcan Materials,02/11/2023,"JPMorgan upgrades this materials stock, says it can weather ...",still open
