Name,Data,News,Evaluation
Vulcan Materials,02/13/2023,How the price action of Vulcan Materials (VMC) is used to our ...,still open
Vulcan Materials,02/13/2023,Vulcan Materials Company (Holding Company) (VMC) Stock Price ...,still open
Vulcan Materials,02/13/2023,"VMC Stock Forecast, Price & News (Vulcan Materials)",still open
Vulcan Materials,02/13/2023,Martin Marietta Materials Inc. stock underperforms Wednesday when compared to competitors,still open
Vulcan Materials,02/13/2023,Should You Sell AngloGold Ashanti Limited (AU) Stock Friday Morning?,still open
Vulcan Materials,02/13/2023,Vulcan Completes Acquisition Of U.S. Concrete,still open
Vulcan Materials,02/13/2023,VMC Price Target 2023 | Vulcan Materials Analyst Ratings,still open
Vulcan Materials,02/13/2023,What's going on with the Vulcan share price today?,still open
Vulcan Materials,02/13/2023,ARIZONA VULCAN MATERIALS TEAMSTERS VOTE TO ...,still open
Vulcan Materials,02/13/2023,VULCAN REPORTS FIRST QUARTER 2022 RESULTS,still open
Vulcan Materials,02/13/2023,Vulcan Materials Co.: Set To Benefit From Economic Stimulus And ...,still open
Vulcan Materials,02/13/2023,Vulcan Materials buys U.S. Concrete in $1.3B deal,still open
Vulcan Materials,02/13/2023,VULCAN PROVIDES UPDATE ON MEXICO OPERATIONS,still open
Vulcan Materials,02/13/2023,Is Eagle Materials Stock A Suitable Foundation On Which To Build ...,still open
Vulcan Materials,02/13/2023,Lithium Americas Provides General Motors Transaction Details and Update on Construction Plan for Thacker Pass,still open
Vulcan Materials,02/13/2023,CRH: Vulcan Materials vs. CRH: Which Infrastructure Stock is a ...,still open
Vulcan Materials,02/13/2023,Is Vulcan Materials Company (VMC) the Top Pick in the Building Materials Industry?,still open
Vulcan Materials,02/13/2023,"Vulcan, Caterpillar stocks surge as infrastructure bill's passage gives big boost to materials makers",still open
Vulcan Materials,02/13/2023,Vulcan Materials consummates U.S. Concrete deal – Concrete ...,still open
Vulcan Materials,02/13/2023,Martin Marietta (MLM) to Sell Ready Mixed Concrete Operations,still open
Vulcan Materials,02/13/2023,Vulcan Materials (NYSE: VMC): The Construction Company That's ...,still open
Vulcan Materials,02/13/2023,13 Best Infrastructure Stocks for America's Big Building Spend,still open
Vulcan Materials,02/13/2023,VULCAN REPORTS FOURTH QUARTER AND FULL YEAR 2021 ...,still open
Vulcan Materials,02/13/2023,3 Best Infrastructure Stocks to Buy Right Now,still open
Vulcan Materials,02/13/2023,Vulcan Materials Company (NYSE:VMC) Is Going Strong But Fundamentals Appear To Be Mixed : Is There A Clear Direction For The Stock?,still open
Vulcan Materials,02/13/2023,Here's Why Eagle Materials (NYSE:EXP) Has Caught The Eye Of Investors,still open
Vulcan Materials,02/13/2023,"Owens Corning Leads 5 Construction and Materials Stocks, as Vulcan Materials Lags",still open
Vulcan Materials,02/13/2023,Mexico Seeks to Settle $1.1 Billion Vulcan Suit Over Limestone Mine ...,still open
Vulcan Materials,02/13/2023,"5 infrastructure stocks to buy now that Biden's bill has been passed, according to Jefferies",still open
Vulcan Materials,02/13/2023,Thursday's top Wall Street analyst calls including Amazon,still open
Vulcan Materials,02/13/2023,Transportation Secretary Elaine Chao Sells Stock in Highway Supply Company,still open
Vulcan Materials,02/15/2023,"Vulcan Materials Co. stock falls Tuesday, underperforms market",still open
Vulcan Materials,02/15/2023,Vulcan Materials (VMC) to Post Q4 Earnings: What to Expect?,still open
Vulcan Materials,02/15/2023,Is Vulcan Materials (NYSE:VMC) A Risky Investment?,still open
Vulcan Materials,02/15/2023,Vulcan Materials (VMC) Declares $0.43 Dividend,still open
Vulcan Materials,02/15/2023,Vulcan Materials Company Scholar Athlete of the Year,still open
Vulcan Materials,02/15/2023,Gardner Russo & Quinn LLC Sells 6480 Shares of Vulcan Materials ...,still open
Vulcan Materials,02/15/2023,BlackRock Increases Position in Vulcan Materials (VMC),still open
Vulcan Materials,02/15/2023,First Horizon Advisors Inc. Has $807000 Stock Holdings in Vulcan ...,still open
Vulcan Materials,02/15/2023,Vulcan Materials (VMC) Reports Next Week: Wall Street Expects ...,still open
Vulcan Materials,02/15/2023,"Vulcan Materials Co. stock rises Monday, still underperforms market",still open
Vulcan Materials,02/15/2023,"Vulcan Materials Co. stock rises Thursday, outperforms market",still open
Vulcan Materials,02/15/2023,"Vulcan Materials Co. stock falls Thursday, underperforms market",still open
Vulcan Materials,02/15/2023,Foundation makes largest donation to date for Forest Preserve ...,still open
Vulcan Materials,02/15/2023,Analysts Forecast Vulcan Materials' Earnings in the Fourth Quarter ...,still open
Vulcan Materials,02/15/2023,"‘Catastrophic failure’ caused quarry blast felt throughout Franklin, fire marshal says",still open
Vulcan Materials,02/15/2023,"Terrill Fort Obituary (1946 - 2023) - Homosassa, FL - Citrus County ...",still open
Vulcan Materials,02/15/2023,ECU to host spring career fairs | News Services | ECU,still open
Vulcan Materials,02/15/2023,Concrete traps CO2 soaked from air in climate-friendly test,still open
Vulcan Materials,02/15/2023,5 big dividend moves: Massive hike at Banc of California | Pro ...,still open
Vulcan Materials,02/15/2023,Vulcan to mine 60% more German lithium than planned,still open
Vulcan Materials,02/15/2023,Great West Life Assurance Co. Can Cuts Stock Position in Vulcan ...,still open
Vulcan Materials,02/15/2023,Oil Prices Down on Concerns of Short-Term Demand Ahead of Key U.S. Inflation Data,still open
Vulcan Materials,02/15/2023,Martin Marietta (MLM) to Report Q4 Earnings: What's in Store?,still open
Vulcan Materials,02/15/2023,We may be storing carbon in concrete someday,still open
Vulcan Materials,02/15/2023,VULCAN ANNOUNCES FOURTH QUARTER AND FULL YEAR ...,still open
Vulcan Materials,02/15/2023,2 Concrete & Aggregates Stocks to Watch Amid Industry Headwinds,still open
Vulcan Materials,02/15/2023,"Atlantic Equities Downgrades Vulcan Materials to Neutral, Raises ...",still open
Vulcan Materials,02/15/2023,Does TransDigm Group Incorporated (TDG) Have Strong Growth Ahead?,still open
Vulcan Materials,02/15/2023,Governor Cooper Announces Appointments and Nominations to ...,still open
Vulcan Materials,02/15/2023,Our Stocks Could Get a Biden Bump - Action Alerts PLUS,still open
Vulcan Materials,02/15/2023,Freeport-McMoRan Announces Appointment of Kathleen L. Quirk to its Board of Directors,still open
Vulcan Materials,02/15/2023,Black Tie Affair Hosts Hatcher Family Honors,still open
Vulcan Materials,02/15/2023,Driver patience urged as Leighton Avenue resurfacing begins this ...,still open
Vulcan Materials,02/15/2023,VMC Dividend Announcement $0.4300/Share 2/10/2023,still open
Vulcan Materials,02/15/2023,Is Applied Materials (AMAT) a Worthy Long-Term Stock?,still open
Vulcan Materials,02/15/2023,Oil Prices are Up as Russia Announces Plans to Reduce Oil Production,still open
Vulcan Materials,02/15/2023,S&P 500 sinks as investors debate the Fed’s next move,still open
Vulcan Materials,02/15/2023,Wachtell: How big & powerful is the US law firm Adani Group has hired to fight Hindenburg,still open
Vulcan Materials,02/15/2023,"Kelly Thompson Obituary (1949 - 2023) - Homewood, AL - The ...",still open
Vulcan Materials,02/15/2023,"Remembering Ann Korologos, a Renaissance woman",still open
Vulcan Materials,02/15/2023,Drifting Toward Disaster: Breaking the Brazos,still open
Vulcan Materials,02/15/2023,Booming Demand in the Lightweight Construction Material Market Will Drive an Exponential Increase CAGR From 20,still open
Vulcan Materials,02/15/2023,"NICHOLAS COMPANY, INC. Buys 1, Sells 4 in 4th Quarter",still open
Vulcan Materials,02/15/2023,5 Best Infrastructure Stocks to Buy,still open
Vulcan Materials,02/15/2023,Vulcan and Stellantis Explore Geothermal Energy to Supply Rüsselsheim Plant,still open
Vulcan Materials,02/15/2023,Vulcan Materials: Solid Growth Prospects (NYSE:VMC),still open
Vulcan Materials,02/15/2023,"Stock Market Week: Gold, Lithium, Steel, And Deere, Medpace ...",still open
Vulcan Materials,02/15/2023,Worker dies following incident at Vulcan quarry,still open
Vulcan Materials,02/15/2023,VULCAN MATERIALS TO OUTLINE NEW GROWTH AND ...,still open
Vulcan Materials,02/15/2023,VULCAN REPORTS THIRD QUARTER 2022 RESULTS,still open
Vulcan Materials,02/15/2023,Vulcan Materials: Performance Looks Mixed Going Forward (NYSE ...,still open
Vulcan Materials,02/15/2023,One Vulcan Materials Company (NYSE:VMC) insider reduced their stake by 30% in the previous year,still open
Vulcan Materials,02/15/2023,Arizona Vulcan Materials Teamsters Vote to Authorize Strike,still open
Vulcan Materials,02/15/2023,Major TxDOT construction projects moving forward in Lufkin District,still open
Vulcan Materials,02/15/2023,Vulcan Materials Company (VMC) Q3 2022 Earnings Call Transcript,still open
Vulcan Materials,02/15/2023,Is Vulcan Materials Company (VMC) an Attractive Investment?,still open
Vulcan Materials,02/15/2023,VULCAN REPORTS SECOND QUARTER 2022 RESULTS,still open
Vulcan Materials,02/15/2023,VULCAN MATERIALS COMPANY ELECTS NEW DIRECTOR,still open
Vulcan Materials,02/15/2023,Lakeland Industries Announces CFO Transition,still open
Vulcan Materials,02/15/2023,Hill Country residents opposed to Vulcan Quarry request rehearing,still open
Vulcan Materials,02/15/2023,The EV Revolution Could Surprisingly Benefit Vulcan Materials ...,still open
Vulcan Materials,02/15/2023,"Vulcan Materials Teamsters Celebrate Victory In Arizona, Ratify ...",still open
Vulcan Materials,02/15/2023,Oil Prices Rise on Supply Shortages After Earthquake in Turkey Causes Major Export Terminal Shutdown,still open
Vulcan Materials,02/15/2023,Fitch Rates Vulcan Materials' S-T IDR and Commercial Paper Rating ...,still open
Vulcan Materials,02/15/2023,PR News | Vulcan Materials Alum Signs with Summit Strategy - Wed ...,still open
Vulcan Materials,02/15/2023,"Vulcan Materials Co. talks mergers, acquisitions and federal funding ...",still open
Vulcan Materials,02/15/2023,Fitch Affirms Vulcan Materials' IDR at 'BBB'; Outlook Stable,still open
Vulcan Materials,02/15/2023,Update on Vulcan's Mexico Operations,still open
Vulcan Materials,02/15/2023,"Vulcan Materials Co. stock rises Friday, outperforms market",still open
Vulcan Materials,02/15/2023,Vulcan Quarry opponents in Comal County request rehearing on air ...,still open
Vulcan Materials,02/15/2023,VULCAN PROVIDES UPDATE ON MEXICO OPERATIONS,still open
Vulcan Materials,02/15/2023,Should You Buy Vulcan Materials Company (NYSE:VMC) For Its Upcoming Dividend?,still open
Vulcan Materials,02/15/2023,Vulcan Materials (NYSE:VMC) Seems To Use Debt Quite Sensibly,still open
Vulcan Materials,02/15/2023,Court ruling restores air permit for Vulcan's proposed quarry in ...,still open
Vulcan Materials,02/15/2023,Vulcan Materials' Mexican mining unit ordered shut by authorities ...,still open
Vulcan Materials,02/15/2023,Vulcan Materials Stock Is A Solid Pick In Building Materials,still open
Vulcan Materials,02/15/2023,Global Cement Market to Reach 14.2 Billion Tons by 2030,still open
Vulcan Materials,02/15/2023,Vulcan Materials' (NYSE:VMC) five-year earnings growth trails the 9.5% YoY shareholder returns,still open
Vulcan Materials,02/15/2023,"Vulcan Materials Co. stock falls Friday, underperforms market",still open
Vulcan Materials,02/15/2023,"South Korea to Develop New ""MSH-II"" MCM Vessels",still open
Vulcan Materials,02/15/2023,Area near Vulcan Materials in Rabun Gap evacuated after truck with ...,still open
Vulcan Materials,02/15/2023,Vulcan Materials Co. creeping into Belize?,still open
Vulcan Materials,02/15/2023,VULCAN REPORTS FIRST QUARTER 2022 RESULTS,still open
Vulcan Materials,02/15/2023,Research Analysts Set Expectations for Vulcan Materials' Q4 2023 ...,still open
Vulcan Materials,02/15/2023,A Bullish Sign Appears On Vulcan Materials's Chart - Vulcan Materials (NYSE:VMC),still open
Vulcan Materials,02/15/2023,Mexico prepared to sue Vulcan Materials over environmental issues ...,still open
Vulcan Materials,02/15/2023,Vulcan Materials acquires California producer,still open
Vulcan Materials,02/15/2023,Vulcan Materials Company (Holdi - Consensus Indicates Potential ...,still open
Vulcan Materials,02/15/2023,VULCAN REPORTS FOURTH QUARTER AND FULL YEAR 2021 ...,still open
Vulcan Materials,02/15/2023,"In Belize, a proposed limestone mine threatens conservation legacy ...",still open
Vulcan Materials,02/15/2023,COBA Students Win at 'The Yard',still open
Vulcan Materials,02/15/2023,VMC: Does Vulcan Materials Deserve a Place in Your Portfolio?,still open
Vulcan Materials,02/15/2023,"FACT SHEET: Biden-Harris Administration Rallies States, Cities ...",still open
Vulcan Materials,02/15/2023,Mexico seeks to settle $1.1 bln Vulcan suit over limestone mine ...,still open
Vulcan Materials,02/15/2023,Vulcan's Scholar Athlete of the Week,still open
Vulcan Materials,02/15/2023,4 Concrete & Aggregates Stocks to Watch Amid Industry Headwinds,still open
Vulcan Materials,02/15/2023,"Vulcan Plant Fire Contained: LPFD | Livermore, CA Patch",still open
Vulcan Materials,02/15/2023,Illinois Quarry Workers OK Deal to End Strike Delaying Roadwork,still open
Vulcan Materials,02/15/2023,"Vulcan Materials Co. stock falls Tuesday, underperforms market",still open
Vulcan Materials,02/15/2023,Vulcan Materials (VMC) to Post Q4 Earnings: What to Expect?,still open
Vulcan Materials,02/15/2023,Vulcan Materials (VMC) Set to Announce Earnings on Thursday,still open
Vulcan Materials,02/15/2023,"Gardner Russo & Quinn LLC sells 6,480 Vulcan Materials shares ...",still open
Vulcan Materials,02/15/2023,Gardner Russo & Quinn LLC Sells 6480 Shares of Vulcan Materials ...,still open
Vulcan Materials,02/15/2023,Zurcher Kantonalbank Zurich Cantonalbank Boosts Stock Holdings ...,still open
Vulcan Materials,02/15/2023,Vulcan Materials (NYSE:VMC) Plans Dividend Increase - $0.43 Per ...,still open
Vulcan Materials,02/15/2023,First Horizon Advisors Inc. Has $807000 Stock Holdings in Vulcan ...,still open
Vulcan Materials,02/15/2023,Vulcan Materials (NYSE:VMC) Stock Position Reduced by Evoke ...,still open
Vulcan Materials,02/15/2023,AE Wealth Management LLC Sells 41164 Shares of Vulcan ...,still open
Vulcan Materials,02/15/2023,"Vulcan Materials Co. stock rises Monday, still underperforms market",still open
Vulcan Materials,02/15/2023,"Vulcan Materials Co. stock falls Thursday, underperforms market",still open
Vulcan Materials,02/15/2023,BlackRock Increases Position in Vulcan Materials (VMC),still open
Vulcan Materials,02/15/2023,Vulcan Materials (VMC) Reports Next Week: Wall Street Expects ...,still open
Vulcan Materials,02/15/2023,Great West Life Assurance Co. Can Cuts Stock Position in Vulcan ...,still open
Vulcan Materials,02/15/2023,2 Concrete & Aggregates Stocks to Watch Amid Industry Headwinds,still open
Vulcan Materials,02/15/2023,Is Applied Materials (AMAT) a Worthy Long-Term Stock?,still open
Vulcan Materials,02/15/2023,5 big dividend moves: Massive hike at Banc of California | Pro ...,still open
Vulcan Materials,02/15/2023,Our Stocks Could Get a Biden Bump - Action Alerts PLUS,still open
Vulcan Materials,02/15/2023,Does TransDigm Group Incorporated (TDG) Have Strong Growth Ahead?,still open
Vulcan Materials,02/15/2023,Oil Prices Down on Concerns of Short-Term Demand Ahead of Key U.S. Inflation Data,still open
Vulcan Materials,02/15/2023,The EV Revolution Could Surprisingly Benefit Vulcan Materials ...,still open
Vulcan Materials,02/15/2023,Martin Marietta (MLM) to Report Q4 Earnings: What's in Store?,still open
Vulcan Materials,02/15/2023,"Stock Market Week: Gold, Lithium, Steel, And Deere, Medpace ...",still open
Vulcan Materials,02/15/2023,5 Best Infrastructure Stocks to Buy,still open
Vulcan Materials,02/15/2023,"NICHOLAS COMPANY, INC. Buys 1, Sells 4 in 4th Quarter",still open
Vulcan Materials,02/15/2023,What Makes Vulcan Materials Company (VMC) an Attractive Stock?,still open
Vulcan Materials,02/15/2023,Vulcan Materials Stock Is A Solid Pick In Building Materials,still open
Vulcan Materials,02/15/2023,Vulcan Materials: Solid Growth Prospects (NYSE:VMC),still open
Vulcan Materials,02/15/2023,S&P 500 sinks as investors debate the Fed’s next move,still open
Vulcan Materials,02/15/2023,One Vulcan Materials Company (NYSE:VMC) insider reduced their stake by 30% in the previous year,still open
Vulcan Materials,02/15/2023,"Atlantic Equities Downgrades Vulcan Materials to Neutral, Raises ...",still open
Vulcan Materials,02/15/2023,VMC Dividend Announcement $0.4300/Share 2/10/2023,still open
Vulcan Materials,02/15/2023,15 Dividend Growth Stocks with the Highest Growth Rates,still open
Vulcan Materials,02/15/2023,Oil Prices are Up as Russia Announces Plans to Reduce Oil Production,still open
Vulcan Materials,02/15/2023,Research Analysts Set Expectations for Vulcan Materials' Q4 2023 ...,still open
Vulcan Materials,02/15/2023,How Bay Area concrete could offer climate change solutions,still open
Vulcan Materials,02/15/2023,Should You Buy Vulcan Materials Company (NYSE:VMC) For Its Upcoming Dividend?,still open
Vulcan Materials,02/15/2023,Freeport-McMoRan Announces Appointment of Kathleen L. Quirk to its Board of Directors,still open
Vulcan Materials,02/15/2023,"JPMorgan upgrades this materials stock, says it can weather ...",still open
Vulcan Materials,02/15/2023,"Vulcan Materials Third Quarter 2022 Earnings: Revenues Beat Expectations, EPS Lags",still open
Vulcan Materials,02/15/2023,"Vulcan Materials Co. stock rises Friday, outperforms market",still open
Vulcan Materials,02/15/2023,Oil Prices Rise on Supply Shortages After Earthquake in Turkey Causes Major Export Terminal Shutdown,still open
Vulcan Materials,02/15/2023,"Zacks Industry Outlook Highlights Vulcan Materials, Martin Marietta ...",still open
Vulcan Materials,02/15/2023,Vulcan Materials' (NYSE:VMC) five-year earnings growth trails the 9.5% YoY shareholder returns,still open
Vulcan Materials,02/15/2023,"Vulcan Materials Co. stock falls Friday, underperforms market",still open
Vulcan Materials,02/15/2023,A Bullish Sign Appears On Vulcan Materials's Chart - Vulcan Materials (NYSE:VMC),still open
Vulcan Materials,02/15/2023,Vulcan Materials Company (NYSE:VMC) Is Going Strong But Fundamentals Appear To Be Mixed : Is There A Clear Direction For The Stock?,still open
Vulcan Materials,02/15/2023,Vulcan Materials Company (VMC) Q3 2022 Earnings Call Transcript,still open
Vulcan Materials,02/15/2023,Vulcan Materials: Performance Looks Mixed Going Forward (NYSE ...,still open
Vulcan Materials,02/15/2023,Vulcan Materials (NYSE:VMC) will distribute a $0.40 quarterly ...,still open
Vulcan Materials,02/15/2023,VMC: Does Vulcan Materials Deserve a Place in Your Portfolio?,still open
Vulcan Materials,02/15/2023,4 Concrete & Aggregates Stocks to Watch Amid Industry Headwinds,still open
Vulcan Materials,02/15/2023,VULCAN REPORTS SECOND QUARTER 2022 RESULTS,still open
Vulcan Materials,02/15/2023,11 Best Cement and Construction Materials Stocks To Buy Now,still open
Vulcan Materials,02/15/2023,Vulcan Materials' Mexican mining unit ordered shut by authorities ...,still open
Vulcan Materials,02/15/2023,7 Stocks to Buy as Infrastructure Spending Starts to Boom,still open
Vulcan Materials,02/15/2023,2 Stocks You'll Want to Own in 2023,still open
Vulcan Materials,02/15/2023,"S&P 500 Stocks: With A $1 Trillion Government Tailwind, Can These ...",still open
Vulcan Materials,02/15/2023,VULCAN MATERIALS TO OUTLINE NEW GROWTH AND ...,still open
Vulcan Materials,02/15/2023,Summit Materials: Good Growth Prospects At A Discount Valuation ...,still open
Vulcan Materials,02/15/2023,VULCAN MATERIALS COMPANY ELECTS NEW DIRECTOR,still open
Vulcan Materials,02/15/2023,"Infrastructure Deal: Martin Marietta, Vulcan Materials Lead 5 Stocks ...",still open
Vulcan Materials,02/15/2023,10 Best Infrastructure Stocks To Buy Now,still open
Vulcan Materials,02/15/2023,"Vulcan Materials Stock (NYSE:VMC), Quotes and News Summary",still open
Vulcan Materials,02/15/2023,10 Best Home Builder Stocks To Buy Now,still open
Vulcan Materials,02/15/2023,Warning! Keep These 7 Dividend Stocks Out of Your Retirement ...,still open
Vulcan Materials,02/15/2023,These Were The Five Best And Worst Performing Basic Materials ...,still open
Vulcan Materials,02/15/2023,Is Vulcan Materials Company (VMC) A Good Stock To Buy?,still open
Vulcan Materials,02/15/2023,Eagle Materials Stock: Good Value For Long-Term Investors (NYSE ...,still open
Vulcan Materials,02/15/2023,U.S. Concrete stock surges after Vulcan Materials buyout deal valued at $1.29 billion,still open
Vulcan Materials,02/15/2023,Soros Fund Management takes new positions in Sierra Wireless ...,still open
Vulcan Materials,02/15/2023,"We're Booting This Stock Back to the Bullpen, Adding to Two More",still open
Vulcan Materials,02/15/2023,VIDEO: The Top 3 Stocks for New Action Alerts PLUS Members ...,still open
Vulcan Materials,02/15/2023,"VMC Stock Forecast, Price & News (Vulcan Materials)",still open
Vulcan Materials,02/15/2023,Vulcan Materials Company (Holding Company) (VMC) Stock Price ...,still open
Vulcan Materials,02/15/2023,Martin Marietta Materials Inc. stock underperforms Wednesday when compared to competitors,still open
Vulcan Materials,02/15/2023,Should You Sell AngloGold Ashanti Limited (AU) Stock Friday Morning?,still open
Vulcan Materials,02/15/2023,Vulcan Completes Acquisition Of U.S. Concrete,still open
Vulcan Materials,02/15/2023,"What Is Summit Materials, Inc.'s (NYSE:SUM) Share Price Doing?",still open
Vulcan Materials,02/15/2023,VMC Price Target 2023 | Vulcan Materials Analyst Ratings,still open
Vulcan Materials,02/15/2023,Upgrade Your PC Gaming Setup With the Best Gaming Keyboards of the Year,still open
Vulcan Materials,02/15/2023,What's going on with the Vulcan share price today?,still open
Vulcan Materials,02/15/2023,ARIZONA VULCAN MATERIALS TEAMSTERS VOTE TO ...,still open
Vulcan Materials,02/15/2023,Lithium Americas Provides General Motors Transaction Details and Update on Construction Plan for Thacker Pass,still open
Vulcan Materials,02/15/2023,Vulcan Materials Co.: Set To Benefit From Economic Stimulus And ...,still open
Vulcan Materials,02/15/2023,VULCAN REPORTS FIRST QUARTER 2022 RESULTS,still open
Vulcan Materials,02/15/2023,"Summit Materials, Inc.'s (NYSE:SUM) Stock Been Rising: Are Strong Financials Guiding The Market?",still open
Vulcan Materials,02/15/2023,Vulcan Materials buys U.S. Concrete in $1.3B deal,still open
Vulcan Materials,02/15/2023,VULCAN PROVIDES UPDATE ON MEXICO OPERATIONS,still open
Vulcan Materials,02/15/2023,Is Eagle Materials Stock A Suitable Foundation On Which To Build ...,still open
Vulcan Materials,02/15/2023,Is Vulcan Materials Company (VMC) the Top Pick in the Building Materials Industry?,still open
Vulcan Materials,02/15/2023,"Vulcan, Caterpillar stocks surge as infrastructure bill's passage gives big boost to materials makers",still open
Vulcan Materials,02/15/2023,"This Insider Has Just Sold Shares In Martin Marietta Materials, Inc. (NYSE:MLM)",still open
Vulcan Materials,02/15/2023,Martin Marietta (MLM) to Sell Ready Mixed Concrete Operations,still open
Vulcan Materials,02/15/2023,Vulcan Materials consummates U.S. Concrete deal – Concrete ...,still open
Vulcan Materials,02/15/2023,Vulcan Materials (NYSE: VMC): The Construction Company That's ...,still open
Vulcan Materials,02/15/2023,"Vulcan Materials Co. stock falls Tuesday, underperforms market",still open
Vulcan Materials,02/15/2023,Vulcan Materials (VMC) to Post Q4 Earnings: What to Expect?,still open
Vulcan Materials,02/15/2023,Is Vulcan Materials (NYSE:VMC) A Risky Investment?,still open
Vulcan Materials,02/15/2023,Vulcan Materials (VMC) Declares $0.43 Dividend,still open
Vulcan Materials,02/15/2023,Vulcan Materials Company Scholar Athlete of the Year,still open
Vulcan Materials,02/15/2023,Gardner Russo & Quinn LLC Sells 6480 Shares of Vulcan Materials ...,still open
Vulcan Materials,02/15/2023,BlackRock Increases Position in Vulcan Materials (VMC),still open
Vulcan Materials,02/15/2023,First Horizon Advisors Inc. Has $807000 Stock Holdings in Vulcan ...,still open
Vulcan Materials,02/15/2023,Vulcan Materials (VMC) Reports Next Week: Wall Street Expects ...,still open
Vulcan Materials,02/15/2023,"Vulcan Materials Co. stock rises Monday, still underperforms market",still open
Vulcan Materials,02/15/2023,"Vulcan Materials Co. stock rises Thursday, outperforms market",still open
Vulcan Materials,02/15/2023,"Vulcan Materials Co. stock falls Thursday, underperforms market",still open
Vulcan Materials,02/15/2023,Foundation makes largest donation to date for Forest Preserve ...,still open
Vulcan Materials,02/15/2023,Analysts Forecast Vulcan Materials' Earnings in the Fourth Quarter ...,still open
Vulcan Materials,02/15/2023,"‘Catastrophic failure’ caused quarry blast felt throughout Franklin, fire marshal says",still open
Vulcan Materials,02/15/2023,"Terrill Fort Obituary (1946 - 2023) - Homosassa, FL - Citrus County ...",still open
Vulcan Materials,02/15/2023,ECU to host spring career fairs | News Services | ECU,still open
Vulcan Materials,02/15/2023,Concrete traps CO2 soaked from air in climate-friendly test,still open
Vulcan Materials,02/15/2023,5 big dividend moves: Massive hike at Banc of California | Pro ...,still open
Vulcan Materials,02/15/2023,Vulcan to mine 60% more German lithium than planned,still open
Vulcan Materials,02/15/2023,Great West Life Assurance Co. Can Cuts Stock Position in Vulcan ...,still open
