Name,Data,News,Evaluation
Vulcan Materials,02/07/2023,"Atlantic Equities Downgrades Vulcan Materials to Neutral, Raises ...",still open
Vulcan Materials,02/07/2023,Major TxDOT construction projects moving forward in Lufkin District,still open
Vulcan Materials,02/07/2023,"Raymond James Maintains Outperform on Vulcan Materials, Raises ...",still open
Vulcan Materials,02/07/2023,We're Trimming One Stock as We Add to Another,still open
Vulcan Materials,02/07/2023,"Stellantis, Vulcan Energy to develop renewable energy assets in ...",still open
Vulcan Materials,02/07/2023,"Kelly Thompson Obituary (1949 - 2023) - Homewood, AL - The ...",still open
Vulcan Materials,02/07/2023,Black Tie Affair Hosts Hatcher Family Honors,still open
Vulcan Materials,02/07/2023,Lakeland Industries Announces CFO Transition,still open
Vulcan Materials,02/07/2023,Women on quarters: Who they are and why it matters,still open
Vulcan Materials,02/07/2023,Construction Aggregates Market Size to Surpass US$ 664 Bn by 2031 | Persistence Market Research,still open
Vulcan Materials,02/07/2023,VULCAN MATERIALS TO OUTLINE NEW GROWTH AND ...,still open
Vulcan Materials,02/07/2023,VULCAN REPORTS THIRD QUARTER 2022 RESULTS,still open
Vulcan Materials,02/07/2023,Vulcan Materials: Solid Growth Prospects (NYSE:VMC),still open
Vulcan Materials,02/07/2023,"Building Material Market 2023 by Top Key Players, Types, Applications and Future Forecast to 2030",still open
Vulcan Materials,02/07/2023,Worker dies following incident at Vulcan quarry,still open
Vulcan Materials,02/07/2023,Vulcan Materials: Performance Looks Mixed Going Forward (NYSE ...,still open
Vulcan Materials,02/07/2023,Phoenix aggregate drivers end strike against Vulcan Materials,still open
Vulcan Materials,02/07/2023,One Vulcan Materials Company (NYSE:VMC) insider reduced their stake by 30% in the previous year,still open
Vulcan Materials,02/07/2023,Arizona Vulcan Materials Teamsters Vote to Authorize Strike,still open
Vulcan Materials,02/07/2023,Vulcan Materials Company (VMC) Q3 2022 Earnings Call Transcript,still open
Vulcan Materials,02/07/2023,Is Vulcan Materials Company (VMC) an Attractive Investment?,still open
Vulcan Materials,02/07/2023,VULCAN REPORTS SECOND QUARTER 2022 RESULTS,still open
Vulcan Materials,02/07/2023,B.C. Climate News: B.C. road repair costs rise to almost half a billion dollars | Columbia River Treaty renewal won’t just go with the flow | Global ocean conservation conference in B.C. hopes to build on Montreal agreements,still open
Vulcan Materials,02/07/2023,VULCAN MATERIALS COMPANY ELECTS NEW DIRECTOR,still open
Vulcan Materials,02/07/2023,Hill Country residents opposed to Vulcan Quarry request rehearing,still open
Vulcan Materials,02/07/2023,Does Vulcan Materials Company (VMC) have Pricing Power?,still open
Vulcan Materials,02/07/2023,Why Shooting Down China's Spy Balloon Over The U.S. Is More ...,still open
Vulcan Materials,02/07/2023,Fitch Rates Vulcan Materials' S-T IDR and Commercial Paper Rating ...,still open
Vulcan Materials,02/07/2023,PR News | Vulcan Materials Alum Signs with Summit Strategy - Wed ...,still open
Vulcan Materials,02/07/2023,"Vulcan Materials Co. talks mergers, acquisitions and federal funding ...",still open
Vulcan Materials,02/07/2023,Update on Vulcan's Mexico Operations,still open
Vulcan Materials,02/07/2023,Roadway Activity Report for parts of East and Middle Tennessee ...,still open
Vulcan Materials,02/07/2023,Fitch Affirms Vulcan Materials' IDR at 'BBB'; Outlook Stable,still open
Vulcan Materials,02/07/2023,VULCAN PROVIDES UPDATE ON MEXICO OPERATIONS,still open
Vulcan Materials,02/07/2023,Vulcan Quarry opponents in Comal County request rehearing on air ...,still open
Vulcan Materials,02/07/2023,Vulcan Materials' Mexican mining unit ordered shut by authorities ...,still open
Vulcan Materials,02/07/2023,Vulcan Materials (NYSE:VMC) Seems To Use Debt Quite Sensibly,still open
Vulcan Materials,02/07/2023,Compounders And Dividends: January 2023 Portfolio Update,still open
Vulcan Materials,02/07/2023,Court ruling restores air permit for Vulcan's proposed quarry in ...,still open
Vulcan Materials,02/07/2023,Vulcan Materials Stock Is A Solid Pick In Building Materials,still open
Vulcan Materials,02/07/2023,VULCAN DECLARES QUARTERLY DIVIDEND ON COMMON STOCK,still open
Vulcan Materials,02/07/2023,Household Dehumidifiers Sales Market Booming Worldwide With ...,still open
Vulcan Materials,02/07/2023,What’s special about the new Samsung Galaxy S23 series lineup? Here are the major deets.,still open
Vulcan Materials,02/07/2023,Area near Vulcan Materials in Rabun Gap evacuated after truck with ...,still open
Vulcan Materials,02/07/2023,VULCAN REPORTS FIRST QUARTER 2022 RESULTS,still open
Vulcan Materials,02/07/2023,Vulcan Materials Co. creeping into Belize?,still open
Vulcan Materials,02/07/2023,Mexico prepared to sue U.S. firm Vulcan over environmental issues ...,still open
Vulcan Materials,02/07/2023,Vulcan Materials acquires California producer,still open
Vulcan Materials,02/07/2023,What is the environmental impact of a supercharged space industry?,still open
Vulcan Materials,02/07/2023,"Solid Construction Activity Aid Vulcan (VMC), Inflation High",still open
Vulcan Materials,02/07/2023,﻿Sports League Management Software Market Report 2020 Industry ...,still open
Vulcan Materials,02/07/2023,Moody's assigns a P-2 rating to Vulcan's New CP program and Baa2 ...,still open
Vulcan Materials,02/07/2023,VULCAN ANNOUNCES SENIOR LEADERSHIP APPOINTMENTS,still open
Vulcan Materials,02/07/2023,Vulcan Materials Company is 'ideal for an inflationary environment',still open
Vulcan Materials,02/07/2023,Umicore to source nickel from Terrafame,still open
Vulcan Materials,02/07/2023,"In Belize, a proposed limestone mine threatens conservation legacy ...",still open
Vulcan Materials,02/07/2023,Tocco Toscano’s 2nd-gen owner saved the biz from closure – grew its revenue to over 7 figures,still open
Vulcan Materials,02/07/2023,Vulcan Materials Company (Holdi - Consensus Indicates Potential ...,still open
Vulcan Materials,02/07/2023,This 26-year-old couple invested thousands to create “good totes” – broke even on launch day,still open
Vulcan Materials,02/07/2023,COBA Students Win at 'The Yard',still open
Vulcan Materials,02/07/2023,Mexico seeks to settle $1.1 bln Vulcan suit over limestone mine ...,still open
Vulcan Materials,02/07/2023,"FACT SHEET: Biden-Harris Administration Rallies States, Cities ...",still open
Vulcan Materials,02/07/2023,9 Valentine's Day gift ideas for the farmer in your life,still open
Vulcan Materials,02/07/2023,Vulcan Materials Declined To Its 200-Day Simple Moving Average On Weak Earnings,still open
Vulcan Materials,02/07/2023,4 Concrete & Aggregates Stocks to Watch Amid Industry Headwinds,still open
Vulcan Materials,02/07/2023,How The Electric Car Movement Will Kill Almost Everything We Love ...,still open
Vulcan Materials,02/07/2023,"Vulcan Plant Fire Contained: LPFD | Livermore, CA Patch",still open
Vulcan Materials,02/07/2023,Illinois Quarry Workers OK Deal to End Strike Delaying Roadwork,still open
Vulcan Materials,02/07/2023,"Big Brothers, Big Sisters benefit from Quarry Crusher Run Saturday",still open
Vulcan Materials,02/07/2023,Chicago-Area Road Work Could Slow Down as Quarry Workers ...,still open
Vulcan Materials,02/07/2023,"Vulcan's Magical Nights returns with holiday lights, music ...",still open
Vulcan Materials,02/07/2023,‘A mama’s worst nightmare:’ 16-year-old boy dies after being pinned by machine at Georgia quarry,still open
Vulcan Materials,02/07/2023,Bettye Francis Obituary,still open
Vulcan Materials,02/07/2023,Mexico ups stakes in Vulcan limestone spat,still open
Vulcan Materials,02/07/2023,Vulcan To Acquire U.S. Concrete,still open
Vulcan Materials,02/07/2023,"Despite difficult situation with Mexican government, Vulcan reports strong earnings",still open
Vulcan Materials,02/07/2023,"JPMorgan upgrades this materials stock, says it can weather ...",still open
Vulcan Materials,02/07/2023,"Global Ready-Mix Concrete Market Report to 2030 - Players Include Holcim, SIKA, UltraTech Cement, Vicat and Vulcan Materials",still open
Vulcan Materials,02/07/2023,"Belize: Vulcan Mining Plan Extracts Protests, Foresight",still open
Vulcan Materials,02/07/2023,Workforce a central theme of GCAA workshop,still open
Vulcan Materials,02/07/2023,Solid Construction Activity Aids Vulcan (VMC) Amid Inflation,still open
Vulcan Materials,02/07/2023,Vulcan Materials to transfer $88 million in pension liabilities with ...,still open
Vulcan Materials,02/07/2023,Vulcan Materials sued for misclassifying truckers,still open
Vulcan Materials,02/07/2023,Vulcan Completes Acquisition Of U.S. Concrete,still open
Vulcan Materials,02/07/2023,"Vulcan Materials Co. stock falls Monday, underperforms market",still open
Vulcan Materials,02/07/2023,"Cullen Frost Bankers Inc. owns $195,000 of Vulcan Materials (NYSE ...",still open
Vulcan Materials,02/07/2023,Cullen Frost Bankers Inc. Has $195000 Position in Vulcan Materials ...,still open
Vulcan Materials,02/07/2023,The EV Revolution Could Surprisingly Benefit Vulcan Materials ...,still open
Vulcan Materials,02/07/2023,Asset Management One Co. Ltd. Sells 4611 Shares of Vulcan ...,still open
Vulcan Materials,02/07/2023,BlackRock Increases Position in Vulcan Materials (VMC),still open
Vulcan Materials,02/07/2023,AE Wealth Management LLC Sells 41164 Shares of Vulcan ...,still open
Vulcan Materials,02/07/2023,Research Analysts Set Expectations for Vulcan Materials' Q4 2023 ...,still open
Vulcan Materials,02/07/2023,"Vulcan Materials Co. stock falls Thursday, underperforms market",still open
Vulcan Materials,02/07/2023,We're Adding to This Holding as Construction Spending Is on the Rise,still open
Vulcan Materials,02/07/2023,Great West Life Assurance Co. Can Cuts Stock Position in Vulcan ...,still open
Vulcan Materials,02/07/2023,We're Trimming One Stock as We Add to Another,still open
Vulcan Materials,02/07/2023,2 Concrete & Aggregates Stocks to Watch Amid Industry Headwinds,still open
Vulcan Materials,02/07/2023,"RBC Upgrades Vulcan Materials to Outperform From Sector Perform, Boosts PT to $191 From $170, Expects 'Ramping Infrastructure Tailwinds'",still open
Vulcan Materials,02/07/2023,"S&P 500 Stocks: With A $1 Trillion Government Tailwind, Can These ...",still open
Vulcan Materials,02/07/2023,"Stellantis, Vulcan Energy to develop renewable energy assets in ...",still open
Vulcan Materials,02/07/2023,What Makes Vulcan Materials Company (VMC) an Attractive Stock?,still open
Vulcan Materials,02/07/2023,"Raymond James Maintains Outperform on Vulcan Materials, Raises ...",still open
Vulcan Materials,02/07/2023,Vulcan Materials Stock Is A Solid Pick In Building Materials,still open
Vulcan Materials,02/07/2023,Vulcan Materials: Solid Growth Prospects (NYSE:VMC),still open
Vulcan Materials,02/07/2023,Vulcan Materials Shares Gain After Q2 Results,still open
Vulcan Materials,02/07/2023,One Vulcan Materials Company (NYSE:VMC) insider reduced their stake by 30% in the previous year,still open
Vulcan Materials,02/07/2023,VULCAN DECLARES QUARTERLY DIVIDEND ON COMMON STOCK,still open
Vulcan Materials,02/07/2023,Does Vulcan Materials Company (VMC) have Pricing Power?,still open
Vulcan Materials,02/07/2023,"Heirloom, CarbonCure Technologies and Central Concrete Achieve ...",still open
Vulcan Materials,02/07/2023,"JPMorgan upgrades this materials stock, says it can weather ...",still open
Vulcan Materials,02/07/2023,"Vulcan Materials Third Quarter 2022 Earnings: Revenues Beat Expectations, EPS Lags",still open
Vulcan Materials,02/07/2023,Vulcan Materials' (NYSE:VMC) five-year earnings growth trails the 9.5% YoY shareholder returns,still open
Vulcan Materials,02/07/2023,Vulcan Materials: Performance Looks Mixed Going Forward (NYSE ...,still open
Vulcan Materials,02/07/2023,Vulcan Materials Company (VMC) Q3 2022 Earnings Call Transcript,still open
Vulcan Materials,02/07/2023,Vulcan Materials (NYSE:VMC) Seems To Use Debt Quite Sensibly,still open
Vulcan Materials,02/07/2023,Vulcan Materials Company is 'ideal for an inflationary environment',still open
Vulcan Materials,02/07/2023,"Up 15% In A Month, Vulcan Materials Stock To Drop In The Near Term",still open
Vulcan Materials,02/07/2023,4 Concrete & Aggregates Stocks to Watch Amid Industry Headwinds,still open
Vulcan Materials,02/07/2023,7 Stocks to Buy as Infrastructure Spending Starts to Boom,still open
Vulcan Materials,02/07/2023,VULCAN REPORTS SECOND QUARTER 2022 RESULTS,still open
Vulcan Materials,02/07/2023,Vulcan Materials Declined To Its 200-Day Simple Moving Average On Weak Earnings,still open
Vulcan Materials,02/07/2023,11 Best Cement and Construction Materials Stocks To Buy Now,still open
Vulcan Materials,02/07/2023,Vulcan Materials warns Mexican government could revoke ...,still open
Vulcan Materials,02/07/2023,Vulcan Materials' Mexican mining unit ordered shut by authorities ...,still open
Vulcan Materials,02/07/2023,VULCAN MATERIALS TO OUTLINE NEW GROWTH AND ...,still open
Vulcan Materials,02/07/2023,2 Stocks You'll Want to Own in 2023,still open
Vulcan Materials,02/07/2023,"Solid Construction Activity Aid Vulcan (VMC), Inflation High",still open
Vulcan Materials,02/07/2023,North American Morning Briefing : Microsoft -2-,still open
Vulcan Materials,02/07/2023,Summit Materials: Good Growth Prospects At A Discount Valuation ...,still open
Vulcan Materials,02/07/2023,VULCAN MATERIALS COMPANY ELECTS NEW DIRECTOR,still open
Vulcan Materials,02/07/2023,10 Best Infrastructure Stocks To Buy Now,still open
Vulcan Materials,02/07/2023,"Infrastructure Deal: Martin Marietta, Vulcan Materials Lead 5 Stocks ...",still open
Vulcan Materials,02/07/2023,10 Best Home Builder Stocks To Buy Now,still open
Vulcan Materials,02/07/2023,Warning! Keep These 7 Dividend Stocks Out of Your Retirement ...,still open
Vulcan Materials,02/07/2023,"Martin Marietta Materials Inc. stock rises Monday, still underperforms market",still open
Vulcan Materials,02/07/2023,U.S. Concrete stock surges after Vulcan Materials buyout deal valued at $1.29 billion,still open
Vulcan Materials,02/07/2023,Is Vulcan Materials Company (VMC) A Good Stock To Buy?,still open
Vulcan Materials,02/07/2023,Eagle Materials Stock: Good Value For Long-Term Investors (NYSE ...,still open
Vulcan Materials,02/07/2023,Soros Fund Management takes new positions in Sierra Wireless ...,still open
Vulcan Materials,02/07/2023,"Martin Marietta Materials Inc. stock rises Tuesday, outperforms market",still open
Vulcan Materials,02/07/2023,"We're Booting This Stock Back to the Bullpen, Adding to Two More",still open
Vulcan Materials,02/07/2023,Phoenix aggregate drivers end strike against Vulcan Materials,still open
Vulcan Materials,02/07/2023,Lithium Americas Provides General Motors Transaction Details and ...,still open
Vulcan Materials,02/07/2023,"Martin Marietta Materials Inc. stock falls Thursday, underperforms market",still open
Vulcan Materials,02/07/2023,Piedmont Lithium adds two new directors to board; stock soars ...,still open
Vulcan Materials,02/07/2023,"Vulcan Materials Stock (NYSE:VMC), Quotes and News Summary",still open
Vulcan Materials,02/07/2023,Vulcan Materials Company (Holding Company) (VMC) Stock Price ...,still open
Vulcan Materials,02/07/2023,"VMC Stock Forecast, Price & News (Vulcan Materials)",still open
Vulcan Materials,02/07/2023,Vulcan Completes Acquisition Of U.S. Concrete,still open
Vulcan Materials,02/07/2023,VMC Price Target 2023 | Vulcan Materials Analyst Ratings,still open
Vulcan Materials,02/07/2023,What's going on with the Vulcan share price today?,still open
Vulcan Materials,02/07/2023,VULCAN REPORTS FIRST QUARTER 2022 RESULTS,still open
Vulcan Materials,02/07/2023,VULCAN PROVIDES UPDATE ON MEXICO OPERATIONS,still open
Vulcan Materials,02/07/2023,ARIZONA VULCAN MATERIALS TEAMSTERS VOTE TO ...,still open
Vulcan Materials,02/07/2023,Is Eagle Materials Stock A Suitable Foundation On Which To Build ...,still open
Vulcan Materials,02/07/2023,Vulcan Steel Limited's (ASX:VSL) Shares Lagging The Market But So Is The Business,still open
Vulcan Materials,02/07/2023,How Much Power Does The 2023 Kawasaki Ninja ZX-4RR Make?,still open
Vulcan Materials,02/07/2023,CRH: Vulcan Materials vs. CRH: Which Infrastructure Stock is a ...,still open
Vulcan Materials,02/07/2023,Is Vulcan Materials Company (VMC) the Top Pick in the Building Materials Industry?,still open
Vulcan Materials,02/07/2023,Moody's assigns a P-2 rating to Vulcan's New CP program and Baa2 ...,still open
Vulcan Materials,02/07/2023,"Vulcan, Caterpillar stocks surge as infrastructure bill's passage gives big boost to materials makers",still open
Vulcan Materials,02/07/2023,Have Louisiana-Pacific Corporation (NYSE:LPX) Insiders Been Selling Their Stock?,still open
Vulcan Materials,02/07/2023,Vulcan Energy Resources Limited's (ASX:VUL)) market cap declines to AU$973m but insiders who sold €7.5m stock were able to hedge their losses,still open
Vulcan Materials,02/07/2023,Martin Marietta (MLM) to Sell Ready Mixed Concrete Operations,still open
Vulcan Materials,02/07/2023,Mining Companies Benefit From the Widespread Utilizations of ...,still open
Vulcan Materials,02/07/2023,Vulcan Materials consummates U.S. Concrete deal – Concrete ...,still open
Vulcan Materials,02/07/2023,VULCAN REPORTS FOURTH QUARTER AND FULL YEAR 2021 ...,still open
Vulcan Materials,02/07/2023,6 Stocks that Work in a Bear Market 'No-Man's Land',still open
Vulcan Materials,02/07/2023,13 Best Infrastructure Stocks for America's Big Building Spend,still open
Vulcan Materials,02/07/2023,"Global Ready-Mix Concrete Market Report to 2030 - Players Include Holcim, SIKA, UltraTech Cement, Vicat and Vulcan Materials",still open
Vulcan Materials,02/07/2023,"5 infrastructure stocks to buy now that Biden's bill has been passed, according to Jefferies",still open
Vulcan Materials,02/07/2023,"Construction, Concrete and Asphalt Prices Keep Going Up: Stocks ...",still open
Vulcan Materials,02/07/2023,"Owens Corning Leads 5 Construction and Materials Stocks, as Vulcan Materials Lags",still open
Vulcan Materials,02/07/2023,CRH: Strong Growth Despite Challenges (NYSE:CRH),still open
Vulcan Materials,02/07/2023,Estimating The Intrinsic Value Of Vulcan Materials Company (NYSE:VMC),still open
Vulcan Materials,02/07/2023,"Vulcan Materials Clears Technical Benchmark, Hitting 80-Plus RS ...",still open
Vulcan Materials,02/07/2023,3 Potential Winning Stocks from Biden's Infrastructure Plan,still open
Vulcan Materials,02/07/2023,Transportation Secretary Elaine Chao Sells Stock in Highway ...,still open
Vulcan Materials,02/07/2023,The Best Stock in Alabama: Vulcan Materials,still open
Vulcan Materials,02/07/2023,Were Hedge Funds Right About Souring On Vulcan Materials Company (VMC)?,still open
Vulcan Materials,02/08/2023,"Vulcan Materials Co. stock rises Tuesday, outperforms market",still open
Vulcan Materials,02/08/2023,BlackRock Increases Position in Vulcan Materials (VMC),still open
Vulcan Materials,02/08/2023,"Vulcan Materials Co. stock rises Monday, still underperforms market",still open
Vulcan Materials,02/08/2023,The EV Revolution Could Surprisingly Benefit Vulcan Materials ...,still open
Vulcan Materials,02/08/2023,"Vulcan Materials Co. stock rises Friday, outperforms market",still open
Vulcan Materials,02/08/2023,"Vulcan Materials Co. stock falls Thursday, underperforms market",still open
Vulcan Materials,02/08/2023,Lightweight Construction Material Market Predictable To Exceed ...,still open
Vulcan Materials,02/08/2023,Freeport-McMoRan Announces Appointment of Kathleen L. Quirk to its Board of Directors,still open
Vulcan Materials,02/08/2023,Dimension Stone Global Market Report 2022 Featuring Major ...,still open
Vulcan Materials,02/08/2023,Concrete traps CO2 soaked from air in climate-friendly test,still open
Vulcan Materials,02/08/2023,"RBC Upgrades Vulcan Materials to Outperform From Sector Perform, Boosts PT to $191 From $170, Expects 'Ramping Infrastructure Tailwinds'",still open
Vulcan Materials,02/08/2023,"Remembering Ann Korologos, a Renaissance woman",still open
Vulcan Materials,02/08/2023,Driver patience urged as Leighton Avenue resurfacing begins this ...,still open
Vulcan Materials,02/08/2023,We're Adding to This Holding as Construction Spending Is on the Rise,still open
Vulcan Materials,02/08/2023,Research Analysts Set Expectations for Vulcan Materials' Q4 2023 ...,still open
Vulcan Materials,02/08/2023,2 Concrete & Aggregates Stocks to Watch Amid Industry Headwinds,still open
Vulcan Materials,02/08/2023,Great West Life Assurance Co. Can Cuts Stock Position in Vulcan ...,still open
Vulcan Materials,02/08/2023,VULCAN ANNOUNCES FOURTH QUARTER AND FULL YEAR ...,still open
Vulcan Materials,02/08/2023,"Atlantic Equities Downgrades Vulcan Materials to Neutral, Raises ...",still open
Vulcan Materials,02/08/2023,"Raymond James Maintains Outperform on Vulcan Materials, Raises ...",still open
Vulcan Materials,02/08/2023,Eagle Materials (EXP) Matches Q3 Earnings Estimates,still open
Vulcan Materials,02/08/2023,We're Trimming One Stock as We Add to Another,still open
Vulcan Materials,02/08/2023,"Stellantis, Vulcan Energy to develop renewable energy assets in ...",still open
Vulcan Materials,02/08/2023,Vulcan Value Partners 2022 Annual Letter,still open
Vulcan Materials,02/08/2023,"Kelly Thompson Obituary (1949 - 2023) - Homewood, AL - The ...",still open
Vulcan Materials,02/08/2023,Black Tie Affair Hosts Hatcher Family Honors,still open
Vulcan Materials,02/08/2023,Major TxDOT construction projects moving forward in Lufkin District,still open
Vulcan Materials,02/08/2023,Lakeland Industries Announces CFO Transition,still open
Vulcan Materials,02/08/2023,50 classics from (almost) everyone's high school reading list,still open
Vulcan Materials,02/08/2023,5 Best Infrastructure Stocks to Buy,still open
Vulcan Materials,02/08/2023,﻿Stone Mining & Quarrying Market Report 2020 Market 2022 ...,still open
Vulcan Materials,02/08/2023,"S&P 500 Stocks: With A $1 Trillion Government Tailwind, Can These ...",still open
Vulcan Materials,02/08/2023,VULCAN REPORTS THIRD QUARTER 2022 RESULTS,still open
Vulcan Materials,02/08/2023,Vulcan Materials: Solid Growth Prospects (NYSE:VMC),still open
Vulcan Materials,02/08/2023,VULCAN MATERIALS TO OUTLINE NEW GROWTH AND ...,still open
Vulcan Materials,02/08/2023,Worker dies following incident at Vulcan quarry,still open
Vulcan Materials,02/08/2023,Vulcan Materials: Performance Looks Mixed Going Forward (NYSE ...,still open
Vulcan Materials,02/08/2023,Phoenix aggregate drivers end strike against Vulcan Materials,still open
Vulcan Materials,02/08/2023,One Vulcan Materials Company (NYSE:VMC) insider reduced their stake by 30% in the previous year,still open
Vulcan Materials,02/08/2023,Arizona Vulcan Materials Teamsters Vote to Authorize Strike,still open
Vulcan Materials,02/08/2023,Vulcan Materials Company (VMC) Q3 2022 Earnings Call Transcript,still open
Vulcan Materials,02/08/2023,Is Vulcan Materials Company (VMC) an Attractive Investment?,still open
Vulcan Materials,02/08/2023,VULCAN REPORTS SECOND QUARTER 2022 RESULTS,still open
Vulcan Materials,02/08/2023,VULCAN MATERIALS COMPANY ELECTS NEW DIRECTOR,still open
Vulcan Materials,02/08/2023,Construction Aggregates Market Size to Surpass US$ 664 Bn by 2031 | Persistence Market Research,still open
Vulcan Materials,02/08/2023,Hill Country residents opposed to Vulcan Quarry request rehearing,still open
Vulcan Materials,02/08/2023,"Building Material Market 2023 by Top Key Players, Types, Applications and Future Forecast to 2030",still open
Vulcan Materials,02/08/2023,Does Vulcan Materials Company (VMC) have Pricing Power?,still open
Vulcan Materials,02/08/2023,Vulcan Materials Shares Gain After Q2 Results,still open
Vulcan Materials,02/08/2023,Fitch Rates Vulcan Materials' S-T IDR and Commercial Paper Rating ...,still open
Vulcan Materials,02/08/2023,PR News | Vulcan Materials Alum Signs with Summit Strategy - Wed ...,still open
Vulcan Materials,02/08/2023,B.C. Climate News: B.C. road repair costs rise to almost half a billion dollars | Columbia River Treaty renewal won’t just go with the flow | Global ocean conservation conference in B.C. hopes to build on Montreal agreements,still open
Vulcan Materials,02/08/2023,Why Shooting Down China's Spy Balloon Over The U.S. Is More ...,still open
Vulcan Materials,02/08/2023,"Vulcan Materials Co. talks mergers, acquisitions and federal funding ...",still open
Vulcan Materials,02/08/2023,Update on Vulcan's Mexico Operations,still open
Vulcan Materials,02/08/2023,Fitch Affirms Vulcan Materials' IDR at 'BBB'; Outlook Stable,still open
Vulcan Materials,02/08/2023,VULCAN PROVIDES UPDATE ON MEXICO OPERATIONS,still open
Vulcan Materials,02/08/2023,Vulcan Quarry opponents in Comal County request rehearing on air ...,still open
Vulcan Materials,02/08/2023,Roadway Activity Report for parts of East and Middle Tennessee ...,still open
Vulcan Materials,02/08/2023,Vulcan Materials' Mexican mining unit ordered shut by authorities ...,still open
Vulcan Materials,02/08/2023,Vulcan Materials (NYSE:VMC) Seems To Use Debt Quite Sensibly,still open
Vulcan Materials,02/08/2023,Court ruling restores air permit for Vulcan's proposed quarry in ...,still open
Vulcan Materials,02/08/2023,Vulcan Materials Stock Is A Solid Pick In Building Materials,still open
Vulcan Materials,02/08/2023,Vulcan Materials' (NYSE:VMC) five-year earnings growth trails the 9.5% YoY shareholder returns,still open
Vulcan Materials,02/08/2023,Compounders And Dividends: January 2023 Portfolio Update,still open
