Name,Data,News,Evaluation
Coca Cola Co.,02/10/2023,Where Does Coca-Cola Co (KO) Stock Fall in the Beverages - Non-Alcoholic Field After It Is Lower By -1.03% This Week?,still open
Coca Cola Co.,02/10/2023,Coca-Cola Co. stock outperforms market despite losses on the day,still open
Coca Cola Co.,02/10/2023,Stock Market Sell-Off: Is Coca-Cola a Buy?,still open
Coca Cola Co.,02/10/2023,Colgate Elects Steve Cahillane to Board of Directors,still open
Coca Cola Co.,02/10/2023,Brian John Smith Sells 94200 Shares of The Coca-Cola Company ...,still open
Coca Cola Co.,02/10/2023,Why Warren Buffett Loves Coca-Cola Stock,still open
Coca Cola Co.,02/10/2023,Is Coca-Cola Stock a Buy?,still open
Coca Cola Co.,02/10/2023,What do the Fundamentals Predict for Coca-Cola Co (KO) Stock?,still open
Coca Cola Co.,02/10/2023,Where Will Coca-Cola Stock Be in 5 Years?,still open
Coca Cola Co.,02/10/2023,Will Coca-Cola Co (KO) Stay at the Top of the Consumer Defensive Sector?,still open
Coca Cola Co.,02/10/2023,Coca-Cola is a stable safe haven in a rough market,still open
Coca Cola Co.,02/10/2023,"Week ahead: big banks begin unveiling bumper returns, US and UK ...",still open
Coca Cola Co.,02/10/2023,"Coca-Cola Stock Higher As Price Hikes Help Q3 Earnings, Revenue Beat, 2022 Forecast Boost",still open
Coca Cola Co.,02/10/2023,Is Coca-Cola Stock A Buy After Beating Earnings? Outlook Is ...,still open
Coca Cola Co.,02/10/2023,"Shares of Coca-Cola are a buy for these four reasons, Jim Cramer says",still open
Coca Cola Co.,02/10/2023,Coke bottler Coca-Cola HBC depleting stock in Russia,still open
Coca Cola Co.,02/10/2023,This Restaurant Is Likely A Better Pick Over Coca-Cola Stock,still open
Coca Cola Co.,02/10/2023,The Coca-Cola Company Elects Three Officers and Declares ...,still open
Coca Cola Co.,02/10/2023,Should Investors Follow Warren Buffett Into Coca-Cola Stock?,still open
Coca Cola Co.,02/10/2023,Coca-Cola and PepsiCo could face pricing probe,still open
Coca Cola Co.,02/10/2023,Investors Heavily Search CocaCola Company The (KO): Here is ...,still open
Coca Cola Co.,02/10/2023,"Top Stock Reports for Coca-Cola, Merck & Toyota Motor",still open
Coca Cola Co.,02/10/2023,Warren Buffett Has Held This Stock for Over 34 Years — Why He Will Never Sell,still open
Coca Cola Co.,02/10/2023,KO vs. PEP: Why Coca-Cola Stock Looks Tastier,still open
Coca Cola Co.,02/10/2023,PepsiCo makes big promise to consumers | Business,still open
Coca Cola Co.,02/10/2023,Coca-Cola bottler to detail costs of exiting Russia,still open
Coca Cola Co.,02/10/2023,Coca-Cola bottler starts making 'Dobry Cola' in Russia,still open
Coca Cola Co.,02/10/2023,MSFT: Coca-Cola and 3 Other High-Quality Stocks to Buy This ...,still open
Coca Cola Co.,02/10/2023,Coca-Cola vs. PepsiCo: Which Stock Looks More Promising Moving Forward?,still open
Coca Cola Co.,02/10/2023,"Top Stock Reports for Alphabet, JPMorgan & Coca-Cola",still open
Coca Cola Co.,02/10/2023,Jim Cramer says Coca-Cola is a buy after company 'put on a clinic' in latest earnings report,still open
Coca Cola Co.,02/10/2023,Ready For A Recession? Here's One Defensive Stock You Can't ...,still open
Coca Cola Co.,02/10/2023,"Laser Photonics stock blasts off on heavy volume again, after Coca ...",still open
Coca Cola Co.,02/10/2023,Coke Vs. Pepsi Stock: Which One Is Better?,still open
Coca Cola Co.,02/10/2023,What Do Bitcoin and Coca-Cola Have in Common?,still open
Coca Cola Co.,02/10/2023,Coca-Cola Vs. PepsiCo: Which Is Currently The More Attractive Stock?,still open
Coca Cola Co.,02/10/2023,Better Buy: Coca-Cola vs. PepsiCo,still open
Coca Cola Co.,02/10/2023,Better Dividend Stock for 2023? 3M Stock vs. Coca-Cola Stock,still open
Coca Cola Co.,02/10/2023,Coca-Cola Co (KO) Stock: How Does it Score on Fundamental Metrics?,still open
Coca Cola Co.,02/10/2023,Engine No. 1 held talks with Coca-Cola on new recycling initiatives ...,still open
Coca Cola Co.,02/10/2023,Coca-Cola to Delay IPO of Africa Bottler on Market Turmoil,still open
Coca Cola Co.,02/10/2023,Coca-Cola's Success Despite Price Hikes Underscores Its Brand Value,still open
Coca Cola Co.,02/10/2023,Coca-Cola Co. stock underperforms Thursday when compared to competitors,still open
Coca Cola Co.,02/10/2023,Coca-Cola partners with Rosalía on new drink,still open
Coca Cola Co.,02/10/2023,Highland Capital Management LLC Buys 25381 Shares of The ...,still open
Coca Cola Co.,02/10/2023,Coca Cola associates take initiative to clean streets,still open
Coca Cola Co.,02/10/2023,Coca-Cola Co. stock underperforms Friday when compared to ...,still open
Coca Cola Co.,02/10/2023,The Coca-Cola Company (NYSE:KO) Receives Consensus ...,still open
Coca Cola Co.,02/10/2023,Metis Global Partners LLC Purchases 4648 Shares of The Coca ...,still open
Coca Cola Co.,02/10/2023,Is Coca-Cola Co (KO) a Stock to Watch After Gaining 1.88% This Week?,still open
Coca Cola Co.,02/10/2023,"Coca-Cola Co. stock rises Monday, still underperforms market",still open
Coca Cola Co.,02/10/2023,BlackRock Increases Position in Coca Cola (KO),still open
Coca Cola Co.,02/10/2023,Coca-Cola Co. stock underperforms Tuesday when compared to competitors despite daily gains,still open
Coca Cola Co.,02/10/2023,"Coca-Cola Co. stock falls Wednesday, underperforms market",still open
Coca Cola Co.,02/10/2023,"The Zacks Analyst Blog Highlights PepsiCo, Coca-Cola, The Boston ...",still open
Coca Cola Co.,02/10/2023,PepsiCo says no more price hikes after better-than-expected ...,still open
Coca Cola Co.,02/10/2023,"Earnings Previews: Cleveland Cliffs, Coca-Cola, Peabody Energy ...",still open
Coca Cola Co.,02/10/2023,Article about FTC probe brings denial from Coca-Cola,still open
Coca Cola Co.,02/10/2023,CocaCola Company (The) (KO) Is a Trending Stock: Facts to Know ...,still open
Coca Cola Co.,02/10/2023,Fire sparks next to Coca-Cola factory in Broward County,still open
Coca Cola Co.,02/10/2023,OpenX Appoints Caroline Slocombe to Lead Coca-Cola Company ...,still open
Coca Cola Co.,02/10/2023,"Earnings week ahead: Coca-Cola, Shopify, Airbnb, Palantir and ...",still open
Coca Cola Co.,02/10/2023,February is American Heart Month,still open
Coca Cola Co.,02/10/2023,16 Most Valuable Beverage Brands in the World,still open
Coca Cola Co.,02/10/2023,"Minute Maid class action alleges juice boxes misleading, falsely ...",still open
Coca Cola Co.,02/10/2023,Realme 10 Pro 5G Coca-Cola Edition Smartphone Takes Co ...,still open
Coca Cola Co.,02/10/2023,The real thing: Coca-Cola fandom brings Cleveland couple together,still open
Coca Cola Co.,02/10/2023,The Coca-Cola Company Announces Timing of Fourth Quarter and ...,still open
Coca Cola Co.,02/10/2023,First Mayor’s Council of Clergy Luncheon of 2023,still open
Coca Cola Co.,02/10/2023,Vita Coco wants its coconut water to be your cocktail mixer — and your hangover cure,still open
Coca Cola Co.,02/10/2023,"Kellogg's sales and profit beat estimates, to retain plant-based meat ...",still open
Coca Cola Co.,02/10/2023,3 Blue Chip Stocks To Watch In February 2023,still open
Coca Cola Co.,02/10/2023,Parsec Financial Management Inc. Acquires 16381 Shares of The ...,still open
Coca Cola Co.,02/10/2023,Heart and Soul Workshop provides school break program for students,still open
Coca Cola Co.,02/10/2023,Flavored and Functional Water Market Pronounce Growth in ...,still open
Coca Cola Co.,02/10/2023,"Coca-Cola HBC falls Friday, underperforms market",still open
Coca Cola Co.,02/10/2023,Here's What to Expect Ahead of Cadence's (CDNS) Q4 Earnings,still open
Coca Cola Co.,02/10/2023,TSD Seniors Named Coca-Cola Scholar Semifinalists for 2023,still open
Coca Cola Co.,02/10/2023,"In Buckhead's newest tower, aluminum giant Novelis opens its offices",still open
Coca Cola Co.,02/10/2023,Culver's restaurant chain drops PepsiCo's beverages for Coca-Cola ...,still open
Coca Cola Co.,02/10/2023,Coke Florida Celebrates Black History Month with Focus on ...,still open
Coca Cola Co.,02/10/2023,Warren Buffett More Than Doubles His Money on This Stock Every 2 ...,still open
Coca Cola Co.,02/10/2023,The Coca-Cola Company's Costa Coffee expands footprint in India ...,still open
Coca Cola Co.,02/10/2023,4 Beverage Stocks Set to Pull Off a Beat This Earnings Season,still open
Coca Cola Co.,02/10/2023,Coca-Cola Southwest Beverages “All-Star” Employees Starring in New Television Ad During the Big...,still open
Coca Cola Co.,02/10/2023,"Nutraceuticals Market Size, Share, Growth Statistics By Top Key ...",still open
Coca Cola Co.,02/10/2023,Mondelez names new leader for Clif Bar,still open
Coca Cola Co.,02/10/2023,Markets - Feb. 10,still open
Coca Cola Co.,02/10/2023,Canned Beverage Market is booming Globally with Top key players ...,still open
Coca Cola Co.,02/10/2023,"Coca-Cola Consolidated, Inc. (NASDAQ:COKE) Shares Bought by ...",still open
Coca Cola Co.,02/10/2023,ARCA Continental (BMV: AC) Rep,still open
Coca Cola Co.,02/10/2023,"‘All-natural’ Simply Tropical juice has high toxic PFAS levels, lawsuit alleges",still open
Coca Cola Co.,02/10/2023,Bottled Water Market Is Booming Worldwide: Forecast period 2020 ...,still open
Coca Cola Co.,02/10/2023,Energy Drink Market To Show Incredible Revenue Growth By 2030 ...,still open
Coca Cola Co.,02/10/2023,3 Dividend Stocks That Will Hold Up No Matter the Market Conditions,still open
Coca Cola Co.,02/10/2023,This German Cake Uses 'Fanta' As Flavouring - Learn How To Make This Fun Dessert,still open
Coca Cola Co.,02/10/2023,"CCEP Indonesia, Dynapack Asia unveil Amandina Bumi Nusantara PET recycling plant - The Jakarta Post",still open
Coca Cola Co.,02/10/2023,10 Coca-Cola Products You Can’t Buy Anymore,still open
Coca Cola Co.,02/10/2023,Work With Us,still open
Coca Cola Co.,02/10/2023,Coca-Cola Invites Fans to Experience Dreamworld – News & Articles,still open
Coca Cola Co.,02/10/2023,2022 Shipper of Choice profile: The Coca-Cola Co.,still open
Coca Cola Co.,02/10/2023,DASANI and Sprite Boost Sustainability Packaging Credentials ...,still open
Coca Cola Co.,02/10/2023,Jack Daniel's & Coca-Cola RTD Debuts in Mexico - News & Articles,still open
Coca Cola Co.,02/10/2023,"JEPI Is The Name, High Yield Is The Game (NYSEARCA:JEPI)",still open
Coca Cola Co.,02/10/2023,Social Impact,still open
Coca Cola Co.,02/10/2023,Ten Biggest Companies Reporting Earnings In The Third Week Of ...,still open
Coca Cola Co.,02/10/2023,"Week ahead: big banks begin unveiling bumper returns, US and UK ...",still open
Coca Cola Co.,02/10/2023,Coca-Cola bottler to detail costs of exiting Russia,still open
Coca Cola Co.,02/10/2023,Coca-Cola Wins in Greenwashing Suits Show Hazy Marketing Limits,still open
Coca Cola Co.,02/10/2023,Coca-Cola bottler starts making 'Dobry Cola' in Russia,still open
Coca Cola Co.,02/10/2023,"2021 Business, Environmental, Social & Governance | Company ...",still open
Coca Cola Co.,02/10/2023,FTSE 100 and FTSE 250 shares – what to expect on the stock ...,still open
Coca Cola Co.,02/10/2023,US open: Stocks lower as volatile week draws to a close | Financial ...,still open
Coca Cola Co.,02/10/2023,Our Partnerships,still open
Coca Cola Co.,02/10/2023,Coca-Cola Launches 'Real Magic Presents' with Christmas ...,still open
Coca Cola Co.,02/10/2023,Our Military Community,still open
Coca Cola Co.,02/10/2023,Is it Worth Investing in The Coca-Cola Company (KO)?,still open
Coca Cola Co.,02/10/2023,A Deeper Look at Coca-Cola's Emerging Business in Alcohol ...,still open
Coca Cola Co.,02/10/2023,14 Best Dividend Stocks To Buy and Hold,still open
Coca Cola Co.,02/10/2023,Community Engagement & Empowerment,still open
Coca Cola Co.,02/10/2023,Coca-Cola Opens West Coast HQ at Spectrum Terrace,still open
Coca Cola Co.,02/10/2023,Sprite Fresca Seagrams Mark Ronson Madlib Music Connection ...,still open
Coca Cola Co.,02/10/2023,Coca-cola and Universal Create Secret Menu –News & Articles,still open
Coca Cola Co.,02/10/2023,Coca-Cola Christmas Caravan Embarks Twenty Fifth Anniversary ...,still open
Coca Cola Co.,02/10/2023,Should You Buy Coca-Cola Co (KO) Stock Monday?,still open
Coca Cola Co.,02/10/2023,The Coca-Cola Company Partners with Musical Legends Mark ...,still open
Coca Cola Co.,02/10/2023,Coca-Cola Commissions Collective of Atlanta Artists - News & Articles,still open
Coca Cola Co.,02/10/2023,How Coca-Cola Will Show Football Fans That Believing is Magic ...,still open
Coca Cola Co.,02/10/2023,Engine No. 1 held talks with Coca-Cola on new recycling initiatives ...,still open
Coca Cola Co.,02/10/2023,"Tesco, Waitrose, Aldi and more recall popular foods due to health fears",still open
Coca Cola Co.,02/10/2023,Coca-Cola confident 2 years after reorganization despite 'all the ...,still open
Coca Cola Co.,02/10/2023,Coke bottler Coca-Cola HBC depleting stock in Russia,still open
Coca Cola Co.,02/10/2023,The Coca-Cola Company Elects Three Officers and Declares ...,still open
Coca Cola Co.,02/10/2023,Coca-Cola Co. leverages 'intelligent experimentation' to land 'epic ...,still open
Coca Cola Co.,02/10/2023,Coca-Cola System Jobs,still open
Coca Cola Co.,02/10/2023,Coca Cola Showcases Solutions at Convenience Stores Show ...,still open
Coca Cola Co.,02/10/2023,Coca-Cola and Bottler Support Jackson Relief Efforts,still open
Coca Cola Co.,02/10/2023,Coca-Cola Hosts Community Engagement Summit –News & Articles,still open
Coca Cola Co.,02/10/2023,The Coca-Cola Company Announces New Leaders in Operations,still open
Coca Cola Co.,02/10/2023,"Coca-Cola Co. stock rises Friday, still underperforms market",still open
Coca Cola Co.,02/10/2023,Highland Capital Management LLC Buys 25381 Shares of The ...,still open
Coca Cola Co.,02/10/2023,LSV Asset Management sells a stake in Coca-Cola Consolidated ...,still open
Coca Cola Co.,02/10/2023,Coca-Cola Europacific Partners (NYSE:CCEP) Stock Rating ...,still open
Coca Cola Co.,02/10/2023,Coca-Cola Co. stock underperforms Thursday when compared to competitors,still open
Coca Cola Co.,02/10/2023,Coca-Cola (KO) Set to Announce Quarterly Earnings on Tuesday,still open
Coca Cola Co.,02/10/2023,The Coca-Cola Company (NYSE:KO) Receives Consensus ...,still open
Coca Cola Co.,02/10/2023,Metis Global Partners LLC Purchases 4648 Shares of The Coca ...,still open
Coca Cola Co.,02/10/2023,Coca-Cola Co. stock underperforms Friday when compared to ...,still open
Coca Cola Co.,02/10/2023,Is Coca-Cola Co (KO) a Stock to Watch After Gaining 1.88% This Week?,still open
Coca Cola Co.,02/10/2023,Coca-Cola Co. stock underperforms Tuesday when compared to competitors despite daily gains,still open
Coca Cola Co.,02/10/2023,"Coca-Cola Co. stock rises Monday, still underperforms market",still open
Coca Cola Co.,02/10/2023,"Coca-Cola Co. stock falls Wednesday, underperforms market",still open
Coca Cola Co.,02/10/2023,BlackRock Increases Position in Coca Cola (KO),still open
Coca Cola Co.,02/10/2023,3 Blue Chip Stocks To Watch In February 2023,still open
Coca Cola Co.,02/10/2023,"Earnings Previews: Cleveland Cliffs, Coca-Cola, Peabody Energy ...",still open
Coca Cola Co.,02/10/2023,"The Zacks Analyst Blog Highlights PepsiCo, Coca-Cola, The Boston ...",still open
Coca Cola Co.,02/10/2023,Parsec Financial Management Inc. Acquires 16381 Shares of The ...,still open
Coca Cola Co.,02/10/2023,60 years of dividend growth! This Warren Buffett stock could make ...,still open
Coca Cola Co.,02/10/2023,Korea Investment CORP Grows Stake in Dollar General Co. (NYSE ...,still open
Coca Cola Co.,02/10/2023,"The Zacks Analyst Blog Highlights UnitedHealth Group, The Coca-Cola, Roche Holding, Lam Research and Valero Energy",still open
Coca Cola Co.,02/10/2023,You'll Never Believe the 'Dumbest' Stock Warren Buffett Ever Bought,still open
Coca Cola Co.,02/10/2023,Buffett Stock Portfolio: Warren Buffett’s Recent Buys,still open
Coca Cola Co.,02/10/2023,"Dupont Capital Management Corp sells 1,878 Coca-Cola ...",still open
Coca Cola Co.,02/10/2023,"Starbucks Corp. stock rises Friday, still underperforms market",still open
Coca Cola Co.,02/10/2023,Vita Coco wants its coconut water to be your cocktail mixer — and your hangover cure,still open
Coca Cola Co.,02/10/2023,4 Beverage Stocks Set to Pull Off a Beat This Earnings Season,still open
Coca Cola Co.,02/10/2023,Comerica Bank Reduces Its Holdings in Coca-Cola Consolidated ...,still open
Coca Cola Co.,02/10/2023,"Starbucks Corp. stock rises Friday, outperforms market",still open
Coca Cola Co.,02/10/2023,"Kraft Heinz Co. stock falls Thursday, underperforms market",still open
Coca Cola Co.,02/10/2023,"Kraft Heinz Co. stock rises Wednesday, still underperforms market",still open
Coca Cola Co.,02/10/2023,FTSE 100 and FTSE 250 shares – what to expect on the stock ...,still open
Coca Cola Co.,02/10/2023,"Starbucks Corp. stock falls Wednesday, underperforms market",still open
Coca Cola Co.,02/10/2023,Article about FTC probe brings denial from Coca-Cola,still open
Coca Cola Co.,02/10/2023,KO: The 2 Best Dow Stocks to Buy in 2023,still open
Coca Cola Co.,02/10/2023,"Earnings Tracker: PepsiCo, Disney, Kellogg, Robinhood, Mattel and ...",still open
Coca Cola Co.,02/10/2023,Newell Brands CEO Saligram to retire; forecasts 2023 results below ...,still open
Coca Cola Co.,02/10/2023,MRK: The 3 Best Large-Cap Stocks to Buy Now and Hold Forever,still open
Coca Cola Co.,02/10/2023,Market movers: Stocks that saw action on Thursday - and why,still open
Coca Cola Co.,02/10/2023,"JEPI Is The Name, High Yield Is The Game (NYSEARCA:JEPI)",still open
Coca Cola Co.,02/10/2023,Should You Buy Coca-Cola Co (KO) Stock Monday?,still open
Coca Cola Co.,02/10/2023,Brokerages have given Coca-Cola Europacific Partners PLC (NYSE ...,still open
Coca Cola Co.,02/10/2023,4 Dividend Aristocrat Buys For February,still open
Coca Cola Co.,02/10/2023,"Coca-Cola Co. stock rises Friday, still underperforms market",still open
Coca Cola Co.,02/10/2023,Coca-Cola Co (KO) Stock: What Does the Chart Say Monday?,still open
Coca Cola Co.,02/10/2023,3 FTSE 100 shares I'd buy to invest like Warren Buffett,still open
Coca Cola Co.,02/10/2023,Buying ASX shares as a beginner? Here are 3 things I wish I'd known,still open
Coca Cola Co.,02/10/2023,S&P 500 sinks as investors debate the Fed’s next move,still open
Coca Cola Co.,02/10/2023,Is Sierra Mist Being Discontinued? Pepsi Launches Sprite ...,still open
Coca Cola Co.,02/10/2023,"Coca-Cola Co. stock rises Friday, outperforms market",still open
Coca Cola Co.,02/10/2023,Can Coca-Cola Co (KO) Stock Rise to the Top of Consumer Defensive Sector Monday?,still open
Coca Cola Co.,02/10/2023,Week ahead: 13-17 February - Investors' Chronicle,still open
Coca Cola Co.,02/10/2023,"Coca-Cola Co. stock rises Tuesday, outperforms market",still open
Coca Cola Co.,02/10/2023,"Coca-Cola Co. stock rises Wednesday, still underperforms market",still open
Coca Cola Co.,02/10/2023,Coca-Cola Co. stock outperforms competitors despite losses on the day,still open
Coca Cola Co.,02/10/2023,Coca-Cola Stock: Buy Now or Wait?,still open
Coca Cola Co.,02/10/2023,Where Does Coca-Cola Co (KO) Stock Fall in the Beverages - Non-Alcoholic Field After It Is Lower By -1.03% This Week?,still open
Coca Cola Co.,02/10/2023,Coca-Cola Co. stock outperforms market despite losses on the day,still open
Coca Cola Co.,02/10/2023,Stock Market Sell-Off: Is Coca-Cola a Buy?,still open
Coca Cola Co.,02/10/2023,Colgate Elects Steve Cahillane to Board of Directors,still open
Coca Cola Co.,02/10/2023,Brian John Smith Sells 94200 Shares of The Coca-Cola Company ...,still open
Coca Cola Co.,02/10/2023,Why Warren Buffett Loves Coca-Cola Stock,still open
Coca Cola Co.,02/10/2023,Is Coca-Cola Stock a Buy?,still open
Coca Cola Co.,02/10/2023,What do the Fundamentals Predict for Coca-Cola Co (KO) Stock?,still open
Coca Cola Co.,02/10/2023,Where Will Coca-Cola Stock Be in 5 Years?,still open
Coca Cola Co.,02/10/2023,Will Coca-Cola Co (KO) Stay at the Top of the Consumer Defensive Sector?,still open
Coca Cola Co.,02/10/2023,Coca-Cola is a stable safe haven in a rough market,still open
Coca Cola Co.,02/10/2023,"Week ahead: big banks begin unveiling bumper returns, US and UK ...",still open
Coca Cola Co.,02/10/2023,"Coca-Cola Stock Higher As Price Hikes Help Q3 Earnings, Revenue Beat, 2022 Forecast Boost",still open
Coca Cola Co.,02/10/2023,Is Coca-Cola Stock A Buy After Beating Earnings? Outlook Is ...,still open
Coca Cola Co.,02/10/2023,"Shares of Coca-Cola are a buy for these four reasons, Jim Cramer says",still open
Coca Cola Co.,02/10/2023,Coke bottler Coca-Cola HBC depleting stock in Russia,still open
Coca Cola Co.,02/10/2023,This Restaurant Is Likely A Better Pick Over Coca-Cola Stock,still open
Coca Cola Co.,02/10/2023,The Coca-Cola Company Elects Three Officers and Declares ...,still open
Coca Cola Co.,02/10/2023,Should Investors Follow Warren Buffett Into Coca-Cola Stock?,still open
Coca Cola Co.,02/10/2023,Coca-Cola and PepsiCo could face pricing probe,still open
Coca Cola Co.,02/10/2023,Investors Heavily Search CocaCola Company The (KO): Here is ...,still open
Coca Cola Co.,02/10/2023,"Top Stock Reports for Coca-Cola, Merck & Toyota Motor",still open
Coca Cola Co.,02/10/2023,Warren Buffett Has Held This Stock for Over 34 Years — Why He Will Never Sell,still open
Coca Cola Co.,02/10/2023,KO vs. PEP: Why Coca-Cola Stock Looks Tastier,still open
Coca Cola Co.,02/10/2023,PepsiCo makes big promise to consumers | Business,still open
Coca Cola Co.,02/10/2023,Coca-Cola bottler to detail costs of exiting Russia,still open
Coca Cola Co.,02/10/2023,Coca-Cola bottler starts making 'Dobry Cola' in Russia,still open
Coca Cola Co.,02/10/2023,MSFT: Coca-Cola and 3 Other High-Quality Stocks to Buy This ...,still open
Coca Cola Co.,02/10/2023,Coca-Cola vs. PepsiCo: Which Stock Looks More Promising Moving Forward?,still open
Coca Cola Co.,02/10/2023,"Top Stock Reports for Alphabet, JPMorgan & Coca-Cola",still open
Coca Cola Co.,02/10/2023,Jim Cramer says Coca-Cola is a buy after company 'put on a clinic' in latest earnings report,still open
Coca Cola Co.,02/10/2023,Ready For A Recession? Here's One Defensive Stock You Can't ...,still open
Coca Cola Co.,02/10/2023,"Laser Photonics stock blasts off on heavy volume again, after Coca ...",still open
Coca Cola Co.,02/10/2023,Coke Vs. Pepsi Stock: Which One Is Better?,still open
Coca Cola Co.,02/10/2023,What Do Bitcoin and Coca-Cola Have in Common?,still open
Coca Cola Co.,02/10/2023,Coca-Cola Vs. PepsiCo: Which Is Currently The More Attractive Stock?,still open
Coca Cola Co.,02/10/2023,Better Buy: Coca-Cola vs. PepsiCo,still open
Coca Cola Co.,02/10/2023,Better Dividend Stock for 2023? 3M Stock vs. Coca-Cola Stock,still open
Coca Cola Co.,02/10/2023,Coca-Cola Co (KO) Stock: How Does it Score on Fundamental Metrics?,still open
Coca Cola Co.,02/10/2023,Engine No. 1 held talks with Coca-Cola on new recycling initiatives ...,still open
Coca Cola Co.,02/10/2023,Coca-Cola to Delay IPO of Africa Bottler on Market Turmoil,still open
Coca Cola Co.,02/10/2023,Coca-Cola's Success Despite Price Hikes Underscores Its Brand Value,still open
Coca Cola Co.,02/11/2023,Coca-Cola Company (KO) to Release Quarter 4 Numbers,still open
Coca Cola Co.,02/11/2023,Coca-Cola (KO) Set to Announce Quarterly Earnings on Tuesday,still open
Coca Cola Co.,02/11/2023,Rosalía & Coca-Cola Drop Limited-Edition Flavor: ‘It Reminds Me of My Favorite Fruit’,still open
Coca Cola Co.,02/11/2023,Coca-Cola Co. stock underperforms Thursday when compared to competitors,still open
Coca Cola Co.,02/11/2023,Coca Cola associates take initiative to clean streets,still open
Coca Cola Co.,02/11/2023,Udine Wealth Management Inc. Buys Shares of 4824 The Coca ...,still open
Coca Cola Co.,02/11/2023,"Coca-Cola Co. stock rises Wednesday, still underperforms market",still open
Coca Cola Co.,02/11/2023,CocaCola Company (The) (KO) Is a Trending Stock: Facts to Know Before Betting on It,still open
Coca Cola Co.,02/11/2023,BlackRock Increases Position in Coca Cola (KO),still open
Coca Cola Co.,02/11/2023,Is Coca-Cola Co (KO) a Stock to Watch After Gaining 1.88% This Week?,still open
Coca Cola Co.,02/11/2023,"Coca-Cola Co. stock rises Monday, still underperforms market",still open
Coca Cola Co.,02/11/2023,The Coca-Cola Company (NYSE:KO) Receives Consensus ...,still open
Coca Cola Co.,02/11/2023,Coca-Cola Consolidated Teamsters Reject Contract Offer,still open
Coca Cola Co.,02/11/2023,Coca-Cola Co. stock underperforms Tuesday when compared to competitors despite daily gains,still open
Coca Cola Co.,02/11/2023,PepsiCo says no more price hikes after better-than-expected ...,still open
Coca Cola Co.,02/11/2023,Metis Global Partners LLC Purchases 4648 Shares of The Coca ...,still open
Coca Cola Co.,02/11/2023,U.S. Recycling Could Hit 75% With ‘Itty-Bitty’ Fees For Extended Producer Responsibility,still open
Coca Cola Co.,02/11/2023,Realme’s Coca-Cola-themed phone’s price won’t burn a hole in your pocket,still open
Coca Cola Co.,02/11/2023,OpenX Appoints Caroline Slocombe to Lead Coca-Cola Company ...,still open
Coca Cola Co.,02/11/2023,Coca-Cola looking to ‘pay it forward’ with student internship program,still open
Coca Cola Co.,02/11/2023,"Earnings Previews: Cleveland Cliffs, Coca-Cola, Peabody Energy",still open
Coca Cola Co.,02/11/2023,The Coca-Cola Company Announces Timing of Fourth Quarter and ...,still open
Coca Cola Co.,02/11/2023,16 Most Valuable Beverage Brands in the World,still open
Coca Cola Co.,02/11/2023,"Minute Maid class action alleges juice boxes misleading, falsely ...",still open
Coca Cola Co.,02/11/2023,Parsec Financial Management Inc. Acquires 16381 Shares of The ...,still open
Coca Cola Co.,02/11/2023,Celebrating Black History Month,still open
Coca Cola Co.,02/11/2023,3 Blue Chip Stocks To Watch In February 2023,still open
