Name,Data,News,Evaluation
Coca Cola Co.,02/14/2023,"KO: If You Could Only Own 3 Stocks, It Should Be These",still open
Coca Cola Co.,02/14/2023,"US STOCKS-Wall St slides as inflation data, policymakers stoke rate worries",still open
Coca Cola Co.,02/14/2023,Why the Highest Yielding Warren Buffett Stocks Are Still the Best 2023 Ideas,still open
Coca Cola Co.,02/14/2023,"Eurozone GDP, U.S. CPI, Coca Cola, AirBnB Earnings",still open
Coca Cola Co.,02/14/2023,Fusion Beverages Market Development Size 2023 |Coca-Cola ...,still open
Coca Cola Co.,02/14/2023,5 Blue-Chip Stocks to Buy Despite Dow's Sluggish Start in 2023,still open
Coca Cola Co.,02/14/2023,The Coca-Cola Company's Costa Coffee expands footprint in India ...,still open
Coca Cola Co.,02/14/2023,Coke says Q4 demand strong despite higher prices,still open
Coca Cola Co.,02/14/2023,"Investor Optimism Improves Slightly As US Stocks Record Gains - Coca-Cola (NYSE:KO), Airbnb (NASDAQ:ABNB)",still open
Coca Cola Co.,02/14/2023,Low Calorie Chocolate Milk Market is Predicted to Reach US$ 6367 ...,still open
Coca Cola Co.,02/14/2023,"Daily Brief Consumer: Yashili International Holdings, Taste Gourmet ...",still open
Coca Cola Co.,02/14/2023,"Airbnb Options Traders Betting On Stock Falling This Much By Friday - Coca-Cola (NYSE:KO), Airbnb (NASDAQ",still open
Coca Cola Co.,02/14/2023,15 Dividend Growth Stocks with the Highest Growth Rates,still open
Coca Cola Co.,02/14/2023,Work With Us,still open
Coca Cola Co.,02/14/2023,"Coca-Cola Beats Profit Estimates, Raises Full-Year Guidance",still open
Coca Cola Co.,02/14/2023,2022 Shipper of Choice profile: The Coca-Cola Co.,still open
Coca Cola Co.,02/14/2023,Social Impact,still open
Coca Cola Co.,02/14/2023,Coca-Cola Invites Fans to Experience Dreamworld – News & Articles,still open
Coca Cola Co.,02/14/2023,Jack Daniel's & Coca-Cola RTD Debuts in Mexico - News & Articles,still open
Coca Cola Co.,02/14/2023,DASANI and Sprite Boost Sustainability Packaging Credentials ...,still open
Coca Cola Co.,02/14/2023,Coca-Cola Wins in Greenwashing Suits Show Hazy Marketing Limits,still open
Coca Cola Co.,02/14/2023,Coca-Cola bottler to detail costs of exiting Russia,still open
Coca Cola Co.,02/14/2023,Coca-Cola bottler starts making 'Dobry Cola' in Russia,still open
Coca Cola Co.,02/14/2023,Is it Worth Investing in The Coca-Cola Company (KO)?,still open
Coca Cola Co.,02/14/2023,"2021 Business, Environmental, Social & Governance | Company ...",still open
Coca Cola Co.,02/14/2023,Coca-Cola Offers Voluntary Buyouts to Some North America Staff,still open
Coca Cola Co.,02/14/2023,Our Partnerships,still open
Coca Cola Co.,02/14/2023,Coca-Cola Launches 'Real Magic Presents' with Christmas ...,still open
Coca Cola Co.,02/14/2023,Our Military Community,still open
Coca Cola Co.,02/14/2023,"Coca-Cola Co. stock rises Friday, still underperforms market",still open
Coca Cola Co.,02/14/2023,A Deeper Look at Coca-Cola's Emerging Business in Alcohol ...,still open
Coca Cola Co.,02/14/2023,Coca-Cola Opens West Coast HQ at Spectrum Terrace,still open
Coca Cola Co.,02/14/2023,Community Engagement & Empowerment,still open
Coca Cola Co.,02/14/2023,Coca-cola and Universal Create Secret Menu –News & Articles,still open
Coca Cola Co.,02/14/2023,Should You Buy Coca-Cola Co (KO) Stock Monday?,still open
Coca Cola Co.,02/14/2023,Coca-Cola Christmas Caravan Embarks Twenty Fifth Anniversary ...,still open
Coca Cola Co.,02/14/2023,The Coca-Cola Company Partners with Musical Legends Mark ...,still open
Coca Cola Co.,02/14/2023,Engine No. 1 held talks with Coca-Cola on new recycling initiatives ...,still open
Coca Cola Co.,02/14/2023,Coca-Cola Commissions Collective of Atlanta Artists - News & Articles,still open
Coca Cola Co.,02/14/2023,How Coca-Cola Will Show Football Fans That Believing is Magic ...,still open
Coca Cola Co.,02/14/2023,Coke bottler Coca-Cola HBC depleting stock in Russia,still open
Coca Cola Co.,02/14/2023,Coca-Cola System Jobs,still open
Coca Cola Co.,02/14/2023,Coca-Cola confident 2 years after reorganization despite 'all the ...,still open
Coca Cola Co.,02/14/2023,Coca Cola Showcases Solutions at Convenience Stores Show ...,still open
Coca Cola Co.,02/14/2023,Coca-Cola Co. leverages 'intelligent experimentation' to land 'epic ...,still open
Coca Cola Co.,02/14/2023,Coca-Cola Hosts Community Engagement Summit –News & Articles,still open
Coca Cola Co.,02/14/2023,The Coca-Cola Company Announces New Leaders in Operations,still open
Coca Cola Co.,02/14/2023,Coca-Cola and Bottler Support Jackson Relief Efforts,still open
Coca Cola Co.,02/14/2023,Molson Coors expands agreement with The Coca-Cola Co. for Topo ...,still open
Coca Cola Co.,02/14/2023,Is Coca-Cola Company (KO) a Good Long-Term Investment?,still open
Coca Cola Co.,02/14/2023,The Coca-Cola Company Elects Three Officers and Declares ...,still open
Coca Cola Co.,02/14/2023,"With 62% ownership of the shares, The Coca-Cola Company (NYSE:KO) is heavily dominated by institutional owners",still open
Coca Cola Co.,02/14/2023,Coca-Cola CEO sees alcohol as fourth bucket,still open
Coca Cola Co.,02/14/2023,"Coke Florida, The Coca-Cola Foundation, and The Coca-Cola ...",still open
Coca Cola Co.,02/14/2023,The Coca-Cola Company Announces Participation in Redburn CEO ...,still open
Coca Cola Co.,02/14/2023,Barry Simpson to Step Down as Chief Platform Services Officer of ...,still open
Coca Cola Co.,02/14/2023,"Coca-Cola Co. stock rises Friday, outperforms market",still open
Coca Cola Co.,02/14/2023,"Coca-Cola Co. stock rises Wednesday, outperforms market",still open
Coca Cola Co.,02/14/2023,John Murphy to Become President and Chief Financial Officer of The ...,still open
Coca Cola Co.,02/14/2023,Coca-Cola Co. stock outperforms market on strong trading day,still open
Coca Cola Co.,02/14/2023,Coca-Cola’s stock falls even after company beats revenue projections and provides upbeat outlook,still open
Coca Cola Co.,02/14/2023,"Coca-Cola beats revenue mark, stock rises",still open
Coca Cola Co.,02/14/2023,Buy Coca-Cola Stock Before Earnings After Pepsi's Solid Q4 Report?,still open
Coca Cola Co.,02/14/2023,Coca-Cola Stock Options Pop After Earnings,still open
Coca Cola Co.,02/14/2023,Coca-Cola (KO Stock): The catalyst will be the announcement of the US CPI,still open
Coca Cola Co.,02/14/2023,"Coca-Cola Co. stock rises Monday, outperforms market",still open
Coca Cola Co.,02/14/2023,The Coca-Cola Company (NYSE:KO) Receives Consensus ...,still open
Coca Cola Co.,02/14/2023,Coca-Cola Co. stock underperforms Tuesday when compared to competitors despite daily gains,still open
Coca Cola Co.,02/14/2023,Is Coca-Cola Co (KO) a Stock to Watch After Gaining 1.88% This Week?,still open
Coca Cola Co.,02/14/2023,"Coca-Cola Co. stock rises Wednesday, still underperforms market",still open
Coca Cola Co.,02/14/2023,"Coca-Cola Co. stock rises Monday, still underperforms market",still open
Coca Cola Co.,02/14/2023,US STOCKS-S&P 500 dips as inflation data supports rate worries,still open
Coca Cola Co.,02/14/2023,BlackRock Increases Position in Coca Cola (KO),still open
Coca Cola Co.,02/14/2023,Stock Market Today: Stocks Lower As Sticky Inflation Sparks Fed Rate Bets; Treasury Yields Rise,still open
Coca Cola Co.,02/14/2023,"Coca-Cola beats revenue mark, stock rises",still open
Coca Cola Co.,02/14/2023,"Coca-Cola beats revenue mark and provides upbeat outlook, stock ...",still open
Coca Cola Co.,02/14/2023,KO: 1 Stock You Can Keep in Your Portfolio Forever,still open
Coca Cola Co.,02/14/2023,Metis Global Partners LLC Purchases 4648 Shares of The Coca ...,still open
Coca Cola Co.,02/14/2023,Why the Highest Yielding Warren Buffett Stocks Are Still the Best 2023 Ideas,still open
Coca Cola Co.,02/14/2023,Trending : Coca-Cola 4Q Revenue Rises but Profit Slips,still open
Coca Cola Co.,02/14/2023,"KO: If You Could Only Own 3 Stocks, It Should Be These",still open
Coca Cola Co.,02/14/2023,5 Blue-Chip Stocks to Buy Despite Dow's Sluggish Start in 2023,still open
Coca Cola Co.,02/14/2023,US STOCKS-Wall St steady as gains in growth stocks counter rate jitters,still open
Coca Cola Co.,02/14/2023,"Q4 Reporting Season Pushes Past Halfway Mark: Coca-Cola, Cisco Systems, Palantir, Roku Lead Earnings This",still open
Coca Cola Co.,02/14/2023,Parsec Financial Management Inc. Acquires 16381 Shares of The ...,still open
Coca Cola Co.,02/14/2023,Live news: Berkshire Hathaway boosts Apple stake but trims ...,still open
Coca Cola Co.,02/14/2023,3 Blue Chip Stocks To Watch In February 2023,still open
Coca Cola Co.,02/14/2023,5 U.S. Corporate Giants to Invest in Ahead of Earnings This Week,still open
Coca Cola Co.,02/14/2023,Stocks Mixed Tuesday Following CPI Report; Palantir Reports First ...,still open
Coca Cola Co.,02/14/2023,": Latest Stock Market News Today: Ford to cut 3,800 jobs, CPI ...",still open
Coca Cola Co.,02/14/2023,Market movers: Stocks that saw action on Tuesday - and why,still open
Coca Cola Co.,02/14/2023,"The Zacks Analyst Blog Highlights PepsiCo, Coca-Cola, The Boston ...",still open
Coca Cola Co.,02/14/2023,"Earnings Previews: Cleveland Cliffs, Coca-Cola, Peabody Energy",still open
Coca Cola Co.,02/14/2023,Canadian Market Might Start Positive,still open
Coca Cola Co.,02/14/2023,3 Great Compounder Stocks to Buy for Strong Returns in All Environments,still open
Coca Cola Co.,02/14/2023,"Starbucks Corp. stock rises Monday, still underperforms market",still open
Coca Cola Co.,02/14/2023,You'll Never Believe the 'Dumbest' Stock Warren Buffett Ever Bought,still open
Coca Cola Co.,02/14/2023,"Kraft Heinz Co. stock falls Tuesday, underperforms market",still open
Coca Cola Co.,02/14/2023,"Starbucks Corp. stock falls Wednesday, underperforms market",still open
Coca Cola Co.,02/14/2023,MRK: The 3 Best Large-Cap Stocks to Buy Now and Hold Forever,still open
Coca Cola Co.,02/14/2023,4 Beverage Stocks Set to Pull Off a Beat This Earnings Season,still open
Coca Cola Co.,02/14/2023,Should You Buy Coca-Cola Co (KO) Stock Monday?,still open
Coca Cola Co.,02/14/2023,"Coca-Cola Co. stock rises Friday, still underperforms market",still open
Coca Cola Co.,02/14/2023,Coca-Cola Co (KO) Stock: What Does the Chart Say Monday?,still open
Coca Cola Co.,02/14/2023,"Coca-Cola Co. stock rises Friday, outperforms market",still open
Coca Cola Co.,02/14/2023,"Coca-Cola Co. stock rises Wednesday, outperforms market",still open
Coca Cola Co.,02/14/2023,Can Coca-Cola Co (KO) Stock Rise to the Top of Consumer Defensive Sector Monday?,still open
Coca Cola Co.,02/14/2023,Coca-Cola Stock: Buy Now or Wait?,still open
Coca Cola Co.,02/14/2023,Where Does Coca-Cola Co (KO) Stock Fall in the Beverages - Non-Alcoholic Field After It Is Lower By -1.03% This Week?,still open
Coca Cola Co.,02/14/2023,Coca-Cola Co. stock outperforms competitors on strong trading day,still open
Coca Cola Co.,02/14/2023,Brian John Smith Sells 94200 Shares of The Coca-Cola Company ...,still open
Coca Cola Co.,02/14/2023,Stock Market Sell-Off: Is Coca-Cola a Buy?,still open
Coca Cola Co.,02/14/2023,Coca-Cola Co. stock outperforms competitors despite losses on the day,still open
Coca Cola Co.,02/14/2023,Why Warren Buffett Loves Coca-Cola Stock,still open
Coca Cola Co.,02/14/2023,Is Coca-Cola Stock a Buy?,still open
Coca Cola Co.,02/14/2023,What do the Fundamentals Predict for Coca-Cola Co (KO) Stock?,still open
Coca Cola Co.,02/14/2023,Will Coca-Cola Co (KO) Stay at the Top of the Consumer Defensive Sector?,still open
Coca Cola Co.,02/14/2023,Where Will Coca-Cola Stock Be in 5 Years?,still open
Coca Cola Co.,02/14/2023,Coca-Cola is a stable safe haven in a rough market,still open
Coca Cola Co.,02/14/2023,Colgate Elects Steve Cahillane to Board of Directors,still open
Coca Cola Co.,02/14/2023,Is Coca-Cola Stock A Buy After Beating Earnings? Outlook Is ...,still open
Coca Cola Co.,02/14/2023,"Shares of Coca-Cola are a buy for these four reasons, Jim Cramer says",still open
Coca Cola Co.,02/14/2023,Coke bottler Coca-Cola HBC depleting stock in Russia,still open
Coca Cola Co.,02/14/2023,Investors Heavily Search CocaCola Company The (KO): Here is ...,still open
Coca Cola Co.,02/14/2023,Coca-Cola raises full-year outlook as earnings beat expectations,still open
Coca Cola Co.,02/14/2023,9 Dividend Stocks to Buy as Inflation Protection,still open
Coca Cola Co.,02/14/2023,Should Investors Follow Warren Buffett Into Coca-Cola Stock?,still open
Coca Cola Co.,02/14/2023,Here's Why Coca-Cola (KO) Looks Poised for Q1 Earnings Beat,still open
Coca Cola Co.,02/14/2023,This Restaurant Is Likely A Better Pick Over Coca-Cola Stock,still open
Coca Cola Co.,02/14/2023,Coca-Cola Has Some Big Questions to Answer For Investors on ...,still open
Coca Cola Co.,02/14/2023,Coca-Cola's Success Despite Price Hikes Underscores Its Brand Value,still open
Coca Cola Co.,02/14/2023,Warren Buffett Has Held This Stock for Over 34 Years — Why He Will Never Sell,still open
Coca Cola Co.,02/14/2023,KO vs. PEP: Why Coca-Cola Stock Looks Tastier,still open
Coca Cola Co.,02/14/2023,Coca-Cola bottler starts making 'Dobry Cola' in Russia,still open
Coca Cola Co.,02/14/2023,Coca-Cola bottler to detail costs of exiting Russia,still open
Coca Cola Co.,02/14/2023,Will Coke (KO) Beat Estimates Again in Its Next Earnings Report?,still open
Coca Cola Co.,02/14/2023,"Zacks Industry Outlook Highlights Coca-Cola, PepsiCo, Coca-Cola ...",still open
Coca Cola Co.,02/14/2023,"Top Stock Reports for Alphabet, JPMorgan & Coca-Cola",still open
Coca Cola Co.,02/14/2023,Why Is Everyone Talking About Coca-Cola Stock?,still open
Coca Cola Co.,02/14/2023,MSFT: Coca-Cola and 3 Other High-Quality Stocks to Buy This ...,still open
Coca Cola Co.,02/14/2023,Jim Cramer says Coca-Cola is a buy after company 'put on a clinic' in latest earnings report,still open
Coca Cola Co.,02/14/2023,"Ex-Dividend Reminder: Dole, Coca-Cola and Advance Auto Parts",still open
Coca Cola Co.,02/14/2023,Coca-Cola vs. PepsiCo: Which Stock Looks More Promising Moving Forward?,still open
Coca Cola Co.,02/14/2023,Ready For A Recession? Here's One Defensive Stock You Can't ...,still open
Coca Cola Co.,02/14/2023,Coke Vs. Pepsi Stock: Which One Is Better?,still open
Coca Cola Co.,02/14/2023,"Laser Photonics stock blasts off on heavy volume again, after Coca-Cola implements laser cleaning system",still open
Coca Cola Co.,02/14/2023,Coca-Cola Vs. PepsiCo: Which Is Currently The More Attractive Stock?,still open
Coca Cola Co.,02/14/2023,Coca-Cola and PepsiCo could face pricing probe,still open
Coca Cola Co.,02/14/2023,Better Dividend Stock for 2023? 3M Stock vs. Coca-Cola Stock,still open
Coca Cola Co.,02/14/2023,Better Buy: Coca-Cola vs. PepsiCo,still open
Coca Cola Co.,02/14/2023,Coca-Cola Co (KO) Stock: How Does it Score on Fundamental Metrics?,still open
Coca Cola Co.,02/14/2023,Engine No. 1 held talks with Coca-Cola on new recycling initiatives ...,still open
Coca Cola Co.,02/14/2023,Coca-Cola to Delay IPO of Africa Bottler on Market Turmoil,still open
Coca Cola Co.,02/14/2023,Better Bear Market Buy: Coca-Cola vs. Altria,still open
Coca Cola Co.,02/14/2023,Coca-Cola Consolidated: An Upside You Can't Ignore (NASDAQ ...,still open
Coca Cola Co.,02/14/2023,Coca-Cola Offers Voluntary Buyouts to Some North America Staff,still open
Coca Cola Co.,02/14/2023,What Do Bitcoin and Coca-Cola Have in Common?,still open
Coca Cola Co.,02/14/2023,Coca-Cola to push ahead with price hikes as PepsiCo hits pause,still open
Coca Cola Co.,02/14/2023,"Coca-Cola revenue rises in fourth quarter, fueled by higher prices",still open
Coca Cola Co.,02/14/2023,Coca-Cola’s stock falls even after company beats revenue projections and provides upbeat outlook,still open
Coca Cola Co.,02/14/2023,Coca-Cola beats 4Q revenue estimates as price hikes add fizz,still open
Coca Cola Co.,02/14/2023,Coca-Cola Has a Sports-Drink Problem as BodyArmor Stumbles,still open
Coca Cola Co.,02/14/2023,FC Dallas Introduces Coca-Cola as Official Carbonated Beverage ...,still open
Coca Cola Co.,02/14/2023,Is It Time To Buy The Dip In The Coca-Cola Company,still open
Coca Cola Co.,02/14/2023,Rosalía x Coca-Cola Creations Move Launch,still open
Coca Cola Co.,02/14/2023,Coca-Cola Co. stock outperforms market on strong trading day,still open
Coca Cola Co.,02/14/2023,THE COCA-COLA COMPANY : Stock Market News and Information ...,still open
Coca Cola Co.,02/14/2023,Coca-Cola (KO Stock): The catalyst will be the announcement of the US CPI,still open
Coca Cola Co.,02/14/2023,Coca-Cola Zero Sugar Invites Fans to #TakeATaste in Newest ...,still open
Coca Cola Co.,02/14/2023,Coca-Cola Co. stock outperforms market despite losses on the day,still open
Coca Cola Co.,02/14/2023,Coca-Cola: There's Little Reason To Own It (NYSE:KO),still open
Coca Cola Co.,02/14/2023,"Coca-Cola: Q4 Earnings Solid, But Stock Remains A Hold (NYSE:KO)",still open
Coca Cola Co.,02/14/2023,How Rosalía inspired Coca-Cola’s latest flavor,still open
Coca Cola Co.,02/14/2023,"Daily Brief United States: S&P 500, Harley Davidson, Bakkt, Coca ...",still open
Coca Cola Co.,02/14/2023,Stock Analysis: Is Coca-Cola Company (KO) a good buy this year?,still open
Coca Cola Co.,02/14/2023,Trending : Coca-Cola 4Q Revenue Rises but Profit Slips,still open
Coca Cola Co.,02/14/2023,Coca-Cola talks up coffee and alcohol potential on earnings call,still open
Coca Cola Co.,02/14/2023,"Coca-Cola Co. stock rises Wednesday, still underperforms market",still open
Coca Cola Co.,02/14/2023,Coca-Cola Co. stock outperforms competitors despite losses on the day,still open
Coca Cola Co.,02/14/2023,India exemplifies long-term growth potential of beverage industry: Coca-Cola,still open
Coca Cola Co.,02/14/2023,Is Coca-Cola Co (KO) a Stock to Watch After Gaining 1.88% This Week?,still open
Coca Cola Co.,02/14/2023,Lilt drink brand to be scrapped and renamed Fanta,still open
Coca Cola Co.,02/14/2023,"Coca-Cola Co. stock rises Monday, still underperforms market",still open
Coca Cola Co.,02/14/2023,The Coca-Cola Company (NYSE:KO) Receives Consensus ...,still open
Coca Cola Co.,02/14/2023,"Coca-Cola has a 'right' to compete in the alcohol industry, CFO says",still open
Coca Cola Co.,02/14/2023,Coca-Cola adds tethered closures to boost PET recycling in Europe,still open
Coca Cola Co.,02/14/2023,"Stocks making the biggest moves premarket: Palantir, Coca-Cola, Marriott and more",still open
Coca Cola Co.,02/14/2023,Costa Coffee's strong UK sales boost Coca-Cola's 2022 revenues,still open
Coca Cola Co.,02/14/2023,"5 stocks to watch on Tuesday: Coca-Cola, Marriott and more (NYSE ...",still open
Coca Cola Co.,02/14/2023,Metis Global Partners LLC Purchases 4648 Shares of The Coca ...,still open
Coca Cola Co.,02/14/2023,"Coca-Cola gains after smashing organic sales expectations, guiding ...",still open
Coca Cola Co.,02/14/2023,The Coca-Cola Company Announces Timing of Fourth Quarter and Full Year 2022 Earnings Release; Company Also Announces Presentation at Consumer Analyst Group of New York (CAGNY) Virtual Conference,still open
Coca Cola Co.,02/14/2023,Caroline Slocombe joins OpenX from WPP to lead The Coca-Cola ...,still open
Coca Cola Co.,02/14/2023,"Coca-Cola Consolidated, Inc. (NASDAQ:COKE) is definitely on the ...",still open
Coca Cola Co.,02/14/2023,"Sports drink market to grow by USD 13,518.01 million: Consumer focus on health and wellness will drive gr",still open
Coca Cola Co.,02/14/2023,Coca-Cola appoints vice-president of marketing for Europe,still open
Coca Cola Co.,02/14/2023,ESG Essentials: What You Need To Know Now - Episode 13 ...,still open
Coca Cola Co.,02/14/2023,Parsec Financial Management Inc. Acquires 16381 Shares of The ...,still open
Coca Cola Co.,02/14/2023,"KO: If You Could Only Own 3 Stocks, It Should Be These",still open
Coca Cola Co.,02/14/2023,"US STOCKS-Wall St slides as inflation data, policymakers stoke rate worries",still open
Coca Cola Co.,02/14/2023,Why the Highest Yielding Warren Buffett Stocks Are Still the Best 2023 Ideas,still open
Coca Cola Co.,02/14/2023,"Eurozone GDP, U.S. CPI, Coca Cola, AirBnB Earnings",still open
Coca Cola Co.,02/14/2023,Fusion Beverages Market Development Size 2023 |Coca-Cola ...,still open
Coca Cola Co.,02/14/2023,5 Blue-Chip Stocks to Buy Despite Dow's Sluggish Start in 2023,still open
Coca Cola Co.,02/14/2023,The Coca-Cola Company's Costa Coffee expands footprint in India ...,still open
Coca Cola Co.,02/14/2023,Coke says Q4 demand strong despite higher prices,still open
Coca Cola Co.,02/14/2023,"Investor Optimism Improves Slightly As US Stocks Record Gains - Coca-Cola (NYSE:KO), Airbnb (NASDAQ:ABNB)",still open
Coca Cola Co.,02/14/2023,Low Calorie Chocolate Milk Market is Predicted to Reach US$ 6367 ...,still open
Coca Cola Co.,02/14/2023,"Daily Brief Consumer: Yashili International Holdings, Taste Gourmet ...",still open
Coca Cola Co.,02/14/2023,"Airbnb Options Traders Betting On Stock Falling This Much By Friday - Coca-Cola (NYSE:KO), Airbnb (NASDAQ",still open
Coca Cola Co.,02/14/2023,15 Dividend Growth Stocks with the Highest Growth Rates,still open
Coca Cola Co.,02/14/2023,Work With Us,still open
Coca Cola Co.,02/14/2023,"Coca-Cola Beats Profit Estimates, Raises Full-Year Guidance",still open
Coca Cola Co.,02/14/2023,2022 Shipper of Choice profile: The Coca-Cola Co.,still open
Coca Cola Co.,02/14/2023,Social Impact,still open
Coca Cola Co.,02/14/2023,Coca-Cola Invites Fans to Experience Dreamworld – News & Articles,still open
Coca Cola Co.,02/14/2023,Jack Daniel's & Coca-Cola RTD Debuts in Mexico - News & Articles,still open
Coca Cola Co.,02/14/2023,DASANI and Sprite Boost Sustainability Packaging Credentials ...,still open
Coca Cola Co.,02/14/2023,Coca-Cola Wins in Greenwashing Suits Show Hazy Marketing Limits,still open
Coca Cola Co.,02/14/2023,Coca-Cola bottler to detail costs of exiting Russia,still open
Coca Cola Co.,02/14/2023,Coca-Cola bottler starts making 'Dobry Cola' in Russia,still open
Coca Cola Co.,02/14/2023,Is it Worth Investing in The Coca-Cola Company (KO)?,still open
Coca Cola Co.,02/14/2023,"2021 Business, Environmental, Social & Governance | Company ...",still open
Coca Cola Co.,02/14/2023,Coca-Cola Offers Voluntary Buyouts to Some North America Staff,still open
Coca Cola Co.,02/14/2023,Our Partnerships,still open
Coca Cola Co.,02/14/2023,Coca-Cola Launches 'Real Magic Presents' with Christmas ...,still open
Coca Cola Co.,02/14/2023,Our Military Community,still open
Coca Cola Co.,02/14/2023,"Coca-Cola Co. stock rises Friday, still underperforms market",still open
Coca Cola Co.,02/14/2023,A Deeper Look at Coca-Cola's Emerging Business in Alcohol ...,still open
Coca Cola Co.,02/14/2023,Coca-Cola Opens West Coast HQ at Spectrum Terrace,still open
Coca Cola Co.,02/14/2023,Community Engagement & Empowerment,still open
Coca Cola Co.,02/14/2023,Coca-cola and Universal Create Secret Menu –News & Articles,still open
Coca Cola Co.,02/14/2023,Should You Buy Coca-Cola Co (KO) Stock Monday?,still open
Coca Cola Co.,02/14/2023,Coca-Cola Christmas Caravan Embarks Twenty Fifth Anniversary ...,still open
Coca Cola Co.,02/14/2023,The Coca-Cola Company Partners with Musical Legends Mark ...,still open
Coca Cola Co.,02/14/2023,Engine No. 1 held talks with Coca-Cola on new recycling initiatives ...,still open
Coca Cola Co.,02/14/2023,Coca-Cola Commissions Collective of Atlanta Artists - News & Articles,still open
Coca Cola Co.,02/14/2023,How Coca-Cola Will Show Football Fans That Believing is Magic ...,still open
Coca Cola Co.,02/14/2023,Coke bottler Coca-Cola HBC depleting stock in Russia,still open
Coca Cola Co.,02/14/2023,Coca-Cola System Jobs,still open
Coca Cola Co.,02/14/2023,Coca-Cola confident 2 years after reorganization despite 'all the ...,still open
Coca Cola Co.,02/14/2023,Coca Cola Showcases Solutions at Convenience Stores Show ...,still open
Coca Cola Co.,02/14/2023,Coca-Cola Co. leverages 'intelligent experimentation' to land 'epic ...,still open
Coca Cola Co.,02/14/2023,Coca-Cola Hosts Community Engagement Summit –News & Articles,still open
Coca Cola Co.,02/14/2023,The Coca-Cola Company Announces New Leaders in Operations,still open
Coca Cola Co.,02/14/2023,Coca-Cola and Bottler Support Jackson Relief Efforts,still open
Coca Cola Co.,02/14/2023,Molson Coors expands agreement with The Coca-Cola Co. for Topo ...,still open
Coca Cola Co.,02/14/2023,Is Coca-Cola Company (KO) a Good Long-Term Investment?,still open
Coca Cola Co.,02/14/2023,The Coca-Cola Company Elects Three Officers and Declares ...,still open
Coca Cola Co.,02/14/2023,"With 62% ownership of the shares, The Coca-Cola Company (NYSE:KO) is heavily dominated by institutional owners",still open
Coca Cola Co.,02/14/2023,Coca-Cola CEO sees alcohol as fourth bucket,still open
Coca Cola Co.,02/14/2023,"Coke Florida, The Coca-Cola Foundation, and The Coca-Cola ...",still open
Coca Cola Co.,02/14/2023,The Coca-Cola Company Announces Participation in Redburn CEO ...,still open
Coca Cola Co.,02/14/2023,Barry Simpson to Step Down as Chief Platform Services Officer of ...,still open
Coca Cola Co.,02/14/2023,"Coca-Cola Co. stock rises Friday, outperforms market",still open
Coca Cola Co.,02/14/2023,"Coca-Cola Co. stock rises Wednesday, outperforms market",still open
Coca Cola Co.,02/14/2023,John Murphy to Become President and Chief Financial Officer of The ...,still open
Coca Cola Co.,02/14/2023,Coca-Cola Co. stock outperforms market on strong trading day,still open
Coca Cola Co.,02/14/2023,Coca-Cola’s stock falls even after company beats revenue projections and provides upbeat outlook,still open
Coca Cola Co.,02/14/2023,"Coca-Cola beats revenue mark, stock rises",still open
Coca Cola Co.,02/14/2023,Buy Coca-Cola Stock Before Earnings After Pepsi's Solid Q4 Report?,still open
