Name,Data,News,Evaluation
Coca Cola Co.,02/21/2023,Coca-Cola (KO) Set to Announce Quarterly Earnings on Tuesday,still open
Coca Cola Co.,02/21/2023,Coca-Cola Co. stock underperforms Thursday when compared to competitors,still open
Coca Cola Co.,02/21/2023,Coca-Cola (KO Stock): The catalyst will be the announcement of the US CPI,still open
Coca Cola Co.,02/21/2023,Massachusetts Financial Services Co. MA Sells 2463 Shares of ...,still open
Coca Cola Co.,02/21/2023,Aperture Investors LLC Sells 27352 Shares of Coca-Cola ...,still open
Coca Cola Co.,02/21/2023,Parsec Financial Management Inc. Acquires 16381 Shares of The ...,still open
Coca Cola Co.,02/21/2023,"The Zacks Analyst Blog Highlights The Coca-Cola, Caterpillar, salesforce.com, The Procter & Gamble and Visa",still open
Coca Cola Co.,02/21/2023,Allianz Asset Management GmbH Sells 5789 Shares of Coca-Cola ...,still open
Coca Cola Co.,02/21/2023,KO Stock: Quarterly Dividend Increase Declared,still open
Coca Cola Co.,02/21/2023,"Coca-Cola Consolidated, Inc. (NASDAQ:COKE) Shares Sold by ...",still open
Coca Cola Co.,02/21/2023,"KO: If You Could Only Own 3 Stocks, It Should Be These",still open
Coca Cola Co.,02/21/2023,Coca-Cola to push ahead with price hikes as PepsiCo hits pause By ...,still open
Coca Cola Co.,02/21/2023,KO: 1 Stock You Can Keep in Your Portfolio Forever,still open
Coca Cola Co.,02/21/2023,COCA COLA CO : Results of Operations and Financial Condition (form 8-K),still open
Coca Cola Co.,02/21/2023,"The Zacks Analyst Blog Highlights PepsiCo, Coca-Cola, The Boston Beer and Molson Coors Beverage",still open
Coca Cola Co.,02/21/2023,Coca-Cola Europacific Partners PLC (NYSE:CCEP) Shares ...,still open
Coca Cola Co.,02/21/2023,You'll Never Believe the 'Dumbest' Stock Warren Buffett Ever Bought,still open
Coca Cola Co.,02/21/2023,US STOCKS-S&P 500 dips as inflation data supports rate worries,still open
Coca Cola Co.,02/21/2023,Should You Buy Coca-Cola Co (KO) Stock Monday?,still open
Coca Cola Co.,02/21/2023,Coca-Cola Co (KO) Stock: What Does the Chart Say Monday?,still open
Coca Cola Co.,02/21/2023,"Coca-Cola Co. stock rises Friday, still underperforms market",still open
Coca Cola Co.,02/21/2023,"Coca-Cola Co. stock rises Wednesday, outperforms market",still open
Coca Cola Co.,02/21/2023,Can Coca-Cola Co (KO) Stock Rise to the Top of Consumer Defensive Sector Monday?,still open
Coca Cola Co.,02/21/2023,Coca-Cola Co. stock outperforms competitors despite losses on the ...,still open
Coca Cola Co.,02/21/2023,"Coca-Cola Co. stock rises Friday, outperforms market",still open
Coca Cola Co.,02/21/2023,Coca-Cola Stock: Buy Now or Wait?,still open
Coca Cola Co.,02/21/2023,Will Coca-Cola Co (KO) Stay at the Top of the Consumer Defensive Sector?,still open
Coca Cola Co.,02/21/2023,Brian John Smith Sells 94200 Shares of The Coca-Cola Company ...,still open
Coca Cola Co.,02/21/2023,Is Coca-Cola Stock a Buy?,still open
Coca Cola Co.,02/21/2023,Coca-Cola is a stable safe haven in a rough market,still open
Coca Cola Co.,02/21/2023,Why Warren Buffett Loves Coca-Cola Stock,still open
Coca Cola Co.,02/21/2023,"Shares of Coca-Cola are a buy for these four reasons, Jim Cramer says",still open
Coca Cola Co.,02/21/2023,Coke bottler Coca-Cola HBC depleting stock in Russia,still open
Coca Cola Co.,02/21/2023,Coca-Cola raises full-year outlook as earnings beat expectations,still open
Coca Cola Co.,02/21/2023,Here's Why Coca-Cola (KO) Looks Poised for Q1 Earnings Beat,still open
Coca Cola Co.,02/21/2023,Why Warren Buffett Loves Coca-Cola's Stock,still open
Coca Cola Co.,02/21/2023,Warren Buffett Has Held This Stock for Over 34 Years — Why He ...,still open
Coca Cola Co.,02/21/2023,Coca-Cola Has Some Big Questions to Answer For Investors on ...,still open
Coca Cola Co.,02/21/2023,KO vs. PEP: Why Coca-Cola Stock Looks Tastier,still open
Coca Cola Co.,02/21/2023,This Restaurant Is Likely A Better Pick Over Coca-Cola Stock,still open
Coca Cola Co.,02/21/2023,Coca-Cola's earnings top expectations as sales volume recovers from pandemic,still open
Coca Cola Co.,02/21/2023,Coca-Cola bottler starts making 'Dobry Cola' in Russia,still open
Coca Cola Co.,02/21/2023,MSFT: Coca-Cola and 3 Other High-Quality Stocks to Buy This ...,still open
Coca Cola Co.,02/21/2023,3 Stocks You Can Keep Forever,still open
Coca Cola Co.,02/21/2023,Coca-Cola bottler to detail costs of exiting Russia,still open
Coca Cola Co.,02/21/2023,"Zacks Industry Outlook Highlights Coca-Cola, PepsiCo, Coca-Cola ...",still open
Coca Cola Co.,02/21/2023,"Top Stock Reports for Alphabet, JPMorgan & Coca-Cola",still open
Coca Cola Co.,02/21/2023,Jim Cramer says Coca-Cola is a buy after company 'put on a clinic' in latest earnings report,still open
Coca Cola Co.,02/21/2023,Ready For A Recession? Here's One Defensive Stock You Can't ...,still open
Coca Cola Co.,02/21/2023,Coca-Cola vs. PepsiCo: Which Stock Looks More Promising Moving Forward?,still open
Coca Cola Co.,02/21/2023,Coke Vs. Pepsi Stock: Which One Is Better?,still open
Coca Cola Co.,02/21/2023,Coca-Cola Vs. PepsiCo: Which Is Currently The More Attractive Stock?,still open
Coca Cola Co.,02/21/2023,"Laser Photonics stock blasts off on heavy volume again, after Coca-Cola implements laser cleaning system",still open
Coca Cola Co.,02/21/2023,Coca-Cola is getting into Christmas movies,still open
Coca Cola Co.,02/21/2023,3 Top Dividend Stocks for 2023,still open
Coca Cola Co.,02/21/2023,Coca-Cola and PepsiCo could face pricing probe,still open
Coca Cola Co.,02/21/2023,Coca-Cola Co (KO) Stock: How Does it Score on Fundamental Metrics?,still open
Coca Cola Co.,02/21/2023,Better Buy: Coca-Cola vs. PepsiCo,still open
Coca Cola Co.,02/21/2023,Better Dividend Stock for 2023? 3M Stock vs. Coca-Cola Stock,still open
Coca Cola Co.,02/21/2023,Coca-Cola Femsa SAB de CV (KOF) Is the Top Stock in the Beverages - Non-Alcoholic Industry?,still open
Coca Cola Co.,02/21/2023,Engine No. 1 held talks with Coca-Cola on new recycling initiatives ...,still open
Coca Cola Co.,02/21/2023,Coca-Cola's Success Despite Price Hikes Underscores Its Brand Value,still open
Coca Cola Co.,02/21/2023,A lesson in share analysis - Investors' Chronicle,still open
Coca Cola Co.,02/21/2023,Is Coca-Cola Co (KO) Stock Trading Below Fair Value?,still open
Coca Cola Co.,02/21/2023,"Dupont Capital Management Corp sells 1,878 Coca-Cola ...",still open
Coca Cola Co.,02/21/2023,Mars Makes More Revenue Than Coca-Cola,still open
Coca Cola Co.,02/21/2023,Coca-Cola and McDonald's left Russia. Their brands stayed behind,still open
Coca Cola Co.,02/21/2023,You'll Never Guess the Top-Performing Stock of the Last 20 Years,still open
Coca Cola Co.,02/21/2023,MOLSON COORS EXPANDS EXCLUSIVE AGREEMENT WITH THE ...,still open
Coca Cola Co.,02/21/2023,2022 Shipper of Choice profile: The Coca-Cola Co.,still open
Coca Cola Co.,02/21/2023,Coca-Cola to Delay IPO of Africa Bottler on Market Turmoil,still open
Coca Cola Co.,02/21/2023,14 Best Dividend Stocks To Buy and Hold,still open
Coca Cola Co.,02/21/2023,"U.S. FTC probes Pepsi, Coca-Cola over price discrimination - Politico",still open
Coca Cola Co.,02/21/2023,Coca-Cola Stock: DCF Analysis Shows Bubbly Valuation (NYSE:KO),still open
Coca Cola Co.,02/21/2023,Coca-Cola CEO sees alcohol as fourth bucket,still open
Coca Cola Co.,02/21/2023,"Coca-Cola Co. stock rises Monday, still underperforms market",still open
Coca Cola Co.,02/21/2023,10 Small-Cap Beverage Stocks to Consider,still open
Coca Cola Co.,02/21/2023,The Coca-Cola Company Elects Three Officers and Declares ...,still open
Coca Cola Co.,02/21/2023,Is Now the Time to Take Advantage of Coca-Cola Dividends?,still open
Coca Cola Co.,02/21/2023,What Do Bitcoin and Coca-Cola Have in Common?,still open
Coca Cola Co.,02/21/2023,Coca-Cola: Stock of the Week,still open
Coca Cola Co.,02/21/2023,Best Dividend Stocks According To Jim Cramer,still open
Coca Cola Co.,02/21/2023,Will Coca-Cola Co (KO) Beat the Rest of the Stocks in the Consumer Defensive Sector?,still open
Coca Cola Co.,02/21/2023,Stocks climb for 3rd straight day as Dow closes at 6-week high,still open
Coca Cola Co.,02/21/2023,Retirement Stock Portfolio: 11 Safe Consumer Stocks to Consider,still open
Coca Cola Co.,02/21/2023,Coca-Cola Co. stock outperforms market on strong trading day,still open
Coca Cola Co.,02/21/2023,10 Best Halal Dividend Stocks To Buy,still open
Coca Cola Co.,02/21/2023,The Fallacy Of Negative Working Capital As A Sign Of Distress ...,still open
Coca Cola Co.,02/21/2023,10 Best Dow Jones Dividend Stocks that Hedge Funds Love,still open
Coca Cola Co.,02/21/2023,Coca Cola: A people-led digital transformation,still open
Coca Cola Co.,02/21/2023,Coca-Cola Move: New Coke flavor released with Rosalía,still open
Coca Cola Co.,02/21/2023,Coca-Cola Releases First Creations Flavor of 2023—Coca-Cola Move,still open
Coca Cola Co.,02/21/2023,Coca-Cola 'Moves' Latest LTO,still open
Coca Cola Co.,02/21/2023,"Coca-Cola will keep Northampton plant operating ‘at least’ through 2023, continues hiring",still open
Coca Cola Co.,02/21/2023,Why PepsiCo’s and Coca-Cola’s Alcohol Drinks Worry Health Experts,still open
Coca Cola Co.,02/21/2023,Coca-Cola to push ahead with price hikes as PepsiCo hits pause,still open
Coca Cola Co.,02/21/2023,Is Coca-Cola Co (KO) a Winner in the Beverages - Non-Alcoholic Industry?,still open
Coca Cola Co.,02/21/2023,The Coca-Cola Company (NYSE:KO) Q4 2022 Earnings Call Transcript,still open
Coca Cola Co.,02/21/2023,The Coca-Cola Company Announces Nomination of New Director ...,still open
Coca Cola Co.,02/21/2023,FC Dallas Introduces Coca-Cola as Official Carbonated Beverage ...,still open
Coca Cola Co.,02/21/2023,Coca-Cola Zero Sugar Invites Fans to #TakeATaste in Newest ...,still open
Coca Cola Co.,02/21/2023,Bain & Company announces services alliance with OpenAI to help ...,still open
Coca Cola Co.,02/21/2023,These 15 Companies Dominate Customer Experience All-Stars,still open
Coca Cola Co.,02/21/2023,Coca-Cola Co. stock underperforms Tuesday when compared to competitors,still open
Coca Cola Co.,02/21/2023,The Coca-Cola Co. wields the axe to Lilt after 50 years,still open
Coca Cola Co.,02/21/2023,Bellwether Advisors LLC Purchases 1820 Shares of Coca-Cola ...,still open
Coca Cola Co.,02/21/2023,Coca-Cola Has a Sports-Drink Problem as BodyArmor Stumbles,still open
Coca Cola Co.,02/21/2023,Coca-Cola Co. stock underperforms Thursday when compared to competitors,still open
Coca Cola Co.,02/21/2023,CocaCola Company (The) (KO) is Attracting Investor Attention: Here ...,still open
Coca Cola Co.,02/21/2023,Jack Daniel's Coca-Cola RTD to hit US in March,still open
Coca Cola Co.,02/21/2023,Is Coca-Cola Co (KO) a Stock to Watch After Gaining 1.88% This Week?,still open
Coca Cola Co.,02/21/2023,Royal London Asset Management Ltd. Reduces Stake in The Coca ...,still open
Coca Cola Co.,02/21/2023,Coca-Cola Bottling Company United breaks ground on expansion for bottling plant in South Bibb County,still open
Coca Cola Co.,02/21/2023,Coca-Cola partners with Rosalía on new drink,still open
Coca Cola Co.,02/21/2023,"Berry, Coca-Cola Collaborate to implement Tethered caps in EU ...",still open
Coca Cola Co.,02/21/2023,Costa Coffee hires new CEO,still open
Coca Cola Co.,02/21/2023,"UBS Adjusts Coca-Cola Company Price Target to $72 From $70, Maintains Buy Rating",still open
Coca Cola Co.,02/21/2023,COCA COLA CO : Results of Operations and Financial Condition (form 8-K),still open
Coca Cola Co.,02/21/2023,"Tuesday’s Top Analyst Upgrades and Downgrades: Cisco, Coca-Cola, Coinbase, Datadog, DraftKings, GE Healthcare, Monster Beverage, Roku, Toast and More",still open
Coca Cola Co.,02/21/2023,The Coca-Cola Company Announces Timing of Fourth Quarter and Full Year 2022 Earnings Release; Company Also Announces Presentation at Consumer Analyst Group of New York (CAGNY) Virtual Conference,still open
Coca Cola Co.,02/21/2023,United States Sports Drink Market Size to Hit $9.38 Billion by 2029 ...,still open
Coca Cola Co.,02/21/2023,Investors Heavily Search CocaCola Company The (KO): Here is ...,still open
Coca Cola Co.,02/21/2023,Coca-Cola Vs. PepsiCo: Which Is The Better Buy For Dividend ...,still open
Coca Cola Co.,02/21/2023,Aperture Investors LLC Sells 27352 Shares of Coca-Cola ...,still open
Coca Cola Co.,02/21/2023,GFSI announces 22nd annual conference – Produce Blue Book,still open
Coca Cola Co.,02/21/2023,"2346 Shares in Coca-Cola Consolidated, Inc. (NASDAQ:COKE ...",still open
Coca Cola Co.,02/21/2023,Investors in a $10 Trillion Market Are on a Rollercoaster Ride,still open
Coca Cola Co.,02/21/2023,"The Zacks Analyst Blog Highlights The Coca-Cola, Caterpillar ...",still open
Coca Cola Co.,02/21/2023,Greenwashing might be financially beneficial—until customers catch ...,still open
Coca Cola Co.,02/21/2023,"Walmart gets cautious on economic outlook, sees lower 2023 performance",still open
Coca Cola Co.,02/21/2023,Extinction Rebellion target London Fashion Week with oil stunt and ...,still open
Coca Cola Co.,02/21/2023,15 Highest Yielding Dividend Stocks You Can Buy,still open
Coca Cola Co.,02/21/2023,"A Look At The Intrinsic Value Of Coca-Cola Consolidated, Inc. (NASDAQ:COKE)",still open
Coca Cola Co.,02/21/2023,🌱 3 Teens Shot At Birmingham Party + Internship At Coca-Cola United,still open
Coca Cola Co.,02/21/2023,Costa Coffee's strong UK sales boost Coca-Cola's 2022 revenues,still open
Coca Cola Co.,02/21/2023,Caroline Slocombe joins OpenX from WPP to lead The Coca-Cola ...,still open
Coca Cola Co.,02/21/2023,"Low Calorie Food Market Potential Growth 2023 -2030, Industry ...",still open
Coca Cola Co.,02/21/2023,Coca-Cola and Novartis’s CEOs don’t care if ‘ESG’ has become a toxic phrase among some,still open
Coca Cola Co.,02/21/2023,Analysis-To raise prices or not? Consumer goods makers weigh bets while retailers fret,still open
Coca Cola Co.,02/21/2023,Simply Orange Juice Class Action Alleges 'Tropical' Drink Contains ...,still open
Coca Cola Co.,02/21/2023,How drinks brands are using smart packaging,still open
Coca Cola Co.,02/21/2023,"Soft Beverages Market Statistical Forecast, Trade Analysis 2023 ...",still open
Coca Cola Co.,02/21/2023,Top Trades of Ray Dalio's Bridgewater in the 4th Quarter,still open
Coca Cola Co.,02/21/2023,"Coca-Cola, Kyocera, and Ocean's Halo Adjust Packaging Material to ...",still open
Coca Cola Co.,02/21/2023,"Canada's Cooler Aisle Just Got Juicier, Simply Spiked™ Hits ...",still open
Coca Cola Co.,02/21/2023,KO: 1 Stock You Can Keep in Your Portfolio Forever,still open
Coca Cola Co.,02/21/2023,Solid Economic Data Unnerve Investors: 5 Low-Beta Picks,still open
Coca Cola Co.,02/21/2023,"Low Calorie Chocolate Milk Market Statistical Forecast, Trade ...",still open
Coca Cola Co.,02/21/2023,"Juices market size is set to grow at a CAGR of 8.55% from 2022 to 2027, Europe will account for 39% of the market's growth - Technavio",still open
Coca Cola Co.,02/21/2023,15 Best Safe Dividend Stocks For 2023,still open
Coca Cola Co.,02/21/2023,KO: 4 Great Stocks to Buy Now for Under $100,still open
Coca Cola Co.,02/21/2023,Work With Us,still open
Coca Cola Co.,02/21/2023,Coca-Cola Invites Fans to Experience Dreamworld – News & Articles,still open
Coca Cola Co.,02/21/2023,10 Coca-Cola Products You Can’t Buy Anymore,still open
Coca Cola Co.,02/21/2023,2022 Shipper of Choice profile: The Coca-Cola Co.,still open
Coca Cola Co.,02/21/2023,Stock Analysis: Is Coca-Cola Company (KO) a good buy this year?,still open
Coca Cola Co.,02/21/2023,Social Impact,still open
Coca Cola Co.,02/21/2023,Jack Daniel's & Coca-Cola RTD Debuts in Mexico - News & Articles,still open
Coca Cola Co.,02/21/2023,Coca-Cola Wins in Greenwashing Suits Show Hazy Marketing Limits,still open
Coca Cola Co.,02/21/2023,DASANI and Sprite Boost Sustainability Packaging Credentials ...,still open
Coca Cola Co.,02/21/2023,Coca-Cola bottler to detail costs of exiting Russia,still open
Coca Cola Co.,02/21/2023,Coca-Cola bottler starts making 'Dobry Cola' in Russia,still open
Coca Cola Co.,02/21/2023,Is it Worth Investing in The Coca-Cola Company (KO)?,still open
Coca Cola Co.,02/21/2023,Coca-Cola Launches 'Real Magic Presents' with Christmas ...,still open
Coca Cola Co.,02/21/2023,Our Military Community,still open
Coca Cola Co.,02/21/2023,"Coca-Cola Co. stock rises Friday, still underperforms market",still open
Coca Cola Co.,02/21/2023,Coca-Cola relying on momentum to overcome consumer shifts,still open
Coca Cola Co.,02/21/2023,"2021 Business, Environmental, Social & Governance | Company ...",still open
Coca Cola Co.,02/21/2023,Our Partnerships,still open
Coca Cola Co.,02/21/2023,A Deeper Look at Coca-Cola's Emerging Business in Alcohol ...,still open
Coca Cola Co.,02/21/2023,Coca-Cola Opens West Coast HQ at Spectrum Terrace,still open
Coca Cola Co.,02/21/2023,Sprite Fresca Seagrams Mark Ronson Madlib Music Connection ...,still open
Coca Cola Co.,02/21/2023,Coca-cola and Universal Create Secret Menu –News & Articles,still open
Coca Cola Co.,02/21/2023,Community Engagement & Empowerment,still open
Coca Cola Co.,02/21/2023,The Coca-Cola Company Partners with Musical Legends Mark ...,still open
Coca Cola Co.,02/21/2023,"Supplier Spotlights: The Coca-Cola Co., Harbor Wholesale & Old ...",still open
Coca Cola Co.,02/21/2023,The Coca-Cola Company Elects Three Officers and Declares ...,still open
Coca Cola Co.,02/21/2023,Coca-Cola Christmas Caravan Embarks Twenty Fifth Anniversary ...,still open
Coca Cola Co.,02/21/2023,Should You Buy Coca-Cola Co (KO) Stock Monday?,still open
Coca Cola Co.,02/21/2023,How Coca-Cola Will Show Football Fans That Believing is Magic ...,still open
Coca Cola Co.,02/21/2023,Coca-Cola Commissions Collective of Atlanta Artists - News & Articles,still open
Coca Cola Co.,02/21/2023,"With 62% ownership of the shares, The Coca-Cola Company (NYSE:KO) is heavily dominated by institutional owners",still open
Coca Cola Co.,02/21/2023,Coca Cola Showcases Solutions at Convenience Stores Show ...,still open
Coca Cola Co.,02/21/2023,Coca-Cola System Jobs,still open
Coca Cola Co.,02/21/2023,Coca-Cola Co. stock outperforms competitors despite losses on the ...,still open
Coca Cola Co.,02/21/2023,Engine No. 1 held talks with Coca-Cola on new recycling initiatives ...,still open
Coca Cola Co.,02/21/2023,Coca-Cola confident 2 years after reorganization despite 'all the ...,still open
Coca Cola Co.,02/21/2023,Is it Time to Dump Coca-Cola Co (KO) Stock After it Is Lower By 0.96% in a Week?,still open
Coca Cola Co.,02/21/2023,FY2023 Earnings Estimate for The Coca-Cola Company Issued By ...,still open
Coca Cola Co.,02/21/2023,Is It Time To Buy The Dip In Coca-Cola,still open
Coca Cola Co.,02/21/2023,Coca-Cola Co. stock underperforms Tuesday when compared to competitors,still open
Coca Cola Co.,02/21/2023,Bellwether Advisors LLC Purchases 1820 Shares of Coca-Cola ...,still open
Coca Cola Co.,02/21/2023,"Coca-Cola Co. stock remains steady Friday, underperforms market",still open
Coca Cola Co.,02/21/2023,Is Coca-Cola Co (KO) a Stock to Watch After Gaining 1.88% This Week?,still open
Coca Cola Co.,02/21/2023,The Coca-Cola Company (NYSE:KO) Declares Dividend Increase ...,still open
Coca Cola Co.,02/21/2023,Royal London Asset Management Ltd. Reduces Stake in The Coca ...,still open
Coca Cola Co.,02/21/2023,Coca-Cola (KO) Set to Announce Quarterly Earnings on Tuesday,still open
Coca Cola Co.,02/21/2023,Coca-Cola Co. stock underperforms Thursday when compared to competitors,still open
Coca Cola Co.,02/21/2023,Coca-Cola (KO Stock): The catalyst will be the announcement of the US CPI,still open
Coca Cola Co.,02/21/2023,BlackRock Increases Position in Coca Cola (KO),still open
Coca Cola Co.,02/21/2023,Nomura Asset Management Co. Ltd. Buys 2200 Shares of Coca ...,still open
Coca Cola Co.,02/21/2023,The Ultimate Beginner's Guide To Investing In The Stock Market,still open
Coca Cola Co.,02/21/2023,"Tuesday’s Top Analyst Upgrades and Downgrades: Cisco, Coca-Cola, Coinbase, Datadog, DraftKings, GE Healthcare, Monster Beverage, Roku, Toast and More",still open
Coca Cola Co.,02/21/2023,"Walmart gets cautious on economic outlook, sees lower 2023 performance",still open
Coca Cola Co.,02/21/2023,Parsec Financial Management Inc. Acquires 16381 Shares of The ...,still open
Coca Cola Co.,02/21/2023,Starbucks Corp. stock outperforms market despite losses on the day,still open
Coca Cola Co.,02/21/2023,"The Zacks Analyst Blog Highlights The Coca-Cola, Caterpillar, salesforce.com, The Procter & Gamble and Visa",still open
Coca Cola Co.,02/21/2023,Allianz Asset Management GmbH Sells 5789 Shares of Coca-Cola ...,still open
Coca Cola Co.,02/21/2023,10 Best Long-Term Stocks To Buy According To Warren Buffett,still open
Coca Cola Co.,02/21/2023,Stock Market,still open
Coca Cola Co.,02/21/2023,KO Stock: Quarterly Dividend Increase Declared,still open
Coca Cola Co.,02/21/2023,US STOCKS-Wall Street ends mixed as inflation data supports rate worries,still open
Coca Cola Co.,02/21/2023,"Coca-Cola Consolidated, Inc. (NASDAQ:COKE) Shares Sold by ...",still open
Coca Cola Co.,02/21/2023,"KO: If You Could Only Own 3 Stocks, It Should Be These",still open
Coca Cola Co.,02/21/2023,Solid Economic Data Unnerve Investors: 5 Low-Beta Picks,still open
Coca Cola Co.,02/21/2023,KO: 1 Stock You Can Keep in Your Portfolio Forever,still open
Coca Cola Co.,02/21/2023,Coca-Cola to push ahead with price hikes as PepsiCo hits pause By ...,still open
Coca Cola Co.,02/21/2023,COCA COLA CO : Results of Operations and Financial Condition (form 8-K),still open
Coca Cola Co.,02/21/2023,Starbucks Corp. stock outperforms market on strong trading day,still open
Coca Cola Co.,02/21/2023,Coca-Cola Europacific Partners PLC (NYSE:CCEP) Shares ...,still open
Coca Cola Co.,02/21/2023,You'll Never Believe the 'Dumbest' Stock Warren Buffett Ever Bought,still open
Coca Cola Co.,02/21/2023,3 Great Compounder Stocks to Buy for Strong Returns in All Environments,still open
Coca Cola Co.,02/21/2023,"Earnings Previews: Cleveland Cliffs, Coca-Cola, Peabody Energy",still open
Coca Cola Co.,02/21/2023,5 Blue-Chip Stocks to Buy Despite Dow's Sluggish Start in 2023,still open
Coca Cola Co.,02/21/2023,Should You Buy Coca-Cola Co (KO) Stock Monday?,still open
Coca Cola Co.,02/21/2023,4 Beverage Stocks Set to Pull Off a Beat This Earnings Season,still open
Coca Cola Co.,02/21/2023,Coca-Cola Co (KO) Stock: What Does the Chart Say Monday?,still open
Coca Cola Co.,02/21/2023,"Coca-Cola Co. stock rises Friday, still underperforms market",still open
Coca Cola Co.,02/21/2023,Can Coca-Cola Co (KO) Stock Rise to the Top of Consumer Defensive Sector Monday?,still open
Coca Cola Co.,02/21/2023,Coca-Cola Co. stock outperforms competitors despite losses on the ...,still open
Coca Cola Co.,02/21/2023,"Coca-Cola Co. stock rises Friday, outperforms market",still open
Coca Cola Co.,02/21/2023,Coca-Cola Stock: Buy Now or Wait?,still open
Coca Cola Co.,02/21/2023,Will Coca-Cola Co (KO) Stay at the Top of the Consumer Defensive Sector?,still open
Coca Cola Co.,02/21/2023,Brian John Smith Sells 94200 Shares of The Coca-Cola Company ...,still open
Coca Cola Co.,02/21/2023,Coca-Cola Co. stock underperforms Friday when compared to competitors,still open
Coca Cola Co.,02/21/2023,Is Coca-Cola Stock a Buy?,still open
Coca Cola Co.,02/21/2023,Coca-Cola is a stable safe haven in a rough market,still open
Coca Cola Co.,02/21/2023,Why Warren Buffett Loves Coca-Cola Stock,still open
Coca Cola Co.,02/21/2023,"Shares of Coca-Cola are a buy for these four reasons, Jim Cramer says",still open
Coca Cola Co.,02/21/2023,Coke bottler Coca-Cola HBC depleting stock in Russia,still open
Coca Cola Co.,02/21/2023,Coca-Cola raises full-year outlook as earnings beat expectations,still open
Coca Cola Co.,02/21/2023,The Coca-Cola Company Elects Three Officers and Declares ...,still open
Coca Cola Co.,02/21/2023,Why Warren Buffett Loves Coca-Cola's Stock,still open
Coca Cola Co.,02/21/2023,Warren Buffett Has Held This Stock for Over 34 Years — Why He ...,still open
Coca Cola Co.,02/21/2023,Coca-Cola Has Some Big Questions to Answer For Investors on ...,still open
Coca Cola Co.,02/21/2023,KO vs. PEP: Why Coca-Cola Stock Looks Tastier,still open
Coca Cola Co.,02/21/2023,This Restaurant Is Likely A Better Pick Over Coca-Cola Stock,still open
Coca Cola Co.,02/21/2023,Coca-Cola's earnings top expectations as sales volume recovers from pandemic,still open
Coca Cola Co.,02/21/2023,"The Zacks Analyst Blog Highlights UnitedHealth Group, The Coca-Cola, Roche Holding, Lam Research and Valero Energy",still open
Coca Cola Co.,02/21/2023,Coca-Cola bottler starts making 'Dobry Cola' in Russia,still open
Coca Cola Co.,02/21/2023,MSFT: Coca-Cola and 3 Other High-Quality Stocks to Buy This ...,still open
Coca Cola Co.,02/21/2023,3 Stocks You Can Keep Forever,still open
Coca Cola Co.,02/21/2023,Coca-Cola bottler to detail costs of exiting Russia,still open
Coca Cola Co.,02/21/2023,"Zacks Industry Outlook Highlights Coca-Cola, PepsiCo, Coca-Cola ...",still open
Coca Cola Co.,02/21/2023,"Top Stock Reports for Alphabet, JPMorgan & Coca-Cola",still open
Coca Cola Co.,02/21/2023,Jim Cramer says Coca-Cola is a buy after company 'put on a clinic' in latest earnings report,still open
Coca Cola Co.,02/21/2023,Ready For A Recession? Here's One Defensive Stock You Can't ...,still open
Coca Cola Co.,02/21/2023,Coca-Cola vs. PepsiCo: Which Stock Looks More Promising Moving Forward?,still open
Coca Cola Co.,02/21/2023,Coke Vs. Pepsi Stock: Which One Is Better?,still open
Coca Cola Co.,02/21/2023,Coca-Cola Vs. PepsiCo: Which Is Currently The More Attractive Stock?,still open
