Name,Data,News,Evaluation
Coca Cola Co.,02/05/2023,Coca-Cola Zero Sugar Invites Fans to #TakeATaste in Newest ...,still open
Coca Cola Co.,02/05/2023,Coca-Cola Co. stock underperforms Friday when compared to competitors,still open
Coca Cola Co.,02/05/2023,Metis Global Partners LLC Purchases 4648 Shares of The Coca ...,still open
Coca Cola Co.,02/05/2023,The Coca-Cola Company (NYSE:KO) Receives Consensus ...,still open
Coca Cola Co.,02/05/2023,Coca-Cola bottling company eyes Moore Co. for expansion,still open
Coca Cola Co.,02/05/2023,"Coca-Cola Co. stock falls Thursday, underperforms market",still open
Coca Cola Co.,02/05/2023,Is Coca-Cola Co (KO) a Stock to Watch After Gaining 1.88% This Week?,still open
Coca Cola Co.,02/05/2023,Coca-Cola Co. stock outperforms market on strong trading day,still open
Coca Cola Co.,02/05/2023,Is it Worth Investing in The Coca-Cola Company (KO)?,still open
Coca Cola Co.,02/05/2023,"Coca-Cola Co. stock rises Friday, still underperforms market",still open
Coca Cola Co.,02/05/2023,Coca-Cola adds tethered closures to boost PET recycling in Europe,still open
Coca Cola Co.,02/05/2023,"Coca-Cola Co. stock falls Wednesday, underperforms market",still open
Coca Cola Co.,02/05/2023,"FTC Is Investigating Coke, Pepsi Price Discounting Under Antitrust ...",still open
Coca Cola Co.,02/05/2023,Calculating The Intrinsic Value Of The Coca-Cola Company (NYSE:KO),still open
Coca Cola Co.,02/05/2023,BlackRock Cuts Stake in Coca-Cola Bottling Co. Consolidated (COKE),still open
Coca Cola Co.,02/05/2023,Coca-Cola Co. stock outperforms market despite losses on the day,still open
Coca Cola Co.,02/05/2023,OpenX Appoints Caroline Slocombe to Lead Coca-Cola Company ...,still open
Coca Cola Co.,02/05/2023,2023 Bottler of the Year: Heartland Coca-Cola Bottling Co.,still open
Coca Cola Co.,02/05/2023,The Coca-Cola Company (KO) Earnings Preview: KO Stock Likely ...,still open
Coca Cola Co.,02/05/2023,"Over dinner in Davos, the CEOs of Novartis, Coca-Cola, and Grab shared what’s worrying them",still open
Coca Cola Co.,02/05/2023,Parsec Financial Management Inc. Acquires 16381 Shares of The ...,still open
Coca Cola Co.,02/05/2023,LSV Asset Management Reduces Stock Position in Coca-Cola ...,still open
Coca Cola Co.,02/05/2023,The Coca-Cola Company Announces Timing of Fourth Quarter and ...,still open
Coca Cola Co.,02/05/2023,Monster to Develop Small Brands In-House with Coke's Blessing,still open
Coca Cola Co.,02/05/2023,CocaCola Company The (KO) is Attracting Investor Attention: Here is ...,still open
Coca Cola Co.,02/05/2023,Coke Florida Celebrates Black History Month with Focus on ...,still open
Coca Cola Co.,02/05/2023,Simply Orange Juice Class Action Alleges 'Tropical' Drink Contains ...,still open
Coca Cola Co.,02/05/2023,Where to Find Prime? Logan Paul and KSI's Drink Signs Deal With ...,still open
Coca Cola Co.,02/05/2023,Coca-Cola Faces Class Action Lawsuit Over High PFAS Levels in ...,still open
Coca Cola Co.,02/05/2023,Coca-Cola bottlers ramp up carbon capture research for supply chains,still open
Coca Cola Co.,02/05/2023,Madlib & Mark Ronson Joins With The Coca-Cola Company For ...,still open
Coca Cola Co.,02/05/2023,"Coca-Cola Consolidated, Inc. (NASDAQ:COKE) Shares Sold by ...",still open
Coca Cola Co.,02/05/2023,Book Club: Design to Grow: How Coca-Cola Learned to Combine ...,still open
Coca Cola Co.,02/05/2023,The Coca-Cola Company's Costa Coffee expands footprint in India ...,still open
Coca Cola Co.,02/05/2023,"Goldman Sachs Lifts Price Target on Coca-Cola to $62 From $61, Maintains Neutral Rating",still open
Coca Cola Co.,02/05/2023,3 Dow Jones Stocks To Watch Ahead Of February 2023,still open
Coca Cola Co.,02/05/2023,realme to introduce the first Coca-Cola edition smartphone ever: Knoe-more,still open
Coca Cola Co.,02/05/2023,Coca-Cola Ballina named one of world's most advanced ...,still open
Coca Cola Co.,02/05/2023,Return to the 24 Hours of Daytona,still open
Coca Cola Co.,02/05/2023,Coke Studio to start Bharat edition | Mint,still open
Coca Cola Co.,02/05/2023,"Coca-Cola, McDonald's & M&S Food detail sustainability push",still open
Coca Cola Co.,02/05/2023,Root Beer Drinks Market Current Status and Future Prospects (2023 ...,still open
Coca Cola Co.,02/05/2023,These 20 stocks led the January rally -2-,still open
Coca Cola Co.,02/05/2023,Colgate Elects Steve Cahillane to Board of Directors,still open
Coca Cola Co.,02/05/2023,Non-Alc Drinks Brand ISH Adds New CMO to Team,still open
Coca Cola Co.,02/05/2023,Soft Beverages Market Overview 2023-2029| Key Players –Groupe ...,still open
Coca Cola Co.,02/05/2023,Rishi admits he's a Coca-Cola addict and a 'nerd' with Star Wars lightsabers,still open
Coca Cola Co.,02/05/2023,﻿Soft Drink Concentrates Market would Register a Healthy Growth of ...,still open
Coca Cola Co.,02/05/2023,Atlanta reacts to former first lady Bunnie Jackson-Ransom’s passing,still open
Coca Cola Co.,02/05/2023,2023 Heralds Useful Ideas for Packaging Progress ...,still open
Coca Cola Co.,02/05/2023,McCormick cuts workforce to help boost profits in 2023,still open
Coca Cola Co.,02/05/2023,UNDER ARMOUR APPOINTS CAROLYN EVERSON AND ...,still open
Coca Cola Co.,02/05/2023,Dollar General Co. (NYSE:DG) Shares Purchased by Braun Stacey ...,still open
Coca Cola Co.,02/05/2023,"'All-natural' Simply Tropical juice has high levels of toxic 'forever chemicals,' lawsuit alleges",still open
Coca Cola Co.,02/05/2023,5 Dividend King Stocks Gurus A,still open
Coca Cola Co.,02/05/2023,What is ESG investing?,still open
Coca Cola Co.,02/05/2023,SCHD: This 3.4% Yielding Dividend ETF Is Top Value (NYSEARCA ...,still open
Coca Cola Co.,02/05/2023,Packaged Natural Mineral Water Market Size 2023 Industry Recent ...,still open
Coca Cola Co.,02/05/2023,Gordon Ramsay gives his brazen review of Logan Paul's energy drink PRIME,still open
Coca Cola Co.,02/05/2023,Buying ASX shares as a beginner? Here are 3 things I wish I'd known,still open
Coca Cola Co.,02/05/2023,2022 Shipper of Choice profile: The Coca-Cola Co.,still open
Coca Cola Co.,02/05/2023,Work With Us,still open
Coca Cola Co.,02/05/2023,Coca-Cola Invites Fans to Experience Dreamworld – News & Articles,still open
Coca Cola Co.,02/05/2023,Coca-Cola rep found 80% liable for own dismissal,still open
Coca Cola Co.,02/05/2023,Cold brew coffee market to grow by 7.23% Y-O-Y from 2022 to 2023 ...,still open
Coca Cola Co.,02/05/2023,DASANI and Sprite Boost Sustainability Packaging Credentials ...,still open
Coca Cola Co.,02/05/2023,Jack Daniel's & Coca-Cola RTD Debuts in Mexico - News & Articles,still open
Coca Cola Co.,02/05/2023,Investment Product and Service Launches | PLANSPONSOR,still open
Coca Cola Co.,02/05/2023,Social Impact,still open
Coca Cola Co.,02/05/2023,Gordon Thompson Obituary (2023),still open
Coca Cola Co.,02/05/2023,"IVV, GOOGL, LLY, KO: Large Inflows Detected at ETF",still open
Coca Cola Co.,02/05/2023,Coca-Cola lifts forecasts as demand keeps pace with pricier sodas,still open
Coca Cola Co.,02/05/2023,1 ex-penny stock that could become a ‘money fountain’,still open
Coca Cola Co.,02/05/2023,EssenceMediacom Launches as the Breakthrough Agency in 120 ...,still open
Coca Cola Co.,02/05/2023,"The Movement to Stop ""Cop City"" Sparks International Solidarity",still open
Coca Cola Co.,02/05/2023,Coca-Cola Wins in Greenwashing Suits Show Hazy Marketing Limits,still open
Coca Cola Co.,02/05/2023,Larry Mullally,still open
Coca Cola Co.,02/05/2023,The Coca-Cola Co.'s IT hiring activity declines 11.2% in August 2022,still open
Coca Cola Co.,02/05/2023,Warren Buffett: Someone's Sitting in the Shade Today Because Someone Planted a Tree a Long Time Ago,still open
Coca Cola Co.,02/05/2023,Coca-Cola bottler to detail costs of exiting Russia,still open
Coca Cola Co.,02/05/2023,Coca-Cola bottler starts making 'Dobry Cola' in Russia,still open
Coca Cola Co.,02/05/2023,"PET reclaimer, packaging maker among grant recipients",still open
Coca Cola Co.,02/05/2023,Top 5 4th Quarter Trades of MILLER HOWARD INVESTMENTS INC ...,still open
Coca Cola Co.,02/05/2023,"2021 Business, Environmental, Social & Governance | Company ...",still open
Coca Cola Co.,02/05/2023,Our Partnerships,still open
Coca Cola Co.,02/05/2023,Coca-Cola Launches 'Real Magic Presents' with Christmas ...,still open
Coca Cola Co.,02/05/2023,A Deeper Look at Coca-Cola's Emerging Business in Alcohol ...,still open
Coca Cola Co.,02/05/2023,International SOS Hires Former Boeing Company VP And Chief ...,still open
Coca Cola Co.,02/05/2023,Coca-cola and Universal Create Secret Menu –News & Articles,still open
Coca Cola Co.,02/05/2023,Community Engagement & Empowerment,still open
Coca Cola Co.,02/05/2023,"Supplier Spotlights: The Coca-Cola Co., Harbor Wholesale & Old ...",still open
Coca Cola Co.,02/05/2023,Coca-Cola Opens West Coast HQ at Spectrum Terrace,still open
Coca Cola Co.,02/05/2023,Coca-Cola Offers Voluntary Buyouts to Some North America Staff,still open
Coca Cola Co.,02/05/2023,Sprite Fresca Seagrams Mark Ronson Madlib Music Connection ...,still open
Coca Cola Co.,02/05/2023,Should You Buy Coca-Cola Co (KO) Stock Monday?,still open
Coca Cola Co.,02/05/2023,The Coca-Cola Company Partners with Musical Legends Mark ...,still open
Coca Cola Co.,02/05/2023,The Coca-Cola Company (NYSE:KO) Receives Consensus ...,still open
Coca Cola Co.,02/05/2023,Metis Global Partners LLC Purchases 4648 Shares of The Coca ...,still open
Coca Cola Co.,02/05/2023,Coca-Cola Co. stock underperforms Friday when compared to competitors,still open
Coca Cola Co.,02/05/2023,"Coca-Cola Co. stock falls Thursday, underperforms market",still open
Coca Cola Co.,02/05/2023,Is Coca-Cola Co (KO) a Stock to Watch After Gaining 1.88% This Week?,still open
Coca Cola Co.,02/05/2023,Coca-Cola Co. stock underperforms Tuesday when compared to competitors despite daily gains,still open
Coca Cola Co.,02/05/2023,Coca-Cola Co. stock outperforms market on strong trading day,still open
Coca Cola Co.,02/05/2023,"Coca-Cola Co. stock rises Friday, still underperforms market",still open
Coca Cola Co.,02/05/2023,Coca-Cola Co. stock outperforms market despite losses on the day,still open
Coca Cola Co.,02/05/2023,Parsec Financial Management Inc. Acquires 16381 Shares of The ...,still open
Coca Cola Co.,02/05/2023,BlackRock Cuts Stake in Coca-Cola Bottling Co. Consolidated (COKE),still open
Coca Cola Co.,02/05/2023,The Manufacturers Life Insurance Company increased its stake in ...,still open
Coca Cola Co.,02/05/2023,Buffett Stock Portfolio: Warren Buffett’s Recent Buys,still open
Coca Cola Co.,02/05/2023,Will Coke (KO) Beat Estimates Again in Its Next Earnings Report?,still open
Coca Cola Co.,02/05/2023,"Dupont Capital Management Corp sells 1,878 Coca-Cola ...",still open
Coca Cola Co.,02/05/2023,Dollar General Co. (NYSE:DG) Shares Purchased by Braun Stacey ...,still open
Coca Cola Co.,02/05/2023,Starbucks Corp. stock outperforms competitors on strong trading day,still open
Coca Cola Co.,02/05/2023,Better Buy: Coca-Cola vs. PepsiCo,still open
Coca Cola Co.,02/05/2023,1 ex-penny stock that could become a ‘money fountain’,still open
Coca Cola Co.,02/05/2023,Comerica Bank Reduces Its Holdings in Coca-Cola Consolidated ...,still open
Coca Cola Co.,02/05/2023,Coca-Cola and PepsiCo could face pricing probe,still open
Coca Cola Co.,02/05/2023,"Kraft Heinz Co. stock rises Thursday, outperforms market",still open
Coca Cola Co.,02/05/2023,"Starbucks Corp. stock rises Friday, outperforms market",still open
Coca Cola Co.,02/05/2023,"U.S. FTC probes Pepsi, Coca-Cola over price discrimination - Politico",still open
Coca Cola Co.,02/05/2023,"Kraft Heinz Co. stock rises Tuesday, still underperforms market",still open
Coca Cola Co.,02/05/2023,‘Back to the meat grinder’: Jeremy Grantham warns that stocks could plunge a ‘stomach-churning 50%’ from here — he's using these 3 shockproof stocks for protection,still open
Coca Cola Co.,02/05/2023,"Starbucks Corp. stock falls Wednesday, underperforms market",still open
Coca Cola Co.,02/05/2023,KO: The 2 Best Dow Stocks to Buy in 2023,still open
Coca Cola Co.,02/05/2023,Ready For A Recession? Here's One Defensive Stock You Can't ...,still open
Coca Cola Co.,02/05/2023,14 Best Stocks To Buy Before the 2023 Recession,still open
Coca Cola Co.,02/05/2023,Forget crypto! I'd follow Warren Buffett and make money in my sleep,still open
Coca Cola Co.,02/05/2023,Dollar General Co. (NYSE:DG) Receives Consensus ...,still open
Coca Cola Co.,02/05/2023,Buying ASX shares as a beginner? Here are 3 things I wish I'd known,still open
Coca Cola Co.,02/05/2023,5 Dividend King Stocks Gurus A,still open
Coca Cola Co.,02/05/2023,"With Rates Still Rising, 7 Highest-Yielding Dividend Kings May Be the Best 2023 Stock Ideas",still open
Coca Cola Co.,02/05/2023,Barron's And Bloomberg 2023 Ideal Dividend Stocks Of The Year,still open
Coca Cola Co.,02/05/2023,Should You Buy Coca-Cola Co (KO) Stock Monday?,still open
Coca Cola Co.,02/05/2023,Top 5 4th Quarter Trades of MILLER HOWARD INVESTMENTS INC ...,still open
Coca Cola Co.,02/05/2023,Warren Buffett: Someone's Sitting in the Shade Today Because Someone Planted a Tree a Long Time Ago,still open
Coca Cola Co.,02/05/2023,"Coca-Cola Co. stock rises Monday, still underperforms market",still open
Coca Cola Co.,02/05/2023,Deutsche Bank Aktiengesellschaft Cuts Coca-Cola HBC (OTCMKTS ...,still open
Coca Cola Co.,02/05/2023,Exclusive: Pepsi is ditching Sierra Mist for a new Sprite rival,still open
Coca Cola Co.,02/05/2023,Coca-Cola Co (KO) Stock: What Does the Chart Say Monday?,still open
Coca Cola Co.,02/05/2023,There's 3 New Standout Dividend Stocks — And 3 Pay The Most,still open
Coca Cola Co.,02/05/2023,"Coca-Cola Co. stock rises Wednesday, outperforms market",still open
Coca Cola Co.,02/05/2023,"Coca-Cola Co. stock rises Friday, outperforms market",still open
Coca Cola Co.,02/05/2023,3 Best Large-Cap Stocks for 2023,still open
Coca Cola Co.,02/05/2023,Coca-Cola Co. stock outperforms competitors despite losses on the day,still open
Coca Cola Co.,02/05/2023,"Coca-Cola Co. stock rises Wednesday, still underperforms market",still open
Coca Cola Co.,02/05/2023,VDC: 3 ETFs to Stock up on in 2023,still open
Coca Cola Co.,02/05/2023,"Coca-Cola Co. stock rises Tuesday, outperforms market",still open
Coca Cola Co.,02/05/2023,Coca-Cola Stock: Buy Now or Wait?,still open
Coca Cola Co.,02/05/2023,"Coca-Cola Co. stock falls Wednesday, underperforms market",still open
Coca Cola Co.,02/05/2023,Where Does Coca-Cola Co (KO) Stock Fall in the Beverages - Non-Alcoholic Field After It Is Lower By -1.03% This Week?,still open
Coca Cola Co.,02/05/2023,Where Will Coca-Cola Stock Be in 5 Years?,still open
Coca Cola Co.,02/05/2023,Buy 5 High-Yielding U.S. Bigwigs to Enhance Your Portfolio,still open
Coca Cola Co.,02/05/2023,Is Coca-Cola Stock a Buy?,still open
Coca Cola Co.,02/05/2023,"Stock Cars, Hip-Hop Stars Set For Busch Light Clash at the Coliseum",still open
Coca Cola Co.,02/05/2023,What is ESG investing?,still open
Coca Cola Co.,02/05/2023,Brian John Smith Sells 94200 Shares of The Coca-Cola Company ...,still open
Coca Cola Co.,02/05/2023,Logan Paul’s Prime Signs Multiyear UFC Deal as Drinks Sell Out,still open
Coca Cola Co.,02/05/2023,"Coca-Cola Co. stock remains steady Wednesday, still outperforms market",still open
Coca Cola Co.,02/05/2023,Will Coca-Cola Co (KO) Stay at the Top of the Consumer Defensive Sector?,still open
Coca Cola Co.,02/05/2023,Coca-Cola is a stable safe haven in a rough market,still open
Coca Cola Co.,02/05/2023,Why Warren Buffett Loves Coca-Cola Stock,still open
Coca Cola Co.,02/05/2023,"Coca-Cola Stock Higher As Price Hikes Help Q3 Earnings, Revenue Beat, 2022 Forecast Boost",still open
Coca Cola Co.,02/05/2023,Is Coca-Cola Stock A Buy After Beating Earnings? Outlook Is ...,still open
Coca Cola Co.,02/05/2023,"Shares of Coca-Cola are a buy for these four reasons, Jim Cramer says",still open
Coca Cola Co.,02/05/2023,Coke bottler Coca-Cola HBC depleting stock in Russia,still open
Coca Cola Co.,02/05/2023,Should Investors Follow Warren Buffett Into Coca-Cola Stock?,still open
Coca Cola Co.,02/05/2023,US open: Stocks trade higher early on final day of January ...,still open
Coca Cola Co.,02/05/2023,This Restaurant Is Likely A Better Pick Over Coca-Cola Stock,still open
Coca Cola Co.,02/05/2023,"Briefs: February 1, 2023",still open
Coca Cola Co.,02/05/2023,JEPI Vs. SCHD ETFs: Which Is A Better Buy,still open
Coca Cola Co.,02/05/2023,‘I’ve given up getting paid’: global tech platform accused of exploiting artists,still open
Coca Cola Co.,02/05/2023,"Top Stock Reports for Coca-Cola, Merck & Toyota Motor",still open
Coca Cola Co.,02/05/2023,Warren Buffett Has Held This Stock for Over 34 Years — Why He Will Never Sell,still open
Coca Cola Co.,02/05/2023,KO vs. PEP: Why Coca-Cola Stock Looks Tastier,still open
Coca Cola Co.,02/05/2023,Coca-Cola bottler starts making 'Dobry Cola' in Russia,still open
Coca Cola Co.,02/05/2023,Coca-Cola bottler to detail costs of exiting Russia,still open
Coca Cola Co.,02/05/2023,MSFT: Coca-Cola and 3 Other High-Quality Stocks to Buy This ...,still open
Coca Cola Co.,02/05/2023,Jefferies Financial Group Analysts Increase Earnings Estimates for ...,still open
Coca Cola Co.,02/05/2023,Report Shows Challenges of 2022 Didn’t Slow Action on Global Issues by Consumer Goods Companies,still open
Coca Cola Co.,02/05/2023,Coca-Cola vs. PepsiCo: Which Stock Looks More Promising Moving Forward?,still open
Coca Cola Co.,02/05/2023,"Top Stock Reports for Alphabet, JPMorgan & Coca-Cola",still open
Coca Cola Co.,02/05/2023,"Ex-Dividend Reminder: Dole, Coca-Cola and Advance Auto Parts",still open
Coca Cola Co.,02/05/2023,Coca-Cola Vs. PepsiCo: Which Is Currently The More Attractive Stock?,still open
Coca Cola Co.,02/05/2023,Jim Cramer says Coca-Cola is a buy after company 'put on a clinic' in latest earnings report,still open
Coca Cola Co.,02/05/2023,Coke Vs. Pepsi Stock: Which One Is Better?,still open
Coca Cola Co.,02/05/2023,"Laser Photonics stock blasts off on heavy volume again, after Coca-Cola implements laser cleaning system",still open
Coca Cola Co.,02/05/2023,Coca-Cola Stock (NYSE:KO): This Passive-Income Giant Still Has Fizz,still open
Coca Cola Co.,02/05/2023,Coca-Cola's Success Despite Price Hikes Underscores Its Brand Value,still open
Coca Cola Co.,02/05/2023,Coca-Cola to Delay IPO of Africa Bottler on Market Turmoil,still open
Coca Cola Co.,02/05/2023,Coca-Cola Co (KO) Stock: How Does it Score on Fundamental Metrics?,still open
Coca Cola Co.,02/05/2023,Better Dividend Stock for 2023? 3M Stock vs. Coca-Cola Stock,still open
Coca Cola Co.,02/05/2023,Engine No. 1 held talks with Coca-Cola on new recycling initiatives ...,still open
Coca Cola Co.,02/05/2023,Coca-Cola Consolidated: An Upside You Can't Ignore (NASDAQ ...,still open
Coca Cola Co.,02/05/2023,Coca-Cola Zero Sugar Invites Fans to #TakeATaste in Newest ...,still open
Coca Cola Co.,02/05/2023,Coca-Cola Co. stock underperforms Friday when compared to competitors,still open
Coca Cola Co.,02/05/2023,Metis Global Partners LLC Purchases 4648 Shares of The Coca ...,still open
Coca Cola Co.,02/05/2023,The Coca-Cola Company (NYSE:KO) Receives Consensus ...,still open
Coca Cola Co.,02/05/2023,Coca-Cola bottling company eyes Moore Co. for expansion,still open
Coca Cola Co.,02/05/2023,"Coca-Cola Co. stock falls Thursday, underperforms market",still open
Coca Cola Co.,02/05/2023,Is Coca-Cola Co (KO) a Stock to Watch After Gaining 1.88% This Week?,still open
Coca Cola Co.,02/05/2023,Coca-Cola Co. stock outperforms market on strong trading day,still open
Coca Cola Co.,02/05/2023,Is it Worth Investing in The Coca-Cola Company (KO)?,still open
Coca Cola Co.,02/05/2023,"Coca-Cola Co. stock rises Friday, still underperforms market",still open
Coca Cola Co.,02/05/2023,Coca-Cola adds tethered closures to boost PET recycling in Europe,still open
Coca Cola Co.,02/05/2023,"Coca-Cola Co. stock falls Wednesday, underperforms market",still open
Coca Cola Co.,02/05/2023,"FTC Is Investigating Coke, Pepsi Price Discounting Under Antitrust ...",still open
Coca Cola Co.,02/05/2023,Calculating The Intrinsic Value Of The Coca-Cola Company (NYSE:KO),still open
Coca Cola Co.,02/05/2023,BlackRock Cuts Stake in Coca-Cola Bottling Co. Consolidated (COKE),still open
Coca Cola Co.,02/05/2023,Coca-Cola Co. stock outperforms market despite losses on the day,still open
Coca Cola Co.,02/05/2023,OpenX Appoints Caroline Slocombe to Lead Coca-Cola Company ...,still open
Coca Cola Co.,02/05/2023,2023 Bottler of the Year: Heartland Coca-Cola Bottling Co.,still open
Coca Cola Co.,02/05/2023,The Coca-Cola Company (KO) Earnings Preview: KO Stock Likely ...,still open
Coca Cola Co.,02/05/2023,"Over dinner in Davos, the CEOs of Novartis, Coca-Cola, and Grab shared what’s worrying them",still open
Coca Cola Co.,02/05/2023,Parsec Financial Management Inc. Acquires 16381 Shares of The ...,still open
Coca Cola Co.,02/05/2023,LSV Asset Management Reduces Stock Position in Coca-Cola ...,still open
Coca Cola Co.,02/05/2023,The Coca-Cola Company Announces Timing of Fourth Quarter and ...,still open
Coca Cola Co.,02/05/2023,Monster to Develop Small Brands In-House with Coke's Blessing,still open
Coca Cola Co.,02/05/2023,CocaCola Company The (KO) is Attracting Investor Attention: Here is ...,still open
Coca Cola Co.,02/05/2023,Coke Florida Celebrates Black History Month with Focus on ...,still open
Coca Cola Co.,02/05/2023,Simply Orange Juice Class Action Alleges 'Tropical' Drink Contains ...,still open
Coca Cola Co.,02/05/2023,Where to Find Prime? Logan Paul and KSI's Drink Signs Deal With ...,still open
Coca Cola Co.,02/05/2023,Coca-Cola Faces Class Action Lawsuit Over High PFAS Levels in ...,still open
Coca Cola Co.,02/05/2023,Coca-Cola bottlers ramp up carbon capture research for supply chains,still open
Coca Cola Co.,02/05/2023,Madlib & Mark Ronson Joins With The Coca-Cola Company For ...,still open
Coca Cola Co.,02/05/2023,"Coca-Cola Consolidated, Inc. (NASDAQ:COKE) Shares Sold by ...",still open
Coca Cola Co.,02/05/2023,Book Club: Design to Grow: How Coca-Cola Learned to Combine ...,still open
Coca Cola Co.,02/05/2023,The Coca-Cola Company's Costa Coffee expands footprint in India ...,still open
Coca Cola Co.,02/05/2023,"Goldman Sachs Lifts Price Target on Coca-Cola to $62 From $61, Maintains Neutral Rating",still open
Coca Cola Co.,02/05/2023,3 Dow Jones Stocks To Watch Ahead Of February 2023,still open
Coca Cola Co.,02/05/2023,realme to introduce the first Coca-Cola edition smartphone ever: Knoe-more,still open
Coca Cola Co.,02/05/2023,Coca-Cola Ballina named one of world's most advanced ...,still open
Coca Cola Co.,02/05/2023,Return to the 24 Hours of Daytona,still open
Coca Cola Co.,02/05/2023,Coke Studio to start Bharat edition | Mint,still open
Coca Cola Co.,02/05/2023,"Coca-Cola, McDonald's & M&S Food detail sustainability push",still open
Coca Cola Co.,02/05/2023,Root Beer Drinks Market Current Status and Future Prospects (2023 ...,still open
Coca Cola Co.,02/05/2023,These 20 stocks led the January rally -2-,still open
Coca Cola Co.,02/05/2023,Colgate Elects Steve Cahillane to Board of Directors,still open
Coca Cola Co.,02/05/2023,Non-Alc Drinks Brand ISH Adds New CMO to Team,still open
Coca Cola Co.,02/05/2023,Soft Beverages Market Overview 2023-2029| Key Players –Groupe ...,still open
Coca Cola Co.,02/05/2023,Rishi admits he's a Coca-Cola addict and a 'nerd' with Star Wars lightsabers,still open
Coca Cola Co.,02/05/2023,﻿Soft Drink Concentrates Market would Register a Healthy Growth of ...,still open
Coca Cola Co.,02/05/2023,Atlanta reacts to former first lady Bunnie Jackson-Ransom’s passing,still open
Coca Cola Co.,02/05/2023,2023 Heralds Useful Ideas for Packaging Progress ...,still open
Coca Cola Co.,02/05/2023,McCormick cuts workforce to help boost profits in 2023,still open
Coca Cola Co.,02/05/2023,UNDER ARMOUR APPOINTS CAROLYN EVERSON AND ...,still open
Coca Cola Co.,02/05/2023,Dollar General Co. (NYSE:DG) Shares Purchased by Braun Stacey ...,still open
Coca Cola Co.,02/05/2023,"'All-natural' Simply Tropical juice has high levels of toxic 'forever chemicals,' lawsuit alleges",still open
Coca Cola Co.,02/05/2023,5 Dividend King Stocks Gurus A,still open
Coca Cola Co.,02/05/2023,What is ESG investing?,still open
Coca Cola Co.,02/05/2023,SCHD: This 3.4% Yielding Dividend ETF Is Top Value (NYSEARCA ...,still open
Coca Cola Co.,02/05/2023,Packaged Natural Mineral Water Market Size 2023 Industry Recent ...,still open
Coca Cola Co.,02/05/2023,Gordon Ramsay gives his brazen review of Logan Paul's energy drink PRIME,still open
Coca Cola Co.,02/05/2023,Buying ASX shares as a beginner? Here are 3 things I wish I'd known,still open
Coca Cola Co.,02/05/2023,2022 Shipper of Choice profile: The Coca-Cola Co.,still open
Coca Cola Co.,02/05/2023,Work With Us,still open
Coca Cola Co.,02/05/2023,Coca-Cola Invites Fans to Experience Dreamworld – News & Articles,still open
Coca Cola Co.,02/05/2023,Coca-Cola rep found 80% liable for own dismissal,still open
Coca Cola Co.,02/05/2023,Cold brew coffee market to grow by 7.23% Y-O-Y from 2022 to 2023 ...,still open
Coca Cola Co.,02/05/2023,DASANI and Sprite Boost Sustainability Packaging Credentials ...,still open
Coca Cola Co.,02/05/2023,Jack Daniel's & Coca-Cola RTD Debuts in Mexico - News & Articles,still open
Coca Cola Co.,02/05/2023,Investment Product and Service Launches | PLANSPONSOR,still open
Coca Cola Co.,02/05/2023,Social Impact,still open
Coca Cola Co.,02/05/2023,Gordon Thompson Obituary (2023),still open
Coca Cola Co.,02/05/2023,"IVV, GOOGL, LLY, KO: Large Inflows Detected at ETF",still open
