Name,Data,News,Evaluation
F5 Networks,02/15/2023,John McAdam to step down from F5 Networks board (Video) - Puget ...,still open
F5 Networks,02/15/2023,Wellington Management Group Llp Cuts Stake in F5 Networks (FFIV),still open
F5 Networks,02/15/2023,Earnings Preview: F5 Networks (FFIV) Q1 Earnings Expected to ...,still open
F5 Networks,02/15/2023,Earnings Preview For F5 Networks - F5 (NASDAQ:FFIV),still open
F5 Networks,02/15/2023,The bottom is in for Cloudflare stock,still open
F5 Networks,02/15/2023,Is the Bottom in for Cyber-Security Stocks?,still open
F5 Networks,02/15/2023,Allspring Global Investments Holdings LLC has purchased shares of ...,still open
F5 Networks,02/15/2023,Validea Daily Guru Fundamental Report for FFIV - 2/9/2023,still open
F5 Networks,02/15/2023,Daily Markets: Big Tech Earnings Come Into Focus As Investors Assess Recession Prospects,still open
F5 Networks,02/15/2023,The Oregon Public Employees Retirement Fund reduces its ...,still open
F5 Networks,02/15/2023,Pre-Market Brief: Stocks Mixed As Focus Shifts to Big Tech Earnings,still open
F5 Networks,02/15/2023,F5: Fiscal Q1 Earnings Snapshot,still open
F5 Networks,02/15/2023,Akamai (AKAM) Reports Q4: Everything You Need To Know Ahead ...,still open
F5 Networks,02/15/2023,A10 Networks: A Long-Term Play In The Cybersecurity Space ...,still open
F5 Networks,02/15/2023,"F5, INC. Management's Discussion and Analysis of Financial Condition and Results of Operations (form 10-Q)",still open
F5 Networks,02/15/2023,Fraud Detection and Prevention Market Share | Segmented by Top ...,still open
F5 Networks,02/15/2023,F5 Networks Stock Has Failed To Outperform The S&P Despite Steady Revenue Growth,still open
F5 Networks,02/15/2023,F5 Inc. Stock: $300 Billion Opportunity; Fairly Valued (FFIV),still open
F5 Networks,02/15/2023,"Data Center Equipment Market Analysis by Size, Status and ...",still open
F5 Networks,02/15/2023,Why Has F5 Networks Stock Underperformed The S&P Since 2019?,still open
F5 Networks,02/15/2023,EPLUS INC MANAGEMENT'S DISCUSSION AND ANALYSIS OF FINANCIAL CONDITION AND RESULTS OF OPERATIONS (form 10-Q),still open
F5 Networks,02/15/2023,Why Has F5 Networks Stock Risen Almost 1.5x Since 2019?,still open
F5 Networks,02/15/2023,"Load Balancer Market Share Analysis, SWOT, Size, Chain Analysis ...",still open
F5 Networks,02/15/2023,F5 Networks (FFIV) Q4 Earnings and Revenues Top Estimates,still open
F5 Networks,02/15/2023,Is The Bottom In For Cybersecurity Stocks?,still open
F5 Networks,02/15/2023,"Extreme Networks, Inc. (NASDAQ:EXTR) Q2 2023 Earnings Call Transcript",still open
F5 Networks,02/15/2023,F5 Networks (FFIV) Stock Gets A $170 Price Target,still open
F5 Networks,02/15/2023,F5 Networks delivers strong earnings and its stock rises,still open
F5 Networks,02/15/2023,Stock Quote & Details – F5,still open
F5 Networks,02/15/2023,"F5, Inc. (NASDAQ:FFIV) insiders sold US$2.0m worth of stock last year which shareholders may not want to overlook",still open
F5 Networks,02/15/2023,"F5's (NASDAQ:FFIV) earnings have declined over year, contributing to shareholders 35% loss",still open
F5 Networks,02/15/2023,Mobile Accelerator Market Research 2023-2027: with Global Trends ...,still open
F5 Networks,02/15/2023,Network Support & Security Market to Witness Robust Expansion by ...,still open
F5 Networks,02/15/2023,"DDoS Protection Market Worth USD 2225.99 Million by 2028 | Company Profiles, Top Regions, Latest Technology, Investment Opportunities, Future Trends | Sales, Price, Revenue, Gross Margin, Cost Analysis",still open
F5 Networks,02/15/2023,Cybersecurity Market - Global Forecast to 2027: Opportunities ...,still open
F5 Networks,02/15/2023,Plurilock Security (PLUR.V) real AI cybersecurity play set for a ...,still open
F5 Networks,02/15/2023,F5 Stock: Unfairly Undervalued (NASDAQ:FFIV),still open
F5 Networks,02/15/2023,Distributed Denial-of-Service (DDoS) Attack Solution Market 2023 ...,still open
F5 Networks,02/15/2023,How the Pandemic Forced F5 to Flex its Software Side,still open
F5 Networks,02/15/2023,Web Application Firewall (WAF) Market Share 2023: Qualitative ...,still open
F5 Networks,02/15/2023,"5G Security Market Share, Trends, Size And Forecasting to 2032 ...",still open
F5 Networks,02/15/2023,DNS Security Software Market Updated Report [2023-2028] | to ...,still open
F5 Networks,02/15/2023,F5 Networks (FFIV) Surpasses Q1 Earnings Estimates,still open
F5 Networks,02/15/2023,Application Delivery Network (ADN) Market 2023 Phenomenal ...,still open
F5 Networks,02/15/2023,DDoS Protection Market Size and Competitive Analysis 2023 by ...,still open
F5 Networks,02/15/2023,Network Encryption System Market is expected to Exhibit a Massive ...,still open
F5 Networks,02/15/2023,"Stock Market This Week: Penny Stocks, News, & What To Watch Jan 23-27",still open
F5 Networks,02/15/2023,Top Wall Street analysts say buy these stocks amid market uncertainty,still open
F5 Networks,02/15/2023,"Cybersecurity in Tourism Market to See Huge Growth by 2028 | F5 Networks, FireEye, Fortinet",still open
F5 Networks,02/15/2023,"By 2032,BIM Market Report, Latest Trends, Industry Opportunity ...",still open
F5 Networks,02/15/2023,DNS Security Software Market Size and Market Drivers Analysis ...,still open
F5 Networks,02/15/2023,"Analysts have given F5, Inc. (NASDAQ:FFIV) an average rating of ...",still open
F5 Networks,02/15/2023,DDoS Protection Market Growth Statistics 2023-2028: Global Size ...,still open
F5 Networks,02/15/2023,F5 Networks shares drop on supply chain constraints,still open
F5 Networks,02/15/2023,Multi Cloud Security Solutions Market is Set To Fly High in Years to ...,still open
F5 Networks,02/15/2023,Global Application Delivery Network Market | 2023-2027 ...,still open
F5 Networks,02/15/2023,Strength Seen in F5 (FFIV): Can Its 3.2% Jump Turn into More Strength?,still open
F5 Networks,02/15/2023,Competing Protocols Market Growth and Global Share 2023 [New ...,still open
F5 Networks,02/15/2023,Market growth for Application Delivery Controller will accelerate to ...,still open
F5 Networks,02/15/2023,Compromised API led to data theft of 37 million T-Mobile customers,still open
F5 Networks,02/15/2023,"Goldman downgrades F5 Networks, says stock could be a ...",still open
F5 Networks,02/15/2023,F5 Networks' stock plunges as it warns of supply chain constraints ...,still open
F5 Networks,02/15/2023,"VoIP Gateways Market Statistical Forecast, Trade Analysis 2022 ...",still open
F5 Networks,02/15/2023,F5 to Participate in 16th Annual Needham Virtual Security ...,still open
F5 Networks,02/15/2023,"Identity and Access Management Market Share, Size, Growth ...",still open
F5 Networks,02/15/2023,F5 Adds Marianne Budnik to Board of Directors,still open
F5 Networks,02/15/2023,"Cyber Security Market Drivers Shaping Future Growth, Revenue USD 478.68 Billion by 2030 | CAGR 9.5%",still open
F5 Networks,02/15/2023,"F5, Inc. Common Stock (FFIV) Stock Price, Quote, News & History",still open
F5 Networks,02/15/2023,"F5, INC. : Change in Directors or Principal Officers, Financial Statements and Exhibits (form 8-K)",still open
F5 Networks,02/15/2023,"Dow closes 400 points higher, but snaps four-week win streak on rising rate fears",still open
F5 Networks,02/15/2023,F5 to Report First Quarter Fiscal Year 2023 Financial Results,still open
F5 Networks,02/15/2023,F5 Named Best in Class for Bot Management in Aite-Novarica Matrix ...,still open
F5 Networks,02/15/2023,Why Is Meta Platforms (META) Up 14.6% Since Last Earnings Report?,still open
F5 Networks,02/15/2023,NetApp shares nudge upward even as Morgan Stanley cuts rating,still open
F5 Networks,02/15/2023,F5 Appoints Kara Sprague as Chief Product Officer,still open
F5 Networks,02/15/2023,F5 lays off roughly 100 employees across the company - Puget ...,still open
F5 Networks,02/15/2023,Privacy Compliance and Practices | F5,still open
F5 Networks,02/15/2023,F5 Networks Stock Slips On $1 Billion Shape Security Acquisition Despite Deal Synergies,still open
F5 Networks,02/15/2023,"Daily Markets: Big Tech Earnings, Fed Comments Drive Market Mood",still open
F5 Networks,02/15/2023,F5 Collaborates with SoftBank Corp. to Offer Advanced Edge ...,still open
F5 Networks,02/15/2023,CISA shares guidance to block ongoing F5 BIG-IP attacks,still open
F5 Networks,02/15/2023,"Keysight, F5 and AMD Collaborate to Demonstrate 5G Terabit Scale ...",still open
F5 Networks,02/15/2023,F5 Networks Reports Inducement Grants under NASDAQ Listing ...,still open
F5 Networks,02/15/2023,"FFIV Stock Forecast, Price & News (F5)",still open
F5 Networks,02/15/2023,How Does F5 Networks Primarily Make Money: Product Sales or Services?,still open
F5 Networks,02/15/2023,"F5 to Participate in Barclays Global Technology, Media ...",still open
F5 Networks,02/15/2023,F5 Enhances Protection for the Apps and APIs Driving Today's ...,still open
F5 Networks,02/15/2023,What Elliott may be up to with F5 Networks after past success with tech,still open
F5 Networks,02/15/2023,"Most Shareholders Will Probably Find That The CEO Compensation For F5, Inc. (NASDAQ:FFIV) Is Reasonable",still open
F5 Networks,02/15/2023,High Severity Vulnerabilities Reported in F5 BIG-IP and BIG-IQ Devices,still open
F5 Networks,02/15/2023,Fortinet vs F5. Inc.: The Best Cybersecurity Stock to Invest in 2022,still open
F5 Networks,02/15/2023,"Transcript : F5, Inc. Presents at Barclays 2022 Global Technology, Media and Telecommunications Conference, Dec-07-2022 09",still open
F5 Networks,02/15/2023,Will Fortinet's Big Returns Co,still open
F5 Networks,02/15/2023,Researchers show techniques for malware persistence on F5 and Citrix load balancers,still open
F5 Networks,02/15/2023,Here's How Juniper Networks Stock Strongly Outperformed The ...,still open
F5 Networks,02/15/2023,Rakuten Symphony and F5 Accelerate Supply Chain Diversity With ...,still open
F5 Networks,02/15/2023,"F5 Networks Inc. stock falls Tuesday, underperforms market",still open
F5 Networks,02/15/2023,"Mattel (MAT) Beats on Q3 Earnings, Trims 2022 View, Stock Down",still open
F5 Networks,02/15/2023,New High-Severity Vulnerabilities Discovered in Cisco IOx and F5 ...,still open
F5 Networks,02/15/2023,"F5 BIG-IP Vulnerability Can Lead to DoS, Code Execution",still open
F5 Networks,02/15/2023,New Flaw in F5 BIG-IP Emerges,still open
F5 Networks,02/15/2023,Wellington Management Group Llp Cuts Stake in F5 Networks (FFIV),still open
F5 Networks,02/15/2023,Earnings Preview For F5 Networks - F5 (NASDAQ:FFIV),still open
F5 Networks,02/15/2023,Earnings Preview: F5 Networks (FFIV) Q1 Earnings Expected to ...,still open
F5 Networks,02/15/2023,New Podcast Altitude: The Unsung Heroes of Cloud Transformation ...,still open
F5 Networks,02/15/2023,"The Global Web Application Firewall Market is forecast to grow by $6895.11 mn during 2022-2027, accelerating at a CAGR of 18.76% during the forecast period",still open
F5 Networks,02/15/2023,F5: Fiscal Q1 Earnings Snapshot,still open
F5 Networks,02/15/2023,Akamai (AKAM) Reports Q4: Everything You Need To Know Ahead ...,still open
F5 Networks,02/15/2023,Load Balancer Market to Flourish with an Impressive CAGR +14.6 ...,still open
F5 Networks,02/15/2023,The Oregon Public Employees Retirement Fund reduces its ...,still open
F5 Networks,02/15/2023,The Bottom Is In For Cloudflare Stock,still open
F5 Networks,02/15/2023,5 Top Web Application Firewall (WAF) Trends in 2023,still open
F5 Networks,02/15/2023,"Cybersecurity in Tourism Market to See Huge Growth by 2028 | F5 Networks, FireEye, Fortinet",still open
F5 Networks,02/15/2023,Fraud Detection and Prevention Market Share | Segmented by Top ...,still open
F5 Networks,02/15/2023,MixMode Announces Mark Rotolo as Chief Revenue Officer,still open
F5 Networks,02/15/2023,Validea Daily Guru Fundamental Report for FFIV - 2/9/2023,still open
F5 Networks,02/15/2023,DNS Security Software Market Updated Report [2023-2028] | to ...,still open
F5 Networks,02/15/2023,High Severity Vulnerabilities Reported in F5 BIG-IP and BIG-IQ Devices,still open
F5 Networks,02/15/2023,F5 Networks Stock Has Failed To Outperform The S&P Despite Steady Revenue Growth,still open
F5 Networks,02/15/2023,How the latest SQL injection attacks threaten web application firewalls,still open
F5 Networks,02/15/2023,F5 Inc. Stock: $300 Billion Opportunity; Fairly Valued (FFIV),still open
F5 Networks,02/15/2023,Market growth for Application Delivery Controller will accelerate to ...,still open
F5 Networks,02/15/2023,F5 Networks delivers strong earnings and its stock rises,still open
F5 Networks,02/15/2023,Threat Actors Exploiting F5 BIG-IP CVE-2022-1388 | CISA,still open
F5 Networks,02/15/2023,How the Pandemic Forced F5 to Flex its Software Side,still open
F5 Networks,02/15/2023,Rakuten Symphony and F5 Accelerate Supply Chain Diversity With ...,still open
F5 Networks,02/15/2023,The Global Web Application Firewall Market is forecast to grow by ...,still open
F5 Networks,02/15/2023,Why Has F5 Networks Stock Underperformed The S&P Since 2019?,still open
F5 Networks,02/15/2023,"F5 fixes high severity RCE bug in BIG-IP, BIG-IQ devices",still open
F5 Networks,02/15/2023,F5 Networks (FFIV) Q4 Earnings and Revenues Top Estimates,still open
F5 Networks,02/15/2023,F5 Networks shares drop on supply chain constraints,still open
F5 Networks,02/15/2023,"VoIP Gateways Market Statistical Forecast, Trade Analysis 2022 ...",still open
F5 Networks,02/15/2023,Critical F5 BIG-IP vulnerability exploited to wipe devices,still open
F5 Networks,02/15/2023,Privacy Compliance and Practices | F5,still open
F5 Networks,02/15/2023,F5 lays off roughly 100 employees across the company - Puget ...,still open
F5 Networks,02/15/2023,"Cyber Security Market Drivers Shaping Future Growth, Revenue USD 478.68 Billion by 2030 | CAGR 9.5%",still open
F5 Networks,02/15/2023,F5 Warns of Critical Bug Allowing Remote Code Execution in BIG-IP ...,still open
F5 Networks,02/15/2023,F5 Networks (FFIV) Stock Gets A $170 Price Target,still open
F5 Networks,02/15/2023,Why Has F5 Networks Stock Risen Almost 1.5x Since 2019?,still open
F5 Networks,02/15/2023,Cisco observability: What you need to know,still open
F5 Networks,02/15/2023,F5 Adds Marianne Budnik to Board of Directors,still open
F5 Networks,02/15/2023,F5 to Participate in 16th Annual Needham Virtual Security ...,still open
F5 Networks,02/15/2023,F5 on the importance of agility for partners,still open
F5 Networks,02/15/2023,F5 Named Best in Class for Bot Management in Aite-Novarica Matrix ...,still open
F5 Networks,02/15/2023,Inside the battle against bad bots: Why F5's CEO believes good ...,still open
F5 Networks,02/15/2023,Applications everywhere: F5 Networks' CEO on the surprising ...,still open
F5 Networks,02/15/2023,Researchers show techniques for malware persistence on F5 and Citrix load balancers,still open
F5 Networks,02/15/2023,F5 Patches Serious Flaws in BIG-IP,still open
F5 Networks,02/15/2023,The value of adaptive applications | F5,still open
F5 Networks,02/15/2023,RMR Group Inc. starts $140M redevelopment of F5 Networks' former ...,still open
F5 Networks,02/15/2023,"Deserialized web security roundup: KeePass dismisses ‘vulnerability’ report, OpenSSL gets patched, and Reddit admits phishing hack",still open
F5 Networks,02/15/2023,F5 BIG-IP CNF solutions help customers accelerate and secure 5G ...,still open
F5 Networks,02/15/2023,Privacy Notice | F5,still open
F5 Networks,02/15/2023,"Keysight, F5 and AMD Collaborate to Demonstrate 5G Terabit Scale ...",still open
F5 Networks,02/15/2023,"Nutanix, Pure Storage, F5 Networks and Palo Alto Best Positioned ...",still open
F5 Networks,02/15/2023,F5 integrates security for multi-cloud app protection.,still open
F5 Networks,02/15/2023,Stock Quote & Details – F5,still open
F5 Networks,02/15/2023,F5 Enhances Protection for the Apps and APIs Driving Today's ...,still open
F5 Networks,02/15/2023,F5 expands its global network presence in India,still open
F5 Networks,02/15/2023,"POCO F5 Pro Makes Appearance on FCC Certification Website, Launch Could Happen Soon",still open
F5 Networks,02/15/2023,F5 Networks' stock plunges as it warns of supply chain constraints ...,still open
F5 Networks,02/15/2023,Another deal for F5 Networks: $68M acquisition of Threat Stack to ...,still open
F5 Networks,02/15/2023,"F5 refreshes brand by dropping 'Networks' from name, marking ...",still open
F5 Networks,02/15/2023,"Web Application Firewall (WAF) Market Latest Trends, Driving Factors, Segmentations, and Key Industry Players",still open
F5 Networks,02/15/2023,F5 Appoints Kara Sprague as Chief Product Officer,still open
F5 Networks,02/15/2023,What Elliott may be up to with F5 Networks after past success with tech,still open
F5 Networks,02/15/2023,"F5's (NASDAQ:FFIV) earnings have declined over year, contributing to shareholders 35% loss",still open
F5 Networks,02/15/2023,"F5, Inc. (NASDAQ:FFIV) insiders sold US$2.0m worth of stock last year which shareholders may not want to overlook",still open
F5 Networks,02/15/2023,How Does F5 Networks Primarily Make Money: Product Sales or Services?,still open
F5 Networks,02/15/2023,F5 Stock: Unfairly Undervalued (NASDAQ:FFIV),still open
F5 Networks,02/15/2023,F5 Networks Planning Open Source Projects Beyond NGINX,still open
F5 Networks,02/15/2023,F5 Networks Reports Inducement Grants under NASDAQ Listing ...,still open
F5 Networks,02/15/2023,F5's Cloud Native Network Functions Saturate Rakuten Symphony,still open
F5 Networks,02/15/2023,F5 partners with Microsoft for Azure application delivery,still open
F5 Networks,02/15/2023,F5 Networks' acquisition of Volterra signals the rise of distributed ...,still open
F5 Networks,02/15/2023,F5 rebrands in 'significant departure' for the company,still open
F5 Networks,02/15/2023,Elliott Management takes stake in F5 Networks: source,still open
F5 Networks,02/15/2023,F5 to Report First Quarter Fiscal Year 2023 Financial Results,still open
F5 Networks,02/15/2023,F5 urges customers to patch critical BIG-IP pre-auth RCE bug,still open
F5 Networks,02/15/2023,"Goldman downgrades F5 Networks, says stock could be a ...",still open
F5 Networks,02/15/2023,Strength Seen in F5 (FFIV): Can Its 3.2% Jump Turn into More Strength?,still open
F5 Networks,02/15/2023,"F5 to Acquire Shape Security, Transforming Application Security",still open
F5 Networks,02/15/2023,F5 Networks will tour interactive art exhibit to demonstrate ...,still open
F5 Networks,02/15/2023,Attackers Exploiting F5 Networks' BIG-IP Vulnerability,still open
F5 Networks,02/15/2023,F5 patches vulnerability that received a CVSS 10 severity score,still open
F5 Networks,02/15/2023,Hackers are trying to steal admin passwords from F5 BIG-IP devices,still open
F5 Networks,02/15/2023,F5 Networks Closes $670 Million NGINX Acquisition,still open
F5 Networks,02/15/2023,F5 Networks Stock Slips On $1 Billion Shape Security Acquisition Despite Deal Synergies,still open
F5 Networks,02/15/2023,"F5 Networks, FireEye, IBM Among Global Cybersecurity Market ...",still open
F5 Networks,02/15/2023,Experts hail digital economy opportunity,still open
F5 Networks,02/15/2023,F5 Networks intros new fraud detection engine based on Shape ...,still open
F5 Networks,02/15/2023,F5 Ups Its Container and Open Source Game With $670M Nginx Deal,still open
F5 Networks,02/15/2023,"Forcepoint Hires F5 Networks, Forescout Vets as New Sales Leaders",still open
F5 Networks,02/15/2023,F5 Networks Eases Transition to Software Company with Program ...,still open
F5 Networks,02/15/2023,F5 Networks Closes Seattle HQ Over Coronavirus Fears,still open
F5 Networks,02/15/2023,"F5 Networks Acquires Shape Security, for $1 Billion",still open
F5 Networks,02/15/2023,John McAdam to step down from F5 Networks board (Video) - Puget ...,still open
F5 Networks,02/15/2023,Wellington Management Group Llp Cuts Stake in F5 Networks (FFIV),still open
F5 Networks,02/15/2023,Earnings Preview: F5 Networks (FFIV) Q1 Earnings Expected to ...,still open
F5 Networks,02/15/2023,Earnings Preview For F5 Networks - F5 (NASDAQ:FFIV),still open
F5 Networks,02/15/2023,The bottom is in for Cloudflare stock,still open
F5 Networks,02/15/2023,Is the Bottom in for Cyber-Security Stocks?,still open
F5 Networks,02/15/2023,Allspring Global Investments Holdings LLC has purchased shares of ...,still open
F5 Networks,02/15/2023,Validea Daily Guru Fundamental Report for FFIV - 2/9/2023,still open
F5 Networks,02/15/2023,Daily Markets: Big Tech Earnings Come Into Focus As Investors Assess Recession Prospects,still open
F5 Networks,02/15/2023,The Oregon Public Employees Retirement Fund reduces its ...,still open
F5 Networks,02/15/2023,Pre-Market Brief: Stocks Mixed As Focus Shifts to Big Tech Earnings,still open
F5 Networks,02/15/2023,F5: Fiscal Q1 Earnings Snapshot,still open
F5 Networks,02/15/2023,Akamai (AKAM) Reports Q4: Everything You Need To Know Ahead ...,still open
F5 Networks,02/15/2023,A10 Networks: A Long-Term Play In The Cybersecurity Space ...,still open
F5 Networks,02/15/2023,"F5, INC. Management's Discussion and Analysis of Financial Condition and Results of Operations (form 10-Q)",still open
F5 Networks,02/15/2023,Fraud Detection and Prevention Market Share | Segmented by Top ...,still open
F5 Networks,02/15/2023,F5 Networks Stock Has Failed To Outperform The S&P Despite Steady Revenue Growth,still open
F5 Networks,02/15/2023,F5 Inc. Stock: $300 Billion Opportunity; Fairly Valued (FFIV),still open
F5 Networks,02/15/2023,"Data Center Equipment Market Analysis by Size, Status and ...",still open
F5 Networks,02/15/2023,Why Has F5 Networks Stock Underperformed The S&P Since 2019?,still open
F5 Networks,02/15/2023,EPLUS INC MANAGEMENT'S DISCUSSION AND ANALYSIS OF FINANCIAL CONDITION AND RESULTS OF OPERATIONS (form 10-Q),still open
F5 Networks,02/15/2023,Why Has F5 Networks Stock Risen Almost 1.5x Since 2019?,still open
F5 Networks,02/15/2023,"Load Balancer Market Share Analysis, SWOT, Size, Chain Analysis ...",still open
F5 Networks,02/15/2023,F5 Networks (FFIV) Q4 Earnings and Revenues Top Estimates,still open
F5 Networks,02/15/2023,Is The Bottom In For Cybersecurity Stocks?,still open
F5 Networks,02/15/2023,"Extreme Networks, Inc. (NASDAQ:EXTR) Q2 2023 Earnings Call Transcript",still open
F5 Networks,02/15/2023,F5 Networks (FFIV) Stock Gets A $170 Price Target,still open
F5 Networks,02/15/2023,F5 Networks delivers strong earnings and its stock rises,still open
F5 Networks,02/15/2023,Stock Quote & Details – F5,still open
F5 Networks,02/15/2023,"F5, Inc. (NASDAQ:FFIV) insiders sold US$2.0m worth of stock last year which shareholders may not want to overlook",still open
F5 Networks,02/15/2023,"F5's (NASDAQ:FFIV) earnings have declined over year, contributing to shareholders 35% loss",still open
F5 Networks,02/15/2023,Mobile Accelerator Market Research 2023-2027: with Global Trends ...,still open
F5 Networks,02/15/2023,Network Support & Security Market to Witness Robust Expansion by ...,still open
F5 Networks,02/15/2023,"DDoS Protection Market Worth USD 2225.99 Million by 2028 | Company Profiles, Top Regions, Latest Technology, Investment Opportunities, Future Trends | Sales, Price, Revenue, Gross Margin, Cost Analysis",still open
F5 Networks,02/15/2023,Cybersecurity Market - Global Forecast to 2027: Opportunities ...,still open
F5 Networks,02/15/2023,Plurilock Security (PLUR.V) real AI cybersecurity play set for a ...,still open
F5 Networks,02/15/2023,F5 Stock: Unfairly Undervalued (NASDAQ:FFIV),still open
F5 Networks,02/15/2023,Distributed Denial-of-Service (DDoS) Attack Solution Market 2023 ...,still open
F5 Networks,02/15/2023,How the Pandemic Forced F5 to Flex its Software Side,still open
F5 Networks,02/15/2023,Web Application Firewall (WAF) Market Share 2023: Qualitative ...,still open
F5 Networks,02/15/2023,"5G Security Market Share, Trends, Size And Forecasting to 2032 ...",still open
F5 Networks,02/15/2023,DNS Security Software Market Updated Report [2023-2028] | to ...,still open
F5 Networks,02/15/2023,F5 Networks (FFIV) Surpasses Q1 Earnings Estimates,still open
F5 Networks,02/15/2023,Application Delivery Network (ADN) Market 2023 Phenomenal ...,still open
F5 Networks,02/15/2023,DDoS Protection Market Size and Competitive Analysis 2023 by ...,still open
F5 Networks,02/15/2023,Network Encryption System Market is expected to Exhibit a Massive ...,still open
F5 Networks,02/15/2023,"Stock Market This Week: Penny Stocks, News, & What To Watch Jan 23-27",still open
F5 Networks,02/15/2023,Top Wall Street analysts say buy these stocks amid market uncertainty,still open
F5 Networks,02/15/2023,"Cybersecurity in Tourism Market to See Huge Growth by 2028 | F5 Networks, FireEye, Fortinet",still open
F5 Networks,02/15/2023,"By 2032,BIM Market Report, Latest Trends, Industry Opportunity ...",still open
F5 Networks,02/15/2023,DNS Security Software Market Size and Market Drivers Analysis ...,still open
F5 Networks,02/15/2023,"Analysts have given F5, Inc. (NASDAQ:FFIV) an average rating of ...",still open
F5 Networks,02/15/2023,DDoS Protection Market Growth Statistics 2023-2028: Global Size ...,still open
F5 Networks,02/15/2023,F5 Networks shares drop on supply chain constraints,still open
F5 Networks,02/15/2023,Multi Cloud Security Solutions Market is Set To Fly High in Years to ...,still open
F5 Networks,02/15/2023,Global Application Delivery Network Market | 2023-2027 ...,still open
F5 Networks,02/15/2023,Strength Seen in F5 (FFIV): Can Its 3.2% Jump Turn into More Strength?,still open
F5 Networks,02/15/2023,Competing Protocols Market Growth and Global Share 2023 [New ...,still open
F5 Networks,02/15/2023,Market growth for Application Delivery Controller will accelerate to ...,still open
