Name,Data,News,Evaluation
F5 Networks,02/21/2023,F5 Networks Reports Inducement Grants under NASDAQ Listing ...,still open
F5 Networks,02/21/2023,How Does F5 Networks Primarily Make Money: Product Sales or Services?,still open
F5 Networks,02/21/2023,Oxford University spinout Lumai secures £1.1m Innovate UK Smart ...,still open
F5 Networks,02/21/2023,F5 Networks Earnings: What Went Wrong?,still open
F5 Networks,02/21/2023,F5: Fiscal Q1 Earnings Snapshot,still open
F5 Networks,02/21/2023,F5 Helps Customers Defend Against Sophisticated Bot Attacks on ...,still open
F5 Networks,02/21/2023,What Elliott may be up to with F5 Networks after past success with tech,still open
F5 Networks,02/21/2023,"Most Shareholders Will Probably Find That The CEO Compensation For F5, Inc. (NASDAQ:FFIV) Is Reasonable",still open
F5 Networks,02/21/2023,High Severity Vulnerabilities Reported in F5 BIG-IP and BIG-IQ Devices,still open
F5 Networks,02/21/2023,"Transcript : F5, Inc. Presents at Barclays 2022 Global Technology, Media and Telecommunications Conference, Dec-07-2022 09",still open
F5 Networks,02/21/2023,Researchers show techniques for malware persistence on F5 and Citrix load balancers,still open
F5 Networks,02/21/2023,Threat Actors Exploiting F5 BIG-IP CVE-2022-1388 | CISA,still open
F5 Networks,02/21/2023,"F5 Networks Inc. stock falls Tuesday, underperforms market",still open
F5 Networks,02/21/2023,"Mattel (MAT) Beats on Q3 Earnings, Trims 2022 View, Stock Down",still open
F5 Networks,02/21/2023,Rakuten Symphony and F5 Accelerate Supply Chain Diversity With ...,still open
F5 Networks,02/21/2023,"Stocks making the biggest moves after hours: Keurig Dr Pepper, F5 Networks, Tesla and more",still open
F5 Networks,02/21/2023,Dow Jones Bear Market: 2 Dividend Stocks That Haven't Been This ...,still open
F5 Networks,02/21/2023,Multi-Cloud Networking Market Is Expected to Reach USD 18.91 Billion By 2030 : Cognitive Market Research,still open
F5 Networks,02/21/2023,"Fortinet Stock: Fairly Valued, Profitable And Growing Rapidly ...",still open
F5 Networks,02/21/2023,RMR Group Inc. starts $140M redevelopment of F5 Networks' former ...,still open
F5 Networks,02/21/2023,Out With The Old — Why Arista Networks Is Crushing Cisco,still open
F5 Networks,02/21/2023,"Stocks making the biggest moves midday: Microsoft, Visa, Enphase Energy, Boeing and more",still open
F5 Networks,02/21/2023,Cisco stock plunges as company forecasts surprising revenue decline,still open
F5 Networks,02/21/2023,F5 integrates security for multi-cloud app protection.,still open
F5 Networks,02/21/2023,F5 Warns of Critical Bug Allowing Remote Code Execution in BIG-IP ...,still open
F5 Networks,02/21/2023,F5 Networks Jumps On Report It's Shopping Itself Around,still open
F5 Networks,02/21/2023,5 Things to Know About F5 Networks,still open
F5 Networks,02/21/2023,"Juniper Networks stock slides on Q2 earnings miss, sees margins ...",still open
F5 Networks,02/21/2023,Critical F5 BIG-IP vulnerability exploited to wipe devices,still open
F5 Networks,02/21/2023,Earnings could keep the market on edge in week ahead as investors ...,still open
F5 Networks,02/21/2023,F5 : Announcing the first open source Open Programmable Infrastructure (OPI) event,still open
F5 Networks,02/21/2023,"F5 Stock (NASDAQ:FFIV), Quotes and News Summary",still open
F5 Networks,02/21/2023,"Web Performance Market Size, Share, Healthy Growth, Trends ...",still open
F5 Networks,02/21/2023,"Daily Markets: Big Tech Earnings, Fed Comments Drive Market Mood",still open
F5 Networks,02/21/2023,"Even in a Recession, Divergent Stocks Will Prosper",still open
F5 Networks,02/21/2023,"Augmented Reality in Retail Market is poised to grow a Robust CAGR of +40% by 2030 | Microsoft, Magic Leap, Go",still open
F5 Networks,02/21/2023,F5 Networks Q1 2023 Earnings Preview (NASDAQ:FFIV),still open
F5 Networks,02/21/2023,New High-Severity Vulnerabilities Discovered in Cisco IOx and F5 ...,still open
F5 Networks,02/21/2023,F5 Networks (FFIV) Surpasses Q1 Earnings Estimates,still open
F5 Networks,02/21/2023,Wellington Management Group Llp Cuts Stake in F5 Networks (FFIV),still open
F5 Networks,02/21/2023,F5 Networks Tops Q1 EPS by 14c By Investing.com,still open
F5 Networks,02/21/2023,Application Delivery Controllers (ADC) Global Market to Reach $4.9 Billion by 2030: Digital Transformation to Enhance the Market,still open
F5 Networks,02/21/2023,Is the Bottom in for Cyber-Security Stocks?,still open
F5 Networks,02/21/2023,3 Highlights of Huawei's Green Intelligent OptiX Network will be ...,still open
F5 Networks,02/21/2023,F5 names Bart Salaets as new CTO for EMEA,still open
F5 Networks,02/21/2023,Load Balancer Market to Flourish with an Impressive CAGR +14.6 ...,still open
F5 Networks,02/21/2023,The Oregon Public Employees Retirement Fund reduces its ...,still open
F5 Networks,02/21/2023,Application Delivery Networks AND Market Research Report 2023 ...,still open
F5 Networks,02/21/2023,Forcepoint CEO on How SSE Eases Unified Policy Application,still open
F5 Networks,02/21/2023,Secure Web Gateways Market 2023 Research Report which Shows ...,still open
F5 Networks,02/21/2023,"F5 Finds Visibility Gaps Exacerbate Cyberattacks, Pose Largest ...",still open
F5 Networks,02/21/2023,"Remote Ddos Protection Market Size Estimation, Share, Future ...",still open
F5 Networks,02/21/2023,Cloud Load Balancers Market – A Comprehensive Study by Key ...,still open
F5 Networks,02/21/2023,Web application firewall market size to grow at 18.76% by 2027; The growing number of cyber threats to bo,still open
F5 Networks,02/21/2023,"Transport Layer Security Market Size, Share Estimation [2023 ...",still open
F5 Networks,02/21/2023,Diameter Signaling Market Size 2023 Insight Report by ...,still open
F5 Networks,02/21/2023,Application Delivery Network (ADN) Market Biggest Innovation with ...,still open
F5 Networks,02/21/2023,Remote Access Software Tools Market to Witness Huge Growth by ...,still open
F5 Networks,02/21/2023,"By 2032,BIM Market Report, Latest Trends, Industry Opportunity ...",still open
F5 Networks,02/21/2023,The bottom is in for Cloudflare stock,still open
F5 Networks,02/21/2023,F5 Networks Stock Has Failed To Outperform The S&P Despite Steady Revenue Growth,still open
F5 Networks,02/21/2023,High Severity Vulnerabilities Reported in F5 BIG-IP and BIG-IQ Devices,still open
F5 Networks,02/21/2023,F5 Inc. Stock: $300 Billion Opportunity; Fairly Valued (FFIV),still open
F5 Networks,02/21/2023,"IoT 5G Security Market Forecast 2023-2029 Business Growth, Type, Size, Application, Cost, Trends, New Opportun",still open
F5 Networks,02/21/2023,F5 Networks (FFIV) Q3 2022 Earnings Call Transcript,still open
F5 Networks,02/21/2023,Threat Actors Exploiting F5 BIG-IP CVE-2022-1388 | CISA,still open
F5 Networks,02/21/2023,Global Mobile Accelerator Market | Expected to Reach USD 4272.86 ...,still open
F5 Networks,02/21/2023,How the Pandemic Forced F5 to Flex its Software Side,still open
F5 Networks,02/21/2023,"Web Performance Testing Market Future Growth Opportunities 2022-2028 | Akamai, Automai, Broadcom",still open
F5 Networks,02/21/2023,Rakuten Symphony and F5 Accelerate Supply Chain Diversity With ...,still open
F5 Networks,02/21/2023,"F5 fixes high severity RCE bug in BIG-IP, BIG-IQ devices",still open
F5 Networks,02/21/2023,"Pressure Control Equipment Market Size, Development Data ...",still open
F5 Networks,02/21/2023,Privacy Compliance and Practices | F5,still open
F5 Networks,02/21/2023,F5 Networks (FFIV) Q4 Earnings and Revenues Top Estimates,still open
F5 Networks,02/21/2023,Does Your CLM Integrate with Your Tech Stack? Here’s Why It Should,still open
F5 Networks,02/21/2023,F5 Networks shares drop on supply chain constraints,still open
F5 Networks,02/21/2023,Critical F5 BIG-IP vulnerability exploited to wipe devices,still open
F5 Networks,02/21/2023,F5 lays off roughly 100 employees across the company - Puget ...,still open
F5 Networks,02/21/2023,F5 Warns of Critical Bug Allowing Remote Code Execution in BIG-IP ...,still open
F5 Networks,02/21/2023,F5 Networks (FFIV) Stock Gets A $170 Price Target,still open
F5 Networks,02/21/2023,F5 to Participate in 16th Annual Needham Virtual Security ...,still open
F5 Networks,02/21/2023,Network Function Virtualization (NFV) Market will Revenue to Cross ...,still open
F5 Networks,02/21/2023,F5 to Report First Quarter Fiscal Year 2023 Financial Results,still open
F5 Networks,02/21/2023,F5 Appoints Kara Sprague as Chief Product Officer,still open
F5 Networks,02/21/2023,F5 Adds Marianne Budnik to Board of Directors,still open
F5 Networks,02/21/2023,The value of adaptive applications | F5,still open
F5 Networks,02/21/2023,Researchers show techniques for malware persistence on F5 and Citrix load balancers,still open
F5 Networks,02/21/2023,F5 Patches Serious Flaws in BIG-IP,still open
F5 Networks,02/21/2023,Privacy Notice | F5,still open
F5 Networks,02/21/2023,Applications everywhere: F5 Networks' CEO on the surprising ...,still open
F5 Networks,02/21/2023,RMR Group Inc. starts $140M redevelopment of F5 Networks' former ...,still open
F5 Networks,02/21/2023,Inside the battle against bad bots: Why F5's CEO believes good ...,still open
F5 Networks,02/21/2023,F5 Named Best in Class for Bot Management in Aite-Novarica Matrix ...,still open
F5 Networks,02/21/2023,F5 BIG-IP CNF solutions help customers accelerate and secure 5G ...,still open
F5 Networks,02/21/2023,F5's Cloud Native Network Functions Saturate Rakuten Symphony,still open
F5 Networks,02/21/2023,Oxford University spinout Lumai secures £1.1m Innovate UK Smart ...,still open
F5 Networks,02/21/2023,"Keysight, F5 and AMD Collaborate to Demonstrate 5G Terabit Scale ...",still open
F5 Networks,02/21/2023,"Targeted Sequencing Market is expected to represent Significant CAGR of +16% by 2030 |Agilent Technologies, Az",still open
F5 Networks,02/21/2023,F5 integrates security for multi-cloud app protection.,still open
F5 Networks,02/21/2023,F5 Collaborates with SoftBank Corp. to Offer Advanced Edge ...,still open
F5 Networks,02/21/2023,F5 expands its global network presence in India,still open
F5 Networks,02/21/2023,Stock Quote & Details – F5,still open
F5 Networks,02/21/2023,Another deal for F5 Networks: $68M acquisition of Threat Stack to ...,still open
F5 Networks,02/21/2023,F5 Networks' stock plunges as it warns of supply chain constraints ...,still open
F5 Networks,02/21/2023,"F5 refreshes brand by dropping 'Networks' from name, marking ...",still open
F5 Networks,02/21/2023,What Elliott may be up to with F5 Networks after past success with tech,still open
F5 Networks,02/21/2023,"F5's (NASDAQ:FFIV) earnings have declined over year, contributing to shareholders 35% loss",still open
F5 Networks,02/21/2023,"F5, Inc. (NASDAQ:FFIV) insiders sold US$2.0m worth of stock last year which shareholders may not want to overlook",still open
F5 Networks,02/21/2023,How Does F5 Networks Primarily Make Money: Product Sales or Services?,still open
F5 Networks,02/21/2023,Bear Of The Day: F5 (FFIV),still open
F5 Networks,02/21/2023,F5 Networks Planning Open Source Projects Beyond NGINX,still open
F5 Networks,02/21/2023,F5 Stock: Unfairly Undervalued (NASDAQ:FFIV),still open
F5 Networks,02/21/2023,F5 partners with Microsoft for Azure application delivery,still open
F5 Networks,02/21/2023,F5 Networks’ acquisition of Volterra foreshadows a fight for the network edge,still open
F5 Networks,02/21/2023,F5: Fiscal Q1 Earnings Snapshot,still open
F5 Networks,02/21/2023,"Francois Locoh-Donou Sells 2201 Shares of F5, Inc. (NASDAQ:FFIV ...",still open
F5 Networks,02/21/2023,F5 rebrands in 'significant departure' for the company,still open
F5 Networks,02/21/2023,Elliott Management takes stake in F5 Networks: source,still open
F5 Networks,02/21/2023,F5 urges customers to patch critical BIG-IP pre-auth RCE bug,still open
F5 Networks,02/21/2023,Load Balancer Market to Witness Massive Growth by 2029 | F5 ...,still open
F5 Networks,02/21/2023,F5 NGINX Delivers Modern Management Platform,still open
F5 Networks,02/21/2023,"F5 to Acquire Shape Security, Transforming Application Security",still open
F5 Networks,02/21/2023,F5 patches vulnerability that received a CVSS 10 severity score,still open
F5 Networks,02/21/2023,F5 Networks Stock Slips On $1 Billion Shape Security Acquisition Despite Deal Synergies,still open
F5 Networks,02/21/2023,Attackers Exploiting F5 Networks' BIG-IP Vulnerability,still open
F5 Networks,02/21/2023,Hackers are trying to steal admin passwords from F5 BIG-IP devices,still open
F5 Networks,02/21/2023,F5 Networks will tour interactive art exhibit to demonstrate ...,still open
F5 Networks,02/21/2023,"F5 Networks, FireEye, IBM Among Global Cybersecurity Market ...",still open
F5 Networks,02/21/2023,F5 Networks unveils new application security services,still open
F5 Networks,02/21/2023,Allspring Global Investments Holdings LLC has purchased shares of ...,still open
F5 Networks,02/21/2023,F5 Networks intros new fraud detection engine based on Shape ...,still open
F5 Networks,02/21/2023,F5 Ups Its Container and Open Source Game With $670M Nginx Deal,still open
F5 Networks,02/21/2023,F5 Networks Eases Transition to Software Company with Program ...,still open
F5 Networks,02/21/2023,"Forcepoint Hires F5 Networks, Forescout Vets as New Sales Leaders",still open
F5 Networks,02/21/2023,F5 Networks Closes $670 Million NGINX Acquisition,still open
F5 Networks,02/21/2023,F5 Networks (FFIV) Surpasses Q1 Earnings Estimates,still open
F5 Networks,02/21/2023,F5's stock slumps as revenue growth slows to a crawl,still open
F5 Networks,02/21/2023,"F5 Networks' (FFIV) Q1 Earnings Beat, Revenues Miss Estimates",still open
F5 Networks,02/21/2023,The Bottom Is In For Cloudflare Stock,still open
F5 Networks,02/21/2023,Wellington Management Group Llp Cuts Stake in F5 Networks (FFIV),still open
F5 Networks,02/21/2023,F5 Networks Q1 2023 Earnings Preview (NASDAQ:FFIV),still open
F5 Networks,02/21/2023,Is The Bottom In For Cyber-Security Stocks?,still open
F5 Networks,02/21/2023,The Oregon Public Employees Retirement Fund reduces its ...,still open
F5 Networks,02/21/2023,Daily Markets: Big Tech Earnings Come Into Focus As Investors Assess Recession Prospects,still open
F5 Networks,02/21/2023,"Remote Ddos Protection Market Size Estimation, Share, Future ...",still open
F5 Networks,02/21/2023,F5 Networks Stock Has Failed To Outperform The S&P Despite Steady Revenue Growth,still open
F5 Networks,02/21/2023,"F5, INC. Management's Discussion and Analysis of Financial Condition and Results of Operations (form 10-Q)",still open
F5 Networks,02/21/2023,F5 Inc. Stock: $300 Billion Opportunity; Fairly Valued (FFIV),still open
F5 Networks,02/21/2023,Secure Web Gateways Market 2023 Research Report which Shows ...,still open
F5 Networks,02/21/2023,F5 Networks slumps as outlook drags on software maker's shares,still open
F5 Networks,02/21/2023,"Transport Layer Security Market Size, Share Estimation [2023 ...",still open
F5 Networks,02/21/2023,Trade Statistics of Carrier Class Firewalls and VNF Market Size ...,still open
F5 Networks,02/21/2023,F5 Networks (FFIV) Q4 Earnings and Revenues Top Estimates,still open
F5 Networks,02/21/2023,Application Delivery Controllers (ADC) Global Market to Reach $4.9 ...,still open
F5 Networks,02/21/2023,Why Has F5 Networks Stock Risen Almost 1.5x Since 2019?,still open
F5 Networks,02/21/2023,F5 Networks (FFIV) Stock Gets A $170 Price Target,still open
F5 Networks,02/21/2023,Is The Bottom In For Cybersecurity Stocks?,still open
F5 Networks,02/21/2023,Diameter Signaling Market Size 2023 Insight Report by ...,still open
F5 Networks,02/21/2023,F5 Networks delivers strong earnings and its stock rises,still open
F5 Networks,02/21/2023,"F5, Inc. (NASDAQ:FFIV) insiders sold US$2.0m worth of stock last year which shareholders may not want to overlook",still open
F5 Networks,02/21/2023,Stock Quote & Details – F5,still open
F5 Networks,02/21/2023,"F5's (NASDAQ:FFIV) earnings have declined over year, contributing to shareholders 35% loss",still open
F5 Networks,02/21/2023,Global Mobile Accelerator Market | Expected to Reach USD 4272.86 ...,still open
F5 Networks,02/21/2023,Cloud Load Balancers Market – A Comprehensive Study by Key ...,still open
F5 Networks,02/21/2023,F5 Stock: Unfairly Undervalued (NASDAQ:FFIV),still open
F5 Networks,02/21/2023,"Francois Locoh-Donou Sells 2201 Shares of F5, Inc. (NASDAQ:FFIV ...",still open
F5 Networks,02/21/2023,"Managed Security Services Market Growth, Opportunities Business ...",still open
F5 Networks,02/21/2023,How the Pandemic Forced F5 to Flex its Software Side,still open
F5 Networks,02/21/2023,Firewall As A Service (Fwaas) Market 2022 Segments Analysis by ...,still open
F5 Networks,02/21/2023,Top Wall Street analysts say buy these stocks amid market uncertainty,still open
F5 Networks,02/21/2023,Cloud Storage Gateways Market Booming Worldwide With Leading ...,still open
F5 Networks,02/21/2023,"IoT 5G Security Market Forecast 2023-2029 Business Growth, Type, Size, Application, Cost, Trends, New Opportun",still open
F5 Networks,02/21/2023,F5 Inc Is a Troubled Stock With Upside Potential,still open
F5 Networks,02/21/2023,"Web Performance Testing Market Future Growth Opportunities 2022-2028 | Akamai, Automai, Broadcom",still open
F5 Networks,02/21/2023,Network Function Virtualization (NFV) Market will Revenue to Cross ...,still open
F5 Networks,02/21/2023,F5 to Report First Quarter Fiscal Year 2023 Financial Results,still open
F5 Networks,02/21/2023,Bear Of The Day: F5 (FFIV),still open
F5 Networks,02/21/2023,F5 to Participate in 16th Annual Needham Virtual Security ...,still open
F5 Networks,02/21/2023,Allspring Global Investments Holdings LLC has purchased shares of ...,still open
F5 Networks,02/21/2023,F5 Networks' stock plunges as it warns of supply chain constraints ...,still open
F5 Networks,02/21/2023,F5 Adds Marianne Budnik to Board of Directors,still open
F5 Networks,02/21/2023,Why Is Meta Platforms (META) Up 14.6% Since Last Earnings Report?,still open
F5 Networks,02/21/2023,A10 Networks: A Long-Term Play In The Cybersecurity Space ...,still open
F5 Networks,02/21/2023,"F5, Inc. Common Stock (FFIV) Stock Price, Quote, News & History",still open
F5 Networks,02/21/2023,"F5, INC. : Change in Directors or Principal Officers, Financial Statements and Exhibits (form 8-K)",still open
F5 Networks,02/21/2023,"Dow closes 400 points higher, but snaps four-week win streak on rising rate fears",still open
F5 Networks,02/21/2023,NetApp shares nudge upward even as Morgan Stanley cuts rating,still open
F5 Networks,02/21/2023,F5 lays off roughly 100 employees across the company - Puget ...,still open
F5 Networks,02/21/2023,F5 Networks Stock Slips On $1 Billion Shape Security Acquisition Despite Deal Synergies,still open
F5 Networks,02/21/2023,F5 Appoints Kara Sprague as Chief Product Officer,still open
F5 Networks,02/21/2023,Privacy Compliance and Practices | F5,still open
F5 Networks,02/21/2023,"Targeted Sequencing Market is expected to represent Significant CAGR of +16% by 2030 |Agilent Technologies, Az",still open
F5 Networks,02/21/2023,F5 Named Best in Class for Bot Management in Aite-Novarica Matrix ...,still open
F5 Networks,02/21/2023,CISA shares guidance to block ongoing F5 BIG-IP attacks,still open
F5 Networks,02/21/2023,F5 Collaborates with SoftBank Corp. to Offer Advanced Edge ...,still open
F5 Networks,02/21/2023,Fortinet vs F5. Inc.: The Best Cybersecurity Stock to Invest in 2022,still open
F5 Networks,02/21/2023,F5 Networks Reports Inducement Grants under NASDAQ Listing ...,still open
F5 Networks,02/21/2023,How Does F5 Networks Primarily Make Money: Product Sales or Services?,still open
F5 Networks,02/21/2023,F5 Networks Earnings: What Went Wrong?,still open
F5 Networks,02/21/2023,Oxford University spinout Lumai secures £1.1m Innovate UK Smart ...,still open
F5 Networks,02/21/2023,F5: Fiscal Q1 Earnings Snapshot,still open
F5 Networks,02/21/2023,F5 Helps Customers Defend Against Sophisticated Bot Attacks on ...,still open
F5 Networks,02/21/2023,What Elliott may be up to with F5 Networks after past success with tech,still open
F5 Networks,02/21/2023,"Most Shareholders Will Probably Find That The CEO Compensation For F5, Inc. (NASDAQ:FFIV) Is Reasonable",still open
F5 Networks,02/21/2023,High Severity Vulnerabilities Reported in F5 BIG-IP and BIG-IQ Devices,still open
F5 Networks,02/21/2023,Researchers show techniques for malware persistence on F5 and Citrix load balancers,still open
F5 Networks,02/21/2023,Here's How Juniper Networks Stock Strongly Outperformed The ...,still open
F5 Networks,02/21/2023,"F5 Networks Inc. stock falls Tuesday, underperforms market",still open
F5 Networks,02/21/2023,Rakuten Symphony and F5 Accelerate Supply Chain Diversity With ...,still open
F5 Networks,02/21/2023,"Stocks making the biggest moves after hours: Keurig Dr Pepper, F5 Networks, Tesla and more",still open
F5 Networks,02/21/2023,Dow Jones Bear Market: 2 Dividend Stocks That Haven't Been This ...,still open
F5 Networks,02/21/2023,"Fortinet Stock: Fairly Valued, Profitable And Growing Rapidly ...",still open
F5 Networks,02/21/2023,RMR Group Inc. starts $140M redevelopment of F5 Networks' former ...,still open
F5 Networks,02/21/2023,Out With The Old — Why Arista Networks Is Crushing Cisco,still open
F5 Networks,02/21/2023,"Stocks making the biggest moves midday: Microsoft, Visa, Enphase Energy, Boeing and more",still open
F5 Networks,02/21/2023,Earnings Preview: Meta Platforms (META) Q2 Earnings Expected to Decline,still open
F5 Networks,02/21/2023,Cisco stock plunges as company forecasts surprising revenue decline,still open
F5 Networks,02/21/2023,F5 integrates security for multi-cloud app protection.,still open
F5 Networks,02/21/2023,F5 Warns of Critical Bug Allowing Remote Code Execution in BIG-IP ...,still open
F5 Networks,02/21/2023,F5 Networks Jumps On Report It's Shopping Itself Around,still open
F5 Networks,02/21/2023,5 Things to Know About F5 Networks,still open
F5 Networks,02/21/2023,"Juniper Networks stock slides on Q2 earnings miss, sees margins ...",still open
F5 Networks,02/21/2023,Critical F5 BIG-IP vulnerability exploited to wipe devices,still open
F5 Networks,02/21/2023,Earnings could keep the market on edge in week ahead as investors ...,still open
F5 Networks,02/21/2023,F5 : Announcing the first open source Open Programmable Infrastructure (OPI) event,still open
F5 Networks,02/21/2023,"F5 Stock (NASDAQ:FFIV), Quotes and News Summary",still open
F5 Networks,02/21/2023,"Web Performance Market Size, Share, Healthy Growth, Trends ...",still open
F5 Networks,02/21/2023,"Daily Markets: Big Tech Earnings, Fed Comments Drive Market Mood",still open
F5 Networks,02/21/2023,"Even in a Recession, Divergent Stocks Will Prosper",still open
F5 Networks,02/21/2023,Privacy Notice | F5,still open
F5 Networks,02/21/2023,"Augmented Reality in Retail Market is poised to grow a Robust CAGR of +40% by 2030 | Microsoft, Magic Leap, Go",still open
F5 Networks,02/21/2023,Find Bear Market Shelter and Mega Upside With 'Divergence' Stocks,still open
F5 Networks,02/21/2023,F5 Networks Q1 2023 Earnings Preview (NASDAQ:FFIV),still open
F5 Networks,02/21/2023,New High-Severity Vulnerabilities Discovered in Cisco IOx and F5 ...,still open
F5 Networks,02/21/2023,F5 Networks (FFIV) Surpasses Q1 Earnings Estimates,still open
F5 Networks,02/21/2023,Wellington Management Group Llp Cuts Stake in F5 Networks (FFIV),still open
F5 Networks,02/21/2023,F5 Networks Tops Q1 EPS by 14c By Investing.com,still open
F5 Networks,02/21/2023,Application Delivery Controllers (ADC) Global Market to Reach $4.9 Billion by 2030: Digital Transformation to Enhance the Market,still open
F5 Networks,02/21/2023,Is the Bottom in for Cyber-Security Stocks?,still open
F5 Networks,02/21/2023,3 Highlights of Huawei's Green Intelligent OptiX Network will be ...,still open
F5 Networks,02/21/2023,F5 names Bart Salaets as new CTO for EMEA,still open
F5 Networks,02/21/2023,Load Balancer Market to Flourish with an Impressive CAGR +14.6 ...,still open
F5 Networks,02/21/2023,The Oregon Public Employees Retirement Fund reduces its ...,still open
F5 Networks,02/21/2023,Application Delivery Networks AND Market Research Report 2023 ...,still open
F5 Networks,02/21/2023,Forcepoint CEO on How SSE Eases Unified Policy Application,still open
F5 Networks,02/21/2023,Secure Web Gateways Market 2023 Research Report which Shows ...,still open
F5 Networks,02/21/2023,"F5 Finds Visibility Gaps Exacerbate Cyberattacks, Pose Largest ...",still open
F5 Networks,02/21/2023,"Remote Ddos Protection Market Size Estimation, Share, Future ...",still open
F5 Networks,02/21/2023,Cloud Load Balancers Market – A Comprehensive Study by Key ...,still open
F5 Networks,02/21/2023,Web application firewall market size to grow at 18.76% by 2027; The growing number of cyber threats to bo,still open
F5 Networks,02/21/2023,"Transport Layer Security Market Size, Share Estimation [2023 ...",still open
F5 Networks,02/21/2023,Diameter Signaling Market Size 2023 Insight Report by ...,still open
F5 Networks,02/21/2023,Application Delivery Network (ADN) Market Biggest Innovation with ...,still open
F5 Networks,02/21/2023,Remote Access Software Tools Market to Witness Huge Growth by ...,still open
F5 Networks,02/21/2023,"By 2032,BIM Market Report, Latest Trends, Industry Opportunity ...",still open
F5 Networks,02/21/2023,The bottom is in for Cloudflare stock,still open
F5 Networks,02/21/2023,F5 Networks Stock Has Failed To Outperform The S&P Despite Steady Revenue Growth,still open
F5 Networks,02/21/2023,High Severity Vulnerabilities Reported in F5 BIG-IP and BIG-IQ Devices,still open
