Name,Data,News,Evaluation
F5 Networks,02/05/2023,New High-Severity Vulnerabilities Discovered in Cisco IOx and F5 ...,still open
F5 Networks,02/05/2023,"F5 BIG-IP Vulnerability Can Lead to DoS, Code Execution",still open
F5 Networks,02/05/2023,F5 working to patch BIG-IP API bug,still open
F5 Networks,02/05/2023,F5 Networks (FFIV) Surpasses Q1 Earnings Estimates,still open
F5 Networks,02/05/2023,Earnings Preview For F5 Networks - F5 (NASDAQ:FFIV),still open
F5 Networks,02/05/2023,"F5 Networks' (FFIV) Q1 Earnings Beat, Revenues Miss Estimates",still open
F5 Networks,02/05/2023,F5 Networks Q1 2023 Earnings Preview (NASDAQ:FFIV),still open
F5 Networks,02/05/2023,Cybersecurity in Tourism Market is Booming Worldwide | F5 ...,still open
F5 Networks,02/05/2023,"Enterprise Network Market Size, Share, Growth Statistics By Top Key ...",still open
F5 Networks,02/05/2023,"F5 Finds Visibility Gaps Exacerbate Cyberattacks, Pose Largest ...",still open
F5 Networks,02/05/2023,F5: Fiscal Q1 Earnings Snapshot,still open
F5 Networks,02/05/2023,Using load balancers to automate security and mitigate the network impact,still open
F5 Networks,02/05/2023,Application Delivery Network (ADN) Market Biggest Innovation with ...,still open
F5 Networks,02/05/2023,Cloud Storage Gateways Market Booming Worldwide With Leading ...,still open
F5 Networks,02/05/2023,﻿Transport Layer Security Market Report 2020 Market Biggest ...,still open
F5 Networks,02/05/2023,Multi-Cloud Security Solutions Market is Expected to Reach US ...,still open
F5 Networks,02/05/2023,"Global Web Performance Market Report 2022: Major Players Include Micro Focus, IBM, Akamai Technologies and Dynatrace",still open
F5 Networks,02/05/2023,"Cybersecurity Market Size, Share, Revenue, Trends And Drivers For 2023-2032",still open
F5 Networks,02/05/2023,"Application security market 2022-2026; A descriptive analysis of the five forces model, market dynamics,",still open
F5 Networks,02/05/2023,Daily Markets: Soft Guidance and Tepid Spending Weigh on Stocks,still open
F5 Networks,02/05/2023,"VoIP Gateways Market Statistical Forecast, Trade Analysis 2022 ...",still open
F5 Networks,02/05/2023,"Global Industrial Cybersecurity Market Report to 2030: Featuring Fortinet, Cisco Systems, Juniper Network",still open
F5 Networks,02/05/2023,High Severity Vulnerabilities Reported in F5 BIG-IP and BIG-IQ Devices,still open
F5 Networks,02/05/2023,F5 Networks Stock Has Failed To Outperform The S&P Despite Steady Revenue Growth,still open
F5 Networks,02/05/2023,F5 Networks delivers strong earnings and its stock rises,still open
F5 Networks,02/05/2023,F5 Inc. Stock: $300 Billion Opportunity; Fairly Valued (FFIV),still open
F5 Networks,02/05/2023,F5 Networks (FFIV) Q4 Earnings and Revenues Top Estimates,still open
F5 Networks,02/05/2023,Threat Actors Exploiting F5 BIG-IP CVE-2022-1388 | CISA,still open
F5 Networks,02/05/2023,How the Pandemic Forced F5 to Flex its Software Side,still open
F5 Networks,02/05/2023,Rakuten Symphony and F5 Accelerate Supply Chain Diversity With ...,still open
F5 Networks,02/05/2023,Hybrid Cloud Infrastructure Trends And Startups To Watch,still open
F5 Networks,02/05/2023,Why Has F5 Networks Stock Underperformed The S&P Since 2019?,still open
F5 Networks,02/05/2023,"Hackers exploiting critical F5 BIG-IP bug, public exploits released",still open
F5 Networks,02/05/2023,F5 Networks shares drop on supply chain constraints,still open
F5 Networks,02/05/2023,Rapid7 discloses more F5 BIG-IP vulnerabilities,still open
F5 Networks,02/05/2023,F5 Networks (FFIV) Stock Gets A $170 Price Target,still open
F5 Networks,02/05/2023,Online Fitness Course Market to Witness Huge Growth by 2029 ...,still open
F5 Networks,02/05/2023,Application Management Services (AMS) Market Size & Analysis By ...,still open
F5 Networks,02/05/2023,F5 lays off roughly 100 employees across the company - Puget ...,still open
F5 Networks,02/05/2023,Privacy Compliance and Practices | F5,still open
F5 Networks,02/05/2023,F5 Warns of Critical Bug Allowing Remote Code Execution in BIG-IP ...,still open
F5 Networks,02/05/2023,Home Security Solutions Market Biggest Innovation with Top Key ...,still open
F5 Networks,02/05/2023,Pediatric Software Market 2022 by Keyplayers and Vendors:Meditab ...,still open
F5 Networks,02/05/2023,Oilfield Communications Market – A Comprehensive Study by Key ...,still open
F5 Networks,02/05/2023,F5 Adds Marianne Budnik to Board of Directors,still open
F5 Networks,02/05/2023,F5 to Report First Quarter Fiscal Year 2023 Financial Results,still open
F5 Networks,02/05/2023,F5 to Participate in 16th Annual Needham Virtual Security ...,still open
F5 Networks,02/05/2023,F5 Appoints Kara Sprague as Chief Product Officer,still open
F5 Networks,02/05/2023,F5 combines technology from big acquisitions into new Distributed ...,still open
F5 Networks,02/05/2023,Inside the battle against bad bots: Why F5's CEO believes good ...,still open
F5 Networks,02/05/2023,F5 Named Best in Class for Bot Management in Aite-Novarica Matrix ...,still open
F5 Networks,02/05/2023,RMR Group Inc. starts $140M redevelopment of F5 Networks' former ...,still open
F5 Networks,02/05/2023,"F5 to Participate in Barclays Global Technology, Media ...",still open
F5 Networks,02/05/2023,Applications everywhere: F5 Networks' CEO on the surprising ...,still open
F5 Networks,02/05/2023,F5 Patches Serious Flaws in BIG-IP,still open
F5 Networks,02/05/2023,F5 BIG-IP CNF solutions help customers accelerate and secure 5G ...,still open
F5 Networks,02/05/2023,Researchers show techniques for malware persistence on F5 and Citrix load balancers,still open
F5 Networks,02/05/2023,The value of adaptive applications | F5,still open
F5 Networks,02/05/2023,Privacy Notice | F5,still open
F5 Networks,02/05/2023,F5 Distributed Cloud App Infrastructure Protection detects ...,still open
F5 Networks,02/05/2023,Cordless Vacuum Cleaner Sales Market 2023 key developmental ...,still open
F5 Networks,02/05/2023,F5 Networks Reaches $500 Million Deal for Startup Volterra,still open
F5 Networks,02/05/2023,"Keysight, F5 and AMD Collaborate to Demonstrate 5G Terabit Scale ...",still open
F5 Networks,02/05/2023,Another deal for F5 Networks: $68M acquisition of Threat Stack to ...,still open
F5 Networks,02/05/2023,"F5 refreshes brand by dropping 'Networks' from name, marking ...",still open
F5 Networks,02/05/2023,The new edge will transform the computing experience,still open
F5 Networks,02/05/2023,"F5, Inc. (NASDAQ:FFIV) insiders sold US$2.0m worth of stock last year which shareholders may not want to overlook",still open
F5 Networks,02/05/2023,F5 Stock: Unfairly Undervalued (NASDAQ:FFIV),still open
F5 Networks,02/05/2023,What Elliott may be up to with F5 Networks after past success with tech,still open
F5 Networks,02/05/2023,"F5's (NASDAQ:FFIV) earnings have declined over year, contributing to shareholders 35% loss",still open
F5 Networks,02/05/2023,F5 Ups Its Container and Open Source Game With $670M Nginx Deal,still open
F5 Networks,02/05/2023,How Does F5 Networks Primarily Make Money: Product Sales or Services?,still open
F5 Networks,02/05/2023,F5's Cloud Native Network Functions Saturate Rakuten Symphony,still open
F5 Networks,02/05/2023,F5 Networks Planning Open Source Projects Beyond NGINX,still open
F5 Networks,02/05/2023,"F5 Unveils NGINX for Microsoft Azure to Deliver Secure, High ...",still open
F5 Networks,02/05/2023,Edge Security Market worth $51.1 billion by 2027 - Exclusive Report ...,still open
F5 Networks,02/05/2023,F5 Networks Reports Inducement Grants under NASDAQ Listing ...,still open
F5 Networks,02/05/2023,F5 Collaborates with SoftBank Corp. to Offer Advanced Edge ...,still open
F5 Networks,02/05/2023,CISA issues warning about vulnerabilities in VMware and F5 products,still open
F5 Networks,02/05/2023,Strength Seen in F5 (FFIV): Can Its 3.2% Jump Turn into More Strength?,still open
F5 Networks,02/05/2023,F5 rebrands in 'significant departure' for the company,still open
F5 Networks,02/05/2023,Elliott Management takes stake in F5 Networks: source,still open
F5 Networks,02/05/2023,Seattle U students tackle real-world computer and engineering ...,still open
F5 Networks,02/05/2023,F5 urges customers to patch critical BIG-IP pre-auth RCE bug,still open
F5 Networks,02/05/2023,F5 Networks will tour interactive art exhibit to demonstrate ...,still open
F5 Networks,02/05/2023,Attackers Exploiting F5 Networks' BIG-IP Vulnerability,still open
F5 Networks,02/05/2023,"F5 to Acquire Shape Security, Transforming Application Security",still open
F5 Networks,02/05/2023,F5 Networks Stock Slips On $1 Billion Shape Security Acquisition Despite Deal Synergies,still open
F5 Networks,02/05/2023,F5 Networks Closes $670 Million NGINX Acquisition,still open
F5 Networks,02/05/2023,F5 patches vulnerability that received a CVSS 10 severity score,still open
F5 Networks,02/05/2023,Hackers are trying to steal admin passwords from F5 BIG-IP devices,still open
F5 Networks,02/05/2023,"F5 Networks Acquires Shape Security, for $1 Billion",still open
F5 Networks,02/05/2023,Do organizations need to guard against complacency when it comes ...,still open
F5 Networks,02/05/2023,"F5 Networks, FireEye, IBM Among Global Cybersecurity Market ...",still open
F5 Networks,02/05/2023,NetSPI acquires nVisium. Netskope raises $401 million in ...,still open
F5 Networks,02/05/2023,F5 Networks intros new fraud detection engine based on Shape ...,still open
F5 Networks,02/05/2023,F5 Networks unveils new application security services,still open
F5 Networks,02/05/2023,"Forcepoint Hires F5 Networks, Forescout Vets as New Sales Leaders",still open
F5 Networks,02/05/2023,F5 Networks Closes Seattle HQ Over Coronavirus Fears,still open
F5 Networks,02/05/2023,F5 Networks (FFIV) Surpasses Q1 Earnings Estimates,still open
F5 Networks,02/05/2023,Earnings Preview For F5 Networks - F5 (NASDAQ:FFIV),still open
F5 Networks,02/05/2023,F5 Reports 2% Revenue Growth in its First Quarter of Fiscal Year 2023,still open
F5 Networks,02/05/2023,Earnings Preview: F5 Networks (FFIV) Q1 Earnings Expected to ...,still open
F5 Networks,02/05/2023,Is the Bottom in for Cyber-Security Stocks?,still open
F5 Networks,02/05/2023,Daily Markets: Big Tech Earnings Come Into Focus As Investors Assess Recession Prospects,still open
F5 Networks,02/05/2023,F5: Fiscal Q1 Earnings Snapshot,still open
F5 Networks,02/05/2023,Allspring Global Investments Holdings LLC has purchased shares of ...,still open
F5 Networks,02/05/2023,The Oregon Public Employees Retirement Fund reduces its ...,still open
F5 Networks,02/05/2023,"Enterprise Network Market Size, Share, Growth Statistics By Top Key ...",still open
F5 Networks,02/05/2023,F5 Networks Stock Has Failed To Outperform The S&P Despite Steady Revenue Growth,still open
F5 Networks,02/05/2023,F5 Inc. Stock: $300 Billion Opportunity; Fairly Valued (FFIV),still open
F5 Networks,02/05/2023,Why Has F5 Networks Stock Underperformed The S&P Since 2019?,still open
F5 Networks,02/05/2023,Is The Bottom In For Cybersecurity Stocks?,still open
F5 Networks,02/05/2023,F5 Networks (FFIV) Q4 Earnings and Revenues Top Estimates,still open
F5 Networks,02/05/2023,"Cybersecurity Market Size, Share, Revenue, Trends And Drivers For 2023-2032",still open
F5 Networks,02/05/2023,F5 Networks (FFIV) Stock Gets A $170 Price Target,still open
F5 Networks,02/05/2023,Application Delivery Network (ADN) Market Biggest Innovation with ...,still open
F5 Networks,02/05/2023,F5 Networks delivers strong earnings and its stock rises,still open
F5 Networks,02/05/2023,Cloud Storage Gateways Market Booming Worldwide With Leading ...,still open
F5 Networks,02/05/2023,"F5, Inc. (NASDAQ:FFIV) insiders sold US$2.0m worth of stock last year which shareholders may not want to overlook",still open
F5 Networks,02/05/2023,"F5's (NASDAQ:FFIV) earnings have declined over year, contributing to shareholders 35% loss",still open
F5 Networks,02/05/2023,How the Pandemic Forced F5 to Flex its Software Side,still open
F5 Networks,02/05/2023,Multi-Cloud Security Solutions Market is Expected to Reach US ...,still open
F5 Networks,02/05/2023,F5 Stock: Unfairly Undervalued (NASDAQ:FFIV),still open
F5 Networks,02/05/2023,"Francois Locoh-Donou Sells 2201 Shares of F5, Inc. (NASDAQ:FFIV ...",still open
F5 Networks,02/05/2023,"VoIP Gateways Market Statistical Forecast, Trade Analysis 2022 ...",still open
F5 Networks,02/05/2023,Top Wall Street analysts say buy these stocks amid market uncertainty,still open
F5 Networks,02/05/2023,"Application security market 2022-2026; A descriptive analysis of the five forces model, market dynamics,",still open
F5 Networks,02/05/2023,F5 Networks shares drop on supply chain constraints,still open
F5 Networks,02/05/2023,"Analysts have given F5, Inc. (NASDAQ:FFIV) an average rating of ...",still open
F5 Networks,02/05/2023,Competing Protocols Market Growth and Global Share 2023 [New ...,still open
F5 Networks,02/05/2023,F5 to Report First Quarter Fiscal Year 2023 Financial Results,still open
F5 Networks,02/05/2023,Strength Seen in F5 (FFIV): Can Its 3.2% Jump Turn into More Strength?,still open
F5 Networks,02/05/2023,Online Fitness Course Market to Witness Huge Growth by 2029 ...,still open
F5 Networks,02/05/2023,F5 to Participate in 16th Annual Needham Virtual Security ...,still open
F5 Networks,02/05/2023,F5 Adds Marianne Budnik to Board of Directors,still open
F5 Networks,02/05/2023,F5 Appoints Kara Sprague as Chief Product Officer,still open
F5 Networks,02/05/2023,Home Security Solutions Market Biggest Innovation with Top Key ...,still open
F5 Networks,02/05/2023,"F5 to Participate in Barclays Global Technology, Media ...",still open
F5 Networks,02/05/2023,"F5, Inc. Common Stock (FFIV) Stock Price, Quote, News & History",still open
F5 Networks,02/05/2023,"Dow closes 400 points higher, but snaps four-week win streak on rising rate fears",still open
F5 Networks,02/05/2023,F5 lays off roughly 100 employees across the company - Puget ...,still open
F5 Networks,02/05/2023,Why Is Meta Platforms (META) Up 14.6% Since Last Earnings Report?,still open
F5 Networks,02/05/2023,A10 Networks Stock: Beats Earnings With Strong 5G Tailwinds (ATEN),still open
F5 Networks,02/05/2023,Stock Quote & Details – F5,still open
F5 Networks,02/05/2023,F5 Named Best in Class for Bot Management in Aite-Novarica Matrix ...,still open
F5 Networks,02/05/2023,NetApp shares nudge upward even as Morgan Stanley cuts rating,still open
F5 Networks,02/05/2023,Privacy Compliance and Practices | F5,still open
F5 Networks,02/05/2023,F5 Networks Stock Slips On $1 Billion Shape Security Acquisition Despite Deal Synergies,still open
F5 Networks,02/05/2023,"Daily Markets: Big Tech Earnings, Fed Comments Drive Market Mood",still open
F5 Networks,02/05/2023,NetSPI acquires nVisium. Netskope raises $401 million in ...,still open
F5 Networks,02/05/2023,"Keysight, F5 and AMD Collaborate to Demonstrate 5G Terabit Scale ...",still open
F5 Networks,02/05/2023,Industrial Cybersecurity Market: Meticulous Research® Reveals ...,still open
F5 Networks,02/05/2023,F5 Collaborates with SoftBank Corp. to Offer Advanced Edge ...,still open
F5 Networks,02/05/2023,F5 Enhances Protection for the Apps and APIs Driving Today's ...,still open
F5 Networks,02/05/2023,"Most Shareholders Will Probably Find That The CEO Compensation For F5, Inc. (NASDAQ:FFIV) Is Reasonable",still open
F5 Networks,02/05/2023,How Does F5 Networks Primarily Make Money: Product Sales or Services?,still open
F5 Networks,02/05/2023,Edge Security Market worth $51.1 billion by 2027 - Exclusive Report ...,still open
F5 Networks,02/05/2023,High Severity Vulnerabilities Reported in F5 BIG-IP and BIG-IQ Devices,still open
F5 Networks,02/05/2023,What Elliott may be up to with F5 Networks after past success with tech,still open
F5 Networks,02/05/2023,"FFIV Stock Forecast, Price & News (F5)",still open
F5 Networks,02/05/2023,F5 Networks Reports Inducement Grants under NASDAQ Listing ...,still open
F5 Networks,02/05/2023,Cordless Vacuum Cleaner Sales Market 2023 key developmental ...,still open
F5 Networks,02/05/2023,Threat Actors Exploiting F5 BIG-IP CVE-2022-1388 | CISA,still open
F5 Networks,02/05/2023,Researchers show techniques for malware persistence on F5 and Citrix load balancers,still open
F5 Networks,02/05/2023,Rakuten Symphony and F5 Accelerate Supply Chain Diversity With ...,still open
F5 Networks,02/05/2023,"Mattel (MAT) Beats on Q3 Earnings, Trims 2022 View, Stock Down",still open
F5 Networks,02/05/2023,RMR Group Inc. starts $140M redevelopment of F5 Networks' former ...,still open
F5 Networks,02/05/2023,F5 Networks Inc. stock outperforms competitors on strong trading day,still open
F5 Networks,02/05/2023,Out With The Old — Why Arista Networks Is Crushing Cisco,still open
F5 Networks,02/05/2023,"F5, Inc. (FFIV) Stock Price Today, Quote & News",still open
F5 Networks,02/05/2023,F5 integrates security for multi-cloud app protection.,still open
F5 Networks,02/05/2023,"Fortinet Stock: Fairly Valued, Profitable And Growing Rapidly ...",still open
F5 Networks,02/05/2023,Dow Jones Bear Market: 2 Dividend Stocks That Haven't Been This ...,still open
F5 Networks,02/05/2023,"Even in a Recession, Divergent Stocks Will Prosper",still open
F5 Networks,02/05/2023,"Stocks making the biggest moves midday: Microsoft, Visa, Enphase Energy, Boeing and more",still open
F5 Networks,02/05/2023,Microsoft makes multibillion-dollar investment in OpenAI,still open
F5 Networks,02/05/2023,5 Things to Know About F5 Networks,still open
F5 Networks,02/05/2023,F5 Warns of Critical Bug Allowing Remote Code Execution in BIG-IP ...,still open
F5 Networks,02/05/2023,Cisco stock plunges as company forecasts surprising revenue decline,still open
F5 Networks,02/05/2023,Critical F5 BIG-IP vulnerability exploited to wipe devices,still open
F5 Networks,02/05/2023,"Hedge Funds Have Never Been This Bullish On F5 Networks, Inc. (FFIV)",still open
F5 Networks,02/05/2023,F5 Networks reaches $500 million deal for startup Volterra,still open
F5 Networks,02/05/2023,"F5 Unveils NGINX for Microsoft Azure to Deliver Secure, High ...",still open
F5 Networks,02/05/2023,Elliott Management Takes Stake in Software Company F5 Networks ...,still open
F5 Networks,02/05/2023,Find Bear Market Shelter and Mega Upside With 'Divergence' Stocks,still open
F5 Networks,02/05/2023,Privacy Notice | F5,still open
F5 Networks,02/05/2023,"F5 Stock (NASDAQ:FFIV), Quotes and News Summary",still open
F5 Networks,02/05/2023,2 Tech Stocks to Buy Puts On Right Now,still open
F5 Networks,02/05/2023,"Multi-cloud networking software: Better speed, performance, efficiency",still open
F5 Networks,02/05/2023,"Stocks making the biggest moves midday: GameStop, Costco, Box, Constellation Brands & more",still open
F5 Networks,02/05/2023,Another deal for F5 Networks: $68M acquisition of Threat Stack to ...,still open
F5 Networks,02/05/2023,F5 rebrands in 'significant departure' for the company,still open
F5 Networks,02/05/2023,Multi-cloud networking trends to watch in 2023,still open
F5 Networks,02/05/2023,New High-Severity Vulnerabilities Discovered in Cisco IOx and F5 ...,still open
F5 Networks,02/05/2023,"F5 BIG-IP Vulnerability Can Lead to DoS, Code Execution",still open
F5 Networks,02/05/2023,F5 working to patch BIG-IP API bug,still open
F5 Networks,02/05/2023,F5 Networks (FFIV) Surpasses Q1 Earnings Estimates,still open
F5 Networks,02/05/2023,Earnings Preview For F5 Networks - F5 (NASDAQ:FFIV),still open
F5 Networks,02/05/2023,"F5 Networks' (FFIV) Q1 Earnings Beat, Revenues Miss Estimates",still open
F5 Networks,02/05/2023,F5 Networks Q1 2023 Earnings Preview (NASDAQ:FFIV),still open
F5 Networks,02/05/2023,Cybersecurity in Tourism Market is Booming Worldwide | F5 ...,still open
F5 Networks,02/05/2023,"Enterprise Network Market Size, Share, Growth Statistics By Top Key ...",still open
F5 Networks,02/05/2023,"F5 Finds Visibility Gaps Exacerbate Cyberattacks, Pose Largest ...",still open
F5 Networks,02/05/2023,F5: Fiscal Q1 Earnings Snapshot,still open
F5 Networks,02/05/2023,Using load balancers to automate security and mitigate the network impact,still open
F5 Networks,02/05/2023,Application Delivery Network (ADN) Market Biggest Innovation with ...,still open
F5 Networks,02/05/2023,Cloud Storage Gateways Market Booming Worldwide With Leading ...,still open
F5 Networks,02/05/2023,﻿Transport Layer Security Market Report 2020 Market Biggest ...,still open
F5 Networks,02/05/2023,Multi-Cloud Security Solutions Market is Expected to Reach US ...,still open
F5 Networks,02/05/2023,"Global Web Performance Market Report 2022: Major Players Include Micro Focus, IBM, Akamai Technologies and Dynatrace",still open
F5 Networks,02/05/2023,"Cybersecurity Market Size, Share, Revenue, Trends And Drivers For 2023-2032",still open
F5 Networks,02/05/2023,"Application security market 2022-2026; A descriptive analysis of the five forces model, market dynamics,",still open
F5 Networks,02/05/2023,Daily Markets: Soft Guidance and Tepid Spending Weigh on Stocks,still open
F5 Networks,02/05/2023,"VoIP Gateways Market Statistical Forecast, Trade Analysis 2022 ...",still open
F5 Networks,02/05/2023,"Global Industrial Cybersecurity Market Report to 2030: Featuring Fortinet, Cisco Systems, Juniper Network",still open
F5 Networks,02/05/2023,High Severity Vulnerabilities Reported in F5 BIG-IP and BIG-IQ Devices,still open
F5 Networks,02/05/2023,F5 Networks Stock Has Failed To Outperform The S&P Despite Steady Revenue Growth,still open
F5 Networks,02/05/2023,F5 Networks delivers strong earnings and its stock rises,still open
F5 Networks,02/05/2023,F5 Inc. Stock: $300 Billion Opportunity; Fairly Valued (FFIV),still open
F5 Networks,02/05/2023,F5 Networks (FFIV) Q4 Earnings and Revenues Top Estimates,still open
F5 Networks,02/05/2023,Threat Actors Exploiting F5 BIG-IP CVE-2022-1388 | CISA,still open
F5 Networks,02/05/2023,How the Pandemic Forced F5 to Flex its Software Side,still open
F5 Networks,02/05/2023,Rakuten Symphony and F5 Accelerate Supply Chain Diversity With ...,still open
F5 Networks,02/05/2023,Hybrid Cloud Infrastructure Trends And Startups To Watch,still open
F5 Networks,02/05/2023,Why Has F5 Networks Stock Underperformed The S&P Since 2019?,still open
F5 Networks,02/05/2023,"Hackers exploiting critical F5 BIG-IP bug, public exploits released",still open
F5 Networks,02/05/2023,F5 Networks shares drop on supply chain constraints,still open
F5 Networks,02/05/2023,Rapid7 discloses more F5 BIG-IP vulnerabilities,still open
F5 Networks,02/05/2023,F5 Networks (FFIV) Stock Gets A $170 Price Target,still open
F5 Networks,02/05/2023,Online Fitness Course Market to Witness Huge Growth by 2029 ...,still open
F5 Networks,02/05/2023,Application Management Services (AMS) Market Size & Analysis By ...,still open
F5 Networks,02/05/2023,F5 lays off roughly 100 employees across the company - Puget ...,still open
F5 Networks,02/05/2023,Privacy Compliance and Practices | F5,still open
F5 Networks,02/05/2023,F5 Warns of Critical Bug Allowing Remote Code Execution in BIG-IP ...,still open
F5 Networks,02/05/2023,Home Security Solutions Market Biggest Innovation with Top Key ...,still open
F5 Networks,02/05/2023,Pediatric Software Market 2022 by Keyplayers and Vendors:Meditab ...,still open
F5 Networks,02/05/2023,Oilfield Communications Market – A Comprehensive Study by Key ...,still open
F5 Networks,02/05/2023,F5 Adds Marianne Budnik to Board of Directors,still open
F5 Networks,02/05/2023,F5 to Report First Quarter Fiscal Year 2023 Financial Results,still open
F5 Networks,02/05/2023,F5 to Participate in 16th Annual Needham Virtual Security ...,still open
F5 Networks,02/05/2023,F5 Appoints Kara Sprague as Chief Product Officer,still open
F5 Networks,02/05/2023,F5 combines technology from big acquisitions into new Distributed ...,still open
F5 Networks,02/05/2023,Inside the battle against bad bots: Why F5's CEO believes good ...,still open
F5 Networks,02/05/2023,F5 Named Best in Class for Bot Management in Aite-Novarica Matrix ...,still open
F5 Networks,02/05/2023,RMR Group Inc. starts $140M redevelopment of F5 Networks' former ...,still open
F5 Networks,02/05/2023,"F5 to Participate in Barclays Global Technology, Media ...",still open
F5 Networks,02/05/2023,Applications everywhere: F5 Networks' CEO on the surprising ...,still open
F5 Networks,02/05/2023,F5 Patches Serious Flaws in BIG-IP,still open
F5 Networks,02/05/2023,F5 BIG-IP CNF solutions help customers accelerate and secure 5G ...,still open
F5 Networks,02/05/2023,Researchers show techniques for malware persistence on F5 and Citrix load balancers,still open
F5 Networks,02/05/2023,The value of adaptive applications | F5,still open
F5 Networks,02/05/2023,Privacy Notice | F5,still open
F5 Networks,02/05/2023,F5 Distributed Cloud App Infrastructure Protection detects ...,still open
F5 Networks,02/05/2023,Cordless Vacuum Cleaner Sales Market 2023 key developmental ...,still open
F5 Networks,02/05/2023,F5 Networks Reaches $500 Million Deal for Startup Volterra,still open
F5 Networks,02/05/2023,"Keysight, F5 and AMD Collaborate to Demonstrate 5G Terabit Scale ...",still open
F5 Networks,02/05/2023,Another deal for F5 Networks: $68M acquisition of Threat Stack to ...,still open
F5 Networks,02/05/2023,"F5 refreshes brand by dropping 'Networks' from name, marking ...",still open
F5 Networks,02/05/2023,The new edge will transform the computing experience,still open
F5 Networks,02/05/2023,"F5, Inc. (NASDAQ:FFIV) insiders sold US$2.0m worth of stock last year which shareholders may not want to overlook",still open
F5 Networks,02/05/2023,F5 Stock: Unfairly Undervalued (NASDAQ:FFIV),still open
