Name,Data,News,Evaluation
F5 Networks,02/09/2023,F5 to Participate in 16th Annual Needham Virtual Security ...,still open
F5 Networks,02/09/2023,F5 Appoints Kara Sprague as Chief Product Officer,still open
F5 Networks,02/09/2023,"Retail Operations Software Market Upcoming Trends, Segmented by ...",still open
F5 Networks,02/09/2023,"Nutanix, Pure Storage, F5 Networks and Palo Alto Best Positioned ...",still open
F5 Networks,02/09/2023,F5 Named Best in Class for Bot Management in Aite-Novarica Matrix ...,still open
F5 Networks,02/09/2023,Inside the battle against bad bots: Why F5's CEO believes good ...,still open
F5 Networks,02/09/2023,"F5 to Participate in Barclays Global Technology, Media ...",still open
F5 Networks,02/09/2023,Wall Street Analysts Think F5 (FFIV) Could Surge 32%: Read This Before Placing a Bet,still open
F5 Networks,02/09/2023,RMR Group Inc. starts $140M redevelopment of F5 Networks' former ...,still open
F5 Networks,02/09/2023,Network Engineer at Technimove Limited,still open
F5 Networks,02/09/2023,The value of adaptive applications | F5,still open
F5 Networks,02/09/2023,Applications everywhere: F5 Networks' CEO on the surprising ...,still open
F5 Networks,02/09/2023,Researchers show techniques for malware persistence on F5 and Citrix load balancers,still open
F5 Networks,02/09/2023,F5 Patches Serious Flaws in BIG-IP,still open
F5 Networks,02/09/2023,Online Fitness Course Market to Witness Huge Growth by 2029 ...,still open
F5 Networks,02/09/2023,F5 BIG-IP CNF solutions help customers accelerate and secure 5G ...,still open
F5 Networks,02/09/2023,Privacy Notice | F5,still open
F5 Networks,02/09/2023,F5 Distributed Cloud App Infrastructure Protection detects ...,still open
F5 Networks,02/09/2023,F5 integrates security for multi-cloud app protection.,still open
F5 Networks,02/09/2023,Aircraft MRO Market 2022 Segments Analysis by Top Key Players ...,still open
F5 Networks,02/09/2023,Oilfield Communications Market – A Comprehensive Study by Key ...,still open
F5 Networks,02/09/2023,Home Security Solutions Market Biggest Innovation with Top Key ...,still open
F5 Networks,02/09/2023,Transit Ticketing Market to Witness Huge Growth by 2029 -Rambus ...,still open
F5 Networks,02/09/2023,Pediatric Software Market 2022 by Keyplayers and Vendors:Meditab ...,still open
F5 Networks,02/09/2023,Stock Quote & Details – F5,still open
F5 Networks,02/09/2023,"Keysight, F5 and AMD Collaborate to Demonstrate 5G Terabit Scale ...",still open
F5 Networks,02/09/2023,Another deal for F5 Networks: $68M acquisition of Threat Stack to ...,still open
F5 Networks,02/09/2023,AdFest announces new speaker sessions for their March 23-25 ...,still open
F5 Networks,02/09/2023,Automotive Tire Carrier Market Research Report 2023 - Omix-ADA ...,still open
F5 Networks,02/09/2023,"F5 refreshes brand by dropping 'Networks' from name, marking ...",still open
F5 Networks,02/09/2023,What Elliott may be up to with F5 Networks after past success with tech,still open
F5 Networks,02/09/2023,F5 Stock: Unfairly Undervalued (NASDAQ:FFIV),still open
F5 Networks,02/09/2023,"F5, Inc. (NASDAQ:FFIV) insiders sold US$2.0m worth of stock last year which shareholders may not want to overlook",still open
F5 Networks,02/09/2023,F5 Ups Its Container and Open Source Game With $670M Nginx Deal,still open
F5 Networks,02/09/2023,How Does F5 Networks Primarily Make Money: Product Sales or Services?,still open
F5 Networks,02/09/2023,F5 partners with Microsoft for Azure application delivery,still open
F5 Networks,02/09/2023,"Global Data Center Equipment Market by Component, By Deployment, Enterprise Size, Industry Vertical, By End Us",still open
F5 Networks,02/09/2023,F5 Networks Planning Open Source Projects Beyond NGINX,still open
F5 Networks,02/09/2023,"F5 Unveils NGINX for Microsoft Azure to Deliver Secure, High ...",still open
F5 Networks,02/09/2023,F5's Cloud Native Network Functions Saturate Rakuten Symphony,still open
F5 Networks,02/09/2023,F5 Networks Reports Inducement Grants under NASDAQ Listing ...,still open
F5 Networks,02/09/2023,F5 to Report First Quarter Fiscal Year 2023 Financial Results,still open
F5 Networks,02/09/2023,F5 Networks' acquisition of Volterra signals the rise of distributed ...,still open
F5 Networks,02/09/2023,F5 Collaborates with SoftBank Corp. to Offer Advanced Edge ...,still open
F5 Networks,02/09/2023,Wellington Management Group Llp Cuts Stake in F5 Networks (FFIV),still open
F5 Networks,02/09/2023,Earnings Preview: F5 Networks (FFIV) Q1 Earnings Expected to ...,still open
F5 Networks,02/09/2023,Validea Daily Guru Fundamental Report for FFIV - 2/9/2023,still open
F5 Networks,02/09/2023,Earnings Preview For F5 Networks - F5 (NASDAQ:FFIV),still open
F5 Networks,02/09/2023,Is the Bottom in for Cyber-Security Stocks?,still open
F5 Networks,02/09/2023,Daily Markets: Big Tech Earnings Come Into Focus As Investors Assess Recession Prospects,still open
F5 Networks,02/09/2023,F5: Fiscal Q1 Earnings Snapshot,still open
F5 Networks,02/09/2023,Allspring Global Investments Holdings LLC has purchased shares of ...,still open
F5 Networks,02/09/2023,The Oregon Public Employees Retirement Fund reduces its ...,still open
F5 Networks,02/09/2023,"F5, INC. Management's Discussion and Analysis of Financial Condition and Results of Operations (form 10-Q)",still open
F5 Networks,02/09/2023,JFrog Earnings: What To Look For From FROG,still open
F5 Networks,02/09/2023,Application Delivery Networks AND Market Research Report 2023 ...,still open
F5 Networks,02/09/2023,F5 Networks Stock Has Failed To Outperform The S&P Despite Steady Revenue Growth,still open
F5 Networks,02/09/2023,Surprising Analyst 12-Month Target For LTL,still open
F5 Networks,02/09/2023,F5 Inc. Stock: $300 Billion Opportunity; Fairly Valued (FFIV),still open
F5 Networks,02/09/2023,Why Has F5 Networks Stock Underperformed The S&P Since 2019?,still open
F5 Networks,02/09/2023,"Load Balancer Market Share Analysis, SWOT, Size, Chain Analysis ...",still open
F5 Networks,02/09/2023,EPLUS INC MANAGEMENT'S DISCUSSION AND ANALYSIS OF FINANCIAL CONDITION AND RESULTS OF OPERATIONS (form 10-Q),still open
F5 Networks,02/09/2023,"F5 Networks Non-GAAP EPS of $2.62 beats by $0.10, revenue of ...",still open
F5 Networks,02/09/2023,Network Support & Security Market to Witness Robust Expansion by ...,still open
F5 Networks,02/09/2023,Is The Bottom In For Cybersecurity Stocks?,still open
F5 Networks,02/09/2023,"Enterprise Network Market Size, Share, Growth Statistics By Top Key ...",still open
F5 Networks,02/09/2023,F5 Networks (FFIV) Stock Gets A $170 Price Target,still open
F5 Networks,02/09/2023,Network Encryption System Market is expected to Exhibit a Massive ...,still open
F5 Networks,02/09/2023,Programmable Network Market 2023 by Keyplayers and Vendors:F5 ...,still open
F5 Networks,02/09/2023,F5 Networks delivers strong earnings and its stock rises,still open
F5 Networks,02/09/2023,Firewall As A Service (Fwaas) Market 2022 Segments Analysis by ...,still open
F5 Networks,02/09/2023,Remote Access Software Tools Market to Witness Huge Growth by ...,still open
F5 Networks,02/09/2023,"F5, Inc. (NASDAQ:FFIV) insiders sold US$2.0m worth of stock last year which shareholders may not want to overlook",still open
F5 Networks,02/09/2023,Stock Quote & Details – F5,still open
F5 Networks,02/09/2023,Plurilock Security (PLUR.V) real AI cybersecurity play set for a ...,still open
F5 Networks,02/09/2023,Key Management Service Market is Predicted to Reach US$ 6367 ...,still open
F5 Networks,02/09/2023,DDoS Protection Market Size and Competitive Analysis 2023 by ...,still open
F5 Networks,02/09/2023,F5 Stock: Unfairly Undervalued (NASDAQ:FFIV),still open
F5 Networks,02/09/2023,DNS Security Software Market Analysis 2023 With Technical ...,still open
F5 Networks,02/09/2023,How the Pandemic Forced F5 to Flex its Software Side,still open
F5 Networks,02/09/2023,Application Delivery Network (ADN) Market Biggest Innovation with ...,still open
F5 Networks,02/09/2023,"Global Managed Security Services Market Size worth $49.6 billion by 2027, growing at a CAGR of 12.3%: Report by MarketsandMarkets™",still open
F5 Networks,02/09/2023,Wall Street Analysts Think F5 (FFIV) Could Surge 32%: Read This Before Placing a Bet,still open
F5 Networks,02/09/2023,"Francois Locoh-Donou Sells 2201 Shares of F5, Inc. (NASDAQ:FFIV ...",still open
F5 Networks,02/09/2023,Cloud Storage Gateways Market Booming Worldwide With Leading ...,still open
F5 Networks,02/09/2023,"Multi-Cloud Networking Market to Reach $19.9 Billion, Globally, by ...",still open
F5 Networks,02/09/2023,Top Wall Street analysts say buy these stocks amid market uncertainty,still open
F5 Networks,02/09/2023,"Nutanix, Pure Storage, F5 Networks and Palo Alto Best Positioned ...",still open
F5 Networks,02/09/2023,F5 Networks shares drop on supply chain constraints,still open
F5 Networks,02/09/2023,Distributed Denial of Service (DDoS) Protection Market scrutinized ...,still open
F5 Networks,02/09/2023,"SSL VPN Products Market 2023, Company Overview, Product and ...",still open
F5 Networks,02/09/2023,Strength Seen in F5 (FFIV): Can Its 3.2% Jump Turn into More Strength?,still open
F5 Networks,02/09/2023,F5 Networks' stock plunges as it warns of supply chain constraints ...,still open
F5 Networks,02/09/2023,"Rotary Telehandler Market Research Report 2023 - JLG, JCB ...",still open
F5 Networks,02/09/2023,F5 to Participate in 16th Annual Needham Virtual Security ...,still open
F5 Networks,02/09/2023,"[Latest Report] Global Online Fraud Detection Market Leading Industry, Upcoming Opportunities, And Forecast To",still open
F5 Networks,02/09/2023,F5 Adds Marianne Budnik to Board of Directors,still open
F5 Networks,02/09/2023,F5 Appoints Kara Sprague as Chief Product Officer,still open
F5 Networks,02/09/2023,F5 to Report First Quarter Fiscal Year 2023 Financial Results,still open
F5 Networks,02/09/2023,"F5 to Participate in Barclays Global Technology, Media ...",still open
F5 Networks,02/09/2023,"F5, Inc. Common Stock (FFIV) Stock Price, Quote, News & History",still open
F5 Networks,02/09/2023,"Dow closes 400 points higher, but snaps four-week win streak on rising rate fears",still open
F5 Networks,02/09/2023,"Daily Markets: Big Tech Earnings, Fed Comments Drive Market Mood",still open
F5 Networks,02/09/2023,Hennessey's 708-Hp Supercharged 'H700' Corvette C8,still open
F5 Networks,02/09/2023,A10 Networks Stock: Beats Earnings With Strong 5G Tailwinds (ATEN),still open
F5 Networks,02/09/2023,NetApp shares nudge upward even as Morgan Stanley cuts rating,still open
F5 Networks,02/09/2023,F5 lays off roughly 100 employees across the company - Puget ...,still open
F5 Networks,02/09/2023,F5 Named Best in Class for Bot Management in Aite-Novarica Matrix ...,still open
F5 Networks,02/09/2023,Privacy Compliance and Practices | F5,still open
F5 Networks,02/09/2023,F5 Networks Stock Slips On $1 Billion Shape Security Acquisition Despite Deal Synergies,still open
F5 Networks,02/09/2023,Aircraft MRO Market 2022 Segments Analysis by Top Key Players ...,still open
F5 Networks,02/09/2023,F5 Networks Reports Inducement Grants under NASDAQ Listing ...,still open
F5 Networks,02/09/2023,F5 Collaborates with SoftBank Corp. to Offer Advanced Edge ...,still open
F5 Networks,02/09/2023,F5 Enhances Protection for the Apps and APIs Driving Today's ...,still open
F5 Networks,02/09/2023,"Most Shareholders Will Probably Find That The CEO Compensation For F5, Inc. (NASDAQ:FFIV) Is Reasonable",still open
F5 Networks,02/09/2023,High Severity Vulnerabilities Reported in F5 BIG-IP and BIG-IQ Devices,still open
F5 Networks,02/09/2023,What Elliott may be up to with F5 Networks after past success with tech,still open
F5 Networks,02/09/2023,Fortinet vs F5. Inc.: The Best Cybersecurity Stock to Invest in 2022,still open
F5 Networks,02/09/2023,How Does F5 Networks Primarily Make Money: Product Sales or Services?,still open
F5 Networks,02/09/2023,Threat Actors Exploiting F5 BIG-IP CVE-2022-1388 | CISA,still open
F5 Networks,02/09/2023,Why Is Meta Platforms (META) Up 14.6% Since Last Earnings Report?,still open
F5 Networks,02/09/2023,Researchers show techniques for malware persistence on F5 and Citrix load balancers,still open
F5 Networks,02/09/2023,"Global Data Center Equipment Market by Component, By Deployment, Enterprise Size, Industry Vertical, By End Us",still open
F5 Networks,02/09/2023,Rakuten Symphony and F5 Accelerate Supply Chain Diversity With ...,still open
F5 Networks,02/09/2023,"F5 Networks Inc. stock falls Tuesday, underperforms market",still open
F5 Networks,02/09/2023,"Mattel (MAT) Beats on Q3 Earnings, Trims 2022 View, Stock Down",still open
F5 Networks,02/09/2023,"Fortinet Stock: Fairly Valued, Profitable And Growing Rapidly ...",still open
F5 Networks,02/09/2023,RMR Group Inc. starts $140M redevelopment of F5 Networks' former ...,still open
F5 Networks,02/09/2023,Dow Jones Bear Market: 2 Dividend Stocks That Haven't Been This ...,still open
F5 Networks,02/09/2023,"Even in a Recession, Divergent Stocks Will Prosper",still open
F5 Networks,02/09/2023,"Stocks making the biggest moves midday: Microsoft, Visa, Enphase Energy, Boeing and more",still open
F5 Networks,02/09/2023,Rapid7 discloses more F5 BIG-IP vulnerabilities,still open
F5 Networks,02/09/2023,Out With The Old — Why Arista Networks Is Crushing Cisco,still open
F5 Networks,02/09/2023,F5 integrates security for multi-cloud app protection.,still open
F5 Networks,02/09/2023,5 Things to Know About F5 Networks,still open
F5 Networks,02/09/2023,Cisco stock plunges as company forecasts surprising revenue decline,still open
F5 Networks,02/09/2023,F5 Warns of Critical Bug Allowing Remote Code Execution in BIG-IP ...,still open
F5 Networks,02/09/2023,F5 Earns Top Marks in KuppingerCole’s 2022 Leadership Compass Report for Web Application Firewalls,still open
F5 Networks,02/09/2023,Web Page Performance Testing Tools Market to reach Huge Growth and Tremendous Demand in Next Coming years by 2,still open
F5 Networks,02/09/2023,"F5's (NASDAQ:FFIV) earnings have declined over year, contributing to shareholders 35% loss",still open
F5 Networks,02/09/2023,Critical F5 BIG-IP vulnerability exploited to wipe devices,still open
F5 Networks,02/10/2023,Wellington Management Group Llp Cuts Stake in F5 Networks (FFIV),still open
F5 Networks,02/10/2023,New High-Severity Vulnerabilities Discovered in Cisco IOx and F5 ...,still open
F5 Networks,02/10/2023,F5 Networks (FFIV) Surpasses Q1 Earnings Estimates,still open
F5 Networks,02/10/2023,Earnings Preview: F5 Networks (FFIV) Q1 Earnings Expected to ...,still open
F5 Networks,02/10/2023,The Bottom Is In For Cloudflare Stock,still open
F5 Networks,02/10/2023,DDI Market Prime Economies Expected to Deliver Major Growth until ...,still open
F5 Networks,02/10/2023,Application Delivery Networks AND Market Research Report 2023 ...,still open
F5 Networks,02/10/2023,Common Kubernetes challenges and how to overcome them,still open
F5 Networks,02/10/2023,Validea Daily Guru Fundamental Report for FFIV - 2/9/2023,still open
F5 Networks,02/10/2023,F5: Fiscal Q1 Earnings Snapshot,still open
F5 Networks,02/10/2023,Distributed Denial-of-Service (DDoS) Attack Solution Market 2023 ...,still open
F5 Networks,02/10/2023,"F5 Finds Visibility Gaps Exacerbate Cyberattacks, Pose Largest ...",still open
F5 Networks,02/10/2023,5 Top Web Application Firewall (WAF) Trends in 2023,still open
F5 Networks,02/10/2023,Programmable Network Market 2023 by Keyplayers and Vendors:F5 ...,still open
F5 Networks,02/10/2023,"Cybersecurity in Tourism Market to See Huge Growth by 2028 | F5 Networks, FireEye, Fortinet",still open
F5 Networks,02/10/2023,JFrog Earnings: What To Look For From FROG,still open
F5 Networks,02/10/2023,"Cyber Security Market Drivers Shaping Future Growth, Revenue USD 478.68 Billion by 2030 | CAGR 9.5%",still open
F5 Networks,02/10/2023,Remote Access Software Tools Market to Witness Huge Growth by ...,still open
F5 Networks,02/10/2023,Key Management Service Market is Predicted to Reach US$ 6367 ...,still open
F5 Networks,02/10/2023,How to fix recent SQL injection vulnerabilities and avoid future attacks,still open
F5 Networks,02/10/2023,"SSL VPN Market Insights-Industry changing aspects, New ...",still open
F5 Networks,02/10/2023,Network Support & Security Market to Witness Robust Expansion by ...,still open
F5 Networks,02/10/2023,"5G Security Market Upcoming Trends, Segmented by Type ...",still open
F5 Networks,02/10/2023,Cloud Storage Gateways Market Booming Worldwide With Leading ...,still open
F5 Networks,02/10/2023,"Deserialized web security roundup: KeePass dismisses ‘vulnerability’ report, OpenSSL gets patched, and Reddit admits phishing hack",still open
F5 Networks,02/10/2023,"WAN Optimization Solutions Market Size, Development Data ...",still open
F5 Networks,02/10/2023,High Severity Vulnerabilities Reported in F5 BIG-IP and BIG-IQ Devices,still open
F5 Networks,02/10/2023,Network Encryption System Market is expected to Exhibit a Massive ...,still open
F5 Networks,02/10/2023,F5 Networks Stock Has Failed To Outperform The S&P Despite Steady Revenue Growth,still open
F5 Networks,02/10/2023,F5 Inc. Stock: $300 Billion Opportunity; Fairly Valued (FFIV),still open
F5 Networks,02/10/2023,F5 Networks delivers strong earnings and its stock rises,still open
F5 Networks,02/10/2023,F5 Networks (FFIV) Q4 Earnings and Revenues Top Estimates,still open
F5 Networks,02/10/2023,Threat Actors Exploiting F5 BIG-IP CVE-2022-1388 | CISA,still open
F5 Networks,02/10/2023,DNS Security Software Market Analysis 2023 With Technical ...,still open
F5 Networks,02/10/2023,How the Pandemic Forced F5 to Flex its Software Side,still open
F5 Networks,02/10/2023,EPLUS INC MANAGEMENT'S DISCUSSION AND ANALYSIS OF FINANCIAL CONDITION AND RESULTS OF OPERATIONS (form 10-Q),still open
F5 Networks,02/10/2023,Rakuten Symphony and F5 Accelerate Supply Chain Diversity With ...,still open
F5 Networks,02/10/2023,Web Application Firewall (WAF) Market Share 2023: Qualitative ...,still open
F5 Networks,02/10/2023,Why Has F5 Networks Stock Underperformed The S&P Since 2019?,still open
F5 Networks,02/10/2023,F5 Networks (FFIV) Stock Gets A $170 Price Target,still open
F5 Networks,02/10/2023,F5 Networks shares drop on supply chain constraints,still open
F5 Networks,02/10/2023,"F5 fixes high severity RCE bug in BIG-IP, BIG-IQ devices",still open
F5 Networks,02/10/2023,Critical F5 BIG-IP vulnerability exploited to wipe devices,still open
F5 Networks,02/10/2023,Privacy Compliance and Practices | F5,still open
F5 Networks,02/10/2023,F5 lays off roughly 100 employees across the company - Puget ...,still open
F5 Networks,02/10/2023,F5 Warns of Critical Bug Allowing Remote Code Execution in BIG-IP ...,still open
F5 Networks,02/10/2023,F5 Adds Marianne Budnik to Board of Directors,still open
F5 Networks,02/10/2023,Hybrid Cloud Infrastructure Trends And Startups To Watch,still open
F5 Networks,02/10/2023,F5 to Participate in 16th Annual Needham Virtual Security ...,still open
F5 Networks,02/10/2023,F5 Appoints Kara Sprague as Chief Product Officer,still open
F5 Networks,02/10/2023,Surprising Analyst 12-Month Target For LTL,still open
F5 Networks,02/10/2023,F5 Named Best in Class for Bot Management in Aite-Novarica Matrix ...,still open
F5 Networks,02/10/2023,Inside the battle against bad bots: Why F5's CEO believes good ...,still open
F5 Networks,02/10/2023,"F5 to Participate in Barclays Global Technology, Media ...",still open
F5 Networks,02/10/2023,Experts hail digital economy opportunity,still open
F5 Networks,02/10/2023,Wall Street Analysts Think F5 (FFIV) Could Surge 32%: Read This Before Placing a Bet,still open
F5 Networks,02/10/2023,Applications everywhere: F5 Networks' CEO on the surprising ...,still open
F5 Networks,02/10/2023,RMR Group Inc. starts $140M redevelopment of F5 Networks' former ...,still open
F5 Networks,02/10/2023,The value of adaptive applications | F5,still open
F5 Networks,02/10/2023,F5 Patches Serious Flaws in BIG-IP,still open
F5 Networks,02/10/2023,"Multi-Cloud Networking Market to Reach $19.9 Billion, Globally, by ...",still open
F5 Networks,02/10/2023,Researchers show techniques for malware persistence on F5 and Citrix load balancers,still open
F5 Networks,02/10/2023,F5 BIG-IP CNF solutions help customers accelerate and secure 5G ...,still open
F5 Networks,02/10/2023,"Retail Operations Software Market Upcoming Trends, Segmented by ...",still open
F5 Networks,02/10/2023,Dozen High-Severity Vulnerabilities Patched in F5 Products,still open
F5 Networks,02/10/2023,Privacy Notice | F5,still open
F5 Networks,02/10/2023,F5 Distributed Cloud App Infrastructure Protection detects ...,still open
F5 Networks,02/10/2023,F5 integrates security for multi-cloud app protection.,still open
F5 Networks,02/10/2023,"Keysight, F5 and AMD Collaborate to Demonstrate 5G Terabit Scale ...",still open
F5 Networks,02/10/2023,"Nutanix, Pure Storage, F5 Networks and Palo Alto Best Positioned ...",still open
F5 Networks,02/10/2023,Network Engineer at Technimove Limited,still open
F5 Networks,02/10/2023,F5 Networks' stock plunges as it warns of supply chain constraints ...,still open
F5 Networks,02/10/2023,Stock Quote & Details – F5,still open
F5 Networks,02/10/2023,Another deal for F5 Networks: $68M acquisition of Threat Stack to ...,still open
F5 Networks,02/10/2023,Aircraft MRO Market 2022 Segments Analysis by Top Key Players ...,still open
F5 Networks,02/10/2023,"F5 refreshes brand by dropping 'Networks' from name, marking ...",still open
F5 Networks,02/10/2023,Global Managed Security Services Market Size worth $49.6 billion ...,still open
F5 Networks,02/10/2023,What Elliott may be up to with F5 Networks after past success with tech,still open
F5 Networks,02/10/2023,Automotive Tire Carrier Market Research Report 2023 - Omix-ADA ...,still open
F5 Networks,02/10/2023,"F5, Inc. (NASDAQ:FFIV) insiders sold US$2.0m worth of stock last year which shareholders may not want to overlook",still open
F5 Networks,02/10/2023,F5 Stock: Unfairly Undervalued (NASDAQ:FFIV),still open
F5 Networks,02/10/2023,F5 Ups Its Container and Open Source Game With $670M Nginx Deal,still open
F5 Networks,02/10/2023,How Does F5 Networks Primarily Make Money: Product Sales or Services?,still open
F5 Networks,02/10/2023,AdFest announces new speaker sessions for their March 23-25 ...,still open
F5 Networks,02/10/2023,F5 Networks Planning Open Source Projects Beyond NGINX,still open
F5 Networks,02/10/2023,"F5 Unveils NGINX for Microsoft Azure to Deliver Secure, High ...",still open
F5 Networks,02/10/2023,F5 partners with Microsoft for Azure application delivery,still open
F5 Networks,02/10/2023,F5's Cloud Native Network Functions Saturate Rakuten Symphony,still open
F5 Networks,02/10/2023,F5 Networks Reports Inducement Grants under NASDAQ Listing ...,still open
F5 Networks,02/10/2023,F5 to Report First Quarter Fiscal Year 2023 Financial Results,still open
F5 Networks,02/10/2023,F5 Networks' acquisition of Volterra signals the rise of distributed ...,still open
F5 Networks,02/10/2023,"Global Data Center Equipment Market by Component, By Deployment, Enterprise Size, Industry Vertical, By End Us",still open
F5 Networks,02/10/2023,F5 Collaborates with SoftBank Corp. to Offer Advanced Edge ...,still open
F5 Networks,02/10/2023,CISA issues warning about vulnerabilities in VMware and F5 products,still open
F5 Networks,02/10/2023,Elliott Management Takes Stake in Software Company F5 Networks ...,still open
F5 Networks,02/10/2023,F5 rebrands in 'significant departure' for the company,still open
F5 Networks,02/10/2023,"Francois Locoh-Donou Sells 2201 Shares of F5, Inc. (NASDAQ:FFIV ...",still open
F5 Networks,02/10/2023,Seattle U students tackle real-world computer and engineering ...,still open
F5 Networks,02/10/2023,Strength Seen in F5 (FFIV): Can Its 3.2% Jump Turn into More Strength?,still open
F5 Networks,02/10/2023,The Bottom Is In For Cloudflare Stock,still open
F5 Networks,02/10/2023,Wellington Management Group Llp Cuts Stake in F5 Networks (FFIV),still open
F5 Networks,02/10/2023,F5 Networks (FFIV) Surpasses Q1 Earnings Estimates,still open
F5 Networks,02/10/2023,Earnings Preview: F5 Networks (FFIV) Q1 Earnings Expected to ...,still open
F5 Networks,02/10/2023,Validea Daily Guru Fundamental Report for FFIV - 2/9/2023,still open
F5 Networks,02/10/2023,Is the Bottom in for Cyber-Security Stocks?,still open
F5 Networks,02/10/2023,Daily Markets: Big Tech Earnings Come Into Focus As Investors Assess Recession Prospects,still open
F5 Networks,02/10/2023,F5: Fiscal Q1 Earnings Snapshot,still open
F5 Networks,02/10/2023,Allspring Global Investments Holdings LLC has purchased shares of ...,still open
F5 Networks,02/10/2023,The Oregon Public Employees Retirement Fund reduces its ...,still open
F5 Networks,02/10/2023,F5 Networks Stock Has Failed To Outperform The S&P Despite Steady Revenue Growth,still open
F5 Networks,02/10/2023,JFrog Earnings: What To Look For From FROG,still open
F5 Networks,02/10/2023,F5 Inc. Stock: $300 Billion Opportunity; Fairly Valued (FFIV),still open
F5 Networks,02/10/2023,Surprising Analyst 12-Month Target For LTL,still open
F5 Networks,02/10/2023,Distributed Denial-of-Service (DDoS) Attack Solution Market 2023 ...,still open
F5 Networks,02/10/2023,Why Has F5 Networks Stock Underperformed The S&P Since 2019?,still open
F5 Networks,02/10/2023,"Load Balancer Market Share Analysis, SWOT, Size, Chain Analysis ...",still open
F5 Networks,02/10/2023,EPLUS INC MANAGEMENT'S DISCUSSION AND ANALYSIS OF FINANCIAL CONDITION AND RESULTS OF OPERATIONS (form 10-Q),still open
