Name,Data,News,Evaluation
Sigma-Aldrich,02/10/2023,Fast DNA-PAINT imaging using a deep neural network,still open
Sigma-Aldrich,02/10/2023,The endocannabinoid anandamide is an airway relaxant in health ...,still open
Sigma-Aldrich,02/10/2023,Analysis of hyperforin (St. John's wort) action at TRPC6 channel ...,still open
Sigma-Aldrich,02/10/2023,A lab-on-a-chip for the concurrent electrochemical detection of ...,still open
Sigma-Aldrich,02/10/2023,16 Ethical Dividend Stocks to Invest in Today,still open
Sigma-Aldrich,02/10/2023,Molecular data storage with zero synthetic effort and simple read-out ...,still open
Sigma-Aldrich,02/10/2023,β subunits of GABAA receptors form proton-gated chloride channels ...,still open
Sigma-Aldrich,02/10/2023,CRISPR activation screen identifies TGFβ-associated PEG10 as a ...,still open
Sigma-Aldrich,02/10/2023,Transplanting rejuvenated blood stem cells extends lifespan of aged ...,still open
Sigma-Aldrich,02/10/2023,DNA repair during nonreductional meiosis in the asexual rotifer ...,still open
Sigma-Aldrich,02/10/2023,The membrane-active polyaminoisoprenyl compound NV716 re ...,still open
Sigma-Aldrich,02/10/2023,A comprehensive update to the Mycobacterium tuberculosis H37Rv ...,still open
Sigma-Aldrich,02/10/2023,"Emerson sells part of business, says it would consider leaving St ...",still open
Sigma-Aldrich,02/10/2023,Guiding cell migration in 3D with high-resolution photografting ...,still open
Sigma-Aldrich,02/10/2023,Rapid antibiotic susceptibility testing and species identification for ...,still open
Sigma-Aldrich,02/10/2023,Ferritin-mediated iron detoxification promotes hypothermia survival ...,still open
Sigma-Aldrich,02/10/2023,Mitochondrial RNA modifications shape metabolic plasticity in ...,still open
Sigma-Aldrich,02/10/2023,A statistical framework for high-content phenotypic profiling using ...,still open
Sigma-Aldrich,02/10/2023,A gut-derived hormone suppresses sugar appetite and regulates ...,still open
Sigma-Aldrich,02/10/2023,Understanding soil selenium accumulation and bioavailability ...,still open
Sigma-Aldrich,02/10/2023,PI3K drives the de novo synthesis of coenzyme A from vitamin B5,still open
Sigma-Aldrich,02/10/2023,Compensatory epistasis maintains ACE2 affinity in SARS-CoV-2 ...,still open
Sigma-Aldrich,02/10/2023,Omicron BA.4/BA.5 escape neutralizing immunity elicited by BA.1 ...,still open
Sigma-Aldrich,02/10/2023,Amoebicidal activity of cationic carbosilane dendrons derived with 4 ...,still open
Sigma-Aldrich,02/10/2023,Mechanism for selective binding of aromatic compounds on oxygen ...,still open
Sigma-Aldrich,02/10/2023,Candida albicans evades NK cell elimination via binding of ...,still open
Sigma-Aldrich,02/10/2023,Biofortified tomatoes provide a new route to vitamin D sufficiency,still open
Sigma-Aldrich,02/10/2023,Serotonin limits generation of chromaffin cells during adrenal organ ...,still open
Sigma-Aldrich,02/10/2023,Exosomes decorated with a recombinant SARS-CoV-2 receptor ...,still open
Sigma-Aldrich,02/10/2023,Endocytosis-like DNA uptake by cell wall-deficient bacteria,still open
Sigma-Aldrich,02/10/2023,MilliporeSigma Announces a Boost in Commercial Capacity in ...,still open
Sigma-Aldrich,02/10/2023,Assessment of the biofilm-forming ability on solid surfaces of ...,still open
Sigma-Aldrich,02/10/2023,Molecularly cleavable bioinks facilitate high-performance digital light ...,still open
Sigma-Aldrich,02/10/2023,Synthesis of natural product hybrids by the Ugi reaction in complex ...,still open
Sigma-Aldrich,02/10/2023,Receptor for advanced glycation end-products (RAGE) mediates ...,still open
Sigma-Aldrich,02/10/2023,Overexpression of the NEK9–EG5 axis is a novel metastatic marker ...,still open
Sigma-Aldrich,02/10/2023,Antimicrobial properties of chitosan from different developmental ...,still open
Sigma-Aldrich,02/10/2023,Design of combination therapy for engineered bacterial therapeutics ...,still open
Sigma-Aldrich,02/10/2023,Enhanced metanephric specification to functional proximal tubule ...,still open
Sigma-Aldrich,02/10/2023,Red Blood Cell Lysis Buffer Market Size And Forecast -Sigma ...,still open
Sigma-Aldrich,02/10/2023,"Phycoerythrin Market Size, Share, Growth Statistics By Top Key ...",still open
Sigma-Aldrich,02/10/2023,"Gold Nanoparticles Market Size, Share, Growth Statistics By Top ...",still open
Sigma-Aldrich,02/10/2023,Immunoassay Instruments Market to Accelerate Growth with ...,still open
Sigma-Aldrich,02/10/2023,Cell Line Development Market Future Business Opportunities 2023 ...,still open
Sigma-Aldrich,02/10/2023,The injections of mitochondrial fusion promoter M1 during proestrus ...,still open
Sigma-Aldrich,02/10/2023,Tissue Diagnostic Market See Incredible Growth 2023-2028 ...,still open
Sigma-Aldrich,02/10/2023,Ferric Fluoride Market Booming Worldwide With Leading Key ...,still open
Sigma-Aldrich,02/10/2023,Analytical Testing of Nitrosamines in Drugs and Food,still open
Sigma-Aldrich,02/10/2023,Top Stories of 2022: #5 to #7 | McDonnell Boehnen Hulbert ...,still open
Sigma-Aldrich,02/10/2023,Caspase Activity Assay Kit Market - 37% of Growth to Originate from ...,still open
Sigma-Aldrich,02/10/2023,Assessing small molecule kinetics and affinity through SPR screening,still open
Sigma-Aldrich,02/10/2023,HP (High Potency) APIs Global Market Report 2023,still open
Sigma-Aldrich,02/10/2023,Hydrophilic Interaction Columns Market Size And Forecast -Sigma ...,still open
Sigma-Aldrich,02/10/2023,Sodium Chlorite Market Major Leading Players Status and Forecast ...,still open
Sigma-Aldrich,02/10/2023,Water-in-salt electrolytes made saltier by Gemini ionic liquids for ...,still open
Sigma-Aldrich,02/10/2023,Global Chromatography Reagent Market Report Covers Future ...,still open
Sigma-Aldrich,02/10/2023,"Automated Cell Cultures Market 2023 with Strong Focus on Business Size, Industry Highlights, Segments, Growth",still open
Sigma-Aldrich,02/10/2023,Viral Vector and Plasmid DNA Manufacturing Market Stand Out As ...,still open
Sigma-Aldrich,02/10/2023,Surface nanoengineering technology for the removal of sulfur ...,still open
Sigma-Aldrich,02/10/2023,"PTAB Rules on Preliminary Motions in Interference No. 106,133",still open
Sigma-Aldrich,02/10/2023,Sodium Ethasulfate Market Growing at a CAGR 73.0% - Key Player ...,still open
Sigma-Aldrich,02/10/2023,Barrier-to-autointegration factor 1 promotes gammaherpesvirus ...,still open
Sigma-Aldrich,02/10/2023,Muconic Acid Market Biggest Innovation with Top Key Players ...,still open
Sigma-Aldrich,02/10/2023,Emerson to stay in St. Louis region,still open
Sigma-Aldrich,02/10/2023,"Glycerol Tristearte (GTS) ? Market : Top Players -Hangzhou Fuchun Food Additive, Sigma-Aldrich, Wuhan 3B Scien",still open
Sigma-Aldrich,02/10/2023,NanoBioTechnology (NBT) Market Booming at a CAGR of +15% by ...,still open
Sigma-Aldrich,02/10/2023,"N-Methylmorpholine Oxide Market Size, Share, Growth Statistics By ...",still open
Sigma-Aldrich,02/10/2023,Gene Editing Market: Factors Benefitting Emergence of New ...,still open
Sigma-Aldrich,02/10/2023,"Sales of 2-Ethylhexanol Market Is Expected To Reach a Valuation of US$ 13 Billion by 2032, Mentions Fact.MR",still open
Sigma-Aldrich,02/10/2023,Disposable Labware Market - 37% of Growth to Originate from ...,still open
Sigma-Aldrich,02/10/2023,"Life Science Products Market Size, Share, Growth Statistics By Top ...",still open
Sigma-Aldrich,02/10/2023,"Organometallics Market Size, Share, Growth Statistics By Top Key ...",still open
Sigma-Aldrich,02/10/2023,"CRISPR and CAS Gene Market Upcoming Trends, Industry Growth ...",still open
Sigma-Aldrich,02/10/2023,"Thallium (CAS 7440-28-0) Market Size, Share, Growth Statistics By ...",still open
Sigma-Aldrich,02/10/2023,Cellulose Market to Grow $305.08 Bn by 2026 with 4.2% CAGR ...,still open
Sigma-Aldrich,02/10/2023,"Sigma-Aldrich, GenOway Modify CRISPR Strategic Alliance",still open
Sigma-Aldrich,02/10/2023,Micro Bioreactors Market Size & Analysis By 2023 -2029 ...,still open
Sigma-Aldrich,02/10/2023,Protein Expression And Purification Technology Market Size & ...,still open
Sigma-Aldrich,02/10/2023,An investigational oral plasma kallikrein inhibitor for on-demand ...,still open
Sigma-Aldrich,02/10/2023,"Nano Zinc Oxide Market Size, Share, Growth Statistics By Top Key ...",still open
Sigma-Aldrich,02/10/2023,"5-hydroxymethylfurfural (5-HMF) (CAS 67-47-0) Market Size, Share ...",still open
Sigma-Aldrich,02/10/2023,Serum Market is booming Globally with Top key players-Thermo ...,still open
Sigma-Aldrich,02/10/2023,"Amine Salts Market to Witness Huge Growth by Key Players: Sigma-Aldrich, Kao Chemicals, Lubrizol, Kerafast, TC",still open
Sigma-Aldrich,02/10/2023,Exploring the Immunodominant Epitopes of SARS-CoV-2 ...,still open
Sigma-Aldrich,02/10/2023,Pathogen evasion of social immunity,still open
Sigma-Aldrich,02/10/2023,Chromatin Immunoprecipitation Assay Kits Market is expected to ...,still open
Sigma-Aldrich,02/10/2023,Chiral Separation Column Market Future Plans and Industry Growth ...,still open
Sigma-Aldrich,02/10/2023,Effects of nitrate and ammonium on assimilation of nitric oxide by ...,still open
Sigma-Aldrich,02/10/2023,Manjari Medika grape seed extract | JIR,still open
Sigma-Aldrich,02/10/2023,Mannobiose Market – A Comprehensive Study by Key Players:Kono ...,still open
Sigma-Aldrich,02/10/2023,Draft genomes of Blastocystis subtypes from human samples of ...,still open
Sigma-Aldrich,02/10/2023,A highly sensitive NanoLuc-based protease biosensor for detecting ...,still open
Sigma-Aldrich,02/10/2023,"Activated Alumina Market to Reach US$ 1,465.0 million by 2032, Witness a Favorable Macroeconomic Environment Amid Elevated Demand from Textile Industry | Report by Future Market Insights, Inc.",still open
Sigma-Aldrich,02/10/2023,"Global Dioxin Analyzer Market 2023: Vast Evolution, New Vendors ...",still open
Sigma-Aldrich,02/10/2023,Global Quantum Dot Display (Qled) Market (New Report 2023) Is ...,still open
Sigma-Aldrich,02/10/2023,Biological Safety Testing Market worth $7.3 billion by 2027 -Lonza ...,still open
Sigma-Aldrich,02/10/2023,Propionate exerts neuroprotective and neuroregenerative effects in ...,still open
Sigma-Aldrich,02/10/2023,Epigenetic Market would Register a Healthy Growth of USD 49.93 ...,still open
Sigma-Aldrich,02/10/2023,Hydrophobic PVDF Membranes Market worth $7.3 billion by 2027 ...,still open
Sigma-Aldrich,02/10/2023,Exponential Growth Expected for Gene Editing Kit Market With ...,still open
Sigma-Aldrich,02/10/2023,Protein Expression Market Huge Growth in Future Scope 2023-2032 ...,still open
Sigma-Aldrich,02/10/2023,Enantiomer Columns Market (Discount up to 70%) Discuss Ultimate ...,still open
Sigma-Aldrich,02/10/2023,FUS-ALS hiPSC-derived astrocytes impair human motor units ...,still open
Sigma-Aldrich,02/10/2023,Exploring the Growth Potential and Opportunities of the Bone ...,still open
Sigma-Aldrich,02/10/2023,Dual-specificity phosphatases 22-deficient T cells contribute to the ...,still open
Sigma-Aldrich,02/10/2023,Association of polysialic acid serum levels with schizophrenia ...,still open
Sigma-Aldrich,02/10/2023,"Recombinant Proteins Market In-depth Analysis and forecasts by 2030 |Sigma Aldrich Company Ltd., Novoprotein S",still open
Sigma-Aldrich,02/10/2023,Metabolic rewiring in MYC-driven medulloblastoma by BET ...,still open
Sigma-Aldrich,02/10/2023,Role of miR-944/MMP10/AXL- axis in lymph node metastasis in ...,still open
Sigma-Aldrich,02/10/2023,Advanced materials engineering in historical gypsum plaster ...,still open
Sigma-Aldrich,02/10/2023,Growing Inclination toward Renewable Sources of Energy to Drive ...,still open
Sigma-Aldrich,02/10/2023,Matrix-entrapped fibers create ecological niches for gut bacterial ...,still open
Sigma-Aldrich,02/10/2023,New C8-substituted caffeine derivatives as promising antioxidants ...,still open
Sigma-Aldrich,02/10/2023,"Genomics in Cancer Care Market Size, Share, Growth Statistics By ...",still open
Sigma-Aldrich,02/10/2023,Mitochondria metabolism sets the species-specific tempo of ...,still open
Sigma-Aldrich,02/10/2023,Dump Hauler Market Current Status and Future Prospects (2023 ...,still open
Sigma-Aldrich,02/10/2023,Tumor organoid biobank-new platform for medical research ...,still open
Sigma-Aldrich,02/10/2023,Super-Resolution Microscope Market To Grow Extensively At ...,still open
Sigma-Aldrich,02/10/2023,Vehicle Bumper Market Size & Analysis By 2023 -2029 -Tong Yang ...,still open
Sigma-Aldrich,02/10/2023,Electron Microscopy And Sample Preparation Market Set to Witness Explosive Growth by 2027,still open
Sigma-Aldrich,02/10/2023,Cryogenic Vials Market Size to Reach $10.6 Billion by 2030: Rising ...,still open
Sigma-Aldrich,02/10/2023,Dicyclohexyl Carbodiimide Market 2023 Segmentation and Regional Analysis by 2028,still open
Sigma-Aldrich,02/10/2023,"Industrial Formic Acid Market Upcoming Trends, Segmented by ...",still open
Sigma-Aldrich,02/10/2023,"Transplant Diagnostics Market | Size, Trends, Market Drivers, Restraints, Opportunities, And Key Industry Deve",still open
Sigma-Aldrich,02/10/2023,Sustainable and energy-efficient photocatalytic degradation of textile ...,still open
Sigma-Aldrich,02/10/2023,North America Aluminum Sulfate Market to be valued at around US$ 249 Mn by 2032-end.,still open
Sigma-Aldrich,02/10/2023,Liposomal Bupivacaine Market is expected to reach a value of 2027 ...,still open
Sigma-Aldrich,02/10/2023,Transcriptome analysis of a newly established mouse model of ...,still open
Sigma-Aldrich,02/10/2023,Reduced glucosinolate content in oilseed rape (Brassica napus L ...,still open
Sigma-Aldrich,02/10/2023,Macromolecular crowding regulates matrix composition and gene ...,still open
Sigma-Aldrich,02/10/2023,"Hydrofluoric Acid Solution Market Revenue, Opportunity, Forecast and Value Chain 2023-2029| Solvay, Columbus C",still open
Sigma-Aldrich,02/10/2023,Toxic Ag+ detection based on Au@Ag core shell nanostructure ...,still open
Sigma-Aldrich,02/10/2023,Species-specific immunogenicity and protective efficacy of a ...,still open
Sigma-Aldrich,02/10/2023,"Hydrated Lime Market Statistical Forecast, Trade Analysis 2023 ...",still open
Sigma-Aldrich,02/10/2023,Rising Trends of RNAi Technology Market to See Huge Growth With in-detailed Competitor Analysis Forecast to 20,still open
Sigma-Aldrich,02/10/2023,"Cupric and Cuprous Chloride Market Latest Trends, Driving Factors, Segmentations, and Key Industry Players Ava",still open
Sigma-Aldrich,02/10/2023,Diffusion MRI approaches for investigating microstructural ...,still open
Sigma-Aldrich,02/10/2023,"Language Learning Platforms Market Statistical Forecast, Trade ...",still open
Sigma-Aldrich,02/10/2023,Hydrogen migration in inner-shell ionized halogenated cyclic ...,still open
Sigma-Aldrich,02/10/2023,Assessing small molecule kinetics and affinity through SPR screening,still open
Sigma-Aldrich,02/10/2023,"Sales of 2-Ethylhexanol Market Is Expected To Reach a Valuation of US$ 13 Billion by 2032, Mentions Fact.MR",still open
Sigma-Aldrich,02/10/2023,The AP-1 transcription factor Fosl-2 drives cardiac fibrosis and ...,still open
Sigma-Aldrich,02/10/2023,Emerson to stay in St. Louis region,still open
Sigma-Aldrich,02/10/2023,Surface nanoengineering technology for the removal of sulfur ...,still open
Sigma-Aldrich,02/10/2023,Barrier-to-autointegration factor 1 promotes gammaherpesvirus ...,still open
Sigma-Aldrich,02/10/2023,Pathogen evasion of social immunity,still open
Sigma-Aldrich,02/10/2023,"Activated Alumina Market to Reach US$ 1,465.0 million by 2032, Witness a Favorable Macroeconomic Environment Amid Elevated Demand from Textile Industry | Report by Future Market Insights, Inc.",still open
Sigma-Aldrich,02/10/2023,Ultra-long-acting in-situ forming implants with cabotegravir protect ...,still open
Sigma-Aldrich,02/10/2023,Effects of nitrate and ammonium on assimilation of nitric oxide by ...,still open
Sigma-Aldrich,02/10/2023,Serum Market is booming Globally with Top key players-Thermo ...,still open
Sigma-Aldrich,02/10/2023,Impact of short chain fatty acids (SCFAs) on antimicrobial activity of ...,still open
Sigma-Aldrich,02/10/2023,Association of polysialic acid serum levels with schizophrenia ...,still open
Sigma-Aldrich,02/10/2023,DNase I and chitosan enhance efficacy of ceftazidime to eradicate ...,still open
Sigma-Aldrich,02/10/2023,Potential roles of acyl homoserine lactones (AHLs) in nitrifying ...,still open
Sigma-Aldrich,02/10/2023,A vein wall cell atlas of murine venous thrombosis determined by ...,still open
Sigma-Aldrich,02/10/2023,Stock Market | FinancialContent Business Page,still open
Sigma-Aldrich,02/10/2023,High-throughput analysis of the transcriptional patterns of sexual ...,still open
Sigma-Aldrich,02/10/2023,The antidiabetic drug metformin aids bacteria in hijacking vitamin ...,still open
Sigma-Aldrich,02/10/2023,Poly(vinyl alcohol) freeze casts with nano-additives as potential ...,still open
Sigma-Aldrich,02/10/2023,RNA binding protein DDX5 restricts RORγt+ Treg suppressor ...,still open
Sigma-Aldrich,02/10/2023,Cell Separation Market to Continue Impressive Measured Growth ...,still open
Sigma-Aldrich,02/10/2023,Gradual release of alendronate for treatment of bone defects | IJN,still open
Sigma-Aldrich,02/10/2023,"Sigma-Aldrich, GenOway Modify CRISPR Strategic Alliance",still open
Sigma-Aldrich,02/10/2023,"3D Cell Culture Global Market Report 2022: Featuring 3D Biotek, Thermo Fisher Scientific, Nano 3D Biosciences, Merck & More",still open
Sigma-Aldrich,02/10/2023,Machine learning and metabolic modelling assisted implementation ...,still open
Sigma-Aldrich,02/10/2023,Efficient adsorptive removal of paracetamol and thiazolyl blue from ...,still open
Sigma-Aldrich,02/10/2023,Chemical spill reported in south St. Louis neighborhood,still open
Sigma-Aldrich,02/10/2023,Identification of astrocyte regulators by nucleic acid cytometry,still open
Sigma-Aldrich,02/10/2023,16 Ethical Dividend Stocks to Invest in Today,still open
Sigma-Aldrich,02/10/2023,Sigma Share Price Today | %EXCHANGE_SYMBOL% SIAL Stock,still open
Sigma-Aldrich,02/10/2023,Curate Biosciences Announces David Backer as Chief Executive ...,still open
Sigma-Aldrich,02/10/2023,Merck to Acquire Sigma-Aldrich to Enhance Position in Attractive ...,still open
Sigma-Aldrich,02/10/2023,Catalogues of complexity | Opinion,still open
Sigma-Aldrich,02/10/2023,Alkylene Carbonates Market to See Major Growth by 2032 | BASF ...,still open
Sigma-Aldrich,02/10/2023,Nicklaus: Emerson remakes itself for growth. Let's hope it hasn't ...,still open
Sigma-Aldrich,02/10/2023,Antibody targeting of E3 ubiquitin ligases for receptor degradation,still open
Sigma-Aldrich,02/10/2023,Study Finds Ants Aren't Altering Behavior in Rising Temperatures,still open
Sigma-Aldrich,02/10/2023,Global Cell And Tissue Culture Supplies Market Size To Exceed 58.3 billion by 2030,still open
Sigma-Aldrich,02/10/2023,According to the Latest Report: Cellulase Market Is Expected ...,still open
Sigma-Aldrich,02/10/2023,What Does Sigma-Aldrich Do,still open
Sigma-Aldrich,02/10/2023,Sigma-Aldrich Announces Agreement on Assets Sale to Honeywell ...,still open
Sigma-Aldrich,02/10/2023,Catalytic activity imperative for nanoparticle dose enhancement in ...,still open
Sigma-Aldrich,02/10/2023,A mitotic chromatin phase transition prevents perforation by ...,still open
Sigma-Aldrich,02/10/2023,CN Bio appoints Dr Paul Brooks as Chief Executive Officer,still open
Sigma-Aldrich,02/10/2023,Ethyl Acetate Market To Generate Revenue Worth USD 2.36 Billion ...,still open
Sigma-Aldrich,02/10/2023,High-fat diet causes mechanical allodynia in the absence of injury or ...,still open
Sigma-Aldrich,02/10/2023,Flavors and Fragrances Global Market Report 2022,still open
Sigma-Aldrich,02/10/2023,Inhibition of FKBP51 induces stress resilience and alters ...,still open
Sigma-Aldrich,02/10/2023,Axalta Coating CEO Bryant to depart effective August 31 (NYSE:AXTA),still open
Sigma-Aldrich,02/10/2023,Apoptotic brown adipocytes enhance energy expenditure via ...,still open
Sigma-Aldrich,02/10/2023,L-threonine promotes healthspan by expediting ferritin-dependent ...,still open
Sigma-Aldrich,02/10/2023,MilliporeSigma Announces a Boost in Commercial Capacity in ...,still open
Sigma-Aldrich,02/10/2023,Early macrophage response to obesity encompasses Interferon ...,still open
Sigma-Aldrich,02/10/2023,Phloretin enhances remyelination by stimulating oligodendrocyte ...,still open
Sigma-Aldrich,02/10/2023,Zymoseptoria tritici white-collar complex integrates light ...,still open
Sigma-Aldrich,02/10/2023,Resistance of Dickeya solani strain IPO 2222 to lytic bacteriophage ...,still open
Sigma-Aldrich,02/10/2023,Bacterial And Plasmid Vectors Global Market Report 2023,still open
Sigma-Aldrich,02/10/2023,Tecovirimat is effective against human monkeypox virus in vitro at ...,still open
Sigma-Aldrich,02/10/2023,The endocannabinoid anandamide is an airway relaxant in health ...,still open
Sigma-Aldrich,02/10/2023,Fast DNA-PAINT imaging using a deep neural network,still open
Sigma-Aldrich,02/10/2023,Analysis of hyperforin (St. John's wort) action at TRPC6 channel ...,still open
Sigma-Aldrich,02/10/2023,A lab-on-a-chip for the concurrent electrochemical detection of ...,still open
Sigma-Aldrich,02/10/2023,Molecular data storage with zero synthetic effort and simple read-out ...,still open
Sigma-Aldrich,02/10/2023,β subunits of GABAA receptors form proton-gated chloride channels ...,still open
Sigma-Aldrich,02/10/2023,CRISPR activation screen identifies TGFβ-associated PEG10 as a ...,still open
Sigma-Aldrich,02/10/2023,Transplanting rejuvenated blood stem cells extends lifespan of aged ...,still open
Sigma-Aldrich,02/10/2023,DNA repair during nonreductional meiosis in the asexual rotifer ...,still open
Sigma-Aldrich,02/10/2023,"Emerson sells part of business, says it would consider leaving St ...",still open
Sigma-Aldrich,02/10/2023,Guiding cell migration in 3D with high-resolution photografting ...,still open
Sigma-Aldrich,02/10/2023,A comprehensive update to the Mycobacterium tuberculosis H37Rv ...,still open
Sigma-Aldrich,02/10/2023,Rapid antibiotic susceptibility testing and species identification for ...,still open
Sigma-Aldrich,02/10/2023,The membrane-active polyaminoisoprenyl compound NV716 re ...,still open
Sigma-Aldrich,02/10/2023,Ferritin-mediated iron detoxification promotes hypothermia survival ...,still open
Sigma-Aldrich,02/10/2023,Mitochondrial RNA modifications shape metabolic plasticity in ...,still open
Sigma-Aldrich,02/10/2023,A statistical framework for high-content phenotypic profiling using ...,still open
Sigma-Aldrich,02/10/2023,A gut-derived hormone suppresses sugar appetite and regulates ...,still open
Sigma-Aldrich,02/10/2023,Understanding soil selenium accumulation and bioavailability ...,still open
Sigma-Aldrich,02/10/2023,Candida albicans evades NK cell elimination via binding of ...,still open
Sigma-Aldrich,02/10/2023,PI3K drives the de novo synthesis of coenzyme A from vitamin B5,still open
Sigma-Aldrich,02/10/2023,Compensatory epistasis maintains ACE2 affinity in SARS-CoV-2 ...,still open
Sigma-Aldrich,02/10/2023,Omicron BA.4/BA.5 escape neutralizing immunity elicited by BA.1 ...,still open
Sigma-Aldrich,02/10/2023,Amoebicidal activity of cationic carbosilane dendrons derived with 4 ...,still open
Sigma-Aldrich,02/10/2023,Mechanism for selective binding of aromatic compounds on oxygen ...,still open
Sigma-Aldrich,02/10/2023,Biofortified tomatoes provide a new route to vitamin D sufficiency,still open
Sigma-Aldrich,02/10/2023,Exosomes decorated with a recombinant SARS-CoV-2 receptor ...,still open
Sigma-Aldrich,02/10/2023,Serotonin limits generation of chromaffin cells during adrenal organ ...,still open
Sigma-Aldrich,02/10/2023,Endocytosis-like DNA uptake by cell wall-deficient bacteria,still open
Sigma-Aldrich,02/10/2023,Assessment of the biofilm-forming ability on solid surfaces of ...,still open
Sigma-Aldrich,02/10/2023,Synthesis of natural product hybrids by the Ugi reaction in complex ...,still open
Sigma-Aldrich,02/10/2023,Molecularly cleavable bioinks facilitate high-performance digital light ...,still open
Sigma-Aldrich,02/10/2023,Overexpression of the NEK9–EG5 axis is a novel metastatic marker ...,still open
Sigma-Aldrich,02/10/2023,Receptor for advanced glycation end-products (RAGE) mediates ...,still open
Sigma-Aldrich,02/10/2023,Antimicrobial properties of chitosan from different developmental ...,still open
Sigma-Aldrich,02/10/2023,Enhanced metanephric specification to functional proximal tubule ...,still open
Sigma-Aldrich,02/10/2023,Design of combination therapy for engineered bacterial therapeutics ...,still open
Sigma-Aldrich,02/10/2023,Loss of NECTIN1 triggers melanoma dissemination upon local IGF1 ...,still open
Sigma-Aldrich,02/10/2023,Development of a pentavalent broadly protective nucleoside ...,still open
Sigma-Aldrich,02/10/2023,Rewiring glucose metabolism improves 5-FU efficacy in p53 ...,still open
Sigma-Aldrich,02/10/2023,Butyrate reduces cellular magnesium absorption independently of ...,still open
Sigma-Aldrich,02/10/2023,Red Blood Cell Lysis Buffer Market Size And Forecast -Sigma ...,still open
Sigma-Aldrich,02/10/2023,"Phycoerythrin Market Size, Share, Growth Statistics By Top Key ...",still open
Sigma-Aldrich,02/10/2023,"Gold Nanoparticles Market Size, Share, Growth Statistics By Top ...",still open
Sigma-Aldrich,02/10/2023,Immunoassay Instruments Market to Accelerate Growth with ...,still open
Sigma-Aldrich,02/10/2023,Cell Line Development Market Future Business Opportunities 2023 ...,still open
