Name,Data,News,Evaluation
Sigma-Aldrich,02/15/2023,Exploring the Immunodominant Epitopes of SARS-CoV-2 ...,still open
Sigma-Aldrich,02/15/2023,"Electric Dental Handpiece Market Size, Development Data, Growth ...",still open
Sigma-Aldrich,02/15/2023,Juglans Regia Shell Powder Market is Predicted to Reach US ...,still open
Sigma-Aldrich,02/15/2023,Epigenetic alterations impede epithelial-mesenchymal transition by ...,still open
Sigma-Aldrich,02/15/2023,Drywall Anchor Market – A Comprehensive Study by Key Players ...,still open
Sigma-Aldrich,02/15/2023,Standardisation challenges in complement activation assays. | IJN,still open
Sigma-Aldrich,02/15/2023,Metagenome reveals caprine abomasal microbiota diversity at early ...,still open
Sigma-Aldrich,02/15/2023,Sigma-Aldrich Licenses CRISPR-Cas9 Tech to Horizon Discovery,still open
Sigma-Aldrich,02/15/2023,Global Oligonucleotide Pool Library Market 2023 Manufacturer ...,still open
Sigma-Aldrich,02/15/2023,"Triphenylphosphine Oxide Market Global Industry Analysis, Future Demand, and Forecast till 2030 |Eastar Chemic",still open
Sigma-Aldrich,02/15/2023,Veterinary Electrocardiographs Market Development Size 2023 ...,still open
Sigma-Aldrich,02/15/2023,Confined environments induce polarized paraspeckle condensates ...,still open
Sigma-Aldrich,02/15/2023,Mechanism of arterial injury exacerbated by hyperhomocysteinemia ...,still open
Sigma-Aldrich,02/15/2023,Food protein-derived amyloids do not accelerate amyloid β ...,still open
Sigma-Aldrich,02/15/2023,PTAB Told Chemical Co.'s Tech Has 'Full Promise' Of CRISPR,still open
Sigma-Aldrich,02/15/2023,Head and neck cancer patient-derived tumouroid cultures ...,still open
Sigma-Aldrich,02/15/2023,Advanced materials engineering in historical gypsum plaster ...,still open
Sigma-Aldrich,02/15/2023,Sparkling Juices Market is likely to expand US$ 2.5 Bn at 10.6 ...,still open
Sigma-Aldrich,02/15/2023,"Fish Oil Supplement Market Statistical Forecast, Trade Analysis ...",still open
Sigma-Aldrich,02/15/2023,Capsules Detergente Market Size and Forecast to 2029 -Procter & ...,still open
Sigma-Aldrich,02/15/2023,Reduced glucosinolate content in oilseed rape (Brassica napus L ...,still open
Sigma-Aldrich,02/15/2023,"Biopharmaceuticals Contract Manufacturing Market Future Development, Emerging Trends, Business Statistics, and",still open
Sigma-Aldrich,02/15/2023,Carbon black-containing self-healing adhesive hydrogels for ...,still open
Sigma-Aldrich,02/15/2023,Pharmaceutical Glass Packaging Market – A Comprehensive Study ...,still open
Sigma-Aldrich,02/15/2023,Nickel Powder Market Current Status and Future Prospects (2023 ...,still open
Sigma-Aldrich,02/15/2023,Diffusion MRI approaches for investigating microstructural ...,still open
Sigma-Aldrich,02/15/2023,Robustness of a multivariate composite score when evaluating ...,still open
Sigma-Aldrich,02/15/2023,Developmental exposure to domoic acid targets reticulospinal ...,still open
Sigma-Aldrich,02/15/2023,Stock Market | FinancialContent Business Page,still open
Sigma-Aldrich,02/15/2023,The huge growth of N-Aminoethylpiperazine (AEP) Market In-depth Analysis Growth Projection with Regional Deman,still open
Sigma-Aldrich,02/15/2023,Emerson to stay in St. Louis region,still open
Sigma-Aldrich,02/15/2023,Barrier-to-autointegration factor 1 promotes gammaherpesvirus ...,still open
Sigma-Aldrich,02/15/2023,Pathogen evasion of social immunity,still open
Sigma-Aldrich,02/15/2023,Decoding the metabolic response of Escherichia coli for sensing ...,still open
Sigma-Aldrich,02/15/2023,The AP-1 transcription factor Fosl-2 drives cardiac fibrosis and ...,still open
Sigma-Aldrich,02/15/2023,Surface nanoengineering technology for the removal of sulfur ...,still open
Sigma-Aldrich,02/15/2023,Impact of short chain fatty acids (SCFAs) on antimicrobial activity of ...,still open
Sigma-Aldrich,02/15/2023,Preparing for the next influenza season | IDR,still open
Sigma-Aldrich,02/15/2023,Determination of drug kinetics with high-affinity molecular interactions,still open
Sigma-Aldrich,02/15/2023,Standoff detection of bacterial spores by field deployable coherent ...,still open
Sigma-Aldrich,02/15/2023,"DNA Data Storage Global Market Report 2023: Featuring 10x Genomics, Agilent Technologies, Illumina, Twist Bioscience & More",still open
Sigma-Aldrich,02/15/2023,"Activated Alumina Market to Reach US$ 1,465.0 million by 2032, Witness a Favorable Macroeconomic Environment Amid Elevated Demand from Textile Industry | Report by Future Market Insights, Inc.",still open
Sigma-Aldrich,02/15/2023,Ultra-long-acting in-situ forming implants with cabotegravir protect ...,still open
Sigma-Aldrich,02/15/2023,A vein wall cell atlas of murine venous thrombosis determined by ...,still open
Sigma-Aldrich,02/15/2023,Association of polysialic acid serum levels with schizophrenia ...,still open
Sigma-Aldrich,02/15/2023,DNase I and chitosan enhance efficacy of ceftazidime to eradicate ...,still open
Sigma-Aldrich,02/15/2023,Antibacterial effect of Matricaria chamomilla L. extract | CCIDE,still open
Sigma-Aldrich,02/15/2023,Stock Market | FinancialContent Business Page,still open
Sigma-Aldrich,02/15/2023,Potential roles of acyl homoserine lactones (AHLs) in nitrifying ...,still open
Sigma-Aldrich,02/15/2023,An in-depth analysis of four classes of antidepressants quantification ...,still open
Sigma-Aldrich,02/15/2023,The antidiabetic drug metformin aids bacteria in hijacking vitamin ...,still open
Sigma-Aldrich,02/15/2023,Poly(vinyl alcohol) freeze casts with nano-additives as potential ...,still open
Sigma-Aldrich,02/15/2023,Standardisation challenges in complement activation assays. | IJN,still open
Sigma-Aldrich,02/15/2023,Cell Separation Market to Continue Impressive Measured Growth ...,still open
Sigma-Aldrich,02/15/2023,Food protein-derived amyloids do not accelerate amyloid β ...,still open
Sigma-Aldrich,02/15/2023,Gradual release of alendronate for treatment of bone defects | IJN,still open
Sigma-Aldrich,02/15/2023,Regions of hepatitis C virus E2 required for membrane association,still open
Sigma-Aldrich,02/15/2023,Why Sigma-Aldrich (SIAL) Stock Is Spiking Today,still open
Sigma-Aldrich,02/15/2023,Effects of nitrate and ammonium on assimilation of nitric oxide by ...,still open
Sigma-Aldrich,02/15/2023,Identification of astrocyte regulators by nucleic acid cytometry,still open
Sigma-Aldrich,02/15/2023,16 Ethical Dividend Stocks to Invest in Today,still open
Sigma-Aldrich,02/15/2023,Update: The Sigma-Aldrich Takeover - Merck KGaA's Way To ...,still open
Sigma-Aldrich,02/15/2023,Sigma Share Price Today | %EXCHANGE_SYMBOL% SIAL Stock,still open
Sigma-Aldrich,02/15/2023,Curate Biosciences Announces David Backer as Chief Executive ...,still open
Sigma-Aldrich,02/15/2023,Catalogues of complexity | Opinion,still open
Sigma-Aldrich,02/15/2023,Nicklaus: Emerson remakes itself for growth. Let's hope it hasn't ...,still open
Sigma-Aldrich,02/15/2023,Antibody targeting of E3 ubiquitin ligases for receptor degradation,still open
Sigma-Aldrich,02/15/2023,What Does Sigma-Aldrich Do,still open
Sigma-Aldrich,02/15/2023,According to the Latest Report: Cellulase Market Is Expected ...,still open
Sigma-Aldrich,02/15/2023,Sigma-Aldrich Announces Agreement on Assets Sale to Honeywell ...,still open
Sigma-Aldrich,02/15/2023,A mitotic chromatin phase transition prevents perforation by ...,still open
Sigma-Aldrich,02/15/2023,Catalytic activity imperative for nanoparticle dose enhancement in ...,still open
Sigma-Aldrich,02/15/2023,Global Cell And Tissue Culture Supplies Market Size To Exceed 58.3 billion by 2030,still open
Sigma-Aldrich,02/15/2023,High-fat diet causes mechanical allodynia in the absence of injury or ...,still open
Sigma-Aldrich,02/15/2023,Inhibition of FKBP51 induces stress resilience and alters ...,still open
Sigma-Aldrich,02/15/2023,Axalta Coating CEO Bryant to depart effective August 31 (NYSE:AXTA),still open
Sigma-Aldrich,02/15/2023,Sigma-Aldrich hit with $9M fine for misleading info during Merck ...,still open
Sigma-Aldrich,02/15/2023,Apoptotic brown adipocytes enhance energy expenditure via ...,still open
Sigma-Aldrich,02/15/2023,RNAi Technology Global Market Report 2022: Featuring QIAGEN ...,still open
Sigma-Aldrich,02/15/2023,L-threonine promotes healthspan by expediting ferritin-dependent ...,still open
Sigma-Aldrich,02/15/2023,MilliporeSigma Announces a Boost in Commercial Capacity in ...,still open
Sigma-Aldrich,02/15/2023,Phloretin enhances remyelination by stimulating oligodendrocyte ...,still open
Sigma-Aldrich,02/15/2023,Early macrophage response to obesity encompasses Interferon ...,still open
Sigma-Aldrich,02/15/2023,Zymoseptoria tritici white-collar complex integrates light ...,still open
Sigma-Aldrich,02/15/2023,Resistance of Dickeya solani strain IPO 2222 to lytic bacteriophage ...,still open
Sigma-Aldrich,02/15/2023,Tecovirimat is effective against human monkeypox virus in vitro at ...,still open
Sigma-Aldrich,02/15/2023,The endocannabinoid anandamide is an airway relaxant in health ...,still open
Sigma-Aldrich,02/15/2023,Fast DNA-PAINT imaging using a deep neural network,still open
Sigma-Aldrich,02/15/2023,High-throughput analysis of the transcriptional patterns of sexual ...,still open
Sigma-Aldrich,02/15/2023,A lab-on-a-chip for the concurrent electrochemical detection of ...,still open
Sigma-Aldrich,02/15/2023,Molecular data storage with zero synthetic effort and simple read-out ...,still open
Sigma-Aldrich,02/15/2023,β subunits of GABAA receptors form proton-gated chloride channels ...,still open
Sigma-Aldrich,02/15/2023,CRISPR activation screen identifies TGFβ-associated PEG10 as a ...,still open
Sigma-Aldrich,02/15/2023,Analysis of hyperforin (St. John's wort) action at TRPC6 channel ...,still open
Sigma-Aldrich,02/15/2023,Transplanting rejuvenated blood stem cells extends lifespan of aged ...,still open
Sigma-Aldrich,02/15/2023,Industrial Alcohol Global Market Report 2022,still open
Sigma-Aldrich,02/15/2023,DNA repair during nonreductional meiosis in the asexual rotifer ...,still open
Sigma-Aldrich,02/15/2023,Rapid antibiotic susceptibility testing and species identification for ...,still open
Sigma-Aldrich,02/15/2023,A comprehensive update to the Mycobacterium tuberculosis H37Rv ...,still open
Sigma-Aldrich,02/15/2023,A statistical framework for high-content phenotypic profiling using ...,still open
Sigma-Aldrich,02/15/2023,Guiding cell migration in 3D with high-resolution photografting ...,still open
Sigma-Aldrich,02/15/2023,"Emerson sells part of business, says it would consider leaving St ...",still open
Sigma-Aldrich,02/15/2023,The membrane-active polyaminoisoprenyl compound NV716 re ...,still open
Sigma-Aldrich,02/15/2023,Ferritin-mediated iron detoxification promotes hypothermia survival ...,still open
Sigma-Aldrich,02/15/2023,Mitochondrial RNA modifications shape metabolic plasticity in ...,still open
Sigma-Aldrich,02/15/2023,A gut-derived hormone suppresses sugar appetite and regulates ...,still open
Sigma-Aldrich,02/15/2023,Understanding soil selenium accumulation and bioavailability ...,still open
Sigma-Aldrich,02/15/2023,Candida albicans evades NK cell elimination via binding of ...,still open
Sigma-Aldrich,02/15/2023,Compensatory epistasis maintains ACE2 affinity in SARS-CoV-2 ...,still open
Sigma-Aldrich,02/15/2023,Amoebicidal activity of cationic carbosilane dendrons derived with 4 ...,still open
Sigma-Aldrich,02/15/2023,PI3K drives the de novo synthesis of coenzyme A from vitamin B5,still open
Sigma-Aldrich,02/15/2023,Omicron BA.4/BA.5 escape neutralizing immunity elicited by BA.1 ...,still open
Sigma-Aldrich,02/15/2023,Biofortified tomatoes provide a new route to vitamin D sufficiency,still open
Sigma-Aldrich,02/15/2023,Assessment of the biofilm-forming ability on solid surfaces of ...,still open
Sigma-Aldrich,02/15/2023,Bacterial And Plasmid Vectors Global Market Report 2023,still open
Sigma-Aldrich,02/15/2023,Exosomes decorated with a recombinant SARS-CoV-2 receptor ...,still open
Sigma-Aldrich,02/15/2023,Overexpression of the NEK9–EG5 axis is a novel metastatic marker ...,still open
Sigma-Aldrich,02/15/2023,Endocytosis-like DNA uptake by cell wall-deficient bacteria,still open
Sigma-Aldrich,02/15/2023,Receptor for advanced glycation end-products (RAGE) mediates ...,still open
Sigma-Aldrich,02/15/2023,Molecularly cleavable bioinks facilitate high-performance digital light ...,still open
Sigma-Aldrich,02/15/2023,Synthesis of natural product hybrids by the Ugi reaction in complex ...,still open
Sigma-Aldrich,02/15/2023,Antimicrobial properties of chitosan from different developmental ...,still open
Sigma-Aldrich,02/15/2023,Design of combination therapy for engineered bacterial therapeutics ...,still open
Sigma-Aldrich,02/15/2023,Enhanced metanephric specification to functional proximal tubule ...,still open
Sigma-Aldrich,02/15/2023,Loss of NECTIN1 triggers melanoma dissemination upon local IGF1 ...,still open
Sigma-Aldrich,02/15/2023,Development of a pentavalent broadly protective nucleoside ...,still open
Sigma-Aldrich,02/15/2023,Genetic Chronic Obstructive Pulmonary Disease (COPD) Market is ...,still open
Sigma-Aldrich,02/15/2023,Pregnenolone Market Projected to Witness Vigorous Expansion by ...,still open
Sigma-Aldrich,02/15/2023,"Prepared Media Market to See Huge Growth by 2029 : 3M, Thermo ...",still open
Sigma-Aldrich,02/15/2023,"Phycoerythrin Market Size, Share, Growth Statistics By Top Key ...",still open
Sigma-Aldrich,02/15/2023,HPAPI global market to reach $34.04b in 2026,still open
Sigma-Aldrich,02/15/2023,Immunoassay Instruments Market to Accelerate Growth with ...,still open
Sigma-Aldrich,02/15/2023,Robustness of a multivariate composite score when evaluating ...,still open
Sigma-Aldrich,02/15/2023,Top Stories of 2022: #5 to #7 | McDonnell Boehnen Hulbert ...,still open
Sigma-Aldrich,02/15/2023,DNA Data Storage Global Market Report 2023: Featuring 10x ...,still open
Sigma-Aldrich,02/15/2023,"PTAB Rules on Preliminary Motions in Interference No. 106,133",still open
Sigma-Aldrich,02/15/2023,The Sds Poly Acrylamide Gel Electrophoresis Market is highly competitive with some key players such as Bio-Rad,still open
Sigma-Aldrich,02/15/2023,Analytical Testing of Nitrosamines in Drugs and Food,still open
Sigma-Aldrich,02/15/2023,Holding Pipette Market Biggest Innovation with Top Key Players ...,still open
Sigma-Aldrich,02/15/2023,"Bovine Growth Serum Market Rising Trends and Demand in Pharma & Healthcare Industry 2023 | HyClone, Rocky Moun",still open
Sigma-Aldrich,02/15/2023,A mechanistic evaluation of human beta defensin 2 mediated ...,still open
Sigma-Aldrich,02/15/2023,Lateral Flow Assays Global Market Report 2023: Smartphone and AI ...,still open
Sigma-Aldrich,02/15/2023,NanoBioTechnology (NBT) Market Booming at a CAGR of +15% by ...,still open
Sigma-Aldrich,02/15/2023,Barrier-to-autointegration factor 1 promotes gammaherpesvirus ...,still open
Sigma-Aldrich,02/15/2023,Water-in-salt electrolytes made saltier by Gemini ionic liquids for ...,still open
Sigma-Aldrich,02/15/2023,Developmental exposure to domoic acid targets reticulospinal ...,still open
Sigma-Aldrich,02/15/2023,"Life Science Products Market Size, Share, Growth Statistics By Top ...",still open
Sigma-Aldrich,02/15/2023,The huge growth of N-Aminoethylpiperazine (AEP) Market In-depth Analysis Growth Projection with Regional Deman,still open
Sigma-Aldrich,02/15/2023,"Thiophene-2-Ethylamine Market is booming across the globe explored in the latest research by 2030|AB Chem, Sig",still open
Sigma-Aldrich,02/15/2023,"Tributyl Borate Market Recent Trends, Industry Growth, Top Manufacturers Analysis, Business Opportunities, and",still open
Sigma-Aldrich,02/15/2023,Gold Nanoparticles Market 2023 Segments Analysis by Top Key ...,still open
Sigma-Aldrich,02/15/2023,"Sodium Persulfate Market Analysis and Forecast To 2028 | VR Persulfates, Peroxy Chem, ABC Chemicals, Geo-Clean",still open
Sigma-Aldrich,02/15/2023,Laboratory Filtration Market is Expected to Reach US$ 43.33 Bn by ...,still open
Sigma-Aldrich,02/15/2023,Resistance training restores skeletal muscle atrophy and satellite ...,still open
Sigma-Aldrich,02/15/2023,"CRISPR and CAS Gene Market Generated Opportunities, Future ...",still open
Sigma-Aldrich,02/15/2023,Surface nanoengineering technology for the removal of sulfur ...,still open
Sigma-Aldrich,02/15/2023,"Zinc Sulfide Market is expected to reach a value of USD 1,721,231.5 ...",still open
Sigma-Aldrich,02/15/2023,"CRISPR and CAS Gene Market Upcoming Trends, Industry Growth ...",still open
Sigma-Aldrich,02/15/2023,Pathogen evasion of social immunity,still open
Sigma-Aldrich,02/15/2023,Sodium Ethasulfate Market Growing at a CAGR 73.0% - Key Player ...,still open
Sigma-Aldrich,02/15/2023,Chiral Separation Column Market Future Plans and Industry Growth ...,still open
Sigma-Aldrich,02/15/2023,"Food Thickeners Market Development Size 2023 |Cargill, Archer ...",still open
Sigma-Aldrich,02/15/2023,Emerson to stay in St. Louis region,still open
Sigma-Aldrich,02/15/2023,Dual RNA sequencing of group B Streptococcus-infected human ...,still open
Sigma-Aldrich,02/15/2023,"Sigma-Aldrich, GenOway Modify CRISPR Strategic Alliance",still open
Sigma-Aldrich,02/15/2023,A highly sensitive NanoLuc-based protease biosensor for detecting ...,still open
Sigma-Aldrich,02/15/2023,Propionate exerts neuroprotective and neuroregenerative effects in ...,still open
Sigma-Aldrich,02/15/2023,"Primary Cells Market Future Outlook 2027 with Thermo Fisher Scientific, Merck Group, Lonza, Cell Biologics, Pr",still open
Sigma-Aldrich,02/15/2023,"Duplex Sequencing Market is thriving worldwide by 2027 | Top Key Players like TwinStrand Biosciences, Apollo G",still open
Sigma-Aldrich,02/15/2023,"Amine Salts Market to Witness Huge Growth by Key Players: Sigma-Aldrich, Kao Chemicals, Lubrizol, Kerafast, TC",still open
Sigma-Aldrich,02/15/2023,Draft genomes of Blastocystis subtypes from human samples of ...,still open
Sigma-Aldrich,02/15/2023,"Automated Cell Cultures Market 2023 with Strong Focus on Business Size, Industry Highlights, Segments, Growth",still open
Sigma-Aldrich,02/15/2023,A vein wall cell atlas of murine venous thrombosis determined by ...,still open
Sigma-Aldrich,02/15/2023,Exponential Growth Expected for Gene Editing Kit Market With ...,still open
Sigma-Aldrich,02/15/2023,FUS-ALS hiPSC-derived astrocytes impair human motor units ...,still open
Sigma-Aldrich,02/15/2023,Human Primary Cells Market is expected to reach a value of 2027 ...,still open
Sigma-Aldrich,02/15/2023,Rising Trends of Human Gene Editing Market will Witness Substantial Growth With in-detailed Competitor Analysi,still open
Sigma-Aldrich,02/15/2023,Flexible biomimetic block copolymer composite for temperature and ...,still open
Sigma-Aldrich,02/15/2023,"Ferric Nitrate Market Global Share, Trends, Opportunities, Outlook ...",still open
Sigma-Aldrich,02/15/2023,Determination of drug kinetics with high-affinity molecular interactions,still open
Sigma-Aldrich,02/15/2023,Exploring the Growth Potential and Opportunities of the Bone ...,still open
Sigma-Aldrich,02/15/2023,Metabolic rewiring in MYC-driven medulloblastoma by BET ...,still open
Sigma-Aldrich,02/15/2023,Role of miR-944/MMP10/AXL- axis in lymph node metastasis in ...,still open
Sigma-Aldrich,02/15/2023,Disposable Labware Market - 37% of Growth to Originate from ...,still open
Sigma-Aldrich,02/15/2023,Association of polysialic acid serum levels with schizophrenia ...,still open
Sigma-Aldrich,02/15/2023,Immunoassay Instruments Market Size 2023 Industry Recent ...,still open
Sigma-Aldrich,02/15/2023,Standoff detection of bacterial spores by field deployable coherent ...,still open
Sigma-Aldrich,02/15/2023,Engineered kirigami design of PVDF-Pt core–shell nanofiber ...,still open
Sigma-Aldrich,02/15/2023,DUSP1 mediates BCG induced apoptosis and inflammatory ...,still open
Sigma-Aldrich,02/15/2023,New C8-substituted caffeine derivatives as promising antioxidants ...,still open
Sigma-Aldrich,02/15/2023,Osteoblasts-derived exosomal lncRNA-MALAT1 | IJN,still open
Sigma-Aldrich,02/15/2023,"Cell Free Protein Expression Market Trends, Competition Strategies ...",still open
Sigma-Aldrich,02/15/2023,"N-Methylmorpholine Oxide Market Size, Share, Growth Statistics By ...",still open
Sigma-Aldrich,02/15/2023,Wheat husk-based sorbent as an economical solution for removal of ...,still open
Sigma-Aldrich,02/15/2023,"Activated Alumina Market to Reach US$ 1,465.0 million by 2032, Witness a Favorable Macroeconomic Environment Amid Elevated Demand from Textile Industry | Report by Future Market Insights, Inc.",still open
Sigma-Aldrich,02/15/2023,Preparing for the next influenza season | IDR,still open
Sigma-Aldrich,02/15/2023,Nanopore adaptive sampling for targeted mitochondrial genome ...,still open
Sigma-Aldrich,02/15/2023,Antibacterial effect of Matricaria chamomilla L. extract | CCIDE,still open
Sigma-Aldrich,02/15/2023,Behavioral and cognitive performance of humanized APOEε3/ε3 ...,still open
Sigma-Aldrich,02/15/2023,"Food Amino Acids Market Size Is to Hit USD 9.2 Bn by 2028: Market Growth, Share, Demand, Solutions & Regional",still open
Sigma-Aldrich,02/15/2023,Exploring the Immunodominant Epitopes of SARS-CoV-2 ...,still open
Sigma-Aldrich,02/15/2023,"Electric Dental Handpiece Market Size, Development Data, Growth ...",still open
Sigma-Aldrich,02/15/2023,Juglans Regia Shell Powder Market is Predicted to Reach US ...,still open
Sigma-Aldrich,02/15/2023,Epigenetic alterations impede epithelial-mesenchymal transition by ...,still open
Sigma-Aldrich,02/15/2023,Drywall Anchor Market – A Comprehensive Study by Key Players ...,still open
Sigma-Aldrich,02/15/2023,Standardisation challenges in complement activation assays. | IJN,still open
Sigma-Aldrich,02/15/2023,Metagenome reveals caprine abomasal microbiota diversity at early ...,still open
Sigma-Aldrich,02/15/2023,Sigma-Aldrich Licenses CRISPR-Cas9 Tech to Horizon Discovery,still open
Sigma-Aldrich,02/15/2023,Global Oligonucleotide Pool Library Market 2023 Manufacturer ...,still open
Sigma-Aldrich,02/15/2023,"Triphenylphosphine Oxide Market Global Industry Analysis, Future Demand, and Forecast till 2030 |Eastar Chemic",still open
Sigma-Aldrich,02/15/2023,Veterinary Electrocardiographs Market Development Size 2023 ...,still open
Sigma-Aldrich,02/15/2023,Confined environments induce polarized paraspeckle condensates ...,still open
Sigma-Aldrich,02/15/2023,Mechanism of arterial injury exacerbated by hyperhomocysteinemia ...,still open
Sigma-Aldrich,02/15/2023,Food protein-derived amyloids do not accelerate amyloid β ...,still open
Sigma-Aldrich,02/15/2023,PTAB Told Chemical Co.'s Tech Has 'Full Promise' Of CRISPR,still open
Sigma-Aldrich,02/15/2023,Head and neck cancer patient-derived tumouroid cultures ...,still open
Sigma-Aldrich,02/15/2023,Advanced materials engineering in historical gypsum plaster ...,still open
Sigma-Aldrich,02/15/2023,Sparkling Juices Market is likely to expand US$ 2.5 Bn at 10.6 ...,still open
Sigma-Aldrich,02/15/2023,"Fish Oil Supplement Market Statistical Forecast, Trade Analysis ...",still open
Sigma-Aldrich,02/15/2023,Capsules Detergente Market Size and Forecast to 2029 -Procter & ...,still open
Sigma-Aldrich,02/15/2023,Reduced glucosinolate content in oilseed rape (Brassica napus L ...,still open
Sigma-Aldrich,02/15/2023,"Biopharmaceuticals Contract Manufacturing Market Future Development, Emerging Trends, Business Statistics, and",still open
Sigma-Aldrich,02/15/2023,Carbon black-containing self-healing adhesive hydrogels for ...,still open
Sigma-Aldrich,02/15/2023,Pharmaceutical Glass Packaging Market – A Comprehensive Study ...,still open
Sigma-Aldrich,02/15/2023,Nickel Powder Market Current Status and Future Prospects (2023 ...,still open
Sigma-Aldrich,02/15/2023,Diffusion MRI approaches for investigating microstructural ...,still open
Sigma-Aldrich,02/15/2023,Robustness of a multivariate composite score when evaluating ...,still open
Sigma-Aldrich,02/15/2023,Developmental exposure to domoic acid targets reticulospinal ...,still open
Sigma-Aldrich,02/15/2023,Stock Market | FinancialContent Business Page,still open
Sigma-Aldrich,02/15/2023,The huge growth of N-Aminoethylpiperazine (AEP) Market In-depth Analysis Growth Projection with Regional Deman,still open
Sigma-Aldrich,02/15/2023,Emerson to stay in St. Louis region,still open
Sigma-Aldrich,02/15/2023,Barrier-to-autointegration factor 1 promotes gammaherpesvirus ...,still open
Sigma-Aldrich,02/15/2023,Pathogen evasion of social immunity,still open
Sigma-Aldrich,02/15/2023,Decoding the metabolic response of Escherichia coli for sensing ...,still open
Sigma-Aldrich,02/15/2023,The AP-1 transcription factor Fosl-2 drives cardiac fibrosis and ...,still open
Sigma-Aldrich,02/15/2023,Surface nanoengineering technology for the removal of sulfur ...,still open
Sigma-Aldrich,02/15/2023,Impact of short chain fatty acids (SCFAs) on antimicrobial activity of ...,still open
Sigma-Aldrich,02/15/2023,Preparing for the next influenza season | IDR,still open
Sigma-Aldrich,02/15/2023,Determination of drug kinetics with high-affinity molecular interactions,still open
Sigma-Aldrich,02/15/2023,Standoff detection of bacterial spores by field deployable coherent ...,still open
Sigma-Aldrich,02/15/2023,"DNA Data Storage Global Market Report 2023: Featuring 10x Genomics, Agilent Technologies, Illumina, Twist Bioscience & More",still open
Sigma-Aldrich,02/15/2023,"Activated Alumina Market to Reach US$ 1,465.0 million by 2032, Witness a Favorable Macroeconomic Environment Amid Elevated Demand from Textile Industry | Report by Future Market Insights, Inc.",still open
