Name,Data,News,Evaluation
Sigma-Aldrich,02/05/2023,High Purity Metals Market is booming Globally with Top key players ...,still open
Sigma-Aldrich,02/05/2023,Cinnamoyl Chloride Market worth $7.3 billion by 2027 -Tci chemical ...,still open
Sigma-Aldrich,02/05/2023,Classical Cell Culture Media Market is Expected to Reach US ...,still open
Sigma-Aldrich,02/05/2023,Serum-Free Media (SFM) Market Size & Analysis By 2022 -2029 ...,still open
Sigma-Aldrich,02/05/2023,Fucosidosis Therapeutics Market Detailed Analysis and Forecast up ...,still open
Sigma-Aldrich,02/05/2023,NanoBioTechnology (NBT) Market Booming at a CAGR of +15% by ...,still open
Sigma-Aldrich,02/05/2023,Halogen Based Biocides Market Growing at a CAGR 73.0% - Key ...,still open
Sigma-Aldrich,02/05/2023,Top Stories of 2022: #5 to #7 | McDonnell Boehnen Hulbert ...,still open
Sigma-Aldrich,02/05/2023,Chiral Separation Column Market Future Plans and Industry Growth ...,still open
Sigma-Aldrich,02/05/2023,"Rhodium Catalyst Market Size [2023-2029] -BASF, Vineeth ...",still open
Sigma-Aldrich,02/05/2023,"Life Science Products Market Size, Share, Growth Statistics By Top ...",still open
Sigma-Aldrich,02/05/2023,"CRISPR and CAS Gene Market Upcoming Trends, Industry Growth ...",still open
Sigma-Aldrich,02/05/2023,"PTAB Rules on Preliminary Motions in Interference No. 106,133",still open
Sigma-Aldrich,02/05/2023,Osteopontin Protein Market 2023 key developmental strategies ...,still open
Sigma-Aldrich,02/05/2023,Pathogen evasion of social immunity,still open
Sigma-Aldrich,02/05/2023,Folin Phenol Reagent Market 2023 – 2030: Latest Research Report ...,still open
Sigma-Aldrich,02/05/2023,Draft genomes of Blastocystis subtypes from human samples of ...,still open
Sigma-Aldrich,02/05/2023,Pre-coated Plates Market - 37% of Growth to Originate from APAC ...,still open
Sigma-Aldrich,02/05/2023,Viral Vector and Plasmid DNA Manufacturing Market to See ...,still open
Sigma-Aldrich,02/05/2023,﻿Protein Characterization and Identification Market Size & Analysis ...,still open
Sigma-Aldrich,02/05/2023,Trail Cameras Market Research Report 2023 - Cambridge Isotope ...,still open
Sigma-Aldrich,02/05/2023,"2-Chloroethanol Market Size, Development Data, Growth Analysis ...",still open
Sigma-Aldrich,02/05/2023,A highly sensitive NanoLuc-based protease biosensor for detecting ...,still open
Sigma-Aldrich,02/05/2023,Zinc Sulfide Market Size 2023 Industry Recent Developments and ...,still open
Sigma-Aldrich,02/05/2023,"Sigma-Aldrich, GenOway Modify CRISPR Strategic Alliance",still open
Sigma-Aldrich,02/05/2023,"Motorcycle Carburetor Market Statistical Forecast, Trade Analysis ...",still open
Sigma-Aldrich,02/05/2023,Retinol (Vitamin A) Industry is Expected to Reach $8 Billion by 2028 ...,still open
Sigma-Aldrich,02/05/2023,Effects of nitrate and ammonium on assimilation of nitric oxide by ...,still open
Sigma-Aldrich,02/05/2023,﻿Microcontact Printing Market Report 2020 Market would Register a ...,still open
Sigma-Aldrich,02/05/2023,Neuropeptide Y Acetate Market to See Booming Growth 2023-2030 ...,still open
Sigma-Aldrich,02/05/2023,Nuclease Market 2023 Extensive Analysis on Global Industries and ...,still open
Sigma-Aldrich,02/05/2023,CRISPR and CAS Gene Market to See Booming Growth 2023-2030 ...,still open
Sigma-Aldrich,02/05/2023,Exponential Growth Expected for Gene Editing Kit Market With ...,still open
Sigma-Aldrich,02/05/2023,FUS-ALS hiPSC-derived astrocytes impair human motor units ...,still open
Sigma-Aldrich,02/05/2023,Exploring the Growth Potential and Opportunities of the Bone ...,still open
Sigma-Aldrich,02/05/2023,New C8-substituted caffeine derivatives as promising antioxidants ...,still open
Sigma-Aldrich,02/05/2023,Enantiomer Columns Market (Discount up to 70%) Discuss Ultimate ...,still open
Sigma-Aldrich,02/05/2023,Tumor organoid biobank-new platform for medical research ...,still open
Sigma-Aldrich,02/05/2023,Metabolic rewiring in MYC-driven medulloblastoma by BET ...,still open
Sigma-Aldrich,02/05/2023,Electric Fabric Shaver Market worth $7.3 billion by 2032 -Gleener ...,still open
Sigma-Aldrich,02/05/2023,γδ T cells are effectors of immunotherapy in cancers with HLA class I ...,still open
Sigma-Aldrich,02/05/2023,Role of miR-944/MMP10/AXL- axis in lymph node metastasis in ...,still open
Sigma-Aldrich,02/05/2023,Monoclonal Antibody Therapy Market 2023 Growth Outlook and ...,still open
Sigma-Aldrich,02/05/2023,Digital X-ray Imaging Market would Register a Healthy Growth of ...,still open
Sigma-Aldrich,02/05/2023,Species-specific immunogenicity and protective efficacy of a ...,still open
Sigma-Aldrich,02/05/2023,Spinal Fusion Devices Market is likely to expand US$ 2.5 Bn at 10.6 ...,still open
Sigma-Aldrich,02/05/2023,Countertop Spray Market Research Report 2023 - Werner & Mertz ...,still open
Sigma-Aldrich,02/05/2023,Agriculture Drones Market Giants Spending Is Going To Boom |DJI ...,still open
Sigma-Aldrich,02/05/2023,"Anti-Cut Gloves Market Research Report 2023 - Catu, Kimberly ...",still open
Sigma-Aldrich,02/05/2023,Music Publishing and Music Recordings Market 2022 by Keyplayers ...,still open
Sigma-Aldrich,02/05/2023,Exocytosis of the silicified cell wall of diatoms involves extensive ...,still open
Sigma-Aldrich,02/05/2023,"Diapers Market to Witness Huge Growth by 2029 -Braskem, SABIC ...",still open
Sigma-Aldrich,02/05/2023,Low frequency electrical waves in ensembles of proteinoid ...,still open
Sigma-Aldrich,02/05/2023,Sigma-Aldrich Licenses CRISPR-Cas9 Tech to Horizon Discovery,still open
Sigma-Aldrich,02/05/2023,Organic Polymer Tantalum Capacitors Market Upcoming Trends ...,still open
Sigma-Aldrich,02/05/2023,Nanofibers Market Giants Spending Is Going To Boom | Key Players ...,still open
Sigma-Aldrich,02/05/2023,"Plant Focused Dips Market Size, Development Data, Growth ...",still open
Sigma-Aldrich,02/05/2023,Pipeline Security Market 2022 key developmental strategies ...,still open
Sigma-Aldrich,02/05/2023,Aircraft Navigation Lens Market Is Thriving Worldwide-Cee Bailey's ...,still open
Sigma-Aldrich,02/05/2023,"Global Size Exclusion Columns Market Growth Factors, Applications, Regional Analysis | Agilent Technologies, M",still open
Sigma-Aldrich,02/05/2023,"Optical Microscope Immersion Oil Market to Witness Huge Growth by Key Players: Nikon, Cargille, Hardy Diagnost",still open
Sigma-Aldrich,02/05/2023,Food protein-derived amyloids do not accelerate amyloid β ...,still open
Sigma-Aldrich,02/05/2023,South America Plant Tissue Culture Market Demand with more competitive SWOT Analysis or Growth Trends,still open
Sigma-Aldrich,02/05/2023,Tissue-resident macrophages are major tumor-associated ...,still open
Sigma-Aldrich,02/05/2023,Sterilization Indicators Market Research Report: A Clear Picture of ...,still open
Sigma-Aldrich,02/05/2023,"Cell Line Development Market: Players tapping Emerging Markets | GE Healthcare, Lonza Group AG, Sartorious AG,",still open
Sigma-Aldrich,02/05/2023,Endodontic Irrigatos Market 2022 by Keyplayers and Vendors ...,still open
Sigma-Aldrich,02/05/2023,"Immunohistochemical Expression of IDH1, ATRX, Ki67, & GFAP | IJGM",still open
Sigma-Aldrich,02/05/2023,Future Scope of Fucosidosis Therapeutics Market: Industry Demands and Competitive Landscape Analysis 2023-2029,still open
Sigma-Aldrich,02/05/2023,Generation of Gαi knock-out HEK293 cells illuminates Gαi-coupling ...,still open
Sigma-Aldrich,02/05/2023,Synthesis of active packaging films from Lepidium sativum gum ...,still open
Sigma-Aldrich,02/05/2023,16 Ethical Dividend Stocks to Invest in Today,still open
Sigma-Aldrich,02/05/2023,"Amber Reagent Bottle Market Size, Industry Insights, Top Trends, Drivers, Growth & Forecast to 2029",still open
Sigma-Aldrich,02/05/2023,Sulfachloropyridazine Sodium Market to See Booming Growth 2023 ...,still open
Sigma-Aldrich,02/05/2023,Sigma-Aldrich Discloses $170M Price Tag for Cell Marque Buy,still open
Sigma-Aldrich,02/05/2023,"Incredible Growth of Electrophoresis Technology Market 2023 by Share, Size, Growth, Segments, Revenue and Top",still open
Sigma-Aldrich,02/05/2023,Research Report on Dipotassium Hydrogenphosphate Market Outlines Growth Opportunities & Industry Status,still open
Sigma-Aldrich,02/05/2023,Chemical spill reported in south St. Louis neighborhood,still open
Sigma-Aldrich,02/05/2023,Baking from the stockroom and an artistic avocado substitute,still open
Sigma-Aldrich,02/05/2023,"PTAB Redeclares Interference No. 106,132 and Suspends Priority ...",still open
Sigma-Aldrich,02/05/2023,Cisplatin/doxorubicin reduces cell viability in HCC | JHC,still open
Sigma-Aldrich,02/05/2023,TPPU inhibits inflammation-induced excessive autophagy to restore ...,still open
Sigma-Aldrich,02/05/2023,"Pregnant Radiation Suits Market Statistical Forecast, Trade Analysis ...",still open
Sigma-Aldrich,02/05/2023,Competition Newsletter - October 2022,still open
Sigma-Aldrich,02/05/2023,Atlanta's 500 Most Powerful Leaders in 2023: Professionals,still open
Sigma-Aldrich,02/05/2023,Wiskott-Aldrich syndrome protein forms nuclear condensates and ...,still open
Sigma-Aldrich,02/05/2023,Merck KGaA (German Merck) Buys Sigma-Aldrich For $17B,still open
Sigma-Aldrich,02/05/2023,Catalogues of complexity | Opinion,still open
Sigma-Aldrich,02/05/2023,Gloucester firefighters step up to BFit Challenge | Local News ...,still open
Sigma-Aldrich,02/05/2023,G is for gene-editing: The CRISPR landscape,still open
Sigma-Aldrich,02/05/2023,CRISPR and CAS Gene Market Future Business Opportunities 2023 ...,still open
Sigma-Aldrich,02/05/2023,Three-dimensional heart extracellular matrix enhances chemically ...,still open
Sigma-Aldrich,02/05/2023,Sigma-Aldrich Enters Co-Marketing Agreement with GenapSys for ...,still open
Sigma-Aldrich,02/05/2023,"Date set for closing of $17 billion Sigma-Aldrich, Merck deal - St ...",still open
Sigma-Aldrich,02/05/2023,Nano-Metal Oxides Market Report Covers Future Trends with ...,still open
Sigma-Aldrich,02/05/2023,Sigma-Aldrich Buys Duolink® Portfolio from Olink,still open
Sigma-Aldrich,02/05/2023,A mitotic chromatin phase transition prevents perforation by ...,still open
Sigma-Aldrich,02/05/2023,High Performance Liquid Chromatography (HPLC) Market ; Eminent Players -,still open
Sigma-Aldrich,02/05/2023,Sigma-Aldrich receives EXCiPACT GMP Certification,still open
Sigma-Aldrich,02/05/2023,Efficacy of soluble lansoprazole-impregnated beta-tricalcium ...,still open
Sigma-Aldrich,02/05/2023,Serum Free & Specialty Media Market 2023 by Keyplayers and ...,still open
Sigma-Aldrich,02/05/2023,Fucosidosis Therapeutics Market Detailed Analysis and Forecast up ...,still open
Sigma-Aldrich,02/05/2023,Pathogen evasion of social immunity,still open
Sigma-Aldrich,02/05/2023,Effects of nitrate and ammonium on assimilation of nitric oxide by ...,still open
Sigma-Aldrich,02/05/2023,Retinol (Vitamin A) Industry is Expected to Reach $8 Billion by 2028 ...,still open
Sigma-Aldrich,02/05/2023,Impact of short chain fatty acids (SCFAs) on antimicrobial activity of ...,still open
Sigma-Aldrich,02/05/2023,Overexpression of the NEK9–EG5 axis is a novel metastatic marker ...,still open
Sigma-Aldrich,02/05/2023,A vein wall cell atlas of murine venous thrombosis determined by ...,still open
Sigma-Aldrich,02/05/2023,16 Ethical Dividend Stocks to Invest in Today,still open
Sigma-Aldrich,02/05/2023,Stock Market | FinancialContent Business Page,still open
Sigma-Aldrich,02/05/2023,DNase I and chitosan enhance efficacy of ceftazidime to eradicate ...,still open
Sigma-Aldrich,02/05/2023,High-throughput analysis of the transcriptional patterns of sexual ...,still open
Sigma-Aldrich,02/05/2023,The antidiabetic drug metformin aids bacteria in hijacking vitamin ...,still open
Sigma-Aldrich,02/05/2023,Poly(vinyl alcohol) freeze casts with nano-additives as potential ...,still open
Sigma-Aldrich,02/05/2023,Gradual release of alendronate for treatment of bone defects | IJN,still open
Sigma-Aldrich,02/05/2023,Tissue-resident macrophages are major tumor-associated ...,still open
Sigma-Aldrich,02/05/2023,Meet the Philly Food Scientists Who Can Make a Potato Chip Taste ...,still open
Sigma-Aldrich,02/05/2023,Food protein-derived amyloids do not accelerate amyloid β ...,still open
Sigma-Aldrich,02/05/2023,Cell Separation Market to Continue Impressive Measured Growth ...,still open
Sigma-Aldrich,02/05/2023,"Sigma-Aldrich, GenOway Modify CRISPR Strategic Alliance",still open
Sigma-Aldrich,02/05/2023,"Chemical evidence for milk, meat, and marine resource processing ...",still open
Sigma-Aldrich,02/05/2023,Screening of lactic acid bacteria strains isolated from Iranian ...,still open
Sigma-Aldrich,02/05/2023,TPPU inhibits inflammation-induced excessive autophagy to restore ...,still open
Sigma-Aldrich,02/05/2023,Sigma-Aldrich Licenses CRISPR-Cas9 Tech to Horizon Discovery,still open
Sigma-Aldrich,02/05/2023,Identification of astrocyte regulators by nucleic acid cytometry,still open
Sigma-Aldrich,02/05/2023,Sigma Share Price Today | %EXCHANGE_SYMBOL% SIAL Stock,still open
Sigma-Aldrich,02/05/2023,Merck to Acquire Sigma-Aldrich to Enhance Position in Attractive ...,still open
Sigma-Aldrich,02/05/2023,Curate Biosciences Announces David Backer as Chief Executive ...,still open
Sigma-Aldrich,02/05/2023,Catalogues of complexity | Opinion,still open
Sigma-Aldrich,02/05/2023,Nicklaus: Emerson remakes itself for growth. Let's hope it hasn't ...,still open
Sigma-Aldrich,02/05/2023,Antibody targeting of E3 ubiquitin ligases for receptor degradation,still open
Sigma-Aldrich,02/05/2023,What Does Sigma-Aldrich Do,still open
Sigma-Aldrich,02/05/2023,Catalytic activity imperative for nanoparticle dose enhancement in ...,still open
Sigma-Aldrich,02/05/2023,Sigma-Aldrich Announces Agreement on Assets Sale to Honeywell ...,still open
Sigma-Aldrich,02/05/2023,A mitotic chromatin phase transition prevents perforation by ...,still open
Sigma-Aldrich,02/05/2023,High-fat diet causes mechanical allodynia in the absence of injury or ...,still open
Sigma-Aldrich,02/05/2023,Axalta Coating CEO Bryant to depart effective August 31 (NYSE:AXTA),still open
Sigma-Aldrich,02/05/2023,Global Cell And Tissue Culture Supplies Market Size To Exceed ...,still open
Sigma-Aldrich,02/05/2023,Flavors and Fragrances Global Market Report 2022,still open
Sigma-Aldrich,02/05/2023,L-threonine promotes healthspan by expediting ferritin-dependent ...,still open
Sigma-Aldrich,02/05/2023,Apoptotic brown adipocytes enhance energy expenditure via ...,still open
Sigma-Aldrich,02/05/2023,"RNAi Technology Global Market Report 2022: Featuring QIAGEN, Phio Pharmaceuticals, Ionis Pharmaceuticals, Benitec Biopharma & More",still open
Sigma-Aldrich,02/05/2023,Inhibition of FKBP51 induces stress resilience and alters ...,still open
Sigma-Aldrich,02/05/2023,Early macrophage response to obesity encompasses Interferon ...,still open
Sigma-Aldrich,02/05/2023,DNA repair during nonreductional meiosis in the asexual rotifer ...,still open
Sigma-Aldrich,02/05/2023,Zymoseptoria tritici white-collar complex integrates light ...,still open
Sigma-Aldrich,02/05/2023,Phloretin enhances remyelination by stimulating oligodendrocyte ...,still open
Sigma-Aldrich,02/05/2023,Resistance of Dickeya solani strain IPO 2222 to lytic bacteriophage ...,still open
Sigma-Aldrich,02/05/2023,Tecovirimat is effective against human monkeypox virus in vitro at ...,still open
Sigma-Aldrich,02/05/2023,Fast DNA-PAINT imaging using a deep neural network,still open
Sigma-Aldrich,02/05/2023,A lab-on-a-chip for the concurrent electrochemical detection of ...,still open
Sigma-Aldrich,02/05/2023,Molecular data storage with zero synthetic effort and simple read-out ...,still open
Sigma-Aldrich,02/05/2023,β subunits of GABAA receptors form proton-gated chloride channels ...,still open
Sigma-Aldrich,02/05/2023,CRISPR activation screen identifies TGFβ-associated PEG10 as a ...,still open
Sigma-Aldrich,02/05/2023,Analysis of hyperforin (St. John's wort) action at TRPC6 channel ...,still open
Sigma-Aldrich,02/05/2023,"Real time PCR (QPCR) Market Size 2022 Exhibits 8.73% CAGR to Reach USD 10,880.30 Million by 2030 | Adroit Market Research",still open
Sigma-Aldrich,02/05/2023,Transplanting rejuvenated blood stem cells extends lifespan of aged ...,still open
Sigma-Aldrich,02/05/2023,Food Amino Acids Market Size Worth $10.58 Bn by 2028 | Vantage Market Research,still open
Sigma-Aldrich,02/05/2023,The membrane-active polyaminoisoprenyl compound NV716 re ...,still open
Sigma-Aldrich,02/05/2023,Guiding cell migration in 3D with high-resolution photografting ...,still open
Sigma-Aldrich,02/05/2023,Rapid antibiotic susceptibility testing and species identification for ...,still open
Sigma-Aldrich,02/05/2023,"Emerson sells part of business, says it would consider leaving St ...",still open
Sigma-Aldrich,02/05/2023,A comprehensive update to the Mycobacterium tuberculosis H37Rv ...,still open
Sigma-Aldrich,02/05/2023,A statistical framework for high-content phenotypic profiling using ...,still open
Sigma-Aldrich,02/05/2023,Mitochondrial RNA modifications shape metabolic plasticity in ...,still open
Sigma-Aldrich,02/05/2023,Ferritin-mediated iron detoxification promotes hypothermia survival ...,still open
Sigma-Aldrich,02/05/2023,A gut-derived hormone suppresses sugar appetite and regulates ...,still open
Sigma-Aldrich,02/05/2023,Retinol (Vitamin A) Global Market Report 2022: Rising Prevalence of Eye and Skin Diseases Bolsters Sector Growth,still open
Sigma-Aldrich,02/05/2023,Verteporfin ameliorates fibrotic aspects of Dupuytren's disease ...,still open
Sigma-Aldrich,02/05/2023,The endocannabinoid anandamide is an airway relaxant in health ...,still open
Sigma-Aldrich,02/05/2023,Understanding soil selenium accumulation and bioavailability ...,still open
Sigma-Aldrich,02/05/2023,PI3K drives the de novo synthesis of coenzyme A from vitamin B5,still open
Sigma-Aldrich,02/05/2023,Omicron BA.4/BA.5 escape neutralizing immunity elicited by BA.1 ...,still open
Sigma-Aldrich,02/05/2023,Compensatory epistasis maintains ACE2 affinity in SARS-CoV-2 ...,still open
Sigma-Aldrich,02/05/2023,Amoebicidal activity of cationic carbosilane dendrons derived with 4 ...,still open
Sigma-Aldrich,02/05/2023,Mechanism for selective binding of aromatic compounds on oxygen ...,still open
Sigma-Aldrich,02/05/2023,Candida albicans evades NK cell elimination via binding of ...,still open
Sigma-Aldrich,02/05/2023,Biofortified tomatoes provide a new route to vitamin D sufficiency,still open
Sigma-Aldrich,02/05/2023,Serotonin limits generation of chromaffin cells during adrenal organ ...,still open
Sigma-Aldrich,02/05/2023,Think Chemicals. Think SLS.,still open
Sigma-Aldrich,02/05/2023,Exosomes decorated with a recombinant SARS-CoV-2 receptor ...,still open
Sigma-Aldrich,02/05/2023,MilliporeSigma Announces a Boost in Commercial Capacity in ...,still open
Sigma-Aldrich,02/05/2023,Endocytosis-like DNA uptake by cell wall-deficient bacteria,still open
Sigma-Aldrich,02/05/2023,Assessment of the biofilm-forming ability on solid surfaces of ...,still open
Sigma-Aldrich,02/05/2023,MilliporeSigma's Chris Famolare Named Environment+Energy Leader 50 Honoree,still open
Sigma-Aldrich,02/05/2023,Molecularly cleavable bioinks facilitate high-performance digital light ...,still open
Sigma-Aldrich,02/05/2023,Receptor for advanced glycation end-products (RAGE) mediates ...,still open
Sigma-Aldrich,02/05/2023,Synthesis of natural product hybrids by the Ugi reaction in complex ...,still open
Sigma-Aldrich,02/05/2023,Depletion of oocyte dynamin-related protein 1 shows maternal-effect ...,still open
Sigma-Aldrich,02/05/2023,Antimicrobial properties of chitosan from different developmental ...,still open
Sigma-Aldrich,02/05/2023,Loss of NECTIN1 triggers melanoma dissemination upon local IGF1 ...,still open
Sigma-Aldrich,02/05/2023,Development of a pentavalent broadly protective nucleoside ...,still open
Sigma-Aldrich,02/05/2023,Enhanced metanephric specification to functional proximal tubule ...,still open
Sigma-Aldrich,02/05/2023,Design of combination therapy for engineered bacterial therapeutics ...,still open
Sigma-Aldrich,02/05/2023,Butyrate reduces cellular magnesium absorption independently of ...,still open
Sigma-Aldrich,02/05/2023,Selective removal of some heavy metals from Lanthanide solution ...,still open
Sigma-Aldrich,02/05/2023,Brain motor and fear circuits regulate leukocytes during acute stress,still open
Sigma-Aldrich,02/05/2023,What the PTAB's CRISPR-Cas9 Decision for Broad Institute Means ...,still open
Sigma-Aldrich,02/05/2023,SARS-CoV-2 infection produces chronic pulmonary epithelial and ...,still open
Sigma-Aldrich,02/05/2023,Pneumolysin boosts the neuroinflammatory response to ...,still open
Sigma-Aldrich,02/05/2023,High Purity Metals Market is booming Globally with Top key players ...,still open
Sigma-Aldrich,02/05/2023,Cinnamoyl Chloride Market worth $7.3 billion by 2027 -Tci chemical ...,still open
Sigma-Aldrich,02/05/2023,Classical Cell Culture Media Market is Expected to Reach US ...,still open
Sigma-Aldrich,02/05/2023,Serum-Free Media (SFM) Market Size & Analysis By 2022 -2029 ...,still open
Sigma-Aldrich,02/05/2023,Fucosidosis Therapeutics Market Detailed Analysis and Forecast up ...,still open
Sigma-Aldrich,02/05/2023,NanoBioTechnology (NBT) Market Booming at a CAGR of +15% by ...,still open
Sigma-Aldrich,02/05/2023,Halogen Based Biocides Market Growing at a CAGR 73.0% - Key ...,still open
Sigma-Aldrich,02/05/2023,Top Stories of 2022: #5 to #7 | McDonnell Boehnen Hulbert ...,still open
Sigma-Aldrich,02/05/2023,Chiral Separation Column Market Future Plans and Industry Growth ...,still open
Sigma-Aldrich,02/05/2023,"Rhodium Catalyst Market Size [2023-2029] -BASF, Vineeth ...",still open
Sigma-Aldrich,02/05/2023,"Life Science Products Market Size, Share, Growth Statistics By Top ...",still open
Sigma-Aldrich,02/05/2023,"CRISPR and CAS Gene Market Upcoming Trends, Industry Growth ...",still open
Sigma-Aldrich,02/05/2023,"PTAB Rules on Preliminary Motions in Interference No. 106,133",still open
Sigma-Aldrich,02/05/2023,Osteopontin Protein Market 2023 key developmental strategies ...,still open
Sigma-Aldrich,02/05/2023,Pathogen evasion of social immunity,still open
Sigma-Aldrich,02/05/2023,Folin Phenol Reagent Market 2023 – 2030: Latest Research Report ...,still open
Sigma-Aldrich,02/05/2023,Draft genomes of Blastocystis subtypes from human samples of ...,still open
Sigma-Aldrich,02/05/2023,Pre-coated Plates Market - 37% of Growth to Originate from APAC ...,still open
Sigma-Aldrich,02/05/2023,Viral Vector and Plasmid DNA Manufacturing Market to See ...,still open
Sigma-Aldrich,02/05/2023,﻿Protein Characterization and Identification Market Size & Analysis ...,still open
Sigma-Aldrich,02/05/2023,Trail Cameras Market Research Report 2023 - Cambridge Isotope ...,still open
Sigma-Aldrich,02/05/2023,"2-Chloroethanol Market Size, Development Data, Growth Analysis ...",still open
Sigma-Aldrich,02/05/2023,A highly sensitive NanoLuc-based protease biosensor for detecting ...,still open
Sigma-Aldrich,02/05/2023,Zinc Sulfide Market Size 2023 Industry Recent Developments and ...,still open
Sigma-Aldrich,02/05/2023,"Sigma-Aldrich, GenOway Modify CRISPR Strategic Alliance",still open
Sigma-Aldrich,02/05/2023,"Motorcycle Carburetor Market Statistical Forecast, Trade Analysis ...",still open
Sigma-Aldrich,02/05/2023,Retinol (Vitamin A) Industry is Expected to Reach $8 Billion by 2028 ...,still open
Sigma-Aldrich,02/05/2023,Effects of nitrate and ammonium on assimilation of nitric oxide by ...,still open
Sigma-Aldrich,02/05/2023,﻿Microcontact Printing Market Report 2020 Market would Register a ...,still open
Sigma-Aldrich,02/05/2023,Neuropeptide Y Acetate Market to See Booming Growth 2023-2030 ...,still open
Sigma-Aldrich,02/05/2023,Nuclease Market 2023 Extensive Analysis on Global Industries and ...,still open
Sigma-Aldrich,02/05/2023,CRISPR and CAS Gene Market to See Booming Growth 2023-2030 ...,still open
Sigma-Aldrich,02/05/2023,Exponential Growth Expected for Gene Editing Kit Market With ...,still open
Sigma-Aldrich,02/05/2023,FUS-ALS hiPSC-derived astrocytes impair human motor units ...,still open
Sigma-Aldrich,02/05/2023,Exploring the Growth Potential and Opportunities of the Bone ...,still open
Sigma-Aldrich,02/05/2023,New C8-substituted caffeine derivatives as promising antioxidants ...,still open
Sigma-Aldrich,02/05/2023,Enantiomer Columns Market (Discount up to 70%) Discuss Ultimate ...,still open
Sigma-Aldrich,02/05/2023,Tumor organoid biobank-new platform for medical research ...,still open
Sigma-Aldrich,02/05/2023,Metabolic rewiring in MYC-driven medulloblastoma by BET ...,still open
Sigma-Aldrich,02/05/2023,Electric Fabric Shaver Market worth $7.3 billion by 2032 -Gleener ...,still open
Sigma-Aldrich,02/05/2023,γδ T cells are effectors of immunotherapy in cancers with HLA class I ...,still open
Sigma-Aldrich,02/05/2023,Role of miR-944/MMP10/AXL- axis in lymph node metastasis in ...,still open
Sigma-Aldrich,02/05/2023,Monoclonal Antibody Therapy Market 2023 Growth Outlook and ...,still open
Sigma-Aldrich,02/05/2023,Digital X-ray Imaging Market would Register a Healthy Growth of ...,still open
Sigma-Aldrich,02/05/2023,Species-specific immunogenicity and protective efficacy of a ...,still open
Sigma-Aldrich,02/05/2023,Spinal Fusion Devices Market is likely to expand US$ 2.5 Bn at 10.6 ...,still open
Sigma-Aldrich,02/05/2023,Countertop Spray Market Research Report 2023 - Werner & Mertz ...,still open
Sigma-Aldrich,02/05/2023,Agriculture Drones Market Giants Spending Is Going To Boom |DJI ...,still open
