Name,Data,News,Evaluation
Sigma-Aldrich,02/21/2023,Calcium Chromate Market Current Status and Future Prospects ...,still open
Sigma-Aldrich,02/21/2023,Classical Cell Culture Media Market 2023 Segments Analysis by ...,still open
Sigma-Aldrich,02/21/2023,Fluorescent Lipid Probe Industry is Expected to Reach $8 Billion by ...,still open
Sigma-Aldrich,02/21/2023,"Quinic Acid Market Research Report 2023 - Merck Group, Thermo ...",still open
Sigma-Aldrich,02/21/2023,Serum Free & Specialty Media Market Upcoming Trends ...,still open
Sigma-Aldrich,02/21/2023,Electroporation Instruments Market to Witness Huge Growth by 2029 ...,still open
Sigma-Aldrich,02/21/2023,Spherical rotary cell seeding system for production of small-caliber ...,still open
Sigma-Aldrich,02/21/2023,Fluorescence Probes Market is expected to reach a value of 2027 ...,still open
Sigma-Aldrich,02/21/2023,Ammonium Pentaborate Octahydrate Market is booming Globally ...,still open
Sigma-Aldrich,02/21/2023,Real Time PCR Fluorescent Probe Market 2023 Segments Analysis ...,still open
Sigma-Aldrich,02/21/2023,"ELISA POT Assay Kits Market Size, Development Data, Growth ...",still open
Sigma-Aldrich,02/21/2023,Quantum Dot Technology Market is Set To Fly High in Years to ...,still open
Sigma-Aldrich,02/21/2023,Platelet Derived Growth Factor Market To Grow Extensively At ...,still open
Sigma-Aldrich,02/21/2023,Cycloheximide (CAS 66-81-9) Market – A Comprehensive Study by ...,still open
Sigma-Aldrich,02/21/2023,"Grignard Reagents Market is booming across the globe explored in the latest research by 2030|Sigma-Aldrich, Al",still open
Sigma-Aldrich,02/21/2023,"Uncoupling Protein Market Research Report 2023 - EDQM, United ...",still open
Sigma-Aldrich,02/21/2023,"PTAB Rules on Preliminary Motions in Interference No. 106,133",still open
Sigma-Aldrich,02/21/2023,Size Exclusion Columns Market Size and Forecast to 2029 -Sigma ...,still open
Sigma-Aldrich,02/21/2023,Suramin Sodium Market 2023 key developmental strategies ...,still open
Sigma-Aldrich,02/21/2023,Biochip Market worth $7.3 billion by 2027 -Abbott Laboratories ...,still open
Sigma-Aldrich,02/21/2023,"Myelin Basic Protein Market Statistical Forecast, Trade Analysis ...",still open
Sigma-Aldrich,02/21/2023,"Phycoerythrin Market Size, Share, Growth Statistics By Top Key ...",still open
Sigma-Aldrich,02/21/2023,Food Thickeners Market Size & Analysis By 2023 -2029 -Cargill ...,still open
Sigma-Aldrich,02/21/2023,Genetic Chronic Obstructive Pulmonary Disease (COPD) Market to ...,still open
Sigma-Aldrich,02/21/2023,Immunoassay Instruments Market to Accelerate Growth with ...,still open
Sigma-Aldrich,02/21/2023,Hydrophilic Interaction Columns Market Size And Forecast -Sigma ...,still open
Sigma-Aldrich,02/21/2023,Cell Culture Inserts Market to Witness Huge Growth by 2029 ...,still open
Sigma-Aldrich,02/21/2023,Formula Fed Calf Serum Market is booming Globally with Top key ...,still open
Sigma-Aldrich,02/21/2023,Zinc Sulfide Market is booming Globally with Top key players-Dow ...,still open
Sigma-Aldrich,02/21/2023,Methanol-D4 Market Overview 2023-2029| Key Players –Sigma ...,still open
Sigma-Aldrich,02/21/2023,White Fungus Drugs Market Booming Worldwide With Leading Key ...,still open
Sigma-Aldrich,02/21/2023,Genetic Chronic Obstructive Pulmonary Disease (COPD) Market is ...,still open
Sigma-Aldrich,02/21/2023,Precast Gels Market To Grow Extensively At Unstoppable Rate ...,still open
Sigma-Aldrich,02/21/2023,Alkaline Proteases Market Overview 2023-2029| Key Players –Ab ...,still open
Sigma-Aldrich,02/21/2023,Laboratory Filtration Market Size and Outlook 2023 by Competitive ...,still open
Sigma-Aldrich,02/21/2023,Nitazoxanide inhibits acetylated KLF5-induced bone metastasis by ...,still open
Sigma-Aldrich,02/21/2023,Ferric Fluoride Market Booming Worldwide With Leading Key ...,still open
Sigma-Aldrich,02/21/2023,The Alzheimer's disease-linked protease BACE1 modulates ...,still open
Sigma-Aldrich,02/21/2023,Biopreservation Market Report Covers Future Trends with Research ...,still open
Sigma-Aldrich,02/21/2023,Keyhole Limpet Hemocyanin (KLH) Market Overview 2023-2029 ...,still open
Sigma-Aldrich,02/21/2023,Red Blood Cell Lysis Buffer Market Size And Forecast -Sigma ...,still open
Sigma-Aldrich,02/21/2023,"Insights into Digital Diagnostics Market Growth 2023: Size, Share ...",still open
Sigma-Aldrich,02/21/2023,Quantum Dots Market is Projected To Grow At A CAGR of 31.1 ...,still open
Sigma-Aldrich,02/21/2023,Primary Antibodies Market To Grow Extensively At Unstoppable ...,still open
Sigma-Aldrich,02/21/2023,Mitochondrial Complex Activity Assay Kits Market Size And Forecast ...,still open
Sigma-Aldrich,02/21/2023,Cinnamoyl Chloride Market worth $7.3 billion by 2027 -Tci chemical ...,still open
Sigma-Aldrich,02/21/2023,Prostate cancer cell-platelet bidirectional signaling promotes ...,still open
Sigma-Aldrich,02/21/2023,"Rice-memolin, a novel peptide derived from rice bran, improves ...",still open
Sigma-Aldrich,02/21/2023,"Nucleic Acid Detection Kits Market Top-Companies Offerings, By ...",still open
Sigma-Aldrich,02/21/2023,Sterile Filtration Market is expected to reach a value of USD ...,still open
Sigma-Aldrich,02/21/2023,Pharmacological ischemic conditioning (PIC) with roxadustat | JPR,still open
Sigma-Aldrich,02/21/2023,Trail Cameras Market Research Report 2023 - Cambridge Isotope ...,still open
Sigma-Aldrich,02/21/2023,Protein Expression Systems Market Booming Worldwide With ...,still open
Sigma-Aldrich,02/21/2023,"Live Cell Imaging Market Strategy for Excellent Growth, Highest ...",still open
Sigma-Aldrich,02/21/2023,Microbiological Testing of Water Market worth $7.3 billion by 2027 ...,still open
Sigma-Aldrich,02/21/2023,Analytical Testing of Nitrosamines in Drugs and Food,still open
Sigma-Aldrich,02/21/2023,"Thymoquinone Market Size, Share, Growth Statistics By Top Key ...",still open
Sigma-Aldrich,02/21/2023,"Cryogenic Vials Market Size, Share, Growth Statistics By Top Key ...",still open
Sigma-Aldrich,02/21/2023,NanoBioTechnology (NBT) Market Booming at a CAGR of +15% by ...,still open
Sigma-Aldrich,02/21/2023,Metagenomics Next Generation Sequencing Market to Flourish with an Impressive CAGR 17% by 2030 Top Key Players,still open
Sigma-Aldrich,02/21/2023,Muconic Acid Market Biggest Innovation with Top Key Players ...,still open
Sigma-Aldrich,02/21/2023,A novel transgenic mouse model expressing primate-specific ...,still open
Sigma-Aldrich,02/21/2023,Chromatography Accessories and Consumables Market Size And ...,still open
Sigma-Aldrich,02/21/2023,Micro Bioreactors Market Size & Analysis By 2023 -2029 ...,still open
Sigma-Aldrich,02/21/2023,Barrier-to-autointegration factor 1 promotes gammaherpesvirus ...,still open
Sigma-Aldrich,02/21/2023,Laboratory Plasticware Market is expected to reach a value of 2027 ...,still open
Sigma-Aldrich,02/21/2023,Sodium Ethasulfate Market Growing at a CAGR 73.0% - Key Player ...,still open
Sigma-Aldrich,02/21/2023,Curate Bio Launches First Commercial Product,still open
Sigma-Aldrich,02/21/2023,Ethyl Levulinate Market Research Report 2023 - Alfa Aesar ...,still open
Sigma-Aldrich,02/21/2023,Water-in-salt electrolytes made saltier by Gemini ionic liquids for ...,still open
Sigma-Aldrich,02/21/2023,Extemporaneous Compounding of Amoxicillin Suspensions During ...,still open
Sigma-Aldrich,02/21/2023,DNA Methylation Sequencing Market is expected to Exhibit a ...,still open
Sigma-Aldrich,02/21/2023,"Anisole Market Giants Spending Is Going To Boom |Evonik, Atul ...",still open
Sigma-Aldrich,02/21/2023,Beta-Eudesmol Market Size And Forecast -Santa Cruz ...,still open
Sigma-Aldrich,02/21/2023,Holding Pipette Market Biggest Innovation with Top Key Players ...,still open
Sigma-Aldrich,02/21/2023,Effect of in vitro cultivation on human gut microbiota composition ...,still open
Sigma-Aldrich,02/21/2023,Serum Free & Specialty Media Market Size And Forecast -Life ...,still open
Sigma-Aldrich,02/21/2023,"Effect of a combination of pea protein, grape seed extract and lactic ...",still open
Sigma-Aldrich,02/21/2023,Lidocaine Hydrochloride Market worth $7.3 billion by 2027 -Zuche ...,still open
Sigma-Aldrich,02/21/2023,High Purity Metals Market is booming Globally with Top key players ...,still open
Sigma-Aldrich,02/21/2023,CVD SiC Market To Grow Extensively At Unstoppable Rate |Tokai ...,still open
Sigma-Aldrich,02/21/2023,"Rhodium Carbonyl Market Size [2023-2029] -BASF, Vineeth ...",still open
Sigma-Aldrich,02/21/2023,"CRISPR and CAS Gene Market Upcoming Trends, Industry Growth ...",still open
Sigma-Aldrich,02/21/2023,Gold Nanoparticles Market 2023 Segments Analysis by Top Key ...,still open
Sigma-Aldrich,02/21/2023,Dark microbiome and extremely low organics in Atacama fossil delta ...,still open
Sigma-Aldrich,02/21/2023,"AuNPs Market worth $7.3 billion by 2027 -Nanopartz, Nanocs ...",still open
Sigma-Aldrich,02/21/2023,Classical Cell Culture Media Market is Predicted to Reach US ...,still open
Sigma-Aldrich,02/21/2023,Surface nanoengineering technology for the removal of sulfur ...,still open
Sigma-Aldrich,02/21/2023,Chiral Separation Column Market Future Plans and Industry Growth ...,still open
Sigma-Aldrich,02/21/2023,A validated LC–MS/MS method for clinical pharmacokinetics and ...,still open
Sigma-Aldrich,02/21/2023,"High Purity Inorganic Reagent market: Key Pitfalls to Encounter in 2023 | AccuStandard, Kanto Chemical, Kronox",still open
Sigma-Aldrich,02/21/2023,Perturbed iron biology in the prefrontal cortex of people with ...,still open
Sigma-Aldrich,02/21/2023,Atlas Cedar Oil Market worth $7.3 billion by 2027 -Xi'an Taima ...,still open
Sigma-Aldrich,02/21/2023,Protein Expression And Purification Technology Market Size & ...,still open
Sigma-Aldrich,02/21/2023,Primary Cell Media Market Booming Worldwide With Leading Key ...,still open
Sigma-Aldrich,02/21/2023,A highly sensitive NanoLuc-based protease biosensor for detecting ...,still open
Sigma-Aldrich,02/21/2023,Calcium Chromate Market Current Status and Future Prospects ...,still open
Sigma-Aldrich,02/21/2023,"Grignard Reagents Market is booming across the globe explored in the latest research by 2030|Sigma-Aldrich, Al",still open
Sigma-Aldrich,02/21/2023,Formula Fed Calf Serum Market is booming Globally with Top key ...,still open
Sigma-Aldrich,02/21/2023,Fungal cell barriers and organelles are disrupted by ...,still open
Sigma-Aldrich,02/21/2023,Stock Market,still open
Sigma-Aldrich,02/21/2023,Barrier-to-autointegration factor 1 promotes gammaherpesvirus ...,still open
Sigma-Aldrich,02/21/2023,Pathogen evasion of social immunity,still open
Sigma-Aldrich,02/21/2023,Decoding the metabolic response of Escherichia coli for sensing ...,still open
Sigma-Aldrich,02/21/2023,Methionine adenosyltransferase2A inhibition restores metabolism to ...,still open
Sigma-Aldrich,02/21/2023,The AP-1 transcription factor Fosl-2 drives cardiac fibrosis and ...,still open
Sigma-Aldrich,02/21/2023,"Effect of a combination of pea protein, grape seed extract and lactic ...",still open
Sigma-Aldrich,02/21/2023,Surface nanoengineering technology for the removal of sulfur ...,still open
Sigma-Aldrich,02/21/2023,A validated LC–MS/MS method for clinical pharmacokinetics and ...,still open
Sigma-Aldrich,02/21/2023,Impact of short chain fatty acids (SCFAs) on antimicrobial activity of ...,still open
Sigma-Aldrich,02/21/2023,Serum Free & Specialty Media Market 2023 by Keyplayers and ...,still open
Sigma-Aldrich,02/21/2023,Neuroprotective and antioxidant properties of new quinolylnitrones ...,still open
Sigma-Aldrich,02/21/2023,Improving morphology and optoelectronic properties of ultra-wide ...,still open
Sigma-Aldrich,02/21/2023,Differences in skin test reactions to official and defined antigens in ...,still open
Sigma-Aldrich,02/21/2023,Beneficial behavioral effects of chronic cerebral dopamine ...,still open
Sigma-Aldrich,02/21/2023,Stock Market | FinancialContent Business Page,still open
Sigma-Aldrich,02/21/2023,Ultra-long-acting in-situ forming implants with cabotegravir protect ...,still open
Sigma-Aldrich,02/21/2023,Metabolic profiles and fingerprints for the investigation of the ...,still open
Sigma-Aldrich,02/21/2023,Retinol (Vitamin A) Industry is Expected to Reach $8 Billion by 2028 ...,still open
Sigma-Aldrich,02/21/2023,Stock Market | FinancialContent Business Page,still open
Sigma-Aldrich,02/21/2023,A vein wall cell atlas of murine venous thrombosis determined by ...,still open
Sigma-Aldrich,02/21/2023,Morpho-physiological and biochemical response of wheat to various ...,still open
Sigma-Aldrich,02/21/2023,MJL-1 is a nuclear envelope protein required for homologous ...,still open
Sigma-Aldrich,02/21/2023,Stock Market,still open
Sigma-Aldrich,02/21/2023,Stability evaluation and validation of appropriate reference genes for ...,still open
Sigma-Aldrich,02/21/2023,Association of polysialic acid serum levels with schizophrenia ...,still open
Sigma-Aldrich,02/21/2023,Potential roles of acyl homoserine lactones (AHLs) in nitrifying ...,still open
Sigma-Aldrich,02/21/2023,The antidiabetic drug metformin aids bacteria in hijacking vitamin ...,still open
Sigma-Aldrich,02/21/2023,Cryonics Technology Market Size & Analysis By 2022 -2029 -Praxair ...,still open
Sigma-Aldrich,02/21/2023,Preparing for the next influenza season | IDR,still open
Sigma-Aldrich,02/21/2023,Gradual release of alendronate for treatment of bone defects | IJN,still open
Sigma-Aldrich,02/21/2023,Standardisation challenges in complement activation assays. | IJN,still open
Sigma-Aldrich,02/21/2023,Adolescent Humans and Chimpanzees Share Risk-Taking Impulses,still open
Sigma-Aldrich,02/21/2023,Cell survival following direct executioner-caspase activation ...,still open
Sigma-Aldrich,02/21/2023,Sigma Share Price Today | NASDAQ SIAL Stock,still open
Sigma-Aldrich,02/21/2023,Identification of astrocyte regulators by nucleic acid cytometry,still open
Sigma-Aldrich,02/21/2023,Effects of nitrate and ammonium on assimilation of nitric oxide by ...,still open
Sigma-Aldrich,02/21/2023,Update: The Sigma-Aldrich Takeover - Merck KGaA's Way To ...,still open
Sigma-Aldrich,02/21/2023,Merck to Acquire Sigma-Aldrich to Enhance Position in Attractive ...,still open
Sigma-Aldrich,02/21/2023,16 Ethical Dividend Stocks to Invest in Today,still open
Sigma-Aldrich,02/21/2023,Curate Biosciences Announces David Backer as Chief Executive ...,still open
Sigma-Aldrich,02/21/2023,Nicklaus: Emerson remakes itself for growth. Let's hope it hasn't ...,still open
Sigma-Aldrich,02/21/2023,Antibody targeting of E3 ubiquitin ligases for receptor degradation,still open
Sigma-Aldrich,02/21/2023,MilliporeSigma Announces a Boost in Commercial Capacity in ...,still open
Sigma-Aldrich,02/21/2023,Bacterial And Plasmid Vectors Global Market Report 2023,still open
Sigma-Aldrich,02/21/2023,What Does Sigma-Aldrich Do,still open
Sigma-Aldrich,02/21/2023,Sigma-Aldrich Announces Agreement on Assets Sale to Honeywell ...,still open
Sigma-Aldrich,02/21/2023,Sannova Appoints Jason Apter as CEO and Stephen Unger as CFO,still open
Sigma-Aldrich,02/21/2023,A mitotic chromatin phase transition prevents perforation by ...,still open
Sigma-Aldrich,02/21/2023,Catalogues of complexity | Opinion,still open
Sigma-Aldrich,02/21/2023,Global Silicon Metal Market to Worth $10.92 Billion | Silicon Production to Quadrupole by 2030 in Silicon Metal Market,still open
Sigma-Aldrich,02/21/2023,"EXT1 Antibody Market Statistical Forecast, Trade Analysis 2023 ...",still open
Sigma-Aldrich,02/21/2023,Global Cell And Tissue Culture Supplies Market Size To Exceed 58.3 billion by 2030,still open
Sigma-Aldrich,02/21/2023,Flavors and Fragrances Global Market Report 2022,still open
Sigma-Aldrich,02/21/2023,Catalytic activity imperative for nanoparticle dose enhancement in ...,still open
Sigma-Aldrich,02/21/2023,High-fat diet causes mechanical allodynia in the absence of injury or ...,still open
Sigma-Aldrich,02/21/2023,Axalta Coating CEO Bryant to depart effective August 31 (NYSE:AXTA),still open
Sigma-Aldrich,02/21/2023,L-threonine promotes healthspan by expediting ferritin-dependent ...,still open
Sigma-Aldrich,02/21/2023,Apoptotic brown adipocytes enhance energy expenditure via ...,still open
Sigma-Aldrich,02/21/2023,Phloretin enhances remyelination by stimulating oligodendrocyte ...,still open
Sigma-Aldrich,02/21/2023,Fast DNA-PAINT imaging using a deep neural network,still open
Sigma-Aldrich,02/21/2023,Inhibition of FKBP51 induces stress resilience and alters ...,still open
Sigma-Aldrich,02/21/2023,Think Chemicals. Think SLS.,still open
Sigma-Aldrich,02/21/2023,Early macrophage response to obesity encompasses Interferon ...,still open
Sigma-Aldrich,02/21/2023,"Dimethyl Sulfoxide (DMSO) Market is Projected to Reach $360 Million by 2030 Globally, at a CAGR of 6.1%, says MarketsandMarkets™",still open
Sigma-Aldrich,02/21/2023,Zymoseptoria tritici white-collar complex integrates light ...,still open
Sigma-Aldrich,02/21/2023,Tecovirimat is effective against human monkeypox virus in vitro at ...,still open
Sigma-Aldrich,02/21/2023,Resistance of Dickeya solani strain IPO 2222 to lytic bacteriophage ...,still open
Sigma-Aldrich,02/21/2023,Targeting TBK1 to overcome resistance to cancer immunotherapy,still open
Sigma-Aldrich,02/21/2023,A lab-on-a-chip for the concurrent electrochemical detection of ...,still open
Sigma-Aldrich,02/21/2023,β subunits of GABAA receptors form proton-gated chloride channels ...,still open
Sigma-Aldrich,02/21/2023,Analysis of hyperforin (St. John's wort) action at TRPC6 channel ...,still open
Sigma-Aldrich,02/21/2023,The endocannabinoid anandamide is an airway relaxant in health ...,still open
Sigma-Aldrich,02/21/2023,Transplanting rejuvenated blood stem cells extends lifespan of aged ...,still open
Sigma-Aldrich,02/21/2023,Molecular data storage with zero synthetic effort and simple read-out ...,still open
Sigma-Aldrich,02/21/2023,CRISPR activation screen identifies TGFβ-associated PEG10 as a ...,still open
Sigma-Aldrich,02/21/2023,"Real time PCR (QPCR) Market Size 2022 Exhibits 8.73% CAGR to Reach USD 10,880.30 Million by 2030 | Adroit Market Research",still open
Sigma-Aldrich,02/21/2023,The membrane-active polyaminoisoprenyl compound NV716 re ...,still open
Sigma-Aldrich,02/21/2023,A comprehensive update to the Mycobacterium tuberculosis H37Rv ...,still open
Sigma-Aldrich,02/21/2023,A statistical framework for high-content phenotypic profiling using ...,still open
Sigma-Aldrich,02/21/2023,DNA repair during nonreductional meiosis in the asexual rotifer ...,still open
Sigma-Aldrich,02/21/2023,"Emerson sells part of business, says it would consider leaving St ...",still open
Sigma-Aldrich,02/21/2023,Rapid antibiotic susceptibility testing and species identification for ...,still open
Sigma-Aldrich,02/21/2023,High-throughput analysis of the transcriptional patterns of sexual ...,still open
Sigma-Aldrich,02/21/2023,A gut-derived hormone suppresses sugar appetite and regulates ...,still open
Sigma-Aldrich,02/21/2023,Mitochondrial RNA modifications shape metabolic plasticity in ...,still open
Sigma-Aldrich,02/21/2023,Ferritin-mediated iron detoxification promotes hypothermia survival ...,still open
Sigma-Aldrich,02/21/2023,Understanding soil selenium accumulation and bioavailability ...,still open
Sigma-Aldrich,02/21/2023,Candida albicans evades NK cell elimination via binding of ...,still open
Sigma-Aldrich,02/21/2023,3D Perfusion Bioreactor System Market 2023 Segments Analysis by ...,still open
Sigma-Aldrich,02/21/2023,Compensatory epistasis maintains ACE2 affinity in SARS-CoV-2 ...,still open
Sigma-Aldrich,02/21/2023,PI3K drives the de novo synthesis of coenzyme A from vitamin B5,still open
Sigma-Aldrich,02/21/2023,Amoebicidal activity of cationic carbosilane dendrons derived with 4 ...,still open
Sigma-Aldrich,02/21/2023,Omicron BA.4/BA.5 escape neutralizing immunity elicited by BA.1 ...,still open
Sigma-Aldrich,02/21/2023,"Ethyl Acetate Market To Generate Revenue Worth USD 2.36 Billion by 2029, Industry Analysis, and Forecast to 2029",still open
Sigma-Aldrich,02/21/2023,Guiding cell migration in 3D with high-resolution photografting ...,still open
Sigma-Aldrich,02/22/2023,Protein Chip Market Untapped Growth Opportunities by Key Players ...,still open
Sigma-Aldrich,02/22/2023,Cell Line Development Services Market 2023 by Keyplayers and ...,still open
Sigma-Aldrich,02/22/2023,"Live Cell Imaging Market Strategy for Excellent Growth, Highest ...",still open
Sigma-Aldrich,02/22/2023,3D Perfusion Bioreactor System Market 2023 Segments Analysis by ...,still open
Sigma-Aldrich,02/22/2023,"Vimentin Market Is Thriving Worldwide-Sino Biological, Sigma ...",still open
Sigma-Aldrich,02/22/2023,Transfection Technology Market Swot Analysis by Key Factors That ...,still open
Sigma-Aldrich,02/22/2023,Neuropeptide Y Acetate Market is poised to grow at CAGR of 11.2 ...,still open
Sigma-Aldrich,02/22/2023,Isocitric Acid Market - 37% of Growth to Originate from APAC -Sigma ...,still open
Sigma-Aldrich,02/22/2023,Calcium Chromate Market Current Status and Future Prospects ...,still open
Sigma-Aldrich,02/22/2023,"CRISPR and CAS Gene Market : Recent Industry Trends, Analysis ...",still open
Sigma-Aldrich,02/22/2023,"Quinic Acid Market Research Report 2023 - Merck Group, Thermo ...",still open
Sigma-Aldrich,02/22/2023,Stable Isotope Labeled Biomolecules Market Report Covers Future Trends with Research 2022-2029 | Cambridge Iso,still open
Sigma-Aldrich,02/22/2023,Classical Cell Culture Media Market 2023 Segments Analysis by ...,still open
Sigma-Aldrich,02/22/2023,Fluorescent Lipid Probe Industry is Expected to Reach $8 Billion by ...,still open
Sigma-Aldrich,02/22/2023,Electroporation Instruments Market to Witness Huge Growth by 2029 ...,still open
Sigma-Aldrich,02/22/2023,Serum Free & Specialty Media Market Upcoming Trends ...,still open
Sigma-Aldrich,02/22/2023,Fluorescence Probes Market is expected to reach a value of 2027 ...,still open
Sigma-Aldrich,02/22/2023,V2CTX MXene-based hybrid sensor with high selectivity and ppb ...,still open
Sigma-Aldrich,02/22/2023,"PTAB Rules on Preliminary Motions in Interference No. 106,133",still open
Sigma-Aldrich,02/22/2023,"Global Bioburden Testing Market Statistical Forecast, Trade Analysis ...",still open
Sigma-Aldrich,02/22/2023,Size Exclusion Columns Market Size and Forecast to 2029 -Sigma ...,still open
Sigma-Aldrich,02/22/2023,Ammonium Pentaborate Octahydrate Market is booming Globally ...,still open
Sigma-Aldrich,02/22/2023,Platinum Crucible Market would Register a Healthy Growth of USD ...,still open
Sigma-Aldrich,02/22/2023,Real Time PCR Fluorescent Probe Market 2023 Segments Analysis ...,still open
Sigma-Aldrich,02/22/2023,Spherical rotary cell seeding system for production of small-caliber ...,still open
Sigma-Aldrich,02/22/2023,"ELISA POT Assay Kits Market Size, Development Data, Growth ...",still open
Sigma-Aldrich,02/22/2023,"Phycoerythrin Market Size, Share, Growth Statistics By Top Key ...",still open
Sigma-Aldrich,02/22/2023,Platelet Derived Growth Factor Market To Grow Extensively At ...,still open
Sigma-Aldrich,02/22/2023,Immunoassay Instruments Market to Accelerate Growth with ...,still open
Sigma-Aldrich,02/22/2023,Global Methyl Cellulose Market is expected to grow from USD ...,still open
Sigma-Aldrich,02/22/2023,Cycloheximide (CAS 66-81-9) Market – A Comprehensive Study by ...,still open
Sigma-Aldrich,02/22/2023,"Uncoupling Protein Market Research Report 2023 - EDQM, United ...",still open
Sigma-Aldrich,02/22/2023,Hydrophilic Interaction Columns Market Size And Forecast -Sigma ...,still open
Sigma-Aldrich,02/22/2023,Poloxamer Market Size 2023 Growing Rapidly with Modern Trends ...,still open
Sigma-Aldrich,02/22/2023,Methanol-D4 Market Overview 2023-2029| Key Players –Sigma ...,still open
Sigma-Aldrich,02/22/2023,Precast Gels Market To Grow Extensively At Unstoppable Rate ...,still open
Sigma-Aldrich,02/22/2023,Biochip Market worth $7.3 billion by 2027 -Abbott Laboratories ...,still open
Sigma-Aldrich,02/22/2023,Suramin Sodium Market 2023 key developmental strategies ...,still open
Sigma-Aldrich,02/22/2023,Insights on the Global Cell Line Identification and Characterization ...,still open
Sigma-Aldrich,02/22/2023,"Myelin Basic Protein Market Statistical Forecast, Trade Analysis ...",still open
Sigma-Aldrich,02/22/2023,1-Decene Market 2023-2032 Explained Effective Movements and ...,still open
Sigma-Aldrich,02/22/2023,Genetic Chronic Obstructive Pulmonary Disease (COPD) Market is ...,still open
Sigma-Aldrich,02/22/2023,Quantum Dot Technology Market is Set To Fly High in Years to ...,still open
Sigma-Aldrich,02/22/2023,Ferric Fluoride Market Booming Worldwide With Leading Key ...,still open
Sigma-Aldrich,02/22/2023,Food Thickeners Market Size & Analysis By 2023 -2029 -Cargill ...,still open
Sigma-Aldrich,02/22/2023,Genetic Chronic Obstructive Pulmonary Disease (COPD) Market to ...,still open
Sigma-Aldrich,02/22/2023,Cell Culture Inserts Market to Witness Huge Growth by 2029 ...,still open
Sigma-Aldrich,02/22/2023,Formula Fed Calf Serum Market is booming Globally with Top key ...,still open
Sigma-Aldrich,02/22/2023,Keyhole Limpet Hemocyanin (KLH) Market Overview 2023-2029 ...,still open
Sigma-Aldrich,02/22/2023,White Fungus Drugs Market Booming Worldwide With Leading Key ...,still open
Sigma-Aldrich,02/22/2023,Primary Antibodies Market To Grow Extensively At Unstoppable ...,still open
Sigma-Aldrich,02/22/2023,Zinc Sulfide Market is booming Globally with Top key players-Dow ...,still open
Sigma-Aldrich,02/22/2023,Alkaline Proteases Market Overview 2023-2029| Key Players –Ab ...,still open
