Name,Data,News,Evaluation
Texas Instruments,02/05/2023,3 Things About Texas Instruments That Smart Investors Know,still open
Texas Instruments,02/05/2023,Who Is King Of Boring Chips? Texas Instruments Vs. Analog Devices,still open
Texas Instruments,02/05/2023,"Top Stock Reports for Texas Instruments, Enbridge & Fiserv",still open
Texas Instruments,02/05/2023,Texas Instruments' Sales Drop for the First Time Since 2020,still open
Texas Instruments,02/05/2023,Texas Instruments signals expanding pain for chipmakers with ...,still open
Texas Instruments,02/05/2023,Metis Global Partners LLC Increases Stock Holdings in Texas ...,still open
Texas Instruments,02/05/2023,BlackRock Increases Position in Texas Instruments (TXN),still open
Texas Instruments,02/05/2023,Texas Instruments replaces CEO Rich Templeton with current operating chief Haviv Ilan,still open
Texas Instruments,02/05/2023,March 24th Options Now Available For Texas Instruments (TXN),still open
Texas Instruments,02/05/2023,"Stocks making the biggest moves after hours: Microsoft, Texas Instruments, Capital One & more",still open
Texas Instruments,02/05/2023,Spot On: Texas Instruments Announces First Chipset That Enables ...,still open
Texas Instruments,02/05/2023,Does Texas Instruments (NASDAQ:TXN) Have A Healthy Balance Sheet?,still open
Texas Instruments,02/05/2023,The Latest Analyst Ratings for Texas Instruments - Texas Instruments (NASDAQ:TXN),still open
Texas Instruments,02/05/2023,"Susquehanna Adjusts Texas Instruments Price Target to $210 From $205, Maintains Positive Rating",still open
Texas Instruments,02/05/2023,"Goldman Sachs Adjusts Price Target on Texas Instruments to $159 From $162, Maintains Sell Rating",still open
Texas Instruments,02/05/2023,Texas Instruments signals expanding pain for chipmakers with somber forecast,still open
Texas Instruments,02/05/2023,Texas Instruments Stock: Analog Chips Are Sustainably Profitable ...,still open
Texas Instruments,02/05/2023,"Texas Instruments Inc. stock falls Thursday, underperforms market",still open
Texas Instruments,02/05/2023,Is Texas Instruments Incorporated's (NASDAQ:TXN) Recent Stock Performance Influenced By Its Fundamentals In Any Way?,still open
Texas Instruments,02/05/2023,Global Graphing Calculator Market Report 2022 to 2030 - Featuring ...,still open
Texas Instruments,02/05/2023,Global RF Components Market 2022 to 2031 - Major Players Include ...,still open
Texas Instruments,02/05/2023,Reinforced switch drivers suit a wide range of applications,still open
Texas Instruments,02/05/2023,Texas Instruments (TXN) Tops Q4 Earnings and Revenue Estimates,still open
Texas Instruments,02/05/2023,Texas Instruments CEO Templeton to step down; company veteran ...,still open
Texas Instruments,02/05/2023,"Tale Of 2 Chip Stocks: Ahead Of Intel, Texas Instruments Earnings, Analysts Weigh In On Results, Q1 Outlo",still open
Texas Instruments,02/05/2023,"Benchmark Adjusts Texas Instruments' Price Target to $203 From $189, Keeps Buy Rating",still open
Texas Instruments,02/05/2023,"Deutsche Bank Adjusts Texas Instruments Price Target to $165 From $158, Maintains Hold Rating",still open
Texas Instruments,02/05/2023,Voltage Translators Market Giants Spending Is Going To Boom ...,still open
Texas Instruments,02/05/2023,Audio Interface ICs Market Size & Analysis By 2023 -2029 -Texas ...,still open
Texas Instruments,02/05/2023,"Mizuho Adjusts Texas Instruments' Price Target to $165 From $159, Keeps Neutral Rating",still open
Texas Instruments,02/05/2023,Texas Instruments Incorporated (NASDAQ:TXN) Given Average ...,still open
Texas Instruments,02/05/2023,"Texas Instruments earnings beat by $0.02, revenue topped ...",still open
Texas Instruments,02/05/2023,"BMO Capital Adjusts Texas Instruments' Price Target to $215 From $195, Maintains Outperform Rating",still open
Texas Instruments,02/05/2023,"Lenovo, Acer Veteran Gianfranco Lanci’s Sudden Death Shocks ...",still open
Texas Instruments,02/05/2023,Texas Instruments board declares first quarter 2023 quarterly dividend,still open
Texas Instruments,02/05/2023,"Car Key Chips Market Is Thriving Worldwide-NXP, Microchip, Texas ...",still open
Texas Instruments,02/05/2023,Texas Instruments Tops Q4 EPS by 2c By Investing.com,still open
Texas Instruments,02/05/2023,Digital Substation Market 2022 by Keyplayers and Vendors:ABB ...,still open
Texas Instruments,02/05/2023,The 7 Most Undervalued Blue-Chip Stocks to Buy in February 2023,still open
Texas Instruments,02/05/2023,TDK collaborates with Texas Instruments on new i3 Micro Module ...,still open
Texas Instruments,02/05/2023,CIBC Asset Management Inc Has $52.95 Million Holdings in Texas ...,still open
Texas Instruments,02/05/2023,The Colony man sentenced for Jan. 6 riot,still open
Texas Instruments,02/05/2023,"Shower Bases & Pans Market Development Size 2023 |AMS, Texas ...",still open
Texas Instruments,02/05/2023,Texas Instruments (TXN) January weekly 172 straddle priced for a ...,still open
Texas Instruments,02/05/2023,"To a laid off engineer, so what if the nation's jobless rate is down to ...",still open
Texas Instruments,02/05/2023,Output Modules Market To Grow Extensively At Unstoppable Rate ...,still open
Texas Instruments,02/05/2023,Validea Daily Guru Fundamental Report for TXN - 1/31/2023,still open
Texas Instruments,02/05/2023,Texas Instruments' forecasts miss estimates in sign of wider demand ...,still open
Texas Instruments,02/05/2023,"Susquehanna Maintains Positive on Texas Instruments, Raises ...",still open
Texas Instruments,02/05/2023,5G Power Amplifier Market Biggest Innovation with Top Key Players ...,still open
Texas Instruments,02/05/2023,MOSFET & IGBT Gate Drivers Sales Market Growing at a CAGR ...,still open
Texas Instruments,02/05/2023,DC Motor Drivers Market 2023 Segments Analysis by Top Key ...,still open
Texas Instruments,02/05/2023,Automotive ARM-Based Microcontroller Market Development Size ...,still open
Texas Instruments,02/05/2023,Pulse Width Modulation (PWM) Controllers Market is expected to ...,still open
Texas Instruments,02/05/2023,Radio Frequency Front-end Module Sales Market Overview 2023 ...,still open
Texas Instruments,02/05/2023,Count on old-school fun with these new calculator emulations,still open
Texas Instruments,02/05/2023,Wireless Sensor Tags Market Biggest Innovation with Top Key ...,still open
Texas Instruments,02/05/2023,RF Power Detector Chips Market to Witness Huge Growth by 2029 ...,still open
Texas Instruments,02/05/2023,"Analog Devices Inc. stock falls Friday, still outperforms market",still open
Texas Instruments,02/05/2023,Mobile Processors Market Is Thriving Worldwide-Qualcomm ...,still open
Texas Instruments,02/05/2023,Automotive Power ECU SiC Devices Market - 37% of Growth to ...,still open
Texas Instruments,02/05/2023,3D Time-of-flight Image Sensors Sales Market is Expected to Reach ...,still open
Texas Instruments,02/05/2023,Global Embedded Processor Market Report 2022 to 2027: Rising Consumer Electronics Industry is Fuelling Growth,still open
Texas Instruments,02/05/2023,IoT Chipset Market – Major Technology Giants in Buzz Again | Intel ...,still open
Texas Instruments,02/05/2023,Teacher Retirement System of Texas Raises Position in ESCO ...,still open
Texas Instruments,02/05/2023,Current Transmitters Market 2023 key developmental strategies ...,still open
Texas Instruments,02/05/2023,"NXP Semiconductor Stock Falls, but the 2023 Outlook for EVs and ...",still open
Texas Instruments,02/05/2023,"Davonte Davis on Instruments, Uniforms, Dunking and Turnovers",still open
Texas Instruments,02/05/2023,RF Chip Industry is Expected to Reach $8 Billion by 2028 -Texas ...,still open
Texas Instruments,02/05/2023,Power over Ethernet Market 2022 by Keyplayers and Vendors:Axis ...,still open
Texas Instruments,02/05/2023,Sales Of IoT Technology Are Expected To Increase At 6.7% CAGR ...,still open
Texas Instruments,02/05/2023,ROBERT LEON WILLIAMS – Herald Democrat,still open
Texas Instruments,02/05/2023,Texas Instruments battery management could increase the range of ...,still open
Texas Instruments,02/05/2023,"Intel salary cuts include CEO Gelsinger and other execs, also mid ...",still open
Texas Instruments,02/05/2023,New lithium-air battery could be 4x better than Li-ion,still open
Texas Instruments,02/05/2023,Couple Establishes Women's Scholarship Fund in Memory of Late ...,still open
Texas Instruments,02/05/2023,Near-Term Earnings Gyration Shouldn’t Shake Long-Term Tech Faith,still open
Texas Instruments,02/05/2023,"Baby Clothing Market Size, Development Data, Growth Analysis ...",still open
Texas Instruments,02/05/2023,Wireless Connectivity Software Market Booming Worldwide With ...,still open
Texas Instruments,02/05/2023,"Power Module Packaging Market Upcoming Trends, Segmented by ...",still open
Texas Instruments,02/05/2023,Global SiC Based Power Electronics and Inverter Market Size To ...,still open
Texas Instruments,02/05/2023,The 10 Best Stocks to Buy in February 2023,still open
Texas Instruments,02/05/2023,DMD Chip Market is likely to expand US$ 2.5 Bn at 10.6% CAGR by ...,still open
Texas Instruments,02/05/2023,ASML Ban Affects China's Advancement in Chips,still open
Texas Instruments,02/05/2023,ESD Protection Devices Market 2023 key developmental strategies ...,still open
Texas Instruments,02/05/2023,USB Smart Card Token Market Size & Analysis By 2023 -2029 ...,still open
Texas Instruments,02/05/2023,Certification org moves to keep IoT safe from quantum threat,still open
Texas Instruments,02/05/2023,What’s Behind Texas Instruments Stock’s Consistent Outperformance Of The Markets?,still open
Texas Instruments,02/05/2023,Automotive Pressure Transducers Market Size And Forecast -IFM ...,still open
Texas Instruments,02/05/2023,Texas Instruments' Forecast Signals Chip Demand Slump Is ...,still open
Texas Instruments,02/05/2023,IoT Communication Technologies Market 2022 key developmental ...,still open
Texas Instruments,02/05/2023,Texas Instruments: Strong Fundamentals Make It A Buy,still open
Texas Instruments,02/05/2023,"Go inside Texas Instruments' newest fab, where chips powering the ...",still open
Texas Instruments,02/05/2023,Qualcomm Stock Joins Other Semiconductor Stocks In Guiding Lower,still open
Texas Instruments,02/05/2023,Texas Instruments: Well-Placed To Navigate Semiconductor Sector,still open
Texas Instruments,02/05/2023,Texas Instruments micropchip plant now open in Utah,still open
Texas Instruments,02/05/2023,Better Semiconductor Stock: Texas Instruments vs. Broadcom,still open
Texas Instruments,02/05/2023,Texas Instruments Inc. stock outperforms competitors despite losses on the day,still open
Texas Instruments,02/05/2023,"Top Stock Reports for Texas Instruments, Enbridge & Fiserv",still open
Texas Instruments,02/05/2023,Where Will Texas Instruments Stock Be in 1 Year?,still open
Texas Instruments,02/05/2023,TXN Stock: Texas Instruments Beats Q4 Targets But Guides Low ...,still open
Texas Instruments,02/05/2023,Texas Instruments' Sales Drop for the First Time Since 2020,still open
Texas Instruments,02/05/2023,Metis Global Partners LLC Increases Stock Holdings in Texas ...,still open
Texas Instruments,02/05/2023,"Stocks making the biggest moves after hours: Microsoft, Texas Instruments, Capital One & more",still open
Texas Instruments,02/05/2023,"Amid a CEO Change, Texas Instruments Needs to Do This",still open
Texas Instruments,02/05/2023,Texas Instruments Stock: Analog Chips Are Sustainably Profitable ...,still open
Texas Instruments,02/05/2023,"Texas Instruments GAAP EPS of $2.13 beats by $0.15, revenue of ...",still open
Texas Instruments,02/05/2023,BlackRock Increases Position in Texas Instruments (TXN),still open
Texas Instruments,02/05/2023,"Texas Instruments Inc. stock falls Thursday, underperforms market",still open
Texas Instruments,02/05/2023,Is Texas Instruments Incorporated's (NASDAQ:TXN) Recent Stock Performance Influenced By Its Fundamentals In Any Way?,still open
Texas Instruments,02/05/2023,March 24th Options Now Available For Texas Instruments (TXN),still open
Texas Instruments,02/05/2023,Texas Instruments Incorporated (NASDAQ:TXN) Given Average ...,still open
Texas Instruments,02/05/2023,The 7 Most Undervalued Blue-Chip Stocks to Buy in February 2023,still open
Texas Instruments,02/05/2023,If You Invested $10000 in TI Stock When Rich Templeton Became ...,still open
Texas Instruments,02/05/2023,Texas Instruments Incorporated is owned by Institutional & Family ...,still open
Texas Instruments,02/05/2023,"Tale Of 2 Chip Stocks: Ahead Of Intel, Texas Instruments Earnings, Analysts Weigh In On Results, Q1 Outlo",still open
Texas Instruments,02/05/2023,"Texas Instruments earnings beat by $0.02, revenue topped ...",still open
Texas Instruments,02/05/2023,The Latest Analyst Ratings for Texas Instruments - Texas Instruments (NASDAQ:TXN),still open
Texas Instruments,02/05/2023,Texas Instruments (TXN) Introduces Ultrasonic Lens Chipsets,still open
Texas Instruments,02/05/2023,"NXP Semiconductor Stock Falls, but the 2023 Outlook for EVs and ...",still open
Texas Instruments,02/05/2023,Nasdaq closes slightly lower for a second day as earnings season rolls on,still open
Texas Instruments,02/05/2023,3 Semiconductor Stocks For Your January 2023 Watchlist,still open
Texas Instruments,02/05/2023,STM vs. TXN: Which Stock Is the Better Value Option?,still open
Texas Instruments,02/05/2023,Down but Not Out: Buy These Beaten-Down Dividend Stocks Before ...,still open
Texas Instruments,02/05/2023,Institutional & Family Asset Management LLC Has $4.26 Million ...,still open
Texas Instruments,02/05/2023,7 Retirement Stocks to Buy Now,still open
Texas Instruments,02/05/2023,"Goldman Sachs Adjusts Price Target on Texas Instruments to $159 From $162, Maintains Sell Rating",still open
Texas Instruments,02/05/2023,What to Expect From Stocks in 2023,still open
Texas Instruments,02/05/2023,"Susquehanna Adjusts Texas Instruments Price Target to $210 From $205, Maintains Positive Rating",still open
Texas Instruments,02/05/2023,"If You Like Dividends, You Should Love These 3 Stocks",still open
Texas Instruments,02/05/2023,2 Tech Stocks To Watch In The Stock Market Today,still open
Texas Instruments,02/05/2023,CIBC Asset Management Inc Has $52.95 Million Holdings in Texas ...,still open
Texas Instruments,02/05/2023,"Analog Devices Inc. stock falls Friday, still outperforms market",still open
Texas Instruments,02/05/2023,Tech's Ferocious Rally Raises Bar for Earnings as Red Flags Wave,still open
Texas Instruments,02/05/2023,Stock market news live updates: Stocks finish mixed as investors evaluate deluge of earnings,still open
Texas Instruments,02/05/2023,Like Income? These 3 Chip Stocks Pay Dividends,still open
Texas Instruments,02/05/2023,The 10 Best Stocks to Buy in February 2023,still open
Texas Instruments,02/05/2023,3 Stocks to Add to Your Portfolio in a Market Pullback,still open
Texas Instruments,02/05/2023,Texas Instruments (TXN) Tops Q4 Earnings and Revenue Estimates,still open
Texas Instruments,02/05/2023,Qualcomm Stock Joins Other Semiconductor Stocks In Guiding Lower,still open
Texas Instruments,02/05/2023,Stock Market: These Hot Investors Are Bullish | Investor's Business ...,still open
Texas Instruments,02/05/2023,"Emerson makes hostile $7.6 billion offer on Texas company, after ...",still open
Texas Instruments,02/05/2023,The 7 Best Dividend Stocks to Buy for 2023,still open
Texas Instruments,02/05/2023,Why Texas Instruments Stock Was Falling Earlier Today,still open
Texas Instruments,02/05/2023,Where Will Broadcom Stock Be In 1 Year?,still open
Texas Instruments,02/05/2023,My Top 15 High-Growth Dividend Stocks For February 2023,still open
Texas Instruments,02/05/2023,"Friday’s Top Analyst Upgrades and Downgrades: Alcoa, Charles Schwab, IBM, Newmont, Philip Morris, Roblox, Shopify, Texas Instruments, Transocean and More",still open
Texas Instruments,02/05/2023,Why Did Texas Instruments Stock Jump 12% in November?,still open
Texas Instruments,02/05/2023,Is Texas Instruments Stock a Buy Right Now?,still open
Texas Instruments,02/05/2023,Texas Instruments signals expanding pain for chipmakers with somber forecast,still open
Texas Instruments,02/05/2023,4 Tech Stocks Seeing Upward Estimate Revisions Heading into Earnings,still open
Texas Instruments,02/05/2023,"Benchmark Adjusts Texas Instruments' Price Target to $203 From $189, Keeps Buy Rating",still open
Texas Instruments,02/05/2023,National Instruments Stock Scores Rising Price Performance With ...,still open
Texas Instruments,02/05/2023,"Unusual Options Activity in AT&T, Verizon, JPMorgan and 7 Other ...",still open
Texas Instruments,02/05/2023,Mutual of America Capital Management LLC Trims Stock Holdings ...,still open
Texas Instruments,02/05/2023,"Deutsche Bank Adjusts Texas Instruments Price Target to $165 From $158, Maintains Hold Rating",still open
Texas Instruments,02/05/2023,12 Cash-Rich Dividend Stocks to Buy Now,still open
Texas Instruments,02/05/2023,What’s Behind Texas Instruments Stock’s Consistent Outperformance Of The Markets?,still open
Texas Instruments,02/05/2023,"BMO Capital Adjusts Texas Instruments' Price Target to $215 From $195, Maintains Outperform Rating",still open
Texas Instruments,02/05/2023,Texas Instruments Stock: Dividend Growth Winner Yields Over 3%,still open
Texas Instruments,02/05/2023,Texas Instruments Stock: The Boom Cycle Is Still On (NASDAQ:TXN),still open
Texas Instruments,02/05/2023,Why I Own Texas Instruments Stock,still open
Texas Instruments,02/05/2023,"To a laid off engineer, so what if the nation's jobless rate is down to ...",still open
Texas Instruments,02/05/2023,Is United Microelectronics Corp (UMC) Stock About to Get Hot Tuesday?,still open
Texas Instruments,02/05/2023,$100 Invested In This Stock 15 Years Ago Would Be Worth $600 Today - Texas Instruments (NASDAQ:TXN),still open
Texas Instruments,02/05/2023,Austin tech giant National Instruments exploring a possible sale,still open
Texas Instruments,02/05/2023,Texas Instruments Stock Up 1.7x On The Back Of Strong Sales Growth,still open
Texas Instruments,02/05/2023,"TE Connectivity Ltd. stock rises Thursday, still underperforms market",still open
Texas Instruments,02/05/2023,This Top Chip Stock Is Expanding Into EVs -- Is It a Buy for 2023?,still open
Texas Instruments,02/05/2023,Analog Devices Inc. stock outperforms competitors on strong trading day,still open
Texas Instruments,02/05/2023,"Texas Instruments stock rises on earnings beat, outlook",still open
Texas Instruments,02/05/2023,"Texas Instruments Plans $15 Billion in Share Buybacks, Boosts ...",still open
Texas Instruments,02/05/2023,Is Texas Instruments Stock a Buy Now?,still open
Texas Instruments,02/05/2023,"Insiders at Texas Instruments Incorporated (NASDAQ:TXN) sold US$8.8m worth of stock, a potential red flag that needs to be monitored",still open
Texas Instruments,02/05/2023,"Texas Instruments (TXN): Safe And Increasing Dividend, But Risky ...",still open
Texas Instruments,02/05/2023,"Car Key Chips Market Is Thriving Worldwide-NXP, Microchip, Texas ...",still open
Texas Instruments,02/05/2023,Strong Sales Growth Has Helped Texas Instruments Stock Outperform The S&P,still open
Texas Instruments,02/05/2023,Netflix's CEO Change Is Huge. This One Matters Even More,still open
Texas Instruments,02/05/2023,"Stocks making the biggest moves after hours: Alphabet, Microsoft, Texas Instruments and more",still open
Texas Instruments,02/05/2023,1 Monster Opportunity Arises in the Global Chip Shortage,still open
Texas Instruments,02/05/2023,Texas Instruments board declares first quarter 2023 quarterly dividend,still open
Texas Instruments,02/05/2023,Texas Instruments: Strong Fundamentals Make It A Buy,still open
Texas Instruments,02/05/2023,3 Reasons Why Texas Instruments Stock Is A Must-Have (NASDAQ ...,still open
Texas Instruments,02/05/2023,National Instruments Co. (NASDAQ:NATI) Shares Sold by Reinhart ...,still open
Texas Instruments,02/05/2023,"Embedded System Market Size, Share, Growth Statistics By Top Key ...",still open
Texas Instruments,02/05/2023,Texas Instruments Stock: Make Profitability Great Again (NASDAQ ...,still open
Texas Instruments,02/05/2023,Texas Instruments (NASDAQ:TXN) Is Reinvesting To Multiply In Value,still open
Texas Instruments,02/05/2023,The 7 Best Income Stocks to Buy in January,still open
Texas Instruments,02/05/2023,Are Strong Financial Prospects The Force That Is Driving The Momentum In Lattice Semiconductor Corporation's NASDAQ:LSCC) Stock?,still open
Texas Instruments,02/05/2023,Micron And Texas Instruments: The Most And Least Cyclical Chip ...,still open
Texas Instruments,02/05/2023,3 Things About Texas Instruments That Smart Investors Know,still open
Texas Instruments,02/05/2023,Who Is King Of Boring Chips? Texas Instruments Vs. Analog Devices,still open
Texas Instruments,02/05/2023,"Top Stock Reports for Texas Instruments, Enbridge & Fiserv",still open
Texas Instruments,02/05/2023,Texas Instruments' Sales Drop for the First Time Since 2020,still open
Texas Instruments,02/05/2023,Texas Instruments signals expanding pain for chipmakers with ...,still open
Texas Instruments,02/05/2023,Metis Global Partners LLC Increases Stock Holdings in Texas ...,still open
Texas Instruments,02/05/2023,BlackRock Increases Position in Texas Instruments (TXN),still open
Texas Instruments,02/05/2023,Texas Instruments replaces CEO Rich Templeton with current operating chief Haviv Ilan,still open
Texas Instruments,02/05/2023,March 24th Options Now Available For Texas Instruments (TXN),still open
Texas Instruments,02/05/2023,"Stocks making the biggest moves after hours: Microsoft, Texas Instruments, Capital One & more",still open
Texas Instruments,02/05/2023,Spot On: Texas Instruments Announces First Chipset That Enables ...,still open
Texas Instruments,02/05/2023,Does Texas Instruments (NASDAQ:TXN) Have A Healthy Balance Sheet?,still open
Texas Instruments,02/05/2023,The Latest Analyst Ratings for Texas Instruments - Texas Instruments (NASDAQ:TXN),still open
Texas Instruments,02/05/2023,"Susquehanna Adjusts Texas Instruments Price Target to $210 From $205, Maintains Positive Rating",still open
Texas Instruments,02/05/2023,"Goldman Sachs Adjusts Price Target on Texas Instruments to $159 From $162, Maintains Sell Rating",still open
Texas Instruments,02/05/2023,Texas Instruments signals expanding pain for chipmakers with somber forecast,still open
Texas Instruments,02/05/2023,Texas Instruments Stock: Analog Chips Are Sustainably Profitable ...,still open
Texas Instruments,02/05/2023,"Texas Instruments Inc. stock falls Thursday, underperforms market",still open
Texas Instruments,02/05/2023,Is Texas Instruments Incorporated's (NASDAQ:TXN) Recent Stock Performance Influenced By Its Fundamentals In Any Way?,still open
Texas Instruments,02/05/2023,Global Graphing Calculator Market Report 2022 to 2030 - Featuring ...,still open
Texas Instruments,02/05/2023,Global RF Components Market 2022 to 2031 - Major Players Include ...,still open
Texas Instruments,02/05/2023,Reinforced switch drivers suit a wide range of applications,still open
Texas Instruments,02/05/2023,Texas Instruments (TXN) Tops Q4 Earnings and Revenue Estimates,still open
Texas Instruments,02/05/2023,Texas Instruments CEO Templeton to step down; company veteran ...,still open
Texas Instruments,02/05/2023,"Tale Of 2 Chip Stocks: Ahead Of Intel, Texas Instruments Earnings, Analysts Weigh In On Results, Q1 Outlo",still open
Texas Instruments,02/05/2023,"Benchmark Adjusts Texas Instruments' Price Target to $203 From $189, Keeps Buy Rating",still open
Texas Instruments,02/05/2023,"Deutsche Bank Adjusts Texas Instruments Price Target to $165 From $158, Maintains Hold Rating",still open
Texas Instruments,02/05/2023,Voltage Translators Market Giants Spending Is Going To Boom ...,still open
Texas Instruments,02/05/2023,Audio Interface ICs Market Size & Analysis By 2023 -2029 -Texas ...,still open
Texas Instruments,02/05/2023,"Mizuho Adjusts Texas Instruments' Price Target to $165 From $159, Keeps Neutral Rating",still open
Texas Instruments,02/05/2023,Texas Instruments Incorporated (NASDAQ:TXN) Given Average ...,still open
Texas Instruments,02/05/2023,"Texas Instruments earnings beat by $0.02, revenue topped ...",still open
Texas Instruments,02/05/2023,"BMO Capital Adjusts Texas Instruments' Price Target to $215 From $195, Maintains Outperform Rating",still open
Texas Instruments,02/05/2023,"Lenovo, Acer Veteran Gianfranco Lanci’s Sudden Death Shocks ...",still open
Texas Instruments,02/05/2023,Texas Instruments board declares first quarter 2023 quarterly dividend,still open
Texas Instruments,02/05/2023,"Car Key Chips Market Is Thriving Worldwide-NXP, Microchip, Texas ...",still open
Texas Instruments,02/05/2023,Texas Instruments Tops Q4 EPS by 2c By Investing.com,still open
Texas Instruments,02/05/2023,Digital Substation Market 2022 by Keyplayers and Vendors:ABB ...,still open
Texas Instruments,02/05/2023,The 7 Most Undervalued Blue-Chip Stocks to Buy in February 2023,still open
Texas Instruments,02/05/2023,TDK collaborates with Texas Instruments on new i3 Micro Module ...,still open
Texas Instruments,02/05/2023,CIBC Asset Management Inc Has $52.95 Million Holdings in Texas ...,still open
Texas Instruments,02/05/2023,The Colony man sentenced for Jan. 6 riot,still open
Texas Instruments,02/05/2023,"Shower Bases & Pans Market Development Size 2023 |AMS, Texas ...",still open
Texas Instruments,02/05/2023,Texas Instruments (TXN) January weekly 172 straddle priced for a ...,still open
Texas Instruments,02/05/2023,"To a laid off engineer, so what if the nation's jobless rate is down to ...",still open
