Name,Data,News,Evaluation
Texas Instruments,02/10/2023,Texas Instruments Stock: Dividend Growth Winner Yields Over 3%,still open
Texas Instruments,02/10/2023,Qualcomm Stock Joins Other Semiconductor Stocks In Guiding Lower,still open
Texas Instruments,02/10/2023,Where Will Broadcom Stock Be In 1 Year?,still open
Texas Instruments,02/10/2023,Texas Instruments signals expanding pain for chipmakers with somber forecast,still open
Texas Instruments,02/10/2023,Texas Instruments Stock: The Boom Cycle Is Still On (NASDAQ:TXN),still open
Texas Instruments,02/10/2023,Stock Market | FinancialContent Business Page,still open
Texas Instruments,02/10/2023,Why I Own Texas Instruments Stock,still open
Texas Instruments,02/10/2023,"BMO Capital Adjusts Texas Instruments' Price Target to $215 From $195, Maintains Outperform Rating",still open
Texas Instruments,02/10/2023,Texas Instruments Stock: Analog Chips Are Sustainably Profitable ...,still open
Texas Instruments,02/10/2023,"Bullish Signal, Fed Thoughts, Microsoft-Google AI Battle, Bard's ...",still open
Texas Instruments,02/10/2023,TEXAS INSTRUMENTS INC : Change in Directors or Principal Officers (form 8-K),still open
Texas Instruments,02/10/2023,$100 Invested In This Stock 15 Years Ago Would Be Worth $600 Today - Texas Instruments (NASDAQ:TXN),still open
Texas Instruments,02/10/2023,Texas Instruments Stock Up 1.7x On The Back Of Strong Sales Growth,still open
Texas Instruments,02/10/2023,3 Top Tech ETFs Worth Investors’ Attention,still open
Texas Instruments,02/10/2023,"Quantbot Technologies LP sells 2,264 Badger Meter, Inc. shares ...",still open
Texas Instruments,02/10/2023,"Texas Instruments stock rises on earnings beat, outlook",still open
Texas Instruments,02/10/2023,"Texas Instruments Plans $15 Billion in Share Buybacks, Boosts ...",still open
Texas Instruments,02/10/2023,"QQQM, TXN, INTC, GILD: Large Inflows Detected at ETF",still open
Texas Instruments,02/10/2023,"Pico Projector Market Size, Cost Structures, Growth Rate and ...",still open
Texas Instruments,02/10/2023,Arrow Electronics: Upcoming Downcycle Is Inevitable (NYSE:ARW),still open
Texas Instruments,02/10/2023,IoT Communication Protocol Market Report 2023 and Forecast by ...,still open
Texas Instruments,02/10/2023,"Texas Instruments (TXN): Safe And Increasing Dividend, But Risky ...",still open
Texas Instruments,02/10/2023,Austin tech giant National Instruments exploring a possible sale,still open
Texas Instruments,02/10/2023,Strong Sales Growth Has Helped Texas Instruments Stock Outperform The S&P,still open
Texas Instruments,02/10/2023,EOG Resources Appoints Lynn A. Dugle to Board of Directors,still open
Texas Instruments,02/10/2023,"Stocks making the biggest moves after hours: Alphabet, Microsoft, Texas Instruments and more",still open
Texas Instruments,02/10/2023,1 Monster Opportunity Arises in the Global Chip Shortage,still open
Texas Instruments,02/10/2023,The world of wine has deep roots in thriving Denison,still open
Texas Instruments,02/10/2023,Texas Instruments Stock: Make Profitability Great Again (NASDAQ ...,still open
Texas Instruments,02/10/2023,Texas Instruments: Strong Fundamentals Make It A Buy,still open
Texas Instruments,02/10/2023,Korea Investment CORP Cuts Stock Holdings in Texas Instruments ...,still open
Texas Instruments,02/10/2023,Is Texas Instruments Stock a Better Buy Than Taiwan ...,still open
Texas Instruments,02/10/2023,"Texas Instruments Inc. stock falls Thursday, still outperforms market",still open
Texas Instruments,02/10/2023,Vanguard Group Increases Position in Texas Instruments (TXN),still open
Texas Instruments,02/10/2023,Texas Instruments' Sales Drop for the First Time Since 2020,still open
Texas Instruments,02/10/2023,Texas Instruments: The Semiconductor Stock to Own This Decade,still open
Texas Instruments,02/10/2023,Texas Instruments replaces CEO Rich Templeton with current operating chief Haviv Ilan,still open
Texas Instruments,02/10/2023,Variscite Launches New System on Module Powered by Texas ...,still open
Texas Instruments,02/10/2023,"Thanks to Texas Instruments, the Microchip Revolution Started in ...",still open
Texas Instruments,02/10/2023,"Stocks making the biggest moves after hours: Microsoft, Texas Instruments, Capital One & more",still open
Texas Instruments,02/10/2023,Spot On: Texas Instruments Announces First Chipset That Enables ...,still open
Texas Instruments,02/10/2023,BlackRock Increases Position in Texas Instruments (TXN),still open
Texas Instruments,02/10/2023,"Expansion, Cooling Demand to Hit Texas Instruments' Fourth ...",still open
Texas Instruments,02/10/2023,See Which Of The Latest 13F Filers Holds Texas Instruments,still open
Texas Instruments,02/10/2023,Reinforced switch drivers suit a wide range of applications,still open
Texas Instruments,02/10/2023,March 24th Options Now Available For Texas Instruments (TXN),still open
Texas Instruments,02/10/2023,Texas Instruments promotes Haviv Ilan as CEO,still open
Texas Instruments,02/10/2023,"Texas Instruments Inc. stock falls Thursday, underperforms market",still open
Texas Instruments,02/10/2023,Metis Global Partners LLC Increases Stock Holdings in Texas ...,still open
Texas Instruments,02/10/2023,Is Texas Instruments Incorporated's (NASDAQ:TXN) Recent Stock Performance Influenced By Its Fundamentals In Any Way?,still open
Texas Instruments,02/10/2023,Texas Instruments signals expanding pain for chipmakers with somber forecast,still open
Texas Instruments,02/10/2023,Texas Instruments CEO Templeton to step down; company veteran ...,still open
Texas Instruments,02/10/2023,"Goldman Sachs Adjusts Price Target on Texas Instruments to $159 From $162, Maintains Sell Rating",still open
Texas Instruments,02/10/2023,"Susquehanna Adjusts Texas Instruments Price Target to $210 From $205, Maintains Positive Rating",still open
Texas Instruments,02/10/2023,Global RF Components Market 2022 to 2031 - Major Players Include ...,still open
Texas Instruments,02/10/2023,Texas Instruments Appoints Company Veteran Haviv Ilan As New CEO; Rich Templeton Will Continue As Chair -,still open
Texas Instruments,02/10/2023,Development Boards Market Size [2023-2029] -Texas Instruments ...,still open
Texas Instruments,02/10/2023,Texas Instruments (TXN) Tops Q4 Earnings and Revenue Estimates,still open
Texas Instruments,02/10/2023,Global Graphing Calculator Market Report 2022 to 2030 - Featuring ...,still open
Texas Instruments,02/10/2023,"Tale Of 2 Chip Stocks: Ahead Of Intel, Texas Instruments Earnings, Analysts Weigh In On Results, Q1 Outlo",still open
Texas Instruments,02/10/2023,"Benchmark Adjusts Texas Instruments' Price Target to $203 From $189, Keeps Buy Rating",still open
Texas Instruments,02/10/2023,"If EPS Growth Is Important To You, Texas Instruments (NASDAQ:TXN) Presents An Opportunity",still open
Texas Instruments,02/10/2023,"Deutsche Bank Adjusts Texas Instruments Price Target to $165 From $158, Maintains Hold Rating",still open
Texas Instruments,02/10/2023,Texas Instruments AM62x on a module from Variscite,still open
Texas Instruments,02/10/2023,"Earnings Previews: ASML, Microsoft, Texas Instruments",still open
Texas Instruments,02/10/2023,Infrared Detector Industry Showing Impressive Growth during ...,still open
Texas Instruments,02/10/2023,"Mizuho Adjusts Texas Instruments' Price Target to $165 From $159, Keeps Neutral Rating",still open
Texas Instruments,02/10/2023,TEXAS INSTRUMENTS INC : Change in Directors or Principal Officers (form 8-K),still open
Texas Instruments,02/10/2023,"BMO Capital Adjusts Texas Instruments' Price Target to $215 From $195, Maintains Outperform Rating",still open
Texas Instruments,02/10/2023,"Process Signal Conditioners Market Statistical Forecast, Trade ...",still open
Texas Instruments,02/10/2023,TechInsights Teardown: Innovusion Falcon Kinetic | Electronics360,still open
Texas Instruments,02/10/2023,Automotive LED Driver Market to Witness Huge Growth by 2029 ...,still open
Texas Instruments,02/10/2023,Students' STEM Skills in Demand by Corporate Recruiters,still open
Texas Instruments,02/10/2023,Texas Instruments Tops Q4 EPS by 2c By Investing.com,still open
Texas Instruments,02/10/2023,"MOSFET Market Size and Forecast to 2029 -Samsung, Toshiba ...",still open
Texas Instruments,02/10/2023,"Most Read articles - Sales growth, TI's AM62x, Chips Act money",still open
Texas Instruments,02/10/2023,Doug Harris | Obituaries | hccommunityjournal.com,still open
Texas Instruments,02/10/2023,Current Limit Switches Market Growing at a CAGR 73.0% - Key ...,still open
Texas Instruments,02/10/2023,Why Investors Need to Take Advantage of These 2 Computer and ...,still open
Texas Instruments,02/10/2023,Voltage Supervisor ICs Market Growing at a CAGR 73.0% - Key ...,still open
Texas Instruments,02/10/2023,Space Light Modulator Market 2023 Segments Analysis by Top Key ...,still open
Texas Instruments,02/10/2023,"DC-DC Converter Market 2023 Global Insights and Business Scenario- Ericsson, Texas Instruments, Murata Manufac",still open
Texas Instruments,02/10/2023,Netflix's CEO Change Is Huge. This One Matters Even More,still open
Texas Instruments,02/10/2023,"Emerson makes hostile $7.6 billion offer on Texas company, after ...",still open
Texas Instruments,02/10/2023,Buck Converters Market Overview 2023-2029| Key Players –Texas ...,still open
Texas Instruments,02/10/2023,Automotive Reversing Radar Market Booming Worldwide With ...,still open
Texas Instruments,02/10/2023,Semiconductor Stocks Could Rally Huge in 2023: 7 ‘Strong Buy’ Favorites With Big Dividends,still open
Texas Instruments,02/10/2023,Dividend Growth Stock Watchlist - February 2023,still open
Texas Instruments,02/10/2023,Self-Storage Supplier Janus International Reorganizes Nokē Division,still open
Texas Instruments,02/10/2023,"Mizuho Maintains Neutral on Texas Instruments, Raises Price Target ...",still open
Texas Instruments,02/10/2023,Lielani Rae “Loni” (Wagner) Shumaker,still open
Texas Instruments,02/10/2023,Embedded System Market is expected to Witness US$ 159.12 billion ...,still open
Texas Instruments,02/10/2023,7 Dividend Stocks to Buy for a Reliable Income Stream,still open
Texas Instruments,02/10/2023,Current Mode PWM Controllers Market Booming Worldwide With ...,still open
Texas Instruments,02/10/2023,Active Electrical Components Market Size & Analysis By 2023 -2029 ...,still open
Texas Instruments,02/10/2023,Semiconductor market size in the military and aerospace industry to ...,still open
Texas Instruments,02/10/2023,"Medical MEMS Market to Hit USD 3.51 Billion by 2028, at a CAGR of 3.6% from 2022-2028 Thanks to Increasing Demand for Device Miniaturization in Electronic Devices",still open
Texas Instruments,02/10/2023,Clock Jitter Cleaners Industry is Expected to Reach $8 Billion by ...,still open
Texas Instruments,02/10/2023,Microchip Technology: Differentiated Exposures Serving Well ...,still open
Texas Instruments,02/10/2023,Russia buys US-made components for electronic warfare systems ...,still open
Texas Instruments,02/10/2023,Amplifier ICs Market Size & Analysis By 2023 -2029 -Analog ...,still open
Texas Instruments,02/10/2023,Semiconductor Temperature Sensors Market Upcoming Trends ...,still open
Texas Instruments,02/10/2023,Battery Charger IC Market would Register a Healthy Growth of USD ...,still open
Texas Instruments,02/10/2023,"William Burgan Obituary (1956 - 2023) - Pflugerville, TX - Houston ...",still open
Texas Instruments,02/10/2023,Ultra Narrow Band Technology Industry is Expected to Reach $8 ...,still open
Texas Instruments,02/10/2023,"New Federal Funds, Initiatives To Expand UTD's North Texas Impact",still open
Texas Instruments,02/10/2023,"Machine Vision market Share, Trustworthy Data and Analysis by 2033",still open
Texas Instruments,02/10/2023,WIFI Chipsets Market is booming Globally with Top key players ...,still open
Texas Instruments,02/10/2023,"RF Mixers Market Statistical Forecast, Trade Analysis 2023 –Mini ...",still open
Texas Instruments,02/10/2023,"Time-of-flight Sensor Market Statistical Forecast, Trade Analysis ...",still open
Texas Instruments,02/10/2023,Motorcycle Inertial Measurement Unit Sensors Market demand and ...,still open
Texas Instruments,02/10/2023,"RF Market Giants Spending Is Going To Boom |Qorvo, Skyworks ...",still open
Texas Instruments,02/10/2023,PCI Express Switches Market Booming Worldwide With Leading Key ...,still open
Texas Instruments,02/10/2023,Space Sensors and Actuators Market Market Outlook And Forecast ...,still open
Texas Instruments,02/10/2023,Audio Interface ICs Market Size & Analysis By 2023 -2029 -Texas ...,still open
Texas Instruments,02/10/2023,"Frequency Multiplier Industry Analysis 2023, Market Growth, Trends ...",still open
Texas Instruments,02/10/2023,Dallas Suburb Eyes New Commercial Airport as Population Booms,still open
Texas Instruments,02/10/2023,Active IR Sensor Market - 37% of Growth to Originate from APAC ...,still open
Texas Instruments,02/10/2023,DC/DC Switching Regulators Market is Predicted to Reach US ...,still open
Texas Instruments,02/10/2023,Digital Potentiometer IC Sales Market is Expected to Reach US ...,still open
Texas Instruments,02/10/2023,M31 on the Specification and Development of MIPI Physical Layer,still open
Texas Instruments,02/10/2023,Wireless Connectivity Portfolio Market is expected to reach a value ...,still open
Texas Instruments,02/10/2023,Driver ICs Market demand and future scope with Russia-Ukraine ...,still open
Texas Instruments,02/10/2023,Energy Harvesting Market is anticipated to expand at a CAGR of + ...,still open
Texas Instruments,02/10/2023,"In-Vehicle Ethernet Gateway Market Statistical Forecast, Trade ...",still open
Texas Instruments,02/10/2023,"Shower Bases & Pans Market Development Size 2023 |AMS, Texas ...",still open
Texas Instruments,02/10/2023,Power Over Ethernet Controller Market Overview 2023-2029| Key ...,still open
Texas Instruments,02/10/2023,Microcrystal Real Time Clock Market Booming Worldwide With ...,still open
Texas Instruments,02/10/2023,Bluetooth Modules Market Biggest Innovation with Top Key Players ...,still open
Texas Instruments,02/10/2023,Korea Investment CORP Cuts Stock Holdings in Texas Instruments ...,still open
Texas Instruments,02/10/2023,Is Texas Instruments Stock a Better Buy Than Taiwan ...,still open
Texas Instruments,02/10/2023,"Texas Instruments Stock: Promising Industry, Better Business Model",still open
Texas Instruments,02/10/2023,Better Semiconductor Stock: Texas Instruments vs. Broadcom,still open
Texas Instruments,02/10/2023,"Top Stock Reports for Texas Instruments, Enbridge & Fiserv",still open
Texas Instruments,02/10/2023,Texas Instruments Revs Up Its Chip Manufacturing Engine -- Is the ...,still open
Texas Instruments,02/10/2023,Where Will Texas Instruments Stock Be in 1 Year?,still open
Texas Instruments,02/10/2023,"Stocks making the biggest moves after hours: Microsoft, Texas Instruments, Capital One & more",still open
Texas Instruments,02/10/2023,Vanguard Group Increases Position in Texas Instruments (TXN),still open
Texas Instruments,02/10/2023,Texas Instruments replaces CEO Rich Templeton with current operating chief Haviv Ilan,still open
Texas Instruments,02/10/2023,Is Texas Instruments Incorporated's (NASDAQ:TXN) Recent Stock Performance Influenced By Its Fundamentals In Any Way?,still open
Texas Instruments,02/10/2023,Texas Instruments Inc. stock underperforms Tuesday when compared to competitors,still open
Texas Instruments,02/10/2023,Metis Global Partners LLC raises its stake in Texas Instruments ...,still open
Texas Instruments,02/10/2023,"Texas Instruments Inc. stock falls Thursday, underperforms market",still open
Texas Instruments,02/10/2023,BlackRock Increases Position in Texas Instruments (TXN),still open
Texas Instruments,02/10/2023,If You Invested $10000 in TI Stock When Rich Templeton Became ...,still open
Texas Instruments,02/10/2023,Where Will Qualcomm Stock Be In 1 Year?,still open
Texas Instruments,02/10/2023,March 24th Options Now Available For Texas Instruments (TXN),still open
Texas Instruments,02/10/2023,Semiconductor Stocks Could Rally Huge in 2023: 7 ‘Strong Buy’ Favorites With Big Dividends,still open
Texas Instruments,02/10/2023,Texas Instruments (TXN) Introduces Ultrasonic Lens Chipsets,still open
Texas Instruments,02/10/2023,Dividend Growth Stock Watchlist - February 2023,still open
Texas Instruments,02/10/2023,"Tale Of 2 Chip Stocks: Ahead Of Intel, Texas Instruments Earnings, Analysts Weigh In On Results, Q1 Outlo",still open
Texas Instruments,02/10/2023,"Earnings Previews: ASML, Microsoft, Texas Instruments",still open
Texas Instruments,02/10/2023,"Analog Devices Inc. stock rises Thursday, outperforms market",still open
Texas Instruments,02/10/2023,Why Investors Need to Take Advantage of These 2 Computer and ...,still open
Texas Instruments,02/10/2023,"TE Connectivity Ltd. stock rises Thursday, outperforms market",still open
Texas Instruments,02/10/2023,Validea Daily Guru Fundamental Report for TXN - 2/6/2023,still open
Texas Instruments,02/10/2023,7 Dividend Stocks to Buy for a Reliable Income Stream,still open
Texas Instruments,02/10/2023,7 Retirement Stocks to Buy Now,still open
Texas Instruments,02/10/2023,Boston Financial Mangement LLC Raises Stock Holdings in Waters ...,still open
Texas Instruments,02/10/2023,The 7 Most Undervalued Blue-Chip Stocks to Buy in February 2023,still open
Texas Instruments,02/10/2023,"Texas Instruments earnings beat by $0.02, revenue topped ...",still open
Texas Instruments,02/10/2023,"Emerson makes hostile $7.6 billion offer on Texas company, after ...",still open
Texas Instruments,02/10/2023,Why Texas Instruments Stock Was Falling Earlier Today,still open
Texas Instruments,02/10/2023,Teacher Retirement System of Texas Takes Position in ...,still open
Texas Instruments,02/10/2023,"NXP Semiconductor Stock Falls, but the 2023 Outlook for EVs and ...",still open
Texas Instruments,02/10/2023,"10365 Shares in Vishay Precision Group, Inc. (NYSE:VPG) Acquired ...",still open
Texas Instruments,02/10/2023,Why Did Texas Instruments Stock Jump 12% in November?,still open
Texas Instruments,02/10/2023,Is Texas Instruments Stock a Buy Right Now?,still open
Texas Instruments,02/10/2023,"Legacy Advisors LLC invests $206,000 in National Instruments Co ...",still open
Texas Instruments,02/10/2023,The 10 Best Stocks to Buy in February 2023,still open
Texas Instruments,02/10/2023,Netflix's CEO Change Is Huge. This One Matters Even More,still open
Texas Instruments,02/10/2023,"Susquehanna Adjusts Texas Instruments Price Target to $210 From $205, Maintains Positive Rating",still open
Texas Instruments,02/10/2023,What’s Behind Texas Instruments Stock’s Consistent Outperformance Of The Markets?,still open
Texas Instruments,02/10/2023,Oil Prices Dip After Country’s Oil Inventories Hit Highest In Months,still open
Texas Instruments,02/10/2023,"Stock market today: Dow ends flat as Microsoft fights back, financials gain",still open
Texas Instruments,02/10/2023,Texas Instruments Stock: Dividend Growth Winner Yields Over 3%,still open
Texas Instruments,02/10/2023,Stock Market | FinancialContent Business Page,still open
Texas Instruments,02/10/2023,Texas Instruments Stock: The Boom Cycle Is Still On (NASDAQ:TXN),still open
Texas Instruments,02/10/2023,WILKINS INVESTMENT COUNSEL INC,still open
Texas Instruments,02/10/2023,Qualcomm Stock Joins Other Semiconductor Stocks In Guiding Lower,still open
Texas Instruments,02/10/2023,Why I Own Texas Instruments Stock,still open
Texas Instruments,02/10/2023,Texas Instruments Stock: Analog Chips Are Sustainably Profitable ...,still open
Texas Instruments,02/10/2023,System on Module uses TI AM62x processor ...,still open
Texas Instruments,02/10/2023,Microchip Technology: Differentiated Exposures Serving Well ...,still open
Texas Instruments,02/10/2023,Stock Market | FinancialContent Business Page,still open
Texas Instruments,02/10/2023,TEXAS INSTRUMENTS INC : Change in Directors or Principal Officers (form 8-K),still open
Texas Instruments,02/10/2023,Stock Market | FinancialContent Business Page,still open
Texas Instruments,02/10/2023,Japan Stepped Into Forex Market Twice in October to Prop Up Yen,still open
Texas Instruments,02/10/2023,Texas Instruments Stock Up 1.7x On The Back Of Strong Sales Growth,still open
Texas Instruments,02/10/2023,"Texas Instruments stock rises on earnings beat, outlook",still open
Texas Instruments,02/10/2023,"Texas Instruments Plans $15 Billion in Share Buybacks, Boosts ...",still open
Texas Instruments,02/10/2023,3 Top Tech ETFs Worth Investors’ Attention,still open
Texas Instruments,02/10/2023,"Machine Vision market Share, Trustworthy Data and Analysis by 2033",still open
Texas Instruments,02/10/2023,"Texas Instruments (TXN): Safe And Increasing Dividend, But Risky ...",still open
Texas Instruments,02/10/2023,Development Boards Market Size [2023-2029] -Texas Instruments ...,still open
Texas Instruments,02/10/2023,Austin tech giant National Instruments exploring a possible sale,still open
Texas Instruments,02/10/2023,Strong Sales Growth Has Helped Texas Instruments Stock Outperform The S&P,still open
Texas Instruments,02/10/2023,"Bullish Signal, Fed Thoughts, Microsoft-Google AI Battle, Bard's ...",still open
Texas Instruments,02/10/2023,"Stocks making the biggest moves after hours: Alphabet, Microsoft, Texas Instruments and more",still open
Texas Instruments,02/10/2023,"QQQM, TXN, INTC, GILD: Large Inflows Detected at ETF",still open
Texas Instruments,02/10/2023,1 Monster Opportunity Arises in the Global Chip Shortage,still open
Texas Instruments,02/10/2023,Texas Instruments: Strong Fundamentals Make It A Buy,still open
Texas Instruments,02/10/2023,Automotive LED Driver Market to Witness Huge Growth by 2029 ...,still open
Texas Instruments,02/10/2023,3 Reasons Why Texas Instruments Stock Is A Must-Have (NASDAQ ...,still open
Texas Instruments,02/10/2023,Texas Instruments Stock: Make Profitability Great Again (NASDAQ ...,still open
Texas Instruments,02/10/2023,Here's What Texas Instruments' (NASDAQ:TXN) Strong Returns On Capital Mean,still open
Texas Instruments,02/10/2023,This Insider Has Just Sold Shares In Texas Instruments Incorporated (NASDAQ:TXN),still open
Texas Instruments,02/10/2023,Texas Instruments (NASDAQ:TXN) Is Reinvesting To Multiply In Value,still open
Texas Instruments,02/10/2023,"Why Texas Instruments, Micron Technology, and Navitas ...",still open
Texas Instruments,02/10/2023,Micron And Texas Instruments: The Most And Least Cyclical Chip ...,still open
Texas Instruments,02/10/2023,I'm Passing on Intel Because IBM and Texas Instruments Are Better,still open
Texas Instruments,02/10/2023,"Substation Market 2023 Growth, Share, Trend, Segmentation and ...",still open
Texas Instruments,02/10/2023,Impact Podcast with John Shegerian Features ESG Today’s Mark Segal,still open
Texas Instruments,02/10/2023,Current Mode PWM Controllers Market Booming Worldwide With ...,still open
Texas Instruments,02/10/2023,Texas Instruments Is A Buy (NASDAQ:TXN),still open
Texas Instruments,02/10/2023,"By 2028, Industrial Electronics Market in Size 2023 | New ...",still open
Texas Instruments,02/10/2023,"Citi cuts estimates on Texas Instruments, NXP, Microchip as analog ...",still open
Texas Instruments,02/10/2023,Signal Conditioners Market to Witness Huge Growth by 2029 ...,still open
Texas Instruments,02/10/2023,"The Zacks Analyst Blog Highlights Linde, Texas Instruments, Trane Technologies, PACCAR and AmerisourceBergen",still open
Texas Instruments,02/10/2023,Bluetooth 5.0 Market Growth Statistics 2022-2030: Global Size and ...,still open
Texas Instruments,02/10/2023,"Top Stock Reports for Comcast, Texas Instruments & Philip Morris",still open
Texas Instruments,02/10/2023,"Parking Sensors Market Size, Share, Growth Statistics By Top Key ...",still open
Texas Instruments,02/10/2023,Texas Instruments: Well-Placed To Navigate Semiconductor Sector,still open
Texas Instruments,02/10/2023,Semiconductor market size in the military and aerospace industry to ...,still open
Texas Instruments,02/10/2023,Better Dividend Stock: Texas Instruments vs. Intel,still open
Texas Instruments,02/10/2023,Korea Investment CORP Cuts Stock Holdings in Texas Instruments ...,still open
Texas Instruments,02/10/2023,Is Texas Instruments Stock a Better Buy Than Taiwan ...,still open
Texas Instruments,02/10/2023,"Texas Instruments Inc. stock falls Thursday, still outperforms market",still open
Texas Instruments,02/10/2023,Vanguard Group Increases Position in Texas Instruments (TXN),still open
Texas Instruments,02/10/2023,Texas Instruments' Sales Drop for the First Time Since 2020,still open
Texas Instruments,02/10/2023,Texas Instruments: The Semiconductor Stock to Own This Decade,still open
Texas Instruments,02/10/2023,Texas Instruments replaces CEO Rich Templeton with current operating chief Haviv Ilan,still open
Texas Instruments,02/10/2023,Variscite Launches New System on Module Powered by Texas ...,still open
Texas Instruments,02/10/2023,"Thanks to Texas Instruments, the Microchip Revolution Started in ...",still open
Texas Instruments,02/10/2023,"Stocks making the biggest moves after hours: Microsoft, Texas Instruments, Capital One & more",still open
Texas Instruments,02/10/2023,Spot On: Texas Instruments Announces First Chipset That Enables ...,still open
Texas Instruments,02/10/2023,BlackRock Increases Position in Texas Instruments (TXN),still open
Texas Instruments,02/10/2023,"Expansion, Cooling Demand to Hit Texas Instruments' Fourth ...",still open
Texas Instruments,02/10/2023,See Which Of The Latest 13F Filers Holds Texas Instruments,still open
