Name,Data,News,Evaluation
Texas Instruments,02/15/2023,"The Time-of-Flight Sensor market size is expected to grow from US$ 3,204.98 million in 2022 to US$ 8,426.63 million by 2028; it is estimated to grow at a CAGR of 17.5% from 2022 to 2028",still open
Texas Instruments,02/15/2023,Linear Resonant Actuators Market Size and Forecast to 2029 ...,still open
Texas Instruments,02/15/2023,Texas Instruments: Strong Fundamentals Make It A Buy,still open
Texas Instruments,02/15/2023,Texas Instruments' Forecast Signals Chip Demand Slump Is ...,still open
Texas Instruments,02/15/2023,What’s Behind Texas Instruments Stock’s Consistent Outperformance Of The Markets?,still open
Texas Instruments,02/15/2023,Texas Instruments micropchip plant now open in Utah,still open
Texas Instruments,02/15/2023,Texas Instruments: Well-Placed To Navigate Semiconductor Sector,still open
Texas Instruments,02/15/2023,Is Texas Instruments Stock a Buy Right Now?,still open
Texas Instruments,02/15/2023,Is Texas Instruments Incorporated (NASDAQ:TXN) Potentially Undervalued?,still open
Texas Instruments,02/15/2023,Texas Instruments Inc. stock underperforms Tuesday when compared to competitors,still open
Texas Instruments,02/15/2023,Texas Instruments Incorporated's (NASDAQ:TXN) Has Had A Decent Run On The Stock market: Are Fundamentals In The Driver's Seat?,still open
Texas Instruments,02/15/2023,Q1 2023 Earnings Forecast for Texas Instruments Incorporated ...,still open
Texas Instruments,02/15/2023,Is Texas Instruments Stock a Better Buy Than Taiwan ...,still open
Texas Instruments,02/15/2023,Semiconductor Stocks Could Rally Huge in 2023: 7 ‘Strong Buy’ Favorites With Big Dividends,still open
Texas Instruments,02/15/2023,"Texas Instruments Stock: Promising Industry, Better Business Model",still open
Texas Instruments,02/15/2023,Where Will Texas Instruments Stock Be in 1 Year?,still open
Texas Instruments,02/15/2023,Better Semiconductor Stock: Texas Instruments vs. Broadcom,still open
Texas Instruments,02/15/2023,Better Dividend Growth Stock: Texas Instruments vs. Microchip ...,still open
Texas Instruments,02/15/2023,"Stocks making the biggest moves after hours: Microsoft, Texas Instruments, Capital One & more",still open
Texas Instruments,02/15/2023,Texas Instruments replaces CEO Rich Templeton with current operating chief Haviv Ilan,still open
Texas Instruments,02/15/2023,"Texas Instruments GAAP EPS of $2.13 beats by $0.15, revenue of ...",still open
Texas Instruments,02/15/2023,Korea Investment CORP Cuts Stock Holdings in Texas Instruments ...,still open
Texas Instruments,02/15/2023,Bullish on EVs and Renewable Energy? This Top Stock Is a Buy ...,still open
Texas Instruments,02/15/2023,Is Texas Instruments Incorporated's (NASDAQ:TXN) Recent Stock Performance Influenced By Its Fundamentals In Any Way?,still open
Texas Instruments,02/15/2023,Texas Instruments (TXN) Introduces Ultrasonic Lens Chipsets,still open
Texas Instruments,02/15/2023,Vanguard Group Increases Position in Texas Instruments (TXN),still open
Texas Instruments,02/15/2023,TE Connectivity Ltd. stock outperforms market on strong trading day,still open
Texas Instruments,02/15/2023,Validea Daily Guru Fundamental Report for TXN - 2/13/2023,still open
Texas Instruments,02/15/2023,Don't fall into the Intel dividend trap: These fund managers find the ...,still open
Texas Instruments,02/15/2023,BlackRock Increases Position in Texas Instruments (TXN),still open
Texas Instruments,02/15/2023,Metis Global Partners LLC raises its stake in Texas Instruments ...,still open
Texas Instruments,02/15/2023,Semiconductor ETFs Shining Amid Mixed Numbers in Q4 Earnings,still open
Texas Instruments,02/15/2023,March 24th Options Now Available For Texas Instruments (TXN),still open
Texas Instruments,02/15/2023,"Analog Devices Inc. stock rises Monday, still underperforms market",still open
Texas Instruments,02/15/2023,"If You Invested $10,000 in TI Stock When Rich Templeton Became ...",still open
Texas Instruments,02/15/2023,2 Disruptive Technology Stocks That Can Thrive in 2023,still open
Texas Instruments,02/15/2023,See Which Of The Latest 13F Filers Holds Texas Instruments,still open
Texas Instruments,02/15/2023,Where Will Qualcomm Stock Be In 1 Year?,still open
Texas Instruments,02/15/2023,"Tale Of 2 Chip Stocks: Ahead Of Intel, Texas Instruments Earnings, Analysts Weigh In On Results, Q1 Outlo",still open
Texas Instruments,02/15/2023,Why Texas Instruments is a Top 25 Dividend Giant (TXN),still open
Texas Instruments,02/15/2023,"Senator Markey Joins Senator Warren, Lawmakers in Calling on ...",still open
Texas Instruments,02/15/2023,"Earnings Previews: ASML, Microsoft, Texas Instruments",still open
Texas Instruments,02/15/2023,7 Retirement Stocks to Buy Now,still open
Texas Instruments,02/15/2023,"Microsoft, Texas Instruments Beat on Quarterly Earnings",still open
Texas Instruments,02/15/2023,"Emerson makes hostile $7.6 billion offer on Texas company, after ...",still open
Texas Instruments,02/15/2023,Down but Not Out: Buy These Beaten-Down Dividend Stocks Before ...,still open
Texas Instruments,02/15/2023,"Texas Instruments earnings beat by $0.02, revenue topped ...",still open
Texas Instruments,02/15/2023,Texas Instruments (TXN) Tops Q4 Earnings and Revenue Estimates,still open
Texas Instruments,02/15/2023,DIODES INC /DEL/ : Change in Directors or Principal Officers (form 8-K),still open
Texas Instruments,02/15/2023,STM vs. TXN: Which Stock Is the Better Value Option?,still open
Texas Instruments,02/15/2023,Why Texas Instruments Stock Was Falling Earlier Today,still open
Texas Instruments,02/15/2023,3 Stocks to Add to Your Portfolio in a Market Pullback,still open
Texas Instruments,02/15/2023,"Stock Market Today: Dow, S&P Live Updates for Jan. 24",still open
Texas Instruments,02/15/2023,Is Texas Instruments Stock a Buy Right Now?,still open
Texas Instruments,02/15/2023,Why Did Texas Instruments Stock Jump 12% in November?,still open
Texas Instruments,02/15/2023,The 7 Best Dividend Stocks to Buy for 2023,still open
Texas Instruments,02/15/2023,Stock Market: These Hot Investors Are Bullish | Investor's Business ...,still open
Texas Instruments,02/15/2023,"Friday’s Top Analyst Upgrades and Downgrades: Alcoa, Charles Schwab, IBM, Newmont, Philip Morris, Roblox, Shopify, Texas Instruments, Transocean and More",still open
Texas Instruments,02/15/2023,Netflix's CEO Change Is Huge. This One Matters Even More,still open
Texas Instruments,02/15/2023,The 7 Most Undervalued Blue-Chip Stocks to Buy in February 2023,still open
Texas Instruments,02/15/2023,"Analog Devices Inc. stock falls Tuesday, underperforms market",still open
Texas Instruments,02/15/2023,What to Expect From Stocks in 2023,still open
Texas Instruments,02/15/2023,"NXP Semiconductor Stock Falls, but the 2023 Outlook for EVs and ...",still open
Texas Instruments,02/15/2023,National Instruments Stock Scores Rising Price Performance With ...,still open
Texas Instruments,02/15/2023,Stock market news live updates: Stocks finish mixed as investors evaluate deluge of earnings,still open
Texas Instruments,02/15/2023,What’s Behind Texas Instruments Stock’s Consistent Outperformance Of The Markets?,still open
Texas Instruments,02/15/2023,Texas businesses feel the burn of higher taxes and look to legislature for help,still open
Texas Instruments,02/15/2023,The 10 Best Stocks to Buy in February 2023,still open
Texas Instruments,02/15/2023,Texas Instruments Stock: Dividend Growth Winner Yields Over 3%,still open
Texas Instruments,02/15/2023,"Benchmark Adjusts Texas Instruments' Price Target to $203 From $189, Keeps Buy Rating",still open
Texas Instruments,02/15/2023,Why I Own Texas Instruments Stock,still open
Texas Instruments,02/15/2023,Texas Instruments Stock: The Boom Cycle Is Still On (NASDAQ:TXN),still open
Texas Instruments,02/15/2023,"Susquehanna Adjusts Texas Instruments Price Target to $210 From $205, Maintains Positive Rating",still open
Texas Instruments,02/15/2023,"Goldman Sachs Adjusts Price Target on Texas Instruments to $159 From $162, Maintains Sell Rating",still open
Texas Instruments,02/15/2023,Texas Instruments signals expanding pain for chipmakers with somber forecast,still open
Texas Instruments,02/15/2023,Tech's Ferocious Rally Raises Bar for Earnings as Red Flags Wave,still open
Texas Instruments,02/15/2023,Variscite Launches New System on Module Powered by Texas ...,still open
Texas Instruments,02/15/2023,"Truist Securities Adjusts Price Target on Texas Instruments to $177 From $158, Maintains Hold Rating",still open
Texas Instruments,02/15/2023,TEXAS INSTRUMENTS INC : Results of Operations and Financial Condition (form 8-K),still open
Texas Instruments,02/15/2023,Power Management IC (PMIC) Market Analysis 2023-2029 : Texas ...,still open
Texas Instruments,02/15/2023,Texas Instruments Stock: Analog Chips Are Sustainably Profitable ...,still open
Texas Instruments,02/15/2023,Global SiC Based Power Electronics and Inverter Market Size to grow USD 5800 Million by 2030 at a CAGR of 35%: Spherical Insights,still open
Texas Instruments,02/15/2023,"Texas Instruments stock rises on earnings beat, outlook",still open
Texas Instruments,02/15/2023,Here is What to Know Beyond Why Texas Instruments Incorporated (TXN) is a Trending Stock,still open
Texas Instruments,02/15/2023,Texas Instruments Stock Up 1.7x On The Back Of Strong Sales Growth,still open
Texas Instruments,02/15/2023,"Texas Instruments Plans $15 Billion in Share Buybacks, Boosts ...",still open
Texas Instruments,02/15/2023,$100 Invested In This Stock 15 Years Ago Would Be Worth $600 Today - Texas Instruments (NASDAQ:TXN),still open
Texas Instruments,02/15/2023,Legacy Advisors LLC Makes New $206000 Investment in National ...,still open
Texas Instruments,02/15/2023,"Bluetooth Modules Market Size, Share, Growth Statistics By Top Key ...",still open
Texas Instruments,02/15/2023,Where Will Broadcom Stock Be In 1 Year?,still open
Texas Instruments,02/15/2023,Strong Sales Growth Has Helped Texas Instruments Stock Outperform The S&P,still open
Texas Instruments,02/15/2023,"Texas Instruments (TXN): Safe And Increasing Dividend, But Risky ...",still open
Texas Instruments,02/15/2023,TE Connectivity Ltd. stock outperforms competitors despite losses on the day,still open
Texas Instruments,02/15/2023,"Stocks making the biggest moves after hours: Alphabet, Microsoft, Texas Instruments and more",still open
Texas Instruments,02/15/2023,1 Monster Opportunity Arises in the Global Chip Shortage,still open
Texas Instruments,02/15/2023,Voltage Detector Market Analysis and Forecast to 2032 by Recent ...,still open
Texas Instruments,02/15/2023,Chip Carrier Market Research Report 2023 - Texas Instruments ...,still open
Texas Instruments,02/15/2023,I'm Passing on Intel Because IBM and Texas Instruments Are Better,still open
Texas Instruments,02/15/2023,Estimating The Fair Value Of Texas Instruments Incorporated (NASDAQ:TXN),still open
Texas Instruments,02/15/2023,Texas Instruments: Strong Fundamentals Make It A Buy,still open
Texas Instruments,02/15/2023,2 Leading Dividend-Paying Tech Stocks to Buy Amid Current Climate,still open
Texas Instruments,02/15/2023,Texas Instruments Inc. stock underperforms Tuesday when compared to competitors,still open
Texas Instruments,02/15/2023,Texas Instruments Incorporated's (NASDAQ:TXN) Has Had A Decent Run On The Stock market: Are Fundamentals In The Driver's Seat?,still open
Texas Instruments,02/15/2023,Texas Instruments Full Year 2022 Earnings: EPS Beats Expectations,still open
Texas Instruments,02/15/2023,Better Dividend Growth Stock: Texas Instruments vs. Microchip ...,still open
Texas Instruments,02/15/2023,Is Texas Instruments Stock a Better Buy Than Taiwan ...,still open
Texas Instruments,02/15/2023,"Texas Instruments Stock: Promising Industry, Better Business Model",still open
Texas Instruments,02/15/2023,Texas Instruments' Sales Drop for the First Time Since 2020,still open
Texas Instruments,02/15/2023,Texas Instruments replaces CEO Rich Templeton with current operating chief Haviv Ilan,still open
Texas Instruments,02/15/2023,Texas Instruments: The Semiconductor Stock to Own This Decade,still open
Texas Instruments,02/15/2023,"Thanks to Texas Instruments, the Microchip Revolution Started in ...",still open
Texas Instruments,02/15/2023,Vanguard Group Increases Position in Texas Instruments (TXN),still open
Texas Instruments,02/15/2023,Does Texas Instruments (NASDAQ:TXN) Have A Healthy Balance Sheet?,still open
Texas Instruments,02/15/2023,Spot On: Texas Instruments Announces First Chipset That Enables ...,still open
Texas Instruments,02/15/2023,Variscite Launches New System on Module Powered by Texas ...,still open
Texas Instruments,02/15/2023,Korea Investment CORP Cuts Stock Holdings in Texas Instruments ...,still open
Texas Instruments,02/15/2023,Power Management IC (PMIC) Market Analysis 2023-2029 : Texas ...,still open
Texas Instruments,02/15/2023,BlackRock Increases Position in Texas Instruments (TXN),still open
Texas Instruments,02/15/2023,Texas Instruments promotes Haviv Ilan as CEO,still open
Texas Instruments,02/15/2023,Why Texas Instruments is a Top 25 Dividend Giant (TXN),still open
Texas Instruments,02/15/2023,"Automotive Electronic Components Market Scenario – NXP, Infineon ...",still open
Texas Instruments,02/15/2023,March 24th Options Now Available For Texas Instruments (TXN),still open
Texas Instruments,02/15/2023,See Which Of The Latest 13F Filers Holds Texas Instruments,still open
Texas Instruments,02/15/2023,Texas Instruments signals expanding pain for chipmakers with somber forecast,still open
Texas Instruments,02/15/2023,"Microsoft, Texas Instruments Beat on Quarterly Earnings",still open
Texas Instruments,02/15/2023,Bullish on EVs and Renewable Energy? This Top Stock Is a Buy ...,still open
Texas Instruments,02/15/2023,Semiconductor ETFs Shining Amid Mixed Numbers in Q4 Earnings,still open
Texas Instruments,02/15/2023,Voltage Detector Market Analysis and Forecast to 2032 by Recent ...,still open
Texas Instruments,02/15/2023,Texas Instruments Appoints Company Veteran Haviv Ilan As New CEO; Rich Templeton Will Continue As Chair -,still open
Texas Instruments,02/15/2023,Texas Instruments (TXN) Tops Q4 Earnings and Revenue Estimates,still open
Texas Instruments,02/15/2023,"Susquehanna Adjusts Texas Instruments Price Target to $210 From $205, Maintains Positive Rating",still open
Texas Instruments,02/15/2023,Texas businesses feel the burn of higher taxes and look to legislature for help,still open
Texas Instruments,02/15/2023,"Goldman Sachs Adjusts Price Target on Texas Instruments to $159 From $162, Maintains Sell Rating",still open
Texas Instruments,02/15/2023,Flyback Hybrid Converters Market Is Thriving Worldwide-Texas ...,still open
Texas Instruments,02/15/2023,"Benchmark Adjusts Texas Instruments' Price Target to $203 From $189, Keeps Buy Rating",still open
Texas Instruments,02/15/2023,"Tale Of 2 Chip Stocks: Ahead Of Intel, Texas Instruments Earnings, Analysts Weigh In On Results, Q1 Outlo",still open
Texas Instruments,02/15/2023,"Truist Securities Adjusts Price Target on Texas Instruments to $177 From $158, Maintains Hold Rating",still open
Texas Instruments,02/15/2023,Validea Daily Guru Fundamental Report for TXN - 2/13/2023,still open
Texas Instruments,02/15/2023,Global Graphing Calculator Market Report 2022 to 2030 - Featuring ...,still open
Texas Instruments,02/15/2023,"Earnings Previews: ASML, Microsoft, Texas Instruments",still open
Texas Instruments,02/15/2023,Power Semiconductor Market worth $7.3 billion by 2027 -Infineon ...,still open
Texas Instruments,02/15/2023,Metis Global Partners LLC Increases Stock Holdings in Texas ...,still open
Texas Instruments,02/15/2023,TEXAS INSTRUMENTS INC : Results of Operations and Financial Condition (form 8-K),still open
Texas Instruments,02/15/2023,Instrumentation Amplifiers Market Is Thriving Worldwide-Texas ...,still open
Texas Instruments,02/15/2023,Analog Semiconductors (Memory) Market Size And Forecast -Texas ...,still open
Texas Instruments,02/15/2023,TE Connectivity Ltd. stock outperforms market on strong trading day,still open
Texas Instruments,02/15/2023,Chip Carrier Market Research Report 2023 - Texas Instruments ...,still open
Texas Instruments,02/15/2023,A potential firmware mistake may lead to control instability - EDN,still open
Texas Instruments,02/15/2023,Global SiC Based Power Electronics and Inverter Market Size to grow USD 5800 Million by 2030 at a CAGR of 35%: Spherical Insights,still open
Texas Instruments,02/15/2023,Automotive Ethernet PHYs Market Size And Forecast -Texas ...,still open
Texas Instruments,02/15/2023,Zeal for Living Moves Forward With North Texas SFR Project,still open
Texas Instruments,02/15/2023,Ultrasonic Parking Sensor Market Is Thriving Worldwide-TGS Group ...,still open
Texas Instruments,02/15/2023,Texas Instruments Tops Q4 EPS by 2c By Investing.com,still open
Texas Instruments,02/15/2023,Digital Hall Effect Sensors Market Development Size 2023 ...,still open
Texas Instruments,02/15/2023,In-Vehicle Networking Market would Register a Healthy Growth of ...,still open
Texas Instruments,02/15/2023,Noninvasive Medical Sensors Market worth $7.3 billion by 2027 ...,still open
Texas Instruments,02/15/2023,Don't fall into the Intel dividend trap: These fund managers find the ...,still open
Texas Instruments,02/15/2023,Netflix's CEO Change Is Huge. This One Matters Even More,still open
Texas Instruments,02/15/2023,DIODES INC /DEL/ : Change in Directors or Principal Officers (form 8-K),still open
Texas Instruments,02/15/2023,Automotive LED Lighting Driver Market 2023 Competitive and ...,still open
Texas Instruments,02/15/2023,"Texas Instruments earnings beat by $0.02, revenue topped ...",still open
Texas Instruments,02/15/2023,Digital Projection E-Vision 4000 4K-UHD Projector,still open
Texas Instruments,02/15/2023,Bidirectional Converter Market is likely to expand US$ 2.5 Bn at 10.6 ...,still open
Texas Instruments,02/15/2023,Automotive Image Signal Processor Market Current Status and ...,still open
Texas Instruments,02/15/2023,Douglas Harris Obituary (1936 - 2023),still open
Texas Instruments,02/15/2023,Mark Godwin – Bowie News,still open
Texas Instruments,02/15/2023,High Voltage Contactor Market Current Status and Future Prospects ...,still open
Texas Instruments,02/15/2023,U.S. Sen. Baldwin: Calls on Biden Administration to prevent CHIPS ...,still open
Texas Instruments,02/15/2023,Sherman adopts updated zoning map on cusp of unprecedented ...,still open
Texas Instruments,02/15/2023,"Most Read articles - Sales growth, TI's AM62x, Chips Act money",still open
Texas Instruments,02/15/2023,"Smart Gate Driver Market Size, Development Data, Growth Analysis ...",still open
Texas Instruments,02/15/2023,Inductive Wireless Charging System Market Growing at a CAGR ...,still open
Texas Instruments,02/15/2023,"Bluetooth Modules Market Size, Share, Growth Statistics By Top Key ...",still open
Texas Instruments,02/15/2023,High Speed SerDes Transceivers Market is expected to reach a ...,still open
Texas Instruments,02/15/2023,3D Imaging in Tablet Market Is Thriving Worldwide-Viavi Solutions ...,still open
Texas Instruments,02/15/2023,TSMC's Morris Chang: $50 Billion US Chip Investment Is Just a ...,still open
Texas Instruments,02/15/2023,Russia buys US-made components for electronic warfare systems ...,still open
Texas Instruments,02/15/2023,Automotive Rear Occupant Alert System Market - 37% of Growth to ...,still open
Texas Instruments,02/15/2023,"Microwave Power Transmission System Market Size, Development ...",still open
Texas Instruments,02/15/2023,Automotive Autonomous Emergency Braking System Market is likely ...,still open
Texas Instruments,02/15/2023,USB Controllers Market To Grow Extensively At Unstoppable Rate ...,still open
Texas Instruments,02/15/2023,Digital Power ICs Global Market Report 2023: Design & Efficiency Challenges of Cellular Base Station Equipment Spurs Adoption of Digital Power Technologies,still open
Texas Instruments,02/15/2023,"Smart Home ICs Market Size, Share, Growth and Trends 2023-2029 ...",still open
Texas Instruments,02/15/2023,The 2023 autoXreport Innovator Awards Honors Executives and Companies in Automotive Tech,still open
Texas Instruments,02/15/2023,Automotive Software Market to hit USD 409.29 Bn over the forecast ...,still open
Texas Instruments,02/15/2023,Automotive central gateway module market to grow at a CAGR of ...,still open
Texas Instruments,02/15/2023,"Embedded Microprocessor Market Size [2023-2029] -HP, Dell ...",still open
Texas Instruments,02/15/2023,Smartphone System on Chip (SoC) Market to Cross US$ 2.8 billion ...,still open
Texas Instruments,02/15/2023,"The Transistor at 75: The First Makers, Part 3 – EEJournal",still open
Texas Instruments,02/15/2023,Three true things about James Bradberry's holding call in Super ...,still open
Texas Instruments,02/15/2023,Radio Frequency (RF) Mixer Industry is Expected to Reach $8 ...,still open
Texas Instruments,02/15/2023,"The Time-of-Flight Sensor market size is expected to grow from US$ 3,204.98 million in 2022 to US$ 8,426.63 million by 2028; it is estimated to grow at a CAGR of 17.5% from 2022 to 2028",still open
Texas Instruments,02/15/2023,Linear Resonant Actuators Market Size and Forecast to 2029 ...,still open
Texas Instruments,02/15/2023,Texas Instruments: Strong Fundamentals Make It A Buy,still open
Texas Instruments,02/15/2023,Texas Instruments' Forecast Signals Chip Demand Slump Is ...,still open
Texas Instruments,02/15/2023,What’s Behind Texas Instruments Stock’s Consistent Outperformance Of The Markets?,still open
Texas Instruments,02/15/2023,Texas Instruments micropchip plant now open in Utah,still open
Texas Instruments,02/15/2023,Texas Instruments: Well-Placed To Navigate Semiconductor Sector,still open
Texas Instruments,02/15/2023,Is Texas Instruments Stock a Buy Right Now?,still open
Texas Instruments,02/15/2023,Is Texas Instruments Incorporated (NASDAQ:TXN) Potentially Undervalued?,still open
Texas Instruments,02/15/2023,Texas Instruments Inc. stock underperforms Tuesday when compared to competitors,still open
Texas Instruments,02/15/2023,Texas Instruments Incorporated's (NASDAQ:TXN) Has Had A Decent Run On The Stock market: Are Fundamentals In The Driver's Seat?,still open
Texas Instruments,02/15/2023,Q1 2023 Earnings Forecast for Texas Instruments Incorporated ...,still open
Texas Instruments,02/15/2023,Is Texas Instruments Stock a Better Buy Than Taiwan ...,still open
Texas Instruments,02/15/2023,Semiconductor Stocks Could Rally Huge in 2023: 7 ‘Strong Buy’ Favorites With Big Dividends,still open
Texas Instruments,02/15/2023,"Texas Instruments Stock: Promising Industry, Better Business Model",still open
Texas Instruments,02/15/2023,Where Will Texas Instruments Stock Be in 1 Year?,still open
Texas Instruments,02/15/2023,Better Semiconductor Stock: Texas Instruments vs. Broadcom,still open
Texas Instruments,02/15/2023,Better Dividend Growth Stock: Texas Instruments vs. Microchip ...,still open
Texas Instruments,02/15/2023,"Stocks making the biggest moves after hours: Microsoft, Texas Instruments, Capital One & more",still open
Texas Instruments,02/15/2023,Texas Instruments replaces CEO Rich Templeton with current operating chief Haviv Ilan,still open
Texas Instruments,02/15/2023,"Texas Instruments GAAP EPS of $2.13 beats by $0.15, revenue of ...",still open
Texas Instruments,02/15/2023,Korea Investment CORP Cuts Stock Holdings in Texas Instruments ...,still open
Texas Instruments,02/15/2023,Bullish on EVs and Renewable Energy? This Top Stock Is a Buy ...,still open
Texas Instruments,02/15/2023,Is Texas Instruments Incorporated's (NASDAQ:TXN) Recent Stock Performance Influenced By Its Fundamentals In Any Way?,still open
Texas Instruments,02/15/2023,Texas Instruments (TXN) Introduces Ultrasonic Lens Chipsets,still open
Texas Instruments,02/15/2023,Vanguard Group Increases Position in Texas Instruments (TXN),still open
Texas Instruments,02/15/2023,TE Connectivity Ltd. stock outperforms market on strong trading day,still open
Texas Instruments,02/15/2023,Validea Daily Guru Fundamental Report for TXN - 2/13/2023,still open
Texas Instruments,02/15/2023,Don't fall into the Intel dividend trap: These fund managers find the ...,still open
Texas Instruments,02/15/2023,BlackRock Increases Position in Texas Instruments (TXN),still open
Texas Instruments,02/15/2023,Metis Global Partners LLC raises its stake in Texas Instruments ...,still open
Texas Instruments,02/15/2023,Semiconductor ETFs Shining Amid Mixed Numbers in Q4 Earnings,still open
Texas Instruments,02/15/2023,March 24th Options Now Available For Texas Instruments (TXN),still open
Texas Instruments,02/15/2023,"Analog Devices Inc. stock rises Monday, still underperforms market",still open
Texas Instruments,02/15/2023,"If You Invested $10,000 in TI Stock When Rich Templeton Became ...",still open
Texas Instruments,02/15/2023,2 Disruptive Technology Stocks That Can Thrive in 2023,still open
Texas Instruments,02/15/2023,See Which Of The Latest 13F Filers Holds Texas Instruments,still open
Texas Instruments,02/15/2023,Where Will Qualcomm Stock Be In 1 Year?,still open
Texas Instruments,02/15/2023,"Tale Of 2 Chip Stocks: Ahead Of Intel, Texas Instruments Earnings, Analysts Weigh In On Results, Q1 Outlo",still open
Texas Instruments,02/15/2023,Why Texas Instruments is a Top 25 Dividend Giant (TXN),still open
Texas Instruments,02/15/2023,"Senator Markey Joins Senator Warren, Lawmakers in Calling on ...",still open
Texas Instruments,02/15/2023,"Earnings Previews: ASML, Microsoft, Texas Instruments",still open
