Name,Data,News,Evaluation
Texas Instruments,02/21/2023,Integrated Passive Devices (IPD) Market Biggest Innovation with ...,still open
Texas Instruments,02/21/2023,How engineers can use sustainable manufacturing strategies to ...,still open
Texas Instruments,02/21/2023,"Haptic Driver Product Market Size, Development Data, Growth ...",still open
Texas Instruments,02/21/2023,Semiconductor for Consumer Electronic Market Size & Analysis By ...,still open
Texas Instruments,02/21/2023,Radio Frequency Front-end Module Sales Market Statistical ...,still open
Texas Instruments,02/21/2023,Time-of-Flight Sensors for Automotive In-Cabin Market Size & ...,still open
Texas Instruments,02/21/2023,Global LED Driver Market Size Will Cross $17.74 Billion by 2028 ...,still open
Texas Instruments,02/21/2023,Current Mirror Market Size 2023 Industry Recent Developments and ...,still open
Texas Instruments,02/21/2023,"HBO’s ‘Love & Death’: Where is Pat Montgomery now, the husband who Candy cheated on?",still open
Texas Instruments,02/21/2023,Display Controllers Market Overview 2023-2029| Key Players ...,still open
Texas Instruments,02/21/2023,Carvana landlord lists Lehi location for $7.7 million,still open
Texas Instruments,02/21/2023,Mayor Eric Johnson is the first Dallas mayor to run unopposed since ... Erik Jonsson,still open
Texas Instruments,02/21/2023,"New Zealand Air Purifier Market Growth Prospects, Competitive ...",still open
Texas Instruments,02/21/2023,DMD Chip Market 2023 key developmental strategies implemented ...,still open
Texas Instruments,02/21/2023,Bluetooth Modules Market Biggest Innovation with Top Key Players ...,still open
Texas Instruments,02/21/2023,Memory Particles Market – A Comprehensive Study by Key Players ...,still open
Texas Instruments,02/21/2023,Analog IC Market Size and Forecast to 2029 -Texas Instruments ...,still open
Texas Instruments,02/21/2023,Automotive Chip Market is booming Globally with Top key players ...,still open
Texas Instruments,02/21/2023,Environmental Sensor Market Size 2023 Industry Recent ...,still open
Texas Instruments,02/21/2023,Texas businesses feel burn of higher taxes and seek legislative help,still open
Texas Instruments,02/21/2023,Automotive Power Management IC Market Research Report 2023 ...,still open
Texas Instruments,02/21/2023,Nearing Retirement? These Stocks Are as Safe as They Come,still open
Texas Instruments,02/21/2023,USB Smart Card Token Market Size & Analysis By 2023 -2029 ...,still open
Texas Instruments,02/21/2023,Digital Pattern Generator Market 2023 key developmental strategies ...,still open
Texas Instruments,02/21/2023,AC-DC Controllers Market to Witness Huge Growth by 2029 -ON ...,still open
Texas Instruments,02/21/2023,Flyback Hybrid Converters Market Is Thriving Worldwide-Texas ...,still open
Texas Instruments,02/21/2023,"Ultrasonic Occupancy Sensor Market Size, Development Data ...",still open
Texas Instruments,02/21/2023,Vector Signal Transceivers Market Booming Worldwide With ...,still open
Texas Instruments,02/21/2023,Interaction Sensor Market Biggest Innovation with Top Key Players ...,still open
Texas Instruments,02/21/2023,Up-Down Converter and Mixer Circuits Market Size & Analysis By ...,still open
Texas Instruments,02/21/2023,Automotive Electronics Market: The Upcoming Landscape of ...,still open
Texas Instruments,02/21/2023,Micropower Voltage References Market 2023 Segments Analysis by ...,still open
Texas Instruments,02/21/2023,Fin Field Effect Transistor (FinFET) Market Upcoming Trends ...,still open
Texas Instruments,02/21/2023,Low Voltage DC-DC LED Drivers Market is Expected to Reach US ...,still open
Texas Instruments,02/21/2023,Tablet and E-Reader Application Processors Market 2023 key ...,still open
Texas Instruments,02/21/2023,Radiation-hardened electronics market to grow at a CAGR of 4.02 ...,still open
Texas Instruments,02/21/2023,"I2C Bus Market Upcoming Trends, Segmented by Type, Application ...",still open
Texas Instruments,02/21/2023,IoT Processors Market demand and future scope with Russia ...,still open
Texas Instruments,02/21/2023,GaN Industrial Devices Market To Grow Extensively At Unstoppable ...,still open
Texas Instruments,02/21/2023,Sensor Hub Market Research Report 2023 - Texas Instruments ...,still open
Texas Instruments,02/21/2023,Automotive Optoelectronics Market Size And Forecast -Avago ...,still open
Texas Instruments,02/21/2023,Ultrasonic Parking Sensor Market Is Thriving Worldwide-TGS Group ...,still open
Texas Instruments,02/21/2023,"Pico Projectors Market Size And Forecast -WowWee Group, Texas ...",still open
Texas Instruments,02/21/2023,"Car Infotainment SOCs Market Size, Development Data, Growth ...",still open
Texas Instruments,02/21/2023,"Thanks to Texas Instruments, the Microchip Revolution Started in ...",still open
Texas Instruments,02/21/2023,Texas Instruments micropchip plant now open in Utah,still open
Texas Instruments,02/21/2023,What’s Behind Texas Instruments Stock’s Consistent Outperformance Of The Markets?,still open
Texas Instruments,02/21/2023,Texas Instruments: Strong Fundamentals Make It A Buy,still open
Texas Instruments,02/21/2023,Is Texas Instruments Incorporated (NASDAQ:TXN) Potentially Undervalued?,still open
Texas Instruments,02/21/2023,Does Texas Instruments (NASDAQ:TXN) Have A Healthy Balance Sheet?,still open
Texas Instruments,02/21/2023,Texas Instruments: Well-Placed To Navigate Semiconductor Sector,still open
Texas Instruments,02/21/2023,"Go inside Texas Instruments' newest fab, where chips powering the ...",still open
Texas Instruments,02/21/2023,Where Will Texas Instruments Stock Be in 1 Year?,still open
Texas Instruments,02/21/2023,TXN Stock: Texas Instruments Beats Q4 Targets But Guides Low ...,still open
Texas Instruments,02/21/2023,"Texas Instruments comfortable with high chip inventory, claims it ...",still open
Texas Instruments,02/21/2023,Is Texas Instruments Stock a Better Buy Than Taiwan ...,still open
Texas Instruments,02/21/2023,"Texas Instruments Stock: Promising Industry, Better Business Model",still open
Texas Instruments,02/21/2023,Better Semiconductor Stock: Texas Instruments vs. Broadcom,still open
Texas Instruments,02/21/2023,"Stocks making the biggest moves after hours: Microsoft, Texas Instruments, Capital One & more",still open
Texas Instruments,02/21/2023,Better Dividend Growth Stock: Texas Instruments vs. Microchip ...,still open
Texas Instruments,02/21/2023,Texas Instruments Incorporated (NASDAQ:TXN) Shares Sold by ...,still open
Texas Instruments,02/21/2023,Shell Asset Management Co. Sells 9884 Shares of Texas ...,still open
Texas Instruments,02/21/2023,"Amid a CEO Change, Texas Instruments Needs to Do This",still open
Texas Instruments,02/21/2023,"Tale Of 2 Chip Stocks: Ahead Of Intel, Texas Instruments Earnings, Analysts Weigh In On Results, Q1 Outlo",still open
Texas Instruments,02/21/2023,3 Semiconductor Stocks To Watch In 2023,still open
Texas Instruments,02/21/2023,Validea Daily Guru Fundamental Report for TXN - 2/17/2023,still open
Texas Instruments,02/21/2023,Vanguard Group Increases Position in Texas Instruments (TXN),still open
Texas Instruments,02/21/2023,Texas Instruments Full Year 2022 Earnings: EPS Beats Expectations,still open
Texas Instruments,02/21/2023,"If You Invested $10,000 in TI Stock When Rich Templeton Became ...",still open
Texas Instruments,02/21/2023,Texas Instruments signals expanding pain for chipmakers with ...,still open
Texas Instruments,02/21/2023,BlackRock Increases Position in Texas Instruments (TXN),still open
Texas Instruments,02/21/2023,Metis Global Partners LLC raises its stake in Texas Instruments ...,still open
Texas Instruments,02/21/2023,STM or TXN: Which Is the Better Value Stock Right Now?,still open
Texas Instruments,02/21/2023,Nearing Retirement? These Stocks Are as Safe as They Come,still open
Texas Instruments,02/21/2023,Al Gore's 'eco-friendly' investment firm owns shares in polluting companies: report,still open
Texas Instruments,02/21/2023,Don't fall into the Intel dividend trap: These fund managers find the ...,still open
Texas Instruments,02/21/2023,2 Disruptive Technology Stocks That Can Thrive in 2023,still open
Texas Instruments,02/21/2023,Down but Not Out: Buy These Beaten-Down Dividend Stocks Before ...,still open
Texas Instruments,02/21/2023,Bullish on EVs and Renewable Energy? This Top Stock Is a Buy ...,still open
Texas Instruments,02/21/2023,Nasdaq closes slightly lower for a second day as earnings season rolls on,still open
Texas Instruments,02/21/2023,"Earnings Previews: ASML, Microsoft, Texas Instruments",still open
Texas Instruments,02/21/2023,Where Will Qualcomm Stock Be In 1 Year?,still open
Texas Instruments,02/21/2023,Why Texas Instruments is a Top 25 Dividend Giant (TXN),still open
Texas Instruments,02/21/2023,"Dow closes 400 points lower as hot inflation report, comments from Fed's Bullard raise rate hike fears: Live updates",still open
Texas Instruments,02/21/2023,"TE Connectivity Ltd. stock falls Friday, still outperforms market",still open
Texas Instruments,02/21/2023,What to Expect From Stocks in 2023,still open
Texas Instruments,02/21/2023,See Which Of The Latest 13F Filers Holds Texas Instruments,still open
Texas Instruments,02/21/2023,Did This Semiconductor Company Predict the Next Chip Bear Market?,still open
Texas Instruments,02/21/2023,"Texas Instruments selects Lehi, Utah, for its next 300-millimeter semiconductor wafer fab",still open
Texas Instruments,02/21/2023,Analog Devices Inc. stock outperforms competitors despite losses on the day,still open
Texas Instruments,02/21/2023,"Texas Instruments earnings beat by $0.02, revenue topped ...",still open
Texas Instruments,02/21/2023,Stock market news live updates: Stocks finish mixed as investors evaluate deluge of earnings,still open
Texas Instruments,02/21/2023,Texas Instruments (TXN) Tops Q4 Earnings and Revenue Estimates,still open
Texas Instruments,02/21/2023,Why Texas Instruments Stock Was Falling Earlier Today,still open
Texas Instruments,02/21/2023,Why Did Texas Instruments Stock Jump 12% in November?,still open
Texas Instruments,02/21/2023,Tech's Ferocious Rally Raises Bar for Earnings as Red Flags Wave,still open
Texas Instruments,02/21/2023,Intel leads chips lower as Morgan Stanley cuts PC estimates again ...,still open
Texas Instruments,02/21/2023,5 Best Stocks to Buy Now for Long-Term Investors,still open
Texas Instruments,02/21/2023,How The Trade Desk Could Boost A Lucrative Retirement (NASDAQ ...,still open
Texas Instruments,02/21/2023,Is Texas Instruments Stock a Buy Right Now?,still open
Texas Instruments,02/21/2023,Global Semiconductor Market Size & Share to Surpass $712.4 ...,still open
Texas Instruments,02/21/2023,7 Dividend Stocks to Buy for a Reliable Income Stream,still open
Texas Instruments,02/21/2023,What’s Behind Texas Instruments Stock’s Consistent Outperformance Of The Markets?,still open
Texas Instruments,02/21/2023,Texas Instruments Tops Q4 EPS by 2c By Investing.com,still open
Texas Instruments,02/21/2023,AI Stocks: The ACTUAL Winners and Losers from the AI Revolution,still open
Texas Instruments,02/21/2023,Texas Instruments Stock: Dividend Growth Winner Yields Over 3%,still open
Texas Instruments,02/21/2023,"NXP Semiconductor Stock Falls, but the 2023 Outlook for EVs and ...",still open
Texas Instruments,02/21/2023,"Power Management Integrated Circuit (PMIC) Market Size, Share ...",still open
Texas Instruments,02/21/2023,Why I Own Texas Instruments Stock,still open
Texas Instruments,02/21/2023,The 7 Most Undervalued Blue-Chip Stocks to Buy in February 2023,still open
Texas Instruments,02/21/2023,"Senator Markey Joins Senator Warren, Lawmakers in Calling on ...",still open
Texas Instruments,02/21/2023,Texas Instruments Stock: The Boom Cycle Is Still On (NASDAQ:TXN),still open
Texas Instruments,02/21/2023,Texas Instruments Stock: Analog Chips Are Sustainably Profitable ...,still open
Texas Instruments,02/21/2023,Semiconductor ETFs Shining Amid Mixed Numbers in Q4 Earnings,still open
Texas Instruments,02/21/2023,"Aircraft Engines Market Hits New High with Texas Instruments, FLIR ...",still open
Texas Instruments,02/21/2023,Here is What to Know Beyond Why Texas Instruments Incorporated (TXN) is a Trending Stock,still open
Texas Instruments,02/21/2023,TEXAS INSTRUMENTS INC : Results of Operations and Financial Condition (form 8-K),still open
Texas Instruments,02/21/2023,The 10 Best Stocks to Buy in February 2023,still open
Texas Instruments,02/21/2023,Texas Instruments signals expanding pain for chipmakers with ...,still open
Texas Instruments,02/21/2023,"Don't let the 'bear market house of mirrors' fool you, Morgan Stanley's Mike Wilson warns of the stock market",still open
Texas Instruments,02/21/2023,Texas Instruments Stock Up 1.7x On The Back Of Strong Sales Growth,still open
Texas Instruments,02/21/2023,"New Zealand Air Purifier Market Growth Prospects, Competitive ...",still open
Texas Instruments,02/21/2023,"Texas Instruments stock rises on earnings beat, outlook",still open
Texas Instruments,02/21/2023,Intel Disaster Spells Catastrophe for Most Chip Stocks,still open
Texas Instruments,02/21/2023,"Insiders at Texas Instruments Incorporated (NASDAQ:TXN) sold US$8.8m worth of stock, a potential red flag that needs to be monitored",still open
Texas Instruments,02/21/2023,"Texas Instruments (TXN): Safe And Increasing Dividend, But Risky ...",still open
Texas Instruments,02/21/2023,Variscite Launches New System on Module Powered by Texas ...,still open
Texas Instruments,02/21/2023,$100 Invested In This Stock 15 Years Ago Would Be Worth $600 Today - Texas Instruments (NASDAQ:TXN),still open
Texas Instruments,02/21/2023,Wireless Sensor Tags Market Biggest Innovation with Top Key ...,still open
Texas Instruments,02/21/2023,Strong Sales Growth Has Helped Texas Instruments Stock Outperform The S&P,still open
Texas Instruments,02/21/2023,"Heart Rate Sensor Market Size, Share, Growth Statistics By Top Key ...",still open
Texas Instruments,02/21/2023,"Hermetic Packaging Market Development Size 2023 |Schott, Ametek ...",still open
Texas Instruments,02/21/2023,"Stocks making the biggest moves after hours: Alphabet, Microsoft, Texas Instruments and more",still open
Texas Instruments,02/21/2023,1 Monster Opportunity Arises in the Global Chip Shortage,still open
Texas Instruments,02/21/2023,Stock Market,still open
Texas Instruments,02/21/2023,Where Will Broadcom Stock Be In 1 Year?,still open
Texas Instruments,02/21/2023,7 Retirement Stocks to Buy Now,still open
Texas Instruments,02/21/2023,Texas Instruments: Strong Fundamentals Make It A Buy,still open
Texas Instruments,02/21/2023,Display Controllers Market Overview 2023-2029| Key Players ...,still open
Texas Instruments,02/21/2023,Carvana landlord lists Lehi location for $7.7 million,still open
Texas Instruments,02/21/2023,Texas Instruments (NASDAQ:TXN) Is Reinvesting To Multiply In Value,still open
Texas Instruments,02/21/2023,Netflix founder Hastings steps down: Hedge funds and C-suites weekly,still open
Texas Instruments,02/21/2023,"Why Texas Instruments, Micron Technology, and Navitas ...",still open
Texas Instruments,02/22/2023,"As GlobalWafers, Texas Instruments go vertical, suppliers eye ...",still open
Texas Instruments,02/22/2023,Texas Instruments: A Buy For The Long-Term Dividend Investor ...,still open
Texas Instruments,02/22/2023,MEDIA RELEASE: Texas Instruments to build new chip factory in ...,still open
Texas Instruments,02/22/2023,Texas Instruments To Invest $11 Billion in New Utah Chipmaking Plant,still open
Texas Instruments,02/22/2023,Is Texas Instruments Stock a Better Buy Than Taiwan ...,still open
Texas Instruments,02/22/2023,Texas Instruments' Sales Drop for the First Time Since 2020,still open
Texas Instruments,02/22/2023,Better Dividend Growth Stock: Texas Instruments vs. Microchip ...,still open
Texas Instruments,02/22/2023,"Texas Instruments Stock: Promising Industry, Better Business Model",still open
Texas Instruments,02/22/2023,Better Semiconductor Stock: Texas Instruments vs. Broadcom,still open
Texas Instruments,02/22/2023,Comerica CEO Farmer elected board member of Texas Instruments ...,still open
Texas Instruments,02/22/2023,Texas Instruments names next CEO - Lake Highlands,still open
Texas Instruments,02/22/2023,"Stocks making the biggest moves after hours: Microsoft, Texas Instruments, Capital One & more",still open
Texas Instruments,02/22/2023,Texas Instruments Full Year 2022 Earnings: EPS Beats Expectations,still open
Texas Instruments,02/22/2023,Texas Instruments signals expanding pain for chipmakers with somber forecast,still open
Texas Instruments,02/22/2023,Variscite Launches New System on Module Powered by Texas ...,still open
Texas Instruments,02/22/2023,Vanguard Group Increases Position in Texas Instruments (TXN),still open
Texas Instruments,02/22/2023,BlackRock Increases Position in Texas Instruments (TXN),still open
Texas Instruments,02/22/2023,"Texas Instruments GAAP EPS of $2.13 beats by $0.15, revenue of ...",still open
Texas Instruments,02/22/2023,This Nasdaq 100 Stock Is a Genius Buy for Dividend Growth,still open
Texas Instruments,02/22/2023,Why Texas Instruments is a Top 25 Dividend Giant (TXN),still open
Texas Instruments,02/22/2023,Texas Instruments signals expanding pain for chipmakers with ...,still open
Texas Instruments,02/22/2023,Audio Interface ICs Market Size & Analysis By 2023 -2029 -Texas ...,still open
Texas Instruments,02/22/2023,Comerica CEO Curtis Farmer joins TI board of directors - Texas Instruments (NASDAQ:TXN),still open
Texas Instruments,02/22/2023,Texas Instruments (TXN) Tops Q4 Earnings and Revenue Estimates,still open
Texas Instruments,02/22/2023,ARM Microcontroller Market Still Has Room to Grow | Emerging ...,still open
Texas Instruments,02/22/2023,Teledyne e2v provides a highly-integrated radiation-tolerant DDR4 ...,still open
Texas Instruments,02/22/2023,Did This Semiconductor Company Predict the Next Chip Bear Market?,still open
Texas Instruments,02/22/2023,"Tanuja Singh joins Texas Instruments as Communications Director, India",still open
Texas Instruments,02/22/2023,"Aircraft Engines Market Hits New High with Texas Instruments, FLIR ...",still open
Texas Instruments,02/22/2023,Limiting Amplifier Market Biggest Innovation with Top Key Players ...,still open
Texas Instruments,02/22/2023,TEXAS INSTRUMENTS INC : Results of Operations and Financial Condition (form 8-K),still open
Texas Instruments,02/22/2023,UTEP to Offer New Bachelor of Science in Computer Engineering ...,still open
Texas Instruments,02/22/2023,Texas Instruments Tops Q4 EPS by 2c By Investing.com,still open
Texas Instruments,02/22/2023,Smartphone Audio Decoder Market Size & Analysis By 2023 -2029 ...,still open
Texas Instruments,02/22/2023,Global Graphing Calculator Market Report 2022 to 2030 - Featuring ...,still open
Texas Instruments,02/22/2023,Danny Kelley Obituary (1956 - 2023),still open
Texas Instruments,02/22/2023,Robotic Sensors Market Size And Forecast -FANUC Corporation ...,still open
Texas Instruments,02/22/2023,Latest medical technology resources include extensive content stream,still open
Texas Instruments,02/22/2023,Tactile Actuator Market Development Size 2023 |AAC Technologies ...,still open
Texas Instruments,02/22/2023,"Hermetic Packaging Market Development Size 2023 |Schott, Ametek ...",still open
Texas Instruments,02/22/2023,Optical Sensing Market 2023 key developmental strategies ...,still open
Texas Instruments,02/22/2023,Time-of-Flight Sensors for Automotive In-Cabin Market Size & ...,still open
Texas Instruments,02/22/2023,7 Dividend-Paying Tech Stocks for Long-Term Growth,still open
Texas Instruments,02/22/2023,Wifi Chipsets Market Giants Spending Is Going To Boom |Broadcom ...,still open
Texas Instruments,02/22/2023,3 Semiconductor Stocks To Watch In 2023,still open
Texas Instruments,02/22/2023,Sherman adopts updated zoning map on cusp of unprecedented ...,still open
Texas Instruments,02/22/2023,Global RF Components Market 2022 to 2031 - Major Players Include ...,still open
Texas Instruments,02/22/2023,Car Key Chips Market demand and future scope with Russia ...,still open
Texas Instruments,02/22/2023,Carvana landlord lists Lehi location for $7.7 million,still open
Texas Instruments,02/22/2023,Wireless Sensor Tags Market Biggest Innovation with Top Key ...,still open
Texas Instruments,02/22/2023,2 Disruptive Technology Stocks That Can Thrive in 2023,still open
Texas Instruments,02/22/2023,D-A Converter (DAC) Market demand and future scope with Russia ...,still open
Texas Instruments,02/22/2023,Integrated Passive Devices (IPD) Market Biggest Innovation with ...,still open
Texas Instruments,02/22/2023,"H-E-B, USAA make Forbes 'America's Best Employers' list",still open
Texas Instruments,02/22/2023,Semiconductor for Consumer Electronic Market Size & Analysis By ...,still open
Texas Instruments,02/22/2023,Analog IC Market Size and Forecast to 2029 -Texas Instruments ...,still open
Texas Instruments,02/22/2023,Texas businesses feel burn of higher taxes and seek legislative help,still open
Texas Instruments,02/22/2023,Radio Frequency Front-end Module Sales Market Statistical ...,still open
Texas Instruments,02/22/2023,"New projects in North Texas for February 21, 2023 - Dallas Business ...",still open
Texas Instruments,02/22/2023,Automotive Power Management IC Market Research Report 2023 ...,still open
Texas Instruments,02/22/2023,Memory Particles Market – A Comprehensive Study by Key Players ...,still open
Texas Instruments,02/22/2023,Display Controllers Market Overview 2023-2029| Key Players ...,still open
Texas Instruments,02/22/2023,Micropower Voltage References Market 2023 Segments Analysis by ...,still open
Texas Instruments,02/22/2023,Body Control Modules (BCM) Market is booming Globally with Top ...,still open
Texas Instruments,02/22/2023,Fluxgate Sensor Market demand and future scope with Russia ...,still open
Texas Instruments,02/22/2023,Bidirectional Converter Market to Witness Huge Growth by 2029 ...,still open
Texas Instruments,02/22/2023,"New Zealand Air Purifier Market Growth Prospects, Competitive ...",still open
Texas Instruments,02/22/2023,AC-DC Controllers Market to Witness Huge Growth by 2029 -ON ...,still open
Texas Instruments,02/22/2023,Digital Pattern Generator Market 2023 key developmental strategies ...,still open
Texas Instruments,02/22/2023,Bluetooth Modules Market Biggest Innovation with Top Key Players ...,still open
Texas Instruments,02/22/2023,Vector Signal Transceivers Market Booming Worldwide With ...,still open
Texas Instruments,02/22/2023,DMD Chip Market 2023 key developmental strategies implemented ...,still open
Texas Instruments,02/22/2023,Interaction Sensor Market Biggest Innovation with Top Key Players ...,still open
Texas Instruments,02/22/2023,Up-Down Converter and Mixer Circuits Market Size & Analysis By ...,still open
Texas Instruments,02/22/2023,Environmental Sensor Market Size 2023 Industry Recent ...,still open
Texas Instruments,02/22/2023,Fin Field Effect Transistor (FinFET) Market Upcoming Trends ...,still open
Texas Instruments,02/22/2023,USB Smart Card Token Market Size & Analysis By 2023 -2029 ...,still open
Texas Instruments,02/22/2023,Automotive Optoelectronics Market Size And Forecast -Avago ...,still open
Texas Instruments,02/22/2023,Low Voltage DC-DC LED Drivers Market is Expected to Reach US ...,still open
Texas Instruments,02/22/2023,Tablet and E-Reader Application Processors Market 2023 key ...,still open
Texas Instruments,02/22/2023,"Ultrasonic Occupancy Sensor Market Size, Development Data ...",still open
Texas Instruments,02/22/2023,Ultrasonic Parking Sensor Market Is Thriving Worldwide-TGS Group ...,still open
Texas Instruments,02/22/2023,"I2C Bus Market Upcoming Trends, Segmented by Type, Application ...",still open
Texas Instruments,02/22/2023,IoT Processors Market demand and future scope with Russia ...,still open
Texas Instruments,02/22/2023,"Shower Bases & Pans Market Development Size 2023 |AMS, Texas ...",still open
Texas Instruments,02/22/2023,Don't fall into the Intel dividend trap: These fund managers find the ...,still open
Texas Instruments,02/22/2023,"Thanks to Texas Instruments, the Microchip Revolution Started in ...",still open
Texas Instruments,02/22/2023,Texas Instruments micropchip plant now open in Utah,still open
Texas Instruments,02/22/2023,What’s Behind Texas Instruments Stock’s Consistent Outperformance Of The Markets?,still open
Texas Instruments,02/22/2023,Texas Instruments: Strong Fundamentals Make It A Buy,still open
Texas Instruments,02/22/2023,Is Texas Instruments Incorporated (NASDAQ:TXN) Potentially Undervalued?,still open
Texas Instruments,02/22/2023,Texas Instruments: Well-Placed To Navigate Semiconductor Sector,still open
Texas Instruments,02/22/2023,"Go inside Texas Instruments' newest fab, where chips powering the ...",still open
Texas Instruments,02/22/2023,Why Texas Instruments Stock Was Falling Earlier Today,still open
Texas Instruments,02/22/2023,Texas Instruments (NASDAQ:TXN) Is Reinvesting To Multiply In Value,still open
Texas Instruments,02/22/2023,Texas Instruments Is A Buy (NASDAQ:TXN),still open
Texas Instruments,02/22/2023,Texas Instruments Is Still Attractive Despite Bleak Projections,still open
Texas Instruments,02/22/2023,"Texas Instruments plans new, state-of the-art product distribution ...",still open
Texas Instruments,02/22/2023,"Texas Instruments Inc. stock falls Tuesday, underperforms market",still open
Texas Instruments,02/22/2023,Texas Instruments: A Buy For The Long-Term Dividend Investor ...,still open
