Name,Data,News,Evaluation
Wal-Mart Stores,02/05/2023,"‘Every time you scan something, it takes pictures of you’: Ex-Walmart employee says self-checkout cameras are ’10 times worse’ than in-store ones",still open
Wal-Mart Stores,02/05/2023,NC Walmart reopens after SUV crashed into front doors; employee stopped SUV after driver had seizure,still open
Wal-Mart Stores,02/05/2023,"Walmart Is Temporarily Closing More Stores, Effective Immediately",still open
Wal-Mart Stores,02/05/2023,"BATAVIA/Man with a gun reported at Walmart, store has been evacuated as police search for suspect",still open
Wal-Mart Stores,02/05/2023,‘Y’all need to chill grocery shopping’: Walmart worker complains about stockpiled 428 online orders after store closes for one day,still open
Wal-Mart Stores,02/05/2023,Police: Angry customer pulled out gun in Fort Wayne Walmart,still open
Wal-Mart Stores,02/05/2023,Walmart shoppers lash out over self-checkout fears after rumors of ‘hundreds of arrests’ & closures amid st...,still open
Wal-Mart Stores,02/05/2023,"Rising thefts at Walmart could lead to price jumps, store closures, CEO says",still open
Wal-Mart Stores,02/05/2023,Walmart Commerce Technologies and Salesforce Team Up To Unlock Local Fulfillment and Delivery Solutions for ...,still open
Wal-Mart Stores,02/05/2023,Bright lights and snazzy mannequins: Walmart rolls out sleek new store designs,still open
Wal-Mart Stores,02/05/2023,"Kroger Merger Is Good for You (and Maybe Bad for Walmart, Costco, and Amazon)",still open
Wal-Mart Stores,02/05/2023,Walmart Raises Starting Wages for Store Workers,still open
Wal-Mart Stores,02/05/2023,Walmart stores in 6 states no longer provide single-use bags at checkout: Which states are next?,still open
Wal-Mart Stores,02/05/2023,Walmart to sell hair care line by actress Tia Mowry,still open
Wal-Mart Stores,02/05/2023,Walmart-owned Sam's Club plans to open about 30 new stores over next five years,still open
Wal-Mart Stores,02/05/2023,Fact check: False claim Walmart stores nationwide are going bagless,still open
Wal-Mart Stores,02/05/2023,"ATF now investigating arsons at Target, Walmart stores",still open
Wal-Mart Stores,02/05/2023,Local Walmart and Dollar General stores among 52 fined for price scanning errors in NC,still open
Wal-Mart Stores,02/05/2023,Threat at Walmart Store in Rosemead Prompts Evacuation,still open
Wal-Mart Stores,02/05/2023,Walmart names Judy Werthauser chief people officer,still open
Wal-Mart Stores,02/05/2023,"Free Screenings and Affordable Immunizations: New Year, New ...",still open
Wal-Mart Stores,02/05/2023,Walmart Announces Launch of Walmart Business To Save Business ...,still open
Wal-Mart Stores,02/05/2023,Walmart to Move Retiring General Counsel's Duties to Legal Chief,still open
Wal-Mart Stores,02/05/2023,Innovative Go Mouthwash to Launch in 869 Walmart Stores This Month,still open
Wal-Mart Stores,02/05/2023,"Are Walmart, Target and grocery stores open in Fort Worth during ...",still open
Wal-Mart Stores,02/05/2023,"Armour, Kroger, Walmart store brands among canned meat recall on contamination threat",still open
Wal-Mart Stores,02/05/2023,Walmart Slammed for New Shopping Features in Stores and Online,still open
Wal-Mart Stores,02/05/2023,Why Walmart is eliminating single-use bags in some states but not others,still open
Wal-Mart Stores,02/05/2023,Pokémon Squishmallow officially out at Walmart,still open
Wal-Mart Stores,02/05/2023,Pokemon Pikachu and Gengar Squishmallows Spotted at Walmart ...,still open
Wal-Mart Stores,02/05/2023,8 Hacks To Save Money at Walmart,still open
Wal-Mart Stores,02/05/2023,Walmart Launches Newly Remodeled Supercenters With Focus On Innovation And Convenience,still open
Wal-Mart Stores,02/05/2023,"Sausage sold at Walmart, Meijer, others recalled over contamination ...",still open
Wal-Mart Stores,02/05/2023,Eureka Walmart employee thwarts theft | Police Fire | myleaderpaper ...,still open
Wal-Mart Stores,02/05/2023,Walmart launches dedicated e-commerce site for businesses,still open
Wal-Mart Stores,02/05/2023,$1 deposit on Walmart’s new coin-operated carts in 2023 is fully refundable,still open
Wal-Mart Stores,02/05/2023,This Major Retailer Could Pose a Threat to Walgreens and CVS ...,still open
Wal-Mart Stores,02/05/2023,BJ’s board member Judy Werthauser to become Walmart U.S. chief people officer,still open
Wal-Mart Stores,02/05/2023,Town of Kimball acquires former Walmart building in McDowell County,still open
Wal-Mart Stores,02/05/2023,Company: fire at Waukegan Walmart was intentionally set,still open
Wal-Mart Stores,02/05/2023,Riverton Walmart Has One Of The Highest Theft Rates in Nation ...,still open
Wal-Mart Stores,02/05/2023,Livonia police looking for women who attempted to steal over $1K ...,still open
Wal-Mart Stores,02/05/2023,Walmart Details Future of Grocery at CES: EXCLUSIVE,still open
Wal-Mart Stores,02/05/2023,Roseville Police investigate reported shooting between two vehicles near Walmart store,still open
Wal-Mart Stores,02/05/2023,"A Pharmacist Shortage Has Caused CVS, Walgreens And Walmart To Cut Pharmacy Hours—Here’s What We Know",still open
Wal-Mart Stores,02/05/2023,Lehigh Valley man twice drives 30 miles to make mess of aisles of ...,still open
Wal-Mart Stores,02/05/2023,"GoodSport, a Dairy-Based Sports Drink, Set to Hit 1000 Walmart ...",still open
Wal-Mart Stores,02/05/2023,Pink Sauce Is Hitting 4300 Walmart Stores With Help from Dallas ...,still open
Wal-Mart Stores,02/05/2023,I found a $44 baby item for just $13 on Walmart secret clearance – all you need is your phone to score s...,still open
Wal-Mart Stores,02/05/2023,Walmart Throws Shade at Amazon Fresh Over New Grocery ...,still open
Wal-Mart Stores,02/05/2023,"After Days Of Bare Shelves, H Street Walmart Is Slowly Restocking",still open
Wal-Mart Stores,02/05/2023,1 dead in shooting at K&J Beauty Supply: Police Chief,still open
Wal-Mart Stores,02/05/2023,Walmart Is Making These Major Changes in 2023,still open
Wal-Mart Stores,02/05/2023,"This Week in Apps: Temu’s hot streak, Walmart’s m-commerce & an Apple XR App Store",still open
Wal-Mart Stores,02/05/2023,"Magic Spoon scoops up Albertsons, Kroger, Walmart shelf space",still open
Wal-Mart Stores,02/05/2023,‘I know for sure we are in a recession now’: Walmart shopper shows store selling 2-pack sugar cookies,still open
Wal-Mart Stores,02/05/2023,Walmart Has Closed Multiple Stores for Recent Fires—And Some ...,still open
Wal-Mart Stores,02/05/2023,Full list of states where Walmart stores hit shoppers with a surcharge – see if you’re affected...,still open
Wal-Mart Stores,02/05/2023,"Shawano Walmart evacuated after fight with gun, knife",still open
Wal-Mart Stores,02/05/2023,3 Of The Best-Selling Armchairs At Walmart,still open
Wal-Mart Stores,02/05/2023,"CVS, Walmart sued over homeopathic products. What are they?",still open
Wal-Mart Stores,02/05/2023,Oh Goody! Pampers Release New Peppa Pig Prints on Limited ...,still open
Wal-Mart Stores,02/05/2023,The Supply Side: Workforce shortage top concern for retailers,still open
Wal-Mart Stores,02/05/2023,I found the viral bubble planters at Walmart for $8 – my secret hack to make them more versatile...,still open
Wal-Mart Stores,02/05/2023,Is Amazon or Walmart the Retail Industry’s Recessionary Winner?,still open
Wal-Mart Stores,02/05/2023,"A Texas chain is the nation’s top grocery store – how it beat Target, Walmart and Aldi...",still open
Wal-Mart Stores,02/05/2023,Evansville restaurant donating 10% of Thursday's proceeds to ...,still open
Wal-Mart Stores,02/05/2023,Walmart viral $8 top flies off the shelves as shoppers praise ‘super stretchy’ material – but there’s a cat...,still open
Wal-Mart Stores,02/05/2023,‘Ppl just aren’t going to bother shopping there anymore’: Walmart customer shows ‘barricaded’ cosmetics section,still open
Wal-Mart Stores,02/05/2023,"MLK Day 2023 store hours for Walmart, Target, CVS, Kohl’s, Macy’s, Home Depot, Lowe’s, Best Buy and more",still open
Wal-Mart Stores,02/05/2023,Walmart is shopping an unexpected product: its technology,still open
Wal-Mart Stores,02/05/2023,Man arrested after stealing Ruffles box truck from Walmart store in ...,still open
Wal-Mart Stores,02/05/2023,"‘First, they remove bags and now they refuse to let you leave after you pay?’: Walmart customer says employee ‘held him hostage,’ accused him of stealing",still open
Wal-Mart Stores,02/05/2023,Walmart Pregnancy Accommodation Win in EEOC Lawsuit Upheld (1),still open
Wal-Mart Stores,02/05/2023,Honoring Chesapeake,still open
Wal-Mart Stores,02/05/2023,Walmart and Netflix Premiere In-Store Expansion of Popular Netflix ...,still open
Wal-Mart Stores,02/05/2023,"NECA Launches AutoT at Walmart, an Exclusive New Digital ...",still open
Wal-Mart Stores,02/05/2023,Walmart's Healthcare Research Institute Launches With Mission To ...,still open
Wal-Mart Stores,02/05/2023,Local Wal-Mart stores honor community first responders on Patriot Day,still open
Wal-Mart Stores,02/05/2023,Walmart Jumps Into Roblox With Launch of Walmart Land and ...,still open
Wal-Mart Stores,02/05/2023,Supporting Hurricane Ian Relief,still open
Wal-Mart Stores,02/05/2023,Walmart+ Members Can Now Save More with Walmart Rewards,still open
Wal-Mart Stores,02/05/2023,Getaway and Walmart Announce New General Stores at Getaway ...,still open
Wal-Mart Stores,02/05/2023,Walmart Delivers New Benefit for Walmart+ Members: A ...,still open
Wal-Mart Stores,02/05/2023,Walmart Releases Q3 FY23 Earnings,still open
Wal-Mart Stores,02/05/2023,Walmart Health Grows in Florida with 16 New Health Centers ...,still open
Wal-Mart Stores,02/05/2023,Claire's is Coming to More Walmart Stores – WWD,still open
Wal-Mart Stores,02/05/2023,"Walmart drone delivery service launches in Arizona, Florida and Texas",still open
Wal-Mart Stores,02/05/2023,Walmart is Helping Customers Set the Table this Holiday Season ...,still open
Wal-Mart Stores,02/05/2023,Walmart Announces Nationwide Opioid Settlement Framework,still open
Wal-Mart Stores,02/05/2023,Walmart to lay off about 1500 workers at Atlanta fulfillment center,still open
Wal-Mart Stores,02/05/2023,"Walmart Black Friday in-store traffic tanks, according to estimate",still open
Wal-Mart Stores,02/05/2023,Walmart employees and customers blame self-checkout for theft,still open
Wal-Mart Stores,02/05/2023,Spark Good: A New Way To Give Back Just in Time for the Holidays,still open
Wal-Mart Stores,02/05/2023,Walmart Launches Drone Delivery From 11 Dallas-Area Stores,still open
Wal-Mart Stores,02/05/2023,Text to Shop: Walmart Customers Can Now Shop as Easily as Texting,still open
Wal-Mart Stores,02/05/2023,"Walmart Inc. stock falls Friday, underperforms market",still open
Wal-Mart Stores,02/05/2023,"Top Research Reports for Walmart, Alibaba & Salesforce",still open
Wal-Mart Stores,02/05/2023,Walmart Recession-Proofs Retail Reign With 3 Rare Moves,still open
Wal-Mart Stores,02/05/2023,Walmart raises minimum wage as retail labor market remains tight,still open
Wal-Mart Stores,02/05/2023,"UK's Bunzl signs new distribution deal with Walmart, shares jump",still open
Wal-Mart Stores,02/05/2023,Walmart-owned Sam's Club plans to open about 30 new stores over next five years,still open
Wal-Mart Stores,02/05/2023,Walmart viral $14 beauty item in stock for cheap – and shoppers are using it in an unusual way...,still open
Wal-Mart Stores,02/05/2023,Confluence Wealth Services Inc. Cuts Stock Position in Walmart Inc ...,still open
Wal-Mart Stores,02/05/2023,Bright lights and snazzy mannequins: Walmart rolls out sleek new store designs,still open
Wal-Mart Stores,02/05/2023,Pikachu and Gengar Squishmallows back in stock at Walmart,still open
Wal-Mart Stores,02/05/2023,Walmart is shopping an unexpected product: its technology,still open
Wal-Mart Stores,02/05/2023,Walmart removes ‘inappropriate’ boots from online marketplace: ‘Inconsistent with our values’,still open
Wal-Mart Stores,02/05/2023,This Major Retailer Could Pose a Threat to Walgreens and CVS ...,still open
Wal-Mart Stores,02/05/2023,Is Amazon or Walmart the Retail Industry’s Recessionary Winner?,still open
Wal-Mart Stores,02/05/2023,"NYSE stocks halted briefly: Mcdonald's, Walmart, AT&T, among others",still open
Wal-Mart Stores,02/05/2023,AMYRIS LAUNCHES 4U BY TIA™ HAIRCARE LINE EXCLUSIVELY ...,still open
Wal-Mart Stores,02/05/2023,"Walmart has Presidents Day deals on Apple, Eufy and Bose—shop ...",still open
Wal-Mart Stores,02/05/2023,Walmart just cut the price of Apple AirPods to their lowest price in 2023,still open
Wal-Mart Stores,02/05/2023,Why Walmart is eliminating single-use bags in some states but not others,still open
Wal-Mart Stores,02/05/2023,A first-hand look inside Walmart's robust security operations,still open
Wal-Mart Stores,02/05/2023,"Tattooed Chef: One More Hurdle To Entry Point, Wait For The ...",still open
Wal-Mart Stores,02/05/2023,Walmart is practically giving away this 4-piece bath towel set from The Pioneer Woman,still open
Wal-Mart Stores,02/05/2023,I work at Walmart – there’s a reason we don’t chase shoplifters and it’s not because we don’t see them...,still open
Wal-Mart Stores,02/05/2023,"A Pharmacist Shortage Has Caused CVS, Walgreens And Walmart To Cut Pharmacy Hours—Here’s What We Know",still open
Wal-Mart Stores,02/05/2023,Pokémon Squishmallow officially out at Walmart,still open
Wal-Mart Stores,02/05/2023,Huge Walmart update as major business deal promises big changes to convenient service used by hundreds of...,still open
Wal-Mart Stores,02/05/2023,News in brief,still open
Wal-Mart Stores,02/05/2023,Got $5000? 3 Stocks to Hold for the Next 20 Years,still open
Wal-Mart Stores,02/05/2023,PS5 scalper reportedly tries and fails to return consoles at Walmart,still open
Wal-Mart Stores,02/05/2023,"Short Interest in Wal-Mart de México, S.A.B. de C.V. (OTCMKTS ...",still open
Wal-Mart Stores,02/05/2023,Walmart Is Making These Major Changes in 2023,still open
Wal-Mart Stores,02/05/2023,Walmart just slashed the price on the Apple Watch 8. Get the top-rated smartwatch for only $349 now before the deal ends,still open
Wal-Mart Stores,02/05/2023,I found a home essential for $25 on Walmart hidden clearance – the sign in the store to look for to get it...,still open
Wal-Mart Stores,02/05/2023,The TikTok famous Laneige lip sleeping mask is only $14 at Walmart right now,still open
Wal-Mart Stores,02/05/2023,"5 things to know before the stock market opens Monday, Jan. 30",still open
Wal-Mart Stores,02/05/2023,Walmart flash deal: Save on this LG 4K smart TV before the big game,still open
Wal-Mart Stores,02/05/2023,‘Not paying a dollar for a broken wheel and strong pull to the left’: Customer claims Walmart will start charging $1 to use their carts,still open
Wal-Mart Stores,02/05/2023,"Wilmar International, Walmart among those exposed to Adani crash",still open
Wal-Mart Stores,02/05/2023,This Revolutionary Growth Stock Is Down 36% Since Its IPO. Here's ...,still open
Wal-Mart Stores,02/05/2023,Amazon and Walmart Take Different Paths to Same Small Businesses,still open
Wal-Mart Stores,02/05/2023,12 Safe Stocks to Buy For Long-Term,still open
Wal-Mart Stores,02/05/2023,WMT: Owning These 3 Stocks Could Make You Rich in 10 Years,still open
Wal-Mart Stores,02/05/2023,10 Ways the Dollar Store Could Actually Be Costing You More,still open
Wal-Mart Stores,02/05/2023,How to Find a PS5 and Xbox Series X In 2023,still open
Wal-Mart Stores,02/05/2023,Walmart is practically giving away this 18-piece The Pioneer Woman mixing bowl set at its New Year's sale,still open
Wal-Mart Stores,02/05/2023,Is Now the Right Time to Buy Walmart Stock?,still open
Wal-Mart Stores,02/05/2023,Video Review for Transformers Legacy Evolution Metalhawk,still open
Wal-Mart Stores,02/05/2023,"Great West Life Assurance Company of Canada buys 9,349 shares ...",still open
Wal-Mart Stores,02/05/2023,Walmart shares slump after retailer cuts profit outlook on inflation concerns,still open
Wal-Mart Stores,02/05/2023,Walmart Just Showed Why It's the Ultimate Recession-Proof Stock,still open
Wal-Mart Stores,02/05/2023,Walmart Vs. Amazon: The WMT Vs. AMZN Stock Showdown,still open
Wal-Mart Stores,02/05/2023,Sell Alert: 3 Dividend Stocks You Shouldn't Own In This Market,still open
Wal-Mart Stores,02/05/2023,Walmart Stock 2023 Forecast: What To Watch For (NYSE:WMT),still open
Wal-Mart Stores,02/05/2023,"Is Walmart Stock a Buy, Even After an Ugly Update?",still open
Wal-Mart Stores,02/05/2023,Opinion: CT should allow wine sales in grocery stores,still open
Wal-Mart Stores,02/05/2023,Target vs. Walmart Stock: Which Is the Better Bear Market Buy?,still open
Wal-Mart Stores,02/05/2023,Introducing Liza Landsman as Stash CEO,still open
Wal-Mart Stores,02/05/2023,"Rising thefts at Walmart could lead to price jumps, store closures, CEO says",still open
Wal-Mart Stores,02/05/2023,Better Buy: Walmart vs. Target,still open
Wal-Mart Stores,02/05/2023,Here's How Much Walmart's Inventory Situation Actually Improved ...,still open
Wal-Mart Stores,02/05/2023,Walmart Stock: A Bit Pricey (NYSE:WMT),still open
Wal-Mart Stores,02/05/2023,Is There Upside To Walmart’s Stock?,still open
Wal-Mart Stores,02/05/2023,"3 reasons to buy Walmart stock despite canned tuna trend, according to Goldman",still open
Wal-Mart Stores,02/05/2023,"If You Invested $1,000 In Walmart Stock At Its IPO, Here's How Much You'd Have Now - Walmart (NYSE:WMT)",still open
Wal-Mart Stores,02/05/2023,Target Vs. Walmart Stock: Which Is The Better Buy?,still open
Wal-Mart Stores,02/05/2023,"Walmart warning sends stock price plunging, renews retail worries",still open
Wal-Mart Stores,02/05/2023,Walmart Or Target: Which Is The Stronger Stock?,still open
Wal-Mart Stores,02/05/2023,Walmart is ‘positioned to win’ in the holiday shopping season: Analyst,still open
Wal-Mart Stores,02/05/2023,How To Buy Walmart (WMT) Stock – Forbes Advisor Canada,still open
Wal-Mart Stores,02/05/2023,Here's Why Walmart Could Trounce Amazon This Holiday Season,still open
Wal-Mart Stores,02/05/2023,Walmart and UnitedHealth Group Collaborate To Deliver Access to ...,still open
Wal-Mart Stores,02/05/2023,Walmart Stock May Offer Opportunity In The Current 'Unusual ...,still open
Wal-Mart Stores,02/05/2023,A Bull Market Is Coming: 1 Brilliant Growth Stock Down 51% to Buy ...,still open
Wal-Mart Stores,02/05/2023,"Dalmia Bharat Sugar declares 150% dividend, net profit surges 15% in Q3 | Mint",still open
Wal-Mart Stores,02/05/2023,"Walmart Doubles Down on Convenience, Value and Experience To ...",still open
Wal-Mart Stores,02/05/2023,Walmart enters the metaverse with Roblox experiences aimed at younger shoppers,still open
Wal-Mart Stores,02/05/2023,Where on the grocery store shelves Walmart CEO says inflation will remain stubborn,still open
Wal-Mart Stores,02/05/2023,"Walmart To Purchase 4,500 Canoo Electric Delivery Vehicles To Be ...",still open
Wal-Mart Stores,02/05/2023,Walmart Now Offers Over-the-Counter Hearing Aids To Help ...,still open
Wal-Mart Stores,02/05/2023,Honoring Chesapeake,still open
Wal-Mart Stores,02/05/2023,Walmart Canada sharpens out-of-stock intelligence,still open
Wal-Mart Stores,02/05/2023,Better Buy: Costco vs. Walmart,still open
Wal-Mart Stores,02/05/2023,"Walmart Shooting: Employee Sues Company, Saying She Warned of Gunman’s Behavior",still open
Wal-Mart Stores,02/05/2023,Who owns Walmart? It's not China. History and look at the biggest ...,still open
Wal-Mart Stores,02/05/2023,Walmart enters deal to buy remaining stake in S.Africa's Massmart,still open
Wal-Mart Stores,02/05/2023,"Target And Walmart Stocks Deserved to Fall, but Could Be Worth ...",still open
Wal-Mart Stores,02/05/2023,"Walmart, BNPL Were Black Friday's Big Winners",still open
Wal-Mart Stores,02/05/2023,"Walmart supervisor Andre Bing identified as gunman in deadly Chesapeake, Virginia, mass shooting",still open
Wal-Mart Stores,02/05/2023,Walmart Says Reducing Inventory Glut Will Take 'Couple Quarters',still open
Wal-Mart Stores,02/05/2023,Walmart is using its thousands of stores to battle Amazon for e-commerce market share,still open
Wal-Mart Stores,02/05/2023,Expanding Walmart's Market Fulfillment Center Capabilities Through ...,still open
Wal-Mart Stores,02/05/2023,"STOCK MARKET NEWS: Apple, Amazon, Starbucks report earnings ...",still open
Wal-Mart Stores,02/05/2023,Cost of living: Walmart issues profit warning as price rises hit,still open
Wal-Mart Stores,02/05/2023,A sign inflation could start easing: Walmart is slashing prices on clothing and other products,still open
Wal-Mart Stores,02/05/2023,Who needs another subscription service? Walmart is betting its millions of customers do,still open
Wal-Mart Stores,02/05/2023,"‘Every time you scan something, it takes pictures of you’: Ex-Walmart employee says self-checkout cameras are ’10 times worse’ than in-store ones",still open
Wal-Mart Stores,02/05/2023,NC Walmart reopens after SUV crashed into front doors; employee stopped SUV after driver had seizure,still open
Wal-Mart Stores,02/05/2023,"Walmart Is Temporarily Closing More Stores, Effective Immediately",still open
Wal-Mart Stores,02/05/2023,"BATAVIA/Man with a gun reported at Walmart, store has been evacuated as police search for suspect",still open
Wal-Mart Stores,02/05/2023,‘Y’all need to chill grocery shopping’: Walmart worker complains about stockpiled 428 online orders after store closes for one day,still open
Wal-Mart Stores,02/05/2023,Police: Angry customer pulled out gun in Fort Wayne Walmart,still open
Wal-Mart Stores,02/05/2023,Walmart shoppers lash out over self-checkout fears after rumors of ‘hundreds of arrests’ & closures amid st...,still open
Wal-Mart Stores,02/05/2023,"Rising thefts at Walmart could lead to price jumps, store closures, CEO says",still open
Wal-Mart Stores,02/05/2023,Walmart Commerce Technologies and Salesforce Team Up To Unlock Local Fulfillment and Delivery Solutions for ...,still open
Wal-Mart Stores,02/05/2023,Bright lights and snazzy mannequins: Walmart rolls out sleek new store designs,still open
Wal-Mart Stores,02/05/2023,"Kroger Merger Is Good for You (and Maybe Bad for Walmart, Costco, and Amazon)",still open
Wal-Mart Stores,02/05/2023,Walmart Raises Starting Wages for Store Workers,still open
Wal-Mart Stores,02/05/2023,Walmart stores in 6 states no longer provide single-use bags at checkout: Which states are next?,still open
Wal-Mart Stores,02/05/2023,Walmart to sell hair care line by actress Tia Mowry,still open
Wal-Mart Stores,02/05/2023,Walmart-owned Sam's Club plans to open about 30 new stores over next five years,still open
Wal-Mart Stores,02/05/2023,Fact check: False claim Walmart stores nationwide are going bagless,still open
Wal-Mart Stores,02/05/2023,"ATF now investigating arsons at Target, Walmart stores",still open
Wal-Mart Stores,02/05/2023,Local Walmart and Dollar General stores among 52 fined for price scanning errors in NC,still open
Wal-Mart Stores,02/05/2023,Threat at Walmart Store in Rosemead Prompts Evacuation,still open
Wal-Mart Stores,02/05/2023,Walmart names Judy Werthauser chief people officer,still open
Wal-Mart Stores,02/05/2023,"Free Screenings and Affordable Immunizations: New Year, New ...",still open
Wal-Mart Stores,02/05/2023,Walmart Announces Launch of Walmart Business To Save Business ...,still open
Wal-Mart Stores,02/05/2023,Walmart to Move Retiring General Counsel's Duties to Legal Chief,still open
Wal-Mart Stores,02/05/2023,Innovative Go Mouthwash to Launch in 869 Walmart Stores This Month,still open
Wal-Mart Stores,02/05/2023,"Are Walmart, Target and grocery stores open in Fort Worth during ...",still open
Wal-Mart Stores,02/05/2023,"Armour, Kroger, Walmart store brands among canned meat recall on contamination threat",still open
Wal-Mart Stores,02/05/2023,Walmart Slammed for New Shopping Features in Stores and Online,still open
Wal-Mart Stores,02/05/2023,Why Walmart is eliminating single-use bags in some states but not others,still open
Wal-Mart Stores,02/05/2023,Pokémon Squishmallow officially out at Walmart,still open
Wal-Mart Stores,02/05/2023,Pokemon Pikachu and Gengar Squishmallows Spotted at Walmart ...,still open
Wal-Mart Stores,02/05/2023,8 Hacks To Save Money at Walmart,still open
Wal-Mart Stores,02/05/2023,Walmart Launches Newly Remodeled Supercenters With Focus On Innovation And Convenience,still open
Wal-Mart Stores,02/05/2023,"Sausage sold at Walmart, Meijer, others recalled over contamination ...",still open
Wal-Mart Stores,02/05/2023,Eureka Walmart employee thwarts theft | Police Fire | myleaderpaper ...,still open
Wal-Mart Stores,02/05/2023,Walmart launches dedicated e-commerce site for businesses,still open
Wal-Mart Stores,02/05/2023,$1 deposit on Walmart’s new coin-operated carts in 2023 is fully refundable,still open
Wal-Mart Stores,02/05/2023,This Major Retailer Could Pose a Threat to Walgreens and CVS ...,still open
Wal-Mart Stores,02/05/2023,BJ’s board member Judy Werthauser to become Walmart U.S. chief people officer,still open
Wal-Mart Stores,02/05/2023,Town of Kimball acquires former Walmart building in McDowell County,still open
Wal-Mart Stores,02/05/2023,Company: fire at Waukegan Walmart was intentionally set,still open
Wal-Mart Stores,02/05/2023,Riverton Walmart Has One Of The Highest Theft Rates in Nation ...,still open
Wal-Mart Stores,02/05/2023,Livonia police looking for women who attempted to steal over $1K ...,still open
Wal-Mart Stores,02/05/2023,Walmart Details Future of Grocery at CES: EXCLUSIVE,still open
Wal-Mart Stores,02/05/2023,Roseville Police investigate reported shooting between two vehicles near Walmart store,still open
