Name,Data,News,Evaluation
Wal-Mart Stores,02/08/2023,Barclays Initiates Walmart at Overweight With $159 Price Target,still open
Wal-Mart Stores,02/08/2023,Barclays Initiates Coverage On Walmart with Overweight Rating ...,still open
Wal-Mart Stores,02/08/2023,"Walmart has Presidents Day deals on Samsung, Eufy and LG—shop ...",still open
Wal-Mart Stores,02/08/2023,Bomb Threats Received at Multiple Walmart Stores Throughout Mich.,still open
Wal-Mart Stores,02/08/2023,Why Walmart is eliminating single-use bags in some states but not others,still open
Wal-Mart Stores,02/08/2023,Walmart Distribution Center Hiring Event Tuesday,still open
Wal-Mart Stores,02/08/2023,El Paso massacre suspect expected to plead guilty to federal hate crimes,still open
Wal-Mart Stores,02/08/2023,"Best online clearance deals at Walmart in Feb. 2023: Save up to 65% on tech, home, kitchen and more",still open
Wal-Mart Stores,02/08/2023,"Tuesday’s Top Analyst Upgrades and Downgrades: ADM, Boeing, Dow, Netflix, Splunk, Spotify, T-Mobile, Walmart and More",still open
Wal-Mart Stores,02/08/2023,Markets - Feb. 7,still open
Wal-Mart Stores,02/08/2023,How to Find a PS5 and Xbox Series X In 2023,still open
Wal-Mart Stores,02/08/2023,Is Now the Right Time to Buy Walmart Stock?,still open
Wal-Mart Stores,02/08/2023,Walmart shares slump after retailer cuts profit outlook on inflation concerns,still open
Wal-Mart Stores,02/08/2023,Walmart Just Showed Why It's the Ultimate Recession-Proof Stock,still open
Wal-Mart Stores,02/08/2023,Stock Market Sell-Off: Is Walmart a Buy?,still open
Wal-Mart Stores,02/08/2023,Walmart Vs. Amazon: The WMT Vs. AMZN Stock Showdown,still open
Wal-Mart Stores,02/08/2023,Walmart Stock 2023 Forecast: What To Watch For (NYSE:WMT),still open
Wal-Mart Stores,02/08/2023,"Bedeviled eggs: Bird flu, inflation bump egg prices, strain supply",still open
Wal-Mart Stores,02/08/2023,"Is Walmart Stock a Buy, Even After an Ugly Update?",still open
Wal-Mart Stores,02/08/2023,Target vs. Walmart Stock: Which Is the Better Bear Market Buy?,still open
Wal-Mart Stores,02/08/2023,Better Buy: Walmart vs. Target,still open
Wal-Mart Stores,02/08/2023,"Rising thefts at Walmart could lead to price jumps, store closures, CEO says",still open
Wal-Mart Stores,02/08/2023,Here's How Much Walmart's Inventory Situation Actually Improved ...,still open
Wal-Mart Stores,02/08/2023,Walmart Stock: A Bit Pricey (NYSE:WMT),still open
Wal-Mart Stores,02/08/2023,Is There Upside To Walmart's Stock?,still open
Wal-Mart Stores,02/08/2023,"3 reasons why Walmart stock is a Buy, according to Goldman Sachs",still open
Wal-Mart Stores,02/08/2023,"If You Invested $1,000 In Walmart Stock At Its IPO, Here's How Much You'd Have Now - Walmart (NYSE:WMT)",still open
Wal-Mart Stores,02/08/2023,Target Vs. Walmart Stock: Which Is The Better Buy?,still open
Wal-Mart Stores,02/08/2023,"3 reasons to buy Walmart stock despite canned tuna trend, according to Goldman",still open
Wal-Mart Stores,02/08/2023,Walmart Or Target: Which Is The Stronger Stock?,still open
Wal-Mart Stores,02/08/2023,Better Buy: Costco vs. Walmart,still open
Wal-Mart Stores,02/08/2023,How To Buy Walmart (WMT) Stock – Forbes Advisor Canada,still open
Wal-Mart Stores,02/08/2023,Walmart Stock: High Valuation For No Growth & Low Yield (NYSE ...,still open
Wal-Mart Stores,02/08/2023,Here's Why Walmart Could Trounce Amazon This Holiday Season,still open
Wal-Mart Stores,02/08/2023,Walmart Stock May Offer Opportunity In The Current 'Unusual ...,still open
Wal-Mart Stores,02/08/2023,Walmart and UnitedHealth Group Collaborate To Deliver Access to ...,still open
Wal-Mart Stores,02/08/2023,Who owns Walmart? It's not China. History and look at the biggest ...,still open
Wal-Mart Stores,02/08/2023,"Walmart Doubles Down on Convenience, Value and Experience To ...",still open
Wal-Mart Stores,02/08/2023,Walmart enters the metaverse with Roblox experiences aimed at younger shoppers,still open
Wal-Mart Stores,02/08/2023,Where on the grocery store shelves Walmart CEO says inflation will remain stubborn,still open
Wal-Mart Stores,02/08/2023,Honoring Chesapeake,still open
Wal-Mart Stores,02/08/2023,Walmart Now Offers Over-the-Counter Hearing Aids To Help ...,still open
Wal-Mart Stores,02/08/2023,"Walmart To Purchase 4,500 Canoo Electric Delivery Vehicles To Be ...",still open
Wal-Mart Stores,02/08/2023,Walmart Vs. Target: Which Stock Is The Much Better Bear Market Buy,still open
Wal-Mart Stores,02/08/2023,Walmart Canada sharpens out-of-stock intelligence,still open
Wal-Mart Stores,02/08/2023,"Walmart Shooting: Employee Sues Company, Saying She Warned of Gunman’s Behavior",still open
Wal-Mart Stores,02/08/2023,"Walmart, BNPL Were Black Friday's Big Winners",still open
Wal-Mart Stores,02/08/2023,Walmart Says Reducing Inventory Glut Will Take 'Couple Quarters',still open
Wal-Mart Stores,02/08/2023,Walmart is using its thousands of stores to battle Amazon for e-commerce market share,still open
Wal-Mart Stores,02/08/2023,"Walmart supervisor Andre Bing identified as gunman in deadly Chesapeake, Virginia, mass shooting",still open
Wal-Mart Stores,02/08/2023,Inflation steers budget shoppers away from Walmart. Bringing them ...,still open
Wal-Mart Stores,02/08/2023,Walmart enters deal to buy remaining stake in S.Africa's Massmart,still open
Wal-Mart Stores,02/08/2023,Expanding Walmart's Market Fulfillment Center Capabilities Through ...,still open
Wal-Mart Stores,02/08/2023,Walmart's “Black Friday Deals for Days” Returns With More Savings ...,still open
Wal-Mart Stores,02/08/2023,Cost of living: Walmart issues profit warning as price rises hit,still open
Wal-Mart Stores,02/08/2023,"If Costco Is Such a Great Stock, Why Is Walmart Actually the Better ...",still open
Wal-Mart Stores,02/08/2023,Analysis | Target and Walmart Are Victims of Their Own Inventory ...,still open
Wal-Mart Stores,02/08/2023,A sign inflation could start easing: Walmart is slashing prices on clothing and other products,still open
Wal-Mart Stores,02/08/2023,Who needs another subscription service? Walmart is betting its millions of customers do,still open
Wal-Mart Stores,02/08/2023,"Zacks Earnings Trends Highlights: Target, Walmart and Lowe's",still open
Wal-Mart Stores,02/08/2023,Walmart overtakes Amazon in shoppers' search for Black Friday bargains,still open
Wal-Mart Stores,02/08/2023,Walmart+ and InHome Combine To Become the Ultimate Membership,still open
Wal-Mart Stores,02/08/2023,Walmart online shoppers to pay list price for product substitutions,still open
Wal-Mart Stores,02/08/2023,Walmart strikes exclusive streaming deal to give Paramount+ to Walmart+ subscribers,still open
Wal-Mart Stores,02/08/2023,Walmart Stock: Dead Money Walking?,still open
Wal-Mart Stores,02/08/2023,"The Walmart Museum Undergoes Renovation, Moves to Temporary ...",still open
Wal-Mart Stores,02/08/2023,Walmart Canada Rolls Out AI-Powered Out-of-Stock Detection to All ...,still open
Wal-Mart Stores,02/08/2023,Walmart+ Members Can Now Save More with Walmart Rewards,still open
Wal-Mart Stores,02/08/2023,"The lesson for Main Street from the Walmart, Target inventory failures",still open
Wal-Mart Stores,02/08/2023,Walmart Announces Acquisition of Volt Systems to Fortify Store ...,still open
Wal-Mart Stores,02/08/2023,Walmart expands its drone-delivery service to reach 4 million households,still open
Wal-Mart Stores,02/08/2023,Walmart to lay off about 1500 workers at Atlanta fulfillment center,still open
Wal-Mart Stores,02/08/2023,Walmart expands abortion coverage for its employees in the wake of Roe v Wade decision,still open
Wal-Mart Stores,02/08/2023,"Walmart, Target, Gap Excess Inventory Discounts, Sales",still open
Wal-Mart Stores,02/08/2023,How Walmart Automated Supplier Negotiations,still open
Wal-Mart Stores,02/10/2023,Walmart to close store on West Silver Spring Drive - Milwaukee Business Journal,still open
Wal-Mart Stores,02/10/2023,Walmart to close Albuquerque store in March,still open
Wal-Mart Stores,02/10/2023,Walmart closing 3 locations in Chicago suburbs,still open
Wal-Mart Stores,02/10/2023,Walmart near Highland High School to close next month,still open
Wal-Mart Stores,02/10/2023,"Silver Spring Drive Walmart in Milwaukee to close, alderman says it's 'terrible news'",still open
Wal-Mart Stores,02/10/2023,Homewood Walmart To Close Permanently,still open
Wal-Mart Stores,02/10/2023,"Walmart to close three suburban stores, including pickup-only prototype in Lincolnwood",still open
Wal-Mart Stores,02/10/2023,Plainfields Walmart To Close: Hasnt Performed As Well As We Hoped,still open
Wal-Mart Stores,02/10/2023,Walmart Creates New Look For Its Supercenters,still open
Wal-Mart Stores,02/10/2023,"Police respond to bomb threats at Walmarts in Canton, White Lake and Rochester Hills",still open
Wal-Mart Stores,02/10/2023,"Walmart Plans to Close 3 Chicago Area Stores, Including Pickup-Only Prototype",still open
Wal-Mart Stores,02/10/2023,Walmart to close some ‘underperforming’ stores in 3 states,still open
Wal-Mart Stores,02/10/2023,Walmart Announces Spate of Store Closings,still open
Wal-Mart Stores,02/10/2023,"Multiple Michigan Walmart stores receive bomb threats, may be ...",still open
Wal-Mart Stores,02/10/2023,"Bomb threats called into multiple Michigan Walmart stores, police say",still open
Wal-Mart Stores,02/10/2023,Iowa Court Clarifies 'Dark Stores' Precedent in Walmart Case,still open
Wal-Mart Stores,02/10/2023,Walmart Commerce Technologies and Salesforce Team Up To ...,still open
Wal-Mart Stores,02/10/2023,IDA grants tax break to Restaurant Depot store planned for former ...,still open
Wal-Mart Stores,02/10/2023,Fact check: False claim Walmart stores nationwide are going bagless,still open
Wal-Mart Stores,02/10/2023,Bright lights and snazzy mannequins: Walmart rolls out sleek new store designs,still open
Wal-Mart Stores,02/10/2023,Walmart stores in 6 states no longer provide single-use bags at checkout: Which states are next?,still open
Wal-Mart Stores,02/10/2023,Police: Woman arrested for attempting to kidnap child from Walmart,still open
Wal-Mart Stores,02/10/2023,Newly Remodeled Walmart Brings ‘Store of the Future’ to Harahan,still open
Wal-Mart Stores,02/10/2023,Texas Walmart massacre suspect pleads guilty to U.S. hate crimes,still open
Wal-Mart Stores,02/10/2023,Walmart Announces Launch of Walmart Business To Save Business ...,still open
Wal-Mart Stores,02/10/2023,Walmart raises minimum wage as retail labor market remains tight,still open
Wal-Mart Stores,02/10/2023,"Huntsville councilman Devyn Keith accused of shoplifting at Walmart 31 times, police report says",still open
Wal-Mart Stores,02/10/2023,"ATF now investigating arsons at Target, Walmart stores",still open
Wal-Mart Stores,02/10/2023,"Walmart to boost minimum wage, but some workers say it's not enough",still open
Wal-Mart Stores,02/10/2023,"BATAVIA/Man with a gun reported at Walmart, store has been ...",still open
Wal-Mart Stores,02/10/2023,Walmart-owned Sam's Club plans to open about 30 new stores over next five years,still open
Wal-Mart Stores,02/10/2023,Threat at Walmart Store in Rosemead Prompts Evacuation,still open
Wal-Mart Stores,02/10/2023,"Suspect in bus stop shooting outside Gentilly Walmart worked at the store, employee says",still open
Wal-Mart Stores,02/10/2023,EPD: Shooting reported at West Side Walmart,still open
Wal-Mart Stores,02/10/2023,Walmart edges out Amazon as most-preferred online grocer,still open
Wal-Mart Stores,02/10/2023,Why Walmart is eliminating single-use bags in some states but not others,still open
Wal-Mart Stores,02/10/2023,BEWARE: Card Skimmers Found At Multiple North Carolina Walmart ...,still open
Wal-Mart Stores,02/10/2023,Walmart Launches Newly Remodeled Supercenters With Focus On Innovation And Convenience,still open
Wal-Mart Stores,02/10/2023,Walmart to sell hair care line by actress Tia Mowry,still open
Wal-Mart Stores,02/10/2023,Future of Vine City Walmart uncertain after fire in December,still open
Wal-Mart Stores,02/10/2023,Walmart CEO Doug McMillon issues warning about ‘price pressures’ – and admits store is still trying to find...,still open
Wal-Mart Stores,02/10/2023,"With Walmart's New Associate-to-Driver Program, the Wheel Is ...",still open
Wal-Mart Stores,02/10/2023,"Walmart Is Closing Multiple Locations, Starting Feb. 17",still open
Wal-Mart Stores,02/10/2023,"GoodSport, a Dairy-Based Sports Drink, Set to Hit 1000 Walmart ...",still open
Wal-Mart Stores,02/10/2023,Pink Sauce Is Hitting 4300 Walmart Stores With Help from Dallas ...,still open
Wal-Mart Stores,02/10/2023,Walmart removes ‘inappropriate’ boots from online marketplace: ‘Inconsistent with our values’,still open
Wal-Mart Stores,02/10/2023,Roseville Police investigate reported shooting between two vehicles near Walmart store,still open
Wal-Mart Stores,02/10/2023,Walmart customer upset at long lines goes on jelly rampage at store in shocking new surveillance footage...,still open
Wal-Mart Stores,02/10/2023,"After Days Of Bare Shelves, H Street Walmart Is Slowly Restocking",still open
Wal-Mart Stores,02/10/2023,Free Health Screenings At Fremont Walmart Stores This Saturday,still open
Wal-Mart Stores,02/10/2023,U.S. prosecutors will not seek death penalty against accused Texas ...,still open
Wal-Mart Stores,02/10/2023,Inside Walmart’s store closures as it announces locations under threat following CEO’s warning of ‘price ri...,still open
Wal-Mart Stores,02/10/2023,Hempstead man arrested for committing multiple grand larcenies at ...,still open
Wal-Mart Stores,02/10/2023,I tried out the new Walmart test store – it is so much better and cheaper than Target with more unique p...,still open
Wal-Mart Stores,02/10/2023,Walmart is shopping an unexpected product: its technology,still open
Wal-Mart Stores,02/10/2023,Man arrested after stealing Ruffles box truck from Walmart store in ...,still open
Wal-Mart Stores,02/10/2023,Walmart Pregnancy Accommodation Win in EEOC Lawsuit Upheld (1),still open
Wal-Mart Stores,02/10/2023,Honoring Chesapeake,still open
Wal-Mart Stores,02/10/2023,Walmart and Netflix Premiere In-Store Expansion of Popular Netflix ...,still open
Wal-Mart Stores,02/10/2023,"Walmart raises outlook as groceries boost sales, inventory glut recedes",still open
Wal-Mart Stores,02/10/2023,Walmart's Healthcare Research Institute Launches With Mission To ...,still open
Wal-Mart Stores,02/10/2023,"NECA Launches AutoT at Walmart, an Exclusive New Digital ...",still open
Wal-Mart Stores,02/10/2023,"Rising thefts at Walmart could lead to price jumps, store closures, CEO says",still open
Wal-Mart Stores,02/10/2023,Local Wal-Mart stores honor community first responders on Patriot Day,still open
Wal-Mart Stores,02/10/2023,Walmart Delivers New Benefit for Walmart+ Members: A ...,still open
Wal-Mart Stores,02/10/2023,Supporting Hurricane Ian Relief,still open
Wal-Mart Stores,02/10/2023,Walmart Jumps Into Roblox With Launch of Walmart Land and ...,still open
Wal-Mart Stores,02/10/2023,Walmart+ Members Can Now Save More with Walmart Rewards,still open
Wal-Mart Stores,02/10/2023,POPABLE AND WALMART JOIN FORCES TO HELP SMALL ...,still open
Wal-Mart Stores,02/10/2023,Walmart Health Grows in Florida with 16 New Health Centers ...,still open
Wal-Mart Stores,02/10/2023,Getaway and Walmart Announce New General Stores at Getaway ...,still open
Wal-Mart Stores,02/10/2023,Walmart to lay off about 1500 workers at Atlanta fulfillment center,still open
Wal-Mart Stores,02/10/2023,Walmart Announces Nationwide Opioid Settlement Framework,still open
Wal-Mart Stores,02/10/2023,Claire's is Coming to More Walmart Stores – WWD,still open
Wal-Mart Stores,02/10/2023,Walmart is Helping Customers Set the Table this Holiday Season ...,still open
Wal-Mart Stores,02/10/2023,Walmart employees and customers blame self-checkout for theft,still open
Wal-Mart Stores,02/10/2023,"Walmart Black Friday in-store traffic tanks, according to estimate",still open
Wal-Mart Stores,02/10/2023,Text to Shop: Walmart Customers Can Now Shop as Easily as Texting,still open
Wal-Mart Stores,02/10/2023,Spark Good: A New Way To Give Back Just in Time for the Holidays,still open
Wal-Mart Stores,02/10/2023,Walmart Launches Drone Delivery From 11 Dallas-Area Stores,still open
Wal-Mart Stores,02/10/2023,Walmart Now Offers Over-the-Counter Hearing Aids To Help ...,still open
Wal-Mart Stores,02/10/2023,Kansas Walmart customers double taxed on food at Topeka grocery ...,still open
Wal-Mart Stores,02/10/2023,"Walmart to get rid of single-use plastic, paper bags in NY, Colorado",still open
Wal-Mart Stores,02/10/2023,"Walmart Doubles Down on Convenience, Value and Experience To ...",still open
Wal-Mart Stores,02/10/2023,Police explain why EBT card data was targeted at two local Walmart stores,still open
Wal-Mart Stores,02/10/2023,Walmart links credit card rewards to in-store discounts,still open
Wal-Mart Stores,02/10/2023,"Walmart supervisor Andre Bing identified as gunman in deadly Chesapeake, Virginia, mass shooting",still open
Wal-Mart Stores,02/10/2023,Drone package delivery takes flight at select Utah Walmart stores,still open
Wal-Mart Stores,02/10/2023,New York Walmart stores to stop selling paper bags in January 2023,still open
Wal-Mart Stores,02/10/2023,EEOC Sues Walmart for Disability Discrimination and Retaliation,still open
Wal-Mart Stores,02/10/2023,Walmart ups automation ante in acquiring Alert Innovation,still open
Wal-Mart Stores,02/10/2023,The Supply Side: Walmart seeks non-traditional holiday sales ...,still open
Wal-Mart Stores,02/10/2023,Complex phone scam uncovered at Fayette County Walmart stores,still open
Wal-Mart Stores,02/10/2023,Fact check: False claim Walmart is resuming 24-hour operations,still open
Wal-Mart Stores,02/10/2023,New Features Put AR Shopping Experiences Right in Customers ...,still open
Wal-Mart Stores,02/10/2023,Walmart remains closed after small fire Saturday night; teens doing ...,still open
Wal-Mart Stores,02/10/2023,EEOC Sues Walmart for Disability Discrimination | U.S. Equal ...,still open
Wal-Mart Stores,02/10/2023,Walmart Inc. stock outperforms competitors on strong trading day,still open
Wal-Mart Stores,02/10/2023,Barclays Initiates Coverage of Walmart (WMT) with Overweight ...,still open
Wal-Mart Stores,02/10/2023,Walmart started at Overweight at Barclays on defensive ...,still open
Wal-Mart Stores,02/10/2023,Walmart Inc. (WMT) Is a Trending Stock: Facts to Know Before ...,still open
Wal-Mart Stores,02/10/2023,Walmart Announces Launch of Walmart Business To Save Business ...,still open
Wal-Mart Stores,02/10/2023,The Highest-Rated Smart TVs On Sale At Walmart,still open
Wal-Mart Stores,02/10/2023,Will This Be the Next Battleground for Walmart and Amazon?,still open
Wal-Mart Stores,02/10/2023,‘Risk to reward ratio might be worth it’: Customer shares PSA about Walmart’s discounted steaks,still open
Wal-Mart Stores,02/10/2023,Walmart raises minimum wage as retail labor market remains tight,still open
Wal-Mart Stores,02/10/2023,"Top Research Reports for Walmart, Alibaba & Salesforce",still open
Wal-Mart Stores,02/10/2023,"Avoid eBay: PS5 is in stock at Walmart, Best Buy, and Amazon",still open
Wal-Mart Stores,02/10/2023,"Planting Hope Launches Full Product Assortment on Walmart.com, Expands Direct-to-Consumer and Wholesale Listings on Amazon.ca, Faire.com, PlantingHopeBrands.com",still open
Wal-Mart Stores,02/10/2023,"With Walmart's New Associate-to-Driver Program, the Wheel Is ...",still open
Wal-Mart Stores,02/10/2023,Walmart edges out Amazon as most-preferred online grocer,still open
Wal-Mart Stores,02/10/2023,"Walmart has Presidents Day deals on Samsung, Eufy and LG—shop ...",still open
Wal-Mart Stores,02/10/2023,Walmart is shopping an unexpected product: its technology,still open
Wal-Mart Stores,02/10/2023,Walmart removes ‘inappropriate’ boots from online marketplace: ‘Inconsistent with our values’,still open
Wal-Mart Stores,02/10/2023,Confluence Wealth Services Inc. Cuts Stock Position in Walmart Inc ...,still open
Wal-Mart Stores,02/10/2023,"UK's Bunzl signs new distribution deal with Walmart, shares jump",still open
Wal-Mart Stores,02/10/2023,"The Zacks Analyst Blog Highlights Walmart, Alibaba Group Holding ...",still open
Wal-Mart Stores,02/10/2023,Walmart's incessant drive for intel and innovation,still open
Wal-Mart Stores,02/10/2023,"NYSE stocks halted briefly: Mcdonald's, Walmart, AT&T, among others",still open
Wal-Mart Stores,02/10/2023,This Major Retailer Could Pose a Threat to Walgreens and CVS ...,still open
Wal-Mart Stores,02/10/2023,Sam Hunt's headed to “Walmart” for new song – KIK-FM 100.7,still open
Wal-Mart Stores,02/10/2023,WALMART : Raised to Buy by Barclays,still open
Wal-Mart Stores,02/10/2023,Pikachu And Gengar Squishmallows Back In Stock At Walmart,still open
Wal-Mart Stores,02/10/2023,Walmart wins lawsuit claiming its Fudge Mint cookies lack fudge and ...,still open
Wal-Mart Stores,02/10/2023,Why Walmart is eliminating single-use bags in some states but not others,still open
Wal-Mart Stores,02/10/2023,"El Paso Walmart Shooter, Who Killed 23 People in Racist Attack ...",still open
Wal-Mart Stores,02/10/2023,"Thursday’s Top Analyst Upgrades and Downgrades: American Airlines, American Express, Best Buy, Dollar General, Goldman Sachs, Royal Caribbean, Walmart and More",still open
Wal-Mart Stores,02/10/2023,Vanguard Group Increases Position in Brixmor Property Group (BRX),still open
Wal-Mart Stores,02/10/2023,"Best online clearance deals at Walmart in Feb. 2023: Save up to 65% on tech, home, kitchen and more",still open
Wal-Mart Stores,02/10/2023,The best Super Bowl OLED TV deal is this 65-inch Vizio for $998,still open
Wal-Mart Stores,02/10/2023,Walmart Distribution Center Hiring Event Tuesday,still open
Wal-Mart Stores,02/10/2023,Ex-Walmart worker reveals 'unethical' act company hates and sad part of job,still open
Wal-Mart Stores,02/10/2023,Bomb Threats Received at Multiple Walmart Stores Throughout Mich.,still open
Wal-Mart Stores,02/10/2023,Barclays Initiates Coverage On Walmart with Overweight Rating ...,still open
Wal-Mart Stores,02/10/2023,How SAP Helps SMEs — the next Walmarts and Porsches — Build ...,still open
Wal-Mart Stores,02/10/2023,When an eBay Order Arrives from Walmart: Cause for Concern,still open
Wal-Mart Stores,02/10/2023,Markets - Feb. 9,still open
Wal-Mart Stores,02/10/2023,"Oppenheimer Maintains Outperform on Walmart, Lowers Price ...",still open
Wal-Mart Stores,02/10/2023,Beat the Dow Jones With This Unstoppable Dividend Stock,still open
Wal-Mart Stores,02/10/2023,Splatoon 3-Themed Nintendo Switch OLED Is In Stock And Discounted,still open
Wal-Mart Stores,02/10/2023,How to Find a PS5 and Xbox Series X In 2023,still open
Wal-Mart Stores,02/10/2023,Is Now the Right Time to Buy Walmart Stock?,still open
Wal-Mart Stores,02/10/2023,"Sedalia Police Reports For February 8, 2023",still open
Wal-Mart Stores,02/10/2023,Walmart shares slump after retailer cuts profit outlook on inflation concerns,still open
Wal-Mart Stores,02/10/2023,Walmart Just Showed Why It's the Ultimate Recession-Proof Stock,still open
Wal-Mart Stores,02/10/2023,Stock Market Sell-Off: Is Walmart a Buy?,still open
Wal-Mart Stores,02/10/2023,Walmart Vs. Amazon: The WMT Vs. AMZN Stock Showdown,still open
Wal-Mart Stores,02/10/2023,Investment Opportunities In Latin America,still open
Wal-Mart Stores,02/10/2023,Walmart Stock 2023 Forecast: What To Watch For (NYSE:WMT),still open
Wal-Mart Stores,02/10/2023,"Is Walmart Stock a Buy, Even After an Ugly Update?",still open
Wal-Mart Stores,02/10/2023,"10 best last-minute Super Bowl deals to shop now—save on TVs, air ...",still open
Wal-Mart Stores,02/10/2023,Target vs. Walmart Stock: Which Is the Better Bear Market Buy?,still open
Wal-Mart Stores,02/10/2023,Paytm Shares Climb After Payments Giant Reports Narrower Loss,still open
Wal-Mart Stores,02/10/2023,Here's How Much Walmart's Inventory Situation Actually Improved ...,still open
Wal-Mart Stores,02/10/2023,"Rising thefts at Walmart could lead to price jumps, store closures, CEO says",still open
Wal-Mart Stores,02/10/2023,Better Buy: Walmart vs. Target,still open
Wal-Mart Stores,02/10/2023,Walmart Stock: A Bit Pricey (NYSE:WMT),still open
Wal-Mart Stores,02/10/2023,Is There Upside To Walmart's Stock?,still open
Wal-Mart Stores,02/10/2023,"3 reasons why Walmart stock is a Buy, according to Goldman Sachs",still open
Wal-Mart Stores,02/10/2023,"3 reasons to buy Walmart stock despite canned tuna trend, according to Goldman",still open
Wal-Mart Stores,02/10/2023,"If You Invested $1,000 In Walmart Stock At Its IPO, Here's How Much You'd Have Now - Walmart (NYSE:WMT)",still open
Wal-Mart Stores,02/10/2023,Target Vs. Walmart Stock: Which Is The Better Buy?,still open
Wal-Mart Stores,02/10/2023,Walmart Or Target: Which Is The Stronger Stock?,still open
Wal-Mart Stores,02/10/2023,Walmart is ‘positioned to win’ in the holiday shopping season: Analyst,still open
Wal-Mart Stores,02/10/2023,Better Buy: Costco vs. Walmart,still open
Wal-Mart Stores,02/10/2023,How To Buy Walmart (WMT) Stock – Forbes Advisor Canada,still open
Wal-Mart Stores,02/10/2023,Here's Why Walmart Could Trounce Amazon This Holiday Season,still open
Wal-Mart Stores,02/10/2023,"Walmart Doubles Down on Convenience, Value and Experience To ...",still open
Wal-Mart Stores,02/10/2023,Walmart and UnitedHealth Group Collaborate To Deliver Access to ...,still open
Wal-Mart Stores,02/10/2023,"Bedeviled eggs: Bird flu, inflation bump egg prices, strain supply",still open
Wal-Mart Stores,02/10/2023,Walmart Stock May Offer Opportunity In The Current 'Unusual ...,still open
Wal-Mart Stores,02/10/2023,Proposed Plastic Plant Meets Another Roadblock After Hearing ...,still open
