Name,Data,News,Evaluation
Wal-Mart Stores,02/19/2023,"Consumer trade down plays: Treehouse, Post, Walmart, Costco and ...",still open
Wal-Mart Stores,02/19/2023,"Walmart's Fourth-Quarter Comparable Sales May Top Views on Price Increases, RBC Says",still open
Wal-Mart Stores,02/19/2023,WMT: Recession Proof Your Portfolio in 2023 With These 3 Stocks,still open
Wal-Mart Stores,02/19/2023,I’m a chef – Six Walmart items all for under $10 that get you ‘monster portions’ – perfect for an ‘extreme...,still open
Wal-Mart Stores,02/19/2023,Warren Buffett is missing out on this year's market comeback,still open
Wal-Mart Stores,02/19/2023,SEC Adopts T+1 Settlement Cycle | Chief Investment Officer,still open
Wal-Mart Stores,02/19/2023,An 84-year-old Walmart greeter said he was fired for his age ...,still open
Wal-Mart Stores,02/19/2023,I found a $25 toy kitchen for only $10 on Walmart hidden clearance – the four secret ways to score the s...,still open
Wal-Mart Stores,02/19/2023,JRONY or WMMVY: Which Is the Better Value Stock Right Now?,still open
Wal-Mart Stores,02/19/2023,UPDATE 1-Indian digital payments firm PhonePe raises $100 mln at ...,still open
Wal-Mart Stores,02/19/2023,Is Now the Right Time to Buy Walmart Stock?,still open
Wal-Mart Stores,02/19/2023,Walmart shares slump after retailer cuts profit outlook on inflation concerns,still open
Wal-Mart Stores,02/19/2023,Walmart Just Showed Why It's the Ultimate Recession-Proof Stock,still open
Wal-Mart Stores,02/19/2023,Walmart Vs. Amazon: The WMT Vs. AMZN Stock Showdown,still open
Wal-Mart Stores,02/19/2023,Walmart Stock 2023 Forecast: What To Watch For (NYSE:WMT),still open
Wal-Mart Stores,02/19/2023,Walmart Stock: A Bit Pricey (NYSE:WMT),still open
Wal-Mart Stores,02/19/2023,"Is Walmart Stock a Buy, Even After an Ugly Update?",still open
Wal-Mart Stores,02/19/2023,Target vs. Walmart Stock: Which Is the Better Bear Market Buy?,still open
Wal-Mart Stores,02/19/2023,The 1 Thing Amazon Still Can't Get Right,still open
Wal-Mart Stores,02/19/2023,"Rising thefts at Walmart could lead to price jumps, store closures, CEO says",still open
Wal-Mart Stores,02/19/2023,Is There Upside To Walmart’s Stock?,still open
Wal-Mart Stores,02/19/2023,Walmart Announces Launch of Walmart Business To Save Business ...,still open
Wal-Mart Stores,02/19/2023,"Walmart Inc. stock falls Wednesday, underperforms market",still open
Wal-Mart Stores,02/19/2023,Better Buy: Costco vs. Walmart,still open
Wal-Mart Stores,02/19/2023,Here's How Much Walmart's Inventory Situation Actually Improved ...,still open
Wal-Mart Stores,02/19/2023,"3 reasons to buy Walmart stock despite canned tuna trend, according to Goldman",still open
Wal-Mart Stores,02/19/2023,Target Vs. Walmart Stock: Which Is The Better Buy?,still open
Wal-Mart Stores,02/19/2023,"3 reasons why Walmart stock is a Buy, according to Goldman Sachs",still open
Wal-Mart Stores,02/19/2023,Buy the Dips in Walmart Stock: Here's Why.,still open
Wal-Mart Stores,02/19/2023,Better Buy: Walmart vs. Target,still open
Wal-Mart Stores,02/19/2023,"If You Invested $1,000 In Walmart Stock At Its IPO, Here's How Much You'd Have Now - Walmart (NYSE:WMT)",still open
Wal-Mart Stores,02/19/2023,Walmart Or Target: Which Is The Stronger Stock?,still open
Wal-Mart Stores,02/19/2023,Walmart enters the metaverse with Roblox experiences aimed at younger shoppers,still open
Wal-Mart Stores,02/19/2023,Here's Why Walmart Could Trounce Amazon This Holiday Season,still open
Wal-Mart Stores,02/19/2023,Walmart is ‘positioned to win’ in the holiday shopping season: Analyst,still open
Wal-Mart Stores,02/19/2023,Walmart Stock May Offer Opportunity In The Current 'Unusual ...,still open
Wal-Mart Stores,02/19/2023,"Despite decades of mass shootings in Texas, legislators have failed ...",still open
Wal-Mart Stores,02/19/2023,How To Buy Walmart (WMT) Stock – Forbes Advisor Canada,still open
Wal-Mart Stores,02/19/2023,"Walmart Doubles Down on Convenience, Value and Experience To ...",still open
Wal-Mart Stores,02/19/2023,Walmart and UnitedHealth Group Collaborate To Deliver Access to ...,still open
Wal-Mart Stores,02/19/2023,Walmart Announces Nationwide Opioid Settlement Framework,still open
Wal-Mart Stores,02/19/2023,Who owns Walmart? It's not China. History and look at the biggest ...,still open
Wal-Mart Stores,02/19/2023,Honoring Chesapeake,still open
Wal-Mart Stores,02/19/2023,Walmart Now Offers Over-the-Counter Hearing Aids To Help ...,still open
Wal-Mart Stores,02/19/2023,"Deutsche names Walmart a top pick, sees more outperformance ...",still open
Wal-Mart Stores,02/19/2023,"Walmart To Purchase 4,500 Canoo Electric Delivery Vehicles To Be ...",still open
Wal-Mart Stores,02/19/2023,Where on the grocery store shelves Walmart CEO says inflation will remain stubborn,still open
Wal-Mart Stores,02/19/2023,Walmart Canada sharpens out-of-stock intelligence,still open
Wal-Mart Stores,02/19/2023,"Walmart, BNPL Were Black Friday's Big Winners",still open
Wal-Mart Stores,02/19/2023,Walmart+ Members Can Now Save More with Walmart Rewards,still open
Wal-Mart Stores,02/19/2023,Walmart is using its thousands of stores to battle Amazon for e-commerce market share,still open
Wal-Mart Stores,02/19/2023,"Walmart supervisor Andre Bing identified as gunman in deadly Chesapeake, Virginia, mass shooting",still open
Wal-Mart Stores,02/19/2023,Walmart overtakes Amazon in shoppers' search for Black Friday bargains,still open
Wal-Mart Stores,02/19/2023,"Walmart Shooting: Employee Sues Company, Saying She Warned of Gunman’s Behavior",still open
Wal-Mart Stores,02/19/2023,Walmart removes ‘inappropriate’ boots from online marketplace: ‘Inconsistent with our values’,still open
Wal-Mart Stores,02/19/2023,"With Walmart's New Associate-to-Driver Program, the Wheel Is ...",still open
Wal-Mart Stores,02/19/2023,Expanding Walmart's Market Fulfillment Center Capabilities Through ...,still open
Wal-Mart Stores,02/19/2023,Cost of living: Walmart issues profit warning as price rises hit,still open
Wal-Mart Stores,02/19/2023,Who needs another subscription service? Walmart is betting its millions of customers do,still open
Wal-Mart Stores,02/19/2023,Walmart enters deal to buy remaining stake in S.Africa's Massmart,still open
Wal-Mart Stores,02/19/2023,Walmart's “Black Friday Deals for Days” Returns With More Savings ...,still open
Wal-Mart Stores,02/19/2023,Walmart will now charge for order substitutions,still open
Wal-Mart Stores,02/19/2023,Inflation: Target and Walmart profits drop and stocks plunge after posting financial reports,still open
Wal-Mart Stores,02/19/2023,"Walmart demand is down, but America's warehouses are still filling up on inventory of goods",still open
Wal-Mart Stores,02/19/2023,"If Costco Is Such a Great Stock, Why Is Walmart Actually the Better ...",still open
Wal-Mart Stores,02/19/2023,"The lesson for Main Street from the Walmart, Target inventory failures",still open
Wal-Mart Stores,02/19/2023,Walmart strikes exclusive streaming deal to give Paramount+ to Walmart+ subscribers,still open
Wal-Mart Stores,02/19/2023,Walmart Canada Rolls Out AI-Powered Out-of-Stock Detection to All ...,still open
Wal-Mart Stores,02/19/2023,Walmart Announces Acquisition of Volt Systems to Fortify Store ...,still open
Wal-Mart Stores,02/21/2023,Walmart warns it's in for a tough year,still open
Wal-Mart Stores,02/21/2023,Walmart Warns That Shoppers Are Feeling Squeeze of Higher Prices,still open
Wal-Mart Stores,02/21/2023,Walmart keeps gaining high-income shoppers amid 'stubborn inflation' in the grocery aisle,still open
Wal-Mart Stores,02/21/2023,Walmart gives soft outlook for the year after posting strong holiday quarter,still open
Wal-Mart Stores,02/21/2023,"Walmart gets cautious on economic outlook, sees lower 2023 performance",still open
Wal-Mart Stores,02/21/2023,Walmart curbs losses despite company’s ‘cautious’ 2023 outlook,still open
Wal-Mart Stores,02/21/2023,Walmart beats Q4 expectations but is cautious on guidance,still open
Wal-Mart Stores,02/21/2023,"Walmart gets cautious on economic outlook, sees lower 2023 performance",still open
Wal-Mart Stores,02/21/2023,Walmart beats Q4 expectations but is cautious on guidance,still open
Wal-Mart Stores,02/21/2023,Walmart and Home Depot are getting ready for a consumer slowdown,still open
Wal-Mart Stores,02/21/2023,Is Walmart’s Loss Leading Egg-Scapade A Winner?,still open
Wal-Mart Stores,02/21/2023,New online superstore surpasses Amazon and Walmart to become most downloaded app in US,still open
Wal-Mart Stores,02/21/2023,"Walmart, Home Depot Give Cautious Outlook as Shoppers Spend ...",still open
Wal-Mart Stores,02/21/2023,"Walmart, Home Depot Fire Off Warnings on the American Consumer",still open
Wal-Mart Stores,02/21/2023,Coral Springs Police: Walmart Store Partially Evacuated After ...,still open
Wal-Mart Stores,02/21/2023,"Food Stamps: How Ending Enhanced SNAP Benefits Could Hurt Walmart, Dollar Stores",still open
Wal-Mart Stores,02/21/2023,"Walmart: Watch Your Back, Amazon - WSJ",still open
Wal-Mart Stores,02/21/2023,"Elderly woman brazenly robbed in Stockton Walmart, family pushing for arrest",still open
Wal-Mart Stores,02/21/2023,How Much Cashback Can You Get At Walmart? [2023],still open
Wal-Mart Stores,02/21/2023,Walmart is closing a batch of stores in 2023 — here's the full list,still open
Wal-Mart Stores,02/21/2023,Gas company called as emergency crews evacuate West Mifflin Walmart,still open
Wal-Mart Stores,02/21/2023,Walmart Announces Spate of Store Closings,still open
Wal-Mart Stores,02/21/2023,"Walmart Shares Rise on Solid Earnings, Dividend Increase",still open
Wal-Mart Stores,02/21/2023,"Acosta Announces Don Byrd, New EVP of In-Store Services for ...",still open
Wal-Mart Stores,02/21/2023,Bright lights and snazzy mannequins: Walmart rolls out sleek new store designs,still open
Wal-Mart Stores,02/21/2023,Walmart stores in 6 states no longer provide single-use bags at checkout: Which states are next?,still open
Wal-Mart Stores,02/21/2023,"Stores closing include Walmart, Macy's, and Bed Bath & Beyond in 2023",still open
Wal-Mart Stores,02/21/2023,Walmart Raises Starting Wages for Store Workers,still open
Wal-Mart Stores,02/21/2023,"ATF now investigating arsons at Target, Walmart stores",still open
Wal-Mart Stores,02/21/2023,"Police respond to bomb threats at Walmarts in Canton, White Lake ...",still open
Wal-Mart Stores,02/21/2023,Walmart Surprises Shoppers By Banning Single-Use Bags In Several States,still open
Wal-Mart Stores,02/21/2023,Man arrested for exposing himself in Cobb Walmart. Again.,still open
Wal-Mart Stores,02/21/2023,Walmart launches dedicated e-commerce site for businesses,still open
Wal-Mart Stores,02/21/2023,Walmart-owned Sam's Club plans to open about 30 new stores over next five years,still open
Wal-Mart Stores,02/21/2023,Twitter user shares GIF of Apple Pay working at Walmart in Canada,still open
Wal-Mart Stores,02/21/2023,‘I’ve done it for so many people’: Former Walmart worker shares hack to get items for cheaper in store,still open
Wal-Mart Stores,02/21/2023,Woman charged after fight breaks out at Walmart: Appomattox Sheriff,still open
Wal-Mart Stores,02/21/2023,Walmart beats Q4 expectations during holiday shopping period,still open
Wal-Mart Stores,02/21/2023,Threat at Walmart Store in Rosemead Prompts Evacuation,still open
Wal-Mart Stores,02/21/2023,"New online retail store dethrones Amazon and Walmart, becomes most downloaded US app: report",still open
Wal-Mart Stores,02/21/2023,"Walmart announces reopening of Vine City store, permanently closing Howell Mill location",still open
Wal-Mart Stores,02/21/2023,"Walmart in Mexico gross margin shrinks, quarterly profit up 12%",still open
Wal-Mart Stores,02/21/2023,"I found Walmart throws for $24.44, but hidden clearance had same item for $7 – ‘unmarked’ clue to look for...",still open
Wal-Mart Stores,02/21/2023,Is Walmart open on President’s Day 2023 and are there sales?,still open
Wal-Mart Stores,02/21/2023,"Walmart, Home Depot, Lowe's deter shoplifting with anti-theft measures",still open
Wal-Mart Stores,02/21/2023,"U.S. Attorney's Office Resolves ADA Complaint with WalMart, Inc.",still open
Wal-Mart Stores,02/21/2023,Best Presidents Day deals at Walmart you can still get,still open
Wal-Mart Stores,02/21/2023,Walmart Automation's team of virtual assistants offers sellers and dropshippers the opportunity to quickl,still open
Wal-Mart Stores,02/21/2023,"GoodSport, a Dairy-Based Sports Drink, Set to Hit 1000 Walmart ...",still open
Wal-Mart Stores,02/21/2023,Fact check: False claim of active shooter at Tennessee Walmart store,still open
Wal-Mart Stores,02/21/2023,"Walmart raises minimum wages, starting with March paychecks",still open
Wal-Mart Stores,02/21/2023,Texas Walmart massacre suspect pleads guilty to U.S. hate crimes,still open
Wal-Mart Stores,02/21/2023,"A Pharmacist Shortage Has Caused CVS, Walgreens And Walmart To Cut Pharmacy Hours—Here’s What We Know",still open
Wal-Mart Stores,02/21/2023,Full list of states where Walmart stores hit shoppers with a surcharge – see if you’re affected...,still open
Wal-Mart Stores,02/21/2023,"Fed minutes, PCE inflation, Walmart earnings: What to know this week",still open
Wal-Mart Stores,02/21/2023,Walmart assures state it’s working with pest control on bedbugs at Derby store,still open
Wal-Mart Stores,02/21/2023,"""No way in hell they charge for that"" - Walmart shopping carts reportedly set to be priced at $1, internet in disbelief",still open
Wal-Mart Stores,02/21/2023,"Walmart, Sam's Club in Scarborough closed due to roof concerns",still open
Wal-Mart Stores,02/21/2023,Walmart Commerce Technologies and Salesforce Team Up To ...,still open
Wal-Mart Stores,02/21/2023,Walmart to purchase e-grocery automated warehouse technology,still open
Wal-Mart Stores,02/21/2023,Walmart Pregnancy Accommodation Win in EEOC Lawsuit Upheld (1),still open
Wal-Mart Stores,02/21/2023,Fact check: False claim Walmart stores nationwide are going bagless,still open
Wal-Mart Stores,02/21/2023,"Walmart raises outlook as groceries boost sales, inventory glut recedes",still open
Wal-Mart Stores,02/21/2023,Walmart and Netflix Premiere In-Store Expansion of Popular Netflix ...,still open
Wal-Mart Stores,02/21/2023,Honoring Chesapeake,still open
Wal-Mart Stores,02/21/2023,"NECA Launches AutoT at Walmart, an Exclusive New Digital ...",still open
Wal-Mart Stores,02/21/2023,Walmart's Healthcare Research Institute Launches With Mission To ...,still open
Wal-Mart Stores,02/21/2023,"Rising thefts at Walmart could lead to price jumps, store closures, CEO says",still open
Wal-Mart Stores,02/21/2023,Walmart Jumps Into Roblox With Launch of Walmart Land and ...,still open
Wal-Mart Stores,02/21/2023,"Free Screenings and Affordable Immunizations: New Year, New ...",still open
Wal-Mart Stores,02/21/2023,Thanksgiving 2022: What stores are open and closed? Hours for ...,still open
Wal-Mart Stores,02/21/2023,Walmart Launches Drone Delivery From 11 Dallas-Area Stores,still open
Wal-Mart Stores,02/21/2023,Supporting Hurricane Ian Relief,still open
Wal-Mart Stores,02/21/2023,Walmart+ Members Can Now Save More with Walmart Rewards,still open
Wal-Mart Stores,02/21/2023,Walmart employees and customers blame self-checkout for theft,still open
Wal-Mart Stores,02/21/2023,Walmart is Helping Customers Set the Table this Holiday Season ...,still open
Wal-Mart Stores,02/21/2023,Local Wal-Mart stores honor community first responders on Patriot Day,still open
Wal-Mart Stores,02/21/2023,Walmart Delivers New Benefit for Walmart+ Members: A ...,still open
Wal-Mart Stores,02/21/2023,Walmart Announces Nationwide Opioid Settlement Framework,still open
Wal-Mart Stores,02/21/2023,POPABLE AND WALMART JOIN FORCES TO HELP SMALL ...,still open
Wal-Mart Stores,02/21/2023,Fact check: False claim Walmart is resuming 24-hour operations,still open
Wal-Mart Stores,02/21/2023,Getaway and Walmart Announce New General Stores at Getaway ...,still open
Wal-Mart Stores,02/21/2023,Claire's is Coming to More Walmart Stores – WWD,still open
Wal-Mart Stores,02/21/2023,Kansas Walmart customers double taxed on food at Topeka grocery ...,still open
Wal-Mart Stores,02/21/2023,"Walmart Black Friday in-store traffic tanks, according to estimate",still open
Wal-Mart Stores,02/21/2023,Walmart to lay off about 1500 workers at Atlanta fulfillment center,still open
Wal-Mart Stores,02/21/2023,Walmart Now Offers Over-the-Counter Hearing Aids To Help ...,still open
Wal-Mart Stores,02/21/2023,Text to Shop: Walmart Customers Can Now Shop as Easily as Texting,still open
Wal-Mart Stores,02/21/2023,Pokémon Squishmallow officially out at Walmart,still open
Wal-Mart Stores,02/21/2023,"Walmart Doubles Down on Convenience, Value and Experience To ...",still open
Wal-Mart Stores,02/21/2023,Police explain why EBT card data was targeted at two local Walmart stores,still open
Wal-Mart Stores,02/21/2023,"6 victims shot and killed in a Virginia Walmart include a 16-year-old boy, authorities say",still open
Wal-Mart Stores,02/21/2023,Walmart Drone Delivery by the Numbers,still open
Wal-Mart Stores,02/21/2023,Spark Good: A New Way To Give Back Just in Time for the Holidays,still open
Wal-Mart Stores,02/21/2023,"Walmart Stock Falls On Weak Guidance, May Hold 'Trade-Down ...",still open
Wal-Mart Stores,02/21/2023,"Walmart earnings report: Revenue exceeded expectations, stock is up",still open
Wal-Mart Stores,02/21/2023,"Walmart, Home Depot Give Cautious Outlook as Shoppers Spend ...",still open
Wal-Mart Stores,02/21/2023,Walmart and Home Depot are getting ready for a consumer slowdown,still open
Wal-Mart Stores,02/21/2023,"Stocks Lower, Week Ahead, Walmart, Meta, Microsoft - Five Things ...",still open
Wal-Mart Stores,02/21/2023,"Walmart Shares Rise on Solid Earnings, Dividend Increase",still open
Wal-Mart Stores,02/21/2023,Walmart Stock Falls Amid Tech Unit Shakeup Ahead Of Earnings,still open
Wal-Mart Stores,02/21/2023,"Walmart: Watch Your Back, Amazon - WSJ",still open
Wal-Mart Stores,02/21/2023,What Do Walmart's Q4 Results Mean? Bad News For The S&P 500,still open
Wal-Mart Stores,02/21/2023,"1 Stock to Buy, 1 Stock to Sell This Week: Walmart, Moderna",still open
Wal-Mart Stores,02/21/2023,Home Depot Stock Falls After Retailer Gives Cautious Outlook,still open
Wal-Mart Stores,02/21/2023,"Futures Fall On 2 Dow Giants; Tesla Deal, Demand In Focus",still open
Wal-Mart Stores,02/21/2023,Walmart Stock Slumps As Retailer Echoes Consumer Spending ...,still open
Wal-Mart Stores,02/21/2023,"Thinking about trading options or stock in Walmart, Tesla, Home Depot, Microsoft, or Lockheed Martin? - L",still open
Wal-Mart Stores,02/21/2023,"Putin speech, Walmart earnings, Europe rebound - what's moving ...",still open
Wal-Mart Stores,02/21/2023,This best-selling KitchenAid mixer dupe is on sale now at Walmart,still open
Wal-Mart Stores,02/21/2023,Bright lights and snazzy mannequins: Walmart rolls out sleek new store designs,still open
Wal-Mart Stores,02/21/2023,Continuing to Strengthen Our Jobs and Invest in Our People,still open
Wal-Mart Stores,02/21/2023,"Look Out, Bezos Backers — Jim Cramer Plans To Target 'The ...",still open
Wal-Mart Stores,02/21/2023,Walmart falls after setting cautious profit guidance; Costco and ...,still open
Wal-Mart Stores,02/21/2023,5 things to know before the stock market opens Tuesday,still open
Wal-Mart Stores,02/21/2023,Walmart-owned Sam's Club plans to open about 30 new stores over next five years,still open
Wal-Mart Stores,02/21/2023,Twitter user shares GIF of Apple Pay working at Walmart in Canada,still open
Wal-Mart Stores,02/21/2023,Royal London Asset Management Ltd. Sells 13618 Shares of ...,still open
Wal-Mart Stores,02/21/2023,"Wal-Mart de México, S.A.B. de C.V.'s (BMV:WALMEX) top owners are public companies with 71% stake, while 18% is held by individual investors",still open
Wal-Mart Stores,02/21/2023,"Best online clearance deals at Walmart in Feb. 2023: Save up to 65% on tech, home and more",still open
Wal-Mart Stores,02/21/2023,Is Now the Right Time to Buy Walmart Stock?,still open
Wal-Mart Stores,02/21/2023,Walmart shares slump after retailer cuts profit outlook on inflation concerns,still open
Wal-Mart Stores,02/21/2023,Walmart Just Showed Why It's the Ultimate Recession-Proof Stock,still open
Wal-Mart Stores,02/21/2023,Walmart Vs. Amazon: The WMT Vs. AMZN Stock Showdown,still open
Wal-Mart Stores,02/21/2023,Walmart Stock 2023 Forecast: What To Watch For (NYSE:WMT),still open
Wal-Mart Stores,02/21/2023,Walmart Stock: A Bit Pricey (NYSE:WMT),still open
Wal-Mart Stores,02/21/2023,Target vs. Walmart Stock: Which Is the Better Bear Market Buy?,still open
Wal-Mart Stores,02/21/2023,Walmart Announces Launch of Walmart Business To Save Business ...,still open
Wal-Mart Stores,02/21/2023,"Rising thefts at Walmart could lead to price jumps, store closures, CEO says",still open
Wal-Mart Stores,02/21/2023,Is There Upside To Walmart’s Stock?,still open
Wal-Mart Stores,02/21/2023,Better Buy: Costco vs. Walmart,still open
Wal-Mart Stores,02/21/2023,"3 reasons to buy Walmart stock despite canned tuna trend, according to Goldman",still open
Wal-Mart Stores,02/21/2023,Here's How Much Walmart's Inventory Situation Actually Improved ...,still open
Wal-Mart Stores,02/21/2023,"Walmart warning sends stock price plunging, renews retail worries",still open
Wal-Mart Stores,02/21/2023,Target Vs. Walmart Stock: Which Is The Better Buy?,still open
Wal-Mart Stores,02/21/2023,Better Buy: Walmart vs. Target,still open
Wal-Mart Stores,02/21/2023,"If You Invested $1,000 In Walmart Stock At Its IPO, Here's How Much You'd Have Now - Walmart (NYSE:WMT)",still open
Wal-Mart Stores,02/21/2023,"Is Walmart Stock a Buy, Even After an Ugly Update?",still open
Wal-Mart Stores,02/21/2023,Walmart Or Target: Which Is The Stronger Stock?,still open
Wal-Mart Stores,02/21/2023,Walmart Stock May Offer Opportunity In The Current 'Unusual ...,still open
Wal-Mart Stores,02/21/2023,Walmart enters the metaverse with Roblox experiences aimed at younger shoppers,still open
Wal-Mart Stores,02/21/2023,Earnings Preview: What To Expect From WalMart On Tuesday,still open
Wal-Mart Stores,02/21/2023,How To Buy Walmart (WMT) Stock – Forbes Advisor Canada,still open
Wal-Mart Stores,02/21/2023,"Walmart Doubles Down on Convenience, Value and Experience To ...",still open
Wal-Mart Stores,02/21/2023,Walmart and UnitedHealth Group Collaborate To Deliver Access to ...,still open
Wal-Mart Stores,02/21/2023,Walmart Now Offers Over-the-Counter Hearing Aids To Help ...,still open
Wal-Mart Stores,02/21/2023,Honoring Chesapeake,still open
Wal-Mart Stores,02/21/2023,Who owns Walmart? It's not China. History and look at the biggest ...,still open
Wal-Mart Stores,02/21/2023,Here's Why Walmart Could Trounce Amazon This Holiday Season,still open
Wal-Mart Stores,02/21/2023,"Walmart To Purchase 4,500 Canoo Electric Delivery Vehicles To Be ...",still open
Wal-Mart Stores,02/21/2023,"Walmart, BNPL Were Black Friday's Big Winners",still open
Wal-Mart Stores,02/21/2023,Wall Street’s top analysts say these are their favorite stocks right now,still open
Wal-Mart Stores,02/21/2023,Walmart+ Members Can Now Save More with Walmart Rewards,still open
Wal-Mart Stores,02/21/2023,Walmart is using its thousands of stores to battle Amazon for e-commerce market share,still open
Wal-Mart Stores,02/21/2023,"Walmart supervisor Andre Bing identified as gunman in deadly Chesapeake, Virginia, mass shooting",still open
Wal-Mart Stores,02/21/2023,"Walmart Shooting: Employee Sues Company, Saying She Warned of Gunman’s Behavior",still open
Wal-Mart Stores,02/21/2023,"With Walmart's New Associate-to-Driver Program, the Wheel Is ...",still open
Wal-Mart Stores,02/21/2023,Walmart removes ‘inappropriate’ boots from online marketplace: ‘Inconsistent with our values’,still open
Wal-Mart Stores,02/21/2023,Cost of living: Walmart issues profit warning as price rises hit,still open
Wal-Mart Stores,02/21/2023,Walmart Canada sharpens out-of-stock intelligence,still open
Wal-Mart Stores,02/21/2023,Who needs another subscription service? Walmart is betting its millions of customers do,still open
Wal-Mart Stores,02/21/2023,Expanding Walmart's Market Fulfillment Center Capabilities Through ...,still open
Wal-Mart Stores,02/21/2023,Walmart's “Black Friday Deals for Days” Returns With More Savings ...,still open
Wal-Mart Stores,02/21/2023,Walmart enters deal to buy remaining stake in S.Africa's Massmart,still open
Wal-Mart Stores,02/21/2023,Inflation: Target and Walmart profits drop and stocks plunge after posting financial reports,still open
Wal-Mart Stores,02/21/2023,"Walmart demand is down, but America's warehouses are still filling up on inventory of goods",still open
Wal-Mart Stores,02/21/2023,"If Costco Is Such a Great Stock, Why Is Walmart Actually the Better ...",still open
Wal-Mart Stores,02/21/2023,Walmart will now charge for order substitutions,still open
Wal-Mart Stores,02/21/2023,"The lesson for Main Street from the Walmart, Target inventory failures",still open
Wal-Mart Stores,02/21/2023,Walmart strikes exclusive streaming deal to give Paramount+ to Walmart+ subscribers,still open
Wal-Mart Stores,02/21/2023,Inflation steers budget shoppers away from Walmart. Bringing them ...,still open
Wal-Mart Stores,02/21/2023,Walmart Announces Acquisition of Volt Systems to Fortify Store ...,still open
Wal-Mart Stores,02/21/2023,Walmart Stock: High Valuation For No Growth & Low Yield (NYSE ...,still open
Wal-Mart Stores,02/21/2023,Walmart is shopping an unexpected product: its technology,still open
Wal-Mart Stores,02/21/2023,Walmart Says Reducing Inventory Glut Will Take 'Couple Quarters',still open
